A1: Last Name | B1: Class | C1: Stage 1 | D1: Stage 2 | E1: Stage 3 | F1: Stage 4 | G1: Stage 5 | H1: Total
A2: Old Man Sykes | B2: D | C2: 73.49 | D2: 71.09 | E2: 69.75 | F2: 97.46 | G2: 69.95 | H2: =SUM(C2:G2) -> 381.74
A3: Cantankerous | B3: D | C3: 72.59 | D3: 88.4 | E3: 79.16 | F3: 85.84 | G3: 57.97 | H3: =SUM(C3:G3) -> 383.96
A4: Possom Creek Bill | B4: D | C4: 79.73 | D4: 73.32 | E4: 81.55 | F4: 90.84 | G4: 72.13 | H4: =SUM(C4:G4) -> 397.57
A5: J.D. Hardrider | B5: D | C5: 89.46 | D5: 91 | E5: 79.16 | F5: 92.66 | G5: 61.38 | H5: =SUM(C5:G5) -> 413.66
A6: Dupo Kid | B6: D | C6: 110.35 | D6: 94.25 | E6: 78.07 | F6: 71.65 | G6: 68.46 | H6: =SUM(C6:G6) -> 422.78
A7: Bounty Seeker | B7: D | C7: 106.41 | D7: 75.19 | E7: 81.48 | F7: 88.08 | G7: 81.9 | H7: =SUM(C7:G7) -> 433.06
A8: three Rivers | B8: D | C8: 100.21 | D8: 90.42 | E8: 90.2 | F8: 91.09 | G8: 69.82 | H8: =SUM(C8:G8) -> 441.74
A9: Railroad bill | B9: D | C9: 111.23 | D9: 80.82 | E9: 84.45 | F9: 91.16 | G9: 78.57 | H9: =SUM(C9:G9) -> 446.23
A10: West Longer | B10: D | C10: 123.77 | D10: 90.68 | E10: 87.78 | F10: 92.13 | G10: 72.55 | H10: =SUM(C10:G10) -> 466.91
A11: Insure Waylae | B11: D | C11: 119.29 | D11: 84.25 | E11: 111.18 | F11: 96.55 | G11: 73.15 | H11: =SUM(C11:G11) -> 484.42
A12: Closenuf Joe | B12: D | C12: 121.8 | D12: 107.49 | E12: 96.29 | F12: 95.05 | G12: 96.94 | H12: =SUM(C12:G12) -> 517.57
A13: Topkick Kalispel | B13: D | C13: 132.91 | D13: 98.8 | E13: 100.27 | F13: 94.04 | G13: 94.22 | H13: =SUM(C13:G13) -> 520.24
A14: Crowfoot | B14: D | C14: 129.66 | D14: 177.89 | E14: 85.72 | F14: 130 | G14: 84.32 | H14: =SUM(C14:G14) -> 607.59
A15: Coffin Sam | B15: D | C15: 165.32 | D15: 123.82 | E15: 147.42 | F15: 123.42 | G15: 98.76 | H15: =SUM(C15:G15) -> 658.74
A16: Ranger Martin Ruger | B16: M | C16: 109.31 | D16: 62.29 | E16: 67.33 | F16: 57.55 | G16: 61.25 | H16: =SUM(C16:G16) -> 357.73
A17: Twlight Tom | B17: M | C17: 74.76 | D17: 71.72 | E17: 75.4 | F17: 77.3 | G17: 60.39 | H17: =SUM(C17:G17) -> 359.57
A18: Jack Blackhawk | B18: M | C18: 138.1 | D18: 97.81 | E18: 86.99 | F18: 115.41 | G18: 78.06 | H18: =SUM(C18:G18) -> 516.37
A19: Squire Lawrence | B19: M/S | C19: 109.41 | D19: 88.11 | E19: 8.17 | F19: 79.05 | G19: 76.59 | H19: =SUM(C19:G19) -> 361.33
A20: Doc Barker | B20: M/S | C20: 121.01 | D20: 103.23 | E20: 89.84 | F20: 107.12 | G20: 94.2 | H20: =SUM(C20:G20) -> 515.4
A21: Dirty "D" | B21: M/S | C21: 134.53 | D21: 115.39 | E21: 142.05 | F21: 85.2 | G21: 112.74 | H21: =SUM(C21:G21) -> 589.91
A22: Billy The Kidder | B22: T | C22: 48.57 | D22: 51.69 | E22: 48.82 | F22: 57.47 | G22: 43.19 | H22: =SUM(C22:G22) -> 249.74
A23: Flat Land Phil | B23: T | C23: 64.06 | D23: 56.77 | E23: 60.32 | F23: 60.07 | G23: 53.63 | H23: =SUM(C23:G23) -> 294.85
A24: Bushy Cap | B24: T | C24: 71.95 | D24: 62.14 | E24: 73.12 | F24: 80.8 | G24: 61.32 | H24: =SUM(C24:G24) -> 349.33
A25: Yuma Tom | B25: T | C25: 88.36 | D25: 71.98 | E25: 70.97 | F25: 84.61 | G25: 64.49 | H25: =SUM(C25:G25) -> 380.41
A26: Cart Ridge | B26: T | C26: 73.16 | D26: 72.04 | E26: 87.65 | F26: 84.28 | G26: 64.86 | H26: =SUM(C26:G26) -> 381.99
A27: CC Morgan | B27: T | C27: 95.17 | D27: 71.56 | E27: 87.25 | F27: 73.97 | G27: 54.27 | H27: =SUM(C27:G27) -> 382.22
A28: Deadly "D" | B28: T | C28: 89.34 | D28: 75.7 | E28: 82.22 | F28: 66.04 | G28: 71.01 | H28: =SUM(C28:G28) -> 384.31
A29: Missouri Bull | B29: T | C29: 96.24 | D29: 75.96 | E29: 76.16 | F29: 85.64 | G29: 56.1 | H29: =SUM(C29:G29) -> 390.1
A30: Trapper | B30: T | C30: 113.03 | D30: 61.56 | E30: 85.23 | F30: 64.99 | G30: 66.95 | H30: =SUM(C30:G30) -> 391.76
A31: Bullshooter Bob | B31: T | C31: 106.14 | D31: 73.7 | E31: 85.31 | F31: 71.6 | G31: 63.41 | H31: =SUM(C31:G31) -> 400.16
A32: Missouri Buck | B32: T | C32: 119.99 | D32: 78.23 | E32: 72.19 | F32: 83.47 | G32: 65.31 | H32: =SUM(C32:G32) -> 419.19
A33: Kid Klondike | B33: T | C33: 116.21 | D33: 85.86 | E33: 89.1 | F33: 83.95 | G33: 61.08 | H33: =SUM(C33:G33) -> 436.2
A34: Red Ryder Tom | B34: T | C34: 106.82 | D34: 97.63 | E34: 90.41 | F34: 100.34 | G34: 64.77 | H34: =SUM(C34:G34) -> 459.97
A35: Bullwhip | B35: T | C35: 111.58 | D35: 88.66 | E35: 77.61 | F35: 118.41 | G35: 75.37 | H35: =SUM(C35:G35) -> 471.63
A36: Johnny Lightening | B36: T | C36: 77.12 | D36: 109.83 | E36: 98.68 | F36: 129.21 | G36: 61.7 | H36: =SUM(C36:G36) -> 476.54
A37: Jay Walker | B37: T | C37: 113.99 | D37: 125.52 | E37: 91.4 | F37: 87.81 | G37: 75.86 | H37: =SUM(C37:G37) -> 494.58
A38: Kentucky Buck | B38: T | C38: 98.14 | D38: 94.64 | E38: 89.5 | F38: 146.37 | G38: 69.09 | H38: =SUM(C38:G38) -> 497.74
A39: Destiny West | B39: T | C39: 111.66 | D39: 109.74 | E39: 89.77 | F39: 88.12 | G39: 102.13 | H39: =SUM(C39:G39) -> 501.42
A40: Outlawyer Dogget | B40: T | C40: 120.1 | D40: 102.01 | E40: 92.36 | F40: 96.69 | G40: 95.06 | H40: =SUM(C40:G40) -> 506.22
A41: Snaggeltooth | B41: T | C41: 94 | D41: 95.03 | E41: 87.27 | F41: 141.19 | G41: 90.78 | H41: =SUM(C41:G41) -> 508.27
A42: Pard N Me | B42: T | C42: 113.11 | D42: 120.79 | E42: 81.1 | F42: 115 | G42: 89.89 | H42: =SUM(C42:G42) -> 519.89
A43: Ponchatoula | B43: T | C43: 129.33 | D43: 111.27 | E43: 100.76 | F43: 106.11 | G43: 95.41 | H43: =SUM(C43:G43) -> 542.88
A44: Dusty Rivers | B44: T | C44: 107.12 | D44: 116.94 | E44: 124.81 | F44: 108.46 | G44: 87.64 | H44: =SUM(C44:G44) -> 544.97
A45: Rancher | B45: T | C45: 118.79 | D45: 91.61 | E45: 113.7 | F45: 109.09 | G45: 112.02 | H45: =SUM(C45:G45) -> 545.21
A46: Johnny 1 Horse | B46: T | C46: 128.6 | D46: 103.83 | E46: 105.34 | F46: 129.01 | G46: 85.09 | H46: =SUM(C46:G46) -> 551.87
A47: City Slicker | B47: T | C47: 152.34 | D47: 138.66 | E47: 109.57 | F47: 128.33 | G47: 86.59 | H47: =SUM(C47:G47) -> 615.49
A48: Stumble Bum | B48: T | C48: 151.43 | D48: 128.63 | E48: 129.36 | F48: 133.32 | G48: 113.77 | H48: =SUM(C48:G48) -> 656.51
A49: Fuzzyburd | B49: T | C49: 169.89 | D49: 143.27 | E49: 126.77 | F49: 118.3 | G49: 99.91 | H49: =SUM(C49:G49) -> 658.14
A50: Willie Lobo | B50: T | C50: 158.35 | D50: 162.18 | E50: 126.72 | F50: 142.55 | G50: 86.24 | H50: =SUM(C50:G50) -> 676.04
A51: Lemay Kid | B51: T | C51: 175 | D51: 136.25 | E51: 128.6 | F51: 148.9 | G51: 103.33 | H51: =SUM(C51:G51) -> 692.08
A52: Dirtwater Dan | B52: T | C52: 163.95 | D52: 143.83 | E52: 142.68 | F52: 148.82 | G52: 101.08 | H52: =SUM(C52:G52) -> 700.36
A53: Nikki Rhinestone | B53: T | C53: 171.68 | D53: 164.14 | E53: 186.12 | F53: 170.75 | G53: 90.21 | H53: =SUM(C53:G53) -> 782.9
A54: Paco Kid | B54: T | C54: 170.42 | D54: 207.98 | E54: 157.79 | F54: 168.75 | G54: 140.6 | H54: =SUM(C54:G54) -> 845.54
A55: Hopalong Bill | B55: T | C55: 120.76 | D55: 79.91 | E55: 88.24 | F55: 82.28 | G55: DNS | H55: =SUM(C55:G55) -> 371.19
A56: Highridge Drifter | B56: T | E56: 80.39
A57: Elmo | B57: T/J | C57: 120.62 | D57: 87.4 | E57: 84.34 | F57: 90.22 | G57: 66.14 | H57: =SUM(C57:G57) -> 448.72
A58: Stumpe | B58: T/S | C58: 129.94 | D58: 109.44 | E58: 84.73 | F58: 109.21 | G58: 87.3 | H58: =SUM(C58:G58) -> 520.62
A59: Calhoun | B59: T/S | C59: 190.91 | D59: 145.89 | E59: 133.47 | F59: 165.79 | G59: 108.71 | H59: =SUM(C59:G59) -> 744.77
A60: Bonnie Fear | B60: T/W | C60: 52.2 | D60: 60.04 | E60: 55.56 | F60: 65 | G60: 39.38 | H60: =SUM(C60:G60) -> 272.18
A61: Crazy Mary | B61: T/W | C61: 82.76 | D61: 78.5 | E61: 76.43 | F61: 95.48 | G61: 58.01 | H61: =SUM(C61:G61) -> 391.18
A62: Yuma Rose | B62: T/W | C62: 158.71 | D62: 117.23 | E62: 85.13 | F62: 98.76 | G62: 84.47 | H62: =SUM(C62:G62) -> 544.3
A63: Boston Lil | B63: T/W | C63: 200.2 | D63: 181.33 | E63: 141.95 | F63: 198.19 | G63: 120.34 | H63: =SUM(C63:G63) -> 842.01
A65: AVERAGE | C65: =SUM(C2:C63)/62 -> 114.59806451612903 | D65: =SUM(D2:D63)/62 -> 99.602258064516121 | E65: =SUM(E2:E63)/62 -> 94.212258064516149 | F65: =SUM(F2:F63)/62 -> 101.59596774193545 | G65: =SUM(G2:G63)/62 -> 77.094516129032272 | H65: =SUM(H2:H63)/62 -> 485.80645161290323