B2: HELM | C2: NAME | D2: AC | E2: STR | F2: STA | G2: DEX | H2: AGI | I2: INT | J2: WIS | K2: CHA | L2: MR | M2: FR | N2: CR | O2: PR | P2: DR | Q2: HP | R2: EFFECT
C3: Indicolite | D3: 20 | I3: 5 | K3: 5
C4: Cobalt | D4: 25 | R4: Infravis
C5: Berserker | D5: 24 | E5: 7 | F5: 2 | G5: 2 | O5: 3 | Q5: 35
C6: Champion | D6: 24 | E6: 2 | F6: 7 | G6: 2 | M6: 3 | Q6: 35
C7: Myrmidon | D7: 27 | E7: 3 | F7: 2 | G7: 12 | N7: 5 | Q7: 35
C8: Warlord | D8: 30 | E8: 4 | F8: 7 | G8: 3 | P8: 4 | Q8: 35
B10: BP | C10: NAME | D10: AC | E10: STR | F10: STA | G10: DEX | H10: AGI | I10: INT | J10: WIS | K10: CHA | L10: MR | M10: FR | N10: CR | O10: PR | P10: DR | Q10: HP | R10: EFFECT
C11: Indicolite | D11: 35 | E11: 15 | F11: 15 | G11: 15
C12: Cobalt | D12: 45 | E12: 12 | F12: 12 | G12: 12 | Q12: 50 | R12: Invigorate
C13: Berserker | D13: 47 | E13: 14 | F13: 10 | G13: 5 | H13: 7 | L13: 4 | M13: 10 | Q13: 90 | R13: Invigorate
C14: Champion | D14: 47 | E14: 14 | F14: 10 | G14: 7 | H14: 5 | L14: 4 | O14: 10 | Q14: 90 | R14: Invigorate
C15: Myrmidon | D15: 54 | E15: 15 | F15: 10 | G15: 7 | H15: 7 | L15: 10 | M15: 5 | N15: 5 | P15: 10 | Q15: 90 | R15: Invigorate
C16: Warlord | D16: 59 | E16: 16 | F16: 10 | G16: 7 | H16: 7 | L16: 6 | N16: 10 | Q16: 90 | R16: Invigorate
B18: ARMS | C18: NAME | D18: AC | E18: STR | F18: STA | G18: DEX | H18: AGI | I18: INT | J18: WIS | K18: CHA | L18: MR | M18: FR | N18: CR | O18: PR | P18: DR | Q18: HP | R18: EFFECT
C19: Indicolite | D19: 20 | E19: 9 | G19: 5
C20: Cobalt | D20: 25 | R20: L Sheilding
C21: Berserker | D21: 24 | E21: 4 | H21: 5 | P21: 2 | Q21: 25
C22: Champion | D22: 24 | E22: 4 | G22: 5 | N22: 2 | Q22: 25
C23: Myrmidon | D23: 30 | E23: 5 | F23: 5 | H23: 5 | L23: 4 | M23: 6 | Q23: 25
C24: Warlord | D24: 33 | E24: 5 | F24: 6 | L24: 2 | O24: 2 | Q24: 25
B26: BRCR | C26: NAME | D26: AC | E26: STR | F26: STA | G26: DEX | H26: AGI | I26: INT | J26: WIS | K26: CHA | L26: MR | M26: FR | N26: CR | O26: PR | P26: DR | Q26: HP | R26: EFFECT
C27: Indicolite | D27: 12 | E27: 3 | G27: 3 | L27: 7 | M27: 7 | N27: 7
C28: Cobalt | D28: 20 | R28: Shrink
C29: Berserker | D29: 19 | E29: 2 | H29: 7 | L29: 2 | M29: 2 | N29: 2 | Q29: 15
C30: Champion | D30: 19 | G30: 2 | H30: 7 | L30: 2 | M30: 2 | N30: 2 | Q30: 15
C31: Myrmidon | D31: 22 | E31: 2 | F31: 5 | G31: 2 | H31: 9 | L31: 3 | M31: 3 | N31: 3 | Q31: 15
C32: Warlord | D32: 25 | F32: 2 | H32: 7 | L32: 2 | M32: 2 | N32: 2 | Q32: 35
B34: GLOV | C34: NAME | D34: AC | E34: STR | F34: STA | G34: DEX | H34: AGI | I34: INT | J34: WIS | K34: CHA | L34: MR | M34: FR | N34: CR | O34: PR | P34: DR | Q34: HP | R34: EFFECT
C35: Indicolite | D35: 16 | F35: 5 | G35: 5 | Q35: 50
C36: Cobalt | D36: 25 | R36: Reck STR
C37: Berserker | D37: 24 | E37: 5 | Q37: 40
C38: Champion | D38: 24 | H38: 5 | Q38: 40
C39: Myrmidon | D39: 27 | G39: 8 | Q39: 90
C40: Warlord | D40: 30 | F40: 5 | Q40: 60
B42: LEGS | C42: NAME | D42: AC | E42: STR | F42: STA | G42: DEX | H42: AGI | I42: INT | J42: WIS | K42: CHA | L42: MR | M42: FR | N42: CR | O42: PR | P42: DR | Q42: HP | R42: EFFECT
C43: Indicolite | D43: 20 | E43: 5 | F43: 5 | H43: 5
C44: Cobalt | D44: 35 | E44: 8 | F44: 8 | G44: 8 | R44: Invisibility
C45: Berserker | D45: 34 | E45: 9 | F45: 7 | L45: 4
C46: Champion | D46: 34 | E46: 9 | F46: 7 | L46: 4
C47: Myrmidon | D47: 40 | E47: 9 | G47: 9 | H47: 9 | L47: 4 | Q47: 40
C48: Warlord | D48: 45 | E48: 9 | F48: 5 | G48: 7 | L48: 4 | M48: 5
B50: BOOT | C50: NAME | D50: AC | E50: STR | F50: STA | G50: DEX | H50: AGI | I50: INT | J50: WIS | K50: CHA | L50: MR | M50: FR | N50: CR | O50: PR | P50: DR | Q50: HP | R50: EFFECT
C51: Indicolite | D51: 20 | H51: 5 | I51: 5 | J51: 5 | O51: 15 | P51: 15
C52: Cobalt | D52: 25 | R52: Kunzar STR
C53: Berserker | D53: 25 | E53: 1 | F53: 3 | G53: 2
C54: Champion | D54: 25 | E54: 1 | F54: 3 | H54: 2
C55: Myrmidon | D55: 28 | F55: 4 | G55: 2 | L55: 1 | M55: 1 | N55: 1 | O55: 1 | P55: 1 | Q55: 25
C56: Warlord | D56: 32 | F56: 3 | H56: 2 | Q56: 30
B58: TOT | C58: NAME | D58: AC | E58: STR | F58: STA | G58: DEX | H58: AGI | I58: INT | J58: WIS | K58: CHA | L58: MR | M58: FR | N58: CR | O58: PR | P58: DR | Q58: HP
C59: Indicolite | D59: =D3+D11+D19+(2*D27)+D35+D43+D51 -> 155 | E59: =E3+E11+E19+(2*E27)+E35+E43+E51 -> 35 | F59: =F3+F11+F19+(2*F27)+F35+F43+F51 -> 25 | G59: =G3+G11+G19+(2*G27)+G35+G43+G51 -> 31 | H59: =H3+H11+H19+(2*H27)+H35+H43+H51 -> 10 | I59: =I3+I11+I19+(2*I27)+I35+I43+I51 -> 10 | J59: =J3+J11+J19+(2*J27)+J35+J43+J51 -> 5 | K59: =K3+K11+K19+(2*K27)+K35+K43+K51 -> 5 | L59: =L3+L11+L19+(2*L27)+L35+L43+L51 -> 14 | M59: =M3+M11+M19+(2*M27)+M35+M43+M51 -> 14 | N59: =N3+N11+N19+(2*N27)+N35+N43+N51 -> 14 | O59: =O3+O11+O19+(2*O27)+O35+O43+O51 -> 15 | P59: =P3+P11+P19+(2*P27)+P35+P43+P51 -> 15 | Q59: =Q3+Q11+Q19+(2*Q27)+Q35+Q43+Q51 -> 50
C60: Cobalt | D60: =D4+D12+D20+(2*D28)+D36+D44+D52 -> 220 | E60: =E4+E12+E20+(2*E28)+E36+E44+E52 -> 20 | F60: =F4+F12+F20+(2*F28)+F36+F44+F52 -> 20 | G60: =G4+G12+G20+(2*G28)+G36+G44+G52 -> 20 | H60: =H4+H12+H20+(2*H28)+H36+H44+H52 -> 0 | I60: =I4+I12+I20+(2*I28)+I36+I44+I52 -> 0 | J60: =J4+J12+J20+(2*J28)+J36+J44+J52 -> 0 | K60: =K4+K12+K20+(2*K28)+K36+K44+K52 -> 0 | L60: =L4+L12+L20+(2*L28)+L36+L44+L52 -> 0 | M60: =M4+M12+M20+(2*M28)+M36+M44+M52 -> 0 | N60: =N4+N12+N20+(2*N28)+N36+N44+N52 -> 0 | O60: =O4+O12+O20+(2*O28)+O36+O44+O52 -> 0 | P60: =P4+P12+P20+(2*P28)+P36+P44+P52 -> 0 | Q60: =Q4+Q12+Q20+(2*Q28)+Q36+Q44+Q52 -> 50
C61: Berserker | D61: =D5+D13+D21+(2*D29)+D37+D45+D53 -> 216 | E61: =E5+E13+E21+(2*E29)+E37+E45+E53 -> 44 | F61: =F5+F13+F21+(2*F29)+F37+F45+F53 -> 22 | G61: =G5+G13+G21+(2*G29)+G37+G45+G53 -> 9 | H61: =H5+H13+H21+(2*H29)+H37+H45+H53 -> 26 | I61: =I5+I13+I21+(2*I29)+I37+I45+I53 -> 0 | J61: =J5+J13+J21+(2*J29)+J37+J45+J53 -> 0 | K61: =K5+K13+K21+(2*K29)+K37+K45+K53 -> 0 | L61: =L5+L13+L21+(2*L29)+L37+L45+L53 -> 12 | M61: =M5+M13+M21+(2*M29)+M37+M45+M53 -> 14 | N61: =N5+N13+N21+(2*N29)+N37+N45+N53 -> 4 | O61: =O5+O13+O21+(2*O29)+O37+O45+O53 -> 3 | P61: =P5+P13+P21+(2*P29)+P37+P45+P53 -> 2 | Q61: =Q5+Q13+Q21+(2*Q29)+Q37+Q45+Q53 -> 220
C62: Champion | D62: =D6+D14+D22+(2*D30)+D38+D46+D54 -> 216 | E62: =E6+E14+E22+(2*E30)+E38+E46+E54 -> 30 | F62: =F6+F14+F22+(2*F30)+F38+F46+F54 -> 27 | G62: =G6+G14+G22+(2*G30)+G38+G46+G54 -> 18 | H62: =H6+H14+H22+(2*H30)+H38+H46+H54 -> 26 | I62: =I6+I14+I22+(2*I30)+I38+I46+I54 -> 0 | J62: =J6+J14+J22+(2*J30)+J38+J46+J54 -> 0 | K62: =K6+K14+K22+(2*K30)+K38+K46+K54 -> 0 | L62: =L6+L14+L22+(2*L30)+L38+L46+L54 -> 12 | M62: =M6+M14+M22+(2*M30)+M38+M46+M54 -> 7 | N62: =N6+N14+N22+(2*N30)+N38+N46+N54 -> 6 | O62: =O6+O14+O22+(2*O30)+O38+O46+O54 -> 10 | P62: =P6+P14+P22+(2*P30)+P38+P46+P54 -> 0 | Q62: =Q6+Q14+Q22+(2*Q30)+Q38+Q46+Q54 -> 220
C63: Myrmidon | D63: =D7+D15+D23+(2*D31)+D39+D47+D55 -> 250 | E63: =E7+E15+E23+(2*E31)+E39+E47+E55 -> 36 | F63: =F7+F15+F23+(2*F31)+F39+F47+F55 -> 31 | G63: =G7+G15+G23+(2*G31)+G39+G47+G55 -> 42 | H63: =H7+H15+H23+(2*H31)+H39+H47+H55 -> 39 | I63: =I7+I15+I23+(2*I31)+I39+I47+I55 -> 0 | J63: =J7+J15+J23+(2*J31)+J39+J47+J55 -> 0 | K63: =K7+K15+K23+(2*K31)+K39+K47+K55 -> 0 | L63: =L7+L15+L23+(2*L31)+L39+L47+L55 -> 25 | M63: =M7+M15+M23+(2*M31)+M39+M47+M55 -> 18 | N63: =N7+N15+N23+(2*N31)+N39+N47+N55 -> 17 | O63: =O7+O15+O23+(2*O31)+O39+O47+O55 -> 1 | P63: =P7+P15+P23+(2*P31)+P39+P47+P55 -> 11 | Q63: =Q7+Q15+Q23+(2*Q31)+Q39+Q47+Q55 -> 335
C64: Warlord | D64: =D8+D16+D24+(2*D32)+D40+D48+D56 -> 279 | E64: =E8+E16+E24+(2*E32)+E40+E48+E56 -> 34 | F64: =F8+F16+F24+(2*F32)+F40+F48+F56 -> 40 | G64: =G8+G16+G24+(2*G32)+G40+G48+G56 -> 17 | H64: =H8+H16+H24+(2*H32)+H40+H48+H56 -> 23 | I64: =I8+I16+I24+(2*I32)+I40+I48+I56 -> 0 | J64: =J8+J16+J24+(2*J32)+J40+J48+J56 -> 0 | K64: =K8+K16+K24+(2*K32)+K40+K48+K56 -> 0 | L64: =L8+L16+L24+(2*L32)+L40+L48+L56 -> 16 | M64: =M8+M16+M24+(2*M32)+M40+M48+M56 -> 9 | N64: =N8+N16+N24+(2*N32)+N40+N48+N56 -> 14 | O64: =O8+O16+O24+(2*O32)+O40+O48+O56 -> 2 | P64: =P8+P16+P24+(2*P32)+P40+P48+P56 -> 4 | Q64: =Q8+Q16+Q24+(2*Q32)+Q40+Q48+Q56 -> 310