A1: Active Roster
B2: Levels | C2: Title | D2: Race | E2: Epic | F2: VP Key | G2: ST Key | H2: EMP Key | I2: VT Key | J2: PoJ Trials | K2: PoS Medals | L2: Agnarr | M2: PoN Hedge | N2: Teris Thule | O2: Saryn | P2: Aerin Dar | Q2: 3 Trials | R2: Mith Marr | S2: Grummus | T2: Carpin | U2: Bertolox | V2: PoI Dragon | W2: MB | X2: Talon Zek | Y2: Vallon Zek | Z2: RZTW | AA2: Sol Ro Tower | AB2: Status
A3: Bard
A4: Arsis | B4: 65 | C4: Veteran | D4: Wood Elf | E4: YES | G4: 1 | H4: 1 | I4: 1 | J4: 1 | K4: 1 | M4: 1 | N4: 1 | O4: 1 | P4: 1 | Q4: 1 | R4: 1 | S4: 1 | T4: 1 | U4: 1 | V4: 1 | W4: 1 | X4: 1 | Y4: 1 | AA4: 1 | AB4: Member | AC4: 1
A5: Deolwen | B5: 65 | D5: Wood Elf | E5: YES | J5: 1 | M5: 1 | N5: 1 | O5: 1 | P5: 1 | Q5: 1 | R5: 1 | S5: 1 | T5: 1 | U5: 1 | V5: 1 | W5: 1 | X5: 1 | AB5: Member | AC5: 1
A6: =HYPERLINK("http://www.magelo.com/eq_view_profile.html?num=602833","Gymi") -> Gymi | B6: 62 | D6: Wood Elf | E6: YES | AB6: Member | AC6: 1
A7: Renasfhlar | B7: 65 | D7: Wood Elf | E7: YES | H7: 1 | I7: 1 | W7: 1 | AB7: Member | AC7: 1
A8: =HYPERLINK("http://www.magelo.com/eq_view_profile.html?num=344746","Rosha") -> Rosha | B8: 65 | C8: Impresario | D8: Wood Elf | E8: YES | F8: 1 | G8: 1 | H8: 1 | I8: 1 | J8: 1 | K8: 1 | L8: 1 | M8: 1 | N8: 1 | O8: 1 | P8: 1 | Q8: 1 | R8: 1 | S8: 1 | T8: 1 | U8: 1 | W8: 1 | X8: 1 | Y8: 1 | AA8: 1 | AB8: Officer | AC8: 1
A9: Paramour | B9: 65 | D9: Wood Elf | E9: YES | AB9: Member | AC9: 1
A10: =HYPERLINK("http://www.magelo.com/eq_view_profile.html?num=663136","Taluwen") -> Taluwen | B10: 65 | C10: Impresario | D10: Half Elf | E10: YES | G10: 1 | H10: 1 | I10: 1 | J10: 1 | K10: 1 | L10: 1 | M10: 1 | N10: 1 | O10: 1 | P10: 1 | Q10: 1 | R10: 1 | S10: 1 | T10: 1 | U10: 1 | V10: 1 | W10: 1 | X10: 1 | Y10: 1 | AA10: 1 | AB10: Member | AC10: 1
A11: =HYPERLINK("http://www.magelo.com/eq_view_profile.html?num=182277","Yorke") -> Yorke | B11: 65 | C11: Veteran | D11: Half Elf | E11: YES | F11: 1 | G11: 1 | H11: 1 | I11: 1 | L11: 1 | W11: 1 | X11: 1 | AB11: Officer | AC11: 1
A12: =HYPERLINK("http://www.magelo.com/eq_view_profile.html?num=194601","Cranth") -> Cranth | B12: 65 | C12: Veteran | D12: Wood Elf | E12: YES | F12: X | G12: X | H12: X | I12: X | AB12: On Break
A13: =HYPERLINK("http://www.magelo.com/eq_view_profile.html?num=84086","Mioawara") -> Mioawara | B13: 65 | C13: Baron | D13: Vah Shir | E13: YES | G13: X | H13: X | I13: X | AB13: On Break
A14: Beastlord
A15: =HYPERLINK("http://www.magelo.com/eq_view_profile.html?num=718004","Crewl") -> Crewl | B15: 65 | C15: Elder | D15: Ogre | E15: YES | G15: 1 | H15: 1 | I15: 1 | J15: 1 | K15: 1 | L15: 1 | M15: 1 | N15: 1 | O15: 1 | P15: 1 | Q15: 1 | R15: 1 | S15: 1 | T15: 1 | U15: 1 | V15: 1 | W15: 1 | X15: 1 | Y15: 1 | AA15: 1 | AB15: Member | AC15: 1
A16: =HYPERLINK("http://www.magelo.com/eq_view_profile.html?num=587698","Meeoww") -> Meeoww | B16: 65 | C16: Elder | D16: Vah Shir | E16: YES | G16: 1 | H16: 1 | I16: 1 | N16: 1 | R16: 1 | S16: 1 | T16: 1 | U16: 1 | Y16: 1 | AB16: Member | AC16: 1
A17: =HYPERLINK("http://www.magelo.com/eq_view_profile.html?num=595579","Sarisha") -> Sarisha | B17: 65 | D17: Vah Shir | E17: YES | AB17: Member | AC17: 1
A18: =HYPERLINK("http://www.magelo.com/eq_view_profile.html?num=527672","Skilor") -> Skilor | B18: 62 | D18: Vah Shir | E18: NO | H18: X | AB18: On Break
A19: Nermel | B19: 61 | D19: Vah Shir | E19: YES | AB19: Alternate
B20: Levels | C20: Title | D20: Race | E20: Epic | F20: VP Key | G20: ST Key | H20: EMP Key | I20: VT Key | J20: PoJ Trials | K20: PoS Medals | L20: Agnarr | M20: PoN Hedge | N20: Teris Thule | O20: Saryn | P20: Aerin Dar | Q20: 3 Trials | R20: Mith Marr | S20: Grummus | T20: Carpin | U20: Bertolox | V20: PoI Dragon | W20: MB | X20: Talon Zek | Y20: Vallon Zek | Z20: RZTW | AA20: Sol Ro Tower | AB20: Status
A21: Clerics
A22: =HYPERLINK("http://www.magelo.com/eq_view_profile.html?num=642183","Aader") -> Aader | B22: 65 | C22: Venerable | D22: Dwarf | E22: YES | G22: 1 | H22: 1 | I22: 1 | J22: 1 | K22: 1 | M22: 1 | N22: 1 | O22: 1 | P22: 1 | Q22: 1 | R22: 1 | S22: 1 | T22: 1 | U22: 1 | V22: 1 | W22: 1 | X22: 1 | Y22: 1 | AA22: 1 | AB22: Member | AC22: 1
A23: =HYPERLINK("http://www.magelo.com/eq_view_profile.html?num=342919","Dinanin") -> Dinanin | B23: 65 | C23: Exarch | D23: Dwarf | E23: YES | F23: X | G23: X | H23: X | I23: X | AB23: Member | AC23: 1
A24: Giverliffe | B24: 65 | D24: High Elf | E24: NO | H24: 1 | I24: 1 | J24: 1 | K24: 1 | L24: 1 | R24: 1 | S24: 1 | T24: 1 | U24: 1 | Y24: 1 | AA24: 1 | AB24: Member | AC24: 1
A25: Harrys | B25: 65 | C25: Exarch | D25: Dwarf | E25: YES | H25: 1 | I25: 1 | J25: 1 | K25: 1 | M25: 1 | N25: 1 | O25: 1 | P25: 1 | Q25: 1 | R25: 1 | S25: 1 | T25: 1 | U25: 1 | V25: 1 | W25: 1 | X25: 1 | Y25: 1 | AA25: 1 | AB25: Member | AC25: 1
A26: =HYPERLINK("http://www.magelo.com/eq_view_profile.html?num=207442","Jerycho") -> Jerycho | B26: 65 | C26: Exarch | D26: Dwarf | E26: YES | G26: 1 | H26: 1 | I26: 1 | J26: 1 | K26: 1 | M26: 1 | N26: 1 | P26: 1 | Q26: 1 | R26: 1 | S26: 1 | T26: 1 | U26: 1 | V26: 1 | W26: 1 | X26: 1 | AA26: 1 | AB26: Member | AC26: 1
A27: =HYPERLINK("http://www.magelo.com/eq_view_profile.html?num=151159","Mediloks") -> Mediloks | B27: 65 | D27: High Elf | E27: YES | G27: 1 | H27: 1 | I27: 1 | J27: 1 | K27: 1 | L27: 1 | M27: 1 | N27: 1 | O27: 1 | P27: 1 | Q27: 1 | R27: 1 | S27: 1 | T27: 1 | U27: 1 | V27: 1 | W27: 1 | X27: 1 | AB27: Member | AC27: 1
A28: =HYPERLINK("http://www.magelo.com/eq_view_profile.html?num=71953","Philander") -> Philander | B28: 65 | C28: Venerable | D28: Dwarf | E28: YES | F28: 1 | G28: 1 | H28: 1 | I28: 1 | J28: 1 | K28: 1 | L28: 1 | M28: 1 | N28: 1 | O28: 1 | P28: 1 | Q28: 1 | R28: 1 | S28: 1 | T28: 1 | U28: 1 | V28: 1 | W28: 1 | X28: 1 | Y28: 1 | AA28: 1 | AB28: Officer | AC28: 1
A29: Relaeh | B29: 65 | D29: High Elf | E29: YES | AB29: Member | AC29: 1
A30: Ressur | B30: 65 | D30: High Elf | E30: YES | AB30: Member | AC30: 1
A31: =HYPERLINK("http://www.magelo.com/eq_view_profile.html?num=495320","Vyera") -> Vyera | B31: 65 | C31: Exarch | D31: Dark Elf | E31: YES | H31: X | J31: 1 | K31: 1 | L31: 1 | M31: 1 | N31: 1 | O31: 1 | P31: 1 | Q31: 1 | S31: 1 | T31: 1 | U31: 1 | W31: 1 | X31: 1 | Y31: 1 | AA31: 1 | AB31: Member | AC31: 1
A32: =HYPERLINK("http://www.magelo.com/eq_view_profile.html?num=62008","Xorolorn") -> Xorolorn | B32: 65 | C32: Exarch | D32: High Elf | E32: YES | F32: 1 | G32: 1 | H32: 1 | I32: 1 | J32: 1 | K32: 1 | M32: 1 | N32: 1 | O32: 1 | P32: 1 | Q32: 1 | R32: 1 | S32: 1 | T32: 1 | U32: 1 | V32: 1 | W32: 1 | X32: 1 | Y32: 1 | AA32: 1 | AB32: Member | AC32: 1
A33: Bohric | B33: 65 | C33: Baron | D33: Dwarf | E33: NO | F33: X | G33: X | AB33: On Break
A34: =HYPERLINK("http://www.magelo.com/eq_view_profile.html?num=84050","Gerweena") -> Gerweena | B34: 65 | C34: Venerable | D34: Halfling | E34: YES | G34: X | H34: X | AB34: On Break
A35: =HYPERLINK("http://www.magelo.com/eq_view_profile.html?num=115196","Iendaar") -> Iendaar | B35: 65 | C35: Baron | D35: High Elf | E35: YES | H35: X | I35: X | AB35: On Break
A36: =HYPERLINK("http://www.magelo.com/eq_view_profile.html?num=581769","Samine") -> Samine | B36: 65 | C36: Venerable | D36: High Elf | E36: NO | F36: X | G36: X | M36: x | AB36: On Break
A37: =HYPERLINK("http://www.magelo.com/eq_view_profile.html?num=141442","Adella") -> Adella | B37: 65 | D37: Dwarf | E37: YES | F37: X | AB37: Alternate
A38: =HYPERLINK("http://www.magelo.com/eq_view_profile.html?num=345649","Andromache") -> Andromache | B38: 65 | C38: Venerable | D38: Dark Elf | E38: YES | H38: X | I38: X | J38: x | K38: x | L38: x | M38: x | N38: x | O38: x | P38: x | Q38: x | R38: x | S38: x | T38: x | U38: x | V38: x | W38: x | X38: x | Y38: x | AA38: x | AB38: Alternate
A39: =HYPERLINK("http://www.magelo.com/eq_view_profile.html?num=59684","Dystopya") -> Dystopya | B39: 65 | C39: Exarch | D39: Human | E39: YES | F39: X | G39: X | H39: X | I39: X | R39: x | S39: x | T39: x | U39: X | W39: X | AB39: Alternate
A40: Fryar | B40: 64 | D40: Dwarf | E40: YES | AB40: Alternate
A41: =HYPERLINK("http://www.magelo.com/eq_view_profile.html?num=596866","Fuzella") -> Fuzella | B41: 65 | C41: Venerable | D41: Halfling | E41: YES | H41: X | J41: X | M41: X | N41: X | O41: x | P41: X | Q41: X | R41: x | S41: X | T41: X | U41: X | V41: X | W41: X | X41: X | Y41: X | AA41: x | AB41: Alternate
A42: =HYPERLINK("http://www.magelo.com/eq_view_profile.html?num=824717","Moogi") -> Moogi | B42: 63 | C42: Baroness | D42: High Elf | E42: YES | J42: X | K42: X | M42: X | N42: X | P42: X | S42: X | T42: X | W42: X | AB42: Alternate
A43: Pria | B43: 65 | D43: High Elf | E43: YES | AB43: Alternate
A44: Restora | B44: 65 | D44: High Elf | E44: YES | H44: X | I44: X | J44: x | K44: x | M44: x | N44: x | O44: x | P44: x | Q44: x | R44: x | S44: x | T44: x | U44: x | V44: x | W44: x | X44: x | Y44: x | AA44: x | AB44: Alternate
A45: Sarigus | B45: 60 | C45: Venerable | D45: Halfling | E45: YES | F45: X | AB45: Alternate
A46: =HYPERLINK("http://www.magelo.com/eq_view_profile.html?num=24215","Weckie") -> Weckie | B46: 65 | C46: Venerable | D46: Dark Elf | E46: YES | F46: X | H46: X | I46: X | J46: x | K46: x | L46: x | M46: x | O46: x | P46: x | Q46: x | R46: x | S46: x | T46: x | U46: x | V46: x | X46: x | Y46: x | AB46: Alternate
B47: Levels | C47: Title | D47: Race | E47: Epic | F47: VP Key | G47: ST Key | H47: EMP Key | I47: VT Key | J47: PoJ Trials | K47: PoS Medals | L47: Agnarr | M47: PoN Hedge | N47: Teris Thule | O47: Saryn | P47: Aerin Dar | Q47: 3 Trials | R47: Mith Marr | S47: Grummus | T47: Carpin | U47: Bertolox | V47: PoI Dragon | W47: MB | X47: Talon Zek | Y47: Vallon Zek | Z47: RZTW | AA47: Sol Ro Tower | AB47: Status
A48: Druid
A49: =HYPERLINK("http://www.magelo.com/eq_view_profile.html?num=28957","Echineasia") -> Echineasia | B49: 65 | C49: Venerable | D49: Wood Elf | E49: YES | F49: 1 | G49: 1 | H49: 1 | I49: 1 | J49: 1 | K49: 1 | L49: 1 | M49: 1 | N49: 1 | O49: 1 | P49: 1 | Q49: 1 | R49: 1 | S49: 1 | T49: 1 | U49: 1 | V49: 1 | W49: 1 | X49: 1 | Y49: 1 | AA49: 1 | AB49: Member | AC49: 1
A50: =HYPERLINK("http://www.magelo.com/eq_view_profile.html?num=107624","Edylc") -> Edylc | B50: 65 | D50: Wood Elf | E50: YES | F50: 1 | G50: 1 | H50: 1 | I50: 1 | J50: 1 | K50: 1 | L50: 1 | M50: 1 | N50: 1 | O50: 1 | P50: 1 | Q50: 1 | R50: 1 | S50: 1 | T50: 1 | U50: 1 | V50: 1 | W50: 1 | X50: 1 | AB50: Member | AC50: 1
A51: =HYPERLINK("http://www.magelo.com/eq_view_profile.html?num=186512","Gweeto") -> Gweeto | B51: 65 | D51: Halfling | E51: YES | F51: 1 | G51: 1 | H51: 1 | I51: 1 | J51: 1 | K51: 1 | L51: 1 | M51: 1 | N51: 1 | O51: 1 | P51: 1 | Q51: 1 | R51: 1 | S51: 1 | T51: 1 | U51: 1 | V51: 1 | W51: 1 | X51: 1 | Y51: 1 | AA51: 1 | AB51: Member | AC51: 1
A52: =HYPERLINK("http://www.magelo.com/eq_view_profile.html?num=54717","Lilee") -> Lilee | B52: 65 | C52: Elder | D52: Wood Elf | E52: YES | H52: 1 | I52: 1 | J52: 1 | K52: 1 | L52: 1 | M52: 1 | N52: 1 | O52: 1 | P52: 1 | Q52: 1 | R52: 1 | S52: 1 | T52: 1 | U52: 1 | V52: 1 | W52: 1 | X52: 1 | Y52: 1 | AA52: 1 | AB52: Member | AC52: 1
A53: Panzon | B53: 65 | D53: Halfling | E53: YES | H53: 1 | I53: 1 | L53: 1 | R53: 1 | S53: 1 | T53: 1 | U53: 1 | W53: 1 | AB53: Member | AC53: 1
A54: =HYPERLINK("http://www.magelo.com/eq_view_profile.html?num=12316","Thunderheart") -> Thunderheart | B54: 65 | C54: Elder | D54: Wood Elf | E54: YES | F54: 1 | H54: 1 | I54: 1 | J54: 1 | K54: 1 | L54: 1 | M54: 1 | N54: 1 | O54: 1 | P54: 1 | Q54: 1 | R54: 1 | S54: 1 | T54: 1 | U54: 1 | V54: 1 | W54: 1 | X54: 1 | Y54: 1 | AA54: 1 | AB54: Member | AC54: 1
A55: Tullane | B55: 65 | D55: Halfling | E55: YES | H55: 1 | I55: 1 | J55: 1 | N55: 1 | S55: 1 | T55: 1 | AB55: Member | AC55: 1
A56: =HYPERLINK("http://www.magelo.com/eq_view_profile.html?num=11509","Wickie") -> Wickie | B56: 65 | C56: Elder | D56: Wood Elf | E56: YES | F56: X | G56: X | H56: X | I56: X | J56: 1 | K56: 1 | L56: 1 | M56: 1 | N56: 1 | O56: 1 | P56: 1 | Q56: 1 | R56: 1 | S56: 1 | T56: 1 | U56: 1 | V56: 1 | W56: 1 | X56: 1 | Y56: 1 | AA56: 1 | AB56: Member | AC56: 1
A57: =HYPERLINK("http://www.magelo.com/eq_view_profile.html?num=126384","Denari") -> Denari | B57: 65 | D57: Half Elf | E57: YES | H57: X | I57: X | AB57: On Break
A58: Leaya | B58: 62 | D58: Wood Elf | E58: YES | AB58: On Break
A59: =HYPERLINK("http://www.magelo.com/eq_view_profile.html?num=19213","Madgegal") -> Madgegal | B59: 65 | C59: Baroness | D59: Wood Elf | E59: YES | H59: X | I59: X | AB59: On Break
A60: =HYPERLINK("http://www.magelo.com/eq_view_profile.html?num=343679","Fellan") -> Fellan | B60: 61 | D60: Halfling | E60: NO | AB60: Alternate
A61: =HYPERLINK("http://www.magelo.com/eq_view_profile.html?num=226868","Padain") -> Padain | B61: 65 | C61: Elder | D61: Wood Elf | E61: YES | F61: X | G61: X | AB61: Alternate
A62: Enchanter
A63: =HYPERLINK("http://www.magelo.com/eq_view_profile.html?num=120701","Azlaan") -> Azlaan | B63: 65 | C63: Sage | D63: Erudite | E63: YES | F63: 1 | G63: 1 | H63: 1 | I63: 1 | J63: 1 | K63: 1 | L63: 1 | M63: 1 | N63: 1 | O63: 1 | P63: 1 | Q63: 1 | R63: 1 | S63: 1 | T63: 1 | U63: 1 | W63: 1 | X63: 1 | Y63: 1 | AA63: 1 | AB63: Member | AC63: 1
A64: Canny | B64: 65 | C64: Mistress | D64: High Elf | E64: NO | G64: 1 | H64: 1 | I64: 1 | J64: 1 | K64: 1 | M64: 1 | N64: 1 | O64: 1 | P64: 1 | Q64: 1 | R64: 1 | S64: 1 | T64: 1 | V64: 1 | W64: 1 | X64: 1 | AB64: Member | AC64: 1
A65: =HYPERLINK("http://www.magelo.com/eq_view_profile.html?num=345631","Cwell") -> Cwell | B65: 65 | C65: Master | D65: Erudite | E65: YES | F65: 1 | G65: 1 | H65: 1 | I65: 1 | J65: 1 | K65: 1 | L65: 1 | M65: 1 | N65: 1 | O65: 1 | P65: 1 | Q65: 1 | R65: 1 | S65: 1 | T65: 1 | U65: 1 | V65: 1 | W65: 1 | X65: 1 | Y65: 1 | AA65: 1 | AB65: Member | AC65: 1
A66: =HYPERLINK("http://www.magelo.com/eq_view_profile.html?num=773753","Morphos") -> Morphos | B66: 65 | C66: Sage | D66: High Elf | E66: NO | H66: 1 | I66: 1 | AB66: Member | AC66: 1
A67: =HYPERLINK("http://www.magelo.com/eq_view_profile.html?num=18992","Qyzus") -> Qyzus | B67: 65 | C67: Mistress | D67: High Elf | E67: YES | H67: 1 | I67: 1 | J67: 1 | K67: 1 | L67: 1 | M67: 1 | N67: 1 | O67: 1 | P67: 1 | Q67: 1 | R67: 1 | S67: 1 | T67: 1 | U67: 1 | V67: 1 | W67: 1 | X67: 1 | Y67: 1 | AA67: 1 | AB67: Member | AC67: 1
A68: =HYPERLINK("http://www.magelo.com/eq_view_profile.html?num=343464","Sethrah") -> Sethrah | B68: 65 | C68: Mistress | D68: Dark Elf | E68: YES | F68: X | G68: X | O68: 1 | AB68: Member | AC68: 1
A69: =HYPERLINK("http://www.magelo.com/eq_view_profile.html?num=363509","Sakuma") -> Sakuma | B69: 64 | D69: High Elf | E69: NO | F69: X | G69: X | H69: X | AB69: On Break
A70: Amantus | B70: 64 | C70: Master | D70: High Elf | E70: NO | H70: X | J70: x | K70: x | M70: x | N70: x | O70: x | P70: x | Q70: x | R70: x | S70: x | T70: x | U70: x | V70: x | W70: x | X70: x | Y70: x | AB70: Alternate
A71: Jaquinetta | B71: 64 | D71: Dark Elf | E71: NO | AB71: Alternate
B72: Levels | C72: Title | D72: Race | E72: Epic | F72: VP Key | G72: ST Key | H72: EMP Key | I72: VT Key | J72: PoJ Trials | K72: PoS Medals | L72: Agnarr | M72: PoN Hedge | N72: Teris Thule | O72: Saryn | P72: Aerin Dar | Q72: 3 Trials | R72: Mith Marr | S72: Grummus | T72: Carpin | U72: Bertolox | V72: PoI Dragon | W72: MB | X72: Talon Zek | Y72: Vallon Zek | Z72: RZTW | AA72: Sol Ro Tower | AB72: Status
A73: Mages
A74: =HYPERLINK("http://www.magelo.com/eq_view_profile.html?num=458201","Crimsen") -> Crimsen | B74: 65 | C74: Master | D74: Gnome | E74: NO | H74: 1 | I74: 1 | J74: 1 | K74: 1 | L74: 1 | M74: 1 | N74: 1 | O74: 1 | P74: 1 | Q74: 1 | R74: 1 | S74: 1 | T74: 1 | U74: 1 | V74: 1 | W74: 1 | X74: 1 | AB74: Member | AC74: 1
A75: =HYPERLINK("http://www.magelo.com/eq_view_profile.html?num=466839","Almorzar") -> Almorzar | B75: 65 | C75: Sage | D75: Erudite | E75: NO | F75: X | G75: X | H75: X | I75: X | J75: 1 | K75: 1 | M75: 1 | N75: 1 | P75: 1 | Q75: 1 | S75: 1 | T75: 1 | V75: 1 | W75: 1 | AB75: On Break
A76: =HYPERLINK("http://www.magelo.com/eq_view_profile.html?num=191052","Canda") -> Canda | B76: 64 | C76: Baron | D76: High Elf | E76: YES | F76: X | G76: X | H76: X | I76: X | AB76: On Break
A77: Gaidar | B77: 63 | D77: Human | E77: NO | AB77: On Break
A78: =HYPERLINK("http://www.magelo.com/eq_view_profile.html?num=855868","Elementus") -> Elementus | B78: 62 | C78: Master | D78: Erudite | E78: NO | L78: x | M78: x | O78: x | P78: x | Q78: x | S78: x | W78: x | X78: x | AB78: Alternate
A79: Mandrayke | B79: 63 | E79: NO | AB79: Alternate
A80: Monks
A81: Omgmise | B81: 65 | D81: Iksar | E81: YES | G81: 1 | H81: 1 | I81: 1 | J81: 1 | K81: 1 | L81: 1 | M81: 1 | N81: 1 | O81: 1 | P81: 1 | Q81: 1 | R81: 1 | S81: 1 | T81: 1 | U81: 1 | W81: 1 | X81: 1 | Y81: 1 | AA81: 1 | AB81: Member | AC81: 1
A82: =HYPERLINK("http://www.magelo.com/eq_view_profile.html?num=93986","Quogin") -> Quogin | B82: 65 | C82: Sensei | D82: Human | E82: YES | G82: 1 | H82: 1 | I82: 1 | J82: 1 | K82: 1 | L82: 1 | M82: 1 | N82: 1 | O82: 1 | P82: 1 | Q82: 1 | R82: 1 | S82: 1 | T82: 1 | U82: 1 | W82: 1 | X82: 1 | Y82: 1 | AA82: 1 | AB82: Member | AC82: 1
A83: Stormin | B83: 65 | C83: Baron | D83: Human | E83: YES | F83: 1 | G83: 1 | H83: 1 | I83: 1 | J83: 1 | K83: 1 | M83: 1 | N83: 1 | O83: 1 | P83: 1 | Q83: 1 | R83: 1 | S83: 1 | T83: 1 | U83: 1 | W83: 1 | X83: 1 | Y83: 1 | AA83: 1 | AB83: Member | AC83: 1
A84: =HYPERLINK("http://www.magelo.com/eq_view_profile.html?num=54695","Talinsyn") -> Talinsyn | B84: 65 | C84: Sensei | D84: Human | E84: YES | F84: 1 | G84: 1 | H84: 1 | I84: 1 | J84: 1 | K84: 1 | L84: 1 | M84: 1 | N84: 1 | O84: 1 | P84: 1 | Q84: 1 | R84: 1 | S84: 1 | T84: 1 | U84: 1 | V84: 1 | W84: 1 | X84: 1 | Y84: 1 | AA84: 1 | AB84: Member | AC84: 1
A85: =HYPERLINK("http://www.magelo.com/eq_view_profile.html?num=64095","Voir") -> Voir | B85: 64 | C85: Brother | D85: Iksar | E85: YES | F85: X | G85: X | AB85: On Break
A86: Necromancer
A87: =HYPERLINK("http://www.magelo.com/eq_view_profile.html?num=799806","Beaa") -> Beaa | B87: 65 | C87: Archlich | D87: Gnome | E87: NO | H87: 1 | I87: 1 | J87: 1 | K87: 1 | M87: 1 | N87: 1 | O87: 1 | P87: 1 | Q87: 1 | R87: 1 | S87: 1 | T87: 1 | U87: 1 | V87: 1 | W87: 1 | X87: 1 | Y87: 1 | AA87: 1 | AB87: Member | AC87: 1
A88: Drexen | B88: 65 | C88: Sage | D88: Dark Elf | E88: NO | H88: 1 | I88: 1 | J88: 1 | K88: 1 | L88: 1 | M88: 1 | N88: 1 | O88: 1 | P88: 1 | Q88: 1 | S88: 1 | T88: 1 | U88: 1 | V88: 1 | W88: 1 | X88: 1 | Y88: 1 | AB88: Member | AC88: 1
A89: =HYPERLINK("http://www.magelo.com/eq_view_profile.html?num=352099","Lokaris") -> Lokaris | B89: 65 | C89: Archlich | D89: Dark Elf | E89: YES | F89: 1 | G89: 1 | H89: 1 | I89: 1 | J89: 1 | K89: 1 | L89: 1 | M89: 1 | N89: 1 | O89: 1 | P89: 1 | Q89: 1 | R89: 1 | S89: 1 | T89: 1 | U89: 1 | V89: 1 | W89: 1 | X89: 1 | Y89: 1 | AA89: 1 | AB89: Officer | AC89: 1
A90: Scraps | B90: 65 | C90: Archlich | D90: Gnome | E90: YES | G90: 1 | H90: 1 | I90: 1 | J90: 1 | K90: 1 | M90: 1 | N90: 1 | O90: 1 | P90: 1 | Q90: 1 | R90: 1 | S90: 1 | T90: 1 | U90: 1 | V90: 1 | W90: 1 | X90: 1 | Y90: 1 | AA90: 1 | AB90: Member | AC90: 1
A91: =HYPERLINK("http://www.magelo.com/eq_view_profile.html?num=434407","Evilgrim") -> Evilgrim | B91: 64 | C91: Baron | D91: Gnome | E91: YES | F91: X | H91: X | AB91: On Break
A92: Lifesteler | B92: 65 | D92: Dark Elf | E92: NO | AB92: On Break
A93: Intention | B93: 63 | D93: Dark Elf | E93: NO | AB93: Alternate
B94: Levels | C94: Title | D94: Race | E94: Epic | F94: VP Key | G94: ST Key | H94: EMP Key | I94: VT Key | J94: PoJ Trials | K94: PoS Medals | L94: Agnarr | M94: PoN Hedge | N94: Teris Thule | O94: Saryn | P94: Aerin Dar | Q94: 3 Trials | R94: Mith Marr | S94: Grummus | T94: Carpin | U94: Bertolox | V94: PoI Dragon | W94: MB | X94: Talon Zek | Y94: Vallon Zek | Z94: RZTW | AA94: Sol Ro Tower | AB94: Status
A95: Paladins
A96: =HYPERLINK("http://www.magelo.com/eq_view_profile.html?num=98063","Badin") -> Badin | B96: 65 | C96: Duke | D96: Dwarf | E96: YES | F96: 1 | G96: 1 | H96: 1 | I96: 1 | J96: 1 | K96: 1 | L96: 1 | M96: 1 | N96: 1 | O96: 1 | P96: 1 | Q96: 1 | R96: 1 | S96: 1 | T96: 1 | U96: 1 | V96: 1 | W96: 1 | X96: 1 | Y96: 1 | AA96: 1 | AB96: Member | AC96: 1
A97: =HYPERLINK("http://www.magelo.com/eq_view_profile.html?num=168250","Brokkson") -> Brokkson | B97: 65 | C97: Duke | D97: Dwarf | E97: YES | F97: 1 | G97: 1 | H97: 1 | I97: 1 | J97: 1 | K97: 1 | L97: 1 | M97: 1 | N97: 1 | O97: 1 | P97: 1 | Q97: 1 | R97: 1 | S97: 1 | T97: 1 | U97: 1 | V97: 1 | W97: 1 | X97: 1 | Y97: 1 | AA97: 1 | AB97: Officer | AC97: 1
A98: =HYPERLINK("http://www.magelo.com/eq_view_profile.html?num=753329","Chantarin") -> Chantarin | B98: 65 | D98: Human | E98: NO | H98: 1 | I98: 1 | J98: 1 | L98: 1 | M98: 1 | N98: 1 | O98: 1 | P98: 1 | Q98: 1 | R98: 1 | S98: 1 | T98: 1 | U98: 1 | V98: 1 | W98: 1 | X98: 1 | Y98: 1 | AA98: 1 | AB98: Member | AC98: 1
A99: Glloinn | B99: 65 | C99: Duke | D99: Dwarf | E99: NO | H99: 1 | I99: 1 | R99: 1 | T99: 1 | Y99: 1 | AB99: Member | AC99: 1
A100: =HYPERLINK("http://www.magelo.com/eq_view_profile.html?num=615440","Kwaidd") -> Kwaidd | B100: 65 | D100: Dwarf | E100: NO | G100: 1 | H100: 1 | I100: 1 | J100: 1 | K100: 1 | M100: 1 | N100: 1 | O100: 1 | Q100: 1 | R100: 1 | S100: 1 | T100: 1 | U100: 1 | W100: 1 | X100: 1 | Y100: 1 | AA100: 1 | AB100: Member | AC100: 1
A101: =HYPERLINK("http://www.magelo.com/eq_view_profile.html?num=301696","Shadrakk") -> Shadrakk | B101: 65 | C101: Sir | D101: Human | E101: NO | J101: 1 | K101: 1 | M101: 1 | N101: 1 | O101: 1 | P101: 1 | S101: 1 | T101: 1 | U101: 1 | V101: 1 | Y101: 1 | AB101: Member | AC101: 1
A102: Stpauli | B102: 65 | C102: Duchess | D102: High Elf | E102: NO | J102: 1 | K102: 1 | L102: 1 | M102: 1 | N102: 1 | O102: 1 | P102: 1 | Q102: 1 | R102: 1 | S102: 1 | T102: 1 | U102: 1 | V102: 1 | W102: 1 | X102: 1 | Y102: 1 | AA102: 1 | AB102: Member | AC102: 1
A103: Thorveld | B103: 65 | C103: Duke | D103: Dwarf | E103: NO | H103: 1 | I103: 1 | J103: 1 | K103: 1 | M103: 1 | N103: 1 | O103: 1 | P103: 1 | Q103: 1 | R103: 1 | S103: 1 | T103: 1 | U103: 1 | V103: 1 | W103: 1 | X103: 1 | Y103: 1 | AA103: 1 | AB103: Member | AC103: 1
A104: Uniqs | B104: 65 | D104: Dwarf | E104: NO | J104: 1 | K104: 1 | M104: 1 | N104: 1 | O104: 1 | P104: 1 | Q104: 1 | R104: 1 | S104: 1 | T104: 1 | U104: 1 | V104: 1 | W104: 1 | X104: 1 | Y104: 1 | AA104: 1 | AB104: Member | AC104: 1
A105: =HYPERLINK("http://www.magelo.com/eq_view_profile.html?num=350082","Infirit") -> Infirit | B105: 63 | C105: Baron | D105: Half Elf | E105: YES | G105: X | H105: X | AB105: On Break
A106: Ranger
A107: Britania | B107: 65 | D107: Wood Elf | E107: NO | H107: 1 | I107: 1 | AB107: Member | AC107: 1
A108: =HYPERLINK("http://www.magelo.com/eq_view_profile.html?num=66546","Canis") -> Canis | B108: 65 | C108: Hunter | D108: Wood Elf | E108: YES | G108: 1 | H108: 1 | I108: 1 | J108: 1 | K108: 1 | L108: 1 | M108: 1 | N108: 1 | O108: 1 | P108: 1 | Q108: 1 | R108: 1 | S108: 1 | T108: 1 | U108: 1 | V108: 1 | W108: 1 | X108: 1 | Y108: 1 | AA108: 1 | AB108: Member | AC108: 1
A109: =HYPERLINK("http://www.magelo.com/eq_view_profile.html?num=11263","Kaziel") -> Kaziel | B109: 65 | C109: Hunter | D109: Wood Elf | E109: YES | H109: 1 | I109: 1 | J109: 1 | K109: 1 | L109: 1 | M109: 1 | N109: 1 | O109: 1 | P109: 1 | Q109: 1 | R109: 1 | S109: 1 | T109: 1 | U109: 1 | V109: 1 | W109: 1 | X109: 1 | Y109: 1 | AA109: 1 | AB109: Member | AC109: 1
A110: Oakken | B110: 63 | D110: Wood Elf | E110: YES | S110: 1 | AB110: Member | AC110: 1
A111: Rothe | B111: 65 | C111: Hunter | D111: Wood Elf | E111: YES | H111: 1 | I111: 1 | J111: 1 | K111: 1 | L111: 1 | M111: 1 | N111: 1 | O111: 1 | P111: 1 | Q111: 1 | R111: 1 | S111: 1 | T111: 1 | U111: 1 | W111: 1 | X111: 1 | AA111: 1 | AB111: Member | AC111: 1
A112: Tano | B112: 65 | D112: Wood Elf | E112: YES | H112: 1 | I112: 1 | J112: 1 | K112: 1 | M112: 1 | N112: 1 | O112: 1 | P112: 1 | Q112: 1 | R112: 1 | S112: 1 | T112: 1 | U112: 1 | V112: 1 | W112: 1 | X112: 1 | Y112: 1 | AA112: 1 | AB112: Member | AC112: 1
A113: Saluki | B113: 65 | D113: Half Elf | E113: YES | G113: 1 | H113: 1 | I113: 1 | J113: 1 | K113: 1 | L113: 1 | M113: 1 | N113: 1 | O113: 1 | P113: 1 | Q113: 1 | R113: 1 | S113: 1 | T113: 1 | U113: 1 | V113: 1 | W113: 1 | X113: 1 | Y113: 1 | AA113: 1 | AB113: Member | AC113: 1
A114: =HYPERLINK("http://www.magelo.com/eq_view_profile.html?num=799168","Tyndall") -> Tyndall | B114: 65 | C114: Hunter | D114: Half Elf | E114: NO | G114: 1 | H114: 1 | I114: 1 | J114: 1 | K114: 1 | M114: 1 | N114: 1 | O114: 1 | P114: 1 | Q114: 1 | R114: 1 | S114: 1 | T114: 1 | U114: 1 | V114: 1 | W114: 1 | X114: 1 | Y114: 1 | AA114: 1 | AB114: Member | AC114: 1
A115: Andriul | B115: 60 | D115: Wood Elf | E115: YES | AB115: On Break
A116: =HYPERLINK("http://www.magelo.com/eq_view_profile.html?num=350545","Moshady") -> Moshady | B116: 65 | C116: Veteran | D116: Wood Elf | E116: YES | G116: X | H116: X | I116: X | AB116: On Break
B117: Levels | C117: Title | D117: Race | E117: Epic | F117: VP Key | G117: ST Key | H117: EMP Key | I117: VT Key | J117: PoJ Trials | K117: PoS Medals | L117: Agnarr | M117: PoN Hedge | N117: Teris Thule | O117: Saryn | P117: Aerin Dar | Q117: 3 Trials | R117: Mith Marr | S117: Grummus | T117: Carpin | U117: Bertolox | V117: PoI Dragon | W117: MB | X117: Talon Zek | Y117: Vallon Zek | Z117: RZTW | AA117: Sol Ro Tower | AB117: Status
A118: Rogues
A119: =HYPERLINK("http://www.magelo.com/eq_view_profile.html?num=524849","Gerhardt") -> Gerhardt | B119: 65 | C119: Marauder | D119: Dwarf | E119: YES | F119: 1 | G119: 1 | H119: 1 | I119: 1 | J119: 1 | K119: 1 | M119: 1 | N119: 1 | O119: 1 | P119: 1 | Q119: 1 | R119: 1 | S119: 1 | T119: 1 | U119: 1 | V119: 1 | W119: 1 | X119: 1 | Y119: 1 | AA119: 1 | AB119: Member | AC119: 1
A120: =HYPERLINK("http://www.magelo.com/eq_view_profile.html?num=528919","Honour") -> Honour | B120: 65 | C120: Veteran | D120: Half Elf | E120: YES | F120: 1 | G120: 1 | H120: 1 | I120: 1 | J120: 1 | K120: 1 | M120: 1 | O120: 1 | P120: 1 | R120: 1 | S120: 1 | T120: 1 | U120: 1 | V120: 1 | W120: 1 | X120: 1 | AB120: Member | AC120: 1
A121: =HYPERLINK("http://www.magelo.com/eq_view_profile.html?num=319473","Less") -> Less | B121: 65 | C121: Marauder | D121: Barbarian | E121: YES | G121: 1 | H121: 1 | I121: 1 | J121: 1 | K121: 1 | M121: 1 | N121: 1 | O121: 1 | P121: 1 | Q121: 1 | R121: 1 | S121: 1 | T121: 1 | U121: 1 | V121: 1 | W121: 1 | X121: 1 | Y121: 1 | AA121: 1 | AB121: Member | AC121: 1
A122: =HYPERLINK("http://www.magelo.com/eq_view_profile.html?num=552907","Mindori") -> Mindori | B122: 65 | C122: Marauder | D122: Wood Elf | E122: YES | G122: 1 | H122: 1 | I122: 1 | J122: 1 | K122: 1 | L122: 1 | M122: 1 | N122: 1 | O122: 1 | P122: 1 | Q122: 1 | R122: 1 | S122: 1 | T122: 1 | U122: 1 | W122: 1 | X122: 1 | Y122: 1 | AA122: 1 | AB122: Member | AC122: 1
A123: =HYPERLINK("http://www.magelo.com/eq_view_profile.html?num=176420","Morisan") -> Morisan | B123: 65 | C123: Marauder | D123: Dwarf | E123: YES | F123: 1 | G123: 1 | H123: 1 | I123: 1 | J123: 1 | K123: 1 | M123: 1 | N123: 1 | O123: 1 | P123: 1 | Q123: 1 | R123: 1 | S123: 1 | T123: 1 | U123: 1 | V123: 1 | W123: 1 | X123: 1 | Y123: 1 | AA123: 1 | AB123: Member | AC123: 1
A124: =HYPERLINK("http://www.magelo.com/eq_view_profile.html?num=123933","Rebbats") -> Rebbats | B124: 65 | D124: Barbarian | E124: YES | J124: 1 | K124: 1 | M124: 1 | N124: 1 | O124: 1 | P124: 1 | Q124: 1 | R124: 1 | S124: 1 | T124: 1 | U124: 1 | V124: 1 | W124: 1 | X124: 1 | Y124: 1 | AA124: 1 | AB124: Member | AC124: 1
A125: =HYPERLINK("http://www.magelo.com/eq_view_profile.html?num=92314","Vestrial") -> Vestrial | B125: 65 | C125: Marauder | D125: Half Elf | E125: YES | F125: 1 | G125: 1 | H125: 1 | I125: 1 | J125: 1 | K125: 1 | M125: 1 | N125: 1 | O125: 1 | P125: 1 | Q125: 1 | R125: 1 | S125: 1 | T125: 1 | U125: 1 | V125: 1 | W125: 1 | X125: 1 | Y125: 1 | AA125: 1 | AB125: Leader | AC125: 1
A126: O'Grady | B126: 65 | D126: Dwarf | E126: YES | G126: X | H126: X | I126: X | AB126: On Break
A127: Shadow Knights
A128: =HYPERLINK("http:www.magelo.com/eq_view_profile.html?num=362550","Asdrubael") -> Asdrubael | B128: 65 | C128: Duke | D128: Dark Elf | E128: YES | F128: 1 | G128: 1 | H128: 1 | I128: 1 | J128: 1 | K128: 1 | M128: 1 | N128: 1 | O128: 1 | P128: 1 | Q128: 1 | R128: 1 | S128: 1 | T128: 1 | U128: 1 | V128: 1 | W128: 1 | X128: 1 | Y128: 1 | AA128: 1 | AB128: Officer | AC128: 1
A129: =HYPERLINK("http:www.magelo.com/eq_view_profile.html?num=313032","Groldar") -> Groldar | B129: 65 | D129: Iksar | E129: NO | G129: X | H129: X | AB129: Member | AC129: 1
A130: =HYPERLINK("http://www.magelo.com/eq_view_profile.html?num=70519","Rakum") -> Rakum | B130: 65 | C130: Duke | D130: Troll | E130: NO | G130: 1 | H130: 1 | I130: 1 | J130: 1 | K130: 1 | M130: 1 | N130: 1 | O130: 1 | P130: 1 | Q130: 1 | R130: 1 | S130: 1 | T130: 1 | U130: 1 | V130: 1 | W130: 1 | X130: 1 | Y130: 1 | AA130: 1 | AB130: Member | AC130: 1
A131: =HYPERLINK("http://www.magelo.com/eq_view_profile.html?num=686618","Sssanarok") -> Sssanarok | B131: 65 | C131: Duke | D131: Iksar | E131: NO | H131: 1 | I131: 1 | J131: 1 | K131: 1 | M131: 1 | N131: 1 | O131: 1 | P131: 1 | Q131: 1 | S131: 1 | T131: 1 | U131: 1 | V131: 1 | W131: 1 | X131: 1 | AB131: Member | AC131: 1
A132: =HYPERLINK("http://www.magelo.com/eq_view_profile.html?num=359742","Tobak") -> Tobak | B132: 63 | D132: Ogre | E132: YES | F132: 1 | G132: 1 | H132: 1 | AB132: Member | AC132: 1
A133: =HYPERLINK("http://www.magelo.com/eq_view_profile.html?num=555532","Veya") -> Veya | B133: 65 | D133: Iksar | E133: NO | G133: X | H133: X | I133: X | J133: 1 | K133: 1 | M133: 1 | N133: 1 | O133: 1 | P133: 1 | Q133: 1 | R133: 1 | S133: 1 | T133: 1 | U133: 1 | V133: 1 | W133: 1 | X133: 1 | Y133: 1 | AA133: 1 | AB133: Member | AC133: 1
A134: =HYPERLINK("http://www.legendsoftherealm.com/legends/","Lunna") -> Lunna | B134: 65 | C134: Baroness | D134: Erudite | E134: NO | G134: X | H134: X | I134: X | AB134: On Break
A135: =HYPERLINK("http://www.magelo.com/eq_view_profile.html?num=350162","Zolgar") -> Zolgar | B135: 65 | C135: Sir | D135: Troll | E135: YES | F135: X | G135: X | H135: X | I135: X | AB135: On Break
A136: =HYPERLINK("http://www.magelo.com/eq_view_profile.html?num=309090","Niudan") -> Niudan | B136: 57 | C136: Baron | D136: Erudite | E136: YES | J136: x | K136: x | S136: x | T136: x | V136: x | W136: x | X136: x | AB136: Alternate
B137: Levels | C137: Title | D137: Race | E137: Epic | F137: VP Key | G137: ST Key | H137: EMP Key | I137: VT Key | J137: PoJ Trials | K137: PoS Medals | L137: Agnarr | M137: PoN Hedge | N137: Teris Thule | O137: Saryn | P137: Aerin Dar | Q137: 3 Trials | R137: Mith Marr | S137: Grummus | T137: Carpin | U137: Bertolox | V137: PoI Dragon | W137: MB | X137: Talon Zek | Y137: Vallon Zek | Z137: RZTW | AA137: Sol Ro Tower | AB137: Status
A138: Shamans
A139: =HYPERLINK("http://www.magelo.com/eq_view_profile.html?num=557618","Aldarien") -> Aldarien | B139: 65 | C139: Elder | D139: Barbarian | E139: YES | G139: 1 | H139: 1 | I139: 1 | J139: 1 | K139: 1 | L139: 1 | M139: 1 | N139: 1 | O139: 1 | P139: 1 | Q139: 1 | R139: 1 | S139: 1 | T139: 1 | U139: 1 | V139: 1 | W139: 1 | X139: 1 | Y139: 1 | AA139: 1 | AB139: Member | AC139: 1
A140: =HYPERLINK("http://www.magelo.com/eq_view_profile.html?num=29294","Angryor") -> Angryor | B140: 65 | C140: Venerable | D140: Barbarian | E140: YES | H140: 1 | I140: 1 | J140: 1 | M140: 1 | O140: 1 | Q140: 1 | R140: 1 | S140: 1 | T140: 1 | U140: 1 | W140: 1 | X140: 1 | Y140: 1 | AB140: Member | AC140: 1
A141: Bamslam | B141: 65 | C141: Venerable | D141: Troll | E141: YES | F141: 1 | G141: 1 | H141: 1 | I141: 1 | J141: 1 | K141: 1 | L141: 1 | M141: 1 | N141: 1 | O141: 1 | P141: 1 | Q141: 1 | R141: 1 | S141: 1 | T141: 1 | U141: 1 | X141: 1 | Y141: 1 | AA141: 1 | AB141: Officer | AC141: 1
A142: =HYPERLINK("http://www.magelo.com/eq_view_profile.html?num=627547","Blisk") -> Blisk | B142: 65 | C142: Baron | D142: Iksar | E142: YES | G142: 1 | H142: 1 | I142: 1 | AB142: Member | AC142: 1
A143: Bulvyne | B143: 65 | C143: Elder | D143: Barbarian | E143: YES | G143: 1 | H143: 1 | I143: 1 | Q143: 1 | R143: 1 | S143: 1 | T143: 1 | U143: 1 | X143: 1 | Y143: 1 | AA143: 1 | AB143: Member | AC143: 1
A144: Gart | B144: 65 | D144: Barbarian | E144: YES | H144: 1 | I144: 1 | J144: 1 | K144: 1 | L144: 1 | M144: 1 | N144: 1 | O144: 1 | P144: 1 | Q144: 1 | R144: 1 | S144: 1 | T144: 1 | U144: 1 | V144: 1 | W144: 1 | X144: 1 | Y144: 1 | AA144: 1 | AB144: Member | AC144: 1
A145: Kroze | B145: 65 | D145: Barbarian | E145: YES | H145: 1 | I145: 1 | AB145: Member | AC145: 1
A146: =HYPERLINK("http://www.magelo.com/eq_view_profile.html?num=183881","Naghite") -> Naghite | B146: 65 | C146: Elder | D146: Ogre | E146: YES | F146: 1 | G146: 1 | H146: 1 | I146: 1 | J146: 1 | K146: 1 | M146: 1 | N146: 1 | O146: 1 | P146: 1 | Q146: 1 | R146: 1 | S146: 1 | T146: 1 | U146: 1 | V146: 1 | W146: 1 | X146: 1 | Y146: 1 | AA146: 1 | AB146: Officer | AC146: 1
A147: =HYPERLINK("http://www.magelo.com/eq_view_profile.html?num=347641","Ruanu") -> Ruanu | B147: 65 | C147: Venerable | D147: Troll | E147: YES | F147: 1 | G147: 1 | H147: 1 | I147: 1 | S147: 1 | T147: 1 | U147: 1 | AB147: Member | AC147: 1
A148: =HYPERLINK("http://www.magelo.com/eq_view_profile.html?num=197796","Saramina") -> Saramina | B148: 65 | C148: Elder | D148: Barbarian | E148: YES | F148: 1 | G148: 1 | H148: 1 | I148: 1 | J148: 1 | K148: 1 | L148: 1 | M148: 1 | N148: 1 | O148: 1 | P148: 1 | Q148: 1 | R148: 1 | S148: 1 | T148: 1 | U148: 1 | W148: 1 | X148: 1 | Y148: 1 | AA148: 1 | AB148: Officer | AC148: 1
A149: =HYPERLINK("http://www.magelo.com/eq_view_profile.html?num=194845","Ulskun") -> Ulskun | B149: 65 | C149: Elder | D149: Barbarian | E149: YES | G149: 1 | H149: 1 | I149: 1 | J149: 1 | K149: 1 | M149: 1 | N149: 1 | O149: 1 | P149: 1 | Q149: 1 | R149: 1 | S149: 1 | T149: 1 | U149: 1 | W149: 1 | X149: 1 | Y149: 1 | AA149: 1 | AB149: Member | AC149: 1
A150: =HYPERLINK("http://www.magelo.com/eq_view_profile.html?num=412675","Walknot") -> Walknot | B150: 65 | D150: Ogre | E150: YES | H150: 1 | I150: 1 | J150: 1 | K150: 1 | M150: 1 | N150: 1 | O150: 1 | P150: 1 | Q150: 1 | R150: 1 | S150: 1 | T150: 1 | U150: 1 | V150: 1 | W150: 1 | X150: 1 | AB150: Member | AC150: 1
A151: =HYPERLINK("http://www.magelo.com/eq_view_profile.html?num=356943","Zurs") -> Zurs | B151: 65 | C151: Venerable | D151: Barbarian | E151: YES | F151: 1 | G151: 1 | H151: 1 | I151: 1 | AB151: Member | AC151: 1
A152: Indar | B152: 65 | D152: Barbarian | E152: YES | H152: 1 | I152: 1 | AB152: On Break
A153: Kikshaaz | B153: 55 | E153: NO | AB153: Alternate
A154: =HYPERLINK("http://www.magelo.com/eq_view_profile.html?num=341926","Oenone") -> Oenone | B154: 60 | C154: Venerable | D154: Troll | E154: YES | F154: X | AB154: Alternate
A155: Warriors
A156: =HYPERLINK("http://www.magelo.com/eq_view_profile.html?num=343105","Hearsay") -> Hearsay | B156: 65 | C156: Veteran | D156: Barbarian | E156: YES | F156: 1 | G156: 1 | H156: 1 | I156: 1 | J156: 1 | K156: 1 | L156: 1 | M156: 1 | N156: 1 | O156: 1 | P156: 1 | Q156: 1 | R156: 1 | S156: 1 | T156: 1 | U156: 1 | V156: 1 | W156: 1 | X156: 1 | Y156: 1 | AA156: 1 | AB156: Member | AC156: 1
A157: Kalmak | B157: 65 | C157: Veteran | D157: Ogre | E157: YES | H157: 1 | I157: 1 | AB157: Member | AC157: 1
A158: =HYPERLINK("http://www.magelo.com/eq_view_profile.html?num=641141","Kylliyn") -> Kylliyn | B158: 65 | C158: Veteran | D158: Dwarf | E158: NO | G158: 1 | H158: 1 | I158: 1 | J158: 1 | K158: 1 | M158: 1 | N158: 1 | O158: 1 | P158: 1 | Q158: 1 | R158: 1 | S158: 1 | T158: 1 | U158: 1 | V158: 1 | W158: 1 | X158: 1 | Y158: 1 | AA158: 1 | AB158: Member | AC158: 1
A159: =HYPERLINK("http://www.magelo.com/eq_view_profile.html?num=430840","Makyaded") -> Makyaded | B159: 65 | D159: Barbarian | E159: NO | H159: 1 | I159: 1 | J159: 1 | K159: 1 | M159: 1 | N159: 1 | P159: 1 | Q159: 1 | R159: 1 | S159: 1 | T159: 1 | U159: 1 | V159: 1 | W159: 1 | X159: 1 | Y159: 1 | AB159: Member | AC159: 1
A160: =HYPERLINK("http://www.magelo.com/eq_view_profile.html?num=599043","Matsu") -> Matsu | B160: 65 | C160: Veteran | D160: Halfling | E160: YES | F160: 1 | G160: 1 | H160: 1 | I160: 1 | J160: 1 | K160: 1 | L160: 1 | M160: 1 | N160: 1 | O160: 1 | P160: 1 | Q160: 1 | R160: 1 | S160: 1 | T160: 1 | U160: 1 | V160: 1 | W160: 1 | X160: 1 | Y160: 1 | AA160: 1 | AB160: Member | AC160: 1
A161: Panzona | B161: 65 | D161: Halfling | E161: NO | H161: 1 | I161: 1 | R161: 1 | S161: 1 | T161: 1 | AB161: Member | AC161: 1
A162: =HYPERLINK("http://www.magelo.com/eq_view_profile.html?num=265387","Sarelin") -> Sarelin | B162: 65 | C162: Marshall | D162: Barbarian | E162: NO | H162: 1 | I162: 1 | J162: 1 | K162: 1 | L162: 1 | M162: 1 | N162: 1 | P162: 1 | Q162: 1 | S162: 1 | T162: 1 | U162: 1 | V162: 1 | W162: 1 | X162: 1 | Y162: 1 | AB162: Member | AC162: 1
A163: Tugurok | B163: 65 | C163: Veteran | D163: Ogre | E163: YES | H163: 1 | I163: 1 | J163: 1 | K163: 1 | L163: 1 | M163: 1 | N163: 1 | O163: 1 | P163: 1 | Q163: 1 | R163: 1 | S163: 1 | T163: 1 | U163: 1 | V163: 1 | W163: 1 | X163: 1 | Y163: 1 | AA163: 1 | AB163: Member | AC163: 1
A164: =HYPERLINK("http://www.magelo.com/eq_view_profile.html?num=361707","Veera") -> Veera | B164: 55 | D164: Barbarian | E164: NO | AB164: Member | AC164: 1
A165: Caldok | B165: 65 | D165: Dwarf | E165: NO | G165: X | H165: X | I165: X | AB165: On Break
A166: =HYPERLINK("http://www.magelo.com/eq_view_profile.html?num=70247","Ghazhagh") -> Ghazhagh | B166: 65 | C166: Veteran | D166: Dwarf | E166: YES | G166: X | H166: X | I166: X | J166: x | K166: x | M166: x | O166: x | P166: x | T166: x | V166: x | X166: x | Y166: x | AB166: On Break
A167: =HYPERLINK("http://www.magelo.com/eq_view_profile.html?num=244458","Mouxxie") -> Mouxxie | B167: 65 | C167: Baroness | D167: Halfling | E167: NO | F167: X | G167: X | H167: X | AB167: On Break
A168: =HYPERLINK("http://www.magelo.com/eq_view_profile.html?num=98879","Silph") -> Silph | B168: 65 | C168: Marshall | D168: Human | E168: YES | F168: X | G168: X | AB168: On Break
A169: =HYPERLINK("http://www.magelo.com/eq_view_profile.html?num=357231","Feersum") -> Feersum | B169: 65 | D169: Barbarian | E169: NO | G169: X | H169: X | I169: X | AB169: Alternate
A170: Zeal | B170: 65 | D170: Ogre | E170: NO | R170: x | AB170: Alternate
B171: Levels | C171: Title | D171: Race | E171: Epic | F171: VP Key | G171: ST Key | H171: EMP Key | I171: VT Key | J171: PoJ Trials | K171: PoS Medals | L171: Agnarr | M171: PoN Hedge | N171: Teris Thule | O171: Saryn | P171: Aerin Dar | Q171: 3 Trials | R171: Mith Marr | S171: Grummus | T171: Carpin | U171: Bertolox | V171: PoI Dragon | W171: MB | X171: Talon Zek | Y171: Vallon Zek | Z171: RZTW | AA171: Sol Ro Tower | AB171: Status
A172: Wizards
A173: =HYPERLINK("http://www.magelo.com/eq_view_profile.html?num=202761","Aylith") -> Aylith | B173: 65 | C173: Mistress | D173: High Elf | E173: YES | F173: 1 | G173: 1 | H173: 1 | I173: 1 | J173: 1 | K173: 1 | L173: 1 | P173: 1 | Q173: 1 | R173: 1 | S173: 1 | T173: 1 | U173: 1 | V173: 1 | W173: 1 | X173: 1 | Y173: 1 | AB173: Member | AC173: 1
A174: Cacius | B174: 65 | D174: Dark Elf | E174: YES | H174: 1 | I174: 1 | R174: 1 | S174: 1 | T174: 1 | U174: 1 | AB174: Member | AC174: 1
A175: Glenwall | B175: 65 | D175: High Elf | E175: YES | H175: 1 | I175: 1 | AB175: Member | AC175: 1
A176: =HYPERLINK("http://www.magelo.com/eq_view_profile.html?num=360232","Kanah") -> Kanah | B176: 65 | C176: Sage | D176: Dark Elf | E176: YES | G176: 1 | H176: 1 | I176: 1 | J176: 1 | K176: 1 | L176: 1 | M176: 1 | N176: 1 | O176: 1 | P176: 1 | Q176: 1 | R176: 1 | S176: 1 | T176: 1 | U176: 1 | V176: 1 | W176: 1 | X176: 1 | Y176: 1 | AA176: 1 | AB176: Member | AC176: 1
A177: Momento | B177: 65 | D177: Erudite | E177: YES | AB177: Member | AC177: 1
A178: Rosewynde | B178: 62 | D178: High Elf | E178: YES | R178: 1 | X178: 1 | Y178: 1 | AB178: Member | AC178: 1
A179: =HYPERLINK("http://www.magelo.com/eq_view_profile.html?num=82670","Senspot") -> Senspot | B179: 65 | C179: Master | D179: Erudite | E179: YES | H179: 1 | I179: 1 | J179: 1 | K179: 1 | L179: 1 | M179: 1 | N179: 1 | O179: 1 | P179: 1 | Q179: 1 | R179: 1 | S179: 1 | T179: 1 | U179: 1 | W179: 1 | X179: 1 | Y179: 1 | AA179: 1 | AB179: Member | AC179: 1
A180: Soladena | B180: 65 | D180: Dark Elf | E180: YES | H180: 1 | I180: 1 | J180: 1 | K180: 1 | M180: 1 | S180: 1 | T180: 1 | U180: 1 | AB180: Member | AC180: 1
A181: Fairuza | B181: 62 | D181: Erudite | E181: YES | AB181: Officer - OB
A182: Zeanith | B182: 58 | D182: Dark Elf | E182: NO | AB182: On Break
A183: Aurillicus | B183: 65 | D183: High Elf | E183: NO | H183: X | I183: X | AB183: Alternate
A184: Kelben | B184: 61 | C184: Baron | D184: Human | E184: YES | AB184: Alternate
A185: Siobahn | B185: 64 | D185: Dark Elf | E185: YES | AB185: Alternate
A186: =HYPERLINK("http://www.magelo.com/eq_view_profile.html?num=791389","Ticktick") -> Ticktick | B186: 65 | C186: Master | D186: Froglock | E186: NO | H186: X | I186: X | AB186: Alternate
A187: # of Active Members | B187: =SUM(AC4:AC186) -> 105 | F187: =SUM(F4:F186)/B187*1 -> 0.27619047619047621 | G187: =SUM(G4:G186)/B187*1 -> 0.49523809523809526 | H187: =SUM(H4:H186)/B187*1 -> 0.81904761904761902 | I187: =SUM(I4:I186)/B187*1 -> 0.80952380952380953 | J187: =SUM(J4:J186)/B187*1 -> 0.73333333333333328 | K187: =SUM(K4:K186)/B187*1 -> 0.69523809523809521 | L187: =SUM(L4:L186)/B187*1 -> 0.41904761904761906 | M187: =SUM(M4:M186)/B187*1 -> 0.70476190476190481 | N187: =SUM(N4:N186)/$B$187*1 -> 0.69523809523809521 | O187: =SUM(O4:O186)/$B$187*1 -> 0.66666666666666663 | P187: =SUM(P4:P186)/$B$187*1 -> 0.68571428571428572 | Q187: =SUM(Q4:Q186)/$B$187*1 -> 0.69523809523809521 | R187: =SUM(R4:R186)/$B$187*1 -> 0.72380952380952379 | S187: =SUM(S4:S186)/$B$187*1 -> 00.8 | T187: =SUM(T4:T186)/$B$187*1 -> 00.8 | U187: =SUM(U4:U186)/$B$187*1 -> 0.75238095238095237 | V187: =SUM(V4:V186)/$B$187*1 -> 0.5714285714285714 | W187: =SUM(W4:W186)/$B$187*1 -> 0.7142857142857143 | X187: =SUM(X4:X186)/$B$187*1 -> 0.7142857142857143 | Y187: =SUM(Y4:Y186)/$B$187*1 -> 0.64761904761904765 | Z187: =SUM(Z4:Z186)/N187*1 -> 0 | AA187: =SUM(AA4:AA186)/$B$187*1 -> 0.580952380952381 | AB187: 37958
A188: Average Level | B188: =AVERAGE(B22:B39,B74:B76,B173:B181,B156:B168,B128:B136,B96:B105,B139:B151,B119:B126,B4:B13,B63:B69,B82:B85,B49:B59,B107:B116,B87:B90,B15:B19) -> 64.619402985074629
A190: PROSPECTS
A191: NAME | B191: Levels | C191: CLASS
A192: Tyrol | B192: 65 | C192: ROG
A193: Jysa | B193: 65 | C193: ENC
A194: Estimated | B194: 65 | C194: DRU
A195: Gryn | B195: 65 | C195: ENC
A196: Skybye | B196: 65 | C196: ENC
A197: Wyllo | B197: 65 | C197: PAL
A198: Shawm | B198: 63 | C198: BRD