A1: Name | B1: Effect | C1: Ranking | D1: AC | E1: STR | F1: STA | G1: AGI | H1: DEX | I1: WIS | J1: INT | K1: CHA | L1: HP | M1: MANA | N1: PR | O1: MR | P1: DR | Q1: FR | R1: CR | S1: WT | T1: WP | U1: Type
A2: A Chipped Opal Amulet | C2: =(I2*10)+M2+(D2*4)+G2+(L2/5)+(F2*2)+(E2*2)+(K2*2)+(O2/2)+(Q2/2)+(R2/2)+(N2/4)+(P2/4) -> 30.75 | D2: 3 | N2: 15 | O2: 15 | R2: 15 | S2: 00.1 | T2: =0-QUOTIENT(S2,5) -> 0 | U2: neck
A3: A Cracked Amulet | C3: =(I3*10)+M3+(D3*4)+G3+(L3/5)+(F3*2)+(E3*2)+(K3*2)+(O3/2)+(Q3/2)+(R3/2)+(N3/4)+(P3/4) -> 61 | D3: 4 | I3: 3 | M3: 15 | S3: 00.1 | U3: neck
A4: A Gypsy Medallion | C4: =(I4*10)+M4+(D4*4)+G4+(L4/5)+(F4*2)+(E4*2)+(K4*2)+(O4/2)+(Q4/2)+(R4/2)+(N4/4)+(P4/4) -> 28.5 | D4: 2 | K4: 9 | P4: 10 | S4: 00.1 | T4: =0-QUOTIENT(S4,5) -> 0 | U4: neck
A5: A Lucky Skunk Foot | C5: =(I5*10)+M5+(D5*4)+G5+(L5/5)+(F5*2)+(E5*2)+(K5*2)+(O5/2)+(Q5/2)+(R5/2)+(N5/4)+(P5/4) -> 30 | D5: 5 | N5: 5 | O5: 5 | P5: 5 | Q5: 5 | R5: 5 | S5: 00.1 | T5: =0-QUOTIENT(S5,5) -> 0 | U5: neck
A6: Alize Volew Medicine Bag | C6: =(I6*10)+M6+(D6*4)+G6+(L6/5)+(F6*2)+(E6*2)+(K6*2)+(O6/2)+(Q6/2)+(R6/2)+(N6/4)+(P6/4) -> 0.5 | D6: 0 | N6: 1 | P6: 1 | S6: 00.2 | T6: =0-QUOTIENT(S6,5) -> 0 | U6: neck
A7: Amcilla's Talisman | C7: =(I7*10)+M7+(D7*4)+G7+(L7/5)+(F7*2)+(E7*2)+(K7*2)+(O7/2)+(Q7/2)+(R7/2)+(N7/4)+(P7/4) -> 108 | D7: 5 | E7: 4 | F7: 4 | G7: 4 | H7: 4 | I7: 4 | J7: 4 | K7: 4 | L7: 10 | M7: 10 | N7: 4 | O7: 4 | P7: 4 | Q7: 4 | R7: 4 | S7: 0.5 | T7: =0-QUOTIENT(S7,5) -> 0 | U7: neck
A8: Amulet of Insight | C8: =(I8*10)+M8+(D8*4)+G8+(L8/5)+(F8*2)+(E8*2)+(K8*2)+(O8/2)+(Q8/2)+(R8/2)+(N8/4)+(P8/4) -> 73 | D8: 2 | E8: 3 | F8: 3 | I8: 3 | J8: 3 | K8: 3 | L8: 10 | M8: 10 | O8: 5 | R8: 5 | S8: 00.1 | T8: =0-QUOTIENT(S8,5) -> 0 | U8: neck
A9: Amulet of the Dreadgazer | B9: Truesight | C9: =(I9*10)+M9+(D9*4)+G9+(L9/5)+(F9*2)+(E9*2)+(K9*2)+(O9/2)+(Q9/2)+(R9/2)+(N9/4)+(P9/4)+30 -> 270 | D9: 15 | E9: 5 | F9: 5 | I9: 5 | J9: 5 | L9: 75 | M9: 75 | N9: 10 | O9: 10 | P9: 10 | Q9: 10 | R9: 10 | S9: 0 | T9: =0-QUOTIENT(S9,5) -> 0 | U9: neck
A10: Amulet of the Grey Wastes | B10: Enduring Breath | C10: =(I10*10)+M10+(D10*4)+G10+(L10/5)+(F10*2)+(E10*2)+(K10*2)+(O10/2)+(Q10/2)+(R10/2)+(N10/4)+(P10/4) -> 24 | D10: 0 | F10: 10 | O10: 4 | R10: 4 | S10: 00.1 | U10: neck
A11: Amulet of the Storm | C11: =(I11*10)+M11+(D11*4)+G11+(L11/5)+(F11*2)+(E11*2)+(K11*2)+(O11/2)+(Q11/2)+(R11/2)+(N11/4)+(P11/4) -> 117.5 | D11: 25 | N11: 10 | O11: 25 | P11: 10 | S11: 0 | T11: =0-QUOTIENT(S11,5) -> 0 | U11: neck
A12: An Elven Charm Necklace | C12: =(I12*10)+M12+(D12*4)+G12+(L12/5)+(F12*2)+(E12*2)+(K12*2)+(O12/2)+(Q12/2)+(R12/2)+(N12/4)+(P12/4) -> 6 | D12: 0 | K12: 3 | S12: 00.2 | T12: =0-QUOTIENT(S12,5) -> 0 | U12: neck
A13: Anti-Poison Amulet | C13: =(I13*10)+M13+(D13*4)+G13+(L13/5)+(F13*2)+(E13*2)+(K13*2)+(O13/2)+(Q13/2)+(R13/2)+(N13/4)+(P13/4) -> 3.75 | D13: 0 | N13: 15 | S13: 00.1 | T13: =0-QUOTIENT(S13,5) -> 0 | U13: neck
A14: Atpaev's Talisman | C14: =(I14*10)+M14+(D14*4)+G14+(L14/5)+(F14*2)+(E14*2)+(K14*2)+(O14/2)+(Q14/2)+(R14/2)+(N14/4)+(P14/4) -> 108 | D14: 5 | E14: 4 | F14: 4 | G14: 4 | H14: 4 | I14: 4 | J14: 4 | K14: 4 | L14: 10 | M14: 10 | N14: 4 | O14: 4 | P14: 4 | Q14: 4 | R14: 4 | S14: 0.5 | T14: =0-QUOTIENT(S14,5) -> 0 | U14: neck
A15: Aviak Charm | C15: =(I15*10)+M15+(D15*4)+G15+(L15/5)+(F15*2)+(E15*2)+(K15*2)+(O15/2)+(Q15/2)+(R15/2)+(N15/4)+(P15/4) -> 10.5 | D15: 0 | H15: 2 | I15: 1 | N15: 2 | S15: 00.1 | T15: =0-QUOTIENT(S15,5) -> 0 | U15: neck
A16: Ayillish's Talisman | C16: =(I16*10)+M16+(D16*4)+G16+(L16/5)+(F16*2)+(E16*2)+(K16*2)+(O16/2)+(Q16/2)+(R16/2)+(N16/4)+(P16/4) -> 178 | D16: 7 | E16: 6 | F16: 6 | G16: 6 | H16: 6 | I16: 6 | J16: 6 | K16: 6 | L16: 30 | M16: 30 | N16: 6 | O16: 6 | P16: 6 | Q16: 6 | R16: 6 | S16: 0.5 | T16: =0-QUOTIENT(S16,5) -> 0 | U16: neck
A17: Azibelle's Scarf of the Night | C17: =(I17*10)+M17+(D17*4)+G17+(L17/5)+(F17*2)+(E17*2)+(K17*2)+(O17/2)+(Q17/2)+(R17/2)+(N17/4)+(P17/4) -> 46 | D17: 5 | L17: 30 | N17: 10 | O17: 10 | P17: 10 | Q17: 10 | R17: 10 | S17: 00.1 | T17: =0-QUOTIENT(S17,5) -> 0 | U17: neck
A18: Beaded Slime Necklace | C18: =(I18*10)+M18+(D18*4)+G18+(L18/5)+(F18*2)+(E18*2)+(K18*2)+(O18/2)+(Q18/2)+(R18/2)+(N18/4)+(P18/4) -> 0 | D18: 0 | J18: 5 | S18: 00.2 | T18: =0-QUOTIENT(S18,5) -> 0 | U18: neck
A19: Beartooth Necklace | C19: =(I19*10)+M19+(D19*4)+G19+(L19/5)+(F19*2)+(E19*2)+(K19*2)+(O19/2)+(Q19/2)+(R19/2)+(N19/4)+(P19/4) -> 8 | D19: 0 | F19: 3 | L19: 10 | S19: 00.2 | T19: =0-QUOTIENT(S19,5) -> 0 | U19: neck
A20: Black Alloy Medallion | C20: =(I20*10)+M20+(D20*4)+G20+(L20/5)+(F20*2)+(E20*2)+(K20*2)+(O20/2)+(Q20/2)+(R20/2)+(N20/4)+(P20/4) -> 74 | D20: 6 | I20: 5 | J20: 5 | S20: 00.1 | T20: =0-QUOTIENT(S20,5) -> 0 | U20: neck
A21: Black Iron Medallion | C21: =(I21*10)+M21+(D21*4)+G21+(L21/5)+(F21*2)+(E21*2)+(K21*2)+(O21/2)+(Q21/2)+(R21/2)+(N21/4)+(P21/4) -> 30 | D21: 0 | I21: 3 | J21: 3 | S21: 00.1 | T21: =0-QUOTIENT(S21,5) -> 0 | U21: neck
A22: Black Pearl Electrum Choker | C22: =(I22*10)+M22+(D22*4)+G22+(L22/5)+(F22*2)+(E22*2)+(K22*2)+(O22/2)+(Q22/2)+(R22/2)+(N22/4)+(P22/4) -> 4 | D22: 0 | G22: 4 | H22: 4 | S22: 00.1 | T22: =0-QUOTIENT(S22,5) -> 0 | U22: neck
A23: Black Sapphire Platinum Necklace | C23: =(I23*10)+M23+(D23*4)+G23+(L23/5)+(F23*2)+(E23*2)+(K23*2)+(O23/2)+(Q23/2)+(R23/2)+(N23/4)+(P23/4) -> 66 | D23: 0 | L23: 55 | M23: 55 | S23: 0 | T23: =0-QUOTIENT(S23,5) -> 0 | U23: neck
A24: Black Sapphire Silver Necklace | C24: =(I24*10)+M24+(D24*4)+G24+(L24/5)+(F24*2)+(E24*2)+(K24*2)+(O24/2)+(Q24/2)+(R24/2)+(N24/4)+(P24/4) -> 30 | D24: 0 | L24: 25 | M24: 25 | S24: 00.1 | T24: =0-QUOTIENT(S24,5) -> 0 | U24: neck
A25: Black Sapphire Velium Necklace | C25: =(I25*10)+M25+(D25*4)+G25+(L25/5)+(F25*2)+(E25*2)+(K25*2)+(O25/2)+(Q25/2)+(R25/2)+(N25/4)+(P25/4) -> 78 | D25: 0 | L25: 65 | M25: 65 | S25: 00.1 | T25: =0-QUOTIENT(S25,5) -> 0 | U25: neck
A26: Bloodshrine Necklace | B26: Greater Healing | C26: =(I26*10)+M26+(D26*4)+G26+(L26/5)+(F26*2)+(E26*2)+(K26*2)+(O26/2)+(Q26/2)+(R26/2)+(N26/4)+(P26/4)+30 -> 60 | D26: 5 | L26: 50 | S26: 0.5 | T26: =0-QUOTIENT(S26,5) -> 0 | U26: neck
A27: Bloodstar Pendant | C27: =(I27*10)+M27+(D27*4)+G27+(L27/5)+(F27*2)+(E27*2)+(K27*2)+(O27/2)+(Q27/2)+(R27/2)+(N27/4)+(P27/4) -> 156 | D27: 5 | E27: 9 | I27: 9 | J27: 9 | K27: 9 | N27: 5 | O27: 5 | P27: 5 | Q27: 5 | R27: 5 | S27: 00.1 | T27: =0-QUOTIENT(S27,5) -> 0 | U27: neck
A28: Bloodtribe Fetish | C28: =(I28*10)+M28+(D28*4)+G28+(L28/5)+(F28*2)+(E28*2)+(K28*2)+(O28/2)+(Q28/2)+(R28/2)+(N28/4)+(P28/4) -> 98 | D28: 2 | I28: 8 | M28: 10 | S28: 0 | U28: neck
A29: Blue Wicker Gorget | C29: =(I29*10)+M29+(D29*4)+G29+(L29/5)+(F29*2)+(E29*2)+(K29*2)+(O29/2)+(Q29/2)+(R29/2)+(N29/4)+(P29/4) -> 16 | D29: 4 | S29: 00.8 | T29: =0-QUOTIENT(S29,5) -> 0 | U29: neck
A30: Bone Amulet of Blade Turning | B30: Guard | C30: =(I30*10)+M30+(D30*4)+G30+(L30/5)+(F30*2)+(E30*2)+(K30*2)+(O30/2)+(Q30/2)+(R30/2)+(N30/4)+(P30/4)+30 -> 108 | D30: 2 | I30: 6 | M30: 10 | S30: 00.1 | T30: =0-QUOTIENT(S30,5) -> 0 | U30: neck
A31: Bone Collar of the Possessed | C31: =(I31*10)+M31+(D31*4)+G31+(L31/5)+(F31*2)+(E31*2)+(K31*2)+(O31/2)+(Q31/2)+(R31/2)+(N31/4)+(P31/4) -> 60 | D31: 0 | E31: 3 | F31: 3 | I31: 3 | J31: 3 | K31: 3 | L31: 10 | M31: 10 | S31: 2 | U31: neck
A32: Bratavar's Talisman | C32: =(I32*10)+M32+(D32*4)+G32+(L32/5)+(F32*2)+(E32*2)+(K32*2)+(O32/2)+(Q32/2)+(R32/2)+(N32/4)+(P32/4) -> 108 | D32: 5 | E32: 4 | F32: 4 | G32: 4 | H32: 4 | I32: 4 | J32: 4 | K32: 4 | L32: 10 | M32: 10 | N32: 4 | O32: 4 | P32: 4 | Q32: 4 | R32: 4 | S32: 0.5 | T32: =0-QUOTIENT(S32,5) -> 0 | U32: neck
A33: Brooch of Sw'Vaye | C33: =(I33*10)+M33+(D33*4)+G33+(L33/5)+(F33*2)+(E33*2)+(K33*2)+(O33/2)+(Q33/2)+(R33/2)+(N33/4)+(P33/4) -> 8 | D33: 1 | K33: 2 | S33: 0 | T33: =0-QUOTIENT(S33,5) -> 0 | U33: neck
A34: Bufa's Talisman | C34: =(I34*10)+M34+(D34*4)+G34+(L34/5)+(F34*2)+(E34*2)+(K34*2)+(O34/2)+(Q34/2)+(R34/2)+(N34/4)+(P34/4) -> 108 | D34: 5 | E34: 4 | F34: 4 | G34: 4 | H34: 4 | I34: 4 | J34: 4 | K34: 4 | L34: 10 | M34: 10 | N34: 4 | O34: 4 | P34: 4 | Q34: 4 | R34: 4 | S34: 0.5 | T34: =0-QUOTIENT(S34,5) -> 0 | U34: neck
A35: Burynai Hide Choker | C35: =(I35*10)+M35+(D35*4)+G35+(L35/5)+(F35*2)+(E35*2)+(K35*2)+(O35/2)+(Q35/2)+(R35/2)+(N35/4)+(P35/4) -> 18 | D35: 4 | G35: 2 | J35: 2 | S35: 0.5 | T35: =0-QUOTIENT(S35,5) -> 0 | U35: neck
A36: Burynaibane Charm | C36: =(I36*10)+M36+(D36*4)+G36+(L36/5)+(F36*2)+(E36*2)+(K36*2)+(O36/2)+(Q36/2)+(R36/2)+(N36/4)+(P36/4) -> 9 | D36: 2 | N36: 2 | P36: 2 | S36: 00.1 | T36: =0-QUOTIENT(S36,5) -> 0 | U36: neck
A37: Cape of Midnight Mist | C37: =(I37*10)+M37+(D37*4)+G37+(L37/5)+(F37*2)+(E37*2)+(K37*2)+(O37/2)+(Q37/2)+(R37/2)+(N37/4)+(P37/4) -> 21.5 | D37: 2 | E37: 5 | O37: 7 | S37: 00.1 | T37: =0-QUOTIENT(S37,5) -> 0 | U37: neck
A38: Cargalia's Talisman | C38: =(I38*10)+M38+(D38*4)+G38+(L38/5)+(F38*2)+(E38*2)+(K38*2)+(O38/2)+(Q38/2)+(R38/2)+(N38/4)+(P38/4) -> 108 | D38: 5 | E38: 4 | F38: 4 | G38: 4 | H38: 4 | I38: 4 | J38: 4 | K38: 4 | L38: 10 | M38: 10 | N38: 4 | O38: 4 | P38: 4 | Q38: 4 | R38: 4 | S38: 0.5 | T38: =0-QUOTIENT(S38,5) -> 0 | U38: neck
A39: Chancellor's Medal | C39: =(I39*10)+M39+(D39*4)+G39+(L39/5)+(F39*2)+(E39*2)+(K39*2)+(O39/2)+(Q39/2)+(R39/2)+(N39/4)+(P39/4) -> 97 | D39: 6 | E39: 4 | F39: 4 | G39: 4 | H39: 4 | I39: 4 | J39: 4 | K39: 4 | N39: 10 | P39: 10 | S39: 00.1 | U39: neck
A40: Cheetah Paw Fetish | C40: =(I40*10)+M40+(D40*4)+G40+(L40/5)+(F40*2)+(E40*2)+(K40*2)+(O40/2)+(Q40/2)+(R40/2)+(N40/4)+(P40/4) -> 46 | D40: 0 | I40: 3 | J40: 3 | K40: 2 | L40: 10 | M40: 10 | S40: 0 | U40: neck
A41: Chipped Bone Collar | C41: =(I41*10)+M41+(D41*4)+G41+(L41/5)+(F41*2)+(E41*2)+(K41*2)+(O41/2)+(Q41/2)+(R41/2)+(N41/4)+(P41/4) -> 28 | D41: 4 | L41: 10 | M41: 10 | S41: 2 | T41: =0-QUOTIENT(S41,5) -> 0 | U41: neck
A42: Chipped Velium Amulet | C42: =(I42*10)+M42+(D42*4)+G42+(L42/5)+(F42*2)+(E42*2)+(K42*2)+(O42/2)+(Q42/2)+(R42/2)+(N42/4)+(P42/4) -> 30 | D42: 4 | E42: 4 | L42: 30 | S42: 00.1 | T42: =0-QUOTIENT(S42,5) -> 0 | U42: neck
A43: Choker of Majdd | B43: See Invisible | C43: =(I43*10)+M43+(D43*4)+G43+(L43/5)+(F43*2)+(E43*2)+(K43*2)+(O43/2)+(Q43/2)+(R43/2)+(N43/4)+(P43/4)+30 -> 46 | D43: 4 | J43: 5 | S43: 00.1 | T43: =0-QUOTIENT(S43,5) -> 0 | U43: neck
A44: Choker of the Overseer | C44: =(I44*10)+M44+(D44*4)+G44+(L44/5)+(F44*2)+(E44*2)+(K44*2)+(O44/2)+(Q44/2)+(R44/2)+(N44/4)+(P44/4) -> 31.75 | D44: 5 | G44: 5 | H44: 5 | L44: 15 | N44: 5 | Q44: 5 | S44: 3 | U44: neck
A45: Choker of the Wretched | B45: Flowing Thought I | C45: =(I45*10)+M45+(D45*4)+G45+(L45/5)+(F45*2)+(E45*2)+(K45*2)+(O45/2)+(Q45/2)+(R45/2)+(N45/4)+(P45/4)+30 -> 222 | D45: 8 | F45: 8 | I45: 8 | J45: 8 | K45: 8 | L45: 40 | M45: 40 | S45: 00.1 | T45: =0-QUOTIENT(S45,5) -> 0 | U45: neck
A46: Chrysoberyl Talisman | C46: =(I46*10)+M46+(D46*4)+G46+(L46/5)+(F46*2)+(E46*2)+(K46*2)+(O46/2)+(Q46/2)+(R46/2)+(N46/4)+(P46/4) -> 70 | D46: 5 | I46: 3 | M46: 20 | S46: 1 | T46: =0-QUOTIENT(S46,5) -> 0 | U46: neck
A47: Cloth Choker | C47: =(I47*10)+M47+(D47*4)+G47+(L47/5)+(F47*2)+(E47*2)+(K47*2)+(O47/2)+(Q47/2)+(R47/2)+(N47/4)+(P47/4) -> 4 | D47: 1 | S47: 00.2 | T47: =0-QUOTIENT(S47,5) -> 0 | U47: neck
A48: Cobalt Drake Gorget | C48: =(I48*10)+M48+(D48*4)+G48+(L48/5)+(F48*2)+(E48*2)+(K48*2)+(O48/2)+(Q48/2)+(R48/2)+(N48/4)+(P48/4) -> 45 | D48: 7 | F48: 5 | M48: 5 | R48: 4 | S48: 0.5 | T48: =0-QUOTIENT(S48,5) -> 0 | U48: neck
A49: Collar of Tavuel Xakreum | B49: Flowing Thought II | C49: =(I49*10)+M49+(D49*4)+G49+(L49/5)+(F49*2)+(E49*2)+(K49*2)+(O49/2)+(Q49/2)+(R49/2)+(N49/4)+(P49/4) -> 269.5 | D49: 10 | I49: 20 | J49: 20 | L49: 60 | O49: 20 | Q49: 15 | S49: 00.1 | U49: neck
A50: Collar of Undead Protection | C50: =(I50*10)+M50+(D50*4)+G50+(L50/5)+(F50*2)+(E50*2)+(K50*2)+(O50/2)+(Q50/2)+(R50/2)+(N50/4)+(P50/4) -> 23.5 | D50: 5 | N50: 7 | P50: 7 | S50: 00.2 | T50: =0-QUOTIENT(S50,5) -> 0 | U50: neck