A1: Cleric Magelo Listing with Stats
A3: This list of Magelo Profiles was complied over the week of June 17, 2002, in order to have some comparison on different stats. While much of the information will (has) become outdated all of the magelo profiles should remain unchanged. Please excuse the poor HTML on some of the pages. Microsoft Excell was used to sort and produce totals of each of the data sets, if the page does not display properly please re-load the page (possibly more then once), which usually corrects the formatting errors. Note that profiles that do not include HP/AC/Mana totals are not included in the average totals due to the incorrect AC information that would skew averages.
A5: Update 6/25/02: Added more profiles (and will continue to do so), but the sub-pages will not be updated quite as often and will be done on a long but regular pace.
A7: Update 6/26/02: Added more profiles (260 total) and started the poccess of re inputing Deity, Resists, Flowing Though, and Regen into the data.
A9: Update 6/28/02: Finished the inputing of Deity, Resists, Flowing Though, and Regen into the data. Please note that the sub sortings have yet to be updated.
A11: Update 7/8/02: Added a few more profiles.
A13: Update 8/15/02: Added a few more profiles and recompiled the stats. Please note to a error on my part that the Weighted Stats only appear on that specific page
A15: In attempts to balance the totals a weighted total is used. This formula was used in attempts to balance each of the statistical categories. The formula is as follows…..
A17: (HP/2)+(AC/1)+(MANA/3.5)+(RESISTS/0.37)+(FT/0.003)+(REGEN/0.001)
A19: Sort by...
A21: Name
A22: Level (Including Averages)
A23: Race
A24: Deity
A25: Server
A26: Hit Points
A27: AC
A28: Mana
A29: Flowing Though
A30: Regen
A31: Stat Totals
A32: Weighted Total
A34: Yamile
A35: Appotus Dominus
A36: Vazaelle
A38: Name | B38: Level | C38: Race | D38: Deity | E38: Server | F38: Hit Points | G38: AC | H38: Mana | I38: Resists | J38: FT | K38: Regen | L38: Total
A40: Sendari | B40: 20 | C40: Human | D40: Karana | E40: Quellious | F40: 407 | G40: 167 | H40: 526 | I40: 149 | J40: 0 | K40: 0 | L40: =SUM(F40:K40) -> 1249
A41: Trastus | B41: 19 | C41: Human | D41: Rodcet Nife | E41: Innoruuk | F41: 441 | G41: 310 | H41: 874 | I41: 172 | J41: 0 | K41: 0 | L41: =SUM(F41:K41) -> 1797
A42: Thotam | B42: 20 | C42: Dark Elf | D42: Innoruuk | E42: Antonius Bayle | F42: 447 | G42: 290 | H42: 606 | I42: 117 | J42: 0 | K42: 0 | L42: =SUM(F42:K42) -> 1460
A43: Maeladin | B43: 25 | C43: Dark Elf | D43: Innoruuk | E43: Solusek Ro | F43: 504 | G43: 151 | H43: 1063 | I43: 146 | J43: 0 | K43: 0 | L43: =SUM(F43:K43) -> 1864
A44: Tyrina | B44: 32 | C44: High Elf | D44: Tunare | E44: Morell-Thule | F44: 622 | G44: x | H44: 1358 | I44: 155 | J44: 0 | K44: 0
A45: Immunu | B45: 31 | C45: Erudite | D45: Prexus | E45: Xegony | F45: 624 | G45: x | H45: 1396 | I45: 143 | J45: 0 | K45: 0
A46: Jawn | B46: 32 | C46: Halfling | D46: Bristlebane | E46: Saryn | F46: 666 | G46: x | H46: 1561 | I46: 119 | J46: 0 | K46: 0
A47: Kinnopio | B47: 27 | C47: Erudite | D47: Quellious | E47: Tribunal | F47: 683 | G47: 188 | H47: 811 | I47: 153 | J47: 0 | K47: 0 | L47: =SUM(F47:K47) -> 1835
A48: Rawnlissa | B48: 30 | C48: Human | D48: Erollisi Marr | E48: Seventh Hammer | F48: 709 | G48: 401 | H48: 1115 | I48: 137 | J48: 0 | K48: 0 | L48: =SUM(F48:K48) -> 2362
A49: Gvelz | B49: 36 | C49: Dwarf | D49: Brell Serilis | E49: Druzzil Ro | F49: 799 | G49: x | H49: 1256 | I49: 131 | J49: 0 | K49: 0
A50: Velma | B50: 40 | C50: Dwarf | D50: Brell Serilis | E50: Fennin Ro | F50: 835 | G50: 728 | H50: 1695 | I50: 177 | J50: 0 | K50: 0 | L50: =SUM(F50:K50) -> 3435
A51: Durley | B51: 40 | C51: Halfling | D51: Bristlebane | E51: Antonius Bayle | F51: 839 | G51: 745 | H51: 1702 | I51: 163 | J51: 0 | K51: 0 | L51: =SUM(F51:K51) -> 3449
A52: Alerias | B52: 44 | C52: High Elf | D52: Karana | E52: Luclin | F52: 854 | G52: 0 | H52: 1594 | I52: 140 | J52: 0 | K52: 0 | L52: =SUM(F52:K52) -> 2588
A53: Bartel | B53: 41 | C53: Dwarf | D53: Brell Serilis | E53: Vazaelle | F53: 856 | G53: 785 | H53: 1650 | I53: 176 | J53: 0 | K53: 0 | L53: =SUM(F53:K53) -> 3467
A54: Ancarett | B54: 44 | C54: High Elf | D54: Tunare | E54: Veeshan | F54: 867 | G54: 663 | H54: 2039 | I54: 211 | J54: 0 | K54: 0 | L54: =SUM(F54:K54) -> 3780
A55: Ikeren | B55: 43 | C55: Erudite | D55: Quellious | E55: Antonius Bayle | F55: 887 | G55: 632 | H55: 1708 | I55: 155 | J55: 0 | K55: 0 | L55: =SUM(F55:K55) -> 3382
A56: Pomaikai | B56: 45 | C56: High Elf | D56: Tunare | E56: Zebuxoruk | F56: 891 | G56: 665 | H56: 2104 | I56: 120 | J56: 0 | K56: 0 | L56: =SUM(F56:K56) -> 3780
A57: Leilei | B57: 48 | C57: High Elf | D57: Tunare | E57: Nameless | F57: 930 | G57: 632 | H57: 1740 | I57: 125 | J57: 0 | K57: 0 | L57: =SUM(F57:K57) -> 3427
A58: Fenlayen | B58: 46 | C58: High Elf | D58: Tunare | E58: Erollisi Marr | F58: 932 | G58: 598 | H58: 1862 | I58: 140 | J58: 0 | K58: 0 | L58: =SUM(F58:K58) -> 3532
A59: Kerowen | B59: 47 | C59: High Elf | D59: Tunare | E59: Drinal | F59: 933 | G59: 641 | H59: 2111 | I59: 175 | J59: 0 | K59: 0 | L59: =SUM(F59:K59) -> 3860
A60: Seamund | B60: 46 | C60: Dwarf | D60: Brell Serilis | E60: Morell-Thule | F60: 937 | G60: x | H60: 1914 | I60: 130 | J60: 0 | K60: 0
A61: Expiere | B61: 41 | C61: Dark Elf | D61: Innoruuk | E61: Prexus | F61: 942 | G61: 854 | H61: 1813 | I61: 150 | J61: 0 | K61: 0 | L61: =SUM(F61:K61) -> 3759
A62: Piikaa | B62: 46 | C62: Dwarf | D62: Brell Serilis | E62: Bertoxxulous | F62: 943 | G62: 763 | H62: 2011 | I62: 164 | J62: 0 | K62: 0 | L62: =SUM(F62:K62) -> 3881
A63: Grogs | B63: 46 | C63: Dwarf | D63: Brell Serilis | E63: Tarew Marr | F63: 952 | G63: 748 | H63: 1784 | I63: 169 | J63: 0 | K63: 0 | L63: =SUM(F63:K63) -> 3653
A64: Serenya | B64: 42 | C64: Dwarf | D64: Brell Serilis | E64: Tribunal | F64: 961 | G64: 763 | H64: 1710 | I64: 148 | J64: 0 | K64: 0 | L64: =SUM(F64:K64) -> 3582
A65: Nhyomee | B65: 46 | C65: High Elf | D65: Tunare | E65: Solusek Ro | F65: 971 | G65: x | H65: 2053 | I65: 150 | J65: 0 | K65: 0
A66: Woosh | B66: 49 | C66: Erudite | D66: Prexus | E66: Kane Bayle | F66: 984 | G66: x | H66: 1730 | I66: 128 | J66: 0 | K66: 0
A67: Boulvi | B67: 52 | C67: High Elf | D67: Tunare | E67: Povar | F67: 994 | G67: x | H67: 2477 | I67: 169 | J67: 0 | K67: 0
A68: Dyvin | B68: 52 | C68: Dark Elf | D68: Innoruuk | E68: Terris-Thule | F68: 994 | G68: 741 | H68: 2341 | I68: 138 | J68: 0 | K68: 0 | L68: =SUM(F68:K68) -> 4214
A69: Dynarik | B69: 51 | C69: High Elf | D69: Tunare | E69: E'ci | F69: 996 | G69: x | H69: 2328 | I69: 183 | J69: 0 | K69: 0
A70: Kimbera | B70: 52 | C70: Human | D70: Mithaniel Marr | E70: Povar | F70: 1000 | G70: x | H70: 2222 | I70: 127 | J70: 0 | K70: 0
A71: Zandilar | B71: 49 | C71: Human | D71: Erollisi Marr | E71: Erollisi Marr | F71: 1011 | G71: 531 | H71: 1863 | I71: 137 | J71: 0 | K71: 0 | L71: =SUM(F71:K71) -> 3542
A72: Lithele | B72: 51 | C72: Human | D72: Rodcet Nife | E72: Antonius Bayle | F72: 1019 | G72: 773 | H72: 2273 | I72: 164 | J72: 0 | K72: 0 | L72: =SUM(F72:K72) -> 4229
A73: Jalaran | B73: 55 | C73: High Elf | D73: Tunare | E73: Mithaniel Marr | F73: 1022 | G73: 565 | H73: 2387 | I73: 151 | J73: 0 | K73: 0 | L73: =SUM(F73:K73) -> 4125
A74: Arolily | B74: 52 | C74: High Elf | D74: Tunare | E74: Morell-Thulle | F74: 1026 | G74: 625 | H74: 2325 | I74: 161 | J74: 0 | K74: 0 | L74: =SUM(F74:K74) -> 4137
A75: Aaelandri | B75: 39 | C75: Dark Elf | D75: Innoruuk | E75: Tribunal | F75: 1029 | G75: 822 | H75: 1685 | I75: 135 | J75: 0 | K75: 0 | L75: =SUM(F75:K75) -> 3671
A76: Sylphiel | B76: 46 | C76: Human | D76: Karana | E76: Fennin Ro | F76: 1036 | G76: 470 | H76: 1805 | I76: 161 | J76: 0 | K76: 0 | L76: =SUM(F76:K76) -> 3472
A77: Ayenya | B77: 52 | C77: High Elf | D77: Tunare | E77: Xegony | F77: 1045 | G77: 830 | H77: 2262 | I77: 198 | J77: 0 | K77: 0 | L77: =SUM(F77:K77) -> 4335
A78: Nayeedah | B78: 51 | C78: Human | D78: Rodcet Nife | E78: Vazaelle | F78: 1049 | G78: x | H78: 2223 | I78: 133 | J78: 0 | K78: 0
A79: Sublym | B79: 51 | C79: Dark Elf | D79: Innoruuk | E79: Kane Bayle | F79: 1053 | G79: 627 | H79: 2048 | I79: 130 | J79: 0 | K79: 0 | L79: =SUM(F79:K79) -> 3858
A80: Agmyleez | B80: 52 | C80: Erudite | D80: Cazic Thule | E80: Karana | F80: 1055 | G80: 652 | H80: 2314 | I80: 164 | J80: 0 | K80: 0 | L80: =SUM(F80:K80) -> 4185
A81: Nyvn | B81: 51 | C81: Dwarf | D81: Brell Serilis | E81: Ayonae Ro | F81: 1055 | G81: 769 | H81: 2374 | I81: 166 | J81: 0 | K81: 0 | L81: =SUM(F81:K81) -> 4364
A82: Javara | B82: 52 | C82: High Elf | D82: Tunare | E82: Brell Serilis | F82: 1059 | G82: 728 | H82: 2191 | I82: 160 | J82: 0 | K82: 0 | L82: =SUM(F82:K82) -> 4138
A83: Etumaru | B83: 52 | C83: Erudite | E83: Erollisi Marr | F83: 1060 | G83: 776 | H83: 2278
A84: Camien | B84: 53 | C84: Dark Elf | D84: Innoruuk | E84: Erollisi Marr | F84: 1083 | G84: 775 | H84: 2491 | I84: 200 | J84: 0 | K84: 0 | L84: =SUM(F84:K84) -> 4549
A85: Fhylden | B85: 54 | C85: Halfling | D85: Bristlebane | E85: Ayonae Ro | F85: 1086 | G85: 782 | H85: 2370 | I85: 192 | J85: 0 | K85: 0 | L85: =SUM(F85:K85) -> 4430
A86: Fattima | B86: 51 | C86: Dwarf | D86: Breel Serilis | E86: Innoruuk | F86: 1087 | G86: 632 | H86: 2142 | I86: 165 | J86: 0 | K86: 0 | L86: =SUM(F86:K86) -> 4026
A87: Quotison | B87: 51 | C87: Dwarf | D87: Brell Serilis | E87: Tarew Marr | F87: 1095 | G87: 580 | H87: 2070 | I87: 154 | J87: 0 | K87: 0 | L87: =SUM(F87:K87) -> 3899
A88: Johrena | B88: 54 | C88: Halfling | D88: Bristlebane | E88: Torvonnilous | F88: 1106 | G88: 540 | H88: 2816 | I88: 270 | J88: 0 | K88: 0 | L88: =SUM(F88:K88) -> 4732
A89: Bombidil | B89: 52 | C89: Dwarf | D89: Brell Serilis | E89: Terris-Thule | F89: 1108 | G89: 585 | H89: 2355 | I89: 153 | J89: 0 | K89: 0 | L89: =SUM(F89:K89) -> 4201
A90: Sindaria | B90: 53 | C90: Dark Elf | D90: Innoruuk | E90: Antonius Bayle | F90: 1113 | G90: x | H90: 2340 | I90: 233 | J90: 0 | K90: 0
A91: Bezil | B91: 54 | C91: Dwarf | D91: Brell Serilis | E91: Rathe | F91: 1123 | G91: 791 | H91: 2448 | I91: 210 | J91: 0 | K91: 0 | L91: =SUM(F91:K91) -> 4572
A92: Halthek | B92: 53 | C92: Dwarf | D92: Brell Serilis | E92: Mithaniel Marr | F92: 1125 | G92: 679 | H92: 2193 | I92: 149 | J92: 0 | K92: 0 | L92: =SUM(F92:K92) -> 4146
A93: Daerv | B93: 54 | C93: Human | D93: Erollisi Marr | E93: Vazaelle | F93: 1126 | G93: 681 | H93: 2464 | I93: 219 | J93: 1 | K93: 0 | L93: =SUM(F93:K93) -> 4491
A94: Lerman | B94: 54 | C94: High Elf | D94: Tunare | E94: Seventh Hammer | F94: 1126 | G94: 784 | H94: 2386 | I94: 283 | J94: 0 | K94: 0 | L94: =SUM(F94:K94) -> 4579
A95: Bindol | B95: 53 | C95: Dwarf | D95: Brell Serilis | E95: Solusek Ro | F95: 1145 | G95: 777 | H95: 2618 | I95: 158 | J95: 0 | K95: 0 | L95: =SUM(F95:K95) -> 4698
A96: Atlin | B96: 51 | C96: Dwarf | D96: Brell Serills | E96: Cazic-Thule | F96: 1155 | G96: 816 | H96: 2278 | I96: 204 | J96: 0 | K96: 0 | L96: =SUM(F96:K96) -> 4453
A97: Omzen | B97: 53 | C97: Erudite | D97: Cazuc Thule | E97: Xegony | F97: 1155 | G97: 876 | H97: 2374 | I97: 200 | J97: 0 | K97: 0 | L97: =SUM(F97:K97) -> 4605
A98: Keyal | B98: 53 | C98: Dark Elf | D98: Innoruuk | E98: Xegony | F98: 1162 | G98: x | H98: 2426 | I98: 181 | J98: 0 | K98: 0
A99: Cartmean | B99: 59 | C99: High Elf | D99: Tunare | E99: Quesllious | F99: 1166 | G99: 809 | H99: 2642 | I99: 172 | J99: 0 | K99: 0 | L99: =SUM(F99:K99) -> 4789
A100: Tofe | B100: 56 | C100: Dwarf | D100: Brell Serilis | E100: Antonius Bayle | F100: 1179 | G100: 859 | H100: 2446 | I100: 212 | J100: 0 | K100: 0 | L100: =SUM(F100:K100) -> 4696
A101: Chrisking | B101: 53 | C101: Dwarf | D101: Brell Serilis | E101: Morell-Thule | F101: 1182 | G101: 693 | H101: 2556 | I101: 227 | J101: 1 | K101: 0 | L101: =SUM(F101:K101) -> 4659
A102: Skwar | B102: 52 | C102: Halfling | D102: Bristlebane | E102: Xev | F102: 1188 | G102: 660 | H102: 2508 | I102: 221 | J102: 0 | K102: 0 | L102: =SUM(F102:K102) -> 4577
A103: Micherick | B103: 57 | C103: Human | D103: Mithaniel Marr | E103: Rathe | F103: 1191 | G103: 723 | H103: 2524 | I103: 164 | J103: 0 | K103: 0 | L103: =SUM(F103:K103) -> 4602
A104: Grundersoltec | B104: 56 | C104: Halfling | D104: Bristlebane | E104: Tholuxe Paells | F104: 1196 | G104: 922 | H104: 2662 | I104: 230 | J104: 0 | K104: 0 | L104: =SUM(F104:K104) -> 5010
A105: Ycarus | B105: 54 | C105: Halfling | D105: Bristlebane | E105: E'cil | F105: 1203 | G105: 863 | H105: 2419 | I105: 230 | J105: 0 | K105: 0 | L105: =SUM(F105:K105) -> 4715
A106: Yumanea | B106: 54 | C106: High Elf | D106: Tunare | E106: Erollisi Marr | F106: 1203 | G106: 741 | H106: 2340 | I106: 193 | J106: 0 | K106: 0 | L106: =SUM(F106:K106) -> 4477
A107: Miette | B107: 53 | C107: High Elf | D107: Tunare | E107: Tholuxe Paells | F107: 1216 | G107: 789 | H107: 2497 | I107: 183 | J107: 0 | K107: 0 | L107: =SUM(F107:K107) -> 4685
A108: Nrewfin | B108: 55 | C108: Dwarf | D108: Brell Serilis | E108: Seventh Hammer | F108: 1219 | G108: 710 | H108: 2068 | I108: 407 | J108: 0 | K108: 0 | L108: =SUM(F108:K108) -> 4404
A109: Erline | B109: 60 | C109: High Elf | D109: Tunare | E109: Vazaelle | F109: 1243 | G109: 727 | H109: 2981 | I109: 169 | J109: 0 | K109: 3 | L109: =SUM(F109:K109) -> 5123
A110: Aean | B110: 53 | C110: Human | D110: Mithaniel Marr | E110: Xegony | F110: 1254 | G110: 899 | H110: 2473 | I110: 195 | J110: 0 | K110: 0 | L110: =SUM(F110:K110) -> 4821
A111: Balanar | B111: 56 | C111: Dwarf | D111: Brell Serilis | E111: Tunare | F111: 1254 | G111: 745 | H111: 2520 | I111: 201 | J111: 0 | K111: 0 | L111: =SUM(F111:K111) -> 4720
A112: Ladile | B112: 58 | C112: Human | D112: Erollisi Marr | E112: Solusek Ro | F112: 1256 | G112: 866 | H112: 2814 | I112: 235 | J112: 0 | K112: 0 | L112: =SUM(F112:K112) -> 5171
A113: Ragnon | B113: 58 | C113: High Elf | D113: Tunare | E113: Morell-Thule | F113: 1267 | G113: 814 | H113: 2813 | I113: 187 | J113: 0 | K113: 0 | L113: =SUM(F113:K113) -> 5081
A114: Mooni | B114: 60 | C114: Halfling | D114: Bristlebane | E114: Rodcet Nife | F114: 1274 | G114: x | H114: 2962 | I114: 269 | J114: 0 | K114: 0
A115: Jessamyn | B115: 55 | C115: Dwarf | D115: Brell Serilis | E115: Tholuxe Paells | F115: 1285 | G115: 777 | H115: 2610 | I115: 209 | J115: 0 | K115: 0 | L115: =SUM(F115:K115) -> 4881
A116: Altheia | B116: 55 | C116: Dark Elf | D116: Innoruuk | E116: Vazaelle | F116: 1307 | G116: 847 | H116: 2782 | I116: 203 | J116: 1 | K116: 0 | L116: =SUM(F116:K116) -> 5140
A117: Ejkas | B117: 60 | C117: High Elf | D117: Tunare | E117: Solusek Ro | F117: 1341 | G117: 880 | H117: 2993 | I117: 226 | J117: 2 | K117: 1 | L117: =SUM(F117:K117) -> 5443
A118: Qutie | B118: 57 | C118: Human | D118: Erollisi Marr | E118: Tarew Marr | F118: 1342 | G118: 727 | H118: 2901 | I118: 210 | J118: 0 | K118: 1 | L118: =SUM(F118:K118) -> 5181
A119: Lazarelle | B119: 60 | C119: High Elf | D119: Tunare | E119: Vazaelle | F119: 1351 | G119: 1130 | H119: 2911 | I119: 376 | J119: 0 | K119: 0 | L119: =SUM(F119:K119) -> 5768
A120: Naxy | B120: 57 | C120: Human | D120: Karana | E120: Bristlebane | F120: 1351 | G120: 895 | H120: 2736 | I120: 174 | J120: 0 | K120: 0 | L120: =SUM(F120:K120) -> 5156
A121: Cedelia | B121: 56 | C121: High Elf | D121: Tunare | E121: Vazaelle | F121: 1366 | G121: 801 | H121: 3228 | I121: 228 | J121: 1 | K121: 0 | L121: =SUM(F121:K121) -> 5624
A122: Leiren | B122: 58 | C122: Human | D122: Mithaniel Marr | E122: Tarew Marr | F122: 1372 | G122: 839 | H122: 2720 | I122: 163 | J122: 0 | K122: 0 | L122: =SUM(F122:K122) -> 5094
A123: Daymondd | B123: 56 | C123: Dwarf | D123: Mithaniel Marr | E123: Mithaniel Marr | F123: 1383 | G123: 940 | H123: 2753 | I123: 216 | J123: 0 | K123: 0 | L123: =SUM(F123:K123) -> 5292
A124: Kaysha | B124: 55 | C124: Human | D124: Erolisi Marr | E124: Lanys T'Vyl | F124: 1391 | G124: 828 | H124: 2954 | I124: 247 | J124: 0 | K124: 0 | L124: =SUM(F124:K124) -> 5420
A125: Laithia | B125: 60 | C125: High Elf | D125: Tunare | E125: Innoruuk | F125: 1393 | G125: 998 | H125: 3069 | I125: 323 | J125: 0 | K125: 0 | L125: =SUM(F125:K125) -> 5783
A126: Mirixia | B126: 56 | C126: Dark Elf | D126: Innoruuk | E126: Vallon Zek | F126: 1408 | G126: 869 | H126: 2828 | I126: 382 | J126: 1 | K126: 0 | L126: =SUM(F126:K126) -> 5488
A127: Dakin | B127: 55 | C127: Dwarf | D127: Brell Serilis | E127: Innoruuk | F127: 1413 | G127: 877 | H127: 2534 | I127: 201 | J127: 0 | K127: 0 | L127: =SUM(F127:K127) -> 5025
A128: Yueana | B128: 57 | C128: High Elf | D128: Tunare | E128: Quellious | F128: 1422 | G128: 947 | H128: 2932 | I128: 201 | J128: 0 | K128: 0 | L128: =SUM(F128:K128) -> 5502
A129: Meadbh | B129: 60 | C129: Dark Elf | D129: Innoruuk | E129: Innoruuk | F129: 1431 | G129: 1031 | H129: 3205 | I129: 272 | J129: 0 | K129: 1 | L129: =SUM(F129:K129) -> 5940
A130: Gragner | B130: 57 | C130: Dwarf | D130: Brell Serilis | E130: Test | F130: 1445 | G130: 866 | H130: 2850 | I130: 328 | J130: 0 | K130: 0 | L130: =SUM(F130:K130) -> 5489
A131: Lorelai | B131: 53 | C131: High Elf | D131: Tunare | E131: Quellious | F131: 1451 | G131: 844 | H131: 2753 | I131: 268 | J131: 0 | K131: 0 | L131: =SUM(F131:K131) -> 5316
A132: Aeler | B132: 54 | C132: Dark Elf | D132: Innoruuk | E132: Nameless | F132: 1455 | G132: 959 | H132: 2974 | I132: 217 | J132: 0 | K132: 1 | L132: =SUM(F132:K132) -> 5606
A133: Ariene | B133: 60 | C133: High Elf | D133: Tunare | E133: Bristlebane | F133: 1468 | G133: 838 | H133: 3304 | I133: 312 | J133: 0 | K133: 0 | L133: =SUM(F133:K133) -> 5922
A134: Sinafein | B134: 57 | C134: Dwarf | D134: Brell Serilis | E134: Morell-Thule | F134: 1474 | G134: 868 | H134: 3051 | I134: 302 | J134: 3 | K134: 0 | L134: =SUM(F134:K134) -> 5698
A135: Lifeheart | B135: 60 | C135: Dark Elf | D135: Innoruuk | E135: Povar | F135: 1492 | G135: 937 | H135: 3021 | I135: 277 | J135: 0 | K135: 0 | L135: =SUM(F135:K135) -> 5727
A136: Cland | B136: 60 | C136: Dwarf | D136: Brell Serilis | E136: Rallos Zek | F136: 1493 | G136: 1290 | H136: 3162 | I136: 373 | J136: 2 | K136: 3 | L136: =SUM(F136:K136) -> 6323
A137: Amojoman | B137: 60 | C137: Dark Elf | D137: Innoruuk | E137: Tribunal | F137: 1503 | G137: 983 | H137: 3106 | I137: 276 | J137: 1 | K137: 1 | L137: =SUM(F137:K137) -> 5870
A138: Yirkin | B138: 60 | C138: Dwarf | D138: Brell Serilis | E138: Povar | F138: 1503 | G138: 985 | H138: 3051 | I138: 238 | J138: 0 | K138: 0 | L138: =SUM(F138:K138) -> 5777
A139: Electrae | B139: 60 | C139: High Elf | D139: Tunare | E139: Drinal | F139: 1505 | G139: 941 | H139: 3211 | I139: 488 | J139: 0 | K139: 3 | L139: =SUM(F139:K139) -> 6148
A140: Drekken | B140: 60 | C140: Human | D140: Mithaniel Marr | E140: Vazaelle | F140: 1515 | G140: 990 | H140: 3116 | I140: 307 | J140: 2 | K140: 0 | L140: =SUM(F140:K140) -> 5930
A141: Zardnok | B141: 59 | C141: High Elf | D141: Tunare | E141: Druzzil Ro | F141: 1518 | G141: 976 | H141: 2942 | I141: 422 | J141: 0 | K141: 0 | L141: =SUM(F141:K141) -> 5858
A142: Bigg | B142: 60 | C142: High Elf | D142: Tunare | E142: Innoruuk | F142: 1533 | G142: 940 | H142: 3129 | I142: 298 | J142: 0 | K142: 0 | L142: =SUM(F142:K142) -> 5900
A143: Binadint | B143: 60 | C143: Dwarf | D143: Brell Serilis | E143: Solusek Ro | F143: 1601 | G143: 1013 | H143: 3009 | I143: 323 | J143: 0 | K143: 2 | L143: =SUM(F143:K143) -> 5948
A144: Miquel | B144: 60 | C144: Dwarf | D144: Brell Serilis | E144: Terris-Thule | F144: 1612 | G144: 887 | H144: 3063 | I144: 310 | J144: 0 | K144: 0 | L144: =SUM(F144:K144) -> 5872
A145: Indelron | B145: 59 | C145: Human | D145: Mithaniel Marr | E145: Tribunal | F145: 1614 | G145: 827 | H145: 3109 | I145: 302 | J145: 3 | K145: 0 | L145: =SUM(F145:K145) -> 5855
A146: Trynnity | B146: 60 | C146: Dark Elf | D146: Innoruuk | E146: Fennin Ro | F146: 1617 | G146: 853 | H146: 3326 | I146: 258 | J146: 0 | K146: 0 | L146: =SUM(F146:K146) -> 6054
A147: Morrun | B147: 60 | C147: Halfling | D147: Bristlebane | E147: Cazic-Thule | F147: 1618 | G147: 944 | H147: 2988 | I147: 247 | J147: 0 | K147: 3 | L147: =SUM(F147:K147) -> 5800
A148: Aalamdara | B148: 58 | C148: High Elf | D148: Tunare | E148: Solusek Ro | F148: 1623 | G148: 963 | H148: 3202 | I148: 432 | J148: 0 | K148: 0 | L148: =SUM(F148:K148) -> 6220
A149: Minkee | B149: 60 | C149: Dark Elf | D149: Innoruuk | E149: Morell-Thule | F149: 1626 | G149: x | H149: 3039 | I149: 385 | J149: 3 | K149: 0
A150: Sadar | B150: 60 | C150: High Elf | D150: Tunare | E150: Seventh Hammer | F150: 1632 | G150: 964 | H150: 3116 | I150: 361 | J150: 1 | K150: 0 | L150: =SUM(F150:K150) -> 6074
A151: Tekara | B151: 60 | C151: Erudite | D151: Cazic Thule | E151: Cazic-Thule | F151: 1634 | G151: 904 | H151: 3360 | I151: 291 | J151: 1 | K151: 0 | L151: =SUM(F151:K151) -> 6190
A152: Confuzzed | B152: 60 | C152: High Elf | D152: Tunare | E152: Quellious | F152: 1636 | G152: 955 | H152: 3444 | I152: 360 | J152: 0 | K152: 0 | L152: =SUM(F152:K152) -> 6395
A153: Mathilda | B153: 60 | C153: Halfing | D153: Bristelbane | E153: Test | F153: 1638 | G153: 972 | H153: 3470 | I153: 380 | J153: 0 | K153: 0 | L153: =SUM(F153:K153) -> 6460
A154: Affinity | B154: 60 | C154: High Elf | D154: Tunare | E154: Rodcet Nife | F154: 1639 | G154: 1020 | H154: 3373 | I154: 388 | J154: 2 | K154: 0 | L154: =SUM(F154:K154) -> 6422
A155: Battas | B155: 60 | C155: Halfling | D155: Bristlebane | E155: Vazaelle | F155: 1639 | G155: 1010 | H155: 2973 | I155: 334 | J155: 0 | K155: 3 | L155: =SUM(F155:K155) -> 5959
A156: Windeliane | B156: 60 | C156: High Elf | D156: Tunare | E156: Terris-Thule | F156: 1645 | G156: 958 | H156: 3230 | I156: 251 | J156: 0 | K156: 3 | L156: =SUM(F156:K156) -> 6087
A157: Cryogenic | B157: 57 | C157: High Elf | D157: Tunare | E157: Antonius Bayle | F157: 1652 | G157: 750 | H157: 3228 | I157: 347 | J157: 0 | K157: 0 | L157: =SUM(F157:K157) -> 5977
A158: Tanilin | B158: 60 | C158: Erudite | D158: Quellious | E158: Rallos Zek | F158: 1660 | G158: 875 | H158: 3094 | I158: 316 | J158: 1 | K158: 0 | L158: =SUM(F158:K158) -> 5946
A159: Gorthe | B159: 58 | C159: Dwarf | D159: Brell Serilis | E159: Innoruuk | F159: 1679 | G159: 932 | H159: 3385 | I159: 399 | J159: 1 | K159: 0 | L159: =SUM(F159:K159) -> 6396
A160: Malf | B160: 56 | C160: Dwarf | D160: Brell Serilis | E160: Torvonnilous | F160: 1679 | G160: 981 | H160: 2854 | I160: 306 | J160: 0 | K160: 0 | L160: =SUM(F160:K160) -> 5820
A161: Callandre | B161: 60 | C161: High Elf | D161: Tunare | E161: Quesllious | F161: 1684 | G161: 864 | H161: 3463 | I161: 344 | J161: 1 | K161: 3 | L161: =SUM(F161:K161) -> 6359
A162: Lylliae | B162: 58 | C162: High Elf | D162: Tunare | E162: Vazaelle | F162: 1688 | G162: 976 | H162: 2952 | I162: 405 | J162: 0 | K162: 0 | L162: =SUM(F162:K162) -> 6021
A163: Magada | B163: 59 | C163: High Elf | D163: Tunare | E163: Drinal | F163: 1705 | G163: x | H163: 3555 | I163: 443 | J163: 3 | K163: 0
A164: Dianna | B164: 60 | C164: Halfling | D164: Bristelbane | E164: Vazaelle | F164: 1712 | G164: 1034 | H164: 3405 | I164: 385 | J164: 2 | K164: 0 | L164: =SUM(F164:K164) -> 6538
A165: Balamor | B165: 60 | C165: Dwarf | D165: Brell Serilis | E165: Fennin Ro | F165: 1722 | G165: 932 | H165: 3432 | I165: 300 | J165: 6 | K165: 0 | L165: =SUM(F165:K165) -> 6392
A166: Marri | B166: 58 | C166: High Elf | D166: Tunare | E166: Innoruuk | F166: 1722 | G166: 1008 | H166: 3345 | I166: 412 | J166: 1 | K166: 0 | L166: =SUM(F166:K166) -> 6488
A167: Faena | B167: 59 | C167: High Elf | D167: Tunare | E167: Solusek Ro | F167: 1723 | G167: x | H167: 3191 | I167: 354 | J167: 0 | K167: 0
A168: Elrin | B168: 60 | C168: Human | D168: Mithaniel Marr | E168: Terris-Thule | F168: 1731 | G168: 1081 | H168: 3337 | I168: 338 | J168: 0 | K168: 0 | L168: =SUM(F168:K168) -> 6487
A169: Trixxey | B169: 60 | C169: Erudite | D169: Prexus | E169: Xev | F169: 1733 | G169: 851 | H169: 3413 | I169: 228 | J169: 0 | K169: 0 | L169: =SUM(F169:K169) -> 6225
A170: Panteroo | B170: 60 | C170: High Elf | D170: Tunare | E170: Fennin Ro | F170: 1735 | G170: 982 | H170: 3225 | I170: 321 | J170: 2 | K170: 3 | L170: =SUM(F170:K170) -> 6268
A171: Adarii | B171: 60 | C171: Dark Elf | D171: Innoruuk | E171: Vazaelle | F171: 1741 | G171: 1051 | H171: 3545 | I171: 329 | J171: 2 | K171: 0 | L171: =SUM(F171:K171) -> 6668
A172: Treage | B172: 60 | C172: High Elf | D172: Tunare | E172: Erollisi Marr | F172: 1742 | G172: 1044 | H172: 3344 | I172: 260 | J172: 0 | K172: 0 | L172: =SUM(F172:K172) -> 6390
A173: Letha | B173: 60 | C173: High Elf | D173: Tunare | E173: Vazaelle | F173: 1748 | G173: 1029 | H173: 3460 | I173: 420 | J173: 2 | K173: 0 | L173: =SUM(F173:K173) -> 6659
A174: Haels | B174: 60 | C174: Dwarf | D174: Brell Serilis | E174: Vazaelle | F174: 1752 | G174: 893 | H174: 3228 | I174: 332 | J174: 0 | K174: 2 | L174: =SUM(F174:K174) -> 6207
A175: Kjia | B175: 57 | C175: Gnome | D175: Bristlebane | E175: Antonius Bayle | F175: 1752 | G175: 1005 | H175: 3037 | I175: 242 | J175: 0 | K175: 0 | L175: =SUM(F175:K175) -> 6036
A176: Hippocrat | B176: 60 | C176: Halfling | D176: Bristlebane | E176: Vazaelle | F176: 1754 | G176: 1012 | H176: 3157 | I176: 496 | J176: 1 | K176: 0 | L176: =SUM(F176:K176) -> 6420
A177: Sherazade | B177: 60 | C177: High Elf | D177: Tunare | E177: Prexus | F177: 1754 | G177: 1064 | H177: 3490 | I177: 446 | J177: 3 | K177: 0 | L177: =SUM(F177:K177) -> 6757
A178: Mathiddae | B178: 60 | C178: High Elf | D178: Tunare | E178: Vazaelle | F178: 1758 | G178: 948 | H178: 3443 | I178: 514 | J178: 1 | K178: 1 | L178: =SUM(F178:K178) -> 6665
A179: Yari | B179: 60 | C179: High Elf | D179: Tunare | E179: Karana | F179: 1766 | G179: 1099 | H179: 3314 | I179: 508 | J179: 0 | K179: 0 | L179: =SUM(F179:K179) -> 6687
A180: Eriond | B180: 60 | C180: Dwarf | D180: Brell Serilis | E180: Antonius Bayle | F180: 1770 | G180: 869 | H180: 3305 | I180: 345 | J180: 0 | K180: 0 | L180: =SUM(F180:K180) -> 6289
A181: Torlan | B181: 60 | C181: High Elf | D181: Tunare | E181: Vazaelle | F181: 1772 | G181: 1011 | H181: 3196
A182: Kornaena | B182: 60 | C182: Dark Elf | D182: Innoruuk | E182: Mithaniel Marr | F182: 1779 | G182: 1005 | H182: 3460 | I182: 356 | J182: 3 | K182: 2 | L182: =SUM(F182:K182) -> 6605
A183: Cyzia | B183: 60 | C183: High Elf | D183: Tunare | E183: Cazic-Thule | F183: 1783 | G183: 1000 | H183: 3500 | I183: 494 | J183: 3 | K183: 1 | L183: =SUM(F183:K183) -> 6781
A184: Dalur | B184: 60 | C184: Dwarf | D184: Brell Serilis | E184: Veeshan | F184: 1783 | G184: 1043 | H184: 3118 | I184: 288 | J184: 1 | K184: 3 | L184: =SUM(F184:K184) -> 6236
A185: Sutiea | B185: 60 | C185: High Elf | D185: Tunare | E185: Nameless | F185: 1785 | G185: 977 | H185: 3393 | I185: 295 | J185: 0 | K185: 2 | L185: =SUM(F185:K185) -> 6452
A186: Higar | B186: 56 | C186: Dwarf | D186: Brell Serilis | E186: Drinal | F186: 1790 | G186: 893 | H186: 3259 | I186: 413 | J186: 2 | K186: 0 | L186: =SUM(F186:K186) -> 6357
A187: Phalia | B187: 60 | C187: Dwarf | D187: Brell Serilis | E187: Xegony | F187: 1797 | G187: 946 | H187: 3353 | I187: 285 | J187: 0 | K187: 0 | L187: =SUM(F187:K187) -> 6381
A188: Kellithe | B188: 59 | C188: Dwarf | D188: Brell Serilis | E188: Cazic-Thule | F188: 1802 | G188: 1033 | H188: 3212 | I188: 367 | J188: 0 | K188: 0 | L188: =SUM(F188:K188) -> 6414
A189: Yamile | B189: 60 | C189: High Elf | D189: Tunare | E189: Vazaelle | F189: 1806 | G189: 1000 | H189: 3586 | I189: 380 | J189: 6 | K189: 0 | L189: =SUM(F189:K189) -> 6778
A190: Fethos | B190: 60 | C190: Human | D190: Mithaniel Marr | E190: Tholuxe Paells | F190: 1809 | G190: 1063 | H190: 3517 | I190: 425 | J190: 2 | K190: 0 | L190: =SUM(F190:K190) -> 6816
A191: Luminar | B191: 60 | C191: Erudite | D191: Quelious | E191: Saryrn | F191: 1822 | G191: 975 | H191: 3224 | I191: 313 | J191: 0 | K191: 0 | L191: =SUM(F191:K191) -> 6334
A192: Badany | B192: 58 | C192: Human | D192: Rodcet Nife | E192: Zebuxoruk | F192: 1824 | G192: 972 | H192: 3232 | I192: 301 | J192: 0 | K192: 0 | L192: =SUM(F192:K192) -> 6329
A193: Loral | B193: 60 | C193: High Elf | D193: Tunare | E193: Quellious | F193: 1825 | G193: 1020 | H193: 3645 | I193: 318 | J193: 1 | K193: 0 | L193: =SUM(F193:K193) -> 6809
A194: Charitey | B194: 60 | C194: Gnome | D194: Brell Serilis | E194: Morell-Thule | F194: 1828 | G194: 1035 | H194: 3438 | I194: 470 | J194: 4 | K194: 0 | L194: =SUM(F194:K194) -> 6775
A195: Mystykal | B195: 60 | C195: Human | D195: Rodcet Nife | E195: Zebuxoruk | F195: 1831 | G195: x | H195: 3272 | I195: 340 | J195: 5 | K195: 3
A196: Calimayrn | B196: 60 | C196: High Elf | D196: Tunare | E196: Veeshan | F196: 1833 | G196: 1097 | H196: 3219 | I196: 340 | J196: 0 | K196: 0 | L196: =SUM(F196:K196) -> 6489
A197: Huneyy | B197: 60 | C197: High Elf | D197: Tunare | E197: Antonius Bayle | F197: 1835 | G197: 1043 | H197: 3815 | I197: 339 | J197: 9 | K197: 3 | L197: =SUM(F197:K197) -> 7044
A198: Dorim | B198: 60 | C198: Dwarf | D198: Brell Serilis | E198: Innoruuk | F198: 1836 | G198: 900 | H198: 3272 | I198: 293 | J198: 0 | K198: 0 | L198: =SUM(F198:K198) -> 6301
A199: Nottall | B199: 60 | C199: Dwarf | D199: Brell Serilis | E199: Povar | F199: 1843 | G199: x | H199: 3500 | I199: 373 | J199: 0 | K199: 0
A200: Daryaen | B200: 60 | C200: High Elf | D200: Tunare | E200: Tunare | F200: 1850 | G200: 939 | H200: 3505 | I200: 332 | J200: 1 | K200: 0 | L200: =SUM(F200:K200) -> 6627
A201: Rosieana | B201: 60 | C201: High Elf | D201: Karana | E201: Karana | F201: 1853 | G201: 1137 | H201: 3645 | I201: 513 | J201: 1 | K201: 3 | L201: =SUM(F201:K201) -> 7152
A202: Luminent | B202: 60 | C202: High Elf | D202: Tunare | E202: Antonius Bayle | F202: 1864 | G202: 1105 | H202: 3565 | I202: 518 | J202: 5 | K202: 4 | L202: =SUM(F202:K202) -> 7061
A203: Gravewalker | B203: 60 | C203: Halfling | D203: Bristlebane | E203: Solusek Ro | F203: 1869 | G203: 992 | H203: 3700 | I203: 326 | J203: 3 | K203: 3 | L203: =SUM(F203:K203) -> 6893
A204: Lilcure | B204: 60 | C204: Halfling | D204: Bristlebane | E204: Cazic-Thule | F204: 1880 | G204: 1064 | H204: 3516 | I204: 364 | J204: 4 | K204: 3 | L204: =SUM(F204:K204) -> 6831
A205: Benaa | B205: 60 | C205: Dark Elf | D205: Innoruuk | E205: Mithaniel Marr | F205: 1884 | G205: 973 | H205: 3550 | I205: 411 | J205: 0 | K205: 3 | L205: =SUM(F205:K205) -> 6821
A206: Bertil | B206: 59 | C206: Dwarf | D206: Brell Serilis | E206: Xegony | F206: 1890 | G206: 1002 | H206: 3432 | I206: 379 | J206: 0 | K206: 0 | L206: =SUM(F206:K206) -> 6703
A207: Qamen | B207: 60 | C207: High Elf | D207: Tunare | E207: Fennin Ro | F207: 1890 | G207: 1049 | H207: 3681 | I207: 391 | J207: 1 | K207: 0 | L207: =SUM(F207:K207) -> 7012
A208: Noryaka | B208: 60 | C208: Dark Elf | D208: Innoruuk | E208: Innoruuk | F208: 1891 | G208: 1112 | H208: 3675 | I208: 385 | J208: 2 | K208: 0 | L208: =SUM(F208:K208) -> 7065
A209: Chaldaea | B209: 60 | C209: Erudite | D209: Quellious | E209: Bertoxxulous | F209: 1892 | G209: x | H209: 3610 | I209: 394 | J209: 1 | K209: 3
A210: Laresa | B210: 60 | C210: High Elf | D210: Tunare | E210: Tarew Marr | F210: 1901 | G210: x | H210: 3840 | I210: 389 | J210: 6 | K210: 0
A211: Taleus | B211: 60 | C211: High Elf | D211: Tunare | E211: Prexus | F211: 1909 | G211: 960 | H211: 3371 | I211: 245 | J211: 2 | K211: 3 | L211: =SUM(F211:K211) -> 6490
A212: Noraseas | B212: 60 | C212: Dark Elf | D212: Innoruuk | E212: Prexus | F212: 1932 | G212: 1070 | H212: 3710 | I212: 522 | J212: 1 | K212: 0 | L212: =SUM(F212:K212) -> 7235
A213: Teclis | B213: 60 | C213: High Elf | D213: Tunare | E213: Rathe | F213: 1934 | G213: 1087 | H213: 3570 | I213: 466 | J213: 0 | K213: 3 | L213: =SUM(F213:K213) -> 7060
A214: Thordoff | B214: 59 | C214: Dwarf | D214: Brell Serilis | E214: Druzzil Ro | F214: 1934 | G214: 1045 | H214: 3553 | I214: 390 | J214: 1 | K214: 0 | L214: =SUM(F214:K214) -> 6923
A215: Yizenthia | B215: 60 | C215: Erudite | D215: Quellious | E215: Tribunal | F215: 1934 | G215: 915 | H215: 3462 | I215: 269 | J215: 1 | K215: 3 | L215: =SUM(F215:K215) -> 6584
A216: Spawrhawk | B216: 60 | C216: Dwarf | D216: Brell Serilis | E216: Fennin Ro | F216: 1945 | G216: 1110 | H216: 3404 | I216: 524 | J216: 0 | K216: 0 | L216: =SUM(F216:K216) -> 6983
A217: Leesa | B217: 60 | C217: High Elf | D217: Tunare | E217: Rathe | F217: 1957 | G217: 1055 | H217: 3705 | I217: 526 | J217: 7 | K217: 0 | L217: =SUM(F217:K217) -> 7250
A218: Grumbles | B218: 60 | C218: Dwarf | D218: Brell Serilis | E218: Drinal | F218: 1961 | G218: 953 | H218: 3615 | I218: 389 | J218: 0 | K218: 0 | L218: =SUM(F218:K218) -> 6918
A219: Auroria | B219: 60 | C219: High Elf | D219: Tunare | E219: Mithaniel Marr | F219: 1970 | G219: 1076 | H219: 3825 | I219: 331 | J219: 2 | K219: 0 | L219: =SUM(F219:K219) -> 7204
A220: Litermin | B220: 60 | C220: Halfling | D220: Bristlebane | E220: Erollisi Marr | F220: 1984 | G220: 1050 | H220: 3770 | I220: 524 | J220: 2 | K220: 0 | L220: =SUM(F220:K220) -> 7330
A221: Tietan | B221: 60 | C221: High Elf | D221: Tunare | E221: Zebuxxoruk | F221: 1993 | G221: 1011 | H221: 3586 | I221: 335 | J221: 2 | K221: 0 | L221: =SUM(F221:K221) -> 6927
A222: Ladimor | B222: 60 | C222: High Elf | D222: Tunare | E222: Bristlebane | F222: 1994 | G222: 995 | H222: 3527 | I222: 588 | J222: 2 | K222: 5 | L222: =SUM(F222:K222) -> 7111
A223: Elronde | B223: 60 | C223: Human | D223: Karana | E223: Seventh Hammer | F223: 1995 | G223: 1055 | H223: 3810 | I223: 423 | J223: 3 | K223: 0 | L223: =SUM(F223:K223) -> 7286
A224: Saela | B224: 60 | C224: Dwarf | D224: Brell Serilis | E224: Drinal | F224: 1995 | G224: 1042 | H224: 3555 | I224: 379 | J224: 2 | K224: 3 | L224: =SUM(F224:K224) -> 6976
A225: Mowang | B225: 60 | C225: Dark Elf | D225: Innoruuk | E225: Luclin | F225: 2002 | G225: 1227 | H225: 3898 | I225: 402 | J225: 2 | K225: 1 | L225: =SUM(F225:K225) -> 7532
A226: Tappsek | B226: 60 | C226: Dwarf | D226: Brell Serilis | E226: Innoruuk | F226: 2010 | G226: 1068 | H226: 3568 | I226: 362 | J226: 2 | K226: 0 | L226: =SUM(F226:K226) -> 7010
A227: Kendal | B227: 60 | C227: High Elf | D227: Tunare | E227: Morell-Thule | F227: 2013 | G227: 1020 | H227: 3795 | I227: 416 | J227: 5 | K227: 0 | L227: =SUM(F227:K227) -> 7249
A228: Caliopy | B228: 60 | C228: Dark Elf | D228: Innoruuk | E228: Innoruuk | F228: 2014 | G228: 1080 | H228: 3623 | I228: 357 | J228: 2 | K228: 0 | L228: =SUM(F228:K228) -> 7076
A229: Jubal | B229: 60 | C229: High Elf | D229: Tunare | E229: Torvonnilous | F229: 2017 | G229: 1099 | H229: 3910 | I229: 430 | J229: 5 | K229: 5 | L229: =SUM(F229:K229) -> 7466
A230: Rommy | B230: 60 | C230: Dark Elf | D230: Innoruuk | E230: Povar | F230: 2033 | G230: 1002 | H230: 3453 | I230: 436 | J230: 1 | K230: 0 | L230: =SUM(F230:K230) -> 6925
A231: Treiz | B231: 60 | C231: High Elf | D231: Tunare | E231: Drinal | F231: 2035 | G231: 1016 | H231: 3740 | I231: 440 | J231: 1 | K231: 0 | L231: =SUM(F231:K231) -> 7232
A232: Cayleu | B232: 60 | C232: High Elf | D232: Tunare | E232: Luclin | F232: 2036 | G232: 1111 | H232: 3775 | I232: 490 | J232: 3 | K232: 5 | L232: =SUM(F232:K232) -> 7420
A233: Barazon | B233: 60 | C233: Dwarf | D233: Brell Serilis | E233: Vazaelle | F233: 2037 | G233: 1159 | H233: 3518 | I233: 448 | J233: 8 | K233: 0 | L233: =SUM(F233:K233) -> 7170
A234: Maribella | B234: 60 | C234: High Elf | D234: Tunare | E234: Test | F234: 2041 | G234: 1068 | H234: 3990 | I234: 506 | J234: 4 | K234: 3 | L234: =SUM(F234:K234) -> 7612
A235: Glorund | B235: 60 | C235: Dwarf | D235: Brell Serilis | E235: Prexus | F235: 2043 | G235: 1067 | H235: 3855 | I235: 519 | J235: 8 | K235: 0 | L235: =SUM(F235:K235) -> 7492
A236: Nasren | B236: 60 | C236: Gnome | D236: Bristlebane | E236: Brell Serilis | F236: 2043 | G236: 1111 | H236: 3925 | I236: 655 | J236: 8 | K236: 3 | L236: =SUM(F236:K236) -> 7745
A237: Allden | B237: 60 | C237: Dark Elf | D237: Innoruuk | E237: Test | F237: 2048 | G237: 1063 | H237: 3965 | I237: 518 | J237: 4 | K237: 3 | L237: =SUM(F237:K237) -> 7601
A238: Torriana | B238: 60 | C238: High Elf | D238: Tunare | E238: Brell Serilis | F238: 2065 | G238: 878 | H238: 3945 | I238: 455 | J238: 3 | K238: 0 | L238: =SUM(F238:K238) -> 7346
A239: Aiyre | B239: 60 | C239: High Elf | D239: Tunare | E239: Druzzil Ro | F239: 2071 | G239: 1072 | H239: 3820 | I239: 518 | J239: 8 | K239: 3 | L239: =SUM(F239:K239) -> 7492
A240: Lyranna | B240: 60 | C240: Human | D240: Mithaniel Marr | E240: Tunare | F240: 2073 | G240: 991 | H240: 3630 | I240: 386 | J240: 5 | K240: 2 | L240: =SUM(F240:K240) -> 7087
A241: Ruloe | B241: 60 | C241: Dwarf | D241: Brell Serilis | E241: Bristlebane | F241: 2073 | G241: 961 | H241: 3720 | I241: 363 | J241: 5 | K241: 0 | L241: =SUM(F241:K241) -> 7122
A242: Thorgrimm | B242: 60 | C242: Dwarf | D242: Brell Serilis | E242: Antonius Bayle | F242: 2094 | G242: 1099 | H242: 3910 | I242: 438 | J242: 8 | K242: 0 | L242: =SUM(F242:K242) -> 7549
A243: Lanfeare | B243: 60 | C243: Dwarf | D243: Brell Serilis | E243: Stormhammer | F243: 2098 | G243: 1131 | H243: 3910 | I243: 468 | J243: 6 | K243: 2 | L243: =SUM(F243:K243) -> 7615
A244: Areina | B244: 60 | C244: Dark Elf | D244: Innoruuk | E244: Mithaniel Marr | F244: 2100 | G244: 1038 | H244: 3612 | I244: 449 | J244: 11 | K244: 3 | L244: =SUM(F244:K244) -> 7213
A245: Reymi | B245: 60 | C245: High Elf | D245: Tunare | E245: Vallon Zek | F245: 2103 | G245: 1074 | H245: 4040 | I245: 637 | J245: 9 | K245: 5 | L245: =SUM(F245:K245) -> 7868
A246: Lalu | B246: 60 | C246: High Elf | D246: Tunare | E246: Rathe | F246: 2105 | G246: 1110 | H246: 4000 | I246: 547 | J246: 7 | K246: 0 | L246: =SUM(F246:K246) -> 7769
A247: Schatje | B247: 60 | C247: Dark Elf | D247: Innoruuk | E247: Rathe | F247: 2120 | G247: 1077 | H247: 3835 | I247: 462 | J247: 1 | K247: 0 | L247: =SUM(F247:K247) -> 7495
A248: Shortyrez | B248: 60 | C248: Dwarf | D248: Brell Serilis | E248: Ayonae Ro | F248: 2121 | G248: 1067 | H248: 3944 | I248: 479 | J248: 5 | K248: 0 | L248: =SUM(F248:K248) -> 7616
A249: Nukuki | B249: 60 | C249: High Elf | D249: Tunare | E249: Vazaelle | F249: 2129 | G249: 1185 | H249: 3885 | I249: 646 | J249: 3 | K249: 3 | L249: =SUM(F249:K249) -> 7851
A250: Stumpf | B250: 60 | C250: Dwarf | D250: Brell Serilis | E250: Erollisi Marr | F250: 2129 | G250: 998 | H250: 3895 | I250: 499 | J250: 5 | K250: 0 | L250: =SUM(F250:K250) -> 7526
A251: Cadsuane | B251: 60 | C251: Dark Elf | D251: Innoruuk | E251: Morell-Thule | F251: 2133 | G251: 1333 | H251: 3925 | I251: 630 | J251: 2 | K251: 3 | L251: =SUM(F251:K251) -> 8026
A252: Absath | B252: 60 | C252: Dwarf | D252: Brell Serills | E252: Vazaelle | F252: 2137 | G252: 1211 | H252: 3725 | I252: 687 | J252: 0 | K252: 2 | L252: =SUM(F252:K252) -> 7762
A253: Yimmarelle | B253: 60 | C253: Gnome | D253: Brell Serilis | E253: Rathe | F253: 2137 | G253: 1086 | H253: 3965 | I253: 500 | J253: 10 | K253: 1 | L253: =SUM(F253:K253) -> 7699
A254: Jantos | B254: 60 | C254: Erudite | D254: Quellious | E254: Drinal | F254: 2139 | G254: 1069 | H254: 3820 | I254: 381 | J254: 2 | K254: 3 | L254: =SUM(F254:K254) -> 7414
A255: Tabb | B255: 60 | C255: Dwarf | D255: Brell Serilis | E255: Test | F255: 2139 | G255: 1036 | H255: 3850 | I255: 552 | J255: 4 | K255: 3 | L255: =SUM(F255:K255) -> 7584
A256: Myriella | B256: 60 | C256: Human | D256: Mithaniel Marr | E256: Tribunal | F256: 2140 | G256: 1044 | H256: 3719 | I256: 404 | J256: 3 | K256: 5 | L256: =SUM(F256:K256) -> 7315
A257: Ingraban | B257: 60 | C257: Dwarf | D257: Brell Serilis | E257: Solusek Ro | F257: 2151 | G257: 1073 | H257: 3755 | I257: 312 | J257: 5 | K257: 0 | L257: =SUM(F257:K257) -> 7296
A258: Markin | B258: 60 | C258: Dwarf | D258: Brell Serilis | E258: Rodcet Nife | F258: 2155 | G258: 1044 | H258: 3484 | I258: 425 | J258: 0 | K258: 4 | L258: =SUM(F258:K258) -> 7112
A259: Teacum | B259: 60 | C259: High Elf | D259: Tunare | E259: Test | F259: 2161 | G259: 1203 | H259: 3740 | I259: 624 | J259: 4 | K259: 0 | L259: =SUM(F259:K259) -> 7732
A260: Atro | B260: 60 | C260: High Elf | D260: Tunare | E260: Tribunal | F260: 2162 | G260: 1223 | H260: 3740 | I260: 530 | J260: 8 | K260: 5 | L260: =SUM(F260:K260) -> 7668
A261: Anika | B261: 60 | C261: Gnome | D261: Brell Serills | E261: Vazaelle | F261: 2199 | G261: 1071 | H261: 3918 | I261: 507 | J261: 4 | K261: 3 | L261: =SUM(F261:K261) -> 7702
A262: Quistil | B262: 60 | C262: High Elf | D262: Tunare | E262: Erollisi Marr | F262: 2199 | G262: 1086 | H262: 3810 | I262: 533 | J262: 4 | K262: 1 | L262: =SUM(F262:K262) -> 7633
A263: Jilanya | B263: 60 | C263: High Elf | D263: Tunare | E263: Innoruuk | F263: 2208 | G263: 1114 | H263: 3805 | I263: 427 | J263: 2 | K263: 1 | L263: =SUM(F263:K263) -> 7557
A264: Solwene | B264: 60 | C264: High Elf | D264: Tunare | E264: Morell-Thule | F264: 2215 | G264: x | H264: 3960 | I264: 534 | J264: 9 | K264: 3
A265: Pacemaker | B265: 60 | C265: Human | D265: Agnostic | E265: Rathe | F265: 2221 | G265: 732 | H265: 3692 | I265: 588 | J265: 1 | K265: 5 | L265: =SUM(F265:K265) -> 7239
A266: Pilsburry | B266: 60 | C266: Dwarf | D266: Brell Serilis | E266: Veeshan | F266: 2225 | G266: 1160 | H266: 3850 | I266: 688 | J266: 10 | K266: 5 | L266: =SUM(F266:K266) -> 7938
A267: Keleios | B267: 60 | C267: Halfling | D267: Bristlebane | E267: Vazaelle | F267: 2226 | G267: 1126 | H267: 3925 | I267: 541 | J267: 8 | K267: 3 | L267: =SUM(F267:K267) -> 7829
A268: Klairen | B268: 60 | C268: High Elf | D268: Tunare | E268: Drinal | F268: 2242 | G268: 1075 | H268: 3870 | I268: 433 | J268: 5 | K268: 3 | L268: =SUM(F268:K268) -> 7628
A269: Skidun | B269: 60 | C269: High Elf | D269: Tunare | E269: Druzzil Ro | F269: 2248 | G269: 1223 | H269: 3710 | I269: 530 | J269: 5 | K269: 1 | L269: =SUM(F269:K269) -> 7717
A270: Laldianne | B270: 60 | C270: High Elf | D270: Tunare | E270: Torvonnilous | F270: 2252 | G270: 1129 | H270: 3735 | I270: 523 | J270: 8 | K270: 3 | L270: =SUM(F270:K270) -> 7650
A271: Borick | B271: 60 | C271: Dwarf | D271: Brell Serilis | E271: Rathe | F271: 2261 | G271: 1142 | H271: 4010 | I271: 564 | J271: 4 | K271: 0 | L271: =SUM(F271:K271) -> 7981
A272: Adon | B272: 60 | C272: High Elf | D272: Tunare | E272: Zebuxoruk | F272: 2265 | G272: 1084 | H272: 3773 | I272: 415 | J272: 5 | K272: 12 | L272: =SUM(F272:K272) -> 7554
A273: Dyschord | B273: 60 | C273: Dark Elf | D273: Innoruuk | E273: Ayonae Ro | F273: 2269 | G273: 1296 | H273: 4170 | I273: 511 | J273: 7 | K273: 1 | L273: =SUM(F273:K273) -> 8254
A274: Alerna | B274: 60 | C274: Erudite | D274: Quellious | E274: Zebuxoruk | F274: 2271 | G274: 1076 | H274: 3925 | I274: 504 | J274: 6 | K274: 0 | L274: =SUM(F274:K274) -> 7782
A275: Vera | B275: 60 | C275: Dark Elf | D275: Innoruuk | E275: Tholuxe Paelle | F275: 2291 | G275: 1183 | H275: 3665 | I275: 444 | J275: 2 | K275: 3 | L275: =SUM(F275:K275) -> 7588
A276: Ryoko | B276: 60 | C276: Human | D276: Bertoxxulous | E276: Vazaelle | F276: 2293 | G276: 1173 | H276: 4050 | I276: 485 | J276: 1 | K276: 3 | L276: =SUM(F276:K276) -> 8005
A277: Johann | B277: 60 | C277: Dwarf | D277: Brell Serilis | E277: Xegony | F277: 2294 | G277: 1004 | H277: 3940 | I277: 427 | J277: 11 | K277: 3 | L277: =SUM(F277:K277) -> 7679
A278: Corunthia | B278: 60 | C278: Dwarf | D278: Brell Serilis | E278: Bristlebane | F278: 2330 | G278: 1077 | H278: 3825 | I278: 658 | J278: 8 | K278: 2 | L278: =SUM(F278:K278) -> 7900
A279: Medik | B279: 60 | C279: Erudite | D279: Quellious | E279: Xev | F279: 2340 | G279: 1126 | H279: 4070 | I279: 519 | J279: 11 | K279: 2 | L279: =SUM(F279:K279) -> 8068
A280: Seethur | B280: 60 | C280: High Elf | D280: Tunare | E280: Drinal | F280: 2348 | G280: 1148 | H280: 3740 | I280: 476 | J280: 6 | K280: 0 | L280: =SUM(F280:K280) -> 7718
A281: Lyllandra | B281: 60 | C281: High Elf | D281: Tunare | E281: Vazaelle | F281: 2353 | G281: 1152 | H281: 3955 | I281: 565 | J281: 3 | K281: 2 | L281: =SUM(F281:K281) -> 8030
A282: Xazy | B282: 60 | C282: Dark Elf | D282: Innoruuk | E282: Morell-Thule | F282: 2360 | G282: 1186 | H282: 3985 | I282: 633 | J282: 20 | K282: 3 | L282: =SUM(F282:K282) -> 8187
A283: Morinkhan | B283: 60 | C283: Dwarf | D283: Brell Serlis | E283: Morell-Thule | F283: 2362 | G283: 1105 | H283: 4095 | I283: 482 | J283: 6 | K283: 2 | L283: =SUM(F283:K283) -> 8052
A284: Kampf | B284: 60 | C284: Dwarf | D284: Brell Serilis | E284: Cazic-Thule | F284: 2364 | G284: 1063 | H284: 4000 | I284: 496 | J284: 19 | K284: 3 | L284: =SUM(F284:K284) -> 7945
A285: Thistleburr | B285: 60 | C285: Halfling | D285: Bristlebane | E285: Tribunal | F285: 2386 | G285: 1141 | H285: 3845 | I285: 573 | J285: 8 | K285: 2 | L285: =SUM(F285:K285) -> 7955
A286: Rosalinde | B286: 60 | C286: High Elf | D286: Tunare | E286: Antonius Bayle | F286: 2389 | G286: 1048 | H286: 3535 | I286: 397 | J286: 9 | K286: 5 | L286: =SUM(F286:K286) -> 7383
A287: Gryfalia | B287: 60 | C287: Dwarf | D287: Brell Serilis | E287: Druzzil Ro | F287: 2402 | G287: 1120 | H287: 3948 | I287: 458 | J287: 2 | K287: 0 | L287: =SUM(F287:K287) -> 7930
A288: Deidda | B288: 60 | C288: Halfling | D288: Bristlebane | E288: Antonius Bayle | F288: 2426 | G288: 1167 | H288: 3934 | I288: 479 | J288: 5 | K288: 0 | L288: =SUM(F288:K288) -> 8011
A289: Mikar | B289: 60 | C289: Dwarf | D289: Brell Serilis | E289: Tribunal | F289: 2426 | G289: 1144 | H289: 4085 | I289: 600 | J289: 10 | K289: 5 | L289: =SUM(F289:K289) -> 8270
A290: Kanroc | B290: 60 | C290: Dwarf | D290: Brell Serilis | E290: Povar | F290: 2427 | G290: 996 | H290: 3597 | I290: 418 | J290: 13 | K290: 3 | L290: =SUM(F290:K290) -> 7454
A291: Joraca | B291: 60 | C291: High Elf | D291: Tunare | E291: Torvonnilous | F291: 2428 | G291: 1138 | H291: 3970 | I291: 683 | J291: 13 | K291: 0 | L291: =SUM(F291:K291) -> 8232
A292: Netorbesnom | B292: 60 | C292: Dwarf | D292: Brell Serilis | E292: Tribunal | F292: 2429 | G292: 1098 | H292: 4250 | I292: 651 | J292: 5 | K292: 0 | L292: =SUM(F292:K292) -> 8433
A293: Grubble | B293: 60 | C293: Dwarf | D293: Brell Serilis | E293: Nameless | F293: 2451 | G293: 1138 | H293: 3706 | I293: 473 | J293: 9 | K293: 0 | L293: =SUM(F293:K293) -> 7777
A294: Nanilya | B294: 60 | C294: High Elf | D294: Tunare | E294: Zebuxoruk | F294: 2455 | G294: 1171 | H294: 3766 | I294: 438 | J294: 1 | K294: 0 | L294: =SUM(F294:K294) -> 7831
A295: Crystali | B295: 60 | C295: High Elf | D295: Tunare | E295: Morell-Thule | F295: 2462 | G295: 1201 | H295: 4090 | I295: 606 | J295: 13 | K295: 2 | L295: =SUM(F295:K295) -> 8374
A296: Kegwell | B296: 60 | C296: Dwarf | D296: Brell Serilis | E296: Xegony | F296: 2506 | G296: 1281 | H296: 3790 | I296: 718 | J296: 16 | K296: 0 | L296: =SUM(F296:K296) -> 8311
A297: Clenzz | B297: 60 | C297: Dwarf | D297: Brell Serilis | E297: Tarew Marr | F297: 2509 | G297: 1056 | H297: 3755 | I297: 444 | J297: 3 | K297: 0 | L297: =SUM(F297:K297) -> 7767
A298: Bramyanea | B298: 60 | C298: Dark Elf | D298: Innoruuk | E298: Bristlebane | F298: 2513 | G298: 1138 | H298: 4005 | I298: 558 | J298: 12 | K298: 2 | L298: =SUM(F298:K298) -> 8228
A299: Sylvia | B299: 60 | C299: Erudite | D299: Cazic Thule | E299: Druzzil Ro | F299: 2520 | G299: 1059 | H299: 4090 | I299: 619 | J299: 9 | K299: 3 | L299: =SUM(F299:K299) -> 8300
A300: Barahir | B300: 60 | C300: Dwarf | D300: Brell Serilis | E300: Solusek Ro | F300: 2537 | G300: 1187 | H300: 3820 | I300: 445 | J300: 0 | K300: 3 | L300: =SUM(F300:K300) -> 7992
A301: Brambodious | B301: 60 | C301: Halfling | D301: Bristlebane | E301: Quellious | F301: 2544 | G301: 1224 | H301: 3655 | I301: 594 | J301: 5 | K301: 2 | L301: =SUM(F301:K301) -> 8024
A302: Immune | B302: 60 | C302: Dark Elf | D302: Innoruuk | E302: Antonius Bayle | F302: 2546 | G302: 1078 | H302: 3930 | I302: 602 | J302: 8 | K302: 3 | L302: =SUM(F302:K302) -> 8167
A303: Darizra | B303: 60 | C303: Dark Elf | D303: Innoruuk | E303: Saryrn | F303: 2571 | G303: 1236 | H303: 4084 | I303: 567 | J303: 2 | K303: 0 | L303: =SUM(F303:K303) -> 8460
A304: Ebonlass | B304: 60 | C304: Dark Elf | D304: Innoruuk | E304: Tunare | F304: 2593 | G304: 1147 | H304: 4120 | I304: 613 | J304: 14 | K304: 3 | L304: =SUM(F304:K304) -> 8490
A305: Mariaa | B305: 60 | C305: High Elf | D305: Tunare | E305: Xegony | F305: 2599 | G305: 624 | H305: 4140 | I305: 549 | J305: 8 | K305: 3 | L305: =SUM(F305:K305) -> 7923
A306: Eonwe | B306: 60 | C306: High Elf | D306: Tunare | E306: Morell-Thule | F306: 2685 | G306: 1300 | H306: 4395 | I306: 738 | J306: 12 | K306: 3 | L306: =SUM(F306:K306) -> 9133
A307: Bubus | B307: 60 | C307: Dwarf | D307: Brell Serilis | E307: Ayonae Ro | F307: 2688 | G307: 1130 | H307: 4010 | I307: 507 | J307: 6 | K307: 0 | L307: =SUM(F307:K307) -> 8341
A308: Swiri | B308: 60 | C308: High Elf | D308: Tunare | E308: Tunare | F308: 2694 | G308: 1164 | H308: 4250 | I308: 776 | J308: 10 | K308: 0 | L308: =SUM(F308:K308) -> 8894
A309: Arturo | B309: 60 | C309: Human | D309: Mithaniel Marr | E309: Bristlebane | F309: 2711 | G309: 1089 | H309: 4110 | I309: 646 | J309: 9 | K309: 3 | L309: =SUM(F309:K309) -> 8568
A310: Slaani | B310: 60 | C310: High Elf | D310: Tunare | E310: Antonius Bayle | F310: 2738 | G310: 1183 | H310: 4120 | I310: 556 | J310: 9 | K310: 3 | L310: =SUM(F310:K310) -> 8609
A311: Cassiana | B311: 60 | C311: Dark Elf | D311: Innoruuk | E311: Vazaelle | F311: 2762 | G311: 1141 | H311: 4240 | I311: 648 | J311: 16 | K311: 5 | L311: =SUM(F311:K311) -> 8812
A312: Aliudyen | B312: 60 | C312: Human | D312: Mithaniel Marr | E312: Cazic-Thule | F312: 2782 | G312: 1233 | H312: 4315 | I312: 622 | J312: 13 | K312: 0 | L312: =SUM(F312:K312) -> 8965
A313: Ceridwen | B313: 60 | C313: High Elf | D313: Tunare | E313: Beroxxulous | F313: 2793 | G313: 1188 | H313: 4185 | I313: 702 | J313: 11 | K313: 3 | L313: =SUM(F313:K313) -> 8882
A314: Ryld | B314: 60 | C314: High Elf | D314: Tunare | E314: Prexus | F314: 2803 | G314: 1261 | H314: 4180 | I314: 670 | J314: 19 | K314: 5 | L314: =SUM(F314:K314) -> 8938
A315: Qwenya | B315: 60 | C315: High Elf | D315: Tunare | E315: Bristlebane | F315: 2856 | G315: 1204 | H315: 4260 | I315: 720 | J315: 13 | K315: 5 | L315: =SUM(F315:K315) -> 9058
A316: Eclectic | B316: 60 | C316: Halfling | D316: Bristlebane | E316: Nameless | F316: 2893 | G316: 1130 | H316: 4020 | I316: 647 | J316: 17 | K316: 3 | L316: =SUM(F316:K316) -> 8710
A317: Thuel | B317: 60 | C317: Dwarf | D317: Brell Serilis | E317: Xegony | F317: 2934 | G317: 1233 | H317: 4055 | I317: 625 | J317: 9 | K317: 2 | L317: =SUM(F317:K317) -> 8858
A318: Serina | B318: 60 | C318: High Elf | D318: Tunare | E318: Bertoxxulous | F318: 2941 | G318: 1223 | H318: 4345 | I318: 582 | J318: 8 | K318: 3 | L318: =SUM(F318:K318) -> 9102
A319: Smegal | B319: 60 | C319: Dwarf | D319: Brell Serilis | E319: Mithaniel Marr | F319: 2998 | G319: 1221 | H319: 4260 | I319: 722 | J319: 10 | K319: 7 | L319: =SUM(F319:K319) -> 9218
A320: Amberel | B320: 60 | C320: High Elf | D320: Tunare | E320: Druzzil Ro | F320: 3018 | G320: 1214 | H320: 4385 | I320: 706 | J320: 9 | K320: 3 | L320: =SUM(F320:K320) -> 9335
A321: Varya | B321: 60 | C321: Dwarf | D321: Brell Serills | E321: Veeshan | F321: 3034 | G321: 1276 | H321: 4475 | I321: 862 | J321: 23 | K321: 5 | L321: =SUM(F321:K321) -> 9675
A322: Arakias | B322: 60 | C322: Dark Elf | D322: Innoruuk | E322: Torconnilous | F322: 3174 | G322: 1255 | H322: 4315 | I322: 710 | J322: 19 | K322: 5 | L322: =SUM(F322:K322) -> 9478
A323: Delheru | B323: 60 | C323: High Elf | D323: Tunare | E323: Rodcet Nife | F323: 3192 | G323: 1233 | H323: 4380 | I323: 770 | J323: 10 | K323: 4 | L323: =SUM(F323:K323) -> 9589
A324: Alloria | B324: 60 | C324: High Elf | D324: Tunare | E324: Veeshan | F324: 3247 | G324: 1306 | H324: 4535 | I324: 1001 | J324: 17 | K324: 0 | L324: =SUM(F324:K324) -> 10106
A325: Arele | B325: 60 | C325: High Elf | D325: Tunare | E325: Mithaniel Marr | F325: 3458 | G325: 1374 | H325: 4730 | I325: 935 | J325: 27 | K325: 13 | L325: =SUM(F325:K325) -> 10537
E326: Average | F326: =AVERAGE(F40:F325) -> 1755.2412587412587 | G326: =AVERAGE(G40:G325) -> 959.42803030303025 | H326: =AVERAGE(H40:H325) -> 3200.5 | I326: =AVERAGE(I40:I325) -> 374.37323943661971 | J326: =AVERAGE(J40:J325) -> 3.1690140845070425 | K326: =AVERAGE(K40:K325) -> 1.1267605633802817 | L326: =AVERAGE(L40:L325) -> 6406.2633587786258