A1: Last Name | B1: First Name | C1: Alias | D1: Class | E1: SASS # | F1: Street | G1: City | H1: State | I1: Zip | J1: Phone | K1: E-Mail | L1: Stage 1 | M1: Stage 2 | N1: Stage 3 | O1: Stage 4 | P1: Stage 5 | Q1: Stage 6 | R1: Day 1 | S1: Stage 6 | T1: Stage 7 | U1: Stage 8 | V1: Stage 9 | W1: Stage 10 | X1: Day 2 | Y1: Total | Z1: Side 1 | AA1: Side 2 | AB1: Side 3 | AC1: Side 4 | AD1: Event 1 | AE1: Event 2 | AF1: Event 3 | AG1: Event 4 | AH1: Possee #
C2: Slippery Earl | D2: ? | L2: 80.94 | M2: 89.17 | N2: 75.38 | O2: 80.63 | P2: 100.17 | Q2: 15.21 | R2: =SUM(L2:P2) -> 426.29 | AH2: 1
A3: Sieck | B3: Bob | C3: Bounty Seeker | D3: D | E3: 12064 | F3: 1952 Catlin Dr. | G3: Barnhart | H3: MO | I3: 63012 | L3: 66.97 | M3: 91.44 | N3: 68.01 | O3: 76.95 | P3: 89.16 | Q3: 48.54 | R3: =SUM(L3:Q3) -> 441.07 | X3: =SUM(S3:W3) -> 0 | Y3: =SUM(R3+X3) -> 441.07 | AH3: 3
A4: Counts | B4: Bob | C4: Bullshooter bob | D4: D | E4: 26212 | F4: 1328 Premio Dr | G4: Fenton | H4: MO | I4: 63026 | J4: 636-225-4741 | K4: gadgets2@juno.com | L4: 54.19 | M4: 96.41 | N4: 74.57 | O4: 77.36 | P4: 75.62 | Q4: 34.73 | R4: =SUM(L4:Q4) -> 412.88 | X4: =SUM(S4:W4) -> 0 | Y4: =SUM(R4+X4) -> 412.88 | AH4: 3
A5: Lampe | B5: John | C5: Cantankerous | D5: D | F5: 815 St. William | G5: Cahokia | H5: IL | I5: 62206-1842 | L5: 143.29 | M5: 127.89 | N5: 86.75 | O5: 142.68 | P5: 183.96 | R5: =SUM(L5:P5) -> 684.57 | X5: =SUM(S5:W5) -> 0 | Y5: =SUM(R5+X5) -> 684.57 | AH5: 5
C6: Dusty Plains | D6: D | L6: 81.18 | M6: 113 | N6: 98.88 | O6: 136.95 | P6: 127.2 | Q6: 36.75 | R6: =SUM(L6:P6) -> 557.21 | AH6: 3
A7: Stiles | B7: John | C7: Highridge Drifter | D7: D | E7: 15758 | F7: 9911 Crestwood Dr | G7: Crestwood | H7: MO | I7: 63126 | J7: 314-821-0668 | K7: bestshotjohn@yahoo.com | L7: 56.15 | M7: 78.42 | N7: 46.22 | O7: 57.24 | P7: 62.83 | Q7: 32.26 | R7: =SUM(L7:Q7) -> 333.12 | X7: =SUM(S7:W7) -> 0 | Y7: =SUM(R7+X7) -> 333.12 | AH7: 5
A8: Dewhirst | B8: Edward | C8: J. D. Webfoot | D8: D | E8: 24199 | F8: #3 Dobbs Ln. | G8: O'Fallon | H8: MO | I8: 63366-4216 | J8: 636-332-0231 | K8: edwardd664@aol.com | L8: 84.26 | M8: 113.13 | N8: 79.09 | O8: 117.79 | P8: 105.14 | Q8: 67 | R8: =SUM(L8:Q8) -> 566.41 | X8: =SUM(S8:W8) -> 0 | Y8: =SUM(R8+X8) -> 566.41 | AH8: 1
A9: Bolle | B9: Brian | C9: Nathan Ward | D9: D | E9: xxx | F9: 3260 Burning Tree Ln | G9: Festus | H9: MO | I9: 63028 | J9: 636-937-2025 | K9: bbolle@ucn.net | L9: 78.96 | M9: 77.47 | N9: 60.59 | O9: 89.19 | P9: 82.39 | Q9: 39.04 | R9: =SUM(L9:Q9) -> 427.64 | X9: =SUM(S9:W9) -> 0 | Y9: =SUM(R9+X9) -> 427.64 | AH9: 5
A10: Anderws | B10: Robert E | C10: Possum Creek Bill | D10: D | F10: P. O. Box 13 | G10: Vales Mines | H10: MO | I10: 63087 | L10: 76.35 | M10: 90.73 | N10: 62.21 | O10: 69.22 | P10: 124.38 | Q10: 22.95 | R10: =SUM(L10:Q10) -> 445.84 | X10: =SUM(S10:W10) -> 0 | Y10: =SUM(R10+X10) -> 445.84 | AH10: 5
A11: Hall | B11: William | C11: Railroad Bill | D11: D | F11: 860 Oak Brook | G11: St. Louis | H11: MO | I11: 63132 | L11: 67.52 | M11: 85.08 | N11: 61.3 | O11: 88.29 | P11: 73.51 | Q11: 29.94 | R11: =SUM(L11:Q11) -> 405.64 | X11: =SUM(S11:W11) -> 0 | Y11: =SUM(R11+X11) -> 405.64 | AH11: 5
C12: Johnny Lightning | D12: Junior | L12: 77.75 | M12: 104.21 | N12: 68.31 | O12: 102.8 | P12: 82.78 | Q12: 29.8 | R12: =SUM(L12:Q12) -> 465.65 | AH12: 5
A13: Sextro | B13: John | C13: Jack Blackhawk | D13: M | F13: 1526 Cheryl Acres | G13: Arnold | H13: MO | I13: 63010 | L13: 102.25 | M13: 90.35 | N13: 93.28 | O13: 106.87 | P13: 87.44 | Q13: 35.56 | R13: =SUM(L13:Q13) -> 515.75 | X13: =SUM(S13:W13) -> 0 | Y13: =SUM(R13+X13) -> 515.75 | AH13: 5
A14: Tuschoff | B14: Brad | C14: Ranger Marlin Ruger | D14: M | F14: 127 Starling Community | G14: Arnold | H14: MO | I14: 63010 | L14: 57.01 | M14: 98.02 | N14: 71.59 | O14: 62.43 | P14: 71.99 | Q14: 52.12 | R14: =SUM(L14:Q14) -> 413.16 | X14: =SUM(S14:W14) -> 0 | Y14: =SUM(R14+X14) -> 413.16 | AH14: 3
C15: Uncle Leonard | D15: M/Senior | L15: 185.99 | M15: 151.94 | N15: 117.5 | O15: 195.84 | P15: 195.7 | Q15: 69.97 | R15: =SUM(L15:P15) -> 846.97 | AH15: 1
A16: Ripplinger | B16: Lawrence | C16: Squire Lawrence | D16: Senior | E16: 28622 | F16: 3242 S. Illinois St. | G16: Belleville | H16: IL | I16: 62220-5110 | J16: 618-233-3592 | K16: rippjr@peaknet.net | L16: 74.14 | M16: 102.46 | N16: 55.99 | O16: 85.89 | P16: 85.49 | Q16: 66.23 | R16: =SUM(L16:Q16) -> 470.2 | X16: =SUM(S16:W16) -> 0 | Y16: =SUM(R16+X16) -> 470.2 | AH16: 5
A17: Myers | B17: Bill | C17: Billy The Kidder | D17: T | E17: 18037 | F17: 7208 Field Ave | G17: St. Louis | H17: MO | I17: 63116 | K17: wmkidder@gtw.net | L17: 76.4 | M17: 61.3 | N17: 39.79 | O17: 43.86 | P17: 42.9 | Q17: 23.37 | R17: =SUM(L17:Q17) -> 287.62 | X17: =SUM(S17:W17) -> 0 | Y17: =SUM(R17+X17) -> 287.62 | AH17: 5
A18: Rivas | B18: Barclay | C18: Cart Ridge | D18: T | F18: 515 N. Elm | G18: Pacific | H18: MO | I18: 63069 | L18: 69.05 | M18: 72.76 | N18: 49.03 | O18: 61.05 | P18: 61.53 | Q18: 37.54 | R18: =SUM(L18:Q18) -> 350.96 | X18: =SUM(S18:W18) -> 0 | Y18: =SUM(R18+X18) -> 350.96 | AH18: 5
C19: Chuckwagon Willy | D19: T | L19: 71.85 | M19: 110.98 | N19: 87.81 | O19: 87.02 | P19: 83.84 | Q19: 19.89 | R19: =SUM(L19:P19) -> 441.5 | AH19: 3
A20: Pisciotta | B20: Dom | C20: Colt Rampant | D20: T | E20: 13753 | F20: 611 Winding Creek Dr | G20: Wentzville | H20: MO | I20: 63385 | J20: 636-639-6968 | K20: poppydom@aol.com | L20: 84.36 | M20: 91.03 | N20: 48.08 | O20: 77.43 | P20: 76.37 | Q20: 30.03 | R20: =SUM(L20:Q20) -> 407.3 | X20: =SUM(S20:W20) -> 0 | Y20: =SUM(R20+X20) -> 407.3 | AH20: 1
A21: Vin | B21: Jack | C21: Crooked Eye Jack | D21: T | F21: 2755 Der Lake Rd | G21: Florissant | H21: MO | I21: 63033 | L21: 107.53 | M21: 145.3 | N21: 88.67 | O21: 96.9 | P21: 147.43 | Q21: 61.79 | R21: =SUM(L21:Q21) -> 647.62 | X21: =SUM(S21:W21) -> 0 | Y21: =SUM(R21+X21) -> 647.62 | AH21: 1
A22: Peters | B22: Dwayne | C22: Deadly "D" | D22: T | E22: xxx | F22: 156 Big Four Pl | G22: Mitchell | H22: IL | I22: 62040 | J22: 618-773-1340 | L22: 96.06 | M22: 97.86 | N22: 55.19 | O22: 78.31 | P22: 123.11 | Q22: 48.06 | R22: =SUM(L22:Q22) -> 498.59 | X22: =SUM(S22:W22) -> 0 | Y22: =SUM(R22+X22) -> 498.59 | AH22: 1
C23: Dusty Kidd | D23: T | L23: 126.66 | M23: 124.68 | N23: 75.97 | O23: 133.77 | P23: 128.46 | Q23: 52.1 | R23: =SUM(L23:Q23) -> 641.64 | AH23: 5
A24: Dillmon | B24: John | C24: J. D. Hardrider | D24: T | E24: 32555 | F24: 5 Camp Hollow Ct | G24: Wildwood | H24: MO | I24: 63038 | J24: 636-458-6647 | K24: jmdillmon@aol.com | L24: 95.15 | M24: 101.86 | N24: 66.04 | O24: 101.52 | P24: 85.9 | Q24: DNF | R24: =SUM(L24:P24) -> 450.47 | X24: =SUM(S24:W24) -> 0 | Y24: =SUM(R24+X24) -> 450.47 | AH24: 5
A25: McDonnel | B25: James | C25: Jimmy John Daniels | D25: T | E25: 38829 | F25: 6920 Greenholly Dr | G25: St. Louis | H25: MO | I25: 63123 | J25: 314-752-9269 | K25: jpmcdonnell@swbell.net | L25: 99.12 | M25: 85.25 | N25: 78.44 | O25: 113.75 | P25: 74.96 | Q25: 30.9 | R25: =SUM(L25:Q25) -> 482.42 | X25: =SUM(S25:W25) -> 0 | Y25: =SUM(R25+X25) -> 482.42 | AH25: 5
A26: Vance | B26: Terry | C26: Joe Lefores | D26: T | F26: 2151 Kerth Dr | G26: Arnold | H26: MO | I26: 63101 | L26: 83.08 | M26: 110.12 | N26: 60.88 | O26: 96.48 | P26: 126.76 | R26: =SUM(L26:P26) -> 477.32 | X26: =SUM(S26:W26) -> 0 | Y26: =SUM(R26+X26) -> 477.32 | AH26: 5
A27: Serra | B27: John | C27: Johnny One Horse | D27: T | F27: 515 Fox Pointe Dr | G27: St. Charles | H27: MO | I27: 63304 | L27: 123.36 | M27: 112.1 | N27: 66.62 | O27: 106.33 | P27: 90.27 | Q27: 38.35 | R27: =SUM(L27:Q27) -> 537.03 | X27: =SUM(S27:W27) -> 0 | Y27: =SUM(R27+X27) -> 537.03 | AH27: 1
C28: Kid Klondike | D28: T | L28: 91.68 | M28: 118.1 | N28: 109.08 | O28: 100.2 | P28: 110.68 | Q28: 18.7 | R28: =SUM(L28:P28) -> 529.74 | AH28: 3
C29: Mighty Slim Pickens | D29: T | L29: 119.09 | M29: 113.09 | N29: DNF | O29: DNF | P29: 121.74 | Q29: 58.69 | R29: =SUM(L29:Q29) -> 412.61 | AH29: 5
A30: Wilson | B30: Gary | C30: Missouri Buck | D30: T | E30: ? | F30: 7252 Klondike Rd | G30: Hillsboro | H30: MO | I30: 63050 | J30: 636-274-2057 | L30: 61.7 | M30: DNF | N30: 67.03 | O30: 80.01 | P30: 60.83 | Q30: 47.92 | R30: =SUM(L30:Q30) -> 317.49 | X30: =SUM(S30:W30) -> 0 | Y30: =SUM(R30+X30) -> 317.49 | AH30: 3
A31: Watson | B31: Mark | C31: Pard N. Me | D31: T | F31: 3540 Rock Creek Garden Rd | G31: Imperial | H31: MO | I31: 63052 | K31: magill@swbell.net | L31: 74.15 | M31: 81.56 | N31: 77.11 | O31: 98.52 | P31: 73.06 | Q31: 22.08 | R31: =SUM(L31:Q31) -> 426.48 | X31: =SUM(S31:W31) -> 0 | Y31: =SUM(R31+X31) -> 426.48 | AH31: 3
C32: Rancher | D32: T | L32: 96.06 | M32: 104.55 | N32: DNF | O32: 118.3 | P32: 114.29 | Q32: 40.84 | R32: =SUM(L32:Q32) -> 474.04 | AH32: 5
C33: Tumbleweed Tom | D33: T | L33: 111.09 | M33: 81.65 | N33: 71.36 | O33: 104.16 | P33: 106.66 | Q33: 50.03 | R33: =SUM(L33:Q33) -> 524.95 | AH33: 1
A34: Everett | B34: Richard | C34: Twilight Tom | D34: T | F34: 9405 Daisy Ln | G34: Affton | H34: MO | I34: 63123 | L34: 63.47 | M34: 70.53 | N34: 75.66 | O34: 98.31 | P34: 69.96 | Q34: 48.58 | R34: =SUM(L34:Q34) -> 426.51 | X34: =SUM(S34:W34) -> 0 | Y34: =SUM(R34+X34) -> 426.51 | AH34: 3
A35: Harmon | B35: Tom | C35: Yuma tom | D35: T | E35: 33602 | F35: 1953 Catin Dr | G35: Barnhart | H35: MO | I35: 63012 | J35: 636-464-7012 | L35: 54.14 | M35: 70.28 | N35: 74.68 | O35: 75.04 | P35: 70.14 | Q35: 18.25 | R35: =SUM(L35:Q35) -> 362.53 | X35: =SUM(S35:W35) -> 0 | Y35: =SUM(R35+X35) -> 362.53 | AH35: 3
A36: Huffman | B36: Charles | C36: Calhoon | D36: T/Senior | E36: 7242 | F36: 3159 Arrowrock Dr. | G36: St. Charles | H36: MO | I36: 63303-6503 | K36: calhoon314@alo.com | L36: 154.66 | M36: 154.48 | N36: 95.29 | O36: 134.96 | P36: 119.84 | Q36: 47.21 | R36: =SUM(L36:Q36) -> 706.44 | X36: =SUM(S36:W36) -> 0 | Y36: =SUM(R36+X36) -> 706.44 | AH36: 1
C37: Stumpe | D37: T/Senior | L37: 108.03 | M37: 99.75 | N37: 73.46 | O37: 103.49 | P37: 102.72 | Q37: 19.66 | R37: =SUM(L37:P37) -> 487.45 | AH37: 1
C38: Ellie Oakley | D38: Women | L38: 91.27 | M38: 114.84 | N38: 78.66 | O38: 122.83 | P38: 98.75 | Q38: 71.96 | R38: =SUM(L38:Q38) -> 578.31 | AH38: 5