A1: Chardok | B1: AC | C1: STR | D1: STA | E1: AGI | F1: DEX | G1: WIS | H1: INT | I1: CHA | J1: PR | K1: MR | L1: DR | M1: FR | N1: CR | O1: Mana | P1: HP | Q1: Effect
A2: Sarnak Hide Boots | B2: 5 | F2: 5 | G2: 5 | H2: 5 | I2: 5 | O2: 25
A3: Nathsar Bracer | B3: 7 | C3: 4 | G3: 4 | I3: 4
A4: Head (NONE)
A5: Nathsar Gauntlets | B5: 8 | G5: 4 | K5: 2 | N5: 2
A6: Nathsar Legs | B6: 12 | E6: 4 | G6: 4 | I6: 4 | J6: 2 | K6: 2
A7: Nathsar Vambraces | B7: 8 | E7: 4 | G7: 4 | L7: 2 | N7: 2
A8: Nathsar Breastplate | B8: 18 | C8: 6 | E8: 6 | G8: 6 | L8: 5 | M8: 5
A9: Total | B9: =SUM(B4:B8)+2*B3+B2 -> 65 | C9: =SUM(C4:C8)+2*C3+C2 -> 14 | D9: =SUM(D4:D8)+2*D3+D2 -> 0 | E9: =SUM(E4:E8)+2*E3+E2 -> 14 | F9: =SUM(F4:F8)+2*F3+F2 -> 5 | G9: =SUM(G4:G8)+2*G3+G2 -> 31 | H9: =SUM(H4:H8)+2*H3+H2 -> 5 | I9: =SUM(I4:I8)+2*I3+I2 -> 17 | J9: =SUM(J4:J8)+2*J3+J2 -> 2 | K9: =SUM(K4:K8)+2*K3+K2 -> 4 | L9: =SUM(L4:L8)+2*L3+L2 -> 7 | M9: =SUM(M4:M8)+2*M3+M2 -> 5 | N9: =SUM(N4:N8)+2*N3+N2 -> 4 | O9: =SUM(O4:O8)+2*O3+O2 -> 25 | P9: =SUM(P4:P8)+2*P3+P2 -> 0
A11: Cobalt Drake (reinforced) | B11: AC | C11: STR | D11: STA | E11: AGI | F11: DEX | G11: WIS | H11: INT | I11: CHA | J11: PR | K11: MR | L11: DR | M11: FR | N11: CR | O11: Mana | P11: HP | Q11: Effect
A12: Cobalt Drake Mask | B12: 6 | I12: 5 | N12: 3 | O12: 5
A13: Cobalt Drake Collar | B13: 7 | D13: 5 | N13: 4 | O13: 5
A14: Cobalt Drake Bracer | B14: 7 | C14: 3 | G14: 3 | N14: 3 | O14: 5
A15: Cobalt Drake Boots | B15: 8 | D15: 4 | I15: 5 | O15: 10
A16: Cobalt Drake Shoulderpads | B16: 7 | C16: 8 | N16: 5 | O16: 10
A17: Cobalt Drake Gloves | B17: 8 | I17: 8 | N17: 5 | O17: 10
A18: Cobalt Drake Sleeves | B18: 8 | I18: 8 | N18: 6 | O18: 22
A19: Cobalt Drake Belt | B19: 8 | D19: 5 | G19: 8 | N19: 4
A20: Cobalt Drake Cap | B20: 9 | N20: 5 | O20: 8
A21: Cobalt Drake Cloak | B21: 9 | C21: 8 | G21: 4 | N21: 8 | O21: 23
A22: Cobalt Drake Pants | B22: 9 | I22: 3 | N22: 8 | O22: 25
A23: Cobalt Drake Tunic | B23: 14 | D23: 8 | I23: 12 | N23: 10 | O23: 27
A24: Total | B24: =SUM(B12:B23)+B14 -> 107 | C24: =SUM(C12:C23)+C14 -> 22 | D24: =SUM(D12:D23)+D14 -> 22 | E24: =SUM(E12:E23)+E14 -> 0 | F24: =SUM(F12:F23)+F14 -> 0 | G24: =SUM(G12:G23)+G14 -> 18 | H24: =SUM(H12:H23)+H14 -> 0 | I24: =SUM(I12:I23)+I14 -> 41 | J24: =SUM(J12:J23)+J14 -> 0 | K24: =SUM(K12:K23)+K14 -> 0 | L24: =SUM(L12:L23)+L14 -> 0 | M24: =SUM(M12:M23)+M14 -> 0 | N24: =SUM(N12:N23)+N14 -> 64 | O24: =SUM(O12:O23)+O14 -> 155
A26: Coterie Armor (Vampires) | B26: AC | C26: STR | D26: STA | E26: AGI | F26: DEX | G26: WIS | H26: INT | I26: CHA | J26: PR | K26: MR | L26: DR | M26: FR | N26: CR | O26: Mana | P26: HP | Q26: Effect
A27: Coterie Mask | B27: 5 | C27: 1 | M27: -1 | P27: 3
A28: Coterie Wristbands | B28: 6 | H28: 1 | M28: -1 | P28: 3
A29: Coterie Cloak | B29: 7 | C29: 1 | H29: 1 | M29: -2 | P29: 6
A30: Coterie Gorget | B30: 6 | C30: 1 | M30: -1 | P30: 3
A31: Coterie Leggings | B31: 8 | C31: 1 | E31: 2 | M31: -3 | P31: 9
A32: Coterie Boots | B32: 7 | E32: 2 | M32: -2 | P32: 6
A33: Coterie Belt | B33: 6 | H33: 1 | M33: -1 | P33: 3
A34: Coterie Gloves | B34: 7 | C34: 2 | M34: -2 | P34: 6
A35: Coterie Tunic | B35: 13 | C35: 2 | H35: 1 | M35: -3 | P35: 9
A36: Coterie Shoulderpads | B36: 6 | H36: 1 | M36: -1 | P36: 3
A37: Coterie Sleeves | B37: 7 | C37: 2 | M37: -2 | P37: 6
A38: Coterie Skullcap | B38: 7 | H38: 2 | M38: -2
A39: Total | B39: =SUM(B27:B38)+B28 -> 91 | C39: =SUM(C27:C38)+C28 -> 10 | D39: =SUM(D27:D38)+D28 -> 0 | E39: =SUM(E27:E38)+E28 -> 4 | F39: =SUM(F27:F38)+F28 -> 0 | G39: =SUM(G27:G38)+G28 -> 0 | H39: =SUM(H27:H38)+H28 -> 8 | I39: =SUM(I27:I38)+I28 -> 0 | J39: =SUM(J27:J38)+J28 -> 0 | K39: =SUM(K27:K38)+K28 -> 0 | L39: =SUM(L27:L38)+L28 -> 0 | M39: =SUM(M27:M38)+M28 -> -22 | N39: =SUM(N27:N38)+N28 -> 0 | O39: =SUM(O27:O38)+O28 -> 0 | P39: =SUM(P27:P38)+P28 -> 60
A41: Crystal Chitin | B41: AC | C41: STR | D41: STA | E41: AGI | F41: DEX | G41: WIS | H41: INT | I41: CHA | J41: PR | K41: MR | L41: DR | M41: FR | N41: CR | O41: Mana | P41: HP | Q41: Effect
A42: Crystal Chitin Guantlets | B42: 20 | C42: 10 | O42: 35
A43: Crystal Chitin Shield | B43: 20 | G43: 9 | O43: 40
A44: Crystal Chitin Armplates | B44: 18 | C44: 5 | D44: 5 | P44: 10
A45: Crystal Chitin Boots | B45: 20 | C45: 7 | F45: 3
A46: Crystal Chitin Circlet | B46: 12 | C46: 3 | G46: 3 | H46: 3
A47: Crystal Chitin Leggings | B47: 15 | D47: 5 | O47: 25
A48: Crystal Chitin Chestguard | B48: 25 | E48: 7 | G48: 10 | I48: 7 | O48: 10
A49: Total | B49: =SUM(B42:B48) -> 130 | C49: =SUM(C42:C48) -> 25 | D49: =SUM(D42:D48) -> 10 | E49: =SUM(E42:E48) -> 7 | F49: =SUM(F42:F48) -> 3 | G49: =SUM(G42:G48) -> 22 | H49: =SUM(H42:H48) -> 3 | I49: =SUM(I42:I48) -> 7 | J49: =SUM(J42:J48) -> 0 | K49: =SUM(K42:K48) -> 0 | L49: =SUM(L42:L48) -> 0 | M49: =SUM(M42:M48) -> 0 | N49: =SUM(N42:N48) -> 0 | O49: =SUM(O42:O48) -> 110 | P49: =SUM(P42:P48) -> 10
A51: Elder Spiritist's (Kunark) | B51: AC | C51: STR | D51: STA | E51: AGI | F51: DEX | G51: WIS | H51: INT | I51: CHA | J51: PR | K51: MR | L51: DR | M51: FR | N51: CR | O51: Mana | P51: HP | Q51: Effect
A52: Elder Spiritist's Boots | B52: 8 | Q52: Levitate
A53: Elder Spiritist's Bracer | B53: 7 | Q53: Share Wolf Form
A54: Elder Spiritist's Helm | B54: 10 | Q54: Superior Camouflage
A55: Elder Spiritist's Gauntlets | B55: 9 | Q55: Snare
A56: Elder Spiritist's Greaves | B56: 10 | C56: 6 | G56: 6 | P56: 55 | Q56: Skin Like Diamond
A57: Elder Spiritist's Vambraces | B57: 8 | Q57: Drones of Doom
A58: Elder Spiritist's Breastplate | B58: 17 | E58: 6 | F58: 6 | G58: 9 | O58: 80 | Q58: Chloroplast
A59: Total | B59: =SUM(B54:B58)+2*B53+B52 -> 76 | C59: =SUM(C54:C58)+2*C53+C52 -> 6 | D59: =SUM(D54:D58)+2*D53+D52 -> 0 | E59: =SUM(E54:E58)+2*E53+E52 -> 6 | F59: =SUM(F54:F58)+2*F53+F52 -> 6 | G59: =SUM(G54:G58)+2*G53+G52 -> 15 | H59: =SUM(H54:H58)+2*H53+H52 -> 0 | I59: =SUM(I54:I58)+2*I53+I52 -> 0 | J59: =SUM(J54:J58)+2*J53+J52 -> 0 | K59: =SUM(K54:K58)+2*K53+K52 -> 0 | L59: =SUM(L54:L58)+2*L53+L52 -> 0 | M59: =SUM(M54:M58)+2*M53+M52 -> 0 | N59: =SUM(N54:N58)+2*N53+N52 -> 0 | O59: =SUM(O54:O58)+2*O53+O52 -> 80 | P59: =SUM(P54:P58)+2*P53+P52 -> 55
A61: Kael (Giants) | B61: AC | C61: STR | D61: STA | E61: AGI | F61: DEX | G61: WIS | H61: INT | I61: CHA | J61: PR | K61: MR | L61: DR | M61: FR | N61: CR | O61: Mana | P61: HP | Q61: Effect
A62: Nature Walker's Boots | B62: 11 | E62: 13 | K62: 2 | M62: 2 | N62: 1 | O62: 10 | Q62: Spirit of Wolf
A63: Nature Walker's Bracer | B63: 9 | G63: 9 | L63: 2 | O63: 20 | Q63: Drones of Doom
A64: Nature Walker's Circlet | B64: 11 | E64: 2 | G64: 9 | J64: 1 | K64: 1 | L64: 3 | M64: 1 | N64: 1 | O64: 20
A65: Nature Walker's Gauntlet | B65: 10 | D65: 2 | E65: 2 | G65: 2 | K65: 2 | N65: 1 | O65: 25
A66: Nature wlalker's Greaves | B66: 14 | F66: 6 | G66: 7 | M66: 3 | N66: 3 | O66: 70 | P66: 20 | Q66: Circle of Misty
A67: Nature Walker's Vambraces | B67: 10 | G67: 2 | K67: 2 | O67: 30 | P67: 20
A68: Nature Walker's Chestguard | B68: 27 | C68: 5 | F68: 5 | G68: 15 | J68: 3 | K68: 10 | L68: 2 | M68: 3 | N68: 2 | O68: 80 | P68: 40 | Q68: Regrowth of the Grove
A69: Total | B69: =SUM(B64:B68)+2*B63+B62 -> 101 | C69: =SUM(C64:C68)+2*C63+C62 -> 5 | D69: =SUM(D64:D68)+2*D63+D62 -> 2 | E69: =SUM(E64:E68)+2*E63+E62 -> 17 | F69: =SUM(F64:F68)+2*F63+F62 -> 11 | G69: =SUM(G64:G68)+2*G63+G62 -> 53 | H69: =SUM(H64:H68)+2*H63+H62 -> 0 | I69: =SUM(I64:I68)+2*I63+I62 -> 0 | J69: =SUM(J64:J68)+2*J63+J62 -> 4 | K69: =SUM(K64:K68)+2*K63+K62 -> 17 | L69: =SUM(L64:L68)+2*L63+L62 -> 9 | M69: =SUM(M64:M68)+2*M63+M62 -> 9 | N69: =SUM(N64:N68)+2*N63+N62 -> 8 | O69: =SUM(O64:O68)+2*O63+O62 -> 275 | P69: =SUM(P64:P68)+2*P63+P62 -> 80
A71: Plane of Hate | B71: AC | C71: STR | D71: STA | E71: AGI | F71: DEX | G71: WIS | H71: INT | I71: CHA | J71: PR | K71: MR | L71: DR | M71: FR | N71: CR | O71: Mana | P71: HP | Q71: Effect
A72: Sandals of Harmony | B72: 8 | I72: 13 | K72: 1 | M72: 1 | N72: 1 | O72: 10 | Q72: Spirit of Wolf
A73: Wristguard of Harmony | B73: 8 | G73: 8 | M73: 2 | O73: 15 | Q73: Drones of Doom
A74: Crown of Harmony | B74: 9 | D74: 2 | G74: 7 | K74: 2 | M74: 3 | N74: 2
A75: Gloves of Harmony | B75: 9 | D75: 2 | G75: 3 | J75: 1 | M75: 2 | O75: 20
A76: Greaves of Harmony | B76: 10 | C76: 6 | G76: 8 | K76: 3 | O76: 65 | Q76: Circle of Misty
A77: Vambraces of Harmony | B77: 8 | G77: 3 | O77: 25
A78: Hauberk of Harmony | B78: 22 | C78: 5 | G78: 12 | I78: 4 | L78: 5 | M78: 7 | N78: 5 | O78: 75 | P78: 35 | Q78: Regrowth of the Grove
A79: Total | B79: =SUM(B74:B78)+2*B73+B72 -> 82 | C79: =SUM(C74:C78)+2*C73+C72 -> 11 | D79: =SUM(D74:D78)+2*D73+D72 -> 4 | E79: =SUM(E74:E78)+2*E73+E72 -> 0 | F79: =SUM(F74:F78)+2*F73+F72 -> 0 | G79: =SUM(G74:G78)+2*G73+G72 -> 49 | H79: =SUM(H74:H78)+2*H73+H72 -> 0 | I79: =SUM(I74:I78)+2*I73+I72 -> 17 | J79: =SUM(J74:J78)+2*J73+J72 -> 1 | K79: =SUM(K74:K78)+2*K73+K72 -> 6 | L79: =SUM(L74:L78)+2*L73+L72 -> 5 | M79: =SUM(M74:M78)+2*M73+M72 -> 17 | N79: =SUM(N74:N78)+2*N73+N72 -> 8 | O79: =SUM(O74:O78)+2*O73+O72 -> 225 | P79: =SUM(P74:P78)+2*P73+P72 -> 35
A81: Plane of Fear | B81: AC | C81: STR | D81: STA | E81: AGI | F81: DEX | G81: WIS | H81: INT | I81: CHA | J81: PR | K81: MR | L81: DR | M81: FR | N81: CR | O81: Mana | P81: HP | Q81: Effect
A82: Vermiculated Boots | B82: 6 | C82: 5 | E82: 13 | P82: 15
A83: Vermiculated Bracelet | B83: 5 | G83: 9 | M83: 7 | N83: 7 | O83: 15
A84: Vermiculated Crown | B84: 7 | H84: 9 | I84: 13 | O84: 15
A85: Vermiculated Gloves | B85: 6 | F85: 13 | H85: 5 | L85: 7
A86: Vermiculated Leggings | B86: 8 | C86: 3 | G86: 5 | J86: 7
A87: Vermiculated Armsplate | B87: 7 | D87: 5 | E87: 5 | F87: 5 | K87: 7
A88: Vermiculated Tunic | B88: 15 | C88: 9 | D88: 9 | G88: 13 | P88: 35
A89: Total | B89: =SUM(B84:B88)+2*B83+B82 -> 59 | C89: =SUM(C84:C88)+2*C83+C82 -> 17 | D89: =SUM(D84:D88)+2*D83+D82 -> 14 | E89: =SUM(E84:E88)+2*E83+E82 -> 18 | F89: =SUM(F84:F88)+2*F83+F82 -> 18 | G89: =SUM(G84:G88)+2*G83+G82 -> 36 | H89: =SUM(H84:H88)+2*H83+H82 -> 14 | I89: =SUM(I84:I88)+2*I83+I82 -> 13 | J89: =SUM(J84:J88)+2*J83+J82 -> 7 | K89: =SUM(K84:K88)+2*K83+K82 -> 7 | L89: =SUM(L84:L88)+2*L83+L82 -> 7 | M89: =SUM(M84:M88)+2*M83+M82 -> 14 | N89: =SUM(N84:N88)+2*N83+N82 -> 14 | O89: =SUM(O84:O88)+2*O83+O82 -> 45 | P89: =SUM(P84:P88)+2*P83+P82 -> 50
A91: Skyshrine (Dragons) | B91: AC | C91: STR | D91: STA | E91: AGI | F91: DEX | G91: WIS | H91: INT | I91: CHA | J91: PR | K91: MR | L91: DR | M91: FR | N91: CR | O91: Mana | P91: HP | Q91: Effect
A92: Woven Grass Boots | B92: 8 | F92: 15 | J92: 2 | K92: 2 | L92: 2 | M92: 2 | N92: 2 | O92: 50 | Q92: Spirit of Wolf
A93: Woven Grass Bracelet | B93: 7 | G93: 9 | J93: 4 | K93: 4 | N93: 4 | O93: 30 | P93: 30 | Q93: Drones of Doom
A94: Woven Grass Headband | B94: 8 | C94: 3 | F94: 3 | G94: 10 | K94: 5 | L94: 3 | N94: 3 | O94: 15
A95: Woven Grass Gauntlets | B95: 8 | D95: 2 | F95: 2 | G95: 3 | K95: 5 | L95: 5 | O95: 45
A96: Woven Grass Greaves | B96: 9 | D96: 5 | E96: 6 | G96: 9 | J96: 3 | O96: 90 | P96: 20 | Q96: Circle of Misty
A97: Woven Grass Vambraces | B97: 7 | D97: 2 | G97: 5 | O97: 30 | P97: 30
A98: Woven Grass Chestguard | B98: 20 | C98: 5 | D98: 7 | G98: 14 | J98: 9 | K98: 9 | M98: 9 | O98: 80 | P98: 50 | Q98: Regrowth of the Grove
A99: Total | B99: =SUM(B94:B98)+2*B93+B92 -> 74 | C99: =SUM(C94:C98)+2*C93+C92 -> 8 | D99: =SUM(D94:D98)+2*D93+D92 -> 16 | E99: =SUM(E94:E98)+2*E93+E92 -> 6 | F99: =SUM(F94:F98)+2*F93+F92 -> 20 | G99: =SUM(G94:G98)+2*G93+G92 -> 59 | H99: =SUM(H94:H98)+2*H93+H92 -> 0 | I99: =SUM(I94:I98)+2*I93+I92 -> 0 | J99: =SUM(J94:J98)+2*J93+J92 -> 22 | K99: =SUM(K94:K98)+2*K93+K92 -> 29 | L99: =SUM(L94:L98)+2*L93+L92 -> 10 | M99: =SUM(M94:M98)+2*M93+M92 -> 11 | N99: =SUM(N94:N98)+2*N93+N92 -> 13 | O99: =SUM(O94:O98)+2*O93+O92 -> 370 | P99: =SUM(P94:P98)+2*P93+P92 -> 160
A101: Thurgadin (Dwarves) | B101: AC | C101: STR | D101: STA | E101: AGI | F101: DEX | G101: WIS | H101: INT | I101: CHA | J101: PR | K101: MR | L101: DR | M101: FR | N101: CR | O101: Mana | P101: HP | Q101: Effect
A102: Rowyl's Boots of Nature | B102: 8 | I102: 13 | K102: 1 | M102: 1 | N102: 1 | O102: 10 | Q102: Spirit of Wolf
A103: Rowyl's Bracer of Nature | B103: 7 | G103: 7 | M103: 2 | O103: 20 | Q103: Drones of Doom
A104: Rowyl's Circlet of Nature | B104: 8 | D104: 2 | G104: 8 | J104: 2 | K104: 3 | M104: 2
A105: Rowyl's Gauntlets of Nature | B105: 8 | D105: 2 | G105: 2 | J105: 1 | K105: 2 | O105: 25
A106: Rowyl's Greaves of Nature | B106: 9 | C106: 6 | G106: 7 | N106: 3 | O106: 70 | Q106: Circle of Misty
A107: Rowyl's Vambraces of Nature | B107: 7 | G107: 2 | O107: 30
A108: Rowyl's Chestguard of Nature | B108: 20 | C108: 5 | G108: 14 | I108: 4 | K108: 7 | L108: 5 | N108: 5 | O108: 80 | P108: 30 | Q108: Regrowth of the Grove
A109: Total | B109: =SUM(B104:B108)+2*B103+B102 -> 74 | C109: =SUM(C104:C108)+2*C103+C102 -> 11 | D109: =SUM(D104:D108)+2*D103+D102 -> 4 | E109: =SUM(E104:E108)+2*E103+E102 -> 0 | F109: =SUM(F104:F108)+2*F103+F102 -> 0 | G109: =SUM(G104:G108)+2*G103+G102 -> 47 | H109: =SUM(H104:H108)+2*H103+H102 -> 0 | I109: =SUM(I104:I108)+2*I103+I102 -> 17 | J109: =SUM(J104:J108)+2*J103+J102 -> 3 | K109: =SUM(K104:K108)+2*K103+K102 -> 13 | L109: =SUM(L104:L108)+2*L103+L102 -> 5 | M109: =SUM(M104:M108)+2*M103+M102 -> 7 | N109: =SUM(N104:N108)+2*N103+N102 -> 9 | O109: =SUM(O104:O108)+2*O103+O102 -> 255 | P109: =SUM(P104:P108)+2*P103+P102 -> 30
A111: Twilight Sea | B111: AC | C111: STR | D111: STA | E111: AGI | F111: DEX | G111: WIS | H111: INT | I111: CHA | J111: PR | K111: MR | L111: DR | M111: FR | N111: CR | O111: Mana | P111: HP | Q111: Effect
A112: Earth Blessed Boots (N/A)
A113: Earth Blessed Veil | B113: 5 | D113: 3 | F113: 1 | G113: 3 | K113: 1 | O113: 5 | P113: 2
A114: Earth Blessed Bracer | B114: 6 | D114: 3 | F114: 1 | G114: 3 | M114: 1 | O114: 5 | P114: 2
A115: Earth Blessed Cape | B115: 8 | D115: 3 | F115: 1 | G115: 4 | M115: 1 | N115: 1 | O115: 5 | P115: 3
A116: Earth Blessed Leggings | B116: 9 | D116: 3 | F116: 1 | G116: 4 | N116: 1 | O116: 10 | P116: 5
A117: Earth Blessed Sleeves | B117: 8 | D117: 3 | F117: 1 | G117: 4 | M117: 1 | O117: 5 | P117: 3
A118: Earth Blessed Tunic | B118: 15 | C118: 5 | F118: 3 | G118: 8 | K118: 2 | M118: 2 | N118: 2 | O118: 20 | P118: 10
A119: Total | B119: =SUM(B113:B118)+B114 -> 57 | C119: =SUM(C113:C118)+C114 -> 5 | D119: =SUM(D113:D118)+D114 -> 18 | E119: =SUM(E113:E118)+E114 -> 0 | F119: =SUM(F113:F118)+F114 -> 9 | G119: =SUM(G113:G118)+G114 -> 29 | H119: =SUM(H113:H118)+H114 -> 0 | I119: =SUM(I113:I118)+I114 -> 0 | J119: =SUM(J113:J118)+J114 -> 0 | K119: =SUM(K113:K118)+K114 -> 3 | L119: =SUM(L113:L118)+L114 -> 0 | M119: =SUM(M113:M118)+M114 -> 6 | N119: =SUM(N113:N118)+N114 -> 4 | O119: =SUM(O113:O118)+O114 -> 55 | P119: =SUM(P113:P118)+P114 -> 27
A121: Umbral Plains | B121: AC | C121: STR | D121: STA | E121: AGI | F121: DEX | G121: WIS | H121: INT | I121: CHA | J121: PR | K121: MR | L121: DR | M121: FR | N121: CR | O121: Mana | P121: HP | Q121: Effect
A122: Elysian Boots | B122: 13 | D122: 5 | G122: 4 | L122: 10 | O122: 15 | P122: 10
A123: Elysian Gloves | B123: 10 | C123: 6 | F123: 10 | G123: 3 | K123: 5 | O123: 25
A124: Elysian Arms | B124: 12 | C124: 5 | D124: 6 | G124: 4 | O124: 25 | P124: 25
A125: Elysian Tunic | B125: 24 | C125: 15 | D125: 5 | G125: 15 | J125: 8 | K125: 8 | L125: 8 | M125: 8 | N125: 8 | O125: 75 | P125: 15
A126: Elysian Crown | B126: 12 | C126: 5 | G126: 8 | M126: 10 | N126: 10
A127: Elysian Bracelet | B127: 8 | G127: 3 | J127: 10 | K127: 5 | O127: 15
A128: Elysian Leggings | B128: 15 | D128: 15 | G128: 7 | H128: 10 | N128: 10 | P128: 50
A129: Total | B129: =SUM(B122:B128)+B127 -> 102 | C129: =SUM(C122:C128)+C127 -> 31 | D129: =SUM(D122:D128)+D127 -> 31 | E129: =SUM(E122:E128)+E127 -> 0 | F129: =SUM(F122:F128)+F127 -> 10 | G129: =SUM(G122:G128)+G127 -> 47 | H129: =SUM(H122:H128)+H127 -> 10 | I129: =SUM(I122:I127)+I127 -> 0 | J129: =SUM(J122:J127)+J127 -> 28 | K129: =SUM(K122:K127)+K127 -> 23 | L129: =SUM(L122:L127)+L127 -> 18 | M129: =SUM(M122:M127)+M127 -> 18 | N129: =SUM(N122:N128)+N127 -> 28 | O129: =SUM(O122:O127)+O127 -> 170 | P129: =SUM(P122:P128)+P127 -> 100

A1: All information contained on this website copyright Thistlethorne Enterprises 2001-2002. Everquest copyright Sony Inc.