A1: Wizard DPS Chart and Calculatorby Gemdiver MyrcideThe table is currently configured to assume improved damage IV, full AA crits, spell haste IV, and mana preservation IV. If you need to change the settings for your own calculations the file can be found following the link below. There is a simple table like the one below for you to input your specific modifiers into and the table will re-adjust accordingly. Click here to download the Excel file for calculations and changing modifiers. *Weighted DPS includes criticals (e.g. if you have a 15% change of having a crit, weighted dps would be .15(crit dmg) + .85(regular dmg) ) Created by: Gemdiver of Fennin Ro Original Spell table from a link Whizbang supplied

A1: Dmg Modifier: | B1: 0.2
A2: Crit Modifier: | B2: 0.16
A3: Spell Haste Modifier: | B3: 0.15
A4: Mana Reduction Modifier: | B4: 0.2
A5: Range Modifier | B5: 0.15

A2: Spell Name | B2: Level | C2: Mana Ratio | D2: DPS | E2: Weighted DPS* | F2: Damage | G2: Mana | H2: Cast | I2: Range | J2: Critical | K2: Recast | L2: Resist
A3: Shock of Magic (max) | B3: 65 | C3: 5.00 | D3: =F2/H2 -> 647.05882352941194 | E3: 750.58823529411791 | F3: =F3*(1+$B$41) -> 3600 | G3: 540 | H3: =H3*(1-$B$43) -> 5.10 | I3: =I3*(1+$B$45) -> 230 | J3: =F22*2 -> 7200 | L3: magic (+20)
A4: Shock of Magic (min) | B4: 65 | C4: 2.00 | D4: =F3/H3 -> 258.8235294117647 | E4: 300.23529411764707 | F4: =F4*(1+$B$41) -> 1440 | G4: 540 | H4: =H4*(1-$B$43) -> 5.10 | I4: =I4*(1+$B$45) -> 230 | J4: =F23*2 -> 2880 | L4: magic (+20)
A5: Shock of Magic (averages) | B5: 65 | C5: 3.50 | D5: =F4/H4 -> 452.94117647058829 | E5: 525.41176470588232 | F5: =F5*(1+$B$41) -> 2520 | G5: 540 | H5: =H5*(1-$B$43) -> 5.10 | I5: =I5*(1+$B$45) -> 230 | J5: =F24*2 -> 5040 | L5: magic (+20)
A6: Strike of Solusek | B6: 65 | C6: 4.28125 | D6: =F5/H5 -> 443.23529411764713 | E6: 514.15294117647068 | F6: =F6*(1+$B$41) -> 3288 | G6: 576 | H6: =H6*(1-$B$43) -> 6.80 | I6: =I6*(1+$B$45) -> 230 | J6: =F25*2 -> 6576 | L6: fire (-10)
A7: Draught of E'ci | B7: 64 | C7: 3.7254900000000002 | D7: =F6/H6 -> 409.80392156862746 | E7: 475.3725490196079 | F7: =F7*(1+$B$41) -> 1140 | G7: 229.5 | H7: =H7*(1-$B$43) -> 2.55 | I7: =I7*(1+$B$45) -> 230 | J7: =F26*2 -> 2280 | L7: cold (-50)
A8: Agnarr's Thunder | B8: 63 | C8: 3.9741300000000002 | D8: =F7/H7 -> 426.1344537815126 | E8: 494.31596638655458 | F8: =F8*(1+$B$41) -> 2766 | G8: 522 | H8: =H8*(1-$B$43) -> 5.95 | I8: =I8*(1+$B$45) -> 230 | J8: =F27*2 -> 5532 | L8: magic
A9: Draught of Thunder | B9: 63 | C9: 3.73 | D9: =F8/H8 -> 409.80392156862746 | E9: 475.3725490196079 | F9: =F9*(1+$B$41) -> 1140 | G9: 229.5 | H9: =H9*(1-$B$43) -> 2.55 | I9: =I9*(1+$B$45) -> 230 | J9: =F28*2 -> 2280 | L9: magic(-50)
A10: Draught of Ro | B10: 62 | C10: 3.73 | D10: =F9/H9 -> 409.80392156862746 | E10: 475.3725490196079 | F10: =F10*(1+$B$41) -> 1140 | G10: 229.5 | H10: =H10*(1-$B$43) -> 2.55 | I10: =I10*(1+$B$45) -> 230 | J10: =F29*2 -> 2280 | L10: fire (-50)
A11: Lure of Ro | B11: 62 | C11: 2.83 | D11: =F10/H10 -> 307.71241830065361 | E11: 356.94640522875818 | F11: =F11*(1+$B$41) -> 1284 | G11: 340.2 | H11: =H11*(1-$B$43) -> 3.8250000000000002 | I11: =I11*(1+$B$45) -> 230 | J11: =F30*2 -> 2568 | L11: fire (-300)
A12: Lure of Thunder | B12: 61 | C12: 2.83 | D12: =F11/H11 -> 307.71241830065361 | E12: 356.94640522875818 | F12: =F12*(1+$B$41) -> 1284 | G12: 340.2 | H12: =H12*(1-$B$43) -> 3.8250000000000002 | I12: =I12*(1+$B$45) -> 230 | J12: =F31*2 -> 2568 | L12: magic (-300)
A13: Ancient: Destruction of Ice | B13: 60 | C13: 4.80 | D13: =F12/H12 -> 443.6974789915966 | E13: 514.68907563025209 | F13: =F13*(1+$B$41) -> 1440 | G13: 225 | H13: =H13*(1-$B$43) -> 2.9750000000000001 | I13: =I13*(1+$B$45) -> 172.5 | J13: =F32*2 -> 2880 | K13: 13.0 | L13: cold (-10)
A14: Draught of Ice | B14: 60 | C14: 3.40 | D14: =F13/H13 -> 315.33333333333337 | E14: 365.78666666666669 | F14: =F14*(1+$B$41) -> 877.2 | G14: 193.5 | H14: =H14*(1-$B$43) -> 2.55 | I14: =I14*(1+$B$45) -> 230 | J14: =F33*2 -> 1754.4 | L14: cold (-10)
A15: Elnerick's Electrical Rending | B15: 60 | C15: 3.60 | D15: =F14/H14 -> 326.11764705882354 | E15: 378.29647058823525 | F15: =F15*(1+$B$41) -> 2268 | G15: 472.5 | H15: =H15*(1-$B$43) -> 6.375 | I15: =I15*(1+$B$45) -> 230 | J15: =F34*2 -> 4536 | L15: magic
A16: Garrisson's Superior Sundering | B16: 60 | C16: 3.8887999999999998 | D16: =F15/H15 -> 339.70588235294116 | E16: 394.05882352941177 | F16: =F16*(1+$B$41) -> 2520 | G16: 486 | H16: =H16*(1-$B$43) -> 6.80 | I16: =I16*(1+$B$45) -> 230 | J16: =F35*2 -> 5040 | L16: fire (-10)
A17: Ice Spear of the Soloist | B17: 60 | C17: 4.00 | D17: =F16/H16 -> 388.23529411764707 | E17: 450.35294117647061 | F17: =F17*(1+$B$41) -> 1440 | G17: 270 | H17: =H17*(1-$B$43) -> 3.40 | I17: =I17*(1+$B$45) -> 172.5 | J17: =F36*2 -> 2880 | K17: 13.0 | L17: cold (-10)
A18: Lure of Ice | B18: 60 | C18: 2.5779999999999998 | D18: =F17/H17 -> 237.25490196078437 | E18: 275.21568627450984 | F18: =F18*(1+$B$41) -> 908 | G18: 288 | H18: =H18*(1-$B$43) -> 3.8250000000000002 | I18: =I18*(1+$B$45) -> 230 | J18: =F37*2 -> 1980 | L18: cold (-300)
A19: Sunstrike | B19: 60 | C19: 3.5888800000000001 | D19: 230.714 | E19: =(($B$42*J38)+(1-$B$42)*F38)/H38 -> 377.82857142857142 | F19: =F19*(1+$B$41) -> 1938 | G19: =G19*(1-$B$44) -> 405 | H19: =H19*(1-$B$43) -> 5.95 | I19: =I19*(1+$B$45) -> 230 | J19: =F38*2 -> 3876 | L19: fire (-10)