A1: <!-- function buddy_pop() { window.open('index.php?act=buddy&s=9ef2fee806e809bcda335792e9d4b43d','BrowserBuddy','width=250,height=500,resizable=yes,scrollbars=yes'); } function chat_pop(cw,ch) { window.open('index.php?s=9ef2fee806e809bcda335792e9d4b43d&act=chat&pop=1','Chat','width='+cw+',height='+ch+',resizable=yes,scrollbars=yes'); } function multi_page_jump( url_bit, total_posts, per_page ) { pages = 1; cur_st = parseInt(""); cur_page = 1; if ( total_posts % per_page == 0 ) { pages = total_posts / per_page; } else { pages = Math.ceil( total_posts / per_page ); } msg = "Please enter a page number to jump to between 1 and" + " " + pages; if ( cur_st > 0 ) { cur_page = cur_st / per_page; cur_page = cur_page -1; } show_page = 1; if ( cur_page < pages ) { show_page = cur_page + 1; } if ( cur_page >= pages ) { show_page = cur_page - 1; } else { show_page = cur_page + 1; } userPage = prompt( msg, show_page ); if ( userPage > 0 ) { if ( userPage < 1 ) { userPage = 1; } if ( userPage > pages ) { userPage = pages; } if ( userPage == 1 ) { start = 0; } else { start = (userPage - 1) * per_page; } window.location = url_bit + "&st=" + start; } } //--> Powered by Invision Power Board(U) v1.3.1 Final © 2003 IPS, Inc. MyiBPortal v1.2 by Yauws.com © 2003

A1: Tanarus Player League -> TPL Player Standings

A1: Forum Nav Site Navigation Member Info Who's Online | B1: <!--table {mso-displayed-decimal-separator:"\."; mso-displayed-thousand-separator:"\,";} .font55783 {color:black; font-size:8.0pt; font-weight:700; font-style:normal; text-decoration:none; font-family:Tahoma; mso-generic-font-family:auto; mso-font-charset:0;} .xl155783 {padding:0px; mso-ignore:padding; color:windowtext; font-size:10.0pt; font-weight:400; font-style:normal; text-decoration:none; font-family:Arial; mso-generic-font-family:auto; mso-font-charset:0; mso-number-format:General; text-align:general; vertical-align:bottom; mso-background-source:auto; mso-pattern:auto; white-space:nowrap;} .xl245783 {padding:0px; mso-ignore:padding; color:windowtext; font-size:10.0pt; font-weight:700; font-style:normal; text-decoration:none; font-family:Arial, sans-serif; mso-font-charset:0; mso-number-format:General; text-align:general; vertical-align:bottom; border-top:none; border-right:none; border-bottom:2.0pt double windowtext; border-left:none; mso-background-source:auto; mso-pattern:auto; white-space:nowrap;} .xl255783 {padding:0px; mso-ignore:padding; color:windowtext; font-size:10.0pt; font-weight:400; font-style:normal; text-decoration:none; font-family:Arial; mso-generic-font-family:auto; mso-font-charset:0; mso-number-format:General; text-align:center; vertical-align:bottom; mso-background-source:auto; mso-pattern:auto; white-space:nowrap;} .xl265783 {padding:0px; mso-ignore:padding; color:windowtext; font-size:10.0pt; font-weight:700; font-style:normal; text-decoration:none; font-family:Arial, sans-serif; mso-font-charset:0; mso-number-format:General; text-align:center; vertical-align:bottom; border-top:none; border-right:none; border-bottom:2.0pt double windowtext; border-left:none; mso-background-source:auto; mso-pattern:auto; white-space:nowrap;} .xl275783 {padding:0px; mso-ignore:padding; color:windowtext; font-size:10.0pt; font-weight:400; font-style:italic; text-decoration:none; font-family:Arial, sans-serif; mso-font-charset:0; mso-number-format:General; text-align:left; vertical-align:bottom; mso-background-source:auto; mso-pattern:auto; white-space:nowrap;} .xl285783 {padding:0px; mso-ignore:padding; color:windowtext; font-size:10.0pt; font-weight:400; font-style:normal; text-decoration:none; font-family:Arial; mso-generic-font-family:auto; mso-font-charset:0; mso-number-format:General; text-align:center; vertical-align:bottom; border:.5pt solid windowtext; mso-background-source:auto; mso-pattern:auto; white-space:nowrap;} .xl295783 {padding:0px; mso-ignore:padding; color:windowtext; font-size:10.0pt; font-weight:400; font-style:normal; text-decoration:none; font-family:Arial; mso-generic-font-family:auto; mso-font-charset:0; mso-number-format:General; text-align:general; vertical-align:bottom; border:.5pt solid windowtext; mso-background-source:auto; mso-pattern:auto; white-space:nowrap;} .xl305783 {padding:0px; mso-ignore:padding; color:red; font-size:10.0pt; font-weight:700; font-style:normal; text-decoration:none; font-family:Arial, sans-serif; mso-font-charset:0; mso-number-format:General; text-align:center; vertical-align:bottom; border:.5pt solid windowtext; mso-background-source:auto; mso-pattern:auto; white-space:nowrap;} .xl315783 {padding:0px; mso-ignore:padding; color:windowtext; font-size:10.0pt; font-weight:400; font-style:normal; text-decoration:none; font-family:Arial; mso-generic-font-family:auto; mso-font-charset:0; mso-number-format:General; text-align:center; vertical-align:bottom; border-top:none; border-right:.5pt solid windowtext; border-bottom:.5pt solid windowtext; border-left:.5pt solid windowtext; mso-background-source:auto; mso-pattern:auto; white-space:nowrap;} .xl325783 {padding:0px; mso-ignore:padding; color:windowtext; font-size:10.0pt; font-weight:400; font-style:normal; text-decoration:none; font-family:Arial; mso-generic-font-family:auto; mso-font-charset:0; mso-number-format:General; text-align:general; vertical-align:bottom; border-top:none; border-right:.5pt solid windowtext; border-bottom:.5pt solid windowtext; border-left:.5pt solid windowtext; mso-background-source:auto; mso-pattern:auto; white-space:nowrap;} .xl335783 {padding:0px; mso-ignore:padding; color:red; font-size:10.0pt; font-weight:700; font-style:normal; text-decoration:none; font-family:Arial, sans-serif; mso-font-charset:0; mso-number-format:General; text-align:center; vertical-align:bottom; border-top:none; border-right:.5pt solid windowtext; border-bottom:.5pt solid windowtext; border-left:.5pt solid windowtext; mso-background-source:auto; mso-pattern:auto; white-space:nowrap;} --> Player Stats Player Stats

B1: <!-- var Nav_bV=parseInt(navigator.appVersion); Nav_NS4=(document.layers) ? true : false; Nav_IE4=((document.all)&&(Nav_bV>=4))?true:false; Nav_FB=((navigator.appName == "Netscape")&&(Nav_bV>=4))?true:false; Nav_ver4 = (Nav_NS4 || Nav_IE4 || Nav_FB ) ? true : false; Nav_isExpanded = false; function Nav_DoNothing() { // return; } function Nav_getIndex($1) { ind = null; for (i=0; i<document.layers.length; i++) { whichEl = document.layers[i]; if (whichEl.id == $1) { ind = i; break; } } return ind; } function Nav_arrange() { nextY = document.layers[firstInd].pageY + document.layers[firstInd].document.height; for (i=firstInd+1; i<document.layers.length; i++) { whichEl = document.layers[i]; if (whichEl.visibility != "hide") { whichEl.pageY = nextY; nextY += whichEl.document.height; } } } function Nav_FolderInit(){ if (Nav_NS4) { firstEl = "m1Parent"; firstInd = Nav_getIndex(firstEl); showAll(); for (i=0; i<document.layers.length; i++) { whichEl = document.layers[i]; if (whichEl.id.indexOf("NavChild") != -1) whichEl.visibility = "hide"; } arrange(); } else if (Nav_IE4) { tempColl = document.all.tags("DIV"); for (i=0; i<tempColl.length; i++) { if (tempColl(i).className == "NavChild") { tempColl(i).style.display = "none"; } } } else { var divCollection = document.getElementsByTagName("div"); for (i=0; i<divCollection.length; i++) { var divObj = divCollection[i]; if (divObj.className == "NavChild") { divObj.style.display = "none"; } } } } function Nav_FolderExpand($1) { if (!Nav_ver4) return; if (Nav_IE4) { Nav_ExpandIE($1); } else if (Nav_FB) { Nav_ExpandNS6($1); } else { Nav_ExpandNS($1) } } function Nav_ExpandIE($1) { Expanda = eval($1 + "a"); Expanda.blur() ExpandChild = eval($1 + "Child"); ExpandTree = eval($1 + "Tree"); if (ExpandChild.style.display == "none") { ExpandChild.style.display = "block"; ExpandTree.src = "http://kashin.org/images/minus.gif"; } else { ExpandChild.style.display = "none"; ExpandTree.src = "http://kashin.org/images/plus.gif"; } } function Nav_ExpandNS6($1) { Expanda = document.getElementById($1 + "a"); Expanda.blur() ExpandChild = document.getElementById($1 + "Child"); ExpandTree = document.getElementById($1 + "Tree"); if (ExpandChild.style.display == "none") { ExpandChild.style.display = "block"; ExpandTree.src = "http://kashin.org/images/minus.gif"; } else { ExpandChild.style.display = "none"; ExpandTree.src = "http://kashin.org/images/plus.gif"; } } function Nav_ExpandNS($1) { ExpandChild = eval("document." + $1 + "Child") ExpandTree = eval("document." + $1 + "Parent.document." + $1 + "Tree") if (ExpandChild.visibility == "hide") { ExpandChild.visibility = "show"; ExpandTree.src = "http://kashin.org/images/minus.gif"; } else { ExpandChild.visibility = "hide"; ExpandTree.src = "http://kashin.org/images/plus.gif"; } arrange(); } function Nav_showAll() { for (i=firstInd; i<document.layers.length; i++) { whichEl = document.layers[i]; whichEl.visibility = "show"; } } with (document) { write("<style type='text/css'>"); write(".NavChild { display:none }"); write("</style>"); } onload = Nav_FolderInit; //--> Home Forums News Site News League News Open Area Xin's Tips League Team Chat General League Talk

A2: TPL Rules
A3: TPL Schedule
A4: Team Standings
A5: Player Standings
A6: Free Agents

B1: Username: Password: Not a member?Register today.

B1: 2 guests, 0 members and 0 anonymous members none [ View Complete List ]

A1: # | B1: Player | C1: Team | D1: Kills | E1: Deaths | F1: Suicides | G1: PP | H1: MVP | I1: Rating
A2: 1 | B2: Porlin | C2: 5 | D2: 24 | E2: 8 | F2: 0 | G2: 0 | H2: 1.5 | I2: =(D2-E2)-(2*F2)-(G2)+(5*H2) -> 23.5
A3: 2 | B3: Saint | C3: 7 | D3: 19 | E3: 8 | F3: 0 | G3: 0 | H3: 2 | I3: =(D3-E3)-(2*F3)-(G3)+(5*H3) -> 21
A4: 3 | B4: ~Wing~ | C4: 1 | D4: 14 | E4: 2 | F4: 0 | G4: 0 | H4: 1 | I4: =(D4-E4)-(2*F4)-(G4)+(5*H4) -> 17
A5: 4 | B5: Phelix | C5: 1 | D5: 21 | E5: 10 | F5: 0 | G5: 0 | H5: 1 | I5: =(D5-E5)-(2*F5)-(G5)+(5*H5) -> 16
A6: 5 | B6: Panzer | C6: 5 | D6: 17 | E6: 7 | F6: 0 | G6: 0 | H6: 1 | I6: =(D6-E6)-(2*F6)-(G6)+(5*H6) -> 15
A7: 6 | B7: Hoose | C7: 3 | D7: 15 | E7: 5 | F7: 0 | G7: 0 | H7: 1 | I7: =(D7-E7)-(2*F7)-(G7)+(5*H7) -> 15
A8: 7 | B8: CyberGod | C8: 5 | D8: 12 | E8: 1 | F8: 0 | G8: 0 | H8: 0.5 | I8: =(D8-E8)-(2*F8)-(G8)+(5*H8) -> 13.5
A9: 8 | B9: Bane | C9: 10 | D9: 7 | E9: 0 | F9: 0 | G9: 0 | H9: 1 | I9: =(D9-E9)-(2*F9)-(G9)+(5*H9) -> 12
A10: 9 | B10: Ninja | C10: 6 | D10: 11 | E10: 5 | F10: 0 | G10: 0 | H10: 1 | I10: =(D10-E10)-(2*F10)-(G10)+(5*H10) -> 11
A11: 10 | B11: Noy | C11: 4 | D11: 7 | E11: 1 | F11: 0 | G11: 0 | H11: 1 | I11: =(D11-E11)-(2*F11)-(G11)+(5*H11) -> 11
A12: 11 | B12: BooBoo | C12: 3 | D12: 15 | E12: 10 | F12: 0 | G12: 0 | H12: 1 | I12: =(D12-E12)-(2*F12)-(G12)+(5*H12) -> 10
A13: 12 | B13: Listerine | C13: 9 | D13: 8 | E13: 3 | F13: 0 | G13: 0 | H13: 1 | I13: =(D13-E13)-(2*F13)-(G13)+(5*H13) -> 10
A14: 13 | B14: Crimson | C14: 1 | D14: 13 | E14: 4 | F14: 0 | G14: 0 | H14: 0 | I14: =(D14-E14)-(2*F14)-(G14)+(5*H14) -> 9
A15: 14 | B15: MaYa[N] | C15: 6 | D15: 9 | E15: 6 | F15: 0 | G15: 0 | H15: 1 | I15: =(D15-E15)-(2*F15)-(G15)+(5*H15) -> 8
A16: 15 | B16: Enus | C16: 3 | D16: 21 | E16: 14 | F16: 0 | G16: 0 | H16: 0 | I16: =(D16-E16)-(2*F16)-(G16)+(5*H16) -> 7
A17: 16 | B17: [FE]Van0r | C17: 10 | D17: 7 | E17: 1 | F17: 0 | G17: 0 | H17: 0 | I17: =(D17-E17)-(2*F17)-(G17)+(5*H17) -> 6
A18: 17 | B18: Kanuck | C18: 3 | D18: 7 | E18: 2 | F18: 0 | G18: 0 | H18: 0 | I18: =(D18-E18)-(2*F18)-(G18)+(5*H18) -> 5
A19: 18 | B19: Weedman | C19: 7 | D19: 6 | E19: 3 | F19: 0 | G19: 0 | H19: 0 | I19: =(D19-E19)-(2*F19)-(G19)+(5*H19) -> 3
A20: 19 | B20: imprex | C20: 6 | D20: 6 | E20: 3 | F20: 0 | G20: 0 | H20: 0 | I20: =(D20-E20)-(2*F20)-(G20)+(5*H20) -> 3
A21: 20 | B21: Atturo | C21: 4 | D21: 4 | E21: 1 | F21: 0 | G21: 0 | H21: 0 | I21: =(D21-E21)-(2*F21)-(G21)+(5*H21) -> 3
A22: 21 | B22: kcpdad | C22: 5 | D22: 3 | E22: 0 | F22: 0 | G22: 0 | H22: 0 | I22: =(D22-E22)-(2*F22)-(G22)+(5*H22) -> 3
A23: 22 | B23: Red5 | C23: 4 | D23: 11 | E23: 9 | F23: 0 | G23: 0 | H23: 0 | I23: =(D23-E23)-(2*F23)-(G23)+(5*H23) -> 2
A24: 23 | B24: Bart | C24: 4 | D24: 4 | E24: 2 | F24: 0 | G24: 0 | H24: 0 | I24: =(D24-E24)-(2*F24)-(G24)+(5*H24) -> 2
A25: 24 | B25: SiGars | C25: 3 | D25: 3 | E25: 1 | F25: 0 | G25: 0 | H25: 0 | I25: =(D25-E25)-(2*F25)-(G25)+(5*H25) -> 2
A26: 25 | B26: Caesar | C26: 8 | D26: 6 | E26: 5 | F26: 0 | G26: 0 | H26: 0 | I26: =(D26-E26)-(2*F26)-(G26)+(5*H26) -> 1
A27: 26 | B27: kanTANKrus | C27: 9 | D27: 4 | E27: 3 | F27: 0 | G27: 0 | H27: 0 | I27: =(D27-E27)-(2*F27)-(G27)+(5*H27) -> 1
A28: 27 | B28: Dante | C28: 2 | D28: 1 | E28: 0 | F28: 0 | G28: 0 | H28: 0 | I28: =(D28-E28)-(2*F28)-(G28)+(5*H28) -> 1
A29: 28 | B29: go~mick | C29: 4 | D29: 9 | E29: 9 | F29: 0 | G29: 0 | H29: 0 | I29: =(D29-E29)-(2*F29)-(G29)+(5*H29) -> 0
A30: 29 | B30: TR~Justice | C30: 6 | D30: 3 | E30: 3 | F30: 0 | G30: 0 | H30: 0 | I30: =(D30-E30)-(2*F30)-(G30)+(5*H30) -> 0
A31: 30 | B31: DR~Driver | C31: 9 | D31: 2 | E31: 2 | F31: 0 | G31: 0 | H31: 0 | I31: =(D31-E31)-(2*F31)-(G31)+(5*H31) -> 0
A32: 31 | B32: KingPain | C32: 8 | D32: 2 | E32: 2 | F32: 0 | G32: 0 | H32: 0 | I32: =(D32-E32)-(2*F32)-(G32)+(5*H32) -> 0
A33: 32 | B33: R2~D2 | D33: 2 | E33: 2 | F33: 0 | G33: 0 | H33: 0 | I33: =(D33-E33)-(2*F33)-(G33)+(5*H33) -> 0
A34: 33 | B34: [CK]Fox | C34: 6 | D34: 0 | E34: 0 | F34: 0 | G34: 0 | H34: 0 | I34: =(D34-E34)-(2*F34)-(G34)+(5*H34) -> 0
A35: 34 | B35: [CK]Tech | C35: 3 | D35: 0 | E35: 0 | F35: 0 | G35: 0 | H35: 0 | I35: =(D35-E35)-(2*F35)-(G35)+(5*H35) -> 0
A36: 35 | B36: [gb]Vanner | D36: 0 | E36: 0 | F36: 0 | G36: 0 | H36: 0 | I36: =(D36-E36)-(2*F36)-(G36)+(5*H36) -> 0
A37: 36 | B37: [Gotenks] | D37: 0 | E37: 0 | F37: 0 | G37: 0 | H37: 0 | I37: =(D37-E37)-(2*F37)-(G37)+(5*H37) -> 0
A38: 37 | B38: [x]zibi[T] | D38: 0 | E38: 0 | F38: 0 | G38: 0 | H38: 0 | I38: =(D38-E38)-(2*F38)-(G38)+(5*H38) -> 0
A39: 38 | B39: ~Aphrodite | D39: 0 | E39: 0 | F39: 0 | G39: 0 | H39: 0 | I39: =(D39-E39)-(2*F39)-(G39)+(5*H39) -> 0
A40: 39 | B40: ~Imation~ | C40: 3 | D40: 0 | E40: 0 | F40: 0 | G40: 0 | H40: 0 | I40: =(D40-E40)-(2*F40)-(G40)+(5*H40) -> 0
A41: 40 | B41: 1MinuteMan | D41: 0 | E41: 0 | F41: 0 | G41: 0 | H41: 0 | I41: =(D41-E41)-(2*F41)-(G41)+(5*H41) -> 0
A42: 41 | B42: Aeshettr | C42: 7 | D42: 0 | E42: 0 | F42: 0 | G42: 0 | H42: 0 | I42: =(D42-E42)-(2*F42)-(G42)+(5*H42) -> 0
A43: 42 | B43: alittleguy | C43: 4 | D43: 0 | E43: 0 | F43: 0 | G43: 0 | H43: 0 | I43: =(D43-E43)-(2*F43)-(G43)+(5*H43) -> 0
A44: 43 | B44: Bluish | D44: 0 | E44: 0 | F44: 0 | G44: 0 | H44: 0 | I44: =(D44-E44)-(2*F44)-(G44)+(5*H44) -> 0
A45: 44 | B45: Caesium | D45: 0 | E45: 0 | F45: 0 | G45: 0 | H45: 0 | I45: =(D45-E45)-(2*F45)-(G45)+(5*H45) -> 0
A46: 45 | B46: Decrepify | D46: 0 | E46: 0 | F46: 0 | G46: 0 | H46: 0 | I46: =(D46-E46)-(2*F46)-(G46)+(5*H46) -> 0
A47: 46 | B47: Dime | C47: 8 | D47: 0 | E47: 0 | F47: 0 | G47: 0 | H47: 0 | I47: =(D47-E47)-(2*F47)-(G47)+(5*H47) -> 0
A48: 47 | B48: donkeyted | C48: 2 | D48: 0 | E48: 0 | F48: 0 | G48: 0 | H48: 0 | I48: =(D48-E48)-(2*F48)-(G48)+(5*H48) -> 0
A49: 48 | B49: Fuel | D49: 0 | E49: 0 | F49: 0 | G49: 0 | H49: 0 | I49: =(D49-E49)-(2*F49)-(G49)+(5*H49) -> 0
A50: 49 | B50: FuNkYmUnKy | D50: 0 | E50: 0 | F50: 0 | G50: 0 | H50: 0 | I50: =(D50-E50)-(2*F50)-(G50)+(5*H50) -> 0
A51: 50 | B51: Grumpy | C51: 1 | D51: 0 | E51: 0 | F51: 0 | G51: 0 | H51: 0 | I51: =(D51-E51)-(2*F51)-(G51)+(5*H51) -> 0
A52: 51 | B52: HelpMePlz | C52: 5 | D52: 0 | E52: 0 | F52: 0 | G52: 0 | H52: 0 | I52: =(D52-E52)-(2*F52)-(G52)+(5*H52) -> 0
A53: 52 | B53: Lowes | D53: 0 | E53: 0 | F53: 0 | G53: 0 | H53: 0 | I53: =(D53-E53)-(2*F53)-(G53)+(5*H53) -> 0
A54: 53 | B54: Mercury | D54: 0 | E54: 0 | F54: 0 | G54: 0 | H54: 0 | I54: =(D54-E54)-(2*F54)-(G54)+(5*H54) -> 0
A55: 54 | B55: Metrol | D55: 0 | E55: 0 | F55: 0 | G55: 0 | H55: 0 | I55: =(D55-E55)-(2*F55)-(G55)+(5*H55) -> 0
A56: 55 | B56: ph0e | C56: 2 | D56: 0 | E56: 0 | F56: 0 | G56: 0 | H56: 0 | I56: =(D56-E56)-(2*F56)-(G56)+(5*H56) -> 0
A57: 56 | B57: Poppy | C57: 10 | D57: 0 | E57: 0 | F57: 0 | G57: 0 | H57: 0 | I57: =(D57-E57)-(2*F57)-(G57)+(5*H57) -> 0
A58: 57 | B58: Quatre | D58: 0 | E58: 0 | F58: 0 | G58: 0 | H58: 0 | I58: =(D58-E58)-(2*F58)-(G58)+(5*H58) -> 0
A59: 58 | B59: Red5~Jr | D59: 0 | E59: 0 | F59: 0 | G59: 0 | H59: 0 | I59: =(D59-E59)-(2*F59)-(G59)+(5*H59) -> 0
A60: 59 | B60: Romeo | C60: 7 | D60: 0 | E60: 0 | F60: 0 | G60: 0 | H60: 0 | I60: =(D60-E60)-(2*F60)-(G60)+(5*H60) -> 0
A61: 60 | B61: Rutgers | D61: 0 | E61: 0 | F61: 0 | G61: 0 | H61: 0 | I61: =(D61-E61)-(2*F61)-(G61)+(5*H61) -> 0
A62: 61 | B62: Savior | C62: 5 | D62: 0 | E62: 0 | F62: 0 | G62: 0 | H62: 0 | I62: =(D62-E62)-(2*F62)-(G62)+(5*H62) -> 0
A63: 62 | B63: Smoked | C63: 8 | D63: 0 | E63: 0 | F63: 0 | G63: 0 | H63: 0 | I63: =(D63-E63)-(2*F63)-(G63)+(5*H63) -> 0
A64: 63 | B64: Sophmore | D64: 0 | E64: 0 | F64: 0 | G64: 0 | H64: 0 | I64: =(D64-E64)-(2*F64)-(G64)+(5*H64) -> 0
A65: 64 | B65: Spartan | C65: 7 | D65: 0 | E65: 0 | F65: 0 | G65: 0 | H65: 0 | I65: =(D65-E65)-(2*F65)-(G65)+(5*H65) -> 0
A66: 65 | B66: TheFool | D66: 0 | E66: 0 | F66: 0 | G66: 0 | H66: 0 | I66: =(D66-E66)-(2*F66)-(G66)+(5*H66) -> 0
A67: 66 | B67: TR~Storax | D67: 0 | E67: 0 | F67: 0 | G67: 0 | H67: 0 | I67: =(D67-E67)-(2*F67)-(G67)+(5*H67) -> 0
A68: 67 | B68: Tread | D68: 0 | E68: 0 | F68: 0 | G68: 0 | H68: 0 | I68: =(D68-E68)-(2*F68)-(G68)+(5*H68) -> 0
A69: 68 | B69: Trixta | C69: 7 | D69: 0 | E69: 0 | F69: 0 | G69: 0 | H69: 0 | I69: =(D69-E69)-(2*F69)-(G69)+(5*H69) -> 0
A70: 69 | B70: W~thunda~W | D70: 0 | E70: 0 | F70: 0 | G70: 0 | H70: 0 | I70: =(D70-E70)-(2*F70)-(G70)+(5*H70) -> 0
A71: 70 | B71: Worm | D71: 0 | E71: 0 | F71: 0 | G71: 0 | H71: 0 | I71: =(D71-E71)-(2*F71)-(G71)+(5*H71) -> 0
A72: 71 | B72: X~VET~BLOOD | D72: 0 | E72: 0 | F72: 0 | G72: 0 | H72: 0 | I72: =(D72-E72)-(2*F72)-(G72)+(5*H72) -> 0
A73: 72 | B73: Zags | C73: 7 | D73: 0 | E73: 0 | F73: 0 | G73: 0 | H73: 0 | I73: =(D73-E73)-(2*F73)-(G73)+(5*H73) -> 0
A74: 73 | B74: Junjulis | C74: 6 | D74: 15 | E74: 16 | F74: 0 | G74: 0 | H74: 0 | I74: =(D74-E74)-(2*F74)-(G74)+(5*H74) -> -1
A75: 74 | B75: Bergy | C75: 2 | D75: 8 | E75: 12 | F75: 0 | G75: 0 | H75: 0.5 | I75: =(D75-E75)-(2*F75)-(G75)+(5*H75) -> -1.5
A76: 75 | B76: vacondor | C76: 5 | D76: 2 | E76: 4 | F76: 0 | G76: 0 | H76: 0 | I76: =(D76-E76)-(2*F76)-(G76)+(5*H76) -> -2
A77: 76 | B77: Sedated1 | C77: 6 | D77: 1 | E77: 3 | F77: 0 | G77: 0 | H77: 0 | I77: =(D77-E77)-(2*F77)-(G77)+(5*H77) -> -2
A78: 77 | B78: Keith | D78: 0 | E78: 2 | F78: 0 | G78: 0 | H78: 0 | I78: =(D78-E78)-(2*F78)-(G78)+(5*H78) -> -2
A79: 78 | B79: DriveBy | C79: 8 | D79: 1 | E79: 4 | F79: 0 | G79: 0 | H79: 0 | I79: =(D79-E79)-(2*F79)-(G79)+(5*H79) -> -3
A80: 79 | B80: CarpetFuzz01 | C80: 9 | D80: 9 | E80: 13 | F80: 0 | G80: 0 | H80: 0 | I80: =(D80-E80)-(2*F80)-(G80)+(5*H80) -> -4
A81: 80 | B81: OldSch00l | C81: 9 | D81: 15 | E81: 20 | F81: 0 | G81: 0 | H81: 0 | I81: =(D81-E81)-(2*F81)-(G81)+(5*H81) -> -5
A82: 81 | B82: PainGank | C82: 10 | D82: 6 | E82: 11 | F82: 0 | G82: 0 | H82: 0 | I82: =(D82-E82)-(2*F82)-(G82)+(5*H82) -> -5
A83: 82 | B83: AntiShock | C83: 4 | D83: 0 | E83: 5 | F83: 0 | G83: 0 | H83: 0 | I83: =(D83-E83)-(2*F83)-(G83)+(5*H83) -> -5
A84: 83 | B84: Nabster | C84: 2 | D84: 3 | E84: 7 | F84: 2 | G84: 0 | H84: 0.5 | I84: =(D84-E84)-(2*F84)-(G84)+(5*H84) -> -5.5
A85: 84 | B85: Willow21 | C85: 10 | D85: 9 | E85: 15 | F85: 0 | G85: 0 | H85: 0 | I85: =(D85-E85)-(2*F85)-(G85)+(5*H85) -> -6
A86: 85 | B86: Fact | C86: 1 | D86: 7 | E86: 13 | F86: 0 | G86: 0 | H86: 0 | I86: =(D86-E86)-(2*F86)-(G86)+(5*H86) -> -6
A87: 86 | B87: Mardi | C87: 2 | D87: 2 | E87: 8 | F87: 0 | G87: 0 | H87: 0 | I87: =(D87-E87)-(2*F87)-(G87)+(5*H87) -> -6
A88: 87 | B88: Enigma | C88: 1 | D88: 1 | E88: 7 | F88: 0 | G88: 0 | H88: 0 | I88: =(D88-E88)-(2*F88)-(G88)+(5*H88) -> -6
A89: 88 | B89: Soullessone | C89: 4 | D89: 1 | E89: 7 | F89: 0 | G89: 0 | H89: 0 | I89: =(D89-E89)-(2*F89)-(G89)+(5*H89) -> -6
A90: 89 | B90: Lutinet | C90: 7 | D90: 8 | E90: 15 | F90: 0 | G90: 0 | H90: 0 | I90: =(D90-E90)-(2*F90)-(G90)+(5*H90) -> -7
A91: 90 | B91: TR~Alan | C91: 9 | D91: 0 | E91: 7 | F91: 0 | G91: 0 | H91: 0 | I91: =(D91-E91)-(2*F91)-(G91)+(5*H91) -> -7
A92: 91 | B92: Zucheto | C92: 10 | D92: 1 | E92: 9 | F92: 0 | G92: 0 | H92: 0 | I92: =(D92-E92)-(2*F92)-(G92)+(5*H92) -> -8
A93: 92 | B93: bogy | C93: 1 | D93: 1 | E93: 9 | F93: 0 | G93: 0 | H93: 0 | I93: =(D93-E93)-(2*F93)-(G93)+(5*H93) -> -8
A94: 93 | B94: 66~CHARGER | C94: 2 | D94: 10 | E94: 19 | F94: 0 | G94: 0 | H94: 0 | I94: =(D94-E94)-(2*F94)-(G94)+(5*H94) -> -9
A95: 94 | B95: Xin | C95: 9 | D95: 7 | E95: 16 | F95: 0 | G95: 0 | H95: 0 | I95: =(D95-E95)-(2*F95)-(G95)+(5*H95) -> -9
A96: 95 | B96: Sako | C96: 8 | D96: 4 | E96: 13 | F96: 0 | G96: 0 | H96: 0 | I96: =(D96-E96)-(2*F96)-(G96)+(5*H96) -> -9
A97: 96 | B97: TwisTa | C97: 10 | D97: 1 | E97: 11 | F97: 0 | G97: 0 | H97: 0 | I97: =(D97-E97)-(2*F97)-(G97)+(5*H97) -> -10
A98: 97 | B98: Coldeath | C98: 1 | D98: 3 | E98: 16 | F98: 0 | G98: 0 | H98: 0 | I98: =(D98-E98)-(2*F98)-(G98)+(5*H98) -> -13
A99: 98 | B99: [GR]Shiner | C99: 8 | D99: 8 | E99: 22 | F99: 0 | G99: 0 | H99: 0 | I99: =(D99-E99)-(2*F99)-(G99)+(5*H99) -> -14
A100: 99 | B100: C-3PO | C100: 8 | D100: 7 | E100: 22 | F100: 0 | G100: 0 | H100: 0 | I100: =(D100-E100)-(2*F100)-(G100)+(5*H100) -> -15
A102: Rating=([Kills-Deaths]-[2*Suicides]-[PP]+[5*MVP]))