B1: STELS | C1: KODD | D1: SVAR | E1: KODD | F1: STARKA | G1: SKODD | H1: PANSAR | I1: KEDJA | J1: SVAR | K1: KEDJA | L1: STARK | M1: KEDJA
A2: BRONZE
A4: HAUBEK | B4: 187 | C4: =B4*80% -> 149.6 | D4: 262 | E4: =D4*80% -> 209.6 | F4: 525 | G4: =F4*80% -> 420 | H4: 375 | I4: =H4*80% -> 300 | J4: 656 | K4: =J4*80% -> 524.8 | L4: 1125 | M4: =L4*80% -> 900
A5: LEGS/HELM | B5: 112 | C5: =B5*80% -> 89.6 | D5: 157 | E5: =D5*80% -> 125.6 | F5: 315 | G5: =F5*80% -> 252 | H5: 225 | I5: =H5*80% -> 180 | J5: 393 | K5: =J5*80% -> 314.4 | L5: 675 | M5: =L5*80% -> 540
A6: SLEEVES | B6: 75 | C6: =B6*80% -> 60 | D6: 105 | E6: =D6*80% -> 84 | F6: 210 | G6: =F6*80% -> 168 | H6: 150 | I6: =H6*80% -> 120 | J6: 262 | K6: =J6*80% -> 209.6 | L6: 450 | M6: =L6*80% -> 360
A7: BOOTS/GLOVES | B7: 37 | C7: =B7*80% -> 29.6 | D7: 52 | E7: =D7*80% -> 41.6 | F7: 105 | G7: =F7*80% -> 84 | H7: 75 | I7: =H7*80% -> 60 | J7: 131 | K7: =J7*80% -> 104.8 | L7: 225 | M7: =L7*80% -> 180
A8: Full Suit | B8: =B4+B5+B5+B6+B7+B7 -> 560 | C8: =C4+C5+C5+C6+C7+C7 -> 448 | D8: =D4+D5+D5+D6+D7+D7 -> 785 | E8: =E4+E5+E5+E6+E7+E7 -> 628 | F8: =F4+F5+F5+F6+F7+F7 -> 1575 | G8: =G4+G5+G5+G6+G7+G7 -> 1260 | H8: =H4+H5+H5+H6+H7+H7 -> 1125 | I8: =I4+I5+I5+I6+I7+I7 -> 900 | J8: =J4+J5+J5+J6+J7+J7 -> 1966 | K8: =K4+K5+K5+K6+K7+K7 -> 1572.8 | L8: =L4+L5+L5+L6+L7+L7 -> 3375 | M8: =M4+M5+M5+M6+M7+M7 -> 2700
A9: IRON
A11: HAUBEK | B11: 3000 | C11: =B11*80% -> 2400 | D11: 4200 | E11: =D11*80% -> 3360 | F11: 8400 | G11: =F11*80% -> 6720 | H11: 6000 | I11: =H11*80% -> 4800 | J11: 10500 | K11: =J11*80% -> 8400 | L11: 10800 | M11: =L11*80% -> 8640
A12: LEGS/HELM | B12: 1800 | C12: =B12*80% -> 1440 | D12: 2520 | E12: =D12*80% -> 2016 | F12: 5040 | G12: =F12*80% -> 4032 | H12: 3600 | I12: =H12*80% -> 2880 | J12: 6300 | K12: =J12*80% -> 5040 | L12: 10000 | M12: =L12*80% -> 8000
A13: SLEEVES | B13: 1500 | C13: =B13*80% -> 1200 | D13: 1680 | E13: =D13*80% -> 1344 | F13: 3360 | G13: =F13*80% -> 2688 | H13: 2400 | I13: =H13*80% -> 1920 | J13: 4200 | K13: =J13*80% -> 3360 | L13: 7200 | M13: =L13*80% -> 5760
A14: BOOTS/GLOVES | B14: 1200 | C14: =B14*80% -> 960 | D14: 840 | E14: =D14*80% -> 672 | F14: 1680 | G14: =F14*80% -> 1344 | H14: 1200 | I14: =H14*80% -> 960 | J14: 2100 | K14: =J14*80% -> 1680 | L14: 3600 | M14: =L14*80% -> 2880
A15: Full Suit | B15: =B11+B12+B12+B13+B14+B14 -> 10500 | C15: =C11+C12+C12+C13+C14+C14 -> 8400 | D15: =D11+D12+D12+D13+D14+D14 -> 12600 | E15: =E11+E12+E12+E13+E14+E14 -> 10080 | F15: =F11+F12+F12+F13+F14+F14 -> 25200 | G15: =G11+G12+G12+G13+G14+G14 -> 20160 | H15: =H11+H12+H12+H13+H14+H14 -> 18000 | I15: =I11+I12+I12+I13+I14+I14 -> 14400 | J15: =J11+J12+J12+J13+J14+J14 -> 31500 | K15: =K11+K12+K12+K13+K14+K14 -> 25200 | L15: =L11+L12+L12+L13+L14+L14 -> 45200 | M15: =M11+M12+M12+M13+M14+M14 -> 36160
A16: STEEL
A18: HAUBEK | B18: 12000 | C18: =B18*80% -> 9600 | D18: 16800 | E18: =D18*80% -> 13440 | F18: 33600 | G18: =F18*80% -> 26880 | H18: 24000 | I18: =H18*80% -> 19200 | J18: 42000 | K18: =J18*80% -> 33600 | L18: 72000 | M18: =L18*80% -> 57600
A19: LEGS/HELM | B19: 7200 | C19: =B19*80% -> 5760 | D19: 10080 | E19: =D19*80% -> 8064 | F19: 20160 | G19: =F19*80% -> 16128 | H19: 14400 | I19: =H19*80% -> 11520 | J19: 25200 | K19: =J19*80% -> 20160 | L19: 43200 | M19: =L19*80% -> 34560
A20: SLEEVES | B20: 4800 | C20: =B20*80% -> 3840 | D20: 6720 | E20: =D20*80% -> 5376 | F20: 13440 | G20: =F20*80% -> 10752 | H20: 9600 | I20: =H20*80% -> 7680 | J20: 16800 | K20: =J20*80% -> 13440 | L20: 28800 | M20: =L20*80% -> 23040
A21: BOOTS/GLOVES | B21: 2400 | C21: =B21*80% -> 1920 | D21: 3360 | E21: =D21*80% -> 2688 | F21: 6720 | G21: =F21*80% -> 5376 | H21: 4800 | I21: =H21*80% -> 3840 | J21: 8400 | K21: =J21*80% -> 6720 | L21: 14400 | M21: =L21*80% -> 11520
A22: Full Suit | B22: =B18+B19+B19+B20+B21+B21 -> 36000 | C22: =C18+C19+C19+C20+C21+C21 -> 28800 | D22: =D18+D19+D19+D20+D21+D21 -> 50400 | E22: =E18+E19+E19+E20+E21+E21 -> 40320 | F22: =F18+F19+F19+F20+F21+F21 -> 100800 | G22: =G18+G19+G19+G20+G21+G21 -> 80640 | H22: =H18+H19+H19+H20+H21+H21 -> 72000 | I22: =I18+I19+I19+I20+I21+I21 -> 57600 | J22: =J18+J19+J19+J20+J21+J21 -> 126000 | K22: =K18+K19+K19+K20+K21+K21 -> 100800 | L22: =L18+L19+L19+L20+L21+L21 -> 216000 | M22: =M18+M19+M19+M20+M21+M21 -> 172800
A23: ALLOY
A25: HAUBEK | B25: 36000 | C25: =B25*80% -> 28800 | D25: 50400 | E25: =D25*80% -> 40320 | F25: 100800 | G25: =F25*80% -> 80640 | H25: 72000 | I25: =H25*80% -> 57600 | J25: 126000 | K25: =J25*80% -> 100800 | L25: 216000 | M25: =L25*80% -> 172800
A26: LEGS/HELM | B26: 21600 | C26: =B26*80% -> 17280 | D26: 30400 | E26: =D26*80% -> 24320 | F26: 60480 | G26: =F26*80% -> 48384 | H26: 43200 | I26: =H26*80% -> 34560 | J26: 75600 | K26: =J26*80% -> 60480 | L26: 129600 | M26: =L26*80% -> 103680
A27: SLEEVES | B27: 14400 | C27: =B27*80% -> 11520 | D27: 20160 | E27: =D27*80% -> 16128 | F27: 40320 | G27: =F27*80% -> 32256 | H27: 28800 | I27: =H27*80% -> 23040 | J27: 50400 | K27: =J27*80% -> 40320 | L27: 86400 | M27: =L27*80% -> 69120
A28: BOOTS/GLOVES | B28: 7200 | C28: =B28*80% -> 5760 | D28: 10080 | E28: =D28*80% -> 8064 | F28: 20160 | G28: =F28*80% -> 16128 | H28: 14400 | I28: =H28*80% -> 11520 | J28: 25200 | K28: =J28*80% -> 20160 | L28: 43200 | M28: =L28*80% -> 34560
A29: Full Suit | B29: =B25+B26+B26+B27+B28+B28 -> 108000 | C29: =C25+C26+C26+C27+C28+C28 -> 86400 | D29: =D25+D26+D26+D27+D28+D28 -> 151520 | E29: =E25+E26+E26+E27+E28+E28 -> 121216 | F29: =F25+F26+F26+F27+F28+F28 -> 302400 | G29: =G25+G26+G26+G27+G28+G28 -> 241920 | H29: =H25+H26+H26+H27+H28+H28 -> 216000 | I29: =I25+I26+I26+I27+I28+I28 -> 172800 | J29: =J25+J26+J26+J27+J28+J28 -> 378000 | K29: =K25+K26+K26+K27+K28+K28 -> 302400 | L29: =L25+L26+L26+L27+L28+L28 -> 648000 | M29: =M25+M26+M26+M27+M28+M28 -> 518400
A30: FINE ALLOY
A32: HAUBEK | B32: 108000 | C32: =B32*80% -> 86400 | D32: 151200 | E32: =D32*80% -> 120960 | F32: 302400 | G32: =F32*80% -> 241920 | H32: 216000 | I32: =H32*80% -> 172800 | J32: 378000 | K32: =J32*80% -> 302400 | L32: 648000 | M32: =L32*80% -> 518400
A33: LEGS/HELM | B33: 64800 | C33: =B33*80% -> 51840 | D33: 90720 | E33: =D33*80% -> 72576 | F33: 181440 | G33: =F33*80% -> 145152 | H33: 129600 | I33: =H33*80% -> 103680 | J33: 226800 | K33: =J33*80% -> 181440 | L33: 388800 | M33: =L33*80% -> 311040
A34: SLEEVES | B34: 43200 | C34: =B34*80% -> 34560 | D34: 60480 | E34: =D34*80% -> 48384 | F34: 120960 | G34: =F34*80% -> 96768 | H34: 86400 | I34: =H34*80% -> 69120 | J34: 151200 | K34: =J34*80% -> 120960 | L34: 259200 | M34: =L34*80% -> 207360
A35: BOOTS/GLOVES | B35: 21600 | C35: =B35*80% -> 17280 | D35: 30240 | E35: =D35*80% -> 24192 | F35: 60480 | G35: =F35*80% -> 48384 | H35: 43200 | I35: =H35*80% -> 34560 | J35: 756 | K35: =J35*80% -> 604.8 | L35: 129600 | M35: =L35*80% -> 103680
A36: Full Suit | B36: =B32+B33+B33+B34+B35+B35 -> 324000 | C36: =C32+C33+C33+C34+C35+C35 -> 259200 | D36: =D32+D33+D33+D34+D35+D35 -> 453600 | E36: =E32+E33+E33+E34+E35+E35 -> 362880 | F36: =F32+F33+F33+F34+F35+F35 -> 907200 | G36: =G32+G33+G33+G34+G35+G35 -> 725760 | H36: =H32+H33+H33+H34+H35+H35 -> 648000 | I36: =I32+I33+I33+I34+I35+I35 -> 518400 | J36: =J32+J33+J33+J34+J35+J35 -> 984312 | K36: =K32+K33+K33+K34+K35+K35 -> 787449.6 | L36: =L32+L33+L33+L34+L35+L35 -> 1944000 | M36: =M32+M33+M33+M34+M35+M35 -> 1555200
A37: MYTHRIL
A39: HAUBEK | B39: 216000 | C39: =B39*80% -> 172800 | D39: 302400 | E39: =D39*80% -> 241920 | F39: 604800 | G39: =F39*80% -> 483840 | H39: 432000 | I39: =H39*80% -> 345600 | J39: 756000 | K39: =J39*80% -> 604800 | L39: 1296000 | M39: =L39*80% -> 1036800
A40: LEGS/HELM | B40: 129600 | C40: =B40*80% -> 103680 | D40: 181440 | E40: =D40*80% -> 145152 | F40: 362880 | G40: =F40*80% -> 290304 | H40: 259200 | I40: =H40*80% -> 207360 | J40: 453600 | K40: =J40*80% -> 362880 | L40: 777600 | M40: =L40*80% -> 622080
A41: SLEEVES | B41: 86400 | C41: =B41*80% -> 69120 | D41: 120960 | E41: =D41*80% -> 96768 | F41: 241920 | G41: =F41*80% -> 193536 | H41: 172800 | I41: =H41*80% -> 138240 | J41: 302400 | K41: =J41*80% -> 241920 | L41: 518400 | M41: =L41*80% -> 414720
A42: BOOTS/GLOVES | B42: 43200 | C42: =B42*80% -> 34560 | D42: 60480 | E42: =D42*80% -> 48384 | F42: 120960 | G42: =F42*80% -> 96768 | H42: 86400 | I42: =H42*80% -> 69120 | J42: 151200 | K42: =J42*80% -> 120960 | L42: 259200 | M42: =L42*80% -> 207360
A43: Full Suit | B43: =B39+B40+B40+B41+B42+B42 -> 648000 | C43: =C39+C40+C40+C41+C42+C42 -> 518400 | D43: =D39+D40+D40+D41+D42+D42 -> 907200 | E43: =E39+E40+E40+E41+E42+E42 -> 725760 | F43: =F39+F40+F40+F41+F42+F42 -> 1814400 | G43: =G39+G40+G40+G41+G42+G42 -> 1451520 | H43: =H39+H40+H40+H41+H42+H42 -> 1296000 | I43: =I39+I40+I40+I41+I42+I42 -> 1036800 | J43: =J39+J40+J40+J41+J42+J42 -> 2268000 | K43: =K39+K40+K40+K41+K42+K42 -> 1814400 | L43: =L39+L40+L40+L41+L42+L42 -> 3888000 | M43: =M39+M40+M40+M41+M42+M42 -> 3110400