A1: Name | B1: Effect | C1: Ranking | D1: AC | E1: STR | F1: STA | G1: AGI | H1: DEX | I1: WIS | J1: INT | K1: CHA | L1: HP | M1: MANA | N1: PR | O1: MR | P1: DR | Q1: FR | R1: CR | S1: WT | T1: Type
A2: Ssra's Bloodstone Eyepatch | B2: Truesight | C2: =(I2*10)+M2+(D2*4)+G2+(L2/5)+(F2*2)+(E2*2)+(K2*2)+(O2/2)+(Q2/2)+(R2/2)+(N2/4)+(P2/4)+30 -> 446 | D2: 35.0 | E2: 10.0 | I2: 15.0 | J2: 15.0 | L2: 75.0 | M2: 75.0 | N2: 8.0 | O2: 8.0 | P2: 8.0 | Q2: 8.0 | R2: 8.0 | S2: 0.0 | T2: face
A3: Akkirus' Mask of Warfare | C3: =(I3*10)+M3+(D3*4)+G3+(L3/5)+(F3*2)+(E3*2)+(K3*2)+(O3/2)+(Q3/2)+(R3/2)+(N3/4)+(P3/4) -> 426 | D3: 30.0 | E3: 10.0 | F3: 10.0 | G3: 10.0 | H3: 10.0 | I3: 10.0 | J3: 10.0 | K3: 10.0 | L3: 100.0 | M3: 100.0 | N3: 8.0 | O3: 8.0 | P3: 8.0 | Q3: 8.0 | R3: 8.0 | S3: 0.0 | T3: face
A4: Mask of the Silver Eyes | B4: Flowing Thought I | C4: =(I4*10)+M4+(D4*4)+G4+(L4/5)+(F4*2)+(E4*2)+(K4*2)+(O4/2)+(Q4/2)+(R4/2)+(N4/4)+(P4/4)+30 -> 368 | D4: 25.0 | F4: 12.0 | I4: 12.0 | J4: 12.0 | L4: 20.0 | M4: 80.0 | N4: 5.0 | O4: 5.0 | P4: 5.0 | Q4: 5.0 | R4: 5.0 | S4: 0.5 | T4: face
A5: Warmaster's Mask of Battle | B5: Flowing Thought III | C5: =(I5*10)+M5+(D5*4)+G5+(L5/5)+(F5*2)+(E5*2)+(K5*2)+(O5/2)+(Q5/2)+(R5/2)+(N5/4)+(P5/4) -> 364 | D5: 13 | E5: 13 | I5: 13 | J5: 13 | K5: 13 | L5: 100 | M5: 100 | N5: 5 | O5: 5 | P5: 5 | Q5: 5 | R5: 5 | S5: 3 | U5: face
A6: Mask of Terror | C6: =(I6*10)+M6+(D6*4)+G6+(L6/5)+(F6*2)+(E6*2)+(K6*2)+(O6/2)+(Q6/2)+(R6/2)+(N6/4)+(P6/4) -> 238 | D6: 12.0 | I6: 12.0 | L6: 50.0 | M6: 50.0 | N6: 5.0 | O6: 5.0 | P6: 5.0 | Q6: 5.0 | R6: 5.0 | S6: 3.5 | T6: face
A7: Sky Watcher's Monocle | C7: =(I7*10)+M7+(D7*4)+G7+(L7/5)+(F7*2)+(E7*2)+(K7*2)+(O7/2)+(Q7/2)+(R7/2)+(N7/4)+(P7/4) -> 230 | D7: 15.0 | G7: 10.0 | H7: 10.0 | I7: 10.0 | L7: 50.0 | M7: 50.0 | S7: 0.0 | T7: face
A8: Eye of Cazic Thule | B8: Flowing Thought I | C8: =(I8*10)+M8+(D8*4)+G8+(L8/5)+(F8*2)+(E8*2)+(K8*2)+(O8/2)+(Q8/2)+(R8/2)+(N8/4)+(P8/4)+30 -> 220 | D8: 15.0 | F8: 5.0 | I8: 5.0 | J8: 5.0 | K8: -25.0 | L8: 50.0 | M8: 100.0 | N8: 5.0 | O8: 5.0 | P8: 5.0 | Q8: 5.0 | R8: 5.0 | S8: 0.5 | T8: face
A9: Mask of Pulchritude | C9: =(I9*10)+M9+(D9*4)+G9+(L9/5)+(F9*2)+(E9*2)+(K9*2)+(O9/2)+(Q9/2)+(R9/2)+(N9/4)+(P9/4) -> 185 | D9: 20 | J9: 15 | K9: 40 | M9: 25 | S9: 00.1 | U9: face
A10: Tobrin's Mystical Eyepatch | B10: See Invisible | C10: =(I10*10)+M10+(D10*4)+G10+(L10/5)+(F10*2)+(E10*2)+(K10*2)+(O10/2)+(Q10/2)+(R10/2)+(N10/4)+(P10/4)+30 -> 180 | D10: 0.0 | I10: 15.0 | J10: 15.0 | S10: 00.1 | T10: face
A11: Centien Visor | C11: =(I11*10)+M11+(D11*4)+G11+(L11/5)+(F11*2)+(E11*2)+(K11*2)+(O11/2)+(Q11/2)+(R11/2)+(N11/4)+(P11/4) -> 179 | D11: 15 | I11: 9 | J11: 9 | L11: 15 | M11: 20 | P11: 8 | R11: 8 | S11: 1 | U11: face
A12: Golem's Jawbone | C12: =(I12*10)+M12+(D12*4)+G12+(L12/5)+(F12*2)+(E12*2)+(K12*2)+(O12/2)+(Q12/2)+(R12/2)+(N12/4)+(P12/4) -> 175 | D12: 5 | I12: 8 | J12: 8 | K12: 10 | L12: 25 | M12: 50 | S12: 1 | U12: face
A13: Mask of War | B13: Yaulp II | C13: =(I13*10)+M13+(D13*4)+G13+(L13/5)+(F13*2)+(E13*2)+(K13*2)+(O13/2)+(Q13/2)+(R13/2)+(N13/4)+(P13/4)+30 -> 170 | D13: 9.0 | E13: 2.0 | F13: 5.0 | I13: 9.0 | S13: 00.2 | T13: face
A14: Transparent Eyepatch | C14: =(I14*10)+M14+(D14*4)+G14+(L14/5)+(F14*2)+(E14*2)+(K14*2)+(O14/2)+(Q14/2)+(R14/2)+(N14/4)+(P14/4) -> 160 | D14: 15.0 | H14: 10.0 | M14: 100.0 | S14: 0.0 | T14: face
A15: Drake-Hide Mask | C15: =(I15*10)+M15+(D15*4)+G15+(L15/5)+(F15*2)+(E15*2)+(K15*2)+(O15/2)+(Q15/2)+(R15/2)+(N15/4)+(P15/4) -> 159.5 | D15: 4.0 | E15: 10.0 | G15: 10.0 | H15: 10.0 | I15: 10.0 | M15: 10.0 | O15: 7.0 | S15: 00.4 | T15: face
A16: Triumphant Mask | C16: =(I16*10)+M16+(D16*4)+G16+(L16/5)+(F16*2)+(E16*2)+(K16*2)+(O16/2)+(Q16/2)+(R16/2)+(N16/4)+(P16/4) -> 155 | D16: 10.0 | E16: 7.0 | G16: 7.0 | I16: 7.0 | K16: 7.0 | O16: 20.0 | S16: 0.5 | T16: face
A17: Ancient Pirate's Eyepatch | C17: =(I17*10)+M17+(D17*4)+G17+(L17/5)+(F17*2)+(E17*2)+(K17*2)+(O17/2)+(Q17/2)+(R17/2)+(N17/4)+(P17/4) -> 130 | D17: 20.0 | F17: 10.0 | G17: 10.0 | H17: 10.0 | N17: 10.0 | O17: 10.0 | P17: 10.0 | Q17: 10.0 | R17: 10.0 | S17: 0.5 | T17: face
A18: Tattered Flesh Veil | C18: =(I18*10)+M18+(D18*4)+G18+(L18/5)+(F18*2)+(E18*2)+(K18*2)+(O18/2)+(Q18/2)+(R18/2)+(N18/4)+(P18/4) -> 128.5 | D18: 4.0 | I18: 7.0 | J18: 7.0 | M18: 40.0 | N18: 10.0 | S18: 3.0 | T18: face
A19: Mask of Fall | C19: =(I19*10)+M19+(D19*4)+G19+(L19/5)+(F19*2)+(E19*2)+(K19*2)+(O19/2)+(Q19/2)+(R19/2)+(N19/4)+(P19/4) -> 120 | D19: 15.0 | J19: 7.0 | M19: 55.0 | N19: 10.0 | P19: 10.0 | S19: 0.0 | T19: face
A20: Maple Leaf Mask | C20: =(I20*10)+M20+(D20*4)+G20+(L20/5)+(F20*2)+(E20*2)+(K20*2)+(O20/2)+(Q20/2)+(R20/2)+(N20/4)+(P20/4) -> 113 | D20: 4.0 | F20: 8.0 | I20: 6.0 | K20: 8.0 | N20: 10.0 | P20: 10.0 | S20: 00.2 | T20: face
A21: Bone Mask of the Enslaved | C21: =(I21*10)+M21+(D21*4)+G21+(L21/5)+(F21*2)+(E21*2)+(K21*2)+(O21/2)+(Q21/2)+(R21/2)+(N21/4)+(P21/4) -> 112 | D21: 7 | I21: 4 | M21: 40 | O21: 4 | Q21: 4 | S21: 2 | U21: face
A22: Eyepatch of Plunder | B22: Captain Nalots Quickening | C22: =(I22*10)+M22+(D22*4)+G22+(L22/5)+(F22*2)+(E22*2)+(K22*2)+(O22/2)+(Q22/2)+(R22/2)+(N22/4)+(P22/4)+30 -> 112 | D22: 10.0 | E22: 10.0 | H22: 10.0 | L22: 50.0 | N22: 6.0 | O22: 6.0 | P22: 6.0 | Q22: 6.0 | R22: 6.0 | S22: 0.5 | T22: face
A23: Mask of the Dragon Slayer | C23: =(I23*10)+M23+(D23*4)+G23+(L23/5)+(F23*2)+(E23*2)+(K23*2)+(O23/2)+(Q23/2)+(R23/2)+(N23/4)+(P23/4) -> 111.5 | D23: 15.0 | E23: 8.0 | G23: 8.0 | K23: 5.0 | L23: 50.0 | O23: 5.0 | Q23: 5.0 | R23: 5.0 | S23: 00.8 | T23: face
A24: Wito Xi Tetoracu | B24: Flowing Thought II | C24: =(I24*10)+M24+(D24*4)+G24+(L24/5)+(F24*2)+(E24*2)+(K24*2)+(O24/2)+(Q24/2)+(R24/2)+(N24/4)+(P24/4) -> 108.75 | D24: 15 | L24: 25 | M24: 25 | P24: 25 | R24: 25 | S24: 00.1 | U24: face
A25: Face Mask of Bumblok | C25: =(I25*10)+M25+(D25*4)+G25+(L25/5)+(F25*2)+(E25*2)+(K25*2)+(O25/2)+(Q25/2)+(R25/2)+(N25/4)+(P25/4) -> 108 | D25: 2.0 | I25: 4.0 | M25: 50.0 | Q25: 10.0 | R25: 10.0 | S25: 00.1 | T25: face
A26: Velium Ruby Veil | C26: =(I26*10)+M26+(D26*4)+G26+(L26/5)+(F26*2)+(E26*2)+(K26*2)+(O26/2)+(Q26/2)+(R26/2)+(N26/4)+(P26/4) -> 96 | D26: 0.0 | E26: 8.0 | I26: 8.0 | S26: 00.1 | T26: face
A27: Mushroom Veil | C27: =(I27*10)+M27+(D27*4)+G27+(L27/5)+(F27*2)+(E27*2)+(K27*2)+(O27/2)+(Q27/2)+(R27/2)+(N27/4)+(P27/4) -> 90.75 | D27: 8 | H27: 12 | M27: 55 | P27: 15 | S27: 1 | U27: face
A28: Bone Mask of the Jarsath | C28: =(I28*10)+M28+(D28*4)+G28+(L28/5)+(F28*2)+(E28*2)+(K28*2)+(O28/2)+(Q28/2)+(R28/2)+(N28/4)+(P28/4) -> 90.5 | D28: 7.0 | E28: 2.0 | I28: 4.0 | K28: 8.0 | N28: 5.0 | P28: 5.0 | S28: 3.0 | T28: face
A29: Polished Mithril Mask | C29: =(I29*10)+M29+(D29*4)+G29+(L29/5)+(F29*2)+(E29*2)+(K29*2)+(O29/2)+(Q29/2)+(R29/2)+(N29/4)+(P29/4) -> 90 | D29: 5.0 | I29: 7.0 | J29: 7.0 | S29: 00.8 | T29: face
A30: Enshrouded Veil | C30: =(I30*10)+M30+(D30*4)+G30+(L30/5)+(F30*2)+(E30*2)+(K30*2)+(O30/2)+(Q30/2)+(R30/2)+(N30/4)+(P30/4) -> 89 | D30: 7.0 | I30: 2.0 | J30: 2.0 | L30: 30.0 | M30: 30.0 | Q30: 10.0 | S30: 00.1 | T30: face
A31: Stained Cloth Mask | B31: Ultravision | C31: =(I31*10)+M31+(D31*4)+G31+(L31/5)+(F31*2)+(E31*2)+(K31*2)+(O31/2)+(Q31/2)+(R31/2)+(N31/4)+(P31/4)+30 -> 88.5 | D31: 6.0 | K31: 4.0 | L31: 20.0 | M31: 20.0 | N31: 5.0 | P31: 5.0 | S31: 3.0 | T31: face
A32: Imbued Platinum Ruby Veil | C32: =(I32*10)+M32+(D32*4)+G32+(L32/5)+(F32*2)+(E32*2)+(K32*2)+(O32/2)+(Q32/2)+(R32/2)+(N32/4)+(P32/4) -> 88 | D32: 0.0 | E32: 7.0 | F32: 4.0 | G32: -4.0 | I32: 7.0 | S32: 00.1 | T32: face
A33: Platinum Ruby Veil | C33: =(I33*10)+M33+(D33*4)+G33+(L33/5)+(F33*2)+(E33*2)+(K33*2)+(O33/2)+(Q33/2)+(R33/2)+(N33/4)+(P33/4) -> 84 | D33: 0.0 | E33: 7.0 | I33: 7.0 | S33: 00.1 | T33: face
A34: Crystal Spider Eyes | C34: =(I34*10)+M34+(D34*4)+G34+(L34/5)+(F34*2)+(E34*2)+(K34*2)+(O34/2)+(Q34/2)+(R34/2)+(N34/4)+(P34/4) -> 74 | D34: 8.0 | L34: 35.0 | M34: 35.0 | S34: 0.0 | T34: face
A35: Velium War Mask | C35: =(I35*10)+M35+(D35*4)+G35+(L35/5)+(F35*2)+(E35*2)+(K35*2)+(O35/2)+(Q35/2)+(R35/2)+(N35/4)+(P35/4) -> 73 | D35: 2.0 | I35: 4.0 | J35: 4.0 | M35: 25.0 | S35: 0.0 | T35: face
A36: Mask of Swirling Water | C36: =(I36*10)+M36+(D36*4)+G36+(L36/5)+(F36*2)+(E36*2)+(K36*2)+(O36/2)+(Q36/2)+(R36/2)+(N36/4)+(P36/4) -> 71 | D36: 4.0 | H36: 5.0 | I36: 5.0 | L36: 25.0 | S36: 0.0 | T36: face
A37: Snow Storm Mask | B37: Heat Sight | C37: =(I37*10)+M37+(D37*4)+G37+(L37/5)+(F37*2)+(E37*2)+(K37*2)+(O37/2)+(Q37/2)+(R37/2)+(N37/4)+(P37/4)+30 -> 70.5 | D37: 7.0 | E37: 4.0 | R37: 9.0 | S37: 0.0 | T37: face
A38: Earth Blessed Veil | C38: =(I38*10)+M38+(D38*4)+G38+(L38/5)+(F38*2)+(E38*2)+(K38*2)+(O38/2)+(Q38/2)+(R38/2)+(N38/4)+(P38/4) -> 61.9 | D38: 5 | F38: 3 | H38: 1 | I38: 3 | L38: 2 | M38: 5 | O38: 1 | S38: 1 | U38: face
A39: Withered Leather Mask | C39: =(I39*10)+M39+(D39*4)+G39+(L39/5)+(F39*2)+(E39*2)+(K39*2)+(O39/2)+(Q39/2)+(R39/2)+(N39/4)+(P39/4) -> 58 | D39: 3.0 | I39: 2.0 | K39: 8.0 | M39: 10.0 | S39: 00.4 | T39: face
A40: Enchanted Velium Mask | B40: Enduring Breath | C40: =(I40*10)+M40+(D40*4)+G40+(L40/5)+(F40*2)+(E40*2)+(K40*2)+(O40/2)+(Q40/2)+(R40/2)+(N40/4)+(P40/4)+30 -> 57.5 | D40: 5.0 | G40: 5.0 | R40: 5.0 | S40: 1.4 | T40: face
A41: Silver Dragon Tattoo | C41: =(I41*10)+M41+(D41*4)+G41+(L41/5)+(F41*2)+(E41*2)+(K41*2)+(O41/2)+(Q41/2)+(R41/2)+(N41/4)+(P41/4) -> 56 | D41: 2.0 | E41: 4.0 | I41: 4.0 | S41: 00.1 | T41: face
A42: Silvery Mask | B42: Identify | C42: =(I42*10)+M42+(D42*4)+G42+(L42/5)+(F42*2)+(E42*2)+(K42*2)+(O42/2)+(Q42/2)+(R42/2)+(N42/4)+(P42/4)+30 -> 55 | D42: 5.0 | L42: 25.0 | S42: 00.2 | T42: face
A43: Braided Beard of the Coldain | B43: Berserker Strength | C43: =(I43*10)+M43+(D43*4)+G43+(L43/5)+(F43*2)+(E43*2)+(K43*2)+(O43/2)+(Q43/2)+(R43/2)+(N43/4)+(P43/4)+30 -> 54.5 | D43: 5.0 | G43: 3.0 | O43: 3.0 | S43: 1.0 | T43: face
A44: Archon's Mask | C44: =(I44*10)+M44+(D44*4)+G44+(L44/5)+(F44*2)+(E44*2)+(K44*2)+(O44/2)+(Q44/2)+(R44/2)+(N44/4)+(P44/4) -> 54 | D44: 6 | I44: 2 | M44: 10 | S44: 1.5 | U44: face
A45: Impenetrable Mask of Al'Kabor | C45: =(I45*10)+M45+(D45*4)+G45+(L45/5)+(F45*2)+(E45*2)+(K45*2)+(O45/2)+(Q45/2)+(R45/2)+(N45/4)+(P45/4) -> 54 | D45: 9.0 | L45: 40.0 | M45: 10.0 | S45: 00.1 | T45: face
A46: Larrikan's Mask | B46: Superior Camouflage | C46: =(I46*10)+M46+(D46*4)+G46+(L46/5)+(F46*2)+(E46*2)+(K46*2)+(O46/2)+(Q46/2)+(R46/2)+(N46/4)+(P46/4)+30 -> 54 | D46: 6.0 | S46: 00.4 | T46: face
A47: Mask of Wurms | C47: =(I47*10)+M47+(D47*4)+G47+(L47/5)+(F47*2)+(E47*2)+(K47*2)+(O47/2)+(Q47/2)+(R47/2)+(N47/4)+(P47/4) -> 54 | D47: 5.0 | E47: 4.0 | G47: 4.0 | L47: 10.0 | M47: 20.0 | S47: 00.9 | T47: face
A48: Woven Frost Giant Beard | B48: Storm Strength | C48: =(I48*10)+M48+(D48*4)+G48+(L48/5)+(F48*2)+(E48*2)+(K48*2)+(O48/2)+(Q48/2)+(R48/2)+(N48/4)+(P48/4)+30 -> 52 | D48: 5.0 | R48: 4.0 | S48: 1.0 | T48: face
A49: Imbued Elven Chainmail Mask | C49: =(I49*10)+M49+(D49*4)+G49+(L49/5)+(F49*2)+(E49*2)+(K49*2)+(O49/2)+(Q49/2)+(R49/2)+(N49/4)+(P49/4) -> 51 | D49: 4.0 | I49: 3.0 | J49: 3.0 | K49: 2.0 | O49: 2.0 | S49: 00.2 | T49: face
A50: Bloodstone Eyepatch | C50: =(I50*10)+M50+(D50*4)+G50+(L50/5)+(F50*2)+(E50*2)+(K50*2)+(O50/2)+(Q50/2)+(R50/2)+(N50/4)+(P50/4) -> 49 | D50: 4.0 | G50: 3.0 | I50: 3.0 | S50: 00.1 | T50: face
A51: Silver Ruby Veil | C51: =(I51*10)+M51+(D51*4)+G51+(L51/5)+(F51*2)+(E51*2)+(K51*2)+(O51/2)+(Q51/2)+(R51/2)+(N51/4)+(P51/4) -> 48 | D51: 0.0 | E51: 4.0 | I51: 4.0 | S51: 00.1 | T51: face
A52: Veil of the Vortex Weaver | C52: =(I52*10)+M52+(D52*4)+G52+(L52/5)+(F52*2)+(E52*2)+(K52*2)+(O52/2)+(Q52/2)+(R52/2)+(N52/4)+(P52/4) -> 47.5 | D52: 5.0 | J52: 4.0 | K52: 10.0 | M52: 5.0 | O52: 5.0 | S52: 00.2 | T52: face
A53: Grimling Warmask | C53: =(I53*10)+M53+(D53*4)+G53+(L53/5)+(F53*2)+(E53*2)+(K53*2)+(O53/2)+(Q53/2)+(R53/2)+(N53/4)+(P53/4) -> 46 | D53: 7 | E53: 7 | H53: 7 | L53: 20 | S53: 1.5 | U53: face
A54: Telescopic Eyepatch | B54: Telescope | C54: =(I54*10)+M54+(D54*4)+G54+(L54/5)+(F54*2)+(E54*2)+(K54*2)+(O54/2)+(Q54/2)+(R54/2)+(N54/4)+(P54/4)+30 -> 42 | D54: 3.0 | S54: 00.1 | T54: face
A55: Cobalt Drake Mask | C55: =(I55*10)+M55+(D55*4)+G55+(L55/5)+(F55*2)+(E55*2)+(K55*2)+(O55/2)+(Q55/2)+(R55/2)+(N55/4)+(P55/4) -> 40.5 | D55: 6.0 | K55: 5.0 | M55: 5.0 | R55: 3.0 | S55: 00.4 | T55: face
A56: Eyepatch of the Shadows | B56: Ultravision | C56: =(I56*10)+M56+(D56*4)+G56+(L56/5)+(F56*2)+(E56*2)+(K56*2)+(O56/2)+(Q56/2)+(R56/2)+(N56/4)+(P56/4) -> 38 | D56: 4.0 | F56: 9.0 | H56: 6.0 | O56: 4.0 | R56: 4.0 | S56: 00.1 | T56: face
A57: Moss Mask | B57: Enduring Breath | C57: =(I57*10)+M57+(D57*4)+G57+(L57/5)+(F57*2)+(E57*2)+(K57*2)+(O57/2)+(Q57/2)+(R57/2)+(N57/4)+(P57/4)+30 -> 38 | D57: 2.0 | S57: 00.1 | T57: face
A58: Enchanted Elven Chainmail Mask | C58: =(I58*10)+M58+(D58*4)+G58+(L58/5)+(F58*2)+(E58*2)+(K58*2)+(O58/2)+(Q58/2)+(R58/2)+(N58/4)+(P58/4) -> 37 | D58: 4.0 | I58: 2.0 | J58: 2.0 | O58: 2.0 | S58: 00.2 | T58: face
A59: Sarnak-Hide Mask | C59: =(I59*10)+M59+(D59*4)+G59+(L59/5)+(F59*2)+(E59*2)+(K59*2)+(O59/2)+(Q59/2)+(R59/2)+(N59/4)+(P59/4) -> 34 | D59: 6.0 | E59: 5.0 | S59: 00.4 | T59: face
A60: Imbued Mithril Reinforced Mask | C60: =(I60*10)+M60+(D60*4)+G60+(L60/5)+(F60*2)+(E60*2)+(K60*2)+(O60/2)+(Q60/2)+(R60/2)+(N60/4)+(P60/4) -> 32 | D60: 5.0 | I60: 1.0 | K60: 1.0 | S60: 00.3 | T60: face
A61: Laced Veil | C61: =(I61*10)+M61+(D61*4)+G61+(L61/5)+(F61*2)+(E61*2)+(K61*2)+(O61/2)+(Q61/2)+(R61/2)+(N61/4)+(P61/4) -> 31.5 | D61: 2.0 | G61: 3.0 | H61: 4.0 | K61: 8.0 | P61: 8.0 | Q61: 5.0 | S61: 00.1 | T61: face
A62: Cougarskin Mask | C62: =(I62*10)+M62+(D62*4)+G62+(L62/5)+(F62*2)+(E62*2)+(K62*2)+(O62/2)+(Q62/2)+(R62/2)+(N62/4)+(P62/4) -> 28 | D62: 6.0 | G62: 2.0 | H62: 2.0 | L62: 10.0 | S62: 1.0 | T62: face
A63: Imbued Mithril Studded Mask | C63: =(I63*10)+M63+(D63*4)+G63+(L63/5)+(F63*2)+(E63*2)+(K63*2)+(O63/2)+(Q63/2)+(R63/2)+(N63/4)+(P63/4) -> 28 | D63: 4.0 | I63: 1.0 | K63: 1.0 | S63: 00.3 | T63: face
A64: Imbued Vale Studded Mask (K) | C64: =(I64*10)+M64+(D64*4)+G64+(L64/5)+(F64*2)+(E64*2)+(K64*2)+(O64/2)+(Q64/2)+(R64/2)+(N64/4)+(P64/4) -> 28 | D64: 4.0 | F64: 1.0 | I64: 1.0 | S64: 00.3 | T64: face
A65: Coterie Mask | C65: =(I65*10)+M65+(D65*4)+G65+(L65/5)+(F65*2)+(E65*2)+(K65*2)+(O65/2)+(Q65/2)+(R65/2)+(N65/4)+(P65/4) -> 22.1 | D65: 5 | E65: 1 | L65: 3 | Q65: -1 | S65: 00.4 | U65: face
A66: Crystaline Silk Mask | C66: =(I66*10)+M66+(D66*4)+G66+(L66/5)+(F66*2)+(E66*2)+(K66*2)+(O66/2)+(Q66/2)+(R66/2)+(N66/4)+(P66/4) -> 22 | D66: 4.0 | N66: 3.0 | O66: 3.0 | P66: 3.0 | Q66: 3.0 | R66: 3.0 | S66: 0.0 | T66: face
A67: Vale Reinforced Mask | C67: =(I67*10)+M67+(D67*4)+G67+(L67/5)+(F67*2)+(E67*2)+(K67*2)+(O67/2)+(Q67/2)+(R67/2)+(N67/4)+(P67/4) -> 20 | D67: 5.0 | S67: 00.3 | T67: face
A68: Velium Star Ruby Veil | C68: =(I68*10)+M68+(D68*4)+G68+(L68/5)+(F68*2)+(E68*2)+(K68*2)+(O68/2)+(Q68/2)+(R68/2)+(N68/4)+(P68/4) -> 20 | D68: 0.0 | H68: 10.0 | K68: 10.0 | S68: 00.1 | T68: face
A69: Lizardskin Tribal Mask | C69: =(I69*10)+M69+(D69*4)+G69+(L69/5)+(F69*2)+(E69*2)+(K69*2)+(O69/2)+(Q69/2)+(R69/2)+(N69/4)+(P69/4) -> 19.5 | D69: 3.0 | G69: 5.0 | O69: 5.0 | S69: 00.2 | T69: face
A70: Netted Kelp Veil | C70: =(I70*10)+M70+(D70*4)+G70+(L70/5)+(F70*2)+(E70*2)+(K70*2)+(O70/2)+(Q70/2)+(R70/2)+(N70/4)+(P70/4) -> 19 | D70: 4.0 | E70: 1.0 | F70: 3.0 | J70: 3.0 | K70: -3.0 | Q70: 2.0 | S70: 00.2 | T70: face
A71: Platinum Star Ruby Veil | C71: =(I71*10)+M71+(D71*4)+G71+(L71/5)+(F71*2)+(E71*2)+(K71*2)+(O71/2)+(Q71/2)+(R71/2)+(N71/4)+(P71/4) -> 18 | D71: 0.0 | H71: 9.0 | K71: 9.0 | S71: 00.1 | T71: face
A72: Pair of Bent Spectacles | C72: =(I72*10)+M72+(D72*4)+G72+(L72/5)+(F72*2)+(E72*2)+(K72*2)+(O72/2)+(Q72/2)+(R72/2)+(N72/4)+(P72/4) -> 17.5 | D72: 0.0 | M72: 15.0 | O72: 5.0 | S72: 00.1 | T72: face
A73: Burynai Hide Mask | C73: =(I73*10)+M73+(D73*4)+G73+(L73/5)+(F73*2)+(E73*2)+(K73*2)+(O73/2)+(Q73/2)+(R73/2)+(N73/4)+(P73/4) -> 16 | D73: 3.0 | F73: 2.0 | H73: 2.0 | S73: 00.4 | T73: face
A74: Dark Muslin Veil | C74: =(I74*10)+M74+(D74*4)+G74+(L74/5)+(F74*2)+(E74*2)+(K74*2)+(O74/2)+(Q74/2)+(R74/2)+(N74/4)+(P74/4) -> 16 | D74: 4.0 | S74: 00.2 | T74: face
A75: Fur Lined Mask | C75: =(I75*10)+M75+(D75*4)+G75+(L75/5)+(F75*2)+(E75*2)+(K75*2)+(O75/2)+(Q75/2)+(R75/2)+(N75/4)+(P75/4) -> 16 | D75: 1.0 | E75: 4.0 | L75: 20.0 | S75: 0.5 | T75: face
A76: Mask of the Eight Eyes | C76: =(I76*10)+M76+(D76*4)+G76+(L76/5)+(F76*2)+(E76*2)+(K76*2)+(O76/2)+(Q76/2)+(R76/2)+(N76/4)+(P76/4) -> 16 | D76: 3.0 | F76: 2.0 | H76: 2.0 | S76: 00.4 | T76: face
A77: Mithril Studded Mask | C77: =(I77*10)+M77+(D77*4)+G77+(L77/5)+(F77*2)+(E77*2)+(K77*2)+(O77/2)+(Q77/2)+(R77/2)+(N77/4)+(P77/4) -> 16 | D77: 4.0 | S77: 00.3 | T77: face
A78: Reinforced Mask | C78: =(I78*10)+M78+(D78*4)+G78+(L78/5)+(F78*2)+(E78*2)+(K78*2)+(O78/2)+(Q78/2)+(R78/2)+(N78/4)+(P78/4) -> 16 | D78: 4.0 | S78: 1.0 | T78: face
A79: Turquoise Eyepatch | C79: =(I79*10)+M79+(D79*4)+G79+(L79/5)+(F79*2)+(E79*2)+(K79*2)+(O79/2)+(Q79/2)+(R79/2)+(N79/4)+(P79/4) -> 16 | D79: 2.0 | F79: 2.0 | J79: 2.0 | K79: 2.0 | S79: 00.1 | T79: face
A80: Vale Studded Mask | C80: =(I80*10)+M80+(D80*4)+G80+(L80/5)+(F80*2)+(E80*2)+(K80*2)+(O80/2)+(Q80/2)+(R80/2)+(N80/4)+(P80/4) -> 16 | D80: 4.0 | S80: 00.3 | T80: face
A81: Wyvern Claw Mask | C81: =(I81*10)+M81+(D81*4)+G81+(L81/5)+(F81*2)+(E81*2)+(K81*2)+(O81/2)+(Q81/2)+(R81/2)+(N81/4)+(P81/4) -> 16 | D81: 4.0 | H81: 4.0 | J81: 4.0 | S81: 1.0 | T81: face
A82: Gnome Skin Mask | C82: =(I82*10)+M82+(D82*4)+G82+(L82/5)+(F82*2)+(E82*2)+(K82*2)+(O82/2)+(Q82/2)+(R82/2)+(N82/4)+(P82/4) -> 15.75 | D82: 3.0 | N82: 5.0 | O82: 5.0 | S82: 0.5 | T82: face
A83: Split Paw Hide Mask | C83: =(I83*10)+M83+(D83*4)+G83+(L83/5)+(F83*2)+(E83*2)+(K83*2)+(O83/2)+(Q83/2)+(R83/2)+(N83/4)+(P83/4) -> 15.75 | D83: 3.0 | N83: 5.0 | O83: 5.0 | S83: 0.5 | T83: face
A84: Serpentskin Eyepatch | C84: =(I84*10)+M84+(D84*4)+G84+(L84/5)+(F84*2)+(E84*2)+(K84*2)+(O84/2)+(Q84/2)+(R84/2)+(N84/4)+(P84/4) -> 15 | D84: 3.0 | G84: 3.0 | S84: 00.1 | T84: face
A85: Carved Ivory Mask | C85: =(I85*10)+M85+(D85*4)+G85+(L85/5)+(F85*2)+(E85*2)+(K85*2)+(O85/2)+(Q85/2)+(R85/2)+(N85/4)+(P85/4) -> 14 | D85: 2.0 | G85: 4.0 | L85: 10.0 | S85: 00.9 | T85: face
A86: Golden Diamond Mask | C86: =(I86*10)+M86+(D86*4)+G86+(L86/5)+(F86*2)+(E86*2)+(K86*2)+(O86/2)+(Q86/2)+(R86/2)+(N86/4)+(P86/4) -> 14 | D86: 0.0 | N86: 5.0 | O86: 3.0 | P86: 5.0 | Q86: 10.0 | R86: 10.0 | S86: 0.0 | T86: face
A87: Spiked Mask | C87: =(I87*10)+M87+(D87*4)+G87+(L87/5)+(F87*2)+(E87*2)+(K87*2)+(O87/2)+(Q87/2)+(R87/2)+(N87/4)+(P87/4) -> 13.25 | D87: 4.0 | G87: -2.0 | J87: 2.0 | P87: -3.0 | S87: 1.5 | T87: face
A88: Elven Chainmail Mask | C88: =(I88*10)+M88+(D88*4)+G88+(L88/5)+(F88*2)+(E88*2)+(K88*2)+(O88/2)+(Q88/2)+(R88/2)+(N88/4)+(P88/4) -> 12 | D88: 3.0 | S88: 0.5 | T88: face
A89: Leering Mask | C89: =(I89*10)+M89+(D89*4)+G89+(L89/5)+(F89*2)+(E89*2)+(K89*2)+(O89/2)+(Q89/2)+(R89/2)+(N89/4)+(P89/4) -> 12 | D89: 3.0 | H89: 3.0 | S89: 00.4 | T89: face
A90: Shaded Mask | C90: =(I90*10)+M90+(D90*4)+G90+(L90/5)+(F90*2)+(E90*2)+(K90*2)+(O90/2)+(Q90/2)+(R90/2)+(N90/4)+(P90/4) -> 12 | D90: 3 | S90: 1 | U90: face
A91: Shaded Mask | C91: =(I91*10)+M91+(D91*4)+G91+(L91/5)+(F91*2)+(E91*2)+(K91*2)+(O91/2)+(Q91/2)+(R91/2)+(N91/4)+(P91/4) -> 12 | D91: 3 | S91: 1 | U91: face
A92: Sheer Bone Mask | C92: =(I92*10)+M92+(D92*4)+G92+(L92/5)+(F92*2)+(E92*2)+(K92*2)+(O92/2)+(Q92/2)+(R92/2)+(N92/4)+(P92/4) -> 12 | D92: 3.0 | J92: 3.0 | S92: 1.5 | T92: face
A93: Diamond Electrum Mask | C93: =(I93*10)+M93+(D93*4)+G93+(L93/5)+(F93*2)+(E93*2)+(K93*2)+(O93/2)+(Q93/2)+(R93/2)+(N93/4)+(P93/4) -> 11.5 | D93: 0.0 | N93: 10.0 | O93: 3.0 | P93: 10.0 | Q93: 5.0 | R93: 5.0 | S93: 00.1 | T93: face
A94: Snakeskin Mask | C94: =(I94*10)+M94+(D94*4)+G94+(L94/5)+(F94*2)+(E94*2)+(K94*2)+(O94/2)+(Q94/2)+(R94/2)+(N94/4)+(P94/4) -> 10.5 | D94: 2.0 | O94: 5.0 | S94: 00.4 | T94: face
A95: Silver Star Ruby Veil | C95: =(I95*10)+M95+(D95*4)+G95+(L95/5)+(F95*2)+(E95*2)+(K95*2)+(O95/2)+(Q95/2)+(R95/2)+(N95/4)+(P95/4) -> 10 | D95: 0.0 | H95: 5.0 | K95: 5.0 | S95: 00.1 | T95: face
A96: Crystalline Silk Mask | C96: =(I96*10)+M96+(D96*4)+G96+(L96/5)+(F96*2)+(E96*2)+(K96*2)+(O96/2)+(Q96/2)+(R96/2)+(N96/4)+(P96/4) -> 8.5 | D96: 2.0 | O96: 1.0 | S96: 00.1 | T96: face
A97: Curscale Snout Mount | C97: =(I97*10)+M97+(D97*4)+G97+(L97/5)+(F97*2)+(E97*2)+(K97*2)+(O97/2)+(Q97/2)+(R97/2)+(N97/4)+(P97/4) -> 8.25 | D97: 2.0 | P97: 1.0 | S97: 00.2 | T97: face
A98: Dingy Veil | C98: =(I98*10)+M98+(D98*4)+G98+(L98/5)+(F98*2)+(E98*2)+(K98*2)+(O98/2)+(Q98/2)+(R98/2)+(N98/4)+(P98/4) -> 8 | D98: 2 | S98: 00.2 | U98: face
A99: Fungal Field Membrane Mask | C99: =(I99*10)+M99+(D99*4)+G99+(L99/5)+(F99*2)+(E99*2)+(K99*2)+(O99/2)+(Q99/2)+(R99/2)+(N99/4)+(P99/4) -> 8 | D99: 2 | S99: 00.1 | U99: face
A100: Leather Mask | C100: =(I100*10)+M100+(D100*4)+G100+(L100/5)+(F100*2)+(E100*2)+(K100*2)+(O100/2)+(Q100/2)+(R100/2)+(N100/4)+(P100/4) -> 8 | D100: 2.0 | S100: 00.4 | T100: face
A101: Raw-hide Mask | C101: =(I101*10)+M101+(D101*4)+G101+(L101/5)+(F101*2)+(E101*2)+(K101*2)+(O101/2)+(Q101/2)+(R101/2)+(N101/4)+(P101/4) -> 8 | D101: 2.0 | S101: 00.6 | T101: face
A102: Soft Wicker Mask | C102: =(I102*10)+M102+(D102*4)+G102+(L102/5)+(F102*2)+(E102*2)+(K102*2)+(O102/2)+(Q102/2)+(R102/2)+(N102/4)+(P102/4) -> 8 | D102: 2.0 | S102: 00.6 | T102: face
A103: Studded Mask | C103: =(I103*10)+M103+(D103*4)+G103+(L103/5)+(F103*2)+(E103*2)+(K103*2)+(O103/2)+(Q103/2)+(R103/2)+(N103/4)+(P103/4) -> 8 | D103: 2.0 | S103: 00.4 | T103: face
A104: Tattered Mask | C104: =(I104*10)+M104+(D104*4)+G104+(L104/5)+(F104*2)+(E104*2)+(K104*2)+(O104/2)+(Q104/2)+(R104/2)+(N104/4)+(P104/4) -> 8 | D104: 2.0 | S104: 00.4 | T104: face
A105: Woven Veil | C105: =(I105*10)+M105+(D105*4)+G105+(L105/5)+(F105*2)+(E105*2)+(K105*2)+(O105/2)+(Q105/2)+(R105/2)+(N105/4)+(P105/4) -> 8 | D105: 2.0 | S105: 00.2 | T105: face
A106: Cloth Veil | C106: =(I106*10)+M106+(D106*4)+G106+(L106/5)+(F106*2)+(E106*2)+(K106*2)+(O106/2)+(Q106/2)+(R106/2)+(N106/4)+(P106/4) -> 4 | D106: 1.0 | S106: 00.2 | T106: face
A107: Dusty Burlap Veil | C107: =(I107*10)+M107+(D107*4)+G107+(L107/5)+(F107*2)+(E107*2)+(K107*2)+(O107/2)+(Q107/2)+(R107/2)+(N107/4)+(P107/4) -> 4 | D107: 1.0 | S107: 00.2 | T107: face
A108: Netted Mask | C108: =(I108*10)+M108+(D108*4)+G108+(L108/5)+(F108*2)+(E108*2)+(K108*2)+(O108/2)+(Q108/2)+(R108/2)+(N108/4)+(P108/4) -> 4 | D108: 1.0 | S108: 00.1 | T108: face
A109: Gorilla Hide Mask | C109: =(I109*10)+M109+(D109*4)+G109+(L109/5)+(F109*2)+(E109*2)+(K109*2)+(O109/2)+(Q109/2)+(R109/2)+(N109/4)+(P109/4) -> 3 | D109: 3.0 | E109: 2.0 | G109: 3.0 | K109: -8.0 | S109: 00.9 | T109: face
A110: Splinter of Frozen Shadow | C110: =(I110*10)+M110+(D110*4)+G110+(L110/5)+(F110*2)+(E110*2)+(K110*2)+(O110/2)+(Q110/2)+(R110/2)+(N110/4)+(P110/4) -> 1 | D110: 0.0 | L110: 5.0 | S110: 00.1 | T110: face
A111: Beer Goggles | B111: Summon Ale | C111: =(I111*10)+M111+(D111*4)+G111+(L111/5)+(F111*2)+(E111*2)+(K111*2)+(O111/2)+(Q111/2)+(R111/2)+(N111/4)+(P111/4) -> -2 | D111: 7 | I111: -5 | J111: -5 | K111: 10 | S111: 00.2 | U111: face
A112: Marauder Snout Ring | C112: =(I112*10)+M112+(D112*4)+G112+(L112/5)+(F112*2)+(E112*2)+(K112*2)+(O112/2)+(Q112/2)+(R112/2)+(N112/4)+(P112/4) -> -2 | D112: 2.0 | H112: 1.0 | K112: -5.0 | S112: 00.1 | T112: face
A113: Marauder Snout Ring 'MM' | C113: =(I113*10)+M113+(D113*4)+G113+(L113/5)+(F113*2)+(E113*2)+(K113*2)+(O113/2)+(Q113/2)+(R113/2)+(N113/4)+(P113/4) -> -6 | D113: 2.0 | F113: 3.0 | K113: -10.0 | S113: 1.0 | T113: face
A114: Forsaken Pariah Mask | C114: =(I114*10)+M114+(D114*4)+G114+(L114/5)+(F114*2)+(E114*2)+(K114*2)+(O114/2)+(Q114/2)+(R114/2)+(N114/4)+(P114/4) -> -30 | D114: 5.0 | K114: -25.0 | S114: 00.4 | T114: face
A115: Mask of Malediction | C115: =(I115*10)+M115+(D115*4)+G115+(L115/5)+(F115*2)+(E115*2)+(K115*2)+(O115/2)+(Q115/2)+(R115/2)+(N115/4)+(P115/4) -> -35 | D115: 0.0 | I115: -4.0 | J115: 5.0 | M115: 10.0 | Q115: -5.0 | R115: -5.0 | S115: 00.2 | T115: face
A116: Maggot Ridden Flesh | C116: =(I116*10)+M116+(D116*4)+G116+(L116/5)+(F116*2)+(E116*2)+(K116*2)+(O116/2)+(Q116/2)+(R116/2)+(N116/4)+(P116/4) -> -42 | D116: 2.0 | K116: -20.0 | N116: -20.0 | P116: -20.0 | S116: 0.5 | T116: face