A1: Active Roster
B2: Levels | C2: Title | D2: Race | E2: Epic | F2: VP Key | G2: ST Key | H2: EMP Key | I2: VT Key | J2: PoV/PoS | K2: BoT | L2: PoI B | M2: CoD | N2: PoN B | O2: PoT | P2: HoH A | Q2: Status
A3: Bard
A4: =HYPERLINK("http://www.magelo.com/eq_view_profile.html?num=194601","Cranth") -> Cranth | B4: 65 | C4: Veteran | D4: Wood Elf | E4: YES | F4: 1 | G4: 1 | H4: 1 | I4: 1 | J4: 1 | K4: 1 | L4: 1 | M4: 1 | N4: 1 | O4: 1 | P4: 1 | Q4: Member
A5: =HYPERLINK("http://www.magelo.com/eq_view_profile.html?num=602833","Gymi") -> Gymi | B5: 61 | D5: Wood Elf | E5: YES | Q5: Member
A6: =HYPERLINK("http://www.magelo.com/eq_view_profile.html?num=84086","Mioawara") -> Mioawara | B6: 65 | C6: Baron | D6: Wood Elf | E6: YES | G6: 1 | H6: 1 | I6: 1 | J6: 1 | K6: 1 | N6: 1 | O6: 1 | P6: 1 | Q6: Member
A7: =HYPERLINK("http://www.magelo.com/eq_view_profile.html?num=344746","Rosha") -> Rosha | B7: 65 | C7: Baron | D7: Wood Elf | E7: YES | F7: 1 | H7: 1 | J7: 1 | Q7: Officer
A8: =HYPERLINK("http://www.magelo.com/eq_view_profile.html?num=663136","Taluwen") -> Taluwen | B8: 65 | C8: Veteran | D8: Half Elf | E8: YES | H8: 1 | I8: 1 | J8: 1 | P8: 1 | Q8: Member
A9: =HYPERLINK("http://www.magelo.com/eq_view_profile.html?num=182277","Yorke") -> Yorke | B9: 65 | C9: Veteran | D9: Half Elf | E9: YES | F9: 1 | G9: 1 | H9: 1 | J9: 1 | K9: 1 | Q9: Officer
A10: Beastlord
A11: Crewl | B11: 65 | D11: Ogre | E11: YES | G11: 1 | H11: 1 | I11: 1 | J11: 1 | K11: 1 | Q11: Member
A12: Nermel | B12: 61 | D12: Vah Shir | E12: YES | Q12: Member
A13: =HYPERLINK("http://www.magelo.com/eq_view_profile.html?num=595579","Sarisha") -> Sarisha | B13: 51 | D13: Vah Shir | E13: NO | Q13: Member
A14: =HYPERLINK("http://www.magelo.com/eq_view_profile.html?num=527672","Skilor") -> Skilor | B14: 62 | D14: Vah Shir | E14: NO | H14: 1 | J14: 1 | Q14: Member
A15: Meoww (alt) | B15: 65 | D15: Vah Shir | E15: NO | H15: X | J15: X | Q15: Member
A16: Clerics
A17: =HYPERLINK("http://www.magelo.com/eq_view_profile.html?num=642183","Aader") -> Aader | B17: 64 | D17: Dwarf | E17: YES | G17: 1 | H17: 1 | J17: 1 | N17: 1 | P17: 1 | Q17: Member
A18: Bohric | B18: 65 | C18: Baron | D18: Dwarf | E18: NO | F18: 1 | G18: 1 | J18: 1 | K18: 1 | L18: 1 | M18: 1 | N18: 1 | P18: 1 | Q18: Member
A19: =HYPERLINK("http://www.magelo.com/eq_view_profile.html?num=342919","Dinanin") -> Dinanin | B19: 65 | C19: Exarch | D19: Dwarf | E19: YES | F19: 1 | G19: 1 | H19: 1 | I19: 1 | J19: 1 | K19: 1 | L19: 1 | M19: 1 | N19: 1 | O19: 1 | P19: 1 | Q19: Member
A20: =HYPERLINK("http://www.magelo.com/eq_view_profile.html?num=59684","Dystopya") -> Dystopya | B20: 65 | C20: Venerable | D20: Human | E20: YES | F20: 1 | G20: 1 | H20: 1 | I20: 1 | J20: 1 | K20: 1 | L20: 1 | M20: 1 | N20: 1 | O20: 1 | P20: 1 | Q20: Member
A21: =HYPERLINK("http://www.magelo.com/eq_view_profile.html?num=84050","Gerweena") -> Gerweena | B21: 65 | C21: Venerable | D21: Halfling | E21: YES | G21: 1 | H21: 1 | J21: 1 | K21: 1 | P21: 1 | Q21: Member
A22: =HYPERLINK("http://www.magelo.com/eq_view_profile.html?num=115196","Iendaar") -> Iendaar | B22: 64 | C22: Baron | D22: High Elf | E22: YES | H22: 1 | J22: 1 | K22: 1 | L22: 1 | Q22: Member
A23: Jerycho | B23: 65 | D23: Dwarf | E23: YES | G23: 1 | H23: 1 | I23: 1 | J23: 1 | Q23: Member
A24: =HYPERLINK("http://www.magelo.com/eq_view_profile.html?num=151159","Mediloks") -> Mediloks | B24: 65 | D24: High Elf | E24: YES | G24: 1 | H24: 1 | I24: 1 | J24: 1 | K24: 1 | N24: 1 | O24: 1 | P24: 1 | Q24: Member
A25: =HYPERLINK("http://www.magelo.com/eq_view_profile.html?num=71953","Philander") -> Philander | B25: 63 | C25: Venerable | D25: Dwarf | E25: YES | F25: 1 | G25: 1 | H25: 1 | J25: 1 | K25: 1 | N25: 1 | P25: 1 | Q25: Officer
A26: =HYPERLINK("http://www.magelo.com/eq_view_profile.html?num=581769","Samine") -> Samine | B26: 65 | C26: Venerable | D26: High Elf | E26: NO | F26: X | G26: X | J26: X | K26: X | L26: X | M26: X | P26: X | Q26: Member
A27: Sarigus | B27: 60 | C27: Venerable | D27: Halfling | E27: YES | F27: X | Q27: Member
A28: =HYPERLINK("http://www.magelo.com/eq_view_profile.html?num=62008","Xorolorn") -> Xorolorn | B28: 65 | C28: Baron | D28: High Elf | E28: YES | F28: 1 | G28: 1 | H28: 1 | I28: 1 | J28: 1 | K28: 1 | L28: 1 | N28: 1 | P28: 1 | Q28: Member
A29: =HYPERLINK("http://www.magelo.com/eq_view_profile.html?num=141442","Adella (alt)") -> Adella (alt) | B29: 64 | D29: Dwarf | E29: YES | F29: X | J29: X | K29: X | P29: X | Q29: Member
A30: =HYPERLINK("http://www.magelo.com/eq_view_profile.html?num=345649","Andromache (alt)") -> Andromache (alt) | B30: 64 | D30: Dark Elf | E30: YES | H30: X | I30: X | J30: X | P30: X | Q30: Member
A31: Fryar (alt) | B31: 64 | D31: Dwarf | E31: YES | J31: X | K31: X | M31: X | P31: X | Q31: Member
A32: Fuzella (alt) | B32: 63 | D32: Halfling | E32: NO | H32: X | Q32: Member
A33: Pria (alt) | B33: 65 | C33: Baroness | D33: High Elf | E33: YES | J33: X | K33: X | N33: X | P33: X | Q33: Member
A34: Restora (alt) | B34: 65 | D34: High Elf | E34: YES | H34: X | N34: X | P34: X | Q34: Member
A35: =HYPERLINK("http://www.magelo.com/eq_view_profile.html?num=495320","Vyera (alt)") -> Vyera (alt) | B35: 65 | C35: Venerable | D35: Dark Elf | E35: NO | J35: X | K35: X | O35: X | Q35: Member
A36: =HYPERLINK("http://www.magelo.com/eq_view_profile.html?num=24215","Weckie (alt)") -> Weckie (alt) | B36: 65 | C36: Venerable | D36: Dark Elf | E36: YES | F36: X | H36: X | I36: X | J36: X | K36: X | M36: X | N36: X | O36: X | P36: X | Q36: Member
A37: Druid
A38: =HYPERLINK("http://www.magelo.com/eq_view_profile.html?num=28957","Echineasia") -> Echineasia | B38: 65 | C38: Venerable | D38: Wood Elf | E38: YES | F38: 1 | G38: 1 | H38: 1 | I38: 1 | J38: 1 | K38: 1 | L38: 1 | M38: 1 | N38: 1 | P38: 1 | Q38: Member
A39: =HYPERLINK("http://www.magelo.com/eq_view_profile.html?num=107624","Edylc") -> Edylc | B39: 65 | D39: Wood Elf | E39: YES | F39: 1 | G39: 1 | H39: 1 | I39: 1 | J39: 1 | K39: 1 | M39: 1 | N39: 1 | O39: 1 | P39: 1 | Q39: Member
A40: Denari | B40: 65 | D40: Half Elf | E40: YES | H40: 1 | J40: 1 | K40: 1 | M40: 1 | O40: 1 | P40: 1 | Q40: Member
A41: =HYPERLINK("http://www.magelo.com/eq_view_profile.html?num=186512","Gweeto") -> Gweeto | B41: 65 | D41: Halfling | E41: YES | F41: 1 | G41: 1 | H41: 1 | I41: 1 | J41: 1 | K41: 1 | L41: 1 | M41: 1 | N41: 1 | O41: 1 | P41: 1 | Q41: Member
A42: =HYPERLINK("http://www.magelo.com/eq_view_profile.html?num=54717","Lilee") -> Lilee | B42: 65 | C42: Elder | D42: Wood Elf | E42: YES | H42: 1 | I42: 1 | J42: 1 | K42: 1 | M42: 1 | P42: 1 | Q42: Member
A43: =HYPERLINK("http://www.magelo.com/eq_view_profile.html?num=19213","Madgegal") -> Madgegal | B43: 65 | D43: Wood Elf | E43: YES | H43: 1 | I43: 1 | J43: 1 | K43: 1 | L43: 1 | M43: 1 | O43: 1 | P43: 1 | Q43: Member
A44: Panzon | B44: 65 | D44: Halfling | E44: YES | H44: 1 | J44: 1 | Q44: Member
A45: =HYPERLINK("http://www.magelo.com/eq_view_profile.html?num=260177","Skysz") -> Skysz | B45: 65 | C45: Elder | D45: Halfling | E45: YES | G45: 1 | H45: 1 | I45: 1 | J45: 1 | K45: 1 | N45: 1 | O45: 1 | P45: 1 | Q45: Member
A46: =HYPERLINK("http://www.magelo.com/eq_view_profile.html?num=12316","Thunderheart") -> Thunderheart | B46: 65 | C46: Venerable | D46: Wood Elf | E46: YES | F46: 1 | H46: 1 | I46: 1 | J46: 1 | K46: 1 | M46: 1 | N46: 1 | P46: 1 | Q46: Member
A47: =HYPERLINK("http://www.magelo.com/eq_view_profile.html?num=11509","Wickie") -> Wickie | B47: 65 | C47: Elder | D47: Wood Elf | E47: YES | F47: 1 | G47: 1 | H47: 1 | I47: 1 | J47: 1 | K47: 1 | L47: 1 | M47: 1 | N47: 1 | O47: 1 | P47: 1 | Q47: Member
A48: =HYPERLINK("http://www.magelo.com/eq_view_profile.html?num=343679","Fellan (alt)") -> Fellan (alt) | B48: 61 | D48: Halfling | E48: NO | L48: X | Q48: Member
A49: =HYPERLINK("http://www.magelo.com/eq_view_profile.html?num=226868","Padain (alt)") -> Padain (alt) | B49: 65 | C49: Venerable | D49: Wood Elf | E49: YES | F49: X | G49: X | J49: X | K49: X | L49: X | M49: X | P49: X | Q49: Member
A50: Enchanter
A51: =HYPERLINK("http://www.magelo.com/eq_view_profile.html?num=120701","Azlaan") -> Azlaan | B51: 65 | C51: Master | D51: Erudite | E51: YES | F51: 1 | G51: 1 | H51: 1 | J51: 1 | K51: 1 | N51: 1 | P51: 1 | Q51: Member
A52: Canny | B52: 65 | C52: Mistress | E52: NO | G52: 1 | H52: 1 | I52: 1 | J52: 1 | K52: 1 | Q52: Member
A53: =HYPERLINK("http://www.magelo.com/eq_view_profile.html?num=345631","Cwell") -> Cwell | B53: 65 | C53: Master | D53: Erudite | E53: YES | F53: 1 | G53: 1 | H53: 1 | I53: 1 | J53: 1 | K53: 1 | N53: 1 | O53: 1 | P53: 1 | Q53: Member
A54: Jaquinetta | B54: 64 | D54: Dark Elf | E54: NO | J54: X | K54: X | L54: X | M54: X | N54: X | P54: X | Q54: Member
A55: Koba | B55: 61 | Q55: Member
A56: Morphos | B56: 65 | D56: High Elf | E56: NO | H56: 1 | I56: 1 | Q56: Member
A57: =HYPERLINK("http://www.magelo.com/eq_view_profile.html?num=343464","Sethrah") -> Sethrah | B57: 65 | C57: Mistress | D57: Dark Elf | E57: YES | F57: X | G57: X | J57: X | K57: X | M57: X | P57: X | Q57: Member
A58: =HYPERLINK("http://www.magelo.com/eq_view_profile.html?num=363509","Sakuma") -> Sakuma | B58: 64 | D58: High Elf | E58: NO | F58: 1 | G58: 1 | H58: 1 | J58: 1 | N58: 1 | O58: 1 | Q58: Member
A59: Amantus (alt) | B59: 64 | D59: High Elf | E59: NO | J59: X | P59: X | Q59: Member
A60: Khuzlean (alt) | B60: 65 | D60: Dark Elf | E60: NO | Q60: Member
A61: =HYPERLINK("http://www.magelo.com/eq_view_profile.html?num=64112","Roonie (alt)") -> Roonie (alt) | B61: 62 | C61: Mistress | D61: Dark Elf | E61: YES | F61: X | J61: X | L61: X | N61: X | P61: X | Q61: Member
A62: Mages
A63: =HYPERLINK("http://www.magelo.com/eq_view_profile.html?num=466839","Almorzar") -> Almorzar | B63: 65 | C63: Master | D63: Erudite | E63: NO | F63: 1 | G63: 1 | H63: 1 | I63: 1 | J63: 1 | K63: 1 | M63: 1 | N63: 1 | O63: 1 | P63: 1 | Q63: Member
A64: =HYPERLINK("http://www.magelo.com/eq_view_profile.html?num=191052","Canda") -> Canda | B64: 64 | C64: Baron | D64: High Elf | E64: YES | F64: X | G64: X | J64: X | K64: X | N64: X | P64: X | Q64: Member
A65: =HYPERLINK("http://www.magelo.com/eq_view_profile.html?num=345293","Elingia") -> Elingia | B65: 59 | D65: High Elf | E65: NO | Q65: Member
A66: Gaidar | B66: 63 | D66: Human | E66: NO | J66: X | K66: X | L66: X | M66: X | O66: X | P66: X | Q66: Member
A67: Mandrayke (alt) | B67: 63 | E67: NO | Q67: Member
A68: Monks
A69: =HYPERLINK("http://www.magelo.com/eq_view_profile.html?num=502685","Chubbies") -> Chubbies | B69: 65 | C69: Sensei | D69: Iksar | E69: YES | F69: 1 | G69: 1 | H69: 1 | I69: 1 | J69: 1 | K69: 1 | M69: 1 | N69: 1 | P69: 1 | Q69: Member
A70: Stormin | B70: 65 | C70: Baron | D70: Human | E70: YES | F70: 1 | G70: 1 | H70: 1 | I70: 1 | J70: 1 | K70: 1 | N70: 1 | O70: 1 | P70: 1 | Q70: Member
A71: =HYPERLINK("http://www.magelo.com/eq_view_profile.html?num=54695","Talinsyn") -> Talinsyn | B71: 65 | C71: Sensei | D71: Human | E71: YES | F71: 1 | G71: 1 | H71: 1 | I71: 1 | J71: 1 | K71: 1 | L71: 1 | M71: 1 | N71: 1 | P71: 1 | Q71: Member
A72: =HYPERLINK("http://www.magelo.com/eq_view_profile.html?num=64095","Voir") -> Voir | B72: 64 | C72: Brother | D72: Iksar | E72: YES | F72: X | G72: X | J72: X | K72: X | L72: X | N72: X | P72: X | Q72: Member
A73: Necromancer
A74: Drexen | B74: 63 | E74: NO | H74: 1 | I74: 1 | Q74: Member
A75: =HYPERLINK("http://www.magelo.com/eq_view_profile.html?num=434407","Evilgrim") -> Evilgrim | B75: 64 | C75: Baron | D75: Gnome | E75: YES | F75: 1 | H75: 1 | J75: 1 | K75: 1 | M75: 1 | N75: 1 | O75: 1 | P75: 1 | Q75: Member
A76: =HYPERLINK("http://www.magelo.com/eq_view_profile.html?num=352099","Lokaris") -> Lokaris | B76: 65 | C76: Archlich | D76: Dark Elf | E76: YES | F76: X | G76: X | H76: X | J76: X | M76: X | N76: X | P76: X | Q76: Officer
A77: Scraps | B77: 65 | C77: Archlich | D77: Gnome | E77: YES | G77: 1 | H77: 1 | I77: 1 | J77: 1 | K77: 1 | L77: 1 | M77: 1 | N77: 1 | O77: 1 | P77: 1 | Q77: Member
A78: Intention (alt) | B78: 63 | D78: Dark Elf | E78: NO | Q78: Member
A79: Paladins
A80: =HYPERLINK("http://www.magelo.com/eq_view_profile.html?num=98063","Badin") -> Badin | B80: 65 | C80: Duke | D80: Dwarf | E80: YES | F80: 1 | G80: 1 | H80: 1 | I80: 1 | J80: 1 | K80: 1 | L80: 1 | M80: 1 | N80: 1 | O80: 1 | P80: 1 | Q80: Member
A81: =HYPERLINK("http://www.magelo.com/eq_view_profile.html?num=168250","Brokkson") -> Brokkson | B81: 65 | C81: Duke | D81: Dwarf | E81: YES | F81: 1 | G81: 1 | H81: 1 | I81: 1 | J81: 1 | K81: 1 | L81: 1 | M81: 1 | N81: 1 | O81: 1 | P81: 1 | Q81: Officer
A82: =HYPERLINK("http://www.magelo.com/eq_view_profile.html?num=350082","Infirit") -> Infirit | B82: 63 | C82: Baron | D82: Half Elf | E82: YES | G82: 1 | H82: 1 | J82: 1 | M82: 1 | N82: 1 | P82: 1 | Q82: Member
A83: Glloinn | B83: 65 | C83: Duke | D83: Dwarf | E83: NO | H83: 1 | J83: 1 | K83: 1 | M83: 1 | P83: 1 | Q83: Member
A84: =HYPERLINK("http://www.magelo.com/eq_view_profile.html?num=615440","Kwaidd") -> Kwaidd | B84: 65 | D84: Dwarf | E84: NO | G84: 1 | H84: 1 | J84: 1 | M84: 1 | N84: 1 | P84: 1 | Q84: Member
A85: =HYPERLINK("http://www.magelo.com/eq_view_profile.html?num=301696","Shadrakk") -> Shadrakk | B85: 64 | D85: Human | E85: NO | J85: 1 | P85: 1 | Q85: Member
A86: Ranger
A87: Andriul | B87: 60 | D87: Wood Elf | E87: YES | Q87: Member
A88: Britania | B88: 63 | D88: Wood Elf | E88: NO | H88: 1 | I88: 1 | J88: 1 | Q88: Member
A89: =HYPERLINK("http://www.magelo.com/eq_view_profile.html?num=66546","Canis") -> Canis | B89: 65 | D89: Wood Elf | E89: YES | G89: 1 | H89: 1 | I89: 1 | J89: 1 | K89: 1 | L89: 1 | M89: 1 | N89: 1 | O89: 1 | P89: 1 | Q89: Member
A90: =HYPERLINK("http://www.magelo.com/eq_view_profile.html?num=350545","Moshady") -> Moshady | B90: 65 | C90: Veteran | D90: Wood Elf | E90: YES | G90: 1 | H90: 1 | I90: 1 | J90: 1 | K90: 1 | L90: 1 | N90: 1 | P90: 1 | Q90: Member
A91: =HYPERLINK("http://www.magelo.com/eq_view_profile.html?num=391661","Molian") -> Molian | B91: 65 | C91: Hunter | D91: Wood Elf | E91: YES | F91: 1 | G91: 1 | H91: 1 | J91: 1 | K91: 1 | L91: 1 | M91: 1 | N91: 1 | P91: 1 | Q91: Member
A92: Oakken | B92: 62 | D92: Wood Elf | E92: NO | Q92: Member
A93: Saluki | B93: 65 | D93: Half Elf | E93: YES | G93: 1 | H93: 1 | J93: 1 | K93: 1 | L93: 1 | M93: 1 | O93: 1 | P93: 1 | Q93: Member
A94: Tyndall | B94: 63 | C94: Veteran | D94: Half Elf | E94: NO | G94: 1 | H94: 1 | I94: 1 | J94: 1 | K94: 1 | L94: 1 | M94: 1 | P94: 1 | Q94: Member
A95: Rogues
A96: =HYPERLINK("http://www.magelo.com/eq_view_profile.html?num=524849","Gerhardt") -> Gerhardt | B96: 65 | C96: Marauder | D96: Dwarf | E96: YES | F96: 1 | G96: 1 | H96: 1 | I96: 1 | J96: 1 | K96: 1 | L96: 1 | M96: 1 | N96: 1 | O96: 1 | P96: 1 | Q96: Member
A97: =HYPERLINK("http://www.magelo.com/eq_view_profile.html?num=35808","Honour") -> Honour | B97: 65 | C97: Veteran | D97: Half Elf | E97: YES | F97: X | G97: X | J97: X | K97: X | L97: X | N97: X | P97: X | Q97: Member
A98: =HYPERLINK("http://www.magelo.com/eq_view_profile.html?num=319473","Less") -> Less | B98: 65 | C98: Veteran | D98: Barbarian | E98: YES | G98: 1 | H98: 1 | I98: 1 | J98: 1 | K98: 1 | L98: 1 | M98: 1 | P98: 1 | Q98: Officer
A99: =HYPERLINK("http://www.magelo.com/eq_view_profile.html?num=552907","Mindori") -> Mindori | B99: 65 | C99: Veteran | D99: Wood Elf | E99: YES | G99: 1 | H99: 1 | I99: 1 | J99: 1 | K99: 1 | N99: 1 | P99: 1 | Q99: Member
A100: =HYPERLINK("http://www.magelo.com/eq_view_profile.html?num=176420","Morisan") -> Morisan | B100: 65 | C100: Marauder | D100: Dwarf | E100: YES | F100: 1 | G100: 1 | H100: 1 | I100: 1 | J100: 1 | K100: 1 | L100: 1 | M100: 1 | N100: 1 | P100: 1 | Q100: Member
A101: O'Grady | B101: 65 | D101: Dwarf | E101: YES | G101: 1 | H101: 1 | I101: 1 | J101: 1 | K101: 1 | Q101: Member
A102: =HYPERLINK("http://www.magelo.com/eq_view_profile.html?num=512841","Slipn") -> Slipn | B102: 65 | D102: Barbarian | E102: YES | G102: 1 | H102: 1 | J102: 1 | K102: 1 | N102: 1 | P102: 1 | Q102: Member
A103: =HYPERLINK("http://www.magelo.com/eq_view_profile.html?num=92314","Vestrial") -> Vestrial | B103: 65 | C103: Marauder | D103: Half Elf | E103: YES | F103: 1 | G103: 1 | H103: 1 | I103: 1 | J103: 1 | K103: 1 | N103: 1 | P103: 1 | Q103: Leader
A104: Britan (alt) | B104: 65 | C104: Veteran | D104: Gnome | E104: YES | F104: X | G104: X | H104: X | J104: X | K104: X | P104: 1 | Q104: Member
A105: Shadow Knights
A106: =HYPERLINK("http:www.magelo.com/eq_view_profile.html?num=362550","Asdrubael") -> Asdrubael | B106: 65 | C106: Duke | D106: Dark Elf | E106: YES | F106: 1 | G106: 1 | H106: 1 | I106: 1 | J106: 1 | K106: 1 | N106: 1 | O106: 1 | P106: 1 | Q106: Officer
A107: =HYPERLINK("http:www.magelo.com/eq_view_profile.html?num=313032","Groldar") -> Groldar | B107: 65 | D107: Iksar | E107: NO | G107: 1 | H107: 1 | J107: 1 | K107: 1 | L107: 1 | M107: 1 | N107: 1 | P107: 1 | Q107: Member
A108: =HYPERLINK("http://www.legendsoftherealm.com/legends/","Lunna") -> Lunna | B108: 65 | D108: Erudite | E108: NO | G108: 1 | H108: 1 | J108: 1 | Q108: Member
A109: =HYPERLINK("http://www.magelo.com/eq_view_profile.html?num=70519","Rakum") -> Rakum | B109: 65 | C109: Duke | D109: Troll | E109: NO | G109: 1 | H109: 1 | I109: 1 | J109: 1 | K109: 1 | L109: 1 | M109: 1 | N109: 1 | O109: 1 | P109: 1 | Q109: Member
A110: =HYPERLINK("http://www.magelo.com/eq_view_profile.html?num=359742","Tobak") -> Tobak | B110: 63 | D110: Ogre | E110: YES | F110: 1 | G110: 1 | J110: 1 | K110: 1 | M110: 1 | N110: 1 | P110: 1 | Q110: Member
A111: =HYPERLINK("http://www.magelo.com/eq_view_profile.html?num=555532","Veya") -> Veya | B111: 65 | D111: Iksar | E111: NO | G111: 1 | H111: 1 | I111: 1 | J111: 1 | K111: 1 | L111: 1 | M111: 1 | N111: 1 | P111: 1 | Q111: Member
A112: =HYPERLINK("http://www.magelo.com/eq_view_profile.html?num=350162","Zolgar") -> Zolgar | B112: 65 | C112: Sir | D112: Troll | E112: YES | F112: 1 | G112: 1 | H112: 1 | I112: 1 | J112: 1 | K112: 1 | L112: 1 | M112: 1 | N112: 1 | O112: 1 | P112: 1 | Q112: Member
A113: Shamans
A114: =HYPERLINK("http://www.magelo.com/eq_view_profile.html?num=557618","Aldarien") -> Aldarien | B114: 65 | C114: Venerable | D114: Barbarian | E114: YES | G114: 1 | H114: 1 | I114: 1 | J114: 1 | K114: 1 | L114: 1 | M114: 1 | N114: 1 | O114: 1 | P114: 1 | Q114: Member
A115: =HYPERLINK("http://www.magelo.com/eq_view_profile.html?num=29294","Angryor") -> Angryor | B115: 65 | C115: Baron | D115: Barbarian | E115: YES | H115: 1 | J115: 1 | Q115: Member
A116: Bamslam | B116: 65 | C116: Venerable | D116: Troll | E116: YES | F116: 1 | G116: 1 | H116: 1 | I116: 1 | J116: 1 | P116: 1 | Q116: Officer
A117: =HYPERLINK("http://www.magelo.com/eq_view_profile.html?num=627547","Blisk") -> Blisk | B117: 65 | C117: Baron | D117: Iksar | E117: YES | G117: 1 | H117: 1 | I117: 1 | J117: 1 | K117: 1 | M117: 1 | N117: 1 | P117: 1 | Q117: Member
A118: Bulvyne | B118: 65 | D118: Barbarian | E118: YES | G118: 1 | H118: 1 | I118: 1 | J118: 1 | L118: 1 | P118: 1 | Q118: Member
A119: Kroze | B119: 65 | D119: Barbarian | E119: YES | H119: 1 | J119: 1 | P119: 1 | Q119: Member
A120: =HYPERLINK("http://www.magelo.com/eq_view_profile.html?num=183881","Naghite") -> Naghite | B120: 65 | C120: Venerable | D120: Ogre | E120: YES | F120: 1 | G120: 1 | H120: 1 | I120: 1 | J120: 1 | K120: 1 | L120: 1 | M120: 1 | N120: 1 | P120: 1 | Q120: Officer
A121: =HYPERLINK("http://www.magelo.com/eq_view_profile.html?num=347641","Ruanu") -> Ruanu | B121: 65 | C121: Venerable | D121: Troll | E121: YES | F121: 1 | G121: 1 | J121: 1 | K121: 1 | L121: 1 | P121: 1 | Q121: Member
A122: =HYPERLINK("http://www.magelo.com/eq_view_profile.html?num=197796","Saramina") -> Saramina | B122: 65 | C122: Venerable | D122: Barbarian | E122: YES | F122: 1 | G122: 1 | H122: 1 | I122: 1 | J122: 1 | K122: 1 | N122: 1 | P122: 1 | Q122: Officer
A123: =HYPERLINK("http://www.magelo.com/eq_view_profile.html?num=194845","Ulskun") -> Ulskun | B123: 65 | D123: Barbarian | E123: YES | G123: 1 | H123: 1 | I123: 1 | J123: 1 | N123: 1 | P123: 1 | Q123: Member
A124: =HYPERLINK("http://www.magelo.com/eq_view_profile.html?num=412675","Walknot") -> Walknot | B124: 65 | D124: Ogre | E124: YES | H124: 1 | J124: 1 | O124: 1 | Q124: Member
A125: =HYPERLINK("http://www.magelo.com/eq_view_profile.html?num=356943","Zurs") -> Zurs | B125: 65 | C125: Venerable | D125: Barbarian | E125: YES | F125: X | G125: X | J125: X | Q125: Member
A126: =HYPERLINK("http://www.magelo.com/eq_view_profile.html?num=341926","Oenone (alt)") -> Oenone (alt) | B126: 60 | C126: Venerable | D126: Troll | E126: YES | F126: X | Q126: Member
A127: Warriors
A128: =HYPERLINK("http://www.magelo.com/eq_view_profile.html?num=141424","Agus") -> Agus | B128: 65 | C128: Veteran | D128: Halfling | E128: YES | F128: 1 | G128: 1 | J128: 1 | K128: 1 | N128: 1 | P128: 1 | Q128: Officer
A129: Caldok | B129: 60 | D129: Dwarf | E129: NO | G129: 1 | Q129: Member
A130: =HYPERLINK("http://www.magelo.com/eq_view_profile.html?num=357231","Feersum") -> Feersum | B130: 65 | D130: Barbarian | E130: NO | G130: 1 | H130: 1 | I130: 1 | J130: 1 | N130: 1 | P130: 1 | Q130: Member
A131: =HYPERLINK("http://www.magelo.com/eq_view_profile.html?num=343105","Hearsay") -> Hearsay | B131: 65 | C131: Veteran | D131: Barbarian | E131: YES | F131: 1 | G131: 1 | H131: 1 | I131: 1 | J131: 1 | K131: 1 | L131: 1 | M131: 1 | N131: 1 | O131: 1 | P131: 1 | Q131: Member
A132: =HYPERLINK("http://www.magelo.com/eq_view_profile.html?num=70247","Ghazhagh") -> Ghazhagh | B132: 65 | D132: Dwarf | E132: NO | G132: 1 | H132: 1 | I132: 1 | J132: 1 | N132: 1 | P132: 1 | Q132: Member
A133: =HYPERLINK("http://www.magelo.com/eq_view_profile.html?num=641141","Kylliyn") -> Kylliyn | B133: 65 | C133: Veteran | D133: Dwarf | E133: NO | G133: 1 | H133: 1 | I133: 1 | J133: 1 | K133: 1 | O133: 1 | P133: 1 | Q133: Member
A134: =HYPERLINK("http://www.magelo.com/eq_view_profile.html?num=599043","Matsu") -> Matsu | B134: 65 | C134: Veteran | D134: Halfling | E134: YES | F134: 1 | G134: 1 | H134: 1 | I134: 1 | J134: 1 | K134: 1 | M134: 1 | N134: 1 | O134: 1 | P134: 1 | Q134: Member
A135: =HYPERLINK("http://www.magelo.com/eq_view_profile.html?num=244458","Mouxxie") -> Mouxxie | B135: 65 | C135: Baroness | D135: Halfling | E135: NO | F135: 1 | G135: 1 | H135: 1 | J135: 1 | K135: 1 | M135: 1 | P135: 1 | Q135: Member
A136: Panzona | B136: 65 | D136: Halfling | E136: NO | H136: 1 | I136: 1 | J136: 1 | Q136: Member
A137: =HYPERLINK("http://www.magelo.com/eq_view_profile.html?num=265387","Sarelin") -> Sarelin | B137: 65 | C137: Marshall | D137: Barbarian | E137: NO | H137: 1 | I137: 1 | J137: 1 | K137: 1 | L137: 1 | M137: 1 | O137: 1 | P137: 1 | Q137: Member
A138: =HYPERLINK("http://www.magelo.com/eq_view_profile.html?num=98879","Silph") -> Silph | B138: 65 | C138: Marshall | D138: Human | E138: YES | F138: X | G138: X | J138: X | K138: X | L138: X | M138: X | P138: X | Q138: Member
A139: =HYPERLINK("http://www.magelo.com/eq_view_profile.html?num=361707","Veera") -> Veera | B139: 55 | D139: Barbarian | E139: NO | Q139: Member
A140: Zeal (alt) | B140: 65 | D140: Ogre | E140: NO | J140: X | P140: X | Q140: Member
A141: Wizards
A142: =HYPERLINK("http://www.magelo.com/eq_view_profile.html?num=202761","Aylith") -> Aylith | B142: 65 | C142: Mistress | D142: High Elf | E142: YES | F142: 1 | G142: 1 | H142: 1 | J142: 1 | K142: 1 | L142: 1 | P142: 1 | Q142: Member
A143: Fairuza | B143: 62 | D143: Erudite | E143: YES | N143: 1 | Q143: Officer
A144: =HYPERLINK("http://www.magelo.com/eq_view_profile.html?num=360232","Kanah") -> Kanah | B144: 65 | C144: Sage | D144: Dark Elf | E144: YES | G144: 1 | H144: 1 | I144: 1 | J144: 1 | K144: 1 | M144: 1 | N144: 1 | O144: 1 | P144: 1 | Q144: Member
A145: Zeanith | B145: 58 | D145: Dark Elf | E145: NO | J145: 1 | Q145: Member
A146: Kelben (alt) | B146: 60 | C146: Baron | D146: Human | E146: YES | Q146: Member
A147: Siobahn (alt) | B147: 61 | D147: Dark Elf | E147: NO | Q147: Member
A148: Ticktick (alt) | B148: 65 | D148: Froglock | E148: NO | H148: X | I148: X | Q148: Member
A149: Num of Act. Memb.= | B149: 96 | C149: % Of Guild With Access= | F149: =SUM(F4:F148)/B149*1 -> 0.40625 | G149: =SUM(G4:G148)/B149*1 -> 0.70833333333333337 | H149: =SUM(H4:H148)/B149*1 -> 0.85416666666666663 | I149: =SUM(I4:I148)/B149*1 -> 0.59375 | J149: =SUM(J4:J148)/B149*1 -> 0.89583333333333337 | K149: =SUM(K4:K148)/B149*1 -> 0.66666666666666663 | L149: =SUM(L4:L148)/B149*1 -> 0.34375 | M149: =SUM(M4:M148)/B149*1 -> 0.4375 | N149: =SUM(N4:N148)/B149*1 -> 0.5625 | O149: =SUM(O4:O148)/B149*1 -> 0.33333333333333331 | P149: =SUM(P4:P148)/B149*1 -> 0.73958333333333337 | Q149: 37819
A150: Average Level= | B150: =AVERAGE(B17:B28,B63:B66,B142:B145,B128:B139,B106:B112,B80:B85,B114:B125,B96:B104,B4:B9,B51:B58,B69:B72,B38:B47,B87:B94,B74:B78,B12:B12) -> 64.259259259259252