A1: Name | B1: Level | C1: Race | D1: Server | E1: Hit Points | F1: AC | G1: Mana | H1: Stat Totals
A2: Sendari | B2: 20 | C2: Human | D2: Quellious | E2: 407 | F2: 167 | G2: 526 | H2: =SUM(E2:G2) -> 1100
A3: Kinnopio | B3: 27 | C3: Erudite | D3: Tribunal | E3: 683 | F3: 188 | G3: 811 | H3: =SUM(E3:G3) -> 1682
A4: Trastus | B4: 19 | C4: Human | D4: Innoruuk | E4: 441 | F4: 310 | G4: 874 | H4: =SUM(E4:G4) -> 1625
A5: Leilei | B5: 43 | C5: High Elf | D5: Nameless | E5: 917 | F5: 629 | G5: 1602 | H5: =SUM(E5:G5) -> 3148
A6: Aaelandri | B6: 39 | C6: Dark Elf | D6: Tribunal | E6: 1029 | F6: 822 | G6: 1685 | H6: =SUM(E6:G6) -> 3536
A7: Durley | B7: 40 | C7: Halfling | D7: Antonius Bayle | E7: 839 | F7: 745 | G7: 1702 | H7: =SUM(E7:G7) -> 3286
A8: Expiere | B8: 40 | C8: Dark Elf | D8: Prexus | E8: 923 | F8: 854 | G8: 1774 | H8: =SUM(E8:G8) -> 3551
A9: Grogs | B9: 46 | C9: Dwarf | D9: Tarew Marr | E9: 952 | F9: 748 | G9: 1784 | H9: =SUM(E9:G9) -> 3484
A10: Fenlayen | B10: 45 | C10: High Elf | D10: Erollisi Marr | E10: 913 | F10: 596 | G10: 1815 | H10: =SUM(E10:G10) -> 3324
A11: Ancarett | B11: 44 | C11: High Elf | D11: Veeshan | E11: 905 | F11: 663 | G11: 1954 | H11: =SUM(E11:G11) -> 3522
A12: Piikaa | B12: 46 | C12: Dwarf | D12: Bertoxxulous | E12: 943 | F12: 763 | G12: 2011 | H12: =SUM(E12:G12) -> 3717
A13: Quotison | B13: 60 | C13: Dwarf | D13: Tarew Marr | E13: 1074 | F13: 580 | G13: 2030 | H13: =SUM(E13:G13) -> 3684
A14: Kerowen | B14: 47 | C14: High Elf | D14: Drinal | E14: 910 | F14: 631 | G14: 2035 | H14: =SUM(E14:G14) -> 3576
A15: Pomaikai | B15: 45 | C15: High Elf | D15: Zebuxoruk | E15: 891 | F15: 665 | G15: 2104 | H15: =SUM(E15:G15) -> 3660
A16: Fattima | B16: 51 | C16: Dwarf | D16: Innoruuk | E16: 1087 | F16: 632 | G16: 2142 | H16: =SUM(E16:G16) -> 3861
A17: Javara | B17: 52 | C17: High Elf | D17: Brell Serilis | E17: 1059 | F17: 728 | G17: 2191 | H17: =SUM(E17:G17) -> 3978
A18: Halthek | B18: 53 | C18: Dwarf | D18: Mithaniel Marr | E18: 1125 | F18: 679 | G18: 2193 | H18: =SUM(E18:G18) -> 3997
A19: Ayenya | B19: 52 | C19: High Elf | D19: Xegony | E19: 1045 | F19: 819 | G19: 2231 | H19: =SUM(E19:G19) -> 4095
A20: Bombidil | B20: 51 | C20: Dwarf | D20: Terris-Thule | E20: 1088 | F20: 565 | G20: 2272 | H20: =SUM(E20:G20) -> 3925
A21: Lithele | B21: 51 | C21: Human | D21: Antonius Bayle | E21: 1019 | F21: 773 | G21: 2273 | H21: =SUM(E21:G21) -> 4065
A22: Atlin | B22: 51 | C22: Dwarf | D22: Cazic-Thule | E22: 1155 | F22: 816 | G22: 2278 | H22: =SUM(E22:G22) -> 4249
A23: Etumaru | B23: 52 | C23: Erudite | D23: Erollisi Marr | E23: 1060 | F23: 776 | G23: 2278 | H23: =SUM(E23:G23) -> 4114
A24: Agmyleez | B24: 52 | C24: Erudite | D24: Karana | E24: 1055 | F24: 652 | G24: 2314 | H24: =SUM(E24:G24) -> 4021
A25: Arolily | B25: 52 | C25: High Elf | D25: Morell-Thulle | E25: 1026 | F25: 625 | G25: 2325 | H25: =SUM(E25:G25) -> 3976
A26: Yumanea | B26: 54 | C26: High Elf | D26: Erollisi Marr | E26: 1203 | F26: 741 | G26: 2340 | H26: =SUM(E26:G26) -> 4284
A27: Dyvin | B27: 52 | C27: Dark Elf | D27: Terris-Thule | E27: 994 | F27: 741 | G27: 2341 | H27: =SUM(E27:G27) -> 4076
A28: Fhylden | B28: 54 | C28: Halfling | D28: Ayonae Ro | E28: 1051 | F28: 779 | G28: 2359 | H28: =SUM(E28:G28) -> 4189
A29: Nyvn | B29: 51 | C29: Dwarf | D29: Ayonae Ro | E29: 1055 | F29: 769 | G29: 2374 | H29: =SUM(E29:G29) -> 4198
A30: Lerman | B30: 54 | C30: High Elf | D30: Seventh Hammer | E30: 1126 | F30: 784 | G30: 2386 | H30: =SUM(E30:G30) -> 4296
A31: Jalaran | B31: 55 | C31: High Elf | D31: Mithaniel Marr | E31: 1022 | F31: 565 | G31: 2387 | H31: =SUM(E31:G31) -> 3974
A32: Balanar | B32: 56 | C32: Dwarf | D32: Tunare | E32: 1211 | F32: 733 | G32: 2413 | H32: =SUM(E32:G32) -> 4357
A33: Daerv | B33: 54 | C33: Human | D33: Vazaelle | E33: 1058 | F33: 675 | G33: 2414 | H33: =SUM(E33:G33) -> 4147
A34: Ycarus | B34: 54 | C34: Halfling | D34: E'cil | E34: 1203 | F34: 863 | G34: 2419 | H34: =SUM(E34:G34) -> 4485
A35: Tofe | B35: 56 | C35: Dwarf | D35: Antonius Bayle | E35: 1179 | F35: 859 | G35: 2446 | H35: =SUM(E35:G35) -> 4484
A36: Bezil | B36: 54 | C36: Dwarf | D36: Rathe | E36: 1130 | F36: 781 | G36: 2460 | H36: =SUM(E36:G36) -> 4371
A37: Aean | B37: 53 | C37: Human | D37: Xegony | E37: 1254 | F37: 899 | G37: 2473 | H37: =SUM(E37:G37) -> 4626
A38: Skwar | B38: 52 | C38: Halfling | D38: Xev | E38: 1181 | F38: 656 | G38: 2509 | H38: =SUM(E38:G38) -> 4346
A39: Dakin | B39: 55 | C39: Dwarf | D39: Innoruuk | E39: 1413 | F39: 877 | G39: 2534 | H39: =SUM(E39:G39) -> 4824
A40: Bindol | B40: 52 | C40: Dwarf | D40: Solusek Ro | E40: 1144 | F40: 777 | G40: 2552 | H40: =SUM(E40:G40) -> 4473
A41: Chrisking | B41: 53 | C41: Dwarf | D41: Morell-Thule | E41: 1182 | F41: 693 | G41: 2556 | H41: =SUM(E41:G41) -> 4431
A42: Jessamyn | B42: 55 | C42: Dwarf | D42: Tholuxe Paells | E42: 1285 | F42: 777 | G42: 2610 | H42: =SUM(E42:G42) -> 4672
A43: Lorelai | B43: 53 | C43: High Elf | D43: Quellious | E43: 1358 | F43: 828 | G43: 2622 | H43: =SUM(E43:G43) -> 4808
A44: Daymondd | B44: 55 | C44: Dwarf | D44: Mithaniel Marr | E44: 1383 | F44: 916 | G44: 2636 | H44: =SUM(E44:G44) -> 4935
A45: Cartmean | B45: 59 | C45: High Elf | D45: Quesllious | E45: 1166 | F45: 809 | G45: 2642 | H45: =SUM(E45:G45) -> 4617
A46: Grundersoltec | B46: 56 | C46: Halfling | D46: Tholuxe Paells | E46: 1196 | F46: 922 | G46: 2662 | H46: =SUM(E46:G46) -> 4780
A47: Leiren | B47: 58 | C47: Human | D47: Tarew Marr | E47: 1372 | F47: 839 | G47: 2720 | H47: =SUM(E47:G47) -> 4931
A48: Altheia | B48: 55 | C48: Dark Elf | D48: Vazaelle | E48: 1255 | F48: 834 | G48: 2730 | H48: =SUM(E48:G48) -> 4819
A49: Johrena | B49: 52 | C49: Halfling | D49: Torvonnilous | E49: 1131 | F49: 521 | G49: 2763 | H49: =SUM(E49:G49) -> 4415
A50: Ragnon | B50: 58 | C50: High Elf | D50: Morell-Thule | E50: 1267 | F50: 814 | G50: 2813 | H50: =SUM(E50:G50) -> 4894
A51: Mirixia | B51: 56 | C51: Dark Elf | D51: Vallon Zek | E51: 1408 | F51: 869 | G51: 2828 | H51: =SUM(E51:G51) -> 5105
A52: Ladile | B52: 58 | C52: Human | D52: Solusek Ro | E52: 1212 | F52: 858 | G52: 2831 | H52: =SUM(E52:G52) -> 4901
A53: Gragner | B53: 57 | C53: Dwarf | D53: Test | E53: 1445 | F53: 866 | G53: 2850 | H53: =SUM(E53:G53) -> 5161
A54: Malf | B54: 56 | C54: Dwarf | D54: Torvonnilous | E54: 1679 | F54: 981 | G54: 2854 | H54: =SUM(E54:G54) -> 5514
A55: Lazarelle | B55: 60 | C55: High Elf | D55: Vazaelle | E55: 1351 | F55: 1130 | G55: 2911 | H55: =SUM(E55:G55) -> 5392
A56: Yueana | B56: 57 | C56: High Elf | D56: Quellious | E56: 1422 | F56: 947 | G56: 2932 | H56: =SUM(E56:G56) -> 5301
A57: Lylliae | B57: 58 | C57: High Elf | D57: Vazaelle | E57: 1688 | F57: 976 | G57: 2952 | H57: =SUM(E57:G57) -> 5616
A58: Kaysha | B58: 55 | C58: Human | D58: Lanys T'Vyl | E58: 1391 | F58: 828 | G58: 2954 | H58: =SUM(E58:G58) -> 5173
A59: Battas | B59: 60 | C59: Halfling | D59: Vvazaelle | E59: 1639 | F59: 1010 | G59: 2973 | H59: =SUM(E59:G59) -> 5622
A60: Morrun | B60: 60 | C60: Halfling | D60: Cazic-Thule | E60: 1618 | F60: 944 | G60: 2988 | H60: =SUM(E60:G60) -> 5550
A61: Ejkas | B61: 60 | C61: High Elf | D61: Solusek Ro | E61: 1341 | F61: 880 | G61: 2993 | H61: =SUM(E61:G61) -> 5214
A62: Binadint | B62: 60 | C62: Dwarf | D62: Solusek Ro | E62: 1601 | F62: 1013 | G62: 3009 | H62: =SUM(E62:G62) -> 5623
A63: Lifeheart | B63: 60 | C63: Dark Elf | D63: Povar | E63: 1492 | F63: 937 | G63: 3021 | H63: =SUM(E63:G63) -> 5450
A64: Sadar | B64: 60 | C64: High Elf | D64: Seventh Hammer | E64: 1562 | F64: 960 | G64: 3031 | H64: =SUM(E64:G64) -> 5553
A65: Kjia | B65: 57 | C65: Gnome | D65: Antonius Bayle | E65: 1752 | F65: 1005 | G65: 3037 | H65: =SUM(E65:G65) -> 5794
A66: Sinafein | B66: 57 | C66: Dwarf | D66: Morell-Thule | E66: 1474 | F66: 868 | G66: 3051 | H66: =SUM(E66:G66) -> 5393
A67: Yirkin | B67: 60 | C67: Dwarf | D67: Povar | E67: 1503 | F67: 985 | G67: 3051 | H67: =SUM(E67:G67) -> 5539
A68: Laithia | B68: 60 | C68: High Elf | D68: Innoruuk | E68: 1393 | F68: 998 | G68: 3069 | H68: =SUM(E68:G68) -> 5460
A69: Tanilin | B69: 60 | C69: Erudite | D69: Rallos Zek | E69: 1610 | F69: 866 | G69: 3100 | H69: =SUM(E69:G69) -> 5576
A70: Drekken | B70: 60 | C70: Human | D70: Vazaelle | E70: 1515 | F70: 990 | G70: 3116 | H70: =SUM(E70:G70) -> 5621
A71: Bigg | B71: 60 | C71: High Elf | D71: Innoruuk | E71: 1533 | F71: 940 | G71: 3129 | H71: =SUM(E71:G71) -> 5602
A72: Cland | B72: 60 | C72: Dwarf | D72: Rallos Zek | E72: 1493 | F72: 1290 | G72: 3162 | H72: =SUM(E72:G72) -> 5945
A73: Higar | B73: 56 | C73: Dwarf | D73: Drinal | E73: 1704 | F73: 866 | G73: 3172 | H73: =SUM(E73:G73) -> 5742
A74: Torlan | B74: 60 | C74: High Elf | D74: Vazaelle | E74: 1772 | F74: 1011 | G74: 3196 | H74: =SUM(E74:G74) -> 5979
A75: Meadbh | B75: 60 | C75: Dark Elf | D75: Innoruuk | E75: 1431 | F75: 1031 | G75: 3205 | H75: =SUM(E75:G75) -> 5667
A76: Kellithe | B76: 59 | C76: Dwarf | D76: Cazic-Thule | E76: 1802 | F76: 1033 | G76: 3212 | H76: =SUM(E76:G76) -> 6047
A77: Calimayrn | B77: 60 | C77: High Elf | D77: Veeshan | E77: 1833 | F77: 1097 | G77: 3219 | H77: =SUM(E77:G77) -> 6149
A78: Luminar | B78: 60 | C78: Erudite | D78: Saryrn | E78: 1822 | F78: 975 | G78: 3224 | H78: =SUM(E78:G78) -> 6021
A79: Panteroo | B79: 60 | C79: High Elf | D79: Fennin Ro | E79: 1735 | F79: 982 | G79: 3225 | H79: =SUM(E79:G79) -> 5942
A80: Cryogenic | B80: 57 | C80: High Elf | D80: Antonius Bayle | E80: 1652 | F80: 750 | G80: 3228 | H80: =SUM(E80:G80) -> 5630
A81: Haels | B81: 60 | C81: Dwarf | D81: Vazaelle | E81: 1752 | F81: 893 | G81: 3228 | H81: =SUM(E81:G81) -> 5873
A82: Windeliane | B82: 60 | C82: High Elf | D82: Terris-Thule | E82: 1645 | F82: 958 | G82: 3230 | H82: =SUM(E82:G82) -> 5833
A83: Badany | B83: 58 | C83: Human | D83: Zebuxoruk | E83: 1809 | F83: 976 | G83: 3269 | H83: =SUM(E83:G83) -> 6054
A84: Dorim | B84: 60 | C84: Dwarf | D84: Innoruuk | E84: 1836 | F84: 900 | G84: 3272 | H84: =SUM(E84:G84) -> 6008
A85: Marri | B85: 58 | C85: High Elf | D85: Innoruuk | E85: 1641 | F85: 1008 | G85: 3290 | H85: =SUM(E85:G85) -> 5939
A86: Eriond | B86: 60 | C86: Dwarf | D86: Antonius Bayle | E86: 1770 | F86: 869 | G86: 3305 | H86: =SUM(E86:G86) -> 5944
A87: Yari | B87: 60 | C87: High Elf | D87: Karana | E87: 1766 | F87: 1099 | G87: 3314 | H87: =SUM(E87:G87) -> 6179
A88: Thordoff | B88: 59 | C88: Dwarf | D88: Druzzil Ro | E88: 1833 | F88: 1001 | G88: 3323 | H88: =SUM(E88:G88) -> 6157
A89: Treage | B89: 60 | C89: High Elf | D89: Erollisi Marr | E89: 1742 | F89: 1044 | G89: 3344 | H89: =SUM(E89:G89) -> 6130
A90: Aalamdara | B90: 58 | C90: High Elf | D90: Solusek Ro | E90: 1640 | F90: 952 | G90: 3348 | H90: =SUM(E90:G90) -> 5940
A91: Phalia | B91: 60 | C91: Dwarf | D91: Xegony | E91: 1797 | F91: 946 | G91: 3353 | H91: =SUM(E91:G91) -> 6096
A92: Tekara | B92: 60 | C92: Erudite | D92: Cazic-Thule | E92: 1634 | F92: 904 | G92: 3360 | H92: =SUM(E92:G92) -> 5898
A93: Taleus | B93: 60 | C93: High Elf | D93: Prexus | E93: 1909 | F93: 960 | G93: 3371 | H93: =SUM(E93:G93) -> 6240
A94: Affinity | B94: 60 | C94: High Elf | D94: Rodcet Nife | E94: 1639 | F94: 1020 | G94: 3373 | H94: =SUM(E94:G94) -> 6032
A95: Trixxey | B95: 60 | C95: Erudite | D95: Xev | E95: 1683 | F95: 842 | G95: 3375 | H95: =SUM(E95:G95) -> 5900
A96: Spawrhawk | B96: 60 | C96: Dwarf | D96: Fennin Ro | E96: 1945 | F96: 1110 | G96: 3404 | H96: =SUM(E96:G96) -> 6459
A97: Dianna | B97: 60 | C97: Halfling | D97: Vazaelle | E97: 1712 | F97: 1034 | G97: 3405 | H97: =SUM(E97:G97) -> 6151
A98: Gorthe | B98: 58 | C98: Dwarf | D98: Innoruuk | E98: 1663 | F98: 924 | G98: 3410 | H98: =SUM(E98:G98) -> 5997
A99: Cyzia | B99: 60 | C99: High Elf | D99: Cazic-Thule | E99: 1763 | F99: 1017 | G99: 3415 | H99: =SUM(E99:G99) -> 6195
A100: Daryaen | B100: 60 | C100: High Elf | D100: Tunare | E100: 1765 | F100: 943 | G100: 3430 | H100: =SUM(E100:G100) -> 6138
A101: Saela | B101: 60 | C101: Dwarf | D101: Drinal | E101: 1850 | F101: 1005 | G101: 3430 | H101: =SUM(E101:G101) -> 6285
A102: Bertil | B102: 59 | C102: Dwarf | D102: Xegony | E102: 1890 | F102: 1002 | G102: 3432 | H102: =SUM(E102:G102) -> 6324
A103: Balamor | B103: 60 | C103: Dwarf | D103: Fennin Ro | E103: 1722 | F103: 932 | G103: 3432 | H103: =SUM(E103:G103) -> 6086
A104: Callandre | B104: 60 | C104: High Elf | D104: Quesllious | E104: 1719 | F104: 877 | G104: 3432 | H104: =SUM(E104:G104) -> 6028
A105: Mathiddae | B105: 60 | C105: High Elf | D105: Vazaelle | E105: 1758 | F105: 948 | G105: 3443 | H105: =SUM(E105:G105) -> 6149
A106: Adarii | B106: 60 | C106: Dark Elf | D106: Vazaelle | E106: 1696 | F106: 1013 | G106: 3445 | H106: =SUM(E106:G106) -> 6154
A107: Kornaena | B107: 60 | C107: Dark Elf | D107: Mithaniel Marr | E107: 1779 | F107: 1005 | G107: 3460 | H107: =SUM(E107:G107) -> 6244
A108: Letha | B108: 60 | C108: High Elf | D108: Vazaelle | E108: 1748 | F108: 1029 | G108: 3460 | H108: =SUM(E108:G108) -> 6237
A109: Barazon | B109: 60 | C109: Dwarf | D109: Vazaelle | E109: 2032 | F109: 1191 | G109: 3471 | H109: =SUM(E109:G109) -> 6694
A110: Caliopy | B110: 60 | C110: Dark Elf | D110: Innoruuk | E110: 1884 | F110: 1094 | G110: 3475 | H110: =SUM(E110:G110) -> 6453
A111: Markin | B111: 60 | C111: Dwarf | D111: Rodcet Nife | E111: 2155 | F111: 1044 | G111: 3484 | H111: =SUM(E111:G111) -> 6683
A112: Sherazade | B112: 60 | C112: High Elf | D112: Prexus | E112: 179 | F112: 1064 | G112: 3490 | H112: =SUM(E112:G112) -> 4733
A113: Rommy | B113: 60 | C113: Dark Elf | D113: Povar | E113: 1975 | F113: 962 | G113: 3498 | H113: =SUM(E113:G113) -> 6435
A114: Ladimor | B114: 60 | C114: High Elf | D114: Bristlebane | E114: 1994 | F114: 995 | G114: 3527 | H114: =SUM(E114:G114) -> 6516
A115: Rosalinde | B115: 60 | C115: High Elf | D115: Antonius Bayle | E115: 2389 | F115: 1048 | G115: 3535 | H115: =SUM(E115:G115) -> 6972
A116: Yamile | B116: 60 | C116: High Elf | D116: Vazaelle | E116: 1736 | F116: 970 | G116: 3536 | H116: =SUM(E116:G116) -> 6242
A117: Benaa | B117: 60 | C117: Dark Elf | D117: Mithaniel Marr | E117: 1884 | F117: 973 | G117: 3550 | H117: =SUM(E117:G117) -> 6407
A118: Luminent | B118: 60 | C118: High Elf | D118: Antonius Bayle | E118: 1864 | F118: 1105 | G118: 3565 | H118: =SUM(E118:G118) -> 6534
A119: Tappsek | B119: 60 | C119: Dwarf | D119: Innoruuk | E119: 2010 | F119: 1068 | G119: 3568 | H119: =SUM(E119:G119) -> 6646
A120: Lyranna | B120: 60 | C120: Human | D120: Tunare | E120: 2030 | F120: 972 | G120: 3584 | H120: =SUM(E120:G120) -> 6586
A121: Tietan | B121: 60 | C121: High Elf | D121: Zebuxoruk | E121: 1993 | F121: 1011 | G121: 3586 | H121: =SUM(E121:G121) -> 6590
A122: Kanroc | B122: 60 | C122: Dwarf | D122: Povar | E122: 2427 | F122: 996 | G122: 3597 | H122: =SUM(E122:G122) -> 7020
A123: Areina | B123: 60 | C123: Dark Elf | D123: Mithaniel Marr | E123: 2100 | F123: 1038 | G123: 3612 | H123: =SUM(E123:G123) -> 6750
A124: Grumbles | B124: 60 | C124: Dwarf | D124: Drinal | E124: 1961 | F124: 953 | G124: 3615 | H124: =SUM(E124:G124) -> 6529
A125: Loral | B125: 60 | C125: High Elf | D125: Quellious | E125: 1825 | F125: 1020 | G125: 3645 | H125: =SUM(E125:G125) -> 6490
A126: Rosieana | B126: 60 | C126: High Elf | D126: Karana | E126: 1853 | F126: 1137 | G126: 3645 | H126: =SUM(E126:G126) -> 6635
A127: Myriella | B127: 60 | C127: Human | D127: Tribunal | E127: 2078 | F127: 1039 | G127: 3660 | H127: =SUM(E127:G127) -> 6777
A128: Vera | B128: 60 | C128: Dark Elf | D128: Tholuxe Paelle | E128: 2291 | F128: 1183 | G128: 3665 | H128: =SUM(E128:G128) -> 7139
A129: Noryaka | B129: 60 | C129: Dark Elf | D129: Innoruuk | E129: 1891 | F129: 1112 | G129: 3675 | H129: =SUM(E129:G129) -> 6678
A130: Qamen | B130: 60 | C130: High Elf | D130: Fennin Ro | E130: 1890 | F130: 1049 | G130: 3681 | H130: =SUM(E130:G130) -> 6620
A131: Gravewalker | B131: 60 | C131: Halfling | D131: Solusek Ro | E131: 1804 | F131: 962 | G131: 3685 | H131: =SUM(E131:G131) -> 6451
A132: Pacemaker | B132: 60 | C132: Human | D132: Rathe | E132: 2221 | F132: 732 | G132: 3692 | H132: =SUM(E132:G132) -> 6645
A133: Leesa | B133: 60 | C133: High Elf | D133: Rathe | E133: 1957 | F133: 1055 | G133: 3705 | H133: =SUM(E133:G133) -> 6717
A134: Grubble | B134: 60 | C134: Dwarf | D134: Nameless | E134: 2451 | F134: 1138 | G134: 3706 | H134: =SUM(E134:G134) -> 7295
A135: Jilanya | B135: 60 | C135: High Elf | D135: Innoruuk | E135: 1932 | F135: 1067 | G135: 3710 | H135: =SUM(E135:G135) -> 6709
A136: Noraseas | B136: 60 | C136: Dark Elf | D136: Prexus | E136: 1932 | F136: 1070 | G136: 3710 | H136: =SUM(E136:G136) -> 6712
A137: Skidun | B137: 60 | C137: High Elf | D137: Druzzil Ro | E137: 2248 | F137: 1223 | G137: 3710 | H137: =SUM(E137:G137) -> 7181
A138: Treiz | B138: 60 | C138: High Elf | D138: Drinal | E138: 2000 | F138: 1011 | G138: 3710 | H138: =SUM(E138:G138) -> 6721
A139: Ruloe | B139: 60 | C139: Dwarf | D139: Bristlebane | E139: 2073 | F139: 961 | G139: 3720 | H139: =SUM(E139:G139) -> 6754
A140: Huneyy | B140: 60 | C140: High Elf | D140: Antonius Nayle | E140: 1780 | F140: 1038 | G140: 3724 | H140: =SUM(E140:G140) -> 6542
A141: Elronde | B141: 60 | C141: Human | D141: Seventh Hammer | E141: 1966 | F141: 1040 | G141: 3725 | H141: =SUM(E141:G141) -> 6731
A142: Brambodious | B142: 60 | C142: Halfling | D142: Quellious | E142: 2232 | F142: 1227 | G142: 3731 | H142: =SUM(E142:G142) -> 7190
A143: Jubal | B143: 60 | C143: High Elf | D143: Torvonnilous | E143: 1877 | F143: 1130 | G143: 3735 | H143: =SUM(E143:G143) -> 6742
A144: Atro | B144: 60 | C144: High Elf | D144: Tribunal | E144: 2132 | F144: 1206 | G144: 3740 | H144: =SUM(E144:G144) -> 7078
A145: Teacum | B145: 60 | C145: High Elf | D145: Test | E145: 2161 | F145: 1203 | G145: 3740 | H145: =SUM(E145:G145) -> 7104
A146: Tabb | B146: 60 | C146: Dwarf | D146: Test | E146: 2062 | F146: 993 | G146: 3745 | H146: =SUM(E146:G146) -> 6800
A147: Litermin | B147: 60 | C147: Halfling | D147: Erollisi Marr | E147: 1984 | F147: 1050 | G147: 3770 | H147: =SUM(E147:G147) -> 6804
A148: Adon | B148: 60 | C148: High Elf | D148: Zebuxoruk | E148: 2265 | F148: 1084 | G148: 3773 | H148: =SUM(E148:G148) -> 7122
A149: Corunthia | B149: 60 | C149: Dwarf | D149: Bristlebane | E149: 2243 | F149: 1070 | G149: 3780 | H149: =SUM(E149:G149) -> 7093
A150: Eclectic | B150: 60 | C150: Halfling | D150: Nameless | E150: 2751 | F150: 1156 | G150: 3782 | H150: =SUM(E150:G150) -> 7689
A151: Kegwell | B151: 60 | C151: Dwarf | D151: Xegony | E151: 2506 | F151: 1281 | G151: 3790 | H151: =SUM(E151:G151) -> 7577
A152: Kendal | B152: 60 | C152: High Elf | D152: Morell-Thule | E152: 2013 | F152: 1020 | G152: 3795 | H152: =SUM(E152:G152) -> 6828
A153: Stumpf | B153: 60 | C153: Dwarf | D153: Erollisi Marr | E153: 2085 | F153: 1017 | G153: 3805 | H153: =SUM(E153:G153) -> 6907
A154: Quistil | B154: 60 | C154: High Elf | D154: Erollisi Marr | E154: 2199 | F154: 1086 | G154: 3810 | H154: =SUM(E154:G154) -> 7095
A155: Aiyre | B155: 60 | C155: High Elf | D155: Druzzil Ro | E155: 2071 | F155: 1072 | G155: 3820 | H155: =SUM(E155:G155) -> 6963
A156: Jantos | B156: 60 | C156: Erudite | D156: Drinal | E156: 2139 | F156: 1069 | G156: 3820 | H156: =SUM(E156:G156) -> 7028
A157: Schatje | B157: 60 | C157: Dark Elf | D157: Rathe | E157: 2120 | F157: 1077 | G157: 3835 | H157: =SUM(E157:G157) -> 7032
A158: Glorund | B158: 60 | C158: Dwarf | D158: Prexus | E158: 2043 | F158: 1067 | G158: 3855 | H158: =SUM(E158:G158) -> 6965
A159: Thistleburr | B159: 60 | C159: Halfling | D159: Tribunal | E159: 2456 | F159: 1128 | G159: 3860 | H159: =SUM(E159:G159) -> 7444
A160: Lanfeare | B160: 60 | C160: Dwarf | D160: Stormhammer | E160: 2111 | F160: 1127 | G160: 3865 | H160: =SUM(E160:G160) -> 7103
A161: Klairen | B161: 60 | C161: High Elf | D161: Drinal | E161: 2242 | F161: 1075 | G161: 3870 | H161: =SUM(E161:G161) -> 7187
A162: Pilsburry | B162: 60 | C162: Dwarf | D162: Veeshan | E162: 2130 | F162: 1171 | G162: 3870 | H162: =SUM(E162:G162) -> 7171
A163: Thorgrimm | B163: 60 | C163: Dwarf | D163: Antonius Bayle | E163: 2144 | F163: 1124 | G163: 3875 | H163: =SUM(E163:G163) -> 7143
A164: Nukuki | B164: 60 | C164: High Elf | D164: Vazaelle | E164: 2129 | F164: 1185 | G164: 3885 | H164: =SUM(E164:G164) -> 7199
A165: Keleios | B165: 60 | C165: Halfling | D165: Vazaelle | E165: 2164 | F165: 1122 | G165: 3890 | H165: =SUM(E165:G165) -> 7176
A166: Torriana | B166: 60 | C166: High Elf | D166: Brell Serilis | E166: 2000 | F166: 865 | G166: 3900 | H166: =SUM(E166:G166) -> 6765
A167: Alerna | B167: 60 | C167: Erudite | D167: Zebuxoruk | E167: 2271 | F167: 1076 | G167: 3925 | H167: =SUM(E167:G167) -> 7272
A168: Cadsuane | B168: 60 | C168: Dark Elf | D168: Morell-Thule | E168: 2133 | F168: 1333 | G168: 3925 | H168: =SUM(E168:G168) -> 7391
A169: Nasren | B169: 60 | C169: Gnome | D169: Brell Serilis | E169: 2043 | F169: 1111 | G169: 3925 | H169: =SUM(E169:G169) -> 7079
A170: Immune | B170: 60 | C170: Dark Elf | D170: Antonius Bayle | E170: 2546 | F170: 1078 | G170: 3930 | H170: =SUM(E170:G170) -> 7554
A171: Deidda | B171: 60 | C171: Halfling | D171: Antonius Bayle | E171: 2426 | F171: 1167 | G171: 3934 | H171: =SUM(E171:G171) -> 7527
A172: Yimmarelle | B172: 60 | C172: Gnome | D172: Rathe | E172: 2102 | F172: 1081 | G172: 3935 | H172: =SUM(E172:G172) -> 7118
A173: Shortyrez | B173: 60 | C173: Dwarf | D173: Ayonae Ro | E173: 2121 | F173: 1067 | G173: 3944 | H173: =SUM(E173:G173) -> 7132
A174: Gryfalia | B174: 60 | C174: Dwarf | D174: Druzzil Ro | E174: 2402 | F174: 1120 | G174: 3948 | H174: =SUM(E174:G174) -> 7470
A175: Lyllandra | B175: 60 | C175: High Elf | D175: Vazaelle | E175: 2353 | F175: 1152 | G175: 3955 | H175: =SUM(E175:G175) -> 7460
A176: Ebonlass | B176: 60 | C176: Dark Elf | D176: Tunare | E176: 2470 | F176: 1164 | G176: 3960 | H176: =SUM(E176:G176) -> 7594
A177: Bubus | B177: 60 | C177: Dwarf | D177: Ayonae Ro | E177: 2596 | F177: 1125 | G177: 3980 | H177: =SUM(E177:G177) -> 7701
A178: Xazy | B178: 60 | C178: Dark Elf | D178: Morell-Thule | E178: 2286 | F178: 1194 | G178: 3985 | H178: =SUM(E178:G178) -> 7465
A179: Clenzz | B179: 60 | C179: Dwarf | D179: Tarew Marr | E179: 2756 | F179: 1068 | G179: 3990 | H179: =SUM(E179:G179) -> 7814
A180: Borick | B180: 60 | C180: Dwarf | D180: Rathe | E180: 2290 | F180: 1133 | G180: 4000 | H180: =SUM(E180:G180) -> 7423
A181: Lalu | B181: 60 | C181: High Elf | D181: Rathe | E181: 2105 | F181: 1110 | G181: 4000 | H181: =SUM(E181:G181) -> 7215
A182: Bramyanea | B182: 60 | C182: Dark Elf | D182: Bristlebane | E182: 2513 | F182: 1138 | G182: 4005 | H182: =SUM(E182:G182) -> 7656
A183: Thuel | B183: 60 | C183: Dwarf | D183: Xegony | E183: 2874 | F183: 1241 | G183: 4040 | H183: =SUM(E183:G183) -> 8155
A184: Ryoko | B184: 60 | C184: Human | D184: Vazaelle | E184: 2293 | F184: 1173 | G184: 4050 | H184: =SUM(E184:G184) -> 7516
A185: Sylvia | B185: 60 | C185: Erudite | D185: Druzzil Ro | E185: 2485 | F185: 1054 | G185: 4060 | H185: =SUM(E185:G185) -> 7599
A186: Medik | B186: 60 | C186: Erudite | D186: Xev | E186: 2340 | F186: 1126 | G186: 4070 | H186: =SUM(E186:G186) -> 7536
A187: Mikar | B187: 60 | C187: Dwarf | D187: Tribunal | E187: 2426 | F187: 1144 | G187: 4085 | H187: =SUM(E187:G187) -> 7655
A188: Morinkhan | B188: 60 | C188: Dwarf | D188: Morell-Thule | E188: 2362 | F188: 1105 | G188: 4095 | H188: =SUM(E188:G188) -> 7562
A189: Arturo | B189: 60 | C189: Human | D189: Bristlebane | E189: 2711 | F189: 1089 | G189: 4110 | H189: =SUM(E189:G189) -> 7910
A190: Slaani | B190: 60 | C190: High Elf | D190: Antonius Bayle | E190: 2593 | F190: 1183 | G190: 4120 | H190: =SUM(E190:G190) -> 7896
A191: Ryld | B191: 60 | C191: High Elf | D191: Prexus | E191: 2748 | F191: 1253 | G191: 4155 | H191: =SUM(E191:G191) -> 8156
A192: Dyschord | B192: 60 | C192: Dark Elf | D192: Ayonae Ro | E192: 2269 | F192: 1296 | G192: 4170 | H192: =SUM(E192:G192) -> 7735
A193: Ceridwen | B193: 60 | C193: High Elf | D193: Beroxxulous | E193: 2793 | F193: 1188 | G193: 4185 | H193: =SUM(E193:G193) -> 8166
A194: Cassiana | B194: 60 | C194: Dark Elf | D194: Vazaelle | E194: 2762 | F194: 1141 | G194: 4240 | H194: =SUM(E194:G194) -> 8143
A195: Netorbesnom | B195: 60 | C195: Dwarf | D195: Tribunal | E195: 2429 | F195: 1098 | G195: 4250 | H195: =SUM(E195:G195) -> 7777
A196: Qwenya | B196: 60 | C196: High Elf | D196: Bristlebane | E196: 2856 | F196: 1204 | G196: 4260 | H196: =SUM(E196:G196) -> 8320
A197: Smegal | B197: 60 | C197: Dwarf | D197: Mithaniel Marr | E197: 2998 | F197: 1221 | G197: 4260 | H197: =SUM(E197:G197) -> 8479
A198: Serina | B198: 60 | C198: High Elf | D198: Bertoxxulous | E198: 2877 | F198: 1224 | G198: 4290 | H198: =SUM(E198:G198) -> 8391
A199: Aliudyen | B199: 60 | C199: Human | D199: Cazic-Thule | E199: 2782 | F199: 1233 | G199: 4315 | H199: =SUM(E199:G199) -> 8330
A200: Delheru | B200: 60 | C200: High Elf | D200: Rodcet Nife | E200: 3192 | F200: 1233 | G200: 4380 | H200: =SUM(E200:G200) -> 8805
A201: Amberel | B201: 60 | C201: High Elf | D201: Druzzil Ro | E201: 3018 | F201: 1214 | G201: 4385 | H201: =SUM(E201:G201) -> 8617
A202: Eonwe | B202: 60 | C202: High Elf | D202: Morell-Thule | E202: 2685 | F202: 1300 | G202: 4395 | H202: =SUM(E202:G202) -> 8380