3: Roster Average Level: 58.63Level 60's: 57 Epic Owners: 52 Total Members: 107 = MIA = Missing in Action Updated 12/01/2001 MIA/Retired
A4: Bards: | C4: 59.50
A5: Clerics: | C5: 57.88
A6: Druids: | C6: 59.66
A7: Enchanters: | C7: 59.00
A8: Magicians: | C8: 58.57
A9: Monks: | C9: 58.40
A10: Necromancers: | C10: 57.00
A11: Paladins: | C11: 59.00
A12: Rangers: | C12: 58.66
A13: Rogues: | C13: 58.16
A14: Shadow Knights: | C14: 58.00
A15: Shaman: | C15: 58.62
A16: Warriors: | C16: 59.06
A17: Wizards: | C17: 59.33
19: Bards : 4 | B19: Epics : 3
20: Dazzadi | B20: 60.00
21: Jull | B21: 60.00
22: Renu | B22: 60.00
23: Dano | B23: 59.00
24: Ides | B24: 59.00
B25: =SUM(B116:B122)/7 -> 57.571428571428569
26: Average | B26: =SUM(B116:B122)/7 -> 57.571428571428569
28: Clerics : 18 | B28: Epics : 8
29: Kiroska | B29: 60.00
30: Mercure | B30: 60.00
31: Tarnelliia | B31: 60.00
32: Topaz | B32: 60.00
33: Humingbyrd | B33: 59.00
34: Rebeca | B34: 59.00
35: Runesteel | B35: 59.00
36: Dinocle | B36: 58.00
37: Manse | B37: 58.00
38: Palanka | B38: 58.00
39: Dipnic | B39: 57.00
40: Kaltor | B40: 57.00
41: Laladasa | B41: 57.00
42: Vaelil | B42: 57.00
43: Alisen | B43: 56.00
44: Naelvan MIA | B44: 56.00
45: Yari | B45: 56.00
46: Xuror | B46: 55.00
B48: =SUM(B1:B18)/18 -> 57.555555555555557
49: Average | B49: =SUM(B1:B18)/18 -> 57.555555555555557
51: Druids : 6 | B51: Epics : 4
52: Eravin | B52: 60.00
53: Gargos | B53: 60.00
54: Lainian | B54: 60.00
55: Sakkin | B55: 60.00
56: Zerendipity | B56: 60.00
57: Aeleb | B57: 59.00
B58: =SUM(B22:B24)/3 -> 59.333333333333336
59: Average | B59: =SUM(B22:B24)/3 -> 59.333333333333336
61: Enchanters : 6 | B61: Epics : 4
62: Chameleos | B62: 60.00
63: Concon | B63: 60.00
64: Dido | B64: 60.00
65: Jeanyes | B65: 60.00
66: Vicepieuse | B66: 60.00
67: Adelica | B67: 54.00
B68: =SUM(B27:B31)/5 -> 
69: Average | B69: =SUM(B27:B31)/5 -> 59.00
71: Magicians : 7 | B71: Epics : 2
72: Gores | B72: 60.00
73: Khaly | B73: 60.00
74: Xyvox | B74: 60.00
75: Gokououououo | B75: 59.00
76: Skids | B76: 59.00
77: Peerebu MIA | B77: 58.00
78: Malachyte MIA | B78: 56.00
B79: =SUM(B34:B38)/5 -> 
80: Average | B80: =SUM(B34:B38)/5 -> 58.57
82: Monks : 5 | B82: Epics : 4
83: Jonnyman | B83: 60.00
84: Velamon | B84: 60.00
85: Xstar | B85: 60.00
86: Kragmere | B86: 58.00
87: Tarval | B87: 54.00
B88: =SUM(B41:B48)/8 -> 58.125
89: Average | B89: =SUM(B41:B48)/8 -> 58.125
91: Necromancers : 5 | B91: Epics : 1
92: Darkform | B92: 60.00
93: Minkey | B93: 58.00
94: Danvi | B94: 57.00
95: Wilfy | B95: 56.00
96: Tpae | B96: 54.00
B97: =SUM(B51:B55)/5 -> 
98: Average | B98: =SUM(B51:B55)/5 -> 57.00
100: Paladins : 7 | B100: Epics : 2
101: Arthurr | B101: 60.00
102: Bruneor | B102: 60.00
103: Heii | B103: 60.00
104: Sentinal | B104: 60.00
105: Archileus | B105: 59.00
106: Chartler | B106: 58.00
107: Mattor | B107: 57.00
B108: =SUM(B58:B65)/8 -> 
109: Average | B109: =SUM(B58:B65)/8 -> 59.00
111: Rangers : 6 | B111: Epics : 6
112: Minlaian | B112: 60.00
113: Shalla | B113: 60.00
114: Vannx | B114: 60.00
115: Iadan | B115: 59.00
116: Kyren | B116: 58.00
117: Melly | B117: 56.00
B118: =SUM(B68:B71)/4 -> 
119: Average | B119: =SUM(B68:B71)/4 -> 58.66
121: Rogues : 6 | B121: Epics : 6
122: Aerah | B122: 60.00
123: Dembrance | B123: 60.00
124: Drachyn | B124: 60.00
125: Caramen | B125: 59.00
126: Jahni | B126: 55.00
127: Kaman | B127: 55.00
B128: =SUM(B74:B78)/5 -> 
129: Average | B129: =SUM(B74:B78)/5 -> 58.16
131: Shadowknights : 5 | B131: Epics : 2
132: Leyrin | B132: 60.00
133: Rowbert | B133: 58.00
134: Slayanya | B134: 58.00
135: Xivilr | B135: 58.00
136: Laemeth | B136: 57.00
B137: =SUM(B81:B84)/4 -> 
138: Average | B138: =SUM(B81:B84)/4 -> 58.00
140: Shamans : 8 | B140: Epics : 6
141: Kaloog | B141: 60.00
142: Hoomiee | B142: 60.00
143: Quiggles | B143: 60.00
144: Tinwe | B144: 60.00
145: Tyrantraxus | B145: 60.00
146: Galadina | B146: 58.00
147: Lethen | B147: 57.00
148: Shameh | B148: 54.00
B149: =SUM(B87:B92)/6 -> 57.666666666666664
150: Average | B150: =SUM(B87:B92)/6 -> 57.666666666666664
152: Warriors : 15 | B152: Epics : 2
153: Cearron | B153: 60.00
154: Ceny | B154: 60.00
155: Dinko | B155: 60.00
156: Dualdor | B156: 60.00
157: Emilia | B157: 60.00
158: Goldax | B158: 60.00
159: Kruelty | B159: 60.00
160: Ludorf | B160: 60.00
161: Minsx | B161: 60.00
162: Robis | B162: 60.00
163: Vonsid | B163: 60.00
164: Aronold | B164: 59.00
165: Bahawar | B165: 58.00
166: Yundalar | B166: 55.00
167: Thor | B167: 54.00
B168: =SUM(B95:B104)/10 -> 
169: Average | B169: =SUM(B95:B104)/10 -> 59.06
171: Wizards : 9 | B171: Epics : 5
172: Aennyil | B172: 60.00
173: Alxkorvin | B173: 60.00
174: Belarkan | B174: 60.00
175: Hester | B175: 60.00
176: Skein | B176: 60.00
177: Xlint | B177: 60.00
178: Loxen | B178: 59.00
179: Aeeliel | B179: 58.00
180: Jonjay | B180: 58.00
B181: =SUM(B107:B113)/7 -> 
182: Average | B182: =SUM(B107:B113)/7 -> 59.33