A1: Last Name | B1: First Name | C1: Alias | D1: Class | E1: SASS # | F1: Street | G1: City | H1: State | I1: Zip | J1: Phone | K1: E-Mail | L1: Stage 1 | M1: Stage 2 | N1: Stage 3 | O1: Stage 4 | P1: Stage 5 | Q1: Stage 6 | R1: Stage 7 | S1: Total | T1: Stage 6 | U1: Stage 7 | V1: Stage 8 | W1: Stage 9 | X1: Stage 10 | Y1: Day 2 | Z1: Total | AA1: Side 1 | AB1: Side 2 | AC1: Side 3 | AD1: Side 4 | AE1: Event 1 | AF1: Event 2 | AG1: Event 3 | AH1: Event 4 | AI1: Possee #
C2: Remy McSwain | D2: D | L2: 107.49 | M2: 101.15 | N2: 123.88 | O2: 126.52 | P2: 99.91 | Q2: 31.48 | S2: =SUM(L2:Q2) -> 590.43 | AI2: 1
C3: Will Shortly | D3: D | L3: 70.15 | M3: 50.26 | N3: 111.53 | O3: 91.23 | P3: 95.99 | Q3: 38.79 | S3: =SUM(L3:P3) -> 419.16 | AI3: 1
A4: Sieck | B4: Bob | C4: Crowfoot | D4: D | L4: 89.74 | M4: 102.26 | N4: 107.34 | O4: 100.42 | P4: 120.23 | Q4: 74.23 | R4: -10 | S4: =SUM(L4:R4) -> 584.22 | AI4: 2
A5: Counts | B5: Bob | C5: Old Man Sykes | D5: D | L5: 69.45 | M5: 69.83 | N5: 87.77 | O5: 73.52 | P5: 64.51 | Q5: 33.05 | R5: -10 | S5: =SUM(L5:R5) -> 388.13 | AI5: 2
C6: Bullshooter Bob | D6: D | E6: 26212 | F6: 1328 Premio Dr | G6: Fenton | H6: MO | I6: 63026 | J6: 636-225-4741 | K6: gadgets2@juno.com | L6: 63.71 | M6: 98.31 | N6: 90.24 | O6: 84.01 | P6: 82.83 | Q6: 30.48 | R6: -10 | S6: =SUM(L6:R6) -> 439.58 | Y6: =SUM(T6:X6) -> 0 | Z6: =SUM(S6+Y6) -> 439.58 | AI6: 3
A7: Stiles | B7: John | C7: Clayton Moore | D7: D | L7: 51.01 | M7: 69.68 | N7: 84.67 | O7: 81.39 | P7: 98.21 | Q7: 42.31 | R7: -10 | S7: =SUM(L7:R7) -> 417.27 | AI7: 3
A8: Dewhirst | B8: Edward | C8: Doc Hurd | D8: D | L8: 65.31 | M8: 77.91 | N8: 73.23 | O8: 64.66 | P8: 64.67 | Q8: 35.9 | R8: -10 | S8: =SUM(L8:R8) -> 371.68 | AI8: 3
C9: Johnny Rio | D9: D | L9: 81.21 | M9: 64.93 | N9: 103.72 | O9: 96.93 | P9: 96.89 | Q9: 51.86 | R9: -10 | S9: =SUM(L9:R9) -> 485.54 | AI9: 3
A10: Bolle | B10: Brian | C10: Dupo Kid | D10: D | L10: 61.04 | M10: 78.49 | N10: 90.7 | O10: 101.68 | P10: 84.14 | Q10: 39.45 | S10: =SUM(L10:Q10) -> 455.5 | AI10: 4
A11: Anderws | B11: Robert E | C11: J. D. Hardrider | D11: D | E11: 32555 | F11: 5 Camp Hollow Ct | G11: Wildwood | H11: MO | I11: 63038 | J11: 636-458-6647 | K11: jmdillmon@aol.com | L11: 65.66 | M11: 63.08 | N11: 100.58 | O11: 91.67 | P11: 93.03 | Q11: 47.78 | S11: =SUM(L11:P11) -> 414.02 | Y11: =SUM(T11:X11) -> 0 | Z11: =SUM(S11+Y11) -> 414.02 | AI11: 4
C12: Cole Black Heart | D12: D | L12: 56.21 | M12: 50.4 | N12: 80.76 | O12: 70.12 | P12: 77.86 | Q12: 23.19 | S12: =SUM(L12:Q12) -> 358.54 | AI12: 5
A13: Hall | B13: William | C13: Missouri Bull | D13: D | L13: 64.13 | M13: 74.47 | N13: 95.06 | O13: 95.33 | P13: 100.11 | Q13: 37 | S13: =SUM(L13:R13) -> 466.1 | AI13: 5
C14: Nathan Ward | D14: D | E14: xxx | F14: 3260 Burning Tree Ln | G14: Festus | H14: MO | I14: 63028 | J14: 636-937-2025 | K14: bbolle@ucn.net | L14: 66.69 | M14: 101.89 | N14: 132.71 | O14: 76.01 | P14: 107.48 | Q14: 42.69 | S14: =SUM(L14:Q14) -> 527.47 | Y14: =SUM(T14:X14) -> 0 | Z14: =SUM(S14+Y14) -> 527.47 | AI14: 5
C15: Hopalung Bill | D15: D/T | L15: 85.36 | M15: 76.37 | N15: 95.45 | O15: 75.98 | P15: 75.98 | Q15: 91.47 | S15: =SUM(L15:R15) -> 500.61 | AI15: 1
C16: Ranger Marlin Ruger | D16: M | F16: 127 Starling Community | G16: Arnold | H16: MO | I16: 63010 | L16: 64.02 | M16: 61.19 | N16: 78.88 | O16: 75.15 | P16: 78.89 | Q16: 39.32 | R16: -10 | S16: =SUM(L16:R16) -> 387.45 | Y16: =SUM(T16:X16) -> 0 | Z16: =SUM(S16+Y16) -> 387.45 | AI16: 3
C17: Dirty "D" | D17: M | L17: 117.51 | M17: 104.83 | N17: 131 | O17: 109.4 | P17: 117.39 | Q17: 49.96 | S17: =SUM(L17:Q17) -> 630.09 | AI17: 4
C18: Jack Blackhawk | D18: M | F18: 1526 Cheryl Acres | G18: Arnold | H18: MO | I18: 63010 | L18: 85.5 | M18: 99.5 | N18: 105.49 | O18: 85.83 | P18: 100.31 | Q18: 48.69 | S18: =SUM(L18:Q18) -> 525.32 | Y18: =SUM(T18:X18) -> 0 | Z18: =SUM(S18+Y18) -> 525.32 | AI18: 5
C19: One Foot Wed | D19: M/J/W | L19: 91.48 | M19: 121.52 | N19: 190.95 | O19: 130.7 | P19: 127.84 | Q19: 45.5 | S19: =SUM(L19:Q19) -> 707.99 | AI19: 4
A20: Sextro | B20: John | C20: Uncle Leonard | D20: M/Senior | L20: 131.08 | M20: 140.68 | N20: 180.02 | O20: 135.16 | P20: 191.48 | Q20: 53.02 | S20: =SUM(L20:P20) -> 778.42 | AI20: 4
C21: Squire Lawrence | D21: M/Senior | E21: 28622 | F21: 3242 S. Illinois St. | G21: Belleville | H21: IL | I21: 62220-5110 | J21: 618-233-3592 | K21: rippjr@peaknet.net | L21: 63.72 | M21: 64.47 | N21: 90.53 | O21: 83.19 | P21: 80.51 | Q21: 29.08 | S21: =SUM(L21:Q21) -> 411.5 | Y21: =SUM(T21:X21) -> 0 | Z21: =SUM(S21+Y21) -> 411.5 | AI21: 5
C22: Colt Rampant | D22: T | E22: 13753 | F22: 611 Winding Creek Dr | G22: Wentzville | H22: MO | I22: 63385 | J22: 636-639-6968 | K22: poppydom@aol.com | L22: 52.9 | M22: 61.35 | N22: 97.92 | O22: 71.31 | P22: 79.93 | Q22: 25.05 | S22: =SUM(L22:Q22) -> 388.46 | Y22: =SUM(T22:X22) -> 0 | Z22: =SUM(S22+Y22) -> 388.46 | AI22: 1
C23: Deadly "D" | D23: T | E23: xxx | F23: 156 Big Four Pl | G23: Mitchell | H23: IL | I23: 62040 | J23: 618-773-1340 | L23: 77.87 | M23: 105.76 | N23: 128.06 | O23: 60.14 | P23: 93.34 | Q23: 25.19 | S23: =SUM(L23:Q23) -> 490.36 | Y23: =SUM(T23:X23) -> 0 | Z23: =SUM(S23+Y23) -> 490.36 | AI23: 1
C24: Johnny One Horse | D24: T | F24: 515 Fox Pointe Dr | G24: St. Charles | H24: MO | I24: 63304 | L24: 90.25 | M24: 85.95 | N24: 104.58 | O24: 96.78 | P24: 112.4 | Q24: 34.77 | S24: =SUM(L24:Q24) -> 524.73 | Y24: =SUM(T24:X24) -> 0 | Z24: =SUM(S24+Y24) -> 524.73 | AI24: 1
C25: Lefty | D25: T | L25: 71.98 | M25: 74.96 | N25: 127.71 | O25: 73.46 | P25: 95.19 | Q25: 21.41 | S25: =SUM(L25:P25) -> 443.3 | AI25: 1
A26: Ripplinger | B26: Lawrence | C26: Red Oak Ranger | D26: T | L26: 81.13 | M26: 86.04 | N26: 132.68 | O26: 85.59 | P26: 89.87 | Q26: 38.52 | S26: =SUM(L26:Q26) -> 513.83 | AI26: 1
A27: Myers | B27: Bill | C27: Yuma Tom | D27: T | E27: 33602 | F27: 1953 Catin Dr | G27: Barnhart | H27: MO | I27: 63012 | J27: 636-464-7012 | L27: 51.04 | M27: 73.87 | N27: 76.89 | O27: 62.76 | P27: 67.46 | Q27: 17.34 | S27: =SUM(L27:Q27) -> 349.36 | Y27: =SUM(T27:X27) -> 0 | Z27: =SUM(S27+Y27) -> 349.36 | AI27: 1
A28: Rivas | B28: Barclay | C28: Marshal Zeke | D28: T | L28: 69.61 | M28: 86.44 | N28: 100.99 | O28: 118.97 | P28: 85.68 | Q28: 30.4 | R28: -10 | S28: =SUM(L28:R28) -> 482.09 | AI28: 2
A29: Pisciotta | B29: Dom | C29: Pard N. Me | D29: T | F29: 3540 Rock Creek Garden Rd | G29: Imperial | H29: MO | I29: 63052 | K29: magill@swbell.net | L29: 76.13 | M29: 77.98 | N29: 79.64 | O29: 72 | P29: 75.94 | Q29: 27.81 | R29: -10 | S29: =SUM(L29:R29) -> 399.5 | Y29: =SUM(T29:X29) -> 0 | Z29: =SUM(S29+Y29) -> 399.5 | AI29: 2
A30: Peters | B30: Dwayne | C30: Snaggeltooth | D30: T | L30: 81.74 | M30: 105.13 | N30: 123.15 | O30: 101.86 | P30: 86.89 | Q30: 49.21 | R30: -10 | S30: =SUM(L30:R30) -> 537.98 | AI30: 2
C31: T Bone McNasty | D31: T | L31: 83.33 | M31: 113.33 | N31: 92.78 | O31: 118.02 | P31: 103.95 | Q31: 41.6 | R31: -10 | S31: =SUM(L31:P31) -> 511.41 | AI31: 2
C32: Alamo Kid | D32: T | L32: 57.65 | M32: 59.51 | N32: 91.96 | O32: 78.06 | P32: 70.11 | Q32: 35.62 | R32: -10 | S32: =SUM(L32:R32) -> 382.91 | AI32: 3
C33: Chuckwagon Willy | D33: T | L33: 66.45 | M33: 80.96 | N33: 91.7 | O33: 93.82 | P33: 77.86 | Q33: 32.32 | R33: -10 | S33: =SUM(L33:P33) -> 410.79 | AI33: 3
C34: Dirty Mo Steve | D34: T | L34: 43.03 | M34: 52.51 | N34: 56.88 | O34: 46.25 | P34: 59.04 | Q34: 28.31 | R34: -10 | S34: =SUM(L34:R34) -> 276.02 | AI34: 3
C35: Lucky Morgan | D35: T | L35: 70.74 | M35: 62.43 | N35: 96.19 | O35: 74.93 | P35: 77.54 | Q35: 37.37 | R35: -10 | S35: =SUM(L35:R35) -> 409.2 | AI35: 3
A36: Dillmon | B36: John | C36: Trapped | D36: T | L36: 55.04 | M36: 73.88 | N36: 87.07 | O36: 65.14 | P36: 86.6 | Q36: 36.29 | R36: -10 | S36: =SUM(L36:R36) -> 394.02 | AI36: 3
C37: Missouri Buck | D37: T | E37: ? | F37: 7252 Klondike Rd | G37: Hillsboro | H37: MO | I37: 63050 | J37: 636-274-2057 | L37: 75.63 | M37: 70.83 | N37: 92.77 | O37: 76.41 | P37: 84.83 | Q37: 23.44 | R37: -10 | S37: =SUM(L37:R37) -> 413.91 | Y37: =SUM(T37:X37) -> 0 | Z37: =SUM(S37+Y37) -> 413.91 | AI37: 3
A38: McDonnel | B38: James | C38: B.T. Smithereens | D38: T | L38: 73.99 | M38: 76.01 | N38: 107.79 | O38: 105.08 | P38: 124.62 | Q38: 40.1 | S38: =SUM(L38:Q38) -> 527.59 | AI38: 4
C39: Dusty Waters | D39: T | L39: 68.9 | M39: 79.14 | N39: 115.79 | O39: 112.76 | P39: 96.44 | Q39: 42.16 | S39: =SUM(L39:Q39) -> 515.19 | AI39: 4
A40: Vance | B40: Terry | C40: Dusty Rivers | D40: T | L40: 110.33 | M40: 109.05 | N40: 118.89 | O40: 98.11 | P40: 120.19 | Q40: 63.42 | S40: =SUM(L40:P40) -> 556.57 | AI40: 5
C41: Jimmy John Daniels | D41: T | E41: 38829 | F41: 6920 Greenholly Dr | G41: St. Louis | H41: MO | I41: 63123 | J41: 314-752-9269 | K41: jpmcdonnell@swbell.net | L41: 91.05 | M41: 92.29 | N41: 115.59 | O41: 95.79 | P41: 126.23 | Q41: 54.23 | S41: =SUM(L41:Q41) -> 575.18 | Y41: =SUM(T41:X41) -> 0 | Z41: =SUM(S41+Y41) -> 575.18 | AI41: 5
C42: Rancher | D42: T | L42: 83.01 | M42: 86.01 | N42: 119.78 | O42: 92.82 | P42: 119.66 | Q42: 36.26 | S42: =SUM(L42:Q42) -> 537.54 | AI42: 5
A43: Serra | B43: John | C43: Kentucky Buck | D43: T | L43: 99.42 | M43: 74.72 | N43: 137.93 | O43: 96.46 | P43: 92.29 | Q43: 32.59 | S43: =SUM(L43:Q43) -> 533.41 | AI43: 5
A44: Wilson | B44: Gary | C44: Elmo | D44: T/J/W | L44: 91.18 | M44: 99.16 | N44: 123.79 | O44: 113.43 | P44: 119.67 | Q44: 44.57 | S44: =SUM(L44:Q44) -> 591.8 | AI44: 4
C45: Calhoun | D45: T/Senior | E45: 7242 | F45: 3159 Arrowrock Dr. | G45: St. Charles | H45: MO | I45: 63303-6503 | K45: calhoon314@alo.com | L45: 134.84 | M45: 132.86 | N45: 178.75 | O45: 129.21 | P45: 175.39 | Q45: 42.74 | S45: =SUM(L45:Q45) -> 793.79 | Y45: =SUM(T45:X45) -> 0 | Z45: =SUM(S45+Y45) -> 793.79 | AI45: 1
C46: Stumpe | D46: T/Senior | L46: 87.94 | M46: 108.82 | N46: 128.85 | O46: 59.22 | P46: 144.31 | Q46: 24.17 | S46: =SUM(L46:P46) -> 529.14 | AI46: 1
C47: Ponchatoula | D47: T/Senior | L47: 76.99 | M47: 98.67 | N47: 115.32 | O47: 90.24 | P47: 85.55 | Q47: 42.72 | R47: -10 | S47: =SUM(L47:R47) -> 499.49 | AI47: 2
C48: Doc | D48: T/Senior | L48: 106.55 | M48: 84.75 | N48: 119.39 | O48: 115.14 | P48: 132.92 | Q48: 28.17 | R48: -10 | S48: =SUM(L48:R48) -> 576.92 | AI48: 3
A49: Huffman | B49: Charles | C49: Red Ryder Tom | D49: T/Senior | L49: 88.51 | M49: 94.89 | N49: 119.01 | O49: 76.66 | P49: 97.4 | Q49: 40.94 | S49: =SUM(L49:Q49) -> 517.41 | AI49: 4
C50: Yuma Rose | D50: T/W | L50: 153.01 | M50: 113.25 | N50: 178.29 | O50: 126.68 | P50: 140.09 | Q50: 51.24 | S50: =SUM(L50:P50) -> 711.32 | AI50: 1
C51: Miss Savella | D51: T/W | L51: 112.54 | M51: 164.74 | N51: 137.28 | O51: 136.08 | P51: 147.93 | Q51: 52.54 | R51: -10 | S51: =SUM(L51:R51) -> 741.11 | AI51: 2
C52: Crazy Mary | D52: T/W | L52: 67.45 | M52: 78.1 | N52: 84.94 | O52: 100.46 | P52: 77.31 | Q52: 85.51 | S52: =SUM(L52:Q52) -> 493.77 | AI52: 4