A1: Active Roster
B2: Levels | C2: Title | D2: Race | E2: Epic | F2: VP Key | G2: ST Key | H2: PoV/PoS | I2: BoT | J2: PoI B | K2: CoD | L2: PoN B | M2: HoH A | N2: Status
A3: Bard
A4: Arsis | B4: 61 | C4: Baron | D4: Wood Elf | E4: YES | H4: 1 | M4: 1 | N4: Member | O4: 1
A5: =HYPERLINK("http://www.magelo.com/eq_view_profile.html?num=194601","Cranth") -> Cranth | B5: 65 | C5: Veteran | D5: Wood Elf | E5: YES | F5: 1 | G5: 1 | H5: 1 | I5: 1 | J5: 1 | K5: 1 | L5: 1 | M5: 1 | N5: Member | O5: 1
A6: =HYPERLINK("http://www.magelo.com/eq_view_profile.html?num=602833","Gymi") -> Gymi | B6: 59 | D6: Wood Elf | E6: NO | N6: Member | O6: 1
A7: =HYPERLINK("http://www.magelo.com/eq_view_profile.html?num=344746","Rosha") -> Rosha | B7: 65 | D7: Wood Elf | E7: YES | F7: 1 | H7: 1 | N7: Officer | O7: 1
A8: =HYPERLINK("http://www.magelo.com/eq_view_profile.html?num=182277","Yorke") -> Yorke | B8: 62 | C8: Veteran | D8: God | E8: YES | F8: 1 | G8: 1 | H8: 1 | I8: 1 | N8: Officer | O8: 1
A9: Beastlord
A10: Nermel | B10: 61 | D10: Vah Shir | E10: YES | N10: Member | O10: 1
A11: =HYPERLINK("http://www.magelo.com/eq_view_profile.html?num=595579","Sarisha") -> Sarisha | B11: 36 | D11: Vah Shir | E11: NO | N11: Member | O11: 1
A12: Clerics
A13: Aader | B13: 61 | D13: Dwarf | E13: NO | N13: Member | O13: 1
A14: Bohric | B14: 66 | C14: Baron | D14: Dwarf | E14: NO | F14: 1 | G14: 1 | H14: 1 | I14: 1 | J14: 1 | K14: 1 | L14: 1 | M14: 1 | N14: Member | O14: 1
A15: =HYPERLINK("http://www.magelo.com/eq_view_profile.html?num=342919","Dinanin") -> Dinanin | B15: 65 | C15: Venerable | D15: Dwarf | E15: YES | F15: 1 | G15: 1 | H15: 1 | I15: 1 | J15: 1 | K15: 1 | L15: 1 | M15: 1 | N15: Member | O15: 1
A16: =HYPERLINK("http://www.magelo.com/eq_view_profile.html?num=59684","Dystopya") -> Dystopya | B16: 65 | C16: Venerable | D16: Human | E16: YES | F16: 1 | G16: 1 | H16: 1 | I16: 1 | J16: 1 | K16: 1 | L16: 1 | M16: 1 | N16: Member | O16: 1
A17: =HYPERLINK("http://www.magelo.com/eq_view_profile.html?num=84050","Gerweena") -> Gerweena | B17: 65 | C17: Venerable | D17: Halfling | E17: YES | G17: 1 | H17: 1 | I17: 1 | M17: 1 | N17: Member | O17: 1
A18: Iendaar | B18: 62 | D18: High Elf | E18: NO | N18: Member | O18: 1
A19: =HYPERLINK("http://www.magelo.com/eq_view_profile.html?num=151159","Mediloks") -> Mediloks | B19: 64 | D19: High Elf | E19: YES | G19: 1 | H19: 1 | I19: 1 | L19: 1 | M19: 1 | N19: Member | O19: 1
A20: =HYPERLINK("http://www.magelo.com/eq_view_profile.html?num=71953","Philander") -> Philander | B20: 63 | C20: Venerable | D20: Dwarf | E20: YES | F20: 1 | G20: 1 | H20: 1 | I20: 1 | L20: 1 | M20: 1 | N20: Officer | O20: 1
A21: Samine | B21: 65 | C21: Venerable | D21: High Elf | E21: NO | F21: 1 | G21: 1 | H21: 1 | I21: 1 | J21: 1 | K21: 1 | M21: 1 | N21: Member | O21: 1
A22: Sarigus | B22: 60 | C22: Venerable | D22: Halfling | E22: YES | F22: 1 | N22: Member | O22: 1
A23: =HYPERLINK("http://www.magelo.com/eq_view_profile.html?num=62008","Xorolorn") -> Xorolorn | B23: 65 | C23: Baron | D23: High Elf | E23: YES | F23: 1 | G23: 1 | H23: 1 | I23: 1 | J23: 1 | L23: 1 | M23: 1 | N23: Member | O23: 1
A24: =HYPERLINK("http://www.magelo.com/eq_view_profile.html?num=141442","Adella (alt)") -> Adella (alt) | B24: 64 | D24: Dwarf | E24: YES | F24: X | H24: X | I24: X | M24: X | N24: Member
A25: =HYPERLINK("http://www.magelo.com/eq_view_profile.html?num=345649","Andromache (alt)") -> Andromache (alt) | B25: 59 | D25: Dark Elf | E25: YES | H25: X | M25: X | N25: Member
A26: Fryar (alt) | B26: 64 | D26: Dwarf | E26: YES | H26: X | I26: X | K26: X | M26: X | N26: Member
A27: Pria (alt) | B27: 62 | C27: Baroness | D27: High Elf | E27: YES | H27: X | I27: X | L27: X | M27: X | N27: Member
A28: Restora (alt) | B28: 65 | D28: High Elf | E28: YES | L28: X | M28: X | N28: Member
A29: =HYPERLINK("http://www.magelo.com/eq_view_profile.html?num=495320","Vyera (alt)") -> Vyera (alt) | B29: 60 | E29: NO | N29: Member
A30: =HYPERLINK("http://www.magelo.com/eq_view_profile.html?num=24215","Weckie (alt)") -> Weckie (alt) | B30: 65 | C30: Venerable | D30: Dark Elf | E30: YES | F30: X | H30: X | I30: X | K30: X | L30: X | M30: X | N30: Member
A31: Druid
A32: =HYPERLINK("http://www.magelo.com/eq_view_profile.html?num=28957","Echineasia") -> Echineasia | B32: 65 | C32: Venerable | D32: Wood Elf | E32: YES | F32: 1 | G32: 1 | H32: 1 | I32: 1 | J32: 1 | K32: 1 | L32: 1 | M32: 1 | N32: Member | O32: 1
A33: =HYPERLINK("http://www.magelo.com/eq_view_profile.html?num=107624","Edylc") -> Edylc | B33: 65 | D33: Wood Elf | E33: YES | F33: 1 | G33: 1 | H33: 1 | I33: 1 | K33: 1 | L33: 1 | M33: 1 | N33: Member | O33: 1
A34: =HYPERLINK("http://www.magelo.com/eq_view_profile.html?num=186512","Gweeto") -> Gweeto | B34: 65 | D34: Halfling | E34: YES | F34: 1 | G34: 1 | H34: 1 | I34: 1 | J34: 1 | K34: 1 | L34: 1 | M34: 1 | N34: Member | O34: 1
A35: Skysz | N35: Member | O35: 1
A36: =HYPERLINK("http://www.magelo.com/eq_view_profile.html?num=12316","Thunderheart") -> Thunderheart | B36: 65 | C36: Venerable | D36: Wood Elf | E36: YES | F36: 1 | H36: 1 | I36: 1 | K36: 1 | L36: 1 | M36: 1 | N36: Member | O36: 1
A37: =HYPERLINK("http://www.magelo.com/eq_view_profile.html?num=11509","Wickie") -> Wickie | B37: 65 | C37: Venerable | D37: Wood Elf | E37: YES | F37: 1 | G37: 1 | H37: 1 | I37: 1 | J37: 1 | K37: 1 | L37: 1 | M37: 1 | N37: Member | O37: 1
A38: =HYPERLINK("http://www.magelo.com/eq_view_profile.html?num=343679","Fellan (alt)") -> Fellan (alt) | B38: 61 | D38: Halfling | E38: NO | J38: X | N38: Member
A39: =HYPERLINK("http://www.magelo.com/eq_view_profile.html?num=226868","Padain (alt)") -> Padain (alt) | B39: 65 | C39: Venerable | D39: Wood Elf | E39: YES | F39: X | G39: X | H39: X | I39: X | J39: X | K39: X | M39: X | N39: Member
A40: Enchanter
A41: =HYPERLINK("http://www.magelo.com/eq_view_profile.html?num=120701","Azlaan") -> Azlaan | B41: 64 | C41: Master | D41: Erudite | E41: YES | F41: 1 | H41: 1 | I41: 1 | L41: 1 | M41: 1 | N41: Member | O41: 1
A42: Canny | B42: 65 | E42: NO | H42: 1 | I42: 1 | N42: Member | O42: 1
A43: =HYPERLINK("http://www.magelo.com/eq_view_profile.html?num=345631","Cwell") -> Cwell | B43: 65 | C43: Master | D43: Erudite | E43: YES | F43: 1 | G43: 1 | H43: 1 | I43: 1 | L43: 1 | M43: 1 | N43: Member | O43: 1
A44: Jaquinetta | B44: 65 | E44: NO | N44: Member | O44: 1
A45: Koba | N45: Member | O45: 1
A46: =HYPERLINK("http://www.magelo.com/eq_view_profile.html?num=343464","Sethrah") -> Sethrah | B46: 65 | C46: Mistress | D46: Dark Elf | E46: YES | F46: 1 | G46: 1 | H46: 1 | I46: 1 | K46: 1 | M46: 1 | N46: Member | O46: 1
A47: Sakuma | B47: 64 | D47: High Elf | E47: NO | F47: 1 | H47: 1 | L47: 1 | N47: Member | O47: 1
A48: Amantus (alt) | B48: 62 | D48: High Elf | E48: NO | H48: X | M48: X | N48: Member
A49: =HYPERLINK("http://www.magelo.com/eq_view_profile.html?num=64112","Roonie (alt)") -> Roonie (alt) | B49: 62 | C49: Mistress | D49: Dark Elf | E49: YES | F49: X | H49: X | J49: X | L49: X | M49: X | N49: Member
A50: Mages
A51: =HYPERLINK("http://www.magelo.com/eq_view_profile.html?num=466839","Almorzar") -> Almorzar | B51: 65 | C51: Master | D51: Erudite | E51: NO | F51: 1 | G51: 1 | H51: 1 | I51: 1 | K51: 1 | L51: 1 | M51: 1 | N51: Member | O51: 1
A52: =HYPERLINK("http://www.magelo.com/eq_view_profile.html?num=191052","Canda") -> Canda | B52: 64 | C52: Baron | D52: High Elf | E52: YES | F52: 1 | G52: 1 | H52: 1 | I52: 1 | L52: 1 | M52: 1 | N52: Member | O52: 1
A53: =HYPERLINK("http://www.magelo.com/eq_view_profile.html?num=345293","Elingia") -> Elingia | B53: 59 | D53: High Elf | E53: NO | N53: Member | O53: 1
A54: Gaidar | B54: 63 | D54: Human | E54: NO | H54: 1 | I54: 1 | J54: 1 | K54: 1 | M54: 1 | N54: Member | O54: 1
A55: Mandrayke (alt) | B55: 63 | E55: NO | N55: Member
A56: Monks
A57: Chubbies | B57: 65 | C57: Sensei | D57: Iksar | E57: YES | F57: 1 | G57: 1 | H57: 1 | I57: 1 | K57: 1 | L57: 1 | M57: 1 | N57: Member | O57: 1
A58: Dlainy | B58: 65 | D58: Human | E58: YES | N58: Member | O58: 1
A59: Stormin | B59: 65 | C59: Baron | D59: Human | E59: YES | F59: 1 | G59: 1 | H59: 1 | L59: 1 | M59: 1 | N59: Member | O59: 1
A60: =HYPERLINK("http://www.magelo.com/eq_view_profile.html?num=54695","Talinsyn") -> Talinsyn | B60: 65 | C60: Sensei | D60: Human | E60: YES | F60: 1 | G60: 1 | H60: 1 | I60: 1 | J60: 1 | K60: 1 | L60: 1 | M60: 1 | N60: Member | O60: 1
A61: =HYPERLINK("http://www.magelo.com/eq_view_profile.html?num=64095","Voir") -> Voir | B61: 64 | C61: Brother | D61: Iksar | E61: YES | F61: 1 | G61: 1 | H61: 1 | I61: 1 | J61: 1 | L61: 1 | M61: 1 | N61: Member | O61: 1
A62: Necromancer
A63: Evilgrim | B63: 63 | C63: Baron | D63: Gnome | E63: NO | H63: 1 | I63: 1 | K63: 1 | L63: 1 | N63: Member | O63: 1
A64: Intention | B64: 63 | D64: Dark Elf | E64: NO | N64: Member | O64: 1
A65: =HYPERLINK("http://www.magelo.com/eq_view_profile.html?num=352099","Lokaris") -> Lokaris | B65: 65 | C65: Lich | D65: Dark Elf | E65: YES | F65: 1 | G65: 1 | H65: 1 | K65: 1 | L65: 1 | M65: 1 | N65: Officer | O65: 1
A66: Scraps | B66: 65 | C66: Lich | D66: Gnome | E66: NO | G66: 1 | H66: 1 | I66: 1 | J66: 1 | K66: 1 | L66: 1 | M66: 1 | N66: Member | O66: 1
A67: Paladins
A68: =HYPERLINK("http://www.magelo.com/eq_view_profile.html?num=98063","Badin") -> Badin | B68: 65 | C68: Duke | D68: Dwarf | E68: YES | F68: 1 | G68: 1 | H68: 1 | I68: 1 | J68: 1 | K68: 1 | L68: 1 | M68: 1 | N68: Guild Leader | O68: 1
A69: =HYPERLINK("http://www.magelo.com/eq_view_profile.html?num=168250","Brokkson") -> Brokkson | B69: 65 | C69: Duke | D69: Dwarf | E69: NO | F69: 1 | G69: 1 | H69: 1 | I69: 1 | J69: 1 | K69: 1 | L69: 1 | M69: 1 | N69: Member | O69: 1
A70: =HYPERLINK("http://www.magelo.com/eq_view_profile.html?num=350082","Infirit") -> Infirit | B70: 62 | D70: Half Elf | E70: YES | G70: 1 | H70: 1 | K70: 1 | L70: 1 | M70: 1 | N70: Member | O70: 1
A71: Kwaidd | B71: 62 | D71: Dwarf | E71: NO | G71: 1 | H71: 1 | K71: 1 | L71: 1 | M71: 1 | N71: Member | O71: 1
A72: =HYPERLINK("http://www.magelo.com/eq_view_profile.html?num=173114","Qetuo") -> Qetuo | B72: 51 | D72: Half Elf | E72: NO | N72: Member | O72: 1
A73: =HYPERLINK("http://www.magelo.com/eq_view_profile.html?num=301696","Shadrakk") -> Shadrakk | B73: 61 | D73: Human | E73: NO | H73: 1 | M73: 1 | N73: Member | O73: 1
A74: Ranger
A75: Andriul | B75: 60 | D75: Wood Elf | E75: YES | N75: Member | O75: 1
A76: Birdsong | B76: 60 | D76: Wood Elf | E76: NO | N76: Member | O76: 1
A77: Canis | B77: 62 | D77: Wood Elf | E77: YES | F77: 1 | H77: 1 | I77: 1 | J77: 1 | K77: 1 | N77: Member | O77: 1
A78: =HYPERLINK("http://www.magelo.com/eq_view_profile.html?num=350545","Moshady") -> Moshady | B78: 63 | C78: Baron | D78: Wood Elf | E78: YES | G78: 1 | H78: 1 | I78: 1 | J78: 1 | L78: 1 | M78: 1 | N78: Member | O78: 1
A79: Molian | B79: 63 | C79: Hunter | D79: Wood Elf | E79: NO | H79: 1 | L79: 1 | M79: 1 | N79: Member | O79: 1
A80: Tyndall | B80: 61 | D80: Half Elf | E80: NO | H80: 1 | I80: 1 | J80: 1 | K80: 1 | M80: 1 | N80: Member | O80: 1
A81: =HYPERLINK("http://www.magelo.com/eq_view_profile.html?num=205039","Twitami") -> Twitami | B81: 64 | C81: Hunter | D81: Wood Elf | E81: YES | F81: 1 | G81: 1 | H81: 1 | I81: 1 | M81: 1 | N81: Member | O81: 1
A82: Rogues
A83: Britan | B83: 65 | C83: Veteran | D83: Gnome | E83: YES | F83: 1 | G83: 1 | H83: 1 | I83: 1 | M83: 1 | N83: Member | O83: 1
A84: =HYPERLINK("http://www.magelo.com/eq_view_profile.html?num=524849","Gerhardt") -> Gerhardt | B84: 65 | C84: Marauder | D84: Dwarf | E84: YES | F84: 1 | G84: 1 | H84: 1 | I84: 1 | J84: 1 | K84: 1 | L84: 1 | M84: 1 | N84: Member | O84: 1
A85: =HYPERLINK("http://www.magelo.com/eq_view_profile.html?num=35808","Honour") -> Honour | B85: 65 | C85: Veteran | D85: Half Elf | E85: YES | F85: 1 | G85: 1 | H85: 1 | I85: 1 | J85: 1 | L85: 1 | M85: 1 | N85: Member | O85: 1
A86: =HYPERLINK("http://www.magelo.com/eq_view_profile.html?num=542888","Hoth") -> Hoth | B86: 51 | D86: Half Elf | E86: NO | N86: Member | O86: 1
A87: =HYPERLINK("http://www.magelo.com/eq_view_profile.html?num=319473","Less") -> Less | B87: 65 | C87: Veteran | D87: Barbarian | E87: YES | G87: 1 | H87: 1 | I87: 1 | J87: 1 | K87: 1 | M87: 1 | N87: Member | O87: 1
A88: =HYPERLINK("http://www.magelo.com/eq_view_profile.html?num=552907","Mindori") -> Mindori | B88: 61 | D88: Dark Elf | E88: YES | H88: 1 | L88: 1 | M88: 1 | N88: Member | O88: 1
A89: =HYPERLINK("http://www.magelo.com/eq_view_profile.html?num=176420","Morisan") -> Morisan | B89: 65 | C89: Marauder | D89: Dwarf | E89: YES | F89: 1 | G89: 1 | H89: 1 | I89: 1 | J89: 1 | K89: 1 | L89: 1 | M89: 1 | N89: Member | O89: 1
A90: =HYPERLINK("http://www.magelo.com/eq_view_profile.html?num=512841","Slipn") -> Slipn | B90: 62 | D90: Barbarian | E90: YES | H90: 1 | I90: 1 | L90: 1 | M90: 1 | N90: Member | O90: 1
A91: =HYPERLINK("http://www.magelo.com/eq_view_profile.html?num=92314","Vestrial") -> Vestrial | B91: 65 | C91: Marauder | D91: Half Elf | E91: YES | F91: 1 | G91: 1 | H91: 1 | I91: 1 | L91: 1 | M91: 1 | N91: Officer | O91: 1
A92: Shadow Knights
A93: =HYPERLINK("http:www.magelo.com/eq_view_profile.html?num=362550","Asdrubael") -> Asdrubael | B93: 65 | C93: Duke | D93: Dark Elf | E93: YES | F93: 1 | G93: 1 | H93: 1 | I93: 1 | L93: 1 | M93: 1 | N93: Officer | O93: 1
A94: =HYPERLINK("http:www.magelo.com/eq_view_profile.html?num=313032","Groldar") -> Groldar | B94: 63 | D94: Iksar | E94: NO | G94: 1 | H94: 1 | I94: 1 | J94: 1 | K94: 1 | L94: 1 | M94: 1 | N94: Member | O94: 1
A95: =HYPERLINK("http://www.legendsoftherealm.com/legends/","Lunna") -> Lunna | B95: 57 | D95: Erudite | E95: NO | N95: Member | O95: 1
A96: =HYPERLINK("http://www.magelo.com/eq_view_profile.html?num=70519","Rakum") -> Rakum | B96: 65 | C96: Duke | D96: Troll | E96: NO | G96: 1 | H96: 1 | I96: 1 | K96: 1 | L96: 1 | M96: 1 | N96: Member | O96: 1
A97: =HYPERLINK("http://www.magelo.com/eq_view_profile.html?num=359742","Tobak") -> Tobak | B97: 62 | D97: Ogre | E97: YES | F97: 1 | G97: 1 | H97: 1 | I97: 1 | K97: 1 | L97: 1 | M97: 1 | N97: Member | O97: 1
A98: =HYPERLINK("http://www.magelo.com/eq_view_profile.html?num=555532","Veya") -> Veya | B98: 65 | D98: Iksar | E98: NO | G98: 1 | H98: 1 | I98: 1 | J98: 1 | K98: 1 | L98: 1 | M98: 1 | N98: Member | O98: 1
A99: =HYPERLINK("http://www.magelo.com/eq_view_profile.html?num=350162","Zolgar") -> Zolgar | B99: 62 | D99: Troll | E99: NO | F99: 1 | G99: 1 | H99: 1 | K99: 1 | L99: 1 | M99: 1 | N99: Member | O99: 1
A100: Shamans
A101: =HYPERLINK("http://www.magelo.com/eq_view_profile.html?num=557618","Aldarien") -> Aldarien | B101: 65 | C101: Venerable | D101: Barbarian | E101: YES | H101: 1 | I101: 1 | J101: 1 | K101: 1 | L101: 1 | M101: 1 | N101: Member | O101: 1
A102: Bamslam | B102: 65 | C102: Venerable | D102: Troll | E102: YES | F102: 1 | G102: 1 | H102: 1 | M102: 1 | N102: Officer | O102: 1
A103: Blisk | B103: 65 | C103: Baron | D103: Iksar | E103: YES | G103: 1 | H103: 1 | I103: 1 | K103: 1 | L103: 1 | M103: 1 | N103: Member | O103: 1
A104: Bulvyne | B104: 65 | D104: Barbarian | E104: YES | H104: 1 | J104: 1 | M104: 1 | N104: Member | O104: 1
A105: Kroze | B105: 61 | D105: Barbarian | E105: YES | H105: 1 | M105: 1 | N105: Member | O105: 1
A106: =HYPERLINK("http://www.magelo.com/eq_view_profile.html?num=183881","Naghite") -> Naghite | B106: 65 | C106: Venerable | D106: Ogre | E106: YES | F106: 1 | G106: 1 | H106: 1 | I106: 1 | J106: 1 | K106: 1 | L106: 1 | M106: 1 | N106: Member | O106: 1
A107: =HYPERLINK("http://www.magelo.com/eq_view_profile.html?num=347641","Ruanu") -> Ruanu | B107: 65 | C107: Venerable | D107: Troll | E107: YES | F107: 1 | G107: 1 | H107: 1 | I107: 1 | J107: 1 | M107: 1 | N107: Member | O107: 1
A108: =HYPERLINK("http://www.magelo.com/eq_view_profile.html?num=197796","Saramina") -> Saramina | B108: 61 | D108: Barbarian | E108: YES | G108: 1 | H108: 1 | I108: 1 | L108: 1 | M108: 1 | N108: Member | O108: 1
A109: =HYPERLINK("http://www.magelo.com/eq_view_profile.html?num=194845","Ulskun") -> Ulskun | B109: 65 | D109: Barbarian | E109: YES | H109: 1 | L109: 1 | M109: 1 | N109: Member | O109: 1
A110: Walknot | B110: 65 | D110: Ogre | E110: YES | H110: 1 | N110: Member | O110: 1
A111: =HYPERLINK("http://www.magelo.com/eq_view_profile.html?num=356943","Zurs") -> Zurs | B111: 65 | C111: Venerable | D111: Barbarian | E111: YES | F111: 1 | G111: 1 | H111: 1 | N111: Member | O111: 1
A112: =HYPERLINK("http://www.magelo.com/eq_view_profile.html?num=341926","Oenone (alt)") -> Oenone (alt) | B112: 60 | C112: Venerable | D112: Troll | E112: YES | F112: X | N112: Member
A113: Warriors
A114: =HYPERLINK("http://www.magelo.com/eq_view_profile.html?num=141424","Agus") -> Agus | B114: 65 | C114: Veteran | D114: Halfling | E114: YES | F114: 1 | G114: 1 | H114: 1 | I114: 1 | L114: 1 | M114: 1 | N114: Officer | O114: 1
A115: =HYPERLINK("http://www.magelo.com/eq_view_profile.html?num=357231","Feersum") -> Feersum | B115: 65 | D115: Barbarian | E115: NO | G115: 1 | H115: 1 | L115: 1 | M115: 1 | N115: Member | O115: 1
A116: =HYPERLINK("http://www.magelo.com/eq_view_profile.html?num=343105","Hearsay") -> Hearsay | B116: 65 | C116: Veteran | D116: Barbarian | E116: YES | F116: 1 | G116: 1 | H116: 1 | I116: 1 | J116: 1 | K116: 1 | L116: 1 | M116: 1 | N116: Member | O116: 1
A117: Ghazhagh | B117: 65 | D117: Dwarf | E117: NO | G117: 1 | H117: 1 | L117: 1 | M117: 1 | N117: Member | O117: 1
A118: Kylliyn | D118: Dwarf | N118: Member | O118: 1
A119: Kteq | B119: 65 | D119: Barbarian | E119: YES | G119: 1 | H119: 1 | I119: 1 | J119: 1 | K119: 1 | L119: 1 | M119: 1 | N119: Member | O119: 1
A120: =HYPERLINK("http://www.magelo.com/eq_view_profile.html?num=599043","Matsu") -> Matsu | B120: 65 | C120: Veteran | D120: Halfling | E120: NO | F120: 1 | G120: 1 | H120: 1 | I120: 1 | K120: 1 | L120: 1 | M120: 1 | N120: Member | O120: 1
A121: =HYPERLINK("http://www.magelo.com/eq_view_profile.html?num=244458","Mouxxie") -> Mouxxie | B121: 65 | C121: Baroness | D121: Halfling | E121: NO | F121: 1 | G121: 1 | H121: 1 | I121: 1 | K121: 1 | M121: 1 | N121: Member | O121: 1
A122: =HYPERLINK("http://www.magelo.com/eq_view_profile.html?num=265387","Sarelin") -> Sarelin | B122: 65 | C122: Veteran | D122: Barbarian | E122: NO | H122: 1 | I122: 1 | J122: 1 | K122: 1 | M122: 1 | N122: Member | O122: 1
A123: =HYPERLINK("http://www.magelo.com/eq_view_profile.html?num=98879","Silph") -> Silph | B123: 65 | C123: Veteran | D123: Human | E123: YES | F123: 1 | G123: 1 | H123: 1 | J123: 1 | M123: 1 | N123: Member | O123: 1
A124: =HYPERLINK("http://www.magelo.com/eq_view_profile.html?num=361707","Veera") -> Veera | B124: 55 | D124: Barbarian | E124: NO | N124: Member | O124: 1
A125: Zeal (alt) | B125: 65 | H125: X | M125: X | N125: Member
A126: Wizards
A127: =HYPERLINK("http://www.magelo.com/eq_view_profile.html?num=202761","Aylith") -> Aylith | B127: 62 | C127: Mistress | D127: High Elf | E127: YES | F127: 1 | G127: 1 | H127: 1 | I127: 1 | J127: 1 | N127: Member | O127: 1
A128: Cacius | B128: 61 | E128: YES | H128: 1 | L128: 1 | M128: 1 | N128: Member | O128: 1
A129: =HYPERLINK("http://www.magelo.com/eq_view_profile.html?num=193912","Faren") -> Faren | B129: 62 | D129: Human | E129: YES | F129: 1 | H129: 1 | N129: Member | O129: 1
A130: Fairuza | B130: 60 | D130: Erudite | E130: YES | L130: 1 | N130: Officer | O130: 1
A131: =HYPERLINK("http://www.magelo.com/eq_view_profile.html?num=360232","Kanah") -> Kanah | B131: 65 | D131: Dark Elf | E131: YES | H131: 1 | I131: 1 | K131: 1 | L131: 1 | M131: 1 | N131: Member | O131: 1
A132: Zeanith | B132: 57 | D132: Dark Elf | E132: NO | H132: 1 | N132: Member | O132: 1
A133: Kelben (alt) | B133: 60 | C133: Baron | D133: Human | E133: YES | N133: Member
A134: Xiaolasing (alt) | B134: 64 | C134: Sage | D134: Dark Elf | E134: YES | F134: X | G134: X | N134: Member
A135: Num of Act. Memb.= | B135: =SUM(O4:O134) -> 101 | C135: % Of Guild With Access= | F135: =SUM(F4:F134)/B135*1 -> 0.48514851485148514 | G135: =SUM(G4:G134)/B135*1 -> 0.5643564356435643 | H135: =SUM(H4:H134)/B135*1 -> 0.80198019801980203 | I135: =SUM(I4:I134)/B135*1 -> 0.57425742574257421 | J135: =SUM(J4:J134)/B135*1 -> 0.32673267326732675 | K135: =SUM(K4:K134)/B135*1 -> 0.40594059405940597 | L135: =SUM(L4:L134)/B135*1 -> 0.5544554455445545 | M135: =SUM(M4:M134)/B135*1 -> 0.69306930693069302
A136: Average Level= | B136: =AVERAGE(B13:B23,B51:B54,B127:B132,B114:B124,B93:B99,B68:B73,B101:B111,B83:B91,B4:B8,B41:B47,B57:B61,B32:B37,B75:B81,B63:B66,B10:B10) -> 63.237113402061858 | O136: 37715