C1: One Hand Setup
O2: Resistance Bonus
A3: Item | B3: AC | C3: WGT | D3: STR | E3: STA | F3: AGI | G3: DEX | H3: WIS | I3: INT | J3: CHA | K3: MN | L3: HP | M3: F | N3: D | O3: C | P3: M | Q3: P
A4: Diamondine Earring | B4: 2 | C4: 00.1 | D4: 3 | L4: 12
A5: Golden Amber Earring | B5: 0 | C5: 00.1 | D5: 3
A6: Collar of Undead Protection | B6: 5 | C6: 00.2 | N6: 7 | Q6: 7
A7: Dented Brass Mask | B7: 4 | C7: 00.8 | D7: 3
A8: Skull Shaped Barbute | B8: 13 | C8: 5.0 | L8: 35 | P8: 10
A9: Jagged Band | B9: 5 | C9: 00.1 | D9: 3
A10: Jagged Band | B10: 5 | C10: 00.1 | D10: 3
A11: Bracer of Ro | B11: 9 | C11: 2.0 | P11: 5
A12: Bracer of Ro | B12: 9 | C12: 2.0 | P12: 5
A13: Vambraces of Ro | B13: 9 | C13: 3.2 | H13: 6 | N13: 10
A14: Gauntlets of Ro | B14: 12 | C14: 2.5 | G14: 6 | Q14: 10
A15: Crested Spaulders | B15: 11 | C15: 4.5 | E15: 6
A16: Breastplate of Ro | B16: 18 | C16: 5.0 | D16: 4 | M16: 10
A17: White Wolf hide Cloak | B17: 7 | C17: 00.3 | D17: 3 | G17: 3 | O17: 5
A18: Flowing Black Silk Sash | B18: 0 | C18: 00.1
A19: Greaves of Ro | B19: 11 | C19: 3.7 | E19: 6 | O19: 10
A20: Boots of Ro | B20: 9 | C20: 1.5 | L20: 35
A21: Cracked Darkwood Shield | B21: 12 | C21: 5.0 | D21: 9
A22: Ghoulbane | B22: 0 | C22: 9.5
A23: DAM 15 DEL 34 | B23: =SUM(B4:B22) -> 141 | C23: =SUM(C4:C22) -> 40.7 | D23: =SUM(D4:D22) -> 31 | E23: =SUM(E4:E22) -> 12 | F23: =SUM(F4:F22) -> 0 | G23: =SUM(G4:G22) -> 9 | H23: =SUM(H4:H22) -> 6 | I23: =SUM(I4:I22) -> 0 | J23: =SUM(J4:J22) -> 0 | K23: =SUM(K4:K22) -> 0 | L23: =SUM(L4:L22) -> 82 | M23: =SUM(M4:M22) -> 10 | N23: =SUM(N4:N22) -> 17 | O23: =SUM(O4:O22) -> 15 | P23: =SUM(P4:P22) -> 20 | Q23: =SUM(Q4:Q22) -> 17
C25: Two Hand Setup
O26: Resistance Bonus
A27: Item | B27: AC | C27: WGT | D27: STR | E27: STA | F27: AGI | G27: DEX | H27: WIS | I27: INT | J27: CHA | K27: MN | L27: HP | M27: F | N27: D | O27: C | P27: M | Q27: P
A28: Diamondine Earring | B28: 2 | C28: 00.1 | D28: 3 | L28: 12
A29: Golden Amber Earring | B29: 0 | C29: 00.1 | D29: 3
A30: Collar of Undead Protection | B30: 5 | C30: 00.2 | N30: 7 | Q30: 7
A31: Dented Brass Mask | B31: 4 | C31: 00.8 | D31: 3
A32: Skull Shaped Barbute | B32: 13 | C32: 5.0 | L32: 35 | P32: 10
A33: Jagged Band | B33: 5 | C33: 00.1 | D33: 3
A34: Jagged Band | B34: 5 | C34: 00.1 | D34: 3
A35: Bracer of Ro | B35: 9 | C35: 2.0 | P35: 5
A36: Bracer of Ro | B36: 9 | C36: 2.0 | P36: 5
A37: Vambraces of Ro | B37: 9 | C37: 3.2 | H37: 6 | N37: 10
A38: Gauntlets of Ro | B38: 12 | C38: 2.5 | G38: 6 | Q38: 10
A39: Crested Spaulders | B39: 11 | C39: 4.5 | E39: 6
A40: Breastplate of Ro | B40: 18 | C40: 5.0 | D40: 4 | M40: 10
A41: White Wolf hide Cloak | B41: 7 | C41: 00.3 | D41: 3 | G41: 3 | O41: 5
A42: Flowing Black Silk Sash | B42: 0 | C42: 00.1
A43: Greaves of Ro | B43: 11 | C43: 3.7 | E43: 6 | O43: 10
A44: Boots of Ro | B44: 9 | C44: 1.5 | L44: 35
A45: Soulfire | B45: 0 | C45: 5.0 | D45: 7 | H45: 7
A46: DAM 23 DEL 45 | B46: =SUM(B28:B45) -> 129 | C46: =SUM(C28:C45) -> 31.2 | D46: =SUM(D28:D45) -> 29 | E46: =SUM(E28:E45) -> 12 | F46: =SUM(F28:F45) -> 0 | G46: =SUM(G28:G45) -> 9 | H46: =SUM(H28:H45) -> 13 | I46: =SUM(I28:I45) -> 0 | J46: =SUM(J28:J45) -> 0 | K46: =SUM(K28:K45) -> 0 | L46: =SUM(L28:L45) -> 82 | M46: =SUM(M28:M45) -> 10 | N46: =SUM(N28:N45) -> 17 | O46: =SUM(O28:O45) -> 15 | P46: =SUM(P28:P45) -> 20 | Q46: =SUM(Q28:Q45) -> 17
A50: Non-worn/alternative Gear
A51: EE Bag | B51: 8 SLT | D51: Weight -70%
A52: Archaeologist Pack | B52: 6 SLT | D52: Weight -20%
A53: Bloodstained Mantle | B53: 6 | C53: 3.5 | D53: +3 STR +10 MR
A55: Items Desired
A56: Etched Ivory Charm | B56: 5 | C56: 0.5 | D56: Str +2, Wis +2, Int +2 | H56: Jailkeep Permafrost
A57: Runed Lava Pendant | B57: 5 | C57: 00.2 | D57: Str +6, SV F +5 | H57: Sol
A58: Mithril Vambraces | B58: 10 | C58: 3.7 | D58: Str +7, SV M +5 | H58: Sol B | I58: Warlord Skarlon
A61: Stats | C61: Base | D61: 1HS | E61: Total | F61: 2HS | G61: Total | M61: =65+70+85+70+100+90+90 -> 570
A62: + STR | B62: 65 | C62: 77 | D62: =D23 -> 31 | E62: =C62+D62 -> 108 | F62: 26 | G62: =C62+F62 -> 103 | J62: 65
A63: +STA | B63: 70 | C63: 78 | D63: =E23 -> 12 | E63: =C63+D63 -> 90 | F63: 12 | G63: =C63+F63 -> 90 | J63: 70
A64: +AGI | B64: 85 | C64: 85 | D64: =F23 -> 0 | E64: =C64+D64 -> 85 | F64: 0 | G64: =C64+F64 -> 85 | J64: 85
A65: +DEX | B65: 70 | C65: 70 | D65: =G23 -> 9 | E65: =C65+D65 -> 79 | F65: 11 | G65: =C65+F65 -> 81 | J65: 70
A66: +WIS | B66: 100 | C66: 100 | D66: =H23 -> 6 | E66: =C66+D66 -> 106 | F66: 13 | G66: =C66+F66 -> 113 | J66: 100
A67: +INT | B67: 90 | C67: 92 | D67: =I23 -> 0 | E67: =C67+D67 -> 92 | F67: 0 | G67: =C67+F67 -> 92 | J67: 90
A68: +CHA | B68: 90 | C68: 90 | D68: =J23 -> 0 | E68: =C68+D68 -> 90 | F68: 0 | G68: =C68+F68 -> 90 | J68: 90
A69: +MANA | B69: 0 | C69: 0 | D69: =K23 -> 0 | E69: =D69 -> 0 | F69: 0 | G69: =C69+F69 -> 0
A70: +HP | B70: 0 | C70: 0 | D70: =L23 -> 82 | E70: =D70 -> 82 | F70: 82 | G70: =C70+F70 -> 82
B71: =B62+B63+B64+B65+B66+B67+B68 -> 570 | C71: =SUM(C62:C70) -> 592 | D71: =SUM(D62:D68) -> 58 | E71: =SUM(E62:E68) -> 650 | F71: =SUM(F62:F68) -> 62 | G71: =SUM(G62:G68) -> 654
A73: Skills
A74: 1HS | B74: 200 | F74: indicates Max for skill
A75: 2HS | B75: 200
A76: 1HB | B76: 30
A77: Hand to Hand | B77: 69
A78: Abjuration | B78: 219
A79: Alcohol Tolerance | B79: 57
A80: Alteration | B80: 225
A81: Archery | B81: 75
A82: Baking | B82: 1
A83: Bash | B83: 175
A84: Bind wound | B84: 83
A85: Brewing | B85: 3
A86: Channeling | B86: 200
A87: Conjuration | B87: 58
A88: Defense | B88: 200
A89: Disarm | B89: 70
A90: Divination | B90: 204
A91: Dodge | B91: 125
A92: Double Attack | B92: 200
A93: Evocation | B93: 217
A94: Meditate | B94: 185
A95: Offense | B95: 200
A96: Parry | B96: 175
A97: Riposte | B97: 175
A98: Sense Heading | B98: 165
A99: Swimming | B99: 200
A100: Taunt | B100: 180