A1: Name | B1: Effect | C1: Ranking | D1: AC | E1: STR | F1: STA | G1: AGI | H1: DEX | I1: WIS | J1: INT | K1: CHA | L1: HP | M1: MANA | N1: PR | O1: MR | P1: DR | Q1: FR | R1: CR | S1: WT | T1: WP | U1: Type
A2: Tattered Owlbear Collar | C2: =(I2*10)+M2+(D2*4)+G2+(L2/5)+(F2*2)+(E2*2)+(K2*2)+(O2/2)+(Q2/2)+(R2/2)+(N2/4)+(P2/4) -> 12.0 | D2: 3.0 | S2: 00.4 | U2: neck
A3: Thorax of the Hivemistress | C3: =(I3*10)+M3+(D3*4)+G3+(L3/5)+(F3*2)+(E3*2)+(K3*2)+(O3/2)+(Q3/2)+(R3/2)+(N3/4)+(P3/4) -> 48.5 | D3: 10.0 | E3: 2.0 | G3: 2.0 | Q3: 5.0 | S3: 1.0 | U3: neck
A4: Topaz Silver Necklace | C4: =(I4*10)+M4+(D4*4)+G4+(L4/5)+(F4*2)+(E4*2)+(K4*2)+(O4/2)+(Q4/2)+(R4/2)+(N4/4)+(P4/4) -> 1.0 | D4: 0.0 | P4: 4.0 | S4: 00.1 | T4: =0-QUOTIENT(S4,5) -> 0.0 | U4: neck
A5: Torin's Choker | C5: =(I5*10)+M5+(D5*4)+G5+(L5/5)+(F5*2)+(E5*2)+(K5*2)+(O5/2)+(Q5/2)+(R5/2)+(N5/4)+(P5/4) -> 19.0 | D5: 4.0 | G5: 3.0 | H5: 3.0 | S5: 2.0 | U5: neck
A6: Torque of Hoar Frost | C6: =(I6*10)+M6+(D6*4)+G6+(L6/5)+(F6*2)+(E6*2)+(K6*2)+(O6/2)+(Q6/2)+(R6/2)+(N6/4)+(P6/4) -> 21.0 | D6: 1.0 | L6: 10.0 | M6: 10.0 | R6: 10.0 | S6: 2.0 | T6: =0-QUOTIENT(S6,5) -> 0.0 | U6: neck
A7: Tro Jeg Official's Badge | C7: =(I7*10)+M7+(D7*4)+G7+(L7/5)+(F7*2)+(E7*2)+(K7*2)+(O7/2)+(Q7/2)+(R7/2)+(N7/4)+(P7/4) -> 23.0 | D7: 2.0 | E7: 2.0 | F7: 4.0 | L7: 10.0 | O7: 2.0 | S7: 00.2 | U7: neck
A8: Tserrina's Symbol | C8: =(I8*10)+M8+(D8*4)+G8+(L8/5)+(F8*2)+(E8*2)+(K8*2)+(O8/2)+(Q8/2)+(R8/2)+(N8/4)+(P8/4) -> 112.0 | D8: 3.0 | I8: 5.0 | J8: 5.0 | K8: 5.0 | M8: 40.0 | S8: 0.0 | T8: =0-QUOTIENT(S8,5) -> 0.0 | U8: neck
A9: Uiliak's Talisman | C9: =(I9*10)+M9+(D9*4)+G9+(L9/5)+(F9*2)+(E9*2)+(K9*2)+(O9/2)+(Q9/2)+(R9/2)+(N9/4)+(P9/4) -> 108.0 | D9: 5.0 | E9: 4.0 | F9: 4.0 | G9: 4.0 | H9: 4.0 | I9: 4.0 | J9: 4.0 | K9: 4.0 | L9: 10.0 | M9: 10.0 | N9: 4.0 | O9: 4.0 | P9: 4.0 | Q9: 4.0 | R9: 4.0 | S9: 0.5 | T9: =0-QUOTIENT(S9,5) -> 0.0 | U9: neck
A10: Ulthork Hide Collar | C10: =(I10*10)+M10+(D10*4)+G10+(L10/5)+(F10*2)+(E10*2)+(K10*2)+(O10/2)+(Q10/2)+(R10/2)+(N10/4)+(P10/4) -> 4.0 | D10: 7.0 | L10: 30.0 | M10: -30.0 | S10: 0.5 | T10: =0-QUOTIENT(S10,5) -> 0.0 | U10: neck
A11: Vale Reinforced Gorget | C11: =(I11*10)+M11+(D11*4)+G11+(L11/5)+(F11*2)+(E11*2)+(K11*2)+(O11/2)+(Q11/2)+(R11/2)+(N11/4)+(P11/4) -> 24.0 | D11: 6.0 | S11: 00.4 | T11: =0-QUOTIENT(S11,5) -> 0.0 | U11: neck
A12: Vale Studded Gorget | C12: =(I12*10)+M12+(D12*4)+G12+(L12/5)+(F12*2)+(E12*2)+(K12*2)+(O12/2)+(Q12/2)+(R12/2)+(N12/4)+(P12/4) -> 20.0 | D12: 5.0 | S12: 00.4 | T12: =0-QUOTIENT(S12,5) -> 0.0 | U12: neck
A13: Valtron's Necklace of Wonder | C13: =(I13*10)+M13+(D13*4)+G13+(L13/5)+(F13*2)+(E13*2)+(K13*2)+(O13/2)+(Q13/2)+(R13/2)+(N13/4)+(P13/4) -> 235.0 | D13: 35.0 | E13: 15.0 | G13: 15.0 | H13: 15.0 | L13: 100.0 | N13: 15.0 | O13: 15.0 | P13: 15.0 | Q13: 15.0 | R13: 15.0 | S13: 0.0 | T13: =0-QUOTIENT(S13,5) -> 0.0 | U13: neck
A14: Velium Cats Eye Necklace | C14: =(I14*10)+M14+(D14*4)+G14+(L14/5)+(F14*2)+(E14*2)+(K14*2)+(O14/2)+(Q14/2)+(R14/2)+(N14/4)+(P14/4) -> 20.0 | D14: 0.0 | K14: 10.0 | S14: 00.1 | T14: =0-QUOTIENT(S14,5) -> 0.0 | U14: neck
A15: Velium Sapphire Necklace | C15: =(I15*10)+M15+(D15*4)+G15+(L15/5)+(F15*2)+(E15*2)+(K15*2)+(O15/2)+(Q15/2)+(R15/2)+(N15/4)+(P15/4) -> 16.0 | D15: 0.0 | E15: 8.0 | J15: 8.0 | S15: 00.1 | T15: =0-QUOTIENT(S15,5) -> 0.0 | U15: neck
A16: Velium Topaz Necklace | C16: =(I16*10)+M16+(D16*4)+G16+(L16/5)+(F16*2)+(E16*2)+(K16*2)+(O16/2)+(Q16/2)+(R16/2)+(N16/4)+(P16/4) -> 27.5 | D16: 6.0 | P16: 14.0 | S16: 00.1 | T16: =0-QUOTIENT(S16,5) -> 0.0 | U16: neck
A17: Veliuum Lapis Lazuli Necklace | C17: =(I17*10)+M17+(D17*4)+G17+(L17/5)+(F17*2)+(E17*2)+(K17*2)+(O17/2)+(Q17/2)+(R17/2)+(N17/4)+(P17/4) -> 2.0 | D17: 0.0 | P17: 8.0 | S17: 00.1 | T17: =0-QUOTIENT(S17,5) -> 0.0 | U17: neck
A18: Velvet Choker | C18: =(I18*10)+M18+(D18*4)+G18+(L18/5)+(F18*2)+(E18*2)+(K18*2)+(O18/2)+(Q18/2)+(R18/2)+(N18/4)+(P18/4) -> 13.0 | D18: 3.0 | L18: 5.0 | S18: 0.5 | T18: =0-QUOTIENT(S18,5) -> 0.0 | U18: neck
A19: Vitaela's Talisman | C19: =(I19*10)+M19+(D19*4)+G19+(L19/5)+(F19*2)+(E19*2)+(K19*2)+(O19/2)+(Q19/2)+(R19/2)+(N19/4)+(P19/4) -> 108.0 | D19: 5.0 | E19: 4.0 | F19: 4.0 | G19: 4.0 | H19: 4.0 | I19: 4.0 | J19: 4.0 | K19: 4.0 | L19: 10.0 | M19: 10.0 | N19: 4.0 | O19: 4.0 | P19: 4.0 | Q19: 4.0 | R19: 4.0 | S19: 0.5 | T19: =0-QUOTIENT(S19,5) -> 0.0 | U19: neck
A20: Vraptin's Talisman | C20: =(I20*10)+M20+(D20*4)+G20+(L20/5)+(F20*2)+(E20*2)+(K20*2)+(O20/2)+(Q20/2)+(R20/2)+(N20/4)+(P20/4) -> 108.0 | D20: 5.0 | E20: 4.0 | F20: 4.0 | G20: 4.0 | H20: 4.0 | I20: 4.0 | J20: 4.0 | K20: 4.0 | L20: 10.0 | M20: 10.0 | N20: 4.0 | O20: 4.0 | P20: 4.0 | Q20: 4.0 | R20: 4.0 | S20: 0.5 | T20: =0-QUOTIENT(S20,5) -> 0.0 | U20: neck
A21: Warden Symbol of Tunare | B21: Grasping Roots | C21: =(I21*10)+M21+(D21*4)+G21+(L21/5)+(F21*2)+(E21*2)+(K21*2)+(O21/2)+(Q21/2)+(R21/2)+(N21/4)+(P21/4)+30 -> 107.0 | D21: 7.0 | I21: 3.0 | K21: 2.0 | M21: 15.0 | S21: 00.1 | T21: =0-QUOTIENT(S21,5) -> 0.0 | U21: neck
A22: White Gold Necklace | C22: =(I22*10)+M22+(D22*4)+G22+(L22/5)+(F22*2)+(E22*2)+(K22*2)+(O22/2)+(Q22/2)+(R22/2)+(N22/4)+(P22/4) -> 20.5 | D22: 0.0 | K22: 5.0 | O22: 7.0 | Q22: 7.0 | R22: 7.0 | S22: 00.3 | T22: =0-QUOTIENT(S22,5) -> 0.0 | U22: neck
A23: Withered Leather Gorget | C23: =(I23*10)+M23+(D23*4)+G23+(L23/5)+(F23*2)+(E23*2)+(K23*2)+(O23/2)+(Q23/2)+(R23/2)+(N23/4)+(P23/4) -> 57.0 | D23: 4.0 | I23: 3.0 | M23: 5.0 | N23: 3.0 | O23: 3.0 | P23: 3.0 | Q23: 3.0 | R23: 3.0 | S23: 0.5 | T23: =0-QUOTIENT(S23,5) -> 0.0 | U23: neck
A24: Wolf's Eye Platinum Necklace | C24: =(I24*10)+M24+(D24*4)+G24+(L24/5)+(F24*2)+(E24*2)+(K24*2)+(O24/2)+(Q24/2)+(R24/2)+(N24/4)+(P24/4) -> 4.5 | D24: 0.0 | O24: 9.0 | S24: 00.1 | T24: =0-QUOTIENT(S24,5) -> 0.0 | U24: neck
A25: Wolf's Eye Silver Necklace | C25: =(I25*10)+M25+(D25*4)+G25+(L25/5)+(F25*2)+(E25*2)+(K25*2)+(O25/2)+(Q25/2)+(R25/2)+(N25/4)+(P25/4) -> 2.0 | D25: 0.0 | O25: 4.0 | S25: 00.1 | T25: =0-QUOTIENT(S25,5) -> 0.0 | U25: neck
A26: Wolves Eye Necklace | C26: =(I26*10)+M26+(D26*4)+G26+(L26/5)+(F26*2)+(E26*2)+(K26*2)+(O26/2)+(Q26/2)+(R26/2)+(N26/4)+(P26/4) -> 18.5 | D26: 1.0 | F26: 4.0 | G26: 4.0 | H26: 4.0 | R26: 5.0 | S26: 0.5 | T26: =0-QUOTIENT(S26,5) -> 0.0 | U26: neck
A27: Woven Collar | C27: =(I27*10)+M27+(D27*4)+G27+(L27/5)+(F27*2)+(E27*2)+(K27*2)+(O27/2)+(Q27/2)+(R27/2)+(N27/4)+(P27/4) -> 8.0 | D27: 2.0 | S27: 00.1 | T27: =0-QUOTIENT(S27,5) -> 0.0 | U27: neck
A28: Xakra Kel Choker | C28: =(I28*10)+M28+(D28*4)+G28+(L28/5)+(F28*2)+(E28*2)+(K28*2)+(O28/2)+(Q28/2)+(R28/2)+(N28/4)+(P28/4) -> 8.0 | D28: 2.0 | S28: 00.1 | U28: neck
A29: Yal's Talisman | C29: =(I29*10)+M29+(D29*4)+G29+(L29/5)+(F29*2)+(E29*2)+(K29*2)+(O29/2)+(Q29/2)+(R29/2)+(N29/4)+(P29/4) -> 108.0 | D29: 5.0 | E29: 4.0 | F29: 4.0 | G29: 4.0 | H29: 4.0 | I29: 4.0 | J29: 4.0 | K29: 4.0 | L29: 10.0 | M29: 10.0 | N29: 4.0 | O29: 4.0 | P29: 4.0 | Q29: 4.0 | R29: 4.0 | S29: 0.5 | T29: =0-QUOTIENT(S29,5) -> 0.0 | U29: neck
A30: Yeldema's Talisman | C30: =(I30*10)+M30+(D30*4)+G30+(L30/5)+(F30*2)+(E30*2)+(K30*2)+(O30/2)+(Q30/2)+(R30/2)+(N30/4)+(P30/4) -> 108.0 | D30: 5.0 | E30: 4.0 | F30: 4.0 | G30: 4.0 | H30: 4.0 | I30: 4.0 | J30: 4.0 | K30: 4.0 | L30: 10.0 | M30: 10.0 | N30: 4.0 | O30: 4.0 | P30: 4.0 | Q30: 4.0 | R30: 4.0 | S30: 0.5 | T30: =0-QUOTIENT(S30,5) -> 0.0 | U30: neck
A31: Yelinak's Talisman | B31: Haste | C31: =(I31*10)+M31+(D31*4)+G31+(L31/5)+(F31*2)+(E31*2)+(K31*2)+(O31/2)+(Q31/2)+(R31/2)+(N31/4)+(P31/4)+30 -> 243.0 | D31: 8.0 | E31: 7.0 | F31: 7.0 | G31: 7.0 | H31: 7.0 | I31: 7.0 | J31: 7.0 | K31: 7.0 | L31: 40.0 | M31: 40.0 | N31: 7.0 | O31: 7.0 | P31: 7.0 | Q31: 7.0 | R31: 7.0 | S31: 0.5 | T31: =0-QUOTIENT(S31,5) -> 0.0 | U31: neck
A32: Yelloweyes Collar | C32: =(I32*10)+M32+(D32*4)+G32+(L32/5)+(F32*2)+(E32*2)+(K32*2)+(O32/2)+(Q32/2)+(R32/2)+(N32/4)+(P32/4) -> 46.0 | D32: 5.0 | E32: 3.0 | I32: 2.0 | S32: 00.4 | U32: neck
A33: Zlandicar's Talisman | C33: =(I33*10)+M33+(D33*4)+G33+(L33/5)+(F33*2)+(E33*2)+(K33*2)+(O33/2)+(Q33/2)+(R33/2)+(N33/4)+(P33/4) -> 198.0 | D33: 10.0 | E33: 10.0 | F33: 9.0 | G33: 3.0 | I33: 5.0 | J33: 10.0 | K33: -7.0 | L33: 60.0 | M33: 60.0 | N33: 6.0 | O33: 2.0 | P33: 6.0 | Q33: 5.0 | R33: 5.0 | S33: 0.5 | T33: =0-QUOTIENT(S33,5) -> 0.0 | U33: neck