D1: AC | F1: Str | G1: Sta | H1: Dex | I1: Agi | J1: Int | K1: Wis | L1: Cha | N1: HP | O1: Mana | Q1: Sv Magic | R1: Sv Fire | S1: Sv Cold | T1: Sv Poison | U1: Sv Disease | W1: Effect
A2: Chestplate | B2: Plane of Fear | D2: 11 | G2: 10 | H2: 10 | J2: 13 | O2: 40
B3: Plane of Growth | D3: 12 | G3: 15 | J3: 14 | N3: 70 | O3: 50 | Q3: 10 | R3: 5 | S3: 5 | T3: 5 | U3: 5 | W3: Conjure Corpse
B4: Plane of Mischief | D4: 22 | F4: 5 | G4: 15 | I4: 5 | J4: 15 | L4: -10 | N4: 100 | O4: 40 | Q4: 5 | R4: 5 | S4: 5 | T4: 15 | U4: 20
B5: Thurgadin | D5: 12 | G5: 15 | J5: 14 | N5: 70 | O5: 50 | Q5: 10 | R5: 5 | S5: 5 | T5: 5 | U5: 5 | W5: Conjure Corpse
B6: Kael | D6: 14 | G6: 15 | J6: 14 | N6: 70 | O6: 50 | Q6: 5 | R6: 10 | S6: 4 | T6: 14 | U6: 4 | W6: Conjure Corpse
B7: Skyshrine
A9: Legs | B9: Plane of Fear | D9: 5 | F9: 3 | H9: 4 | N9: 10 | S9: 10
B10: Plane of Growth | D10: 7 | G10: 5 | J10: 2 | Q10: 3 | R10: 2 | S10: 2 | T10: 1 | U10: 2 | W10: Augment Death
B11: Plane of Mischief
B12: Thurgadin | D12: 7 | G12: 5 | J12: 2 | Q12: 3 | R12: 2 | S12: 2 | T12: 1 | U12: 1 | W12: Augment Death
B13: Kael
B14: Skyshrine | D14: 7 | G14: 6 | J14: 3 | N14: 45 | O14: 50 | Q14: 4 | R14: 3 | S14: 3 | T14: 2 | U14: 2 | W14: Augment Death
A16: Arms | B16: Plane of Fear | D16: 5 | J16: 7 | N16: 15 | R16: 10
B17: Plane of Growth | D17: 6 | G17: 4 | J17: 5 | N17: 30 | R17: 2
B18: Plane of Mischief
B19: Thurgadin | D19: 6 | G19: 4 | J19: 5 | N19: 30 | T19: 2
B20: Kael | D20: 8 | G20: 4 | J20: 7 | N20: 30 | S20: 8
B21: Skyshrine | D21: 6 | G21: 5 | H21: 2 | J21: 8 | N21: 35 | O21: 10 | Q21: 1 | R21: 1 | S21: 1 | T21: 1 | U21: 1
A23: Hands | B23: Plane of Fear | D23: 4 | H23: 10 | J23: 8 | O23: 12 | U23: 10
B24: Plane of Growth | D24: 5 | G24: 4 | J24: 9 | L24: 4 | N24: 25 | Q24: 1 | R24: 2 | S24: 2 | T24: 2 | U24: 2
B25: Plane of Mischief | D25: 10 | G25: 5 | J25: 6 | N25: 25 | O25: 30 | R25: 5 | S25: 5 | W25: Nullify Magic (10)
B26: Thurgadin | D26: 5 | G26: 4 | J26: 9 | L26: 4 | N26: 25 | Q26: 1 | R26: 2 | S26: 2 | T26: 2 | U26: 2
B27: Kael | D27: 7 | G27: 5 | J27: 10 | L27: 4 | N27: 25 | Q27: 3 | R27: 3 | S27: 3 | T27: 3 | U27: 3
B28: Skyshrine | D28: 5 | F28: 2 | G28: 6 | J28: 10 | L28: 6 | N28: 25 | Q28: 2 | R28: 2 | S28: 2 | T28: 2 | U28: 2
A30: Feet | B30: Plane of Fear | D30: 4 | I30: 14 | N30: 5 | T30: 10
B31: Plane of Growth | D31: 5 | G31: 3 | N31: 35 | Q31: 2 | R31: 2 | S31: 2 | T31: 2 | U31: 2 | W31: Invisibility to Undead
B32: Plane of Mischief
B33: Thurgadin | D33: 5 | G33: 3 | N33: 35 | Q33: 2 | R33: 2 | S33: 2 | T33: 2 | U33: 2 | W33: Invisibility to Undead
B34: Kael | D34: 7 | G34: 3 | N34: 35 | Q34: 3 | R34: 4 | S34: 4 | T34: 4 | U34: 4 | W34: Invisibility to Undead
B35: Skyshrine | D35: 5 | G35: 4 | J35: 6 | N35: 50 | Q35: 2 | R35: 2 | S35: 2 | T35: 2 | U35: 2 | W35: Invisibility to Undead
A37: Head | B37: Plane of Fear | D37: 5 | J37: 8 | K37: 7 | N37: 10 | O37: 20 | Q37: 10
B38: Plane of Growth | D38: 6 | G38: 7 | J38: 4 | N38: 20 | O38: 10 | Q38: 5 | T38: 4
B39: Plane of Mischief
B40: Thurgadin | D40: 6 | G40: 7 | J40: 4 | N40: 20 | O40: 10 | Q40: 5 | R40: 4
B41: Kael | D41: 8 | G41: 7 | J41: 4 | L41: 3 | N41: 30 | Q41: 5 | U41: 6
B42: Skyshrine | D42: 6 | G42: 8 | J42: 5 | N42: 35 | O42: 30 | Q42: 10 | S42: 4
A44: Wrist | B44: Plane of Fear | D44: 3 | F44: 4 | H44: 5 | O44: 15
B45: Plane of Growth | D45: 4 | H45: 5 | J45: 2 | N45: 20 | Q45: 1 | R45: 1 | S45: 1 | T45: 1 | U45: 1 | W45: Reclaim Energy
B46: Plane of Mischief
B47: Thurgadin | D47: 4 | H47: 5 | J47: 2 | N47: 20 | Q47: 1 | R47: 2 | S47: 2 | T47: 1 | U47: 1 | W47: Reclaim Energy
B48: Kael | D48: 6 | H48: 5 | J48: 3 | N48: 25 | O48: 10 | Q48: 1 | R48: 3 | S48: 2 | T48: 1 | U48: 3 | W48: Reclaim Energy
B49: Skyshrine | D49: 4 | H49: 5 | J49: 3 | N49: 20 | O49: 20 | Q49: 3 | R49: 3 | S49: 3 | T49: 3 | U49: 3 | W49: Reclaim Energy
A51: Total | B51: Plane of Fear | D51: =D2+D9+D16+D23+D30+D37+2*D44 -> 40 | F51: =F2+F9+F16+F23+F30+F37+2*F44 -> 11 | G51: =G2+G9+G16+G23+G30+G37+2*G44 -> 10 | H51: =H2+H9+H16+H23+H30+H37+2*H44 -> 34 | I51: =I2+I9+I16+I23+I30+I37+2*I44 -> 14 | J51: =J2+J9+J16+J23+J30+J37+2*J44 -> 36 | K51: =K2+K9+K16+K23+K30+K37+2*K44 -> 7 | L51: =L2+L9+L16+L23+L30+L37+2*L44 -> 0 | N51: =N2+N9+N16+N23+N30+N37+2*N44 -> 40 | O51: =O2+O9+O16+O23+O30+O37+2*O44 -> 102 | Q51: =Q2+Q9+Q16+Q23+Q30+Q37+2*Q44 -> 10 | R51: =R2+R9+R16+R23+R30+R37+2*R44 -> 10 | S51: =S2+S9+S16+S23+S30+S37+2*S44 -> 10 | T51: =T2+T9+T16+T23+T30+T37+2*T44 -> 10 | U51: =U2+U9+U16+U23+U30+U37+2*U44 -> 10
B52: Plane of Growth | D52: =D3+D10+D17+D24+D31+D38+2*D45 -> 49 | F52: =F3+F10+F17+F24+F31+F38+2*F45 -> 0 | G52: =G3+G10+G17+G24+G31+G38+2*G45 -> 38 | H52: =H3+H10+H17+H24+H31+H38+2*H45 -> 10 | I52: =I3+I10+I17+I24+I31+I38+2*I45 -> 0 | J52: =J3+J10+J17+J24+J31+J38+2*J45 -> 38 | K52: =K3+K10+K17+K24+K31+K38+2*K45 -> 0 | L52: =L3+L10+L17+L24+L31+L38+2*L45 -> 4 | N52: =N3+N10+N17+N24+N31+N38+2*N45 -> 220 | O52: =O3+O10+O17+O24+O31+O38+2*O45 -> 60 | Q52: =Q3+Q10+Q17+Q24+Q31+Q38+2*Q45 -> 23 | R52: =R3+R10+R17+R24+R31+R38+2*R45 -> 15 | S52: =S3+S10+S17+S24+S31+S38+2*S45 -> 13 | T52: =T3+T10+T17+T24+T31+T38+2*T45 -> 16 | U52: =U3+U10+U17+U24+U31+U38+2*U45 -> 13
B53: Plane of Mischief | D53: =D4+D11+D18+D25+D32+D39+2*D46 -> 32 | F53: =F4+F11+F18+F25+F32+F39+2*F46 -> 5 | G53: =G4+G11+G18+G25+G32+G39+2*G46 -> 20 | H53: =H4+H11+H18+H25+H32+H39+2*H46 -> 0 | I53: =I4+I11+I18+I25+I32+I39+2*I46 -> 5 | J53: =J4+J11+J18+J25+J32+J39+2*J46 -> 21 | K53: =K4+K11+K18+K25+K32+K39+2*K46 -> 0 | L53: =L4+L11+L18+L25+L32+L39+2*L46 -> -10 | N53: =N4+N11+N18+N25+N32+N39+2*N46 -> 125 | O53: =O4+O11+O18+O25+O32+O39+2*O46 -> 70 | Q53: =Q4+Q11+Q18+Q25+Q32+Q39+2*Q46 -> 5 | R53: =R4+R11+R18+R25+R32+R39+2*R46 -> 10 | S53: =S4+S11+S18+S25+S32+S39+2*S46 -> 10 | T53: =T4+T11+T18+T25+T32+T39+2*T46 -> 15 | U53: =U4+U11+U18+U25+U32+U39+2*U46 -> 20
B54: Thurgadin | D54: =D5+D12+D19+D26+D33+D40+2*D47 -> 49 | F54: =F5+F12+F19+F26+F33+F40+2*F47 -> 0 | G54: =G5+G12+G19+G26+G33+G40+2*G47 -> 38 | H54: =H5+H12+H19+H26+H33+H40+2*H47 -> 10 | I54: =I5+I12+I19+I26+I33+I40+2*I47 -> 0 | J54: =J5+J12+J19+J26+J33+J40+2*J47 -> 38 | K54: =K5+K12+K19+K26+K33+K40+2*K47 -> 0 | L54: =L5+L12+L19+L26+L33+L40+2*L47 -> 4 | N54: =N5+N12+N19+N26+N33+N40+2*N47 -> 220 | O54: =O5+O12+O19+O26+O33+O40+2*O47 -> 60 | Q54: =Q5+Q12+Q19+Q26+Q33+Q40+2*Q47 -> 23 | R54: =R5+R12+R19+R26+R33+R40+2*R47 -> 19 | S54: =S5+S12+S19+S26+S33+S40+2*S47 -> 15 | T54: =T5+T12+T19+T26+T33+T40+2*T47 -> 14 | U54: =U5+U12+U19+U26+U33+U40+2*U47 -> 12
B55: Kael | D55: =D6+D13+D20+D27+D34+D41+2*D48 -> 56 | F55: =F6+F13+F20+F27+F34+F41+2*F48 -> 0 | G55: =G6+G13+G20+G27+G34+G41+2*G48 -> 34 | H55: =H6+H13+H20+H27+H34+H41+2*H48 -> 10 | I55: =I6+I13+I20+I27+I34+I41+2*I48 -> 0 | J55: =J6+J13+J20+J27+J34+J41+2*J48 -> 41 | K55: =K6+K13+K20+K27+K34+K41+2*K48 -> 0 | L55: =L6+L13+L20+L27+L34+L41+2*L48 -> 7 | N55: =N6+N13+N20+N27+N34+N41+2*N48 -> 240 | O55: =O6+O13+O20+O27+O34+O41+2*O48 -> 70 | Q55: =Q6+Q13+Q20+Q27+Q34+Q41+2*Q48 -> 18 | R55: =R6+R13+R20+R27+R34+R41+2*R48 -> 23 | S55: =S6+S13+S20+S27+S34+S41+2*S48 -> 23 | T55: =T6+T13+T20+T27+T34+T41+2*T48 -> 23 | U55: =U6+U13+U20+U27+U34+U41+2*U48 -> 23
B56: Skyshrine | D56: =D7+D14+D21+D28+D35+D42+2*D49 -> 37 | F56: =F7+F14+F21+F28+F35+F42+2*F49 -> 2 | G56: =G7+G14+G21+G28+G35+G42+2*G49 -> 29 | H56: =H7+H14+H21+H28+H35+H42+2*H49 -> 12 | I56: =I7+I14+I21+I28+I35+I42+2*I49 -> 0 | J56: =J7+J14+J21+J28+J35+J42+2*J49 -> 38 | K56: =K7+K14+K21+K28+K35+K42+2*K49 -> 0 | L56: =L7+L14+L21+L28+L35+L42+2*L49 -> 6 | N56: =N7+N14+N21+N28+N35+N42+2*N49 -> 230 | O56: =O7+O14+O21+O28+O35+O42+2*O49 -> 130 | Q56: =Q7+Q14+Q21+Q28+Q35+Q42+2*Q49 -> 25 | R56: =R7+R14+R21+R28+R35+R42+2*R49 -> 14 | S56: =S7+S14+S21+S28+S35+S42+2*S49 -> 18 | T56: =T7+T14+T21+T28+T35+T42+2*T49 -> 13 | U56: =U7+U14+U21+U28+U35+U42+2*U49 -> 13