A1: FastCounter by bCentral site hosted by PlusNet | C1: Prexus Board Stats 2nd August 2002. All figures are daily averages over 30 days.

A1: Home News Latest Site News Latest genre news Features Azzna's Clue Bat Reviews & Features Creative Work Community Message Board Links About EQ Women Submit Content Contact EQ Women About this Site Support the board - buy stuff here.

A1: Forum | B1: Page Views | C1: EZsupporter | D1: Posts | E1: net views | F1: %supporter
A2: General | B2: 7927 | C2: 1625 | D2: 113 | E2: = B2-C2 -> 6302 | F2: =C2/F2 -> 20.499558471048317
A3: Rants | B3: 5462 | C3: 1197 | D3: 81 | E3: = B3-C3 -> 4265 | F3: =C3/F3 -> 21.915049432442331
A4: Politics | B4: 4328 | C4: 1360 | D4: 227 | E4: = B4-C4 -> 2968 | F4: =C4/F4 -> 31.42329020332717
A5: Entertainment | B5: 1856 | C5: 474 | D5: 36 | E5: = B5-C5 -> 1382 | F5: =C5/F5 -> 25.538793103448278
A6: Trading | B6: 991 | C6: 149 | D6: 10 | E6: = B6-C6 -> 842 | F6: =C6/F6 -> 15.035317860746721
A7: Polls | B7: 723 | C7: 205 | D7: 10 | E7: = B7-C7 -> 518 | F7: =C7/F7 -> 28.354080221300137
A8: Sports | B8: 679 | C8: 163 | D8: 21 | E8: = B8-C8 -> 516 | F8: =C8/F8 -> 24.005891016200295
A9: Guild Recruiting | B9: 633 | C9: 122 | D9: 4 | E9: = B9-C9 -> 511 | F9: =C9/F9 -> 19.273301737756714
A10: Armchair Science | B10: 285 | C10: 68 | D10: 7 | E10: = B10-C10 -> 217 | F10: =C10/F10 -> 23.859649122807017
A11: Spam and chips | B11: 118 | C11: 28 | D11: 3 | E11: = B11-C11 -> 90 | F11: =C11/F11 -> 23.728813559322035
A12: Roleplaying | B12: 105 | C12: 24 | D12: 2 | E12: = B12-C12 -> 81 | F12: =C12/F12 -> 22.857142857142858
A13: Spell Trading | B13: 88 | C13: 13 | D13: 0 | E13: = B13-C13 -> 75 | F13: =C13/F13 -> 14.772727272727273
A14: HoF | B14: 83 | C14: 9 | D14: 0 | E14: = B14-C14 -> 74 | F14: =C14/F14 -> 10.843373493975903
A15: Retirement | B15: 73 | C15: 17 | D15: 1 | E15: = B15-C15 -> 56 | F15: =C15/F15 -> 23.287671232876711
A16: Guild Leadership | B16: 64 | C16: 33 | D16: 2 | E16: = B16-C16 -> 31 | F16: =C16/F16 -> 51.5625
A17: Admin | B17: 47 | C17: 16 | D17: 1 | E17: = B17-C17 -> 31 | F17: =C17/F17 -> 34.042553191489361
A18: Test | B18: 24 | C18: 3 | D18: 2 | E18: = B18-C18 -> 21 | F18: =C18/F18 -> 12.5
A19: Tradeskills | B19: 7 | C19: 1 | D19: 0 | E19: = B19-C19 -> 6 | F19: =C19/F19 -> 14.285714285714285
A20: Fallen Friends | B20: 0 | C20: 0 | D20: 0 | E20: = B20-C20 -> 0 | F20: =C20/F20 -> #DIV/0!