A1: Name | B1: Effect | C1: Ranking | D1: AC | E1: STR | F1: STA | G1: AGI | H1: DEX | I1: WIS | J1: INT | K1: CHA | L1: HP | M1: MANA | N1: PR | O1: MR | P1: DR | Q1: FR | R1: CR | S1: WT | T1: WP | U1: Type
A2: Silver Charm of Tranquility | C2: =(I2*10)+M2+(D2*4)+G2+(L2/5)+(F2*2)+(E2*2)+(K2*2)+(O2/2)+(Q2/2)+(R2/2)+(N2/4)+(P2/4) -> 326 | D2: 35 | E2: 10 | F2: 15 | L2: 100 | M2: 100 | N2: 8 | O2: 8 | P2: 8 | Q2: 8 | R2: 8 | S2: 0.5 | T2: =0-QUOTIENT(S2,5) -> 0 | U2: neck
A3: Amulet of the Dreadgazer | B3: Truesight | C3: =(I3*10)+M3+(D3*4)+G3+(L3/5)+(F3*2)+(E3*2)+(K3*2)+(O3/2)+(Q3/2)+(R3/2)+(N3/4)+(P3/4)+30 -> 270 | D3: 15 | E3: 5 | F3: 5 | I3: 5 | J3: 5 | L3: 75 | M3: 75 | N3: 10 | O3: 10 | P3: 10 | Q3: 10 | R3: 10 | S3: 0 | T3: =0-QUOTIENT(S3,5) -> 0 | U3: neck
A4: Collar of Tavuel Xakreum | B4: Flowing Thought II | C4: =(I4*10)+M4+(D4*4)+G4+(L4/5)+(F4*2)+(E4*2)+(K4*2)+(O4/2)+(Q4/2)+(R4/2)+(N4/4)+(P4/4) -> 269.5 | D4: 10 | I4: 20 | J4: 20 | L4: 60 | O4: 20 | Q4: 15 | S4: 00.1 | U4: neck
A5: Yelinak's Talisman | B5: Haste | C5: =(I5*10)+M5+(D5*4)+G5+(L5/5)+(F5*2)+(E5*2)+(K5*2)+(O5/2)+(Q5/2)+(R5/2)+(N5/4)+(P5/4)+30 -> 243 | D5: 8 | E5: 7 | F5: 7 | G5: 7 | H5: 7 | I5: 7 | J5: 7 | K5: 7 | L5: 40 | M5: 40 | N5: 7 | O5: 7 | P5: 7 | Q5: 7 | R5: 7 | S5: 0.5 | T5: =0-QUOTIENT(S5,5) -> 0 | U5: neck
A6: Valtron's Necklace of Wonder | C6: =(I6*10)+M6+(D6*4)+G6+(L6/5)+(F6*2)+(E6*2)+(K6*2)+(O6/2)+(Q6/2)+(R6/2)+(N6/4)+(P6/4) -> 235 | D6: 35 | E6: 15 | G6: 15 | H6: 15 | L6: 100 | N6: 15 | O6: 15 | P6: 15 | Q6: 15 | R6: 15 | S6: 0 | T6: =0-QUOTIENT(S6,5) -> 0 | U6: neck
A7: Choker of the Wretched | B7: Flowing Thought I | C7: =(I7*10)+M7+(D7*4)+G7+(L7/5)+(F7*2)+(E7*2)+(K7*2)+(O7/2)+(Q7/2)+(R7/2)+(N7/4)+(P7/4)+30 -> 222 | D7: 8 | F7: 8 | I7: 8 | J7: 8 | K7: 8 | L7: 40 | M7: 40 | S7: 00.1 | T7: =0-QUOTIENT(S7,5) -> 0 | U7: neck
A8: First Brood Talisman | C8: =(I8*10)+M8+(D8*4)+G8+(L8/5)+(F8*2)+(E8*2)+(K8*2)+(O8/2)+(Q8/2)+(R8/2)+(N8/4)+(P8/4) -> 219 | D8: 15 | E8: 5 | F8: 5 | G8: 5 | H8: 5 | I8: 5 | J8: 5 | K8: 5 | L8: 50 | M8: 50 | N8: 7 | O8: 7 | P8: 7 | Q8: 7 | R8: 7 | S8: 0 | T8: =0-QUOTIENT(S8,5) -> 0 | U8: neck
A9: Klandicar's Talisman | C9: =(I9*10)+M9+(D9*4)+G9+(L9/5)+(F9*2)+(E9*2)+(K9*2)+(O9/2)+(Q9/2)+(R9/2)+(N9/4)+(P9/4) -> 213 | D9: 8 | E9: 7 | F9: 7 | G9: 7 | H9: 7 | I9: 7 | J9: 7 | K9: 7 | L9: 40 | M9: 40 | N9: 7 | O9: 7 | P9: 7 | Q9: 7 | R9: 7 | S9: 0.5 | T9: =0-QUOTIENT(S9,5) -> 0 | U9: neck
A10: Sontalek's Talisman | C10: =(I10*10)+M10+(D10*4)+G10+(L10/5)+(F10*2)+(E10*2)+(K10*2)+(O10/2)+(Q10/2)+(R10/2)+(N10/4)+(P10/4) -> 213 | D10: 8 | E10: 7 | F10: 7 | G10: 7 | H10: 7 | I10: 7 | J10: 7 | K10: 7 | L10: 40 | M10: 40 | N10: 7 | O10: 7 | P10: 7 | Q10: 7 | R10: 7 | S10: 0.5 | T10: =0-QUOTIENT(S10,5) -> 0 | U10: neck
A11: Lendiniara's Talisman | C11: =(I11*10)+M11+(D11*4)+G11+(L11/5)+(F11*2)+(E11*2)+(K11*2)+(O11/2)+(Q11/2)+(R11/2)+(N11/4)+(P11/4) -> 211 | D11: 8 | E11: 5 | F11: 5 | G11: 5 | H11: 5 | I11: 5 | J11: 5 | K11: 5 | L11: 70 | M11: 70 | N11: 5 | O11: 5 | P11: 5 | Q11: 5 | R11: 5 | S11: 0.5 | T11: =0-QUOTIENT(S11,5) -> 0 | U11: neck
A12: Spinning Orb of Confusion | C12: =(I12*10)+M12+(D12*4)+G12+(L12/5)+(F12*2)+(E12*2)+(K12*2)+(O12/2)+(Q12/2)+(R12/2)+(N12/4)+(P12/4) -> 205 | D12: 25 | F12: 15 | G12: 15 | K12: 15 | L12: 25 | M12: 25 | S12: 0 | T12: =0-QUOTIENT(S12,5) -> 0 | U12: neck
A13: Zlandicar's Talisman | C13: =(I13*10)+M13+(D13*4)+G13+(L13/5)+(F13*2)+(E13*2)+(K13*2)+(O13/2)+(Q13/2)+(R13/2)+(N13/4)+(P13/4) -> 198 | D13: 10 | E13: 10 | F13: 9 | G13: 3 | I13: 5 | J13: 10 | K13: -7 | L13: 60 | M13: 60 | N13: 6 | O13: 2 | P13: 6 | Q13: 5 | R13: 5 | S13: 0.5 | T13: =0-QUOTIENT(S13,5) -> 0 | U13: neck
A14: Medal of Deep Thought | C14: =(I14*10)+M14+(D14*4)+G14+(L14/5)+(F14*2)+(E14*2)+(K14*2)+(O14/2)+(Q14/2)+(R14/2)+(N14/4)+(P14/4) -> 183 | D14: 10 | I14: 9 | J14: 9 | L14: 75 | M14: 30 | N14: 4 | O14: 4 | P14: 4 | Q14: 4 | R14: 4 | S14: 0 | T14: =0-QUOTIENT(S14,5) -> 0 | U14: neck
A15: Pulsating Gem | C15: =(I15*10)+M15+(D15*4)+G15+(L15/5)+(F15*2)+(E15*2)+(K15*2)+(O15/2)+(Q15/2)+(R15/2)+(N15/4)+(P15/4) -> 182.8 | D15: 7 | E15: 9 | F15: 9 | G15: 9 | H15: 9 | I15: 9 | J15: 9 | K15: 9 | L15: 9 | T15: =0-QUOTIENT(S15,5) -> 0 | U15: neck
A16: Ayillish's Talisman | C16: =(I16*10)+M16+(D16*4)+G16+(L16/5)+(F16*2)+(E16*2)+(K16*2)+(O16/2)+(Q16/2)+(R16/2)+(N16/4)+(P16/4) -> 178 | D16: 7 | E16: 6 | F16: 6 | G16: 6 | H16: 6 | I16: 6 | J16: 6 | K16: 6 | L16: 30 | M16: 30 | N16: 6 | O16: 6 | P16: 6 | Q16: 6 | R16: 6 | S16: 0.5 | T16: =0-QUOTIENT(S16,5) -> 0 | U16: neck
A17: Derasinel's Talisman | C17: =(I17*10)+M17+(D17*4)+G17+(L17/5)+(F17*2)+(E17*2)+(K17*2)+(O17/2)+(Q17/2)+(R17/2)+(N17/4)+(P17/4) -> 178 | D17: 7 | E17: 6 | F17: 6 | G17: 6 | H17: 6 | I17: 6 | J17: 6 | K17: 6 | L17: 30 | M17: 30 | N17: 6 | O17: 6 | P17: 6 | Q17: 6 | R17: 6 | S17: 0.5 | T17: =0-QUOTIENT(S17,5) -> 0 | U17: neck
A18: Draazak's Talisman | C18: =(I18*10)+M18+(D18*4)+G18+(L18/5)+(F18*2)+(E18*2)+(K18*2)+(O18/2)+(Q18/2)+(R18/2)+(N18/4)+(P18/4) -> 178 | D18: 7 | E18: 6 | F18: 6 | G18: 6 | H18: 6 | I18: 6 | J18: 6 | K18: 6 | L18: 30 | M18: 30 | N18: 6 | O18: 6 | P18: 6 | Q18: 6 | R18: 6 | S18: 0.5 | T18: =0-QUOTIENT(S18,5) -> 0 | U18: neck
A19: Entariz's Talisman | C19: =(I19*10)+M19+(D19*4)+G19+(L19/5)+(F19*2)+(E19*2)+(K19*2)+(O19/2)+(Q19/2)+(R19/2)+(N19/4)+(P19/4) -> 178 | D19: 7 | E19: 6 | F19: 6 | G19: 6 | H19: 6 | I19: 6 | J19: 6 | K19: 6 | L19: 30 | M19: 30 | N19: 6 | O19: 6 | P19: 6 | Q19: 6 | R19: 6 | S19: 0.5 | T19: =0-QUOTIENT(S19,5) -> 0 | U19: neck
A20: Harla Dar's Talisman | C20: =(I20*10)+M20+(D20*4)+G20+(L20/5)+(F20*2)+(E20*2)+(K20*2)+(O20/2)+(Q20/2)+(R20/2)+(N20/4)+(P20/4) -> 178 | D20: 7 | E20: 6 | F20: 6 | G20: 6 | H20: 6 | I20: 6 | J20: 6 | K20: 6 | L20: 30 | M20: 30 | N20: 6 | O20: 6 | P20: 6 | Q20: 6 | R20: 6 | S20: 0.5 | T20: =0-QUOTIENT(S20,5) -> 0 | U20: neck
A21: Ionat's Talisman | C21: =(I21*10)+M21+(D21*4)+G21+(L21/5)+(F21*2)+(E21*2)+(K21*2)+(O21/2)+(Q21/2)+(R21/2)+(N21/4)+(P21/4) -> 178 | D21: 7 | E21: 6 | F21: 6 | G21: 6 | H21: 6 | I21: 6 | J21: 6 | K21: 6 | L21: 30 | M21: 30 | N21: 6 | O21: 6 | P21: 6 | Q21: 6 | R21: 6 | S21: 0.5 | T21: =0-QUOTIENT(S21,5) -> 0 | U21: neck
A22: Jen Sapara's Talisman | C22: =(I22*10)+M22+(D22*4)+G22+(L22/5)+(F22*2)+(E22*2)+(K22*2)+(O22/2)+(Q22/2)+(R22/2)+(N22/4)+(P22/4) -> 178 | D22: 7 | E22: 6 | F22: 6 | G22: 6 | H22: 6 | I22: 6 | J22: 6 | K22: 6 | L22: 30 | M22: 30 | N22: 6 | O22: 6 | P22: 6 | Q22: 6 | R22: 6 | S22: 0.5 | T22: =0-QUOTIENT(S22,5) -> 0 | U22: neck
A23: Kar Sapara's Talisman | C23: =(I23*10)+M23+(D23*4)+G23+(L23/5)+(F23*2)+(E23*2)+(K23*2)+(O23/2)+(Q23/2)+(R23/2)+(N23/4)+(P23/4) -> 178 | D23: 7 | E23: 6 | F23: 6 | G23: 6 | H23: 6 | I23: 6 | J23: 6 | K23: 6 | L23: 30 | M23: 30 | N23: 6 | O23: 6 | P23: 6 | Q23: 6 | R23: 6 | S23: 0.5 | T23: =0-QUOTIENT(S23,5) -> 0 | U23: neck
A24: Karkona's Talisman | C24: =(I24*10)+M24+(D24*4)+G24+(L24/5)+(F24*2)+(E24*2)+(K24*2)+(O24/2)+(Q24/2)+(R24/2)+(N24/4)+(P24/4) -> 178 | D24: 7 | E24: 6 | F24: 6 | G24: 6 | H24: 6 | I24: 6 | J24: 6 | K24: 6 | L24: 30 | M24: 30 | N24: 6 | O24: 6 | P24: 6 | Q24: 6 | R24: 6 | S24: 0.5 | T24: =0-QUOTIENT(S24,5) -> 0 | U24: neck
A25: Lotus Vine Necklace | C25: =(I25*10)+M25+(D25*4)+G25+(L25/5)+(F25*2)+(E25*2)+(K25*2)+(O25/2)+(Q25/2)+(R25/2)+(N25/4)+(P25/4) -> 171 | D25: 9 | I25: 9 | M25: 45 | S25: 1 | U25: neck
A26: Bloodstar Pendant | C26: =(I26*10)+M26+(D26*4)+G26+(L26/5)+(F26*2)+(E26*2)+(K26*2)+(O26/2)+(Q26/2)+(R26/2)+(N26/4)+(P26/4) -> 156 | D26: 5 | E26: 9 | I26: 9 | J26: 9 | K26: 9 | N26: 5 | O26: 5 | P26: 5 | Q26: 5 | R26: 5 | S26: 00.1 | T26: =0-QUOTIENT(S26,5) -> 0 | U26: neck
A27: Escorpa's Talisman | C27: =(I27*10)+M27+(D27*4)+G27+(L27/5)+(F27*2)+(E27*2)+(K27*2)+(O27/2)+(Q27/2)+(R27/2)+(N27/4)+(P27/4) -> 143 | D27: 6 | E27: 5 | F27: 5 | G27: 5 | H27: 5 | I27: 5 | J27: 5 | K27: 5 | L27: 20 | M27: 20 | N27: 5 | O27: 5 | P27: 5 | Q27: 5 | R27: 5 | S27: 0.5 | T27: =0-QUOTIENT(S27,5) -> 0 | U27: neck
A28: Glati's Talisman | C28: =(I28*10)+M28+(D28*4)+G28+(L28/5)+(F28*2)+(E28*2)+(K28*2)+(O28/2)+(Q28/2)+(R28/2)+(N28/4)+(P28/4) -> 143 | D28: 6 | E28: 5 | F28: 5 | G28: 5 | H28: 5 | I28: 5 | J28: 5 | K28: 5 | L28: 20 | M28: 20 | N28: 5 | O28: 5 | P28: 5 | Q28: 5 | R28: 5 | S28: 0.5 | T28: =0-QUOTIENT(S28,5) -> 0 | U28: neck
A29: Neordla's Talisman | C29: =(I29*10)+M29+(D29*4)+G29+(L29/5)+(F29*2)+(E29*2)+(K29*2)+(O29/2)+(Q29/2)+(R29/2)+(N29/4)+(P29/4) -> 143 | D29: 6 | E29: 5 | F29: 5 | G29: 5 | H29: 5 | I29: 5 | J29: 5 | K29: 5 | L29: 20 | M29: 20 | N29: 5 | O29: 5 | P29: 5 | Q29: 5 | R29: 5 | S29: 0.5 | T29: =0-QUOTIENT(S29,5) -> 0 | U29: neck
A30: Silver Disk | C30: =(I30*10)+M30+(D30*4)+G30+(L30/5)+(F30*2)+(E30*2)+(K30*2)+(O30/2)+(Q30/2)+(R30/2)+(N30/4)+(P30/4) -> 137.5 | D30: 20 | F30: 15 | G30: 10 | H30: 25 | L30: 50 | O30: 15 | S30: 0.5 | T30: =0-QUOTIENT(S30,5) -> 0 | U30: neck
A31: Kin Lore Necklace | C31: =(I31*10)+M31+(D31*4)+G31+(L31/5)+(F31*2)+(E31*2)+(K31*2)+(O31/2)+(Q31/2)+(R31/2)+(N31/4)+(P31/4) -> 133 | D31: 0 | I31: 8 | M31: 45 | N31: 3 | O31: 5 | P31: 3 | Q31: 5 | R31: 3 | S31: 00.1 | T31: =0-QUOTIENT(S31,5) -> 0 | U31: neck
A32: Qeynos Badge of Honor | B32: See Invisible | C32: =(I32*10)+M32+(D32*4)+G32+(L32/5)+(F32*2)+(E32*2)+(K32*2)+(O32/2)+(Q32/2)+(R32/2)+(N32/4)+(P32/4)+30 -> 132 | D32: 5 | E32: 4 | G32: 4 | I32: 4 | J32: 4 | L32: 25 | M32: 25 | S32: 00.1 | T32: =0-QUOTIENT(S32,5) -> 0 | U32: neck
A33: Amulet of the Storm | C33: =(I33*10)+M33+(D33*4)+G33+(L33/5)+(F33*2)+(E33*2)+(K33*2)+(O33/2)+(Q33/2)+(R33/2)+(N33/4)+(P33/4) -> 117.5 | D33: 25 | N33: 10 | O33: 25 | P33: 10 | S33: 0 | T33: =0-QUOTIENT(S33,5) -> 0 | U33: neck
A34: Necklace of Superiority | C34: =(I34*10)+M34+(D34*4)+G34+(L34/5)+(F34*2)+(E34*2)+(K34*2)+(O34/2)+(Q34/2)+(R34/2)+(N34/4)+(P34/4) -> 117 | D34: 5 | E34: 5 | F34: 5 | G34: 5 | H34: 5 | I34: 5 | J34: 5 | K34: 5 | L34: 10 | M34: 10 | S34: 00.1 | T34: =0-QUOTIENT(S34,5) -> 0 | U34: neck
A35: Tserrina's Symbol | C35: =(I35*10)+M35+(D35*4)+G35+(L35/5)+(F35*2)+(E35*2)+(K35*2)+(O35/2)+(Q35/2)+(R35/2)+(N35/4)+(P35/4) -> 112 | D35: 3 | I35: 5 | J35: 5 | K35: 5 | M35: 40 | S35: 0 | T35: =0-QUOTIENT(S35,5) -> 0 | U35: neck
A36: Medallion of Life | C36: =(I36*10)+M36+(D36*4)+G36+(L36/5)+(F36*2)+(E36*2)+(K36*2)+(O36/2)+(Q36/2)+(R36/2)+(N36/4)+(P36/4) -> 110 | D36: 10 | E36: 5 | M36: 50 | N36: 5 | O36: 5 | P36: 5 | Q36: 5 | R36: 5 | S36: 00.1 | U36: neck
A37: Amcilla's Talisman | C37: =(I37*10)+M37+(D37*4)+G37+(L37/5)+(F37*2)+(E37*2)+(K37*2)+(O37/2)+(Q37/2)+(R37/2)+(N37/4)+(P37/4) -> 108 | D37: 5 | E37: 4 | F37: 4 | G37: 4 | H37: 4 | I37: 4 | J37: 4 | K37: 4 | L37: 10 | M37: 10 | N37: 4 | O37: 4 | P37: 4 | Q37: 4 | R37: 4 | S37: 0.5 | T37: =0-QUOTIENT(S37,5) -> 0 | U37: neck
A38: Atpaev's Talisman | C38: =(I38*10)+M38+(D38*4)+G38+(L38/5)+(F38*2)+(E38*2)+(K38*2)+(O38/2)+(Q38/2)+(R38/2)+(N38/4)+(P38/4) -> 108 | D38: 5 | E38: 4 | F38: 4 | G38: 4 | H38: 4 | I38: 4 | J38: 4 | K38: 4 | L38: 10 | M38: 10 | N38: 4 | O38: 4 | P38: 4 | Q38: 4 | R38: 4 | S38: 0.5 | T38: =0-QUOTIENT(S38,5) -> 0 | U38: neck
A39: Bone Amulet of Blade Turning | B39: Guard | C39: =(I39*10)+M39+(D39*4)+G39+(L39/5)+(F39*2)+(E39*2)+(K39*2)+(O39/2)+(Q39/2)+(R39/2)+(N39/4)+(P39/4)+30 -> 108 | D39: 2 | I39: 6 | M39: 10 | S39: 00.1 | T39: =0-QUOTIENT(S39,5) -> 0 | U39: neck
A40: Bratavar's Talisman | C40: =(I40*10)+M40+(D40*4)+G40+(L40/5)+(F40*2)+(E40*2)+(K40*2)+(O40/2)+(Q40/2)+(R40/2)+(N40/4)+(P40/4) -> 108 | D40: 5 | E40: 4 | F40: 4 | G40: 4 | H40: 4 | I40: 4 | J40: 4 | K40: 4 | L40: 10 | M40: 10 | N40: 4 | O40: 4 | P40: 4 | Q40: 4 | R40: 4 | S40: 0.5 | T40: =0-QUOTIENT(S40,5) -> 0 | U40: neck
A41: Bufa's Talisman | C41: =(I41*10)+M41+(D41*4)+G41+(L41/5)+(F41*2)+(E41*2)+(K41*2)+(O41/2)+(Q41/2)+(R41/2)+(N41/4)+(P41/4) -> 108 | D41: 5 | E41: 4 | F41: 4 | G41: 4 | H41: 4 | I41: 4 | J41: 4 | K41: 4 | L41: 10 | M41: 10 | N41: 4 | O41: 4 | P41: 4 | Q41: 4 | R41: 4 | S41: 0.5 | T41: =0-QUOTIENT(S41,5) -> 0 | U41: neck
A42: Cargalia's Talisman | C42: =(I42*10)+M42+(D42*4)+G42+(L42/5)+(F42*2)+(E42*2)+(K42*2)+(O42/2)+(Q42/2)+(R42/2)+(N42/4)+(P42/4) -> 108 | D42: 5 | E42: 4 | F42: 4 | G42: 4 | H42: 4 | I42: 4 | J42: 4 | K42: 4 | L42: 10 | M42: 10 | N42: 4 | O42: 4 | P42: 4 | Q42: 4 | R42: 4 | S42: 0.5 | T42: =0-QUOTIENT(S42,5) -> 0 | U42: neck
A43: Frakadar's Talisman | C43: =(I43*10)+M43+(D43*4)+G43+(L43/5)+(F43*2)+(E43*2)+(K43*2)+(O43/2)+(Q43/2)+(R43/2)+(N43/4)+(P43/4) -> 108 | D43: 5 | E43: 4 | F43: 4 | G43: 4 | H43: 4 | I43: 4 | J43: 4 | K43: 4 | L43: 10 | M43: 10 | N43: 4 | O43: 4 | P43: 4 | Q43: 4 | R43: 4 | S43: 0.5 | T43: =0-QUOTIENT(S43,5) -> 0 | U43: neck
A44: Gafala's Talisman | C44: =(I44*10)+M44+(D44*4)+G44+(L44/5)+(F44*2)+(E44*2)+(K44*2)+(O44/2)+(Q44/2)+(R44/2)+(N44/4)+(P44/4) -> 108 | D44: 5 | E44: 4 | F44: 4 | G44: 4 | H44: 4 | I44: 4 | J44: 4 | K44: 4 | L44: 10 | M44: 10 | N44: 4 | O44: 4 | P44: 4 | Q44: 4 | R44: 4 | S44: 0.5 | T44: =0-QUOTIENT(S44,5) -> 0 | U44: neck
A45: Gangel's Talisman | C45: =(I45*10)+M45+(D45*4)+G45+(L45/5)+(F45*2)+(E45*2)+(K45*2)+(O45/2)+(Q45/2)+(R45/2)+(N45/4)+(P45/4) -> 108 | D45: 5 | E45: 4 | F45: 4 | G45: 4 | H45: 4 | I45: 4 | J45: 4 | K45: 4 | L45: 10 | M45: 10 | N45: 4 | O45: 4 | P45: 4 | Q45: 4 | R45: 4 | S45: 0.5 | T45: =0-QUOTIENT(S45,5) -> 0 | U45: neck
A46: Hechaeva's Talisman | C46: =(I46*10)+M46+(D46*4)+G46+(L46/5)+(F46*2)+(E46*2)+(K46*2)+(O46/2)+(Q46/2)+(R46/2)+(N46/4)+(P46/4) -> 108 | D46: 5 | E46: 4 | F46: 4 | G46: 4 | H46: 4 | I46: 4 | J46: 4 | K46: 4 | L46: 10 | M46: 10 | N46: 4 | O46: 4 | P46: 4 | Q46: 4 | R46: 4 | S46: 0.5 | T46: =0-QUOTIENT(S46,5) -> 0 | U46: neck
A47: Honvar's Talisman | C47: =(I47*10)+M47+(D47*4)+G47+(L47/5)+(F47*2)+(E47*2)+(K47*2)+(O47/2)+(Q47/2)+(R47/2)+(N47/4)+(P47/4) -> 108 | D47: 5 | E47: 4 | F47: 4 | G47: 4 | H47: 4 | I47: 4 | J47: 4 | K47: 4 | L47: 10 | M47: 10 | N47: 4 | O47: 4 | P47: 4 | Q47: 4 | R47: 4 | S47: 0.5 | T47: =0-QUOTIENT(S47,5) -> 0 | U47: neck
A48: Linbrak's Talisman | C48: =(I48*10)+M48+(D48*4)+G48+(L48/5)+(F48*2)+(E48*2)+(K48*2)+(O48/2)+(Q48/2)+(R48/2)+(N48/4)+(P48/4) -> 108 | D48: 5 | E48: 4 | F48: 4 | G48: 4 | H48: 4 | I48: 4 | J48: 4 | K48: 4 | L48: 10 | M48: 10 | N48: 4 | O48: 4 | P48: 4 | Q48: 4 | R48: 4 | S48: 0.5 | T48: =0-QUOTIENT(S48,5) -> 0 | U48: neck
A49: Makala's Talisman | C49: =(I49*10)+M49+(D49*4)+G49+(L49/5)+(F49*2)+(E49*2)+(K49*2)+(O49/2)+(Q49/2)+(R49/2)+(N49/4)+(P49/4) -> 108 | D49: 5 | E49: 4 | F49: 4 | G49: 4 | H49: 4 | I49: 4 | J49: 4 | K49: 4 | L49: 10 | M49: 10 | N49: 4 | O49: 4 | P49: 4 | Q49: 4 | R49: 4 | S49: 0.5 | T49: =0-QUOTIENT(S49,5) -> 0 | U49: neck
A50: Mazi's Talisman | C50: =(I50*10)+M50+(D50*4)+G50+(L50/5)+(F50*2)+(E50*2)+(K50*2)+(O50/2)+(Q50/2)+(R50/2)+(N50/4)+(P50/4) -> 108 | D50: 5 | E50: 4 | F50: 4 | G50: 4 | H50: 4 | I50: 4 | J50: 4 | K50: 4 | L50: 10 | M50: 10 | N50: 4 | O50: 4 | P50: 4 | Q50: 4 | R50: 4 | S50: 0.5 | T50: =0-QUOTIENT(S50,5) -> 0 | U50: neck
A51: Myga's Talisman | C51: =(I51*10)+M51+(D51*4)+G51+(L51/5)+(F51*2)+(E51*2)+(K51*2)+(O51/2)+(Q51/2)+(R51/2)+(N51/4)+(P51/4) -> 108 | D51: 5 | E51: 4 | F51: 4 | G51: 4 | H51: 4 | I51: 4 | J51: 4 | K51: 4 | L51: 10 | M51: 10 | N51: 4 | O51: 4 | P51: 4 | Q51: 4 | R51: 4 | S51: 0.5 | T51: =0-QUOTIENT(S51,5) -> 0 | U51: neck
A52: Nyga's Talisman | C52: =(I52*10)+M52+(D52*4)+G52+(L52/5)+(F52*2)+(E52*2)+(K52*2)+(O52/2)+(Q52/2)+(R52/2)+(N52/4)+(P52/4) -> 108 | D52: 5 | E52: 4 | F52: 4 | G52: 4 | H52: 4 | I52: 4 | J52: 4 | K52: 4 | L52: 10 | M52: 10 | N52: 4 | O52: 4 | P52: 4 | Q52: 4 | R52: 4 | S52: 0.5 | T52: =0-QUOTIENT(S52,5) -> 0 | U52: neck
A53: Onava's Talisman | C53: =(I53*10)+M53+(D53*4)+G53+(L53/5)+(F53*2)+(E53*2)+(K53*2)+(O53/2)+(Q53/2)+(R53/2)+(N53/4)+(P53/4) -> 108 | D53: 5 | E53: 4 | F53: 4 | G53: 4 | H53: 4 | I53: 4 | J53: 4 | K53: 4 | L53: 10 | M53: 10 | N53: 4 | O53: 4 | P53: 4 | Q53: 4 | R53: 4 | S53: 0.5 | T53: =0-QUOTIENT(S53,5) -> 0 | U53: neck
A54: Pantrilla's Talisman | C54: =(I54*10)+M54+(D54*4)+G54+(L54/5)+(F54*2)+(E54*2)+(K54*2)+(O54/2)+(Q54/2)+(R54/2)+(N54/4)+(P54/4) -> 108 | D54: 5 | E54: 4 | F54: 4 | G54: 4 | H54: 4 | I54: 4 | J54: 4 | K54: 4 | L54: 10 | M54: 10 | N54: 4 | O54: 4 | P54: 4 | Q54: 4 | R54: 4 | S54: 0.5 | T54: =0-QUOTIENT(S54,5) -> 0 | U54: neck
A55: Uiliak's Talisman | C55: =(I55*10)+M55+(D55*4)+G55+(L55/5)+(F55*2)+(E55*2)+(K55*2)+(O55/2)+(Q55/2)+(R55/2)+(N55/4)+(P55/4) -> 108 | D55: 5 | E55: 4 | F55: 4 | G55: 4 | H55: 4 | I55: 4 | J55: 4 | K55: 4 | L55: 10 | M55: 10 | N55: 4 | O55: 4 | P55: 4 | Q55: 4 | R55: 4 | S55: 0.5 | T55: =0-QUOTIENT(S55,5) -> 0 | U55: neck
A56: Vitaela's Talisman | C56: =(I56*10)+M56+(D56*4)+G56+(L56/5)+(F56*2)+(E56*2)+(K56*2)+(O56/2)+(Q56/2)+(R56/2)+(N56/4)+(P56/4) -> 108 | D56: 5 | E56: 4 | F56: 4 | G56: 4 | H56: 4 | I56: 4 | J56: 4 | K56: 4 | L56: 10 | M56: 10 | N56: 4 | O56: 4 | P56: 4 | Q56: 4 | R56: 4 | S56: 0.5 | T56: =0-QUOTIENT(S56,5) -> 0 | U56: neck
A57: Vraptin's Talisman | C57: =(I57*10)+M57+(D57*4)+G57+(L57/5)+(F57*2)+(E57*2)+(K57*2)+(O57/2)+(Q57/2)+(R57/2)+(N57/4)+(P57/4) -> 108 | D57: 5 | E57: 4 | F57: 4 | G57: 4 | H57: 4 | I57: 4 | J57: 4 | K57: 4 | L57: 10 | M57: 10 | N57: 4 | O57: 4 | P57: 4 | Q57: 4 | R57: 4 | S57: 0.5 | T57: =0-QUOTIENT(S57,5) -> 0 | U57: neck
A58: Yal's Talisman | C58: =(I58*10)+M58+(D58*4)+G58+(L58/5)+(F58*2)+(E58*2)+(K58*2)+(O58/2)+(Q58/2)+(R58/2)+(N58/4)+(P58/4) -> 108 | D58: 5 | E58: 4 | F58: 4 | G58: 4 | H58: 4 | I58: 4 | J58: 4 | K58: 4 | L58: 10 | M58: 10 | N58: 4 | O58: 4 | P58: 4 | Q58: 4 | R58: 4 | S58: 0.5 | T58: =0-QUOTIENT(S58,5) -> 0 | U58: neck
A59: Yeldema's Talisman | C59: =(I59*10)+M59+(D59*4)+G59+(L59/5)+(F59*2)+(E59*2)+(K59*2)+(O59/2)+(Q59/2)+(R59/2)+(N59/4)+(P59/4) -> 108 | D59: 5 | E59: 4 | F59: 4 | G59: 4 | H59: 4 | I59: 4 | J59: 4 | K59: 4 | L59: 10 | M59: 10 | N59: 4 | O59: 4 | P59: 4 | Q59: 4 | R59: 4 | S59: 0.5 | T59: =0-QUOTIENT(S59,5) -> 0 | U59: neck
A60: Warden Symbol of Tunare | B60: Grasping Roots | C60: =(I60*10)+M60+(D60*4)+G60+(L60/5)+(F60*2)+(E60*2)+(K60*2)+(O60/2)+(Q60/2)+(R60/2)+(N60/4)+(P60/4)+30 -> 107 | D60: 7 | I60: 3 | K60: 2 | M60: 15 | S60: 00.1 | T60: =0-QUOTIENT(S60,5) -> 0 | U60: neck
A61: Nilibik's Yew Affixed Amulet | C61: =(I61*10)+M61+(D61*4)+G61+(L61/5)+(F61*2)+(E61*2)+(K61*2)+(O61/2)+(Q61/2)+(R61/2)+(N61/4)+(P61/4) -> 103 | D61: 7 | I61: 5 | M61: 25 | S61: 00.1 | U61: neck
A62: Ornate Velium Pendant | B62: Alliance | C62: =(I62*10)+M62+(D62*4)+G62+(L62/5)+(F62*2)+(E62*2)+(K62*2)+(O62/2)+(Q62/2)+(R62/2)+(N62/4)+(P62/4)+30 -> 102 | D62: 0 | I62: 6 | K62: 6 | S62: 00.1 | T62: =0-QUOTIENT(S62,5) -> 0 | U62: neck
A63: Bloodtribe Fetish | C63: =(I63*10)+M63+(D63*4)+G63+(L63/5)+(F63*2)+(E63*2)+(K63*2)+(O63/2)+(Q63/2)+(R63/2)+(N63/4)+(P63/4) -> 98 | D63: 2 | I63: 8 | M63: 10 | S63: 0 | U63: neck
A64: Chancellor's Medal | C64: =(I64*10)+M64+(D64*4)+G64+(L64/5)+(F64*2)+(E64*2)+(K64*2)+(O64/2)+(Q64/2)+(R64/2)+(N64/4)+(P64/4) -> 97 | D64: 6 | E64: 4 | F64: 4 | G64: 4 | H64: 4 | I64: 4 | J64: 4 | K64: 4 | N64: 10 | P64: 10 | S64: 00.1 | U64: neck
A65: Shrouded Medallion | C65: =(I65*10)+M65+(D65*4)+G65+(L65/5)+(F65*2)+(E65*2)+(K65*2)+(O65/2)+(Q65/2)+(R65/2)+(N65/4)+(P65/4) -> 95.5 | D65: 12 | E65: 5 | M65: 25 | O65: 15 | Q65: 5 | R65: 5 | S65: 1 | U65: neck
A66: Disciple Symbol of Tunare | B66: Aloe Sweat | C66: =(I66*10)+M66+(D66*4)+G66+(L66/5)+(F66*2)+(E66*2)+(K66*2)+(O66/2)+(Q66/2)+(R66/2)+(N66/4)+(P66/4)+30 -> 79 | D66: 5 | I66: 2 | K66: 1 | M66: 7 | S66: 00.1 | T66: =0-QUOTIENT(S66,5) -> 0 | U66: neck
A67: Black Sapphire Velium Necklace | C67: =(I67*10)+M67+(D67*4)+G67+(L67/5)+(F67*2)+(E67*2)+(K67*2)+(O67/2)+(Q67/2)+(R67/2)+(N67/4)+(P67/4) -> 78 | D67: 0 | L67: 65 | M67: 65 | S67: 00.1 | T67: =0-QUOTIENT(S67,5) -> 0 | U67: neck
A68: Greater Talisman of Wistfulness | C68: =(I68*10)+M68+(D68*4)+G68+(L68/5)+(F68*2)+(E68*2)+(K68*2)+(O68/2)+(Q68/2)+(R68/2)+(N68/4)+(P68/4) -> 76 | D68: 4 | I68: 5 | J68: 5 | K68: 5 | S68: 0.5 | U68: neck
A69: Black Alloy Medallion | C69: =(I69*10)+M69+(D69*4)+G69+(L69/5)+(F69*2)+(E69*2)+(K69*2)+(O69/2)+(Q69/2)+(R69/2)+(N69/4)+(P69/4) -> 74 | D69: 6 | I69: 5 | J69: 5 | S69: 00.1 | T69: =0-QUOTIENT(S69,5) -> 0 | U69: neck
A70: Goranga Warbeads | C70: =(I70*10)+M70+(D70*4)+G70+(L70/5)+(F70*2)+(E70*2)+(K70*2)+(O70/2)+(Q70/2)+(R70/2)+(N70/4)+(P70/4) -> 74 | D70: 7 | E70: 3 | I70: 4 | J70: 4 | S70: 00.1 | U70: neck
A71: Amulet of Insight | C71: =(I71*10)+M71+(D71*4)+G71+(L71/5)+(F71*2)+(E71*2)+(K71*2)+(O71/2)+(Q71/2)+(R71/2)+(N71/4)+(P71/4) -> 73 | D71: 2 | E71: 3 | F71: 3 | I71: 3 | J71: 3 | K71: 3 | L71: 10 | M71: 10 | O71: 5 | R71: 5 | S71: 00.1 | T71: =0-QUOTIENT(S71,5) -> 0 | U71: neck
A72: Researcher's Badge | C72: =(I72*10)+M72+(D72*4)+G72+(L72/5)+(F72*2)+(E72*2)+(K72*2)+(O72/2)+(Q72/2)+(R72/2)+(N72/4)+(P72/4) -> 73 | D72: 4 | E72: 3 | G72: 3 | I72: 3 | J72: 3 | L72: 15 | M72: 15 | S72: 00.1 | T72: =0-QUOTIENT(S72,5) -> 0 | U72: neck
A73: Dabner's Amulet of Elements | C73: =(I73*10)+M73+(D73*4)+G73+(L73/5)+(F73*2)+(E73*2)+(K73*2)+(O73/2)+(Q73/2)+(R73/2)+(N73/4)+(P73/4) -> 71 | D73: 4 | M73: 50 | Q73: 5 | R73: 5 | S73: 4 | T73: =0-QUOTIENT(S73,5) -> 0 | U73: neck
A74: Chrysoberyl Talisman | C74: =(I74*10)+M74+(D74*4)+G74+(L74/5)+(F74*2)+(E74*2)+(K74*2)+(O74/2)+(Q74/2)+(R74/2)+(N74/4)+(P74/4) -> 70 | D74: 5 | I74: 3 | M74: 20 | S74: 1 | T74: =0-QUOTIENT(S74,5) -> 0 | U74: neck
A75: Black Sapphire Platinum Necklace | C75: =(I75*10)+M75+(D75*4)+G75+(L75/5)+(F75*2)+(E75*2)+(K75*2)+(O75/2)+(Q75/2)+(R75/2)+(N75/4)+(P75/4) -> 66 | D75: 0 | L75: 55 | M75: 55 | S75: 0 | T75: =0-QUOTIENT(S75,5) -> 0 | U75: neck
A76: Rough Silver Chain | C76: =(I76*10)+M76+(D76*4)+G76+(L76/5)+(F76*2)+(E76*2)+(K76*2)+(O76/2)+(Q76/2)+(R76/2)+(N76/4)+(P76/4) -> 66 | D76: 5 | L76: 30 | M76: 30 | N76: 5 | O76: 5 | P76: 5 | Q76: 5 | R76: 5 | S76: 00.3 | T76: =0-QUOTIENT(S76,5) -> 0 | U76: neck
A77: Shaderock Amulet | C77: =(I77*10)+M77+(D77*4)+G77+(L77/5)+(F77*2)+(E77*2)+(K77*2)+(O77/2)+(Q77/2)+(R77/2)+(N77/4)+(P77/4) -> 62 | D77: 3 | E77: 10 | F77: 5 | L77: 100 | S77: 00.2 | U77: neck
A78: A Cracked Amulet | C78: =(I78*10)+M78+(D78*4)+G78+(L78/5)+(F78*2)+(E78*2)+(K78*2)+(O78/2)+(Q78/2)+(R78/2)+(N78/4)+(P78/4) -> 61 | D78: 4 | I78: 3 | M78: 15 | S78: 00.1 | U78: neck
A79: Siren Hair Locket | C79: =(I79*10)+M79+(D79*4)+G79+(L79/5)+(F79*2)+(E79*2)+(K79*2)+(O79/2)+(Q79/2)+(R79/2)+(N79/4)+(P79/4) -> 60.5 | D79: 2 | M79: 50 | O79: 5 | S79: 0.5 | T79: =0-QUOTIENT(S79,5) -> 0 | U79: neck
A80: Bloodshrine Necklace | B80: Greater Healing | C80: =(I80*10)+M80+(D80*4)+G80+(L80/5)+(F80*2)+(E80*2)+(K80*2)+(O80/2)+(Q80/2)+(R80/2)+(N80/4)+(P80/4)+30 -> 60 | D80: 5 | L80: 50 | S80: 0.5 | T80: =0-QUOTIENT(S80,5) -> 0 | U80: neck
A81: Bone Collar of the Possessed | C81: =(I81*10)+M81+(D81*4)+G81+(L81/5)+(F81*2)+(E81*2)+(K81*2)+(O81/2)+(Q81/2)+(R81/2)+(N81/4)+(P81/4) -> 60 | D81: 0 | E81: 3 | F81: 3 | I81: 3 | J81: 3 | K81: 3 | L81: 10 | M81: 10 | S81: 2 | U81: neck
A82: Spider Fur Collar | C82: =(I82*10)+M82+(D82*4)+G82+(L82/5)+(F82*2)+(E82*2)+(K82*2)+(O82/2)+(Q82/2)+(R82/2)+(N82/4)+(P82/4) -> 59.25 | D82: 10 | E82: 7 | N82: 7 | R82: 7 | S82: 3 | T82: =0-QUOTIENT(S82,5) -> 0 | U82: neck
A83: Imbued Elven Chainmail Neckguard | C83: =(I83*10)+M83+(D83*4)+G83+(L83/5)+(F83*2)+(E83*2)+(K83*2)+(O83/2)+(Q83/2)+(R83/2)+(N83/4)+(P83/4) -> 59 | D83: 6 | I83: 3 | J83: 3 | K83: 2 | O83: 2 | S83: 00.2 | T83: =0-QUOTIENT(S83,5) -> 0 | U83: neck
A84: Rune Covered Torque | C84: =(I84*10)+M84+(D84*4)+G84+(L84/5)+(F84*2)+(E84*2)+(K84*2)+(O84/2)+(Q84/2)+(R84/2)+(N84/4)+(P84/4) -> 58 | D84: 7 | I84: 3 | J84: 3 | S84: 00.2 | T84: =0-QUOTIENT(S84,5) -> 0 | U84: neck
A85: Spiked Leather Wolf Collar | C85: =(I85*10)+M85+(D85*4)+G85+(L85/5)+(F85*2)+(E85*2)+(K85*2)+(O85/2)+(Q85/2)+(R85/2)+(N85/4)+(P85/4) -> 57 | D85: 3 | I85: 3 | M85: 15 | S85: 1 | T85: =0-QUOTIENT(S85,5) -> 0 | U85: neck
A86: Withered Leather Gorget | C86: =(I86*10)+M86+(D86*4)+G86+(L86/5)+(F86*2)+(E86*2)+(K86*2)+(O86/2)+(Q86/2)+(R86/2)+(N86/4)+(P86/4) -> 57 | D86: 4 | I86: 3 | M86: 5 | N86: 3 | O86: 3 | P86: 3 | Q86: 3 | R86: 3 | S86: 0.5 | T86: =0-QUOTIENT(S86,5) -> 0 | U86: neck
A87: Labyrinth Talisman | C87: =(I87*10)+M87+(D87*4)+G87+(L87/5)+(F87*2)+(E87*2)+(K87*2)+(O87/2)+(Q87/2)+(R87/2)+(N87/4)+(P87/4) -> 56 | D87: 5 | F87: 3 | I87: 3 | S87: 00.2 | T87: =0-QUOTIENT(S87,5) -> 0 | U87: neck
A88: Pendant of Salvation | B88: Divine Aura | C88: =(I88*10)+M88+(D88*4)+G88+(L88/5)+(F88*2)+(E88*2)+(K88*2)+(O88/2)+(Q88/2)+(R88/2)+(N88/4)+(P88/4)+30 -> 56 | D88: 5 | G88: 3 | L88: 15 | S88: 0 | T88: =0-QUOTIENT(S88,5) -> 0 | U88: neck
A89: Initiate Symbol of Tunare | B89: Echinacea Infusion | C89: =(I89*10)+M89+(D89*4)+G89+(L89/5)+(F89*2)+(E89*2)+(K89*2)+(O89/2)+(Q89/2)+(R89/2)+(N89/4)+(P89/4)+30 -> 55 | D89: 3 | I89: 1 | M89: 3 | S89: 00.1 | T89: =0-QUOTIENT(S89,5) -> 0 | U89: neck
A90: Laoch Meditation Beads | C90: =(I90*10)+M90+(D90*4)+G90+(L90/5)+(F90*2)+(E90*2)+(K90*2)+(O90/2)+(Q90/2)+(R90/2)+(N90/4)+(P90/4) -> 52.5 | D90: 1 | E90: 2 | I90: 4 | L90: 10 | Q90: 5 | S90: 00.1 | T90: =0-QUOTIENT(S90,5) -> 0 | U90: neck
A91: Glowing Bone Collar | C91: =(I91*10)+M91+(D91*4)+G91+(L91/5)+(F91*2)+(E91*2)+(K91*2)+(O91/2)+(Q91/2)+(R91/2)+(N91/4)+(P91/4) -> 50 | D91: 5 | L91: 25 | M91: 25 | S91: 00.4 | T91: =0-QUOTIENT(S91,5) -> 0 | U91: neck
A92: Thorax of the Hivemistress | C92: =(I92*10)+M92+(D92*4)+G92+(L92/5)+(F92*2)+(E92*2)+(K92*2)+(O92/2)+(Q92/2)+(R92/2)+(N92/4)+(P92/4) -> 48.5 | D92: 10 | E92: 2 | G92: 2 | Q92: 5 | S92: 1 | U92: neck
A93: Crystaline Torque | C93: =(I93*10)+M93+(D93*4)+G93+(L93/5)+(F93*2)+(E93*2)+(K93*2)+(O93/2)+(Q93/2)+(R93/2)+(N93/4)+(P93/4) -> 48 | D93: 12 | S93: 0 | T93: =0-QUOTIENT(S93,5) -> 0 | U93: neck
A94: Netted Kelp Choker | C94: =(I94*10)+M94+(D94*4)+G94+(L94/5)+(F94*2)+(E94*2)+(K94*2)+(O94/2)+(Q94/2)+(R94/2)+(N94/4)+(P94/4) -> 47 | D94: 4 | E94: 3 | I94: 3 | J94: 2 | K94: -3 | Q94: 2 | S94: 00.2 | T94: =0-QUOTIENT(S94,5) -> 0 | U94: neck
A95: Azibelle's Scarf of the Night | C95: =(I95*10)+M95+(D95*4)+G95+(L95/5)+(F95*2)+(E95*2)+(K95*2)+(O95/2)+(Q95/2)+(R95/2)+(N95/4)+(P95/4) -> 46 | D95: 5 | L95: 30 | N95: 10 | O95: 10 | P95: 10 | Q95: 10 | R95: 10 | S95: 00.1 | T95: =0-QUOTIENT(S95,5) -> 0 | U95: neck
A96: Cheetah Paw Fetish | C96: =(I96*10)+M96+(D96*4)+G96+(L96/5)+(F96*2)+(E96*2)+(K96*2)+(O96/2)+(Q96/2)+(R96/2)+(N96/4)+(P96/4) -> 46 | D96: 0 | I96: 3 | J96: 3 | K96: 2 | L96: 10 | M96: 10 | S96: 0 | U96: neck
A97: Choker of Majdd | B97: See Invisible | C97: =(I97*10)+M97+(D97*4)+G97+(L97/5)+(F97*2)+(E97*2)+(K97*2)+(O97/2)+(Q97/2)+(R97/2)+(N97/4)+(P97/4)+30 -> 46 | D97: 4 | J97: 5 | S97: 00.1 | T97: =0-QUOTIENT(S97,5) -> 0 | U97: neck
A98: Enchanted Elven Chainmail Neckguard | C98: =(I98*10)+M98+(D98*4)+G98+(L98/5)+(F98*2)+(E98*2)+(K98*2)+(O98/2)+(Q98/2)+(R98/2)+(N98/4)+(P98/4) -> 46 | D98: 6 | I98: 2 | J98: 2 | O98: 4 | S98: 00.4 | T98: =0-QUOTIENT(S98,5) -> 0 | U98: neck
A99: Interrogator's Badge | C99: =(I99*10)+M99+(D99*4)+G99+(L99/5)+(F99*2)+(E99*2)+(K99*2)+(O99/2)+(Q99/2)+(R99/2)+(N99/4)+(P99/4) -> 46 | D99: 2 | E99: 2 | G99: 2 | I99: 2 | J99: 2 | L99: 10 | M99: 10 | S99: 00.1 | T99: =0-QUOTIENT(S99,5) -> 0 | U99: neck
A100: Yelloweyes Collar | C100: =(I100*10)+M100+(D100*4)+G100+(L100/5)+(F100*2)+(E100*2)+(K100*2)+(O100/2)+(Q100/2)+(R100/2)+(N100/4)+(P100/4) -> 46 | D100: 5 | E100: 3 | I100: 2 | S100: 00.4 | U100: neck
A101: Cobalt Drake Gorget | C101: =(I101*10)+M101+(D101*4)+G101+(L101/5)+(F101*2)+(E101*2)+(K101*2)+(O101/2)+(Q101/2)+(R101/2)+(N101/4)+(P101/4) -> 45 | D101: 7 | F101: 5 | M101: 5 | R101: 4 | S101: 0.5 | T101: =0-QUOTIENT(S101,5) -> 0 | U101: neck
A102: Imbued Golden Black Pearl Choker | C102: =(I102*10)+M102+(D102*4)+G102+(L102/5)+(F102*2)+(E102*2)+(K102*2)+(O102/2)+(Q102/2)+(R102/2)+(N102/4)+(P102/4) -> 45 | D102: 0 | G102: 5 | H102: 5 | I102: 4 | S102: 00.1 | T102: =0-QUOTIENT(S102,5) -> 0 | U102: neck
A103: Etched Ivory Charm | C103: =(I103*10)+M103+(D103*4)+G103+(L103/5)+(F103*2)+(E103*2)+(K103*2)+(O103/2)+(Q103/2)+(R103/2)+(N103/4)+(P103/4) -> 44 | D103: 5 | E103: 2 | I103: 2 | J103: 2 | S103: 0.5 | T103: =0-QUOTIENT(S103,5) -> 0 | U103: neck
A104: Lesser Talisman of Wistfulness | C104: =(I104*10)+M104+(D104*4)+G104+(L104/5)+(F104*2)+(E104*2)+(K104*2)+(O104/2)+(Q104/2)+(R104/2)+(N104/4)+(P104/4) -> 44 | D104: 2 | I104: 3 | J104: 3 | K104: 3 | S104: 0.5 | U104: neck
A105: Sapphire Platinum Necklace | C105: =(I105*10)+M105+(D105*4)+G105+(L105/5)+(F105*2)+(E105*2)+(K105*2)+(O105/2)+(Q105/2)+(R105/2)+(N105/4)+(P105/4)+30 -> 44 | D105: 0 | E105: 7 | J105: 7 | S105: 00.1 | T105: =0-QUOTIENT(S105,5) -> 0 | U105: neck
A106: Spider Fang Choker | C106: =(I106*10)+M106+(D106*4)+G106+(L106/5)+(F106*2)+(E106*2)+(K106*2)+(O106/2)+(Q106/2)+(R106/2)+(N106/4)+(P106/4) -> 43 | D106: 3 | F106: 2 | G106: 2 | M106: 20 | O106: 5 | R106: 5 | S106: 00.1 | T106: =0-QUOTIENT(S106,5) -> 0 | U106: neck
A107: Golden Blue Diamond Pendant | C107: =(I107*10)+M107+(D107*4)+G107+(L107/5)+(F107*2)+(E107*2)+(K107*2)+(O107/2)+(Q107/2)+(R107/2)+(N107/4)+(P107/4) -> 36 | D107: 0 | M107: 20 | N107: 6 | O107: 4 | P107: 6 | Q107: 11 | R107: 11 | S107: 00.1 | T107: =0-QUOTIENT(S107,5) -> 0 | U107: neck
A108: Imbued Mithril Reinforced Gorget | C108: =(I108*10)+M108+(D108*4)+G108+(L108/5)+(F108*2)+(E108*2)+(K108*2)+(O108/2)+(Q108/2)+(R108/2)+(N108/4)+(P108/4) -> 36 | D108: 6 | I108: 1 | K108: 1 | S108: 00.4 | T108: =0-QUOTIENT(S108,5) -> 0 | U108: neck
A109: Imbued Vale Reinforced Gorget (K) | C109: =(I109*10)+M109+(D109*4)+G109+(L109/5)+(F109*2)+(E109*2)+(K109*2)+(O109/2)+(Q109/2)+(R109/2)+(N109/4)+(P109/4) -> 36 | D109: 6 | F109: 1 | I109: 1 | S109: 00.4 | T109: =0-QUOTIENT(S109,5) -> 0 | U109: neck
A110: Orc Fang Necklace | C110: =(I110*10)+M110+(D110*4)+G110+(L110/5)+(F110*2)+(E110*2)+(K110*2)+(O110/2)+(Q110/2)+(R110/2)+(N110/4)+(P110/4) -> 35 | D110: 5 | E110: 3 | F110: 3 | G110: 3 | S110: 1 | T110: =0-QUOTIENT(S110,5) -> 0 | U110: neck
A111: Platinum-Plated Pearl Necklace | C111: =(I111*10)+M111+(D111*4)+G111+(L111/5)+(F111*2)+(E111*2)+(K111*2)+(O111/2)+(Q111/2)+(R111/2)+(N111/4)+(P111/4) -> 35 | D111: 3 | L111: 15 | M111: 15 | Q111: 5 | R111: 5 | S111: 00.3 | T111: =0-QUOTIENT(S111,5) -> 0 | U111: neck
A112: Runed Lava Pendant | C112: =(I112*10)+M112+(D112*4)+G112+(L112/5)+(F112*2)+(E112*2)+(K112*2)+(O112/2)+(Q112/2)+(R112/2)+(N112/4)+(P112/4) -> 34.5 | D112: 5 | E112: 6 | Q112: 5 | S112: 00.2 | T112: =0-QUOTIENT(S112,5) -> 0 | U112: neck
A113: Fire Seared Gorget | C113: =(I113*10)+M113+(D113*4)+G113+(L113/5)+(F113*2)+(E113*2)+(K113*2)+(O113/2)+(Q113/2)+(R113/2)+(N113/4)+(P113/4) -> 33 | D113: 7 | Q113: 10 | S113: 1 | T113: =0-QUOTIENT(S113,5) -> 0 | U113: neck
A114: Imbued Mithril Studded Gorget | C114: =(I114*10)+M114+(D114*4)+G114+(L114/5)+(F114*2)+(E114*2)+(K114*2)+(O114/2)+(Q114/2)+(R114/2)+(N114/4)+(P114/4) -> 32 | D114: 5 | I114: 1 | K114: 1 | S114: 00.4 | T114: =0-QUOTIENT(S114,5) -> 0 | U114: neck
A115: Imbued Vale Studded Gorget (K) | C115: =(I115*10)+M115+(D115*4)+G115+(L115/5)+(F115*2)+(E115*2)+(K115*2)+(O115/2)+(Q115/2)+(R115/2)+(N115/4)+(P115/4) -> 32 | D115: 5 | F115: 1 | I115: 1 | S115: 00.4 | T115: =0-QUOTIENT(S115,5) -> 0 | U115: neck
A116: Ognit's Aqua Collar | C116: =(I116*10)+M116+(D116*4)+G116+(L116/5)+(F116*2)+(E116*2)+(K116*2)+(O116/2)+(Q116/2)+(R116/2)+(N116/4)+(P116/4) -> 32 | D116: 8 | S116: 0.5 | T116: =0-QUOTIENT(S116,5) -> 0 | U116: neck
A117: Choker of the Overseer | C117: =(I117*10)+M117+(D117*4)+G117+(L117/5)+(F117*2)+(E117*2)+(K117*2)+(O117/2)+(Q117/2)+(R117/2)+(N117/4)+(P117/4) -> 31.75 | D117: 5 | G117: 5 | H117: 5 | L117: 15 | N117: 5 | Q117: 5 | S117: 3 | U117: neck
A118: A Chipped Opal Amulet | C118: =(I118*10)+M118+(D118*4)+G118+(L118/5)+(F118*2)+(E118*2)+(K118*2)+(O118/2)+(Q118/2)+(R118/2)+(N118/4)+(P118/4) -> 30.75 | D118: 3 | N118: 15 | O118: 15 | R118: 15 | S118: 00.1 | T118: =0-QUOTIENT(S118,5) -> 0 | U118: neck
A119: A Lucky Skunk Foot | C119: =(I119*10)+M119+(D119*4)+G119+(L119/5)+(F119*2)+(E119*2)+(K119*2)+(O119/2)+(Q119/2)+(R119/2)+(N119/4)+(P119/4) -> 30 | D119: 5 | N119: 5 | O119: 5 | P119: 5 | Q119: 5 | R119: 5 | S119: 00.1 | T119: =0-QUOTIENT(S119,5) -> 0 | U119: neck
A120: Black Iron Medallion | C120: =(I120*10)+M120+(D120*4)+G120+(L120/5)+(F120*2)+(E120*2)+(K120*2)+(O120/2)+(Q120/2)+(R120/2)+(N120/4)+(P120/4) -> 30 | D120: 0 | I120: 3 | J120: 3 | S120: 00.1 | T120: =0-QUOTIENT(S120,5) -> 0 | U120: neck
A121: Black Sapphire Silver Necklace | C121: =(I121*10)+M121+(D121*4)+G121+(L121/5)+(F121*2)+(E121*2)+(K121*2)+(O121/2)+(Q121/2)+(R121/2)+(N121/4)+(P121/4) -> 30 | D121: 0 | L121: 25 | M121: 25 | S121: 00.1 | T121: =0-QUOTIENT(S121,5) -> 0 | U121: neck
A122: Chipped Velium Amulet | C122: =(I122*10)+M122+(D122*4)+G122+(L122/5)+(F122*2)+(E122*2)+(K122*2)+(O122/2)+(Q122/2)+(R122/2)+(N122/4)+(P122/4) -> 30 | D122: 4 | E122: 4 | L122: 30 | S122: 00.1 | T122: =0-QUOTIENT(S122,5) -> 0 | U122: neck
A123: Locket of Escape | B123: Bind Affinity | C123: =(I123*10)+M123+(D123*4)+G123+(L123/5)+(F123*2)+(E123*2)+(K123*2)+(O123/2)+(Q123/2)+(R123/2)+(N123/4)+(P123/4)+30 -> 30 | D123: 0 | S123: 00.1 | T123: =0-QUOTIENT(S123,5) -> 0 | U123: neck
A124: Ornately Runed Shell Necklace | B124: Enduring Breath | C124: =(I124*10)+M124+(D124*4)+G124+(L124/5)+(F124*2)+(E124*2)+(K124*2)+(O124/2)+(Q124/2)+(R124/2)+(N124/4)+(P124/4)+30 -> 30 | D124: 0 | S124: 0.5 | T124: =0-QUOTIENT(S124,5) -> 0 | U124: neck
A125: Runed Shell Necklace | B125: Enduring Breath | C125: =(I125*10)+M125+(D125*4)+G125+(L125/5)+(F125*2)+(E125*2)+(K125*2)+(O125/2)+(Q125/2)+(R125/2)+(N125/4)+(P125/4)+30 -> 30 | D125: 0 | S125: 0.5 | T125: =0-QUOTIENT(S125,5) -> 0 | U125: neck
A126: Talisman of the Flame | C126: =(I126*10)+M126+(D126*4)+G126+(L126/5)+(F126*2)+(E126*2)+(K126*2)+(O126/2)+(Q126/2)+(R126/2)+(N126/4)+(P126/4) -> 30 | D126: 4 | E126: 1 | I126: 1 | K126: 1 | S126: 0.5 | U126: neck
A127: A Gypsy Medallion | C127: =(I127*10)+M127+(D127*4)+G127+(L127/5)+(F127*2)+(E127*2)+(K127*2)+(O127/2)+(Q127/2)+(R127/2)+(N127/4)+(P127/4) -> 28.5 | D127: 2 | K127: 9 | P127: 10 | S127: 00.1 | T127: =0-QUOTIENT(S127,5) -> 0 | U127: neck
A128: Chipped Bone Collar | C128: =(I128*10)+M128+(D128*4)+G128+(L128/5)+(F128*2)+(E128*2)+(K128*2)+(O128/2)+(Q128/2)+(R128/2)+(N128/4)+(P128/4) -> 28 | D128: 4 | L128: 10 | M128: 10 | S128: 2 | T128: =0-QUOTIENT(S128,5) -> 0 | U128: neck
A129: Ivory Pendant | C129: =(I129*10)+M129+(D129*4)+G129+(L129/5)+(F129*2)+(E129*2)+(K129*2)+(O129/2)+(Q129/2)+(R129/2)+(N129/4)+(P129/4) -> 28 | D129: 2 | I129: 2 | J129: 2 | S129: 1 | T129: =0-QUOTIENT(S129,5) -> 0 | U129: neck
A130: Velium Topaz Necklace | C130: =(I130*10)+M130+(D130*4)+G130+(L130/5)+(F130*2)+(E130*2)+(K130*2)+(O130/2)+(Q130/2)+(R130/2)+(N130/4)+(P130/4) -> 27.5 | D130: 6 | P130: 14 | S130: 00.1 | T130: =0-QUOTIENT(S130,5) -> 0 | U130: neck
A131: Coterie Gorget | C131: =(I131*10)+M131+(D131*4)+G131+(L131/5)+(F131*2)+(E131*2)+(K131*2)+(O131/2)+(Q131/2)+(R131/2)+(N131/4)+(P131/4) -> 26.1 | D131: 6 | E131: 1 | L131: 3 | Q131: -1 | S131: 0.5 | U131: neck
A132: Goblin Choker | C132: =(I132*10)+M132+(D132*4)+G132+(L132/5)+(F132*2)+(E132*2)+(K132*2)+(O132/2)+(Q132/2)+(R132/2)+(N132/4)+(P132/4) -> 26 | D132: 4 | E132: 2 | F132: 2 | G132: 2 | H132: 2 | S132: 1 | T132: =0-QUOTIENT(S132,5) -> 0 | U132: neck
A133: Amulet of the Grey Wastes | B133: Enduring Breath | C133: =(I133*10)+M133+(D133*4)+G133+(L133/5)+(F133*2)+(E133*2)+(K133*2)+(O133/2)+(Q133/2)+(R133/2)+(N133/4)+(P133/4) -> 24 | D133: 0 | F133: 10 | O133: 4 | R133: 4 | S133: 00.1 | U133: neck
A134: Golden Opal Amulet | C134: =(I134*10)+M134+(D134*4)+G134+(L134/5)+(F134*2)+(E134*2)+(K134*2)+(O134/2)+(Q134/2)+(R134/2)+(N134/4)+(P134/4) -> 24 | D134: 0 | F134: 9 | G134: 6 | S134: 00.1 | T134: =0-QUOTIENT(S134,5) -> 0 | U134: neck
A135: Mithril Reinforced Gorget | C135: =(I135*10)+M135+(D135*4)+G135+(L135/5)+(F135*2)+(E135*2)+(K135*2)+(O135/2)+(Q135/2)+(R135/2)+(N135/4)+(P135/4) -> 24 | D135: 6 | S135: 00.4 | T135: =0-QUOTIENT(S135,5) -> 0 | U135: neck
A136: Studded Leather Wolf Collar | C136: =(I136*10)+M136+(D136*4)+G136+(L136/5)+(F136*2)+(E136*2)+(K136*2)+(O136/2)+(Q136/2)+(R136/2)+(N136/4)+(P136/4) -> 24 | D136: 5 | E136: 2 | S136: 1 | T136: =0-QUOTIENT(S136,5) -> 0 | U136: neck
A137: Vale Reinforced Gorget | C137: =(I137*10)+M137+(D137*4)+G137+(L137/5)+(F137*2)+(E137*2)+(K137*2)+(O137/2)+(Q137/2)+(R137/2)+(N137/4)+(P137/4) -> 24 | D137: 6 | S137: 00.4 | T137: =0-QUOTIENT(S137,5) -> 0 | U137: neck
A138: Collar of Undead Protection | C138: =(I138*10)+M138+(D138*4)+G138+(L138/5)+(F138*2)+(E138*2)+(K138*2)+(O138/2)+(Q138/2)+(R138/2)+(N138/4)+(P138/4) -> 23.5 | D138: 5 | N138: 7 | P138: 7 | S138: 00.2 | T138: =0-QUOTIENT(S138,5) -> 0 | U138: neck
A139: Investigator's Badge | C139: =(I139*10)+M139+(D139*4)+G139+(L139/5)+(F139*2)+(E139*2)+(K139*2)+(O139/2)+(Q139/2)+(R139/2)+(N139/4)+(P139/4) -> 23 | D139: 1 | E139: 1 | G139: 1 | I139: 1 | J139: 1 | L139: 5 | M139: 5 | S139: 00.1 | T139: =0-QUOTIENT(S139,5) -> 0 | U139: neck
A140: Tro Jeg Official's Badge | C140: =(I140*10)+M140+(D140*4)+G140+(L140/5)+(F140*2)+(E140*2)+(K140*2)+(O140/2)+(Q140/2)+(R140/2)+(N140/4)+(P140/4) -> 23 | D140: 2 | E140: 2 | F140: 4 | L140: 10 | O140: 2 | S140: 00.2 | U140: neck
A141: Golden Pearl Choker | C141: =(I141*10)+M141+(D141*4)+G141+(L141/5)+(F141*2)+(E141*2)+(K141*2)+(O141/2)+(Q141/2)+(R141/2)+(N141/4)+(P141/4) -> 22.25 | D141: 5 | N141: 9 | S141: 00.1 | T141: =0-QUOTIENT(S141,5) -> 0 | U141: neck
A142: Necklace of the Refugee | C142: =(I142*10)+M142+(D142*4)+G142+(L142/5)+(F142*2)+(E142*2)+(K142*2)+(O142/2)+(Q142/2)+(R142/2)+(N142/4)+(P142/4) -> 22 | D142: 2 | E142: 3 | L142: 20 | N142: 2 | O142: 2 | P142: 2 | Q142: 2 | R142: 2 | S142: 00.1 | U142: neck
A143: Cape of Midnight Mist | C143: =(I143*10)+M143+(D143*4)+G143+(L143/5)+(F143*2)+(E143*2)+(K143*2)+(O143/2)+(Q143/2)+(R143/2)+(N143/4)+(P143/4) -> 21.5 | D143: 2 | E143: 5 | O143: 7 | S143: 00.1 | T143: =0-QUOTIENT(S143,5) -> 0 | U143: neck
A144: Gnome Skin Gorget | C144: =(I144*10)+M144+(D144*4)+G144+(L144/5)+(F144*2)+(E144*2)+(K144*2)+(O144/2)+(Q144/2)+(R144/2)+(N144/4)+(P144/4) -> 21.25 | D144: 5 | N144: 5 | S144: 1 | T144: =0-QUOTIENT(S144,5) -> 0 | U144: neck
A145: Torque of Hoar Frost | C145: =(I145*10)+M145+(D145*4)+G145+(L145/5)+(F145*2)+(E145*2)+(K145*2)+(O145/2)+(Q145/2)+(R145/2)+(N145/4)+(P145/4) -> 21 | D145: 1 | L145: 10 | M145: 10 | R145: 10 | S145: 2 | T145: =0-QUOTIENT(S145,5) -> 0 | U145: neck
A146: White Gold Necklace | C146: =(I146*10)+M146+(D146*4)+G146+(L146/5)+(F146*2)+(E146*2)+(K146*2)+(O146/2)+(Q146/2)+(R146/2)+(N146/4)+(P146/4) -> 20.5 | D146: 0 | K146: 5 | O146: 7 | Q146: 7 | R146: 7 | S146: 00.3 | T146: =0-QUOTIENT(S146,5) -> 0 | U146: neck
A147: Dark Muslin Collar | C147: =(I147*10)+M147+(D147*4)+G147+(L147/5)+(F147*2)+(E147*2)+(K147*2)+(O147/2)+(Q147/2)+(R147/2)+(N147/4)+(P147/4) -> 20 | D147: 5 | S147: 00.2 | T147: =0-QUOTIENT(S147,5) -> 0 | U147: neck
A148: Elven Chainmail Neckguard | C148: =(I148*10)+M148+(D148*4)+G148+(L148/5)+(F148*2)+(E148*2)+(K148*2)+(O148/2)+(Q148/2)+(R148/2)+(N148/4)+(P148/4) -> 20 | D148: 5 | S148: 0.5 | T148: =0-QUOTIENT(S148,5) -> 0 | U148: neck
A149: Gem of Rage | C149: =(I149*10)+M149+(D149*4)+G149+(L149/5)+(F149*2)+(E149*2)+(K149*2)+(O149/2)+(Q149/2)+(R149/2)+(N149/4)+(P149/4) -> 20 | D149: 2 | E149: 6 | S149: 00.4 | T149: =0-QUOTIENT(S149,5) -> 0 | U149: neck
A150: Imbued Night Ember Sphere | C150: =(I150*10)+M150+(D150*4)+G150+(L150/5)+(F150*2)+(E150*2)+(K150*2)+(O150/2)+(Q150/2)+(R150/2)+(N150/4)+(P150/4) -> 20 | D150: 5 | S150: 0.5 | T150: =0-QUOTIENT(S150,5) -> 0 | U150: neck
A151: Mithril Studded Gorget | C151: =(I151*10)+M151+(D151*4)+G151+(L151/5)+(F151*2)+(E151*2)+(K151*2)+(O151/2)+(Q151/2)+(R151/2)+(N151/4)+(P151/4) -> 20 | D151: 5 | S151: 00.4 | T151: =0-QUOTIENT(S151,5) -> 0 | U151: neck
A152: Stone Collar | C152: =(I152*10)+M152+(D152*4)+G152+(L152/5)+(F152*2)+(E152*2)+(K152*2)+(O152/2)+(Q152/2)+(R152/2)+(N152/4)+(P152/4) -> 20 | D152: 5 | S152: 2 | T152: =0-QUOTIENT(S152,5) -> 0 | U152: neck
A153: Vale Studded Gorget | C153: =(I153*10)+M153+(D153*4)+G153+(L153/5)+(F153*2)+(E153*2)+(K153*2)+(O153/2)+(Q153/2)+(R153/2)+(N153/4)+(P153/4) -> 20 | D153: 5 | S153: 00.4 | T153: =0-QUOTIENT(S153,5) -> 0 | U153: neck
A154: Velium Cats Eye Necklace | C154: =(I154*10)+M154+(D154*4)+G154+(L154/5)+(F154*2)+(E154*2)+(K154*2)+(O154/2)+(Q154/2)+(R154/2)+(N154/4)+(P154/4) -> 20 | D154: 0 | K154: 10 | S154: 00.1 | T154: =0-QUOTIENT(S154,5) -> 0 | U154: neck
A155: Engraved Skull Amulet | C155: =(I155*10)+M155+(D155*4)+G155+(L155/5)+(F155*2)+(E155*2)+(K155*2)+(O155/2)+(Q155/2)+(R155/2)+(N155/4)+(P155/4) -> 19.5 | D155: 3 | E155: 2 | O155: 7 | S155: 00.1 | T155: =0-QUOTIENT(S155,5) -> 0 | U155: neck
A156: Engraved Skull Mask | C156: =(I156*10)+M156+(D156*4)+G156+(L156/5)+(F156*2)+(E156*2)+(K156*2)+(O156/2)+(Q156/2)+(R156/2)+(N156/4)+(P156/4) -> 19.5 | D156: 3 | E156: 2 | O156: 7 | S156: 00.1 | T156: =0-QUOTIENT(S156,5) -> 0 | U156: neck
A157: Split Paw Tooth Necklace | C157: =(I157*10)+M157+(D157*4)+G157+(L157/5)+(F157*2)+(E157*2)+(K157*2)+(O157/2)+(Q157/2)+(R157/2)+(N157/4)+(P157/4) -> 19.25 | D157: 2 | K157: 5 | N157: 5 | S157: 00.2 | T157: =0-QUOTIENT(S157,5) -> 0 | U157: neck
A158: Sparkling Soul Necklace | C158: =(I158*10)+M158+(D158*4)+G158+(L158/5)+(F158*2)+(E158*2)+(K158*2)+(O158/2)+(Q158/2)+(R158/2)+(N158/4)+(P158/4) -> 19 | D158: 2 | G158: 6 | H158: 5 | N158: 5 | O158: 5 | P158: 5 | S158: 0.5 | T158: =0-QUOTIENT(S158,5) -> 0 | U158: neck
A159: Torin's Choker | C159: =(I159*10)+M159+(D159*4)+G159+(L159/5)+(F159*2)+(E159*2)+(K159*2)+(O159/2)+(Q159/2)+(R159/2)+(N159/4)+(P159/4) -> 19 | D159: 4 | G159: 3 | H159: 3 | S159: 2 | U159: neck
A160: Wolves Eye Necklace | C160: =(I160*10)+M160+(D160*4)+G160+(L160/5)+(F160*2)+(E160*2)+(K160*2)+(O160/2)+(Q160/2)+(R160/2)+(N160/4)+(P160/4) -> 18.5 | D160: 1 | F160: 4 | G160: 4 | H160: 4 | R160: 5 | S160: 0.5 | T160: =0-QUOTIENT(S160,5) -> 0 | U160: neck
A161: Burynai Hide Choker | C161: =(I161*10)+M161+(D161*4)+G161+(L161/5)+(F161*2)+(E161*2)+(K161*2)+(O161/2)+(Q161/2)+(R161/2)+(N161/4)+(P161/4) -> 18 | D161: 4 | G161: 2 | J161: 2 | S161: 0.5 | T161: =0-QUOTIENT(S161,5) -> 0 | U161: neck
A162: Platinum Cat Eye Necklace | C162: =(I162*10)+M162+(D162*4)+G162+(L162/5)+(F162*2)+(E162*2)+(K162*2)+(O162/2)+(Q162/2)+(R162/2)+(N162/4)+(P162/4) -> 18 | D162: 0 | K162: 9 | S162: 00.1 | T162: =0-QUOTIENT(S162,5) -> 0 | U162: neck
A163: Blue Wicker Gorget | C163: =(I163*10)+M163+(D163*4)+G163+(L163/5)+(F163*2)+(E163*2)+(K163*2)+(O163/2)+(Q163/2)+(R163/2)+(N163/4)+(P163/4) -> 16 | D163: 4 | S163: 00.8 | T163: =0-QUOTIENT(S163,5) -> 0 | U163: neck
A164: Iridescent Charm | C164: =(I164*10)+M164+(D164*4)+G164+(L164/5)+(F164*2)+(E164*2)+(K164*2)+(O164/2)+(Q164/2)+(R164/2)+(N164/4)+(P164/4) -> 16 | D164: 0 | G164: 4 | H164: 4 | Q164: 12 | R164: 12 | S164: 00.2 | U164: neck
A165: Reinforced Collar | C165: =(I165*10)+M165+(D165*4)+G165+(L165/5)+(F165*2)+(E165*2)+(K165*2)+(O165/2)+(Q165/2)+(R165/2)+(N165/4)+(P165/4) -> 16 | D165: 4 | S165: 0.5 | T165: =0-QUOTIENT(S165,5) -> 0 | U165: neck
A166: Studded Leather Collar | C166: =(I166*10)+M166+(D166*4)+G166+(L166/5)+(F166*2)+(E166*2)+(K166*2)+(O166/2)+(Q166/2)+(R166/2)+(N166/4)+(P166/4) -> 16 | D166: 3 | E166: 1 | F166: 1 | S166: 0.5 | T166: =0-QUOTIENT(S166,5) -> 0 | U166: neck
A167: Velium Sapphire Necklace | C167: =(I167*10)+M167+(D167*4)+G167+(L167/5)+(F167*2)+(E167*2)+(K167*2)+(O167/2)+(Q167/2)+(R167/2)+(N167/4)+(P167/4) -> 16 | D167: 0 | E167: 8 | J167: 8 | S167: 00.1 | T167: =0-QUOTIENT(S167,5) -> 0 | U167: neck
A168: Evergreen Ivy Ringband | C168: =(I168*10)+M168+(D168*4)+G168+(L168/5)+(F168*2)+(E168*2)+(K168*2)+(O168/2)+(Q168/2)+(R168/2)+(N168/4)+(P168/4) -> 14 | D168: 3 | F168: 1 | S168: 0.5 | T168: =0-QUOTIENT(S168,5) -> 0 | U168: neck
A169: Fishbone Necklace | C169: =(I169*10)+M169+(D169*4)+G169+(L169/5)+(F169*2)+(E169*2)+(K169*2)+(O169/2)+(Q169/2)+(R169/2)+(N169/4)+(P169/4) -> 14 | D169: 3 | G169: 2 | S169: 0.5 | T169: =0-QUOTIENT(S169,5) -> 0 | U169: neck
A170: Electrum Pearl Necklace | C170: =(I170*10)+M170+(D170*4)+G170+(L170/5)+(F170*2)+(E170*2)+(K170*2)+(O170/2)+(Q170/2)+(R170/2)+(N170/4)+(P170/4) -> 13.5 | D170: 3 | N170: 6 | S170: 00.1 | T170: =0-QUOTIENT(S170,5) -> 0 | U170: neck
A171: Velvet Choker | C171: =(I171*10)+M171+(D171*4)+G171+(L171/5)+(F171*2)+(E171*2)+(K171*2)+(O171/2)+(Q171/2)+(R171/2)+(N171/4)+(P171/4) -> 13 | D171: 3 | L171: 5 | S171: 0.5 | T171: =0-QUOTIENT(S171,5) -> 0 | U171: neck
A172: Silver Topaz Necklace | C172: =(I172*10)+M172+(D172*4)+G172+(L172/5)+(F172*2)+(E172*2)+(K172*2)+(O172/2)+(Q172/2)+(R172/2)+(N172/4)+(P172/4) -> 12.75 | D172: 3 | P172: 3 | S172: 0 | T172: =0-QUOTIENT(S172,5) -> 0 | U172: neck
A173: Fungal Field Membrane Gorget | C173: =(I173*10)+M173+(D173*4)+G173+(L173/5)+(F173*2)+(E173*2)+(K173*2)+(O173/2)+(Q173/2)+(R173/2)+(N173/4)+(P173/4) -> 12 | D173: 3 | S173: 00.1 | U173: neck
A174: Golden Locket | C174: =(I174*10)+M174+(D174*4)+G174+(L174/5)+(F174*2)+(E174*2)+(K174*2)+(O174/2)+(Q174/2)+(R174/2)+(N174/4)+(P174/4) -> 12 | D174: 2 | K174: 2 | S174: 00.3 | T174: =0-QUOTIENT(S174,5) -> 0 | U174: neck
A175: Leather Gorget | C175: =(I175*10)+M175+(D175*4)+G175+(L175/5)+(F175*2)+(E175*2)+(K175*2)+(O175/2)+(Q175/2)+(R175/2)+(N175/4)+(P175/4) -> 12 | D175: 3 | S175: 0.5 | T175: =0-QUOTIENT(S175,5) -> 0 | U175: neck
A176: Mesh Gorget | C176: =(I176*10)+M176+(D176*4)+G176+(L176/5)+(F176*2)+(E176*2)+(K176*2)+(O176/2)+(Q176/2)+(R176/2)+(N176/4)+(P176/4) -> 12 | D176: 3 | S176: 00.1 | T176: =0-QUOTIENT(S176,5) -> 0 | U176: neck
A177: Raw-hide Gorget | C177: =(I177*10)+M177+(D177*4)+G177+(L177/5)+(F177*2)+(E177*2)+(K177*2)+(O177/2)+(Q177/2)+(R177/2)+(N177/4)+(P177/4) -> 12 | D177: 3 | S177: 00.8 | T177: =0-QUOTIENT(S177,5) -> 0 | U177: neck
A178: Soft Wicker Gorget | C178: =(I178*10)+M178+(D178*4)+G178+(L178/5)+(F178*2)+(E178*2)+(K178*2)+(O178/2)+(Q178/2)+(R178/2)+(N178/4)+(P178/4) -> 12 | D178: 3 | S178: 00.8 | T178: =0-QUOTIENT(S178,5) -> 0 | U178: neck
A179: Steel Torque | C179: =(I179*10)+M179+(D179*4)+G179+(L179/5)+(F179*2)+(E179*2)+(K179*2)+(O179/2)+(Q179/2)+(R179/2)+(N179/4)+(P179/4) -> 12 | D179: 3 | S179: 0.5 | T179: =0-QUOTIENT(S179,5) -> 0 | U179: neck
A180: Tattered Owlbear Collar | C180: =(I180*10)+M180+(D180*4)+G180+(L180/5)+(F180*2)+(E180*2)+(K180*2)+(O180/2)+(Q180/2)+(R180/2)+(N180/4)+(P180/4) -> 12 | D180: 3 | S180: 00.4 | U180: neck
A181: Electrum Opal Amulet | C181: =(I181*10)+M181+(D181*4)+G181+(L181/5)+(F181*2)+(E181*2)+(K181*2)+(O181/2)+(Q181/2)+(R181/2)+(N181/4)+(P181/4) -> 11 | D181: 0 | F181: 4 | G181: 3 | S181: 00.1 | T181: =0-QUOTIENT(S181,5) -> 0 | U181: neck
A182: Aviak Charm | C182: =(I182*10)+M182+(D182*4)+G182+(L182/5)+(F182*2)+(E182*2)+(K182*2)+(O182/2)+(Q182/2)+(R182/2)+(N182/4)+(P182/4) -> 10.5 | D182: 0 | H182: 2 | I182: 1 | N182: 2 | S182: 00.1 | T182: =0-QUOTIENT(S182,5) -> 0 | U182: neck
A183: Gold Bloodstone Necklace | C183: =(I183*10)+M183+(D183*4)+G183+(L183/5)+(F183*2)+(E183*2)+(K183*2)+(O183/2)+(Q183/2)+(R183/2)+(N183/4)+(P183/4) -> 10 | D183: 0 | F183: 5 | S183: 00.1 | T183: =0-QUOTIENT(S183,5) -> 0 | U183: neck
A184: Medal of Merit | C184: =(I184*10)+M184+(D184*4)+G184+(L184/5)+(F184*2)+(E184*2)+(K184*2)+(O184/2)+(Q184/2)+(R184/2)+(N184/4)+(P184/4) -> 10 | D184: 0 | K184: 5 | S184: 00.1 | T184: =0-QUOTIENT(S184,5) -> 0 | U184: neck
A185: Order of Thunder | C185: =(I185*10)+M185+(D185*4)+G185+(L185/5)+(F185*2)+(E185*2)+(K185*2)+(O185/2)+(Q185/2)+(R185/2)+(N185/4)+(P185/4) -> 10 | D185: 0 | K185: 5 | S185: 00.1 | T185: =0-QUOTIENT(S185,5) -> 0 | U185: neck
A186: Sarnak Arcane Fetish | C186: =(I186*10)+M186+(D186*4)+G186+(L186/5)+(F186*2)+(E186*2)+(K186*2)+(O186/2)+(Q186/2)+(R186/2)+(N186/4)+(P186/4) -> 10 | D186: 0 | H186: 2 | J186: 6 | K186: 5 | S186: 00.1 | T186: =0-QUOTIENT(S186,5) -> 0 | U186: neck
A187: Serpent Insignia Collar | C187: =(I187*10)+M187+(D187*4)+G187+(L187/5)+(F187*2)+(E187*2)+(K187*2)+(O187/2)+(Q187/2)+(R187/2)+(N187/4)+(P187/4) -> 10 | D187: 0 | N187: 5 | O187: 5 | P187: 5 | Q187: 5 | R187: 5 | S187: 00.1 | T187: =0-QUOTIENT(S187,5) -> 0 | U187: neck
A188: Burynaibane Charm | C188: =(I188*10)+M188+(D188*4)+G188+(L188/5)+(F188*2)+(E188*2)+(K188*2)+(O188/2)+(Q188/2)+(R188/2)+(N188/4)+(P188/4) -> 9 | D188: 2 | N188: 2 | P188: 2 | S188: 00.1 | T188: =0-QUOTIENT(S188,5) -> 0 | U188: neck
A189: Crystalline Silk Collar | C189: =(I189*10)+M189+(D189*4)+G189+(L189/5)+(F189*2)+(E189*2)+(K189*2)+(O189/2)+(Q189/2)+(R189/2)+(N189/4)+(P189/4) -> 8.5 | D189: 2 | O189: 1 | S189: 00.1 | T189: =0-QUOTIENT(S189,5) -> 0 | U189: neck
A190: Beartooth Necklace | C190: =(I190*10)+M190+(D190*4)+G190+(L190/5)+(F190*2)+(E190*2)+(K190*2)+(O190/2)+(Q190/2)+(R190/2)+(N190/4)+(P190/4) -> 8 | D190: 0 | F190: 3 | L190: 10 | S190: 00.2 | T190: =0-QUOTIENT(S190,5) -> 0 | U190: neck
A191: Brooch of Sw'Vaye | C191: =(I191*10)+M191+(D191*4)+G191+(L191/5)+(F191*2)+(E191*2)+(K191*2)+(O191/2)+(Q191/2)+(R191/2)+(N191/4)+(P191/4) -> 8 | D191: 1 | K191: 2 | S191: 0 | T191: =0-QUOTIENT(S191,5) -> 0 | U191: neck
A192: Curscale Choker | C192: =(I192*10)+M192+(D192*4)+G192+(L192/5)+(F192*2)+(E192*2)+(K192*2)+(O192/2)+(Q192/2)+(R192/2)+(N192/4)+(P192/4) -> 8 | D192: 2 | S192: 00.2 | T192: =0-QUOTIENT(S192,5) -> 0 | U192: neck
A193: Silver Sapphire Necklace | C193: =(I193*10)+M193+(D193*4)+G193+(L193/5)+(F193*2)+(E193*2)+(K193*2)+(O193/2)+(Q193/2)+(R193/2)+(N193/4)+(P193/4) -> 8 | D193: 0 | E193: 4 | J193: 4 | S193: 00.1 | T193: =0-QUOTIENT(S193,5) -> 0 | U193: neck
A194: Tattered Gorget | C194: =(I194*10)+M194+(D194*4)+G194+(L194/5)+(F194*2)+(E194*2)+(K194*2)+(O194/2)+(Q194/2)+(R194/2)+(N194/4)+(P194/4) -> 8 | D194: 2 | S194: 0.5 | T194: =0-QUOTIENT(S194,5) -> 0 | U194: neck
A195: Woven Collar | C195: =(I195*10)+M195+(D195*4)+G195+(L195/5)+(F195*2)+(E195*2)+(K195*2)+(O195/2)+(Q195/2)+(R195/2)+(N195/4)+(P195/4) -> 8 | D195: 2 | S195: 00.1 | T195: =0-QUOTIENT(S195,5) -> 0 | U195: neck
A196: Xakra Kel Choker | C196: =(I196*10)+M196+(D196*4)+G196+(L196/5)+(F196*2)+(E196*2)+(K196*2)+(O196/2)+(Q196/2)+(R196/2)+(N196/4)+(P196/4) -> 8 | D196: 2 | S196: 00.1 | U196: neck
A197: Golden Black Pearl Choker | C197: =(I197*10)+M197+(D197*4)+G197+(L197/5)+(F197*2)+(E197*2)+(K197*2)+(O197/2)+(Q197/2)+(R197/2)+(N197/4)+(P197/4) -> 7 | D197: 0 | G197: 7 | H197: 7 | S197: 00.1 | T197: =0-QUOTIENT(S197,5) -> 0 | U197: neck
A198: Necklace of Adversity | C198: =(I198*10)+M198+(D198*4)+G198+(L198/5)+(F198*2)+(E198*2)+(K198*2)+(O198/2)+(Q198/2)+(R198/2)+(N198/4)+(P198/4) -> 6.5 | D198: 0 | L198: 20 | O198: 5 | S198: 0.5 | U198: neck
A199: An Elven Charm Necklace | C199: =(I199*10)+M199+(D199*4)+G199+(L199/5)+(F199*2)+(E199*2)+(K199*2)+(O199/2)+(Q199/2)+(R199/2)+(N199/4)+(P199/4) -> 6 | D199: 0 | K199: 3 | S199: 00.2 | T199: =0-QUOTIENT(S199,5) -> 0 | U199: neck
A200: Electrum Bloodstone Necklace | C200: =(I200*10)+M200+(D200*4)+G200+(L200/5)+(F200*2)+(E200*2)+(K200*2)+(O200/2)+(Q200/2)+(R200/2)+(N200/4)+(P200/4) -> 6 | D200: 0 | F200: 3 | S200: 00.1 | T200: =0-QUOTIENT(S200,5) -> 0 | U200: neck
A201: Informer's Necklace | C201: =(I201*10)+M201+(D201*4)+G201+(L201/5)+(F201*2)+(E201*2)+(K201*2)+(O201/2)+(Q201/2)+(R201/2)+(N201/4)+(P201/4) -> 6 | D201: 0 | L201: 5 | Q201: 5 | R201: 5 | S201: 00.1 | U201: neck
A202: Silver Cat Eye Necklace | C202: =(I202*10)+M202+(D202*4)+G202+(L202/5)+(F202*2)+(E202*2)+(K202*2)+(O202/2)+(Q202/2)+(R202/2)+(N202/4)+(P202/4) -> 6 | D202: 0 | K202: 3 | S202: 00.1 | T202: =0-QUOTIENT(S202,5) -> 0 | U202: neck
A203: Snaorf's Medallion | C203: =(I203*10)+M203+(D203*4)+G203+(L203/5)+(F203*2)+(E203*2)+(K203*2)+(O203/2)+(Q203/2)+(R203/2)+(N203/4)+(P203/4) -> 4.5 | D203: 1 | R203: 1 | S203: 00.4 | T203: =0-QUOTIENT(S203,5) -> 0 | U203: neck
A204: Wolf's Eye Platinum Necklace | C204: =(I204*10)+M204+(D204*4)+G204+(L204/5)+(F204*2)+(E204*2)+(K204*2)+(O204/2)+(Q204/2)+(R204/2)+(N204/4)+(P204/4) -> 4.5 | D204: 0 | O204: 9 | S204: 00.1 | T204: =0-QUOTIENT(S204,5) -> 0 | U204: neck
A205: Black Pearl Electrum Choker | C205: =(I205*10)+M205+(D205*4)+G205+(L205/5)+(F205*2)+(E205*2)+(K205*2)+(O205/2)+(Q205/2)+(R205/2)+(N205/4)+(P205/4) -> 4 | D205: 0 | G205: 4 | H205: 4 | S205: 00.1 | T205: =0-QUOTIENT(S205,5) -> 0 | U205: neck
A206: Cloth Choker | C206: =(I206*10)+M206+(D206*4)+G206+(L206/5)+(F206*2)+(E206*2)+(K206*2)+(O206/2)+(Q206/2)+(R206/2)+(N206/4)+(P206/4) -> 4 | D206: 1 | S206: 00.2 | T206: =0-QUOTIENT(S206,5) -> 0 | U206: neck
A207: Dusty Burlap Collar | C207: =(I207*10)+M207+(D207*4)+G207+(L207/5)+(F207*2)+(E207*2)+(K207*2)+(O207/2)+(Q207/2)+(R207/2)+(N207/4)+(P207/4) -> 4 | D207: 1 | S207: 00.2 | T207: =0-QUOTIENT(S207,5) -> 0 | U207: neck
A208: Iron Torque | C208: =(I208*10)+M208+(D208*4)+G208+(L208/5)+(F208*2)+(E208*2)+(K208*2)+(O208/2)+(Q208/2)+(R208/2)+(N208/4)+(P208/4) -> 4 | D208: 1 | S208: 00.2 | T208: =0-QUOTIENT(S208,5) -> 0 | U208: neck
A209: Netted Choker | C209: =(I209*10)+M209+(D209*4)+G209+(L209/5)+(F209*2)+(E209*2)+(K209*2)+(O209/2)+(Q209/2)+(R209/2)+(N209/4)+(P209/4) -> 4 | D209: 1 | S209: 00.1 | T209: =0-QUOTIENT(S209,5) -> 0 | U209: neck
A210: Ulthork Hide Collar | C210: =(I210*10)+M210+(D210*4)+G210+(L210/5)+(F210*2)+(E210*2)+(K210*2)+(O210/2)+(Q210/2)+(R210/2)+(N210/4)+(P210/4) -> 4 | D210: 7 | L210: 30 | M210: -30 | S210: 0.5 | T210: =0-QUOTIENT(S210,5) -> 0 | U210: neck
A211: Anti-Poison Amulet | C211: =(I211*10)+M211+(D211*4)+G211+(L211/5)+(F211*2)+(E211*2)+(K211*2)+(O211/2)+(Q211/2)+(R211/2)+(N211/4)+(P211/4) -> 3.75 | D211: 0 | N211: 15 | S211: 00.1 | T211: =0-QUOTIENT(S211,5) -> 0 | U211: neck
A212: Gold Hematite Choker | C212: =(I212*10)+M212+(D212*4)+G212+(L212/5)+(F212*2)+(E212*2)+(K212*2)+(O212/2)+(Q212/2)+(R212/2)+(N212/4)+(P212/4) -> 3.5 | D212: 0 | Q212: 7 | S212: 00.1 | T212: =0-QUOTIENT(S212,5) -> 0 | U212: neck
A213: Electrum Hematite Choker | C213: =(I213*10)+M213+(D213*4)+G213+(L213/5)+(F213*2)+(E213*2)+(K213*2)+(O213/2)+(Q213/2)+(R213/2)+(N213/4)+(P213/4) -> 2 | D213: 0 | Q213: 4 | S213: 00.1 | T213: =0-QUOTIENT(S213,5) -> 0 | U213: neck
A214: Veliuum Lapis Lazuli Necklace | C214: =(I214*10)+M214+(D214*4)+G214+(L214/5)+(F214*2)+(E214*2)+(K214*2)+(O214/2)+(Q214/2)+(R214/2)+(N214/4)+(P214/4) -> 2 | D214: 0 | P214: 8 | S214: 00.1 | T214: =0-QUOTIENT(S214,5) -> 0 | U214: neck
A215: Wolf's Eye Silver Necklace | C215: =(I215*10)+M215+(D215*4)+G215+(L215/5)+(F215*2)+(E215*2)+(K215*2)+(O215/2)+(Q215/2)+(R215/2)+(N215/4)+(P215/4) -> 2 | D215: 0 | O215: 4 | S215: 00.1 | T215: =0-QUOTIENT(S215,5) -> 0 | U215: neck
A216: Platinum Lapis Lazuli Necklace | C216: =(I216*10)+M216+(D216*4)+G216+(L216/5)+(F216*2)+(E216*2)+(K216*2)+(O216/2)+(Q216/2)+(R216/2)+(N216/4)+(P216/4) -> 1.75 | D216: 0 | P216: 7 | S216: 00.1 | T216: =0-QUOTIENT(S216,5) -> 0 | U216: neck
A217: Intestine Necklace | C217: =(I217*10)+M217+(D217*4)+G217+(L217/5)+(F217*2)+(E217*2)+(K217*2)+(O217/2)+(Q217/2)+(R217/2)+(N217/4)+(P217/4) -> 1 | D217: 0 | L217: 5 | S217: 00.1 | T217: =0-QUOTIENT(S217,5) -> 0 | U217: neck
A218: Topaz Silver Necklace | C218: =(I218*10)+M218+(D218*4)+G218+(L218/5)+(F218*2)+(E218*2)+(K218*2)+(O218/2)+(Q218/2)+(R218/2)+(N218/4)+(P218/4) -> 1 | D218: 0 | P218: 4 | S218: 00.1 | T218: =0-QUOTIENT(S218,5) -> 0 | U218: neck
A219: Alize Volew Medicine Bag | C219: =(I219*10)+M219+(D219*4)+G219+(L219/5)+(F219*2)+(E219*2)+(K219*2)+(O219/2)+(Q219/2)+(R219/2)+(N219/4)+(P219/4) -> 0.5 | D219: 0 | N219: 1 | P219: 1 | S219: 00.2 | T219: =0-QUOTIENT(S219,5) -> 0 | U219: neck
A220: Silver Lapis Lazuli Necklace | C220: =(I220*10)+M220+(D220*4)+G220+(L220/5)+(F220*2)+(E220*2)+(K220*2)+(O220/2)+(Q220/2)+(R220/2)+(N220/4)+(P220/4) -> 0.5 | D220: 0 | P220: 2 | S220: 00.1 | T220: =0-QUOTIENT(S220,5) -> 0 | U220: neck
A221: Snake Fang Necklace | C221: =(I221*10)+M221+(D221*4)+G221+(L221/5)+(F221*2)+(E221*2)+(K221*2)+(O221/2)+(Q221/2)+(R221/2)+(N221/4)+(P221/4) -> 0.5 | D221: 0 | N221: 2 | S221: 00.1 | T221: =0-QUOTIENT(S221,5) -> 0 | U221: neck
A222: Beaded Slime Necklace | C222: =(I222*10)+M222+(D222*4)+G222+(L222/5)+(F222*2)+(E222*2)+(K222*2)+(O222/2)+(Q222/2)+(R222/2)+(N222/4)+(P222/4) -> 0 | D222: 0 | J222: 5 | S222: 00.2 | T222: =0-QUOTIENT(S222,5) -> 0 | U222: neck
A223: Electrum Onyx Pendant | C223: =(I223*10)+M223+(D223*4)+G223+(L223/5)+(F223*2)+(E223*2)+(K223*2)+(O223/2)+(Q223/2)+(R223/2)+(N223/4)+(P223/4) -> 0 | D223: 0 | H223: 3 | S223: 00.1 | T223: =0-QUOTIENT(S223,5) -> 0 | U223: neck
A224: Electrum Star Amulet | C224: =(I224*10)+M224+(D224*4)+G224+(L224/5)+(F224*2)+(E224*2)+(K224*2)+(O224/2)+(Q224/2)+(R224/2)+(N224/4)+(P224/4) -> 0 | D224: 0 | J224: 2 | S224: 00.1 | T224: =0-QUOTIENT(S224,5) -> 0 | U224: neck
A225: Frog Eye Necklace | C225: =(I225*10)+M225+(D225*4)+G225+(L225/5)+(F225*2)+(E225*2)+(K225*2)+(O225/2)+(Q225/2)+(R225/2)+(N225/4)+(P225/4) -> 0 | D225: 0 | S225: 00.2 | T225: =0-QUOTIENT(S225,5) -> 0 | U225: neck
A226: Goblin Warlord Warbeads | C226: =(I226*10)+M226+(D226*4)+G226+(L226/5)+(F226*2)+(E226*2)+(K226*2)+(O226/2)+(Q226/2)+(R226/2)+(N226/4)+(P226/4) -> 0 | D226: 0 | S226: 00.2 | T226: =0-QUOTIENT(S226,5) -> 0 | U226: neck
A227: Gold Onyx Pendant | C227: =(I227*10)+M227+(D227*4)+G227+(L227/5)+(F227*2)+(E227*2)+(K227*2)+(O227/2)+(Q227/2)+(R227/2)+(N227/4)+(P227/4) -> 0 | D227: 0 | H227: 5 | S227: 00.1 | T227: =0-QUOTIENT(S227,5) -> 0 | U227: neck
A228: Golden Star Amulet | C228: =(I228*10)+M228+(D228*4)+G228+(L228/5)+(F228*2)+(E228*2)+(K228*2)+(O228/2)+(Q228/2)+(R228/2)+(N228/4)+(P228/4) -> 0 | D228: 0 | J228: 4 | S228: 00.1 | T228: =0-QUOTIENT(S228,5) -> 0 | U228: neck
A229: Piece of a Medallion | C229: =(I229*10)+M229+(D229*4)+G229+(L229/5)+(F229*2)+(E229*2)+(K229*2)+(O229/2)+(Q229/2)+(R229/2)+(N229/4)+(P229/4) -> 0 | D229: 0 | S229: 00.1 | T229: =0-QUOTIENT(S229,5) -> 0 | U229: neck
A230: Piece of a Medallion | C230: =(I230*10)+M230+(D230*4)+G230+(L230/5)+(F230*2)+(E230*2)+(K230*2)+(O230/2)+(Q230/2)+(R230/2)+(N230/4)+(P230/4) -> 0 | D230: 0 | S230: 00.1 | T230: =0-QUOTIENT(S230,5) -> 0 | U230: neck
A231: Ruby Pendant | C231: =(I231*10)+M231+(D231*4)+G231+(L231/5)+(F231*2)+(E231*2)+(K231*2)+(O231/2)+(Q231/2)+(R231/2)+(N231/4)+(P231/4) -> 0 | D231: 0 | J231: 1 | S231: 00.1 | T231: =0-QUOTIENT(S231,5) -> 0 | U231: neck
A232: Rat's Foot Necklace | C232: =(I232*10)+M232+(D232*4)+G232+(L232/5)+(F232*2)+(E232*2)+(K232*2)+(O232/2)+(Q232/2)+(R232/2)+(N232/4)+(P232/4) -> -1.6 | D232: 0 | K232: -1 | L232: 2 | S232: 00.1 | T232: =0-QUOTIENT(S232,5) -> 0 | U232: neck