A1: Active Roster
B2: Levels | C2: Title | D2: Race | E2: Epic | F2: VP Key | G2: ST Key | H2: EMP Key | I2: VT Key | J2: PoV/PoS | K2: BoT | L2: PoI B | M2: CoD | N2: PoN B | O2: PoT | P2: HoH A | Q2: Status
A3: Bard
A4: =HYPERLINK("http://www.magelo.com/eq_view_profile.html?num=194601","Cranth") -> Cranth | B4: 65 | C4: Veteran | D4: Wood Elf | E4: YES | F4: 1 | G4: 1 | H4: 1 | I4: 1 | J4: 1 | K4: 1 | L4: 1 | M4: 1 | N4: 1 | O4: 1 | P4: 1 | Q4: Member | R4: 1
A5: =HYPERLINK("http://www.magelo.com/eq_view_profile.html?num=602833","Gymi") -> Gymi | B5: 61 | D5: Wood Elf | E5: YES | Q5: Member | R5: 1
A6: =HYPERLINK("http://www.magelo.com/eq_view_profile.html?num=84086","Mioawara") -> Mioawara | B6: 65 | C6: Baron | D6: Wood Elf | E6: YES | G6: 1 | H6: 1 | I6: 1 | J6: 1 | K6: 1 | N6: 1 | O6: 1 | P6: 1 | Q6: Member | R6: 1
A7: =HYPERLINK("http://www.magelo.com/eq_view_profile.html?num=344746","Rosha") -> Rosha | B7: 65 | C7: Baron | D7: Wood Elf | E7: YES | F7: 1 | G7: 1 | H7: 1 | I7: 1 | J7: 1 | Q7: Officer | R7: 1
A8: =HYPERLINK("http://www.magelo.com/eq_view_profile.html?num=663136","Taluwen") -> Taluwen | B8: 65 | C8: Impresario | D8: Half Elf | E8: YES | G8: 1 | H8: 1 | I8: 1 | J8: 1 | P8: 1 | Q8: Member | R8: 1
A9: =HYPERLINK("http://www.magelo.com/eq_view_profile.html?num=182277","Yorke") -> Yorke | B9: 65 | C9: Veteran | D9: Half Elf | E9: YES | F9: 1 | G9: 1 | H9: 1 | J9: 1 | K9: 1 | Q9: Officer | R9: 1
A10: Beastlord
A11: Crewl | B11: 65 | D11: Ogre | E11: YES | G11: 1 | H11: 1 | I11: 1 | J11: 1 | K11: 1 | Q11: Member | R11: 1
A12: Meoww | B12: 65 | D12: Vah Shir | E12: NO | G12: 1 | H12: 1 | J12: 1 | K12: 1 | L12: 1 | M12: 1 | N12: 1 | O12: 1 | P12: 1 | Q12: Member | R12: 1
A13: =HYPERLINK("http://www.magelo.com/eq_view_profile.html?num=595579","Sarisha") -> Sarisha | B13: 53 | D13: Vah Shir | E13: YES | Q13: Member | R13: 1
A14: =HYPERLINK("http://www.magelo.com/eq_view_profile.html?num=527672","Skilor") -> Skilor | B14: 62 | D14: Vah Shir | E14: NO | H14: 1 | J14: 1 | Q14: Member | R14: 1
A15: Nermel | B15: 61 | D15: Vah Shir | E15: YES | Q15: Alternate
A16: Clerics
A17: =HYPERLINK("http://www.magelo.com/eq_view_profile.html?num=642183","Aader") -> Aader | B17: 65 | C17: Baron | D17: Dwarf | E17: YES | G17: 1 | H17: 1 | J17: 1 | K17: 1 | L17: 1 | N17: 1 | P17: 1 | Q17: Member | R17: 1
A18: =HYPERLINK("http://www.magelo.com/eq_view_profile.html?num=342919","Dinanin") -> Dinanin | B18: 65 | C18: Exarch | D18: Dwarf | E18: YES | F18: 1 | G18: 1 | H18: 1 | I18: 1 | J18: 1 | K18: 1 | L18: 1 | M18: 1 | N18: 1 | O18: 1 | P18: 1 | Q18: Member | R18: 1
A19: =HYPERLINK("http://www.magelo.com/eq_view_profile.html?num=84050","Gerweena") -> Gerweena | B19: 65 | C19: Venerable | D19: Halfling | E19: YES | G19: 1 | H19: 1 | J19: 1 | K19: 1 | P19: 1 | Q19: Member | R19: 1
A20: =HYPERLINK("http://www.magelo.com/eq_view_profile.html?num=115196","Iendaar") -> Iendaar | B20: 64 | C20: Baron | D20: High Elf | E20: YES | H20: 1 | J20: 1 | K20: 1 | L20: 1 | Q20: Member | R20: 1
A21: Jerycho | B21: 65 | D21: Dwarf | E21: YES | G21: 1 | H21: 1 | I21: 1 | J21: 1 | Q21: Member | R21: 1
A22: =HYPERLINK("http://www.magelo.com/eq_view_profile.html?num=151159","Mediloks") -> Mediloks | B22: 65 | D22: High Elf | E22: YES | G22: 1 | H22: 1 | I22: 1 | J22: 1 | K22: 1 | N22: 1 | O22: 1 | P22: 1 | Q22: Member | R22: 1
A23: Moogi | B23: 61 | C23: Baroness | D23: High Elf | E23: YES | Q23: Member | R23: 1
A24: =HYPERLINK("http://www.magelo.com/eq_view_profile.html?num=71953","Philander") -> Philander | B24: 63 | C24: Venerable | D24: Dwarf | E24: YES | F24: 1 | G24: 1 | H24: 1 | J24: 1 | K24: 1 | N24: 1 | P24: 1 | Q24: Officer | R24: 1
A25: =HYPERLINK("http://www.magelo.com/eq_view_profile.html?num=62008","Xorolorn") -> Xorolorn | B25: 65 | C25: Baron | D25: High Elf | E25: YES | F25: 1 | G25: 1 | H25: 1 | I25: 1 | J25: 1 | K25: 1 | L25: 1 | N25: 1 | P25: 1 | Q25: Member | R25: 1
A26: Bohric | B26: 65 | C26: Baron | D26: Dwarf | E26: NO | F26: X | G26: X | J26: X | K26: X | L26: X | M26: X | N26: X | P26: X | Q26: On Break
A27: =HYPERLINK("http://www.magelo.com/eq_view_profile.html?num=581769","Samine") -> Samine | B27: 65 | C27: Venerable | D27: High Elf | E27: NO | F27: X | G27: X | J27: X | K27: X | L27: X | M27: X | P27: X | Q27: On Break
A28: Sarigus | B28: 60 | C28: Venerable | D28: Halfling | E28: YES | F28: X | Q28: On Break
A29: =HYPERLINK("http://www.magelo.com/eq_view_profile.html?num=141442","Adella") -> Adella | B29: 65 | D29: Dwarf | E29: YES | F29: X | J29: X | K29: X | P29: X | Q29: Alternate
A30: =HYPERLINK("http://www.magelo.com/eq_view_profile.html?num=345649","Andromache") -> Andromache | B30: 65 | D30: Dark Elf | E30: YES | H30: X | I30: X | J30: X | P30: X | Q30: Alternate
A31: =HYPERLINK("http://www.magelo.com/eq_view_profile.html?num=59684","Dystopya") -> Dystopya | B31: 65 | C31: Venerable | D31: Human | E31: YES | F31: 1 | G31: 1 | H31: 1 | I31: 1 | J31: 1 | K31: 1 | L31: 1 | M31: 1 | N31: 1 | O31: 1 | P31: 1 | Q31: Alternate
A32: Fryar | B32: 64 | D32: Dwarf | E32: YES | J32: X | K32: X | M32: X | P32: X | Q32: Alternate
A33: Fuzella | B33: 63 | D33: Halfling | E33: NO | H33: X | Q33: Alternate
A34: Petrafied | B34: 65 | D34: High Elf | E34: YES | H34: X | I34: X | J34: X | K34: X | L34: X | M34: X | N34: X | O34: X | P34: X | Q34: Alternate
A35: Pria | B35: 65 | C35: Baroness | D35: High Elf | E35: YES | J35: X | K35: X | N35: X | P35: X | Q35: Alternate
A36: Restora | B36: 65 | D36: High Elf | E36: YES | H36: X | N36: X | P36: X | Q36: Alternate
A37: =HYPERLINK("http://www.magelo.com/eq_view_profile.html?num=495320","Vyera") -> Vyera | B37: 65 | C37: Venerable | D37: Dark Elf | E37: NO | J37: X | K37: X | O37: X | Q37: Alternate
A38: =HYPERLINK("http://www.magelo.com/eq_view_profile.html?num=24215","Weckie") -> Weckie | B38: 65 | C38: Venerable | D38: Dark Elf | E38: YES | F38: X | H38: X | I38: X | J38: X | K38: X | M38: X | N38: X | O38: X | P38: X | Q38: Alternate
A39: Druid
A40: Denari | B40: 65 | D40: Half Elf | E40: YES | H40: 1 | I40: 1 | J40: 1 | K40: 1 | M40: 1 | O40: 1 | P40: 1 | Q40: Member | R40: 1
A41: =HYPERLINK("http://www.magelo.com/eq_view_profile.html?num=28957","Echineasia") -> Echineasia | B41: 65 | C41: Venerable | D41: Wood Elf | E41: YES | F41: 1 | G41: 1 | H41: 1 | I41: 1 | J41: 1 | K41: 1 | L41: 1 | M41: 1 | N41: 1 | P41: 1 | Q41: Member | R41: 1
A42: =HYPERLINK("http://www.magelo.com/eq_view_profile.html?num=107624","Edylc") -> Edylc | B42: 65 | D42: Wood Elf | E42: YES | F42: 1 | G42: 1 | H42: 1 | I42: 1 | J42: 1 | K42: 1 | M42: 1 | N42: 1 | O42: 1 | P42: 1 | Q42: Member | R42: 1
A43: =HYPERLINK("http://www.magelo.com/eq_view_profile.html?num=186512","Gweeto") -> Gweeto | B43: 65 | D43: Halfling | E43: YES | F43: 1 | G43: 1 | H43: 1 | I43: 1 | J43: 1 | K43: 1 | L43: 1 | M43: 1 | N43: 1 | O43: 1 | P43: 1 | Q43: Member | R43: 1
A44: =HYPERLINK("http://www.magelo.com/eq_view_profile.html?num=54717","Lilee") -> Lilee | B44: 65 | C44: Elder | D44: Wood Elf | E44: YES | H44: 1 | I44: 1 | J44: 1 | K44: 1 | M44: 1 | P44: 1 | Q44: Member | R44: 1
A45: =HYPERLINK("http://www.magelo.com/eq_view_profile.html?num=19213","Madgegal") -> Madgegal | B45: 65 | C45: Baroness | D45: Wood Elf | E45: YES | H45: 1 | I45: 1 | J45: 1 | K45: 1 | L45: 1 | M45: 1 | O45: 1 | P45: 1 | Q45: Member | R45: 1
A46: Panzon | B46: 65 | D46: Halfling | E46: YES | H46: 1 | I46: 1 | J46: 1 | Q46: Member | R46: 1
A47: =HYPERLINK("http://www.magelo.com/eq_view_profile.html?num=260177","Skysz") -> Skysz | B47: 65 | C47: Elder | D47: Halfling | E47: YES | G47: 1 | H47: 1 | I47: 1 | J47: 1 | K47: 1 | N47: 1 | O47: 1 | P47: 1 | Q47: Member | R47: 1
A48: =HYPERLINK("http://www.magelo.com/eq_view_profile.html?num=12316","Thunderheart") -> Thunderheart | B48: 65 | C48: Venerable | D48: Wood Elf | E48: YES | F48: 1 | H48: 1 | I48: 1 | J48: 1 | K48: 1 | M48: 1 | N48: 1 | P48: 1 | Q48: Member | R48: 1
A49: =HYPERLINK("http://www.magelo.com/eq_view_profile.html?num=11509","Wickie") -> Wickie | B49: 65 | C49: Elder | D49: Wood Elf | E49: YES | F49: 1 | G49: 1 | H49: 1 | I49: 1 | J49: 1 | K49: 1 | L49: 1 | M49: 1 | N49: 1 | O49: 1 | P49: 1 | Q49: Member | R49: 1
A50: =HYPERLINK("http://www.magelo.com/eq_view_profile.html?num=343679","Fellan") -> Fellan | B50: 61 | D50: Halfling | E50: NO | L50: X | Q50: Alternate
A51: =HYPERLINK("http://www.magelo.com/eq_view_profile.html?num=226868","Padain") -> Padain | B51: 65 | C51: Venerable | D51: Wood Elf | E51: YES | F51: X | G51: X | J51: X | K51: X | L51: X | M51: X | P51: X | Q51: Alternate
A52: Enchanter
A53: =HYPERLINK("http://www.magelo.com/eq_view_profile.html?num=120701","Azlaan") -> Azlaan | B53: 65 | C53: Master | D53: Erudite | E53: YES | F53: 1 | G53: 1 | H53: 1 | I53: 1 | J53: 1 | K53: 1 | N53: 1 | P53: 1 | Q53: Member | R53: 1
A54: Canny | B54: 65 | C54: Mistress | E54: NO | G54: 1 | H54: 1 | I54: 1 | J54: 1 | K54: 1 | Q54: Member | R54: 1
A55: =HYPERLINK("http://www.magelo.com/eq_view_profile.html?num=345631","Cwell") -> Cwell | B55: 65 | C55: Master | D55: Erudite | E55: YES | F55: 1 | G55: 1 | H55: 1 | I55: 1 | J55: 1 | K55: 1 | N55: 1 | O55: 1 | P55: 1 | Q55: Member | R55: 1
A56: Morphos | B56: 65 | D56: High Elf | E56: NO | H56: 1 | I56: 1 | Q56: Member | R56: 1
A57: =HYPERLINK("http://www.magelo.com/eq_view_profile.html?num=363509","Sakuma") -> Sakuma | B57: 64 | D57: High Elf | E57: NO | F57: 1 | G57: 1 | H57: 1 | J57: 1 | N57: 1 | O57: 1 | Q57: Member | R57: 1
A58: =HYPERLINK("http://www.magelo.com/eq_view_profile.html?num=343464","Sethrah") -> Sethrah | B58: 65 | C58: Mistress | D58: Dark Elf | E58: YES | F58: X | G58: X | J58: X | K58: X | M58: X | P58: X | Q58: On Break
A59: Amantus | B59: 64 | D59: High Elf | E59: NO | H59: X | J59: X | P59: X | Q59: Alternate
A60: Jaquinetta | B60: 64 | D60: Dark Elf | E60: NO | J60: X | K60: X | L60: X | M60: X | N60: X | P60: X | Q60: Alternate
A61: Khuzlean | B61: 65 | D61: Dark Elf | E61: NO | H61: X | I61: X | J61: X | K61: X | L61: X | M61: X | N61: X | O61: X | P61: X | Q61: Alternate
A62: =HYPERLINK("http://www.magelo.com/eq_view_profile.html?num=64112","Roonie") -> Roonie | B62: 62 | C62: Mistress | D62: Dark Elf | E62: YES | F62: X | J62: X | L62: X | N62: X | P62: X | Q62: Alternate
A63: Mages
A64: =HYPERLINK("http://www.magelo.com/eq_view_profile.html?num=466839","Almorzar") -> Almorzar | B64: 65 | C64: Master | D64: Erudite | E64: NO | F64: 1 | G64: 1 | H64: 1 | I64: 1 | J64: 1 | K64: 1 | M64: 1 | N64: 1 | O64: 1 | P64: 1 | Q64: Member | R64: 1
A65: =HYPERLINK("http://www.magelo.com/eq_view_profile.html?num=191052","Canda") -> Canda | B65: 64 | C65: Baron | D65: High Elf | E65: YES | F65: X | G65: X | J65: X | K65: X | N65: X | P65: X | Q65: On Break
A66: =HYPERLINK("http://www.magelo.com/eq_view_profile.html?num=345293","Elingia") -> Elingia | B66: 59 | D66: High Elf | E66: NO | Q66: On Break
A67: Gaidar | B67: 63 | D67: Human | E67: NO | J67: X | K67: X | L67: X | M67: X | O67: X | P67: X | Q67: On Break
A68: Mandrayke | B68: 63 | E68: NO | Q68: Alternate
A69: Monks
A70: =HYPERLINK("http://www.magelo.com/eq_view_profile.html?num=502685","Chubbies") -> Chubbies | B70: 65 | C70: Sensei | D70: Iksar | E70: YES | F70: 1 | G70: 1 | H70: 1 | I70: 1 | J70: 1 | K70: 1 | M70: 1 | N70: 1 | P70: 1 | Q70: Member | R70: 1
A71: Quigon | B71: 62 | C71: Baron | D71: Human | E71: YES | G71: 1 | H71: 1 | Q71: Member | R71: 1
A72: Stormin | B72: 65 | C72: Baron | D72: Human | E72: YES | F72: 1 | G72: 1 | H72: 1 | I72: 1 | J72: 1 | K72: 1 | N72: 1 | O72: 1 | P72: 1 | Q72: Member | R72: 1
A73: =HYPERLINK("http://www.magelo.com/eq_view_profile.html?num=54695","Talinsyn") -> Talinsyn | B73: 65 | C73: Sensei | D73: Human | E73: YES | F73: 1 | G73: 1 | H73: 1 | I73: 1 | J73: 1 | K73: 1 | L73: 1 | M73: 1 | N73: 1 | P73: 1 | Q73: Member | R73: 1
A74: =HYPERLINK("http://www.magelo.com/eq_view_profile.html?num=64095","Voir") -> Voir | B74: 64 | C74: Brother | D74: Iksar | E74: YES | F74: X | G74: X | J74: X | K74: X | L74: X | N74: X | P74: X | Q74: On Break
A75: Necromancer
A76: Drexen | B76: 64 | C76: Sage | D76: Dark Elf | E76: NO | H76: 1 | I76: 1 | Q76: Member | R76: 1
A77: =HYPERLINK("http://www.magelo.com/eq_view_profile.html?num=434407","Evilgrim") -> Evilgrim | B77: 64 | C77: Baron | D77: Gnome | E77: YES | F77: 1 | H77: 1 | J77: 1 | K77: 1 | M77: 1 | N77: 1 | O77: 1 | P77: 1 | Q77: Member | R77: 1
A78: Scraps | B78: 65 | C78: Archlich | D78: Gnome | E78: YES | G78: 1 | H78: 1 | I78: 1 | J78: 1 | K78: 1 | L78: 1 | M78: 1 | N78: 1 | O78: 1 | P78: 1 | Q78: Member | R78: 1
A79: =HYPERLINK("http://www.magelo.com/eq_view_profile.html?num=352099","Lokaris") -> Lokaris | B79: 65 | C79: Archlich | D79: Dark Elf | E79: YES | F79: X | G79: X | H79: X | J79: X | M79: X | N79: X | P79: X | Q79: Officer - OB
A80: Intention | B80: 63 | D80: Dark Elf | E80: NO | Q80: Alternate
A81: Paladins
A82: =HYPERLINK("http://www.magelo.com/eq_view_profile.html?num=98063","Badin") -> Badin | B82: 65 | C82: Duke | D82: Dwarf | E82: YES | F82: 1 | G82: 1 | H82: 1 | I82: 1 | J82: 1 | K82: 1 | L82: 1 | M82: 1 | N82: 1 | O82: 1 | P82: 1 | Q82: Officer | R82: 1
A83: =HYPERLINK("http://www.magelo.com/eq_view_profile.html?num=168250","Brokkson") -> Brokkson | B83: 65 | C83: Duke | D83: Dwarf | E83: YES | F83: 1 | G83: 1 | H83: 1 | I83: 1 | J83: 1 | K83: 1 | L83: 1 | M83: 1 | N83: 1 | O83: 1 | P83: 1 | Q83: Officer | R83: 1
A84: =HYPERLINK("http://www.magelo.com/eq_view_profile.html?num=350082","Infirit") -> Infirit | B84: 63 | C84: Baron | D84: Half Elf | E84: YES | G84: 1 | H84: 1 | J84: 1 | M84: 1 | N84: 1 | P84: 1 | Q84: Member | R84: 1
A85: Glloinn | B85: 65 | C85: Duke | D85: Dwarf | E85: NO | H85: 1 | J85: 1 | K85: 1 | M85: 1 | P85: 1 | Q85: Member | R85: 1
A86: =HYPERLINK("http://www.magelo.com/eq_view_profile.html?num=615440","Kwaidd") -> Kwaidd | B86: 65 | D86: Dwarf | E86: NO | G86: 1 | H86: 1 | J86: 1 | M86: 1 | N86: 1 | P86: 1 | Q86: Member | R86: 1
A87: =HYPERLINK("http://www.magelo.com/eq_view_profile.html?num=301696","Shadrakk") -> Shadrakk | B87: 64 | D87: Human | E87: NO | J87: 1 | P87: 1 | Q87: Member | R87: 1
A88: Ranger
A89: =HYPERLINK("http://www.magelo.com/eq_view_profile.html?num=66546","Canis") -> Canis | B89: 65 | C89: Hunter | D89: Wood Elf | E89: YES | G89: 1 | H89: 1 | I89: 1 | J89: 1 | K89: 1 | L89: 1 | M89: 1 | N89: 1 | O89: 1 | P89: 1 | Q89: Member | R89: 1
A90: =HYPERLINK("http://www.magelo.com/eq_view_profile.html?num=391661","Molian") -> Molian | B90: 65 | C90: Hunter | D90: Wood Elf | E90: YES | F90: 1 | G90: 1 | H90: 1 | I90: 1 | J90: 1 | K90: 1 | L90: 1 | M90: 1 | N90: 1 | P90: 1 | Q90: Member | R90: 1
A91: =HYPERLINK("http://www.magelo.com/eq_view_profile.html?num=350545","Moshady") -> Moshady | B91: 65 | C91: Veteran | D91: Wood Elf | E91: YES | G91: 1 | H91: 1 | I91: 1 | J91: 1 | K91: 1 | L91: 1 | N91: 1 | P91: 1 | Q91: Member | R91: 1
A92: Oakken | B92: 62 | D92: Wood Elf | E92: NO | Q92: Member | R92: 1
A93: Saluki | B93: 65 | D93: Half Elf | E93: YES | G93: 1 | H93: 1 | I93: 1 | J93: 1 | K93: 1 | L93: 1 | M93: 1 | O93: 1 | P93: 1 | Q93: Member | R93: 1
A94: Tyndall | B94: 65 | C94: Hunter | D94: Half Elf | E94: NO | G94: 1 | H94: 1 | I94: 1 | J94: 1 | K94: 1 | L94: 1 | M94: 1 | P94: 1 | Q94: Member | R94: 1
A95: Andriul | B95: 60 | D95: Wood Elf | E95: YES | Q95: On Break
A96: Britania | B96: 63 | D96: Wood Elf | E96: NO | H96: 1 | I96: 1 | J96: 1 | Q96: On Break
A97: Rogues
A98: =HYPERLINK("http://www.magelo.com/eq_view_profile.html?num=524849","Gerhardt") -> Gerhardt | B98: 65 | C98: Marauder | D98: Dwarf | E98: YES | F98: 1 | G98: 1 | H98: 1 | I98: 1 | J98: 1 | K98: 1 | L98: 1 | M98: 1 | N98: 1 | O98: 1 | P98: 1 | Q98: Member | R98: 1
A99: =HYPERLINK("http://www.magelo.com/eq_view_profile.html?num=35808","Honour") -> Honour | B99: 65 | C99: Veteran | D99: Half Elf | E99: YES | F99: 1 | G99: 1 | J99: 1 | K99: 1 | L99: 1 | N99: 1 | P99: 1 | Q99: Member | R99: 1
A100: =HYPERLINK("http://www.magelo.com/eq_view_profile.html?num=319473","Less") -> Less | B100: 65 | C100: Veteran | D100: Barbarian | E100: YES | G100: 1 | H100: 1 | I100: 1 | J100: 1 | K100: 1 | L100: 1 | M100: 1 | P100: 1 | Q100: Officer | R100: 1
A101: =HYPERLINK("http://www.magelo.com/eq_view_profile.html?num=552907","Mindori") -> Mindori | B101: 65 | C101: Veteran | D101: Wood Elf | E101: YES | G101: 1 | H101: 1 | I101: 1 | J101: 1 | K101: 1 | N101: 1 | P101: 1 | Q101: Member | R101: 1
A102: =HYPERLINK("http://www.magelo.com/eq_view_profile.html?num=176420","Morisan") -> Morisan | B102: 65 | C102: Marauder | D102: Dwarf | E102: YES | F102: 1 | G102: 1 | H102: 1 | I102: 1 | J102: 1 | K102: 1 | L102: 1 | M102: 1 | N102: 1 | P102: 1 | Q102: Member | R102: 1
A103: O'Grady | B103: 65 | D103: Dwarf | E103: YES | G103: 1 | H103: 1 | I103: 1 | J103: 1 | K103: 1 | Q103: Member | R103: 1
A104: =HYPERLINK("http://www.magelo.com/eq_view_profile.html?num=512841","Slipn") -> Slipn | B104: 65 | D104: Barbarian | E104: YES | G104: 1 | H104: 1 | I104: 1 | J104: 1 | K104: 1 | N104: 1 | P104: 1 | Q104: Member | R104: 1
A105: =HYPERLINK("http://www.magelo.com/eq_view_profile.html?num=92314","Vestrial") -> Vestrial | B105: 65 | C105: Marauder | D105: Half Elf | E105: YES | F105: 1 | G105: 1 | H105: 1 | I105: 1 | J105: 1 | K105: 1 | N105: 1 | P105: 1 | Q105: Leader | R105: 1
A106: Shadow Knights
A107: =HYPERLINK("http:www.magelo.com/eq_view_profile.html?num=362550","Asdrubael") -> Asdrubael | B107: 65 | C107: Duke | D107: Dark Elf | E107: YES | F107: 1 | G107: 1 | H107: 1 | I107: 1 | J107: 1 | K107: 1 | N107: 1 | O107: 1 | P107: 1 | Q107: Officer | R107: 1
A108: =HYPERLINK("http:www.magelo.com/eq_view_profile.html?num=313032","Groldar") -> Groldar | B108: 65 | D108: Iksar | E108: NO | G108: 1 | H108: 1 | J108: 1 | K108: 1 | L108: 1 | M108: 1 | N108: 1 | P108: 1 | Q108: Member | R108: 1
A109: =HYPERLINK("http://www.legendsoftherealm.com/legends/","Lunna") -> Lunna | B109: 65 | D109: Erudite | E109: NO | G109: 1 | H109: 1 | I109: 1 | J109: 1 | Q109: Member | R109: 1
A110: =HYPERLINK("http://www.magelo.com/eq_view_profile.html?num=70519","Rakum") -> Rakum | B110: 65 | C110: Duke | D110: Troll | E110: NO | G110: 1 | H110: 1 | I110: 1 | J110: 1 | K110: 1 | L110: 1 | M110: 1 | N110: 1 | O110: 1 | P110: 1 | Q110: Member | R110: 1
A111: =HYPERLINK("http://www.magelo.com/eq_view_profile.html?num=359742","Tobak") -> Tobak | B111: 63 | D111: Ogre | E111: YES | F111: 1 | G111: 1 | J111: 1 | K111: 1 | M111: 1 | N111: 1 | P111: 1 | Q111: Member | R111: 1
A112: =HYPERLINK("http://www.magelo.com/eq_view_profile.html?num=555532","Veya") -> Veya | B112: 65 | D112: Iksar | E112: NO | G112: 1 | H112: 1 | I112: 1 | J112: 1 | K112: 1 | L112: 1 | M112: 1 | N112: 1 | P112: 1 | Q112: Member | R112: 1
A113: =HYPERLINK("http://www.magelo.com/eq_view_profile.html?num=350162","Zolgar") -> Zolgar | B113: 65 | C113: Sir | D113: Troll | E113: YES | F113: X | G113: X | H113: X | I113: X | J113: X | K113: X | L113: X | M113: X | N113: X | O113: X | P113: X | Q113: On Break
A114: Shamans
A115: =HYPERLINK("http://www.magelo.com/eq_view_profile.html?num=557618","Aldarien") -> Aldarien | B115: 65 | C115: Venerable | D115: Barbarian | E115: YES | G115: 1 | H115: 1 | I115: 1 | J115: 1 | K115: 1 | L115: 1 | M115: 1 | N115: 1 | O115: 1 | P115: 1 | Q115: Member | R115: 1
A116: =HYPERLINK("http://www.magelo.com/eq_view_profile.html?num=29294","Angryor") -> Angryor | B116: 65 | C116: Baron | D116: Barbarian | E116: YES | H116: 1 | J116: 1 | Q116: Member | R116: 1
A117: Bamslam | B117: 65 | C117: Venerable | D117: Troll | E117: YES | F117: 1 | G117: 1 | H117: 1 | I117: 1 | J117: 1 | P117: 1 | Q117: Officer | R117: 1
A118: =HYPERLINK("http://www.magelo.com/eq_view_profile.html?num=627547","Blisk") -> Blisk | B118: 65 | C118: Baron | D118: Iksar | E118: YES | G118: 1 | H118: 1 | I118: 1 | J118: 1 | K118: 1 | M118: 1 | N118: 1 | P118: 1 | Q118: Member | R118: 1
A119: Bulvyne | B119: 65 | C119: Elder | D119: Barbarian | E119: YES | G119: 1 | H119: 1 | I119: 1 | J119: 1 | L119: 1 | P119: 1 | Q119: Member | R119: 1
A120: Kroze | B120: 65 | D120: Barbarian | E120: YES | H120: 1 | I120: 1 | J120: 1 | P120: 1 | Q120: Member | R120: 1
A121: =HYPERLINK("http://www.magelo.com/eq_view_profile.html?num=183881","Naghite") -> Naghite | B121: 65 | C121: Venerable | D121: Ogre | E121: YES | F121: 1 | G121: 1 | H121: 1 | I121: 1 | J121: 1 | K121: 1 | L121: 1 | M121: 1 | N121: 1 | P121: 1 | Q121: Officer | R121: 1
A122: =HYPERLINK("http://www.magelo.com/eq_view_profile.html?num=347641","Ruanu") -> Ruanu | B122: 65 | C122: Venerable | D122: Troll | E122: YES | F122: 1 | G122: 1 | H122: 1 | J122: 1 | K122: 1 | L122: 1 | P122: 1 | Q122: Member | R122: 1
A123: =HYPERLINK("http://www.magelo.com/eq_view_profile.html?num=197796","Saramina") -> Saramina | B123: 65 | C123: Venerable | D123: Barbarian | E123: YES | F123: 1 | G123: 1 | H123: 1 | I123: 1 | J123: 1 | K123: 1 | N123: 1 | P123: 1 | Q123: Officer | R123: 1
A124: =HYPERLINK("http://www.magelo.com/eq_view_profile.html?num=194845","Ulskun") -> Ulskun | B124: 65 | D124: Barbarian | E124: YES | G124: 1 | H124: 1 | I124: 1 | J124: 1 | N124: 1 | P124: 1 | Q124: Member | R124: 1
A125: =HYPERLINK("http://www.magelo.com/eq_view_profile.html?num=412675","Walknot") -> Walknot | B125: 65 | D125: Ogre | E125: YES | H125: 1 | J125: 1 | O125: 1 | Q125: Member | R125: 1
A126: =HYPERLINK("http://www.magelo.com/eq_view_profile.html?num=356943","Zurs") -> Zurs | B126: 65 | C126: Venerable | D126: Barbarian | E126: YES | F126: X | G126: X | J126: X | Q126: On Break
A127: Kikshaaz | B127: 55 | E127: NO | Q127: Alternate
A128: =HYPERLINK("http://www.magelo.com/eq_view_profile.html?num=341926","Oenone") -> Oenone | B128: 60 | C128: Venerable | D128: Troll | E128: YES | F128: X | Q128: Alternate
A129: Warriors
A130: Caldok | B130: 63 | D130: Dwarf | E130: NO | G130: 1 | H130: 1 | Q130: Member | R130: 1
A131: =HYPERLINK("http://www.magelo.com/eq_view_profile.html?num=357231","Feersum") -> Feersum | B131: 65 | D131: Barbarian | E131: NO | G131: 1 | H131: 1 | I131: 1 | J131: 1 | N131: 1 | P131: 1 | Q131: Member | R131: 1
A132: =HYPERLINK("http://www.magelo.com/eq_view_profile.html?num=70247","Ghazhagh") -> Ghazhagh | B132: 65 | D132: Dwarf | E132: NO | G132: 1 | H132: 1 | I132: 1 | J132: 1 | N132: 1 | P132: 1 | Q132: Member | R132: 1
A133: =HYPERLINK("http://www.magelo.com/eq_view_profile.html?num=343105","Hearsay") -> Hearsay | B133: 65 | C133: Veteran | D133: Barbarian | E133: YES | F133: 1 | G133: 1 | H133: 1 | I133: 1 | J133: 1 | K133: 1 | L133: 1 | M133: 1 | N133: 1 | O133: 1 | P133: 1 | Q133: Member | R133: 1
A134: =HYPERLINK("http://www.magelo.com/eq_view_profile.html?num=641141","Kylliyn") -> Kylliyn | B134: 65 | C134: Veteran | D134: Dwarf | E134: NO | G134: 1 | H134: 1 | I134: 1 | J134: 1 | K134: 1 | O134: 1 | P134: 1 | Q134: Member | R134: 1
A135: Makyaded | B135: 65 | D135: Barbarian | E135: NO | H135: 1 | Q135: Member | R135: 1
A136: =HYPERLINK("http://www.magelo.com/eq_view_profile.html?num=599043","Matsu") -> Matsu | B136: 65 | C136: Veteran | D136: Halfling | E136: YES | F136: 1 | G136: 1 | H136: 1 | I136: 1 | J136: 1 | K136: 1 | M136: 1 | N136: 1 | O136: 1 | P136: 1 | Q136: Member | R136: 1
A137: Panzona | B137: 65 | D137: Halfling | E137: NO | H137: 1 | I137: 1 | J137: 1 | Q137: Member | R137: 1
A138: =HYPERLINK("http://www.magelo.com/eq_view_profile.html?num=265387","Sarelin") -> Sarelin | B138: 65 | C138: Marshall | D138: Barbarian | E138: NO | H138: 1 | I138: 1 | J138: 1 | K138: 1 | L138: 1 | M138: 1 | O138: 1 | P138: 1 | Q138: Member | R138: 1
A139: =HYPERLINK("http://www.magelo.com/eq_view_profile.html?num=361707","Veera") -> Veera | B139: 55 | D139: Barbarian | E139: NO | Q139: Member | R139: 1
A140: =HYPERLINK("http://www.magelo.com/eq_view_profile.html?num=141424","Agus") -> Agus | B140: 65 | C140: Veteran | D140: Halfling | E140: YES | F140: X | G140: X | J140: X | K140: X | N140: X | P140: X | Q140: Officer - OB
A141: =HYPERLINK("http://www.magelo.com/eq_view_profile.html?num=244458","Mouxxie") -> Mouxxie | B141: 65 | C141: Baroness | D141: Halfling | E141: NO | F141: 1 | G141: 1 | H141: 1 | J141: 1 | K141: 1 | M141: 1 | P141: 1 | Q141: On Break
A142: =HYPERLINK("http://www.magelo.com/eq_view_profile.html?num=98879","Silph") -> Silph | B142: 65 | C142: Marshall | D142: Human | E142: YES | F142: X | G142: X | J142: X | K142: X | L142: X | M142: X | P142: X | Q142: On Break
A143: Zeal | B143: 65 | D143: Ogre | E143: NO | J143: X | P143: X | Q143: Alternate
A144: Wizards
A145: =HYPERLINK("http://www.magelo.com/eq_view_profile.html?num=202761","Aylith") -> Aylith | B145: 65 | C145: Mistress | D145: High Elf | E145: YES | F145: 1 | G145: 1 | H145: 1 | J145: 1 | K145: 1 | L145: 1 | P145: 1 | Q145: Member | R145: 1
A146: =HYPERLINK("http://www.magelo.com/eq_view_profile.html?num=360232","Kanah") -> Kanah | B146: 65 | C146: Sage | D146: Dark Elf | E146: YES | G146: 1 | H146: 1 | I146: 1 | J146: 1 | K146: 1 | M146: 1 | N146: 1 | O146: 1 | P146: 1 | Q146: Member | R146: 1
A147: Zeanith | B147: 58 | D147: Dark Elf | E147: NO | J147: 1 | Q147: Member | R147: 1
A148: Fairuza | B148: 62 | D148: Erudite | E148: YES | N148: X | Q148: Officer - OB
A149: Aurillicus | B149: 58 | D149: High Elf | E149: NO | H149: X | I149: X | J149: X | K149: X | Q149: Alternate
A150: Kelben | B150: 61 | C150: Baron | D150: Human | E150: YES | Q150: Alternate
A151: Siobahn | B151: 63 | D151: Dark Elf | E151: NO | Q151: Alternate
A152: Ticktick | B152: 65 | D152: Froglock | E152: NO | H152: X | I152: X | J152: X | K152: X | Q152: Alternate
A153: # of Active Members | B153: =SUM(R4:R152) -> 92 | F153: =SUM(F4:F152)/B153*1 -> 0.40217391304347827 | G153: =SUM(G4:G152)/B153*1 -> 0.76086956521739135 | H153: =SUM(H4:H152)/B153*1 -> 0.93478260869565222 | I153: =SUM(I4:I152)/B153*1 -> 0.70652173913043481 | J153: =SUM(J4:J152)/B153*1 -> 0.92391304347826086 | K153: =SUM(K4:K152)/B153*1 -> 0.69565217391304346 | L153: =SUM(L4:L152)/B153*1 -> 0.36956521739130432 | M153: =SUM(M4:M152)/B153*1 -> 0.44565217391304346 | N153: =SUM(N4:N152)/B153*1 -> 0.56521739130434778 | O153: =SUM(O4:O152)/B153*1 -> 0.34782608695652173 | P153: =SUM(P4:P152)/B153*1 -> 0.75 | Q153: 37833
A154: Average Level | B154: =AVERAGE(B17:B29,B64:B67,B145:B148,B130:B142,B107:B113,B82:B87,B115:B126,B98:B105,B4:B9,B53:B58,B70:B74,B40:B49,B89:B96,B76:B79,B11:B15) -> 64.207207207207205
A156: PROSPECTS
A157: NAME | B157: Levels | C157: CLASS
A158: Chantarin | B158: 65 | C158: PAL
A159: Giverlife | B159: 65 | C159: CLR
A160: Beaa | B160: 65 | C160: NEC
A161: Kaziel | B161: 65 | C161: RNG
A162: Qyzus | B162: 65 | C162: ENC
A163: Rothe | B163: 65 | C163: RNG