A1: Alias | B1: Class | C1: Posse # | D1: Stage 1 | E1: Stage 2 | F1: Stage 3 | G1: Stage 4 | H1: Stage 5 | J1: Total
A2: Bounty seeker | B2: D | C2: 1 | D2: 87.65 | E2: 91.72 | F2: 47.91 | G2: 107.2 | H2: 84.29 | J2: =SUM(C2:I2) -> 419.77
A3: Bullshooter Bob | B3: D | C3: 2 | D3: 88.38 | E3: 93.48 | F3: 42.03 | G3: 109.27 | H3: 113.78 | J3: =SUM(C3:I3) -> 448.94
A4: Canktankerous | B4: D | C4: 4 | D4: 81.04 | E4: 115.01 | F4: 59.38 | G4: 106.58 | H4: 92.84 | J4: =SUM(C4:I4) -> 458.85
A5: J.D. Hardrider | B5: D | C5: 2 | D5: 89.59 | E5: 98.48 | F5: 85.15 | G5: 129.63 | H5: 94.43 | J5: =SUM(C5:I5) -> 499.28
A6: Johnny Rio | B6: D | C6: 3 | D6: 83.01 | E6: 93.77 | F6: 98.73 | G6: 109.17 | H6: 119.57 | J6: =SUM(C6:I6) -> 507.25
A7: Missouri Buck | B7: D | C7: 2 | D7: 76.39 | E7: 87.75 | F7: 53.12 | G7: 107.92 | H7: 99.15 | J7: =SUM(C7:I7) -> 426.33
A8: Missouri Bull | B8: D | C8: 2 | D8: 81.63 | E8: 83.76 | F8: 62.43 | G8: 103.87 | H8: 70.3 | J8: =SUM(C8:I8) -> 403.99
A9: Nathan Ward | B9: D | C9: 5 | D9: 74.29 | E9: 93.39 | F9: 53.54 | G9: 119.67 | H9: 86.65 | J9: =SUM(C9:I9) -> 432.54
A10: Possom Creek Bill | B10: D | C10: 4 | D10: 55.78 | E10: 79.96 | F10: 51.13 | G10: 81.55 | H10: 69.25 | J10: =SUM(C10:I10) -> 341.67
A11: Railroad Bill | B11: D | C11: 4 | D11: 71.56 | E11: 67.6 | F11: 85.56 | G11: 113.73 | H11: 92.33 | J11: =SUM(C11:I11) -> 434.78
A12: Remy McSwain | B12: D | C12: 1 | D12: 98.8 | E12: 116.19 | F12: 69.42 | G12: 157.25 | H12: 112.32 | J12: =SUM(C12:I12) -> 554.98
A13: Topkick Kalispel | B13: D | C13: 4 | D13: 68.68 | E13: 77.17 | F13: 62.02 | G13: 93.68 | H13: 83.35 | J13: =SUM(C13:I13) -> 388.9
A14: Wes Dixon | B14: D | C14: 5 | D14: 74.31 | E14: 118.91 | F14: 66.89 | G14: 92.05 | H14: 88.95 | J14: =SUM(C14:I14) -> 446.11
A15: Will Shortly | B15: D | C15: 1 | D15: 81.88 | E15: 97.08 | F15: 69.76 | G15: 105.33 | H15: 89.97 | J15: =SUM(C15:I15) -> 445.02
A16: Highridge Drifter | B16: F | C16: 2 | D16: 72.86 | E16: 75.74 | F16: 52.49 | G16: 114.65 | H16: 74.23 | J16: =SUM(C16:I16) -> 391.97
A17: Missouri Kid | B17: M | C17: 4 | D17: 122.27 | E17: 118.04 | F17: 92.45 | G17: 173.57 | H17: 89.17 | J17: =SUM(C17:I17) -> 599.5
A18: Ranger Marlin Ruger | B18: M | C18: 2 | D18: 72.28 | E18: 78.95 | F18: 50.1 | G18: 94.76 | H18: 100.3 | J18: =SUM(C18:I18) -> 398.39
A19: Elmo | B19: M/J/W | C19: 3 | D19: 115.29 | E19: 124.69 | F19: 72.44 | G19: 131.16 | H19: 126.85 | J19: =SUM(C19:I19) -> 573.43
A20: One Foot Wednesday | B20: M/J/W | C20: 3 | D20: 109.28 | E20: 140.65 | F20: 108.52 | G20: 168.64 | H20: 146.59 | J20: =SUM(C20:I20) -> 676.68
A21: Blind Guy | B21: M/S | C21: 4 | D21: 141.65 | E21: 93.95 | F21: 82.77 | G21: 110.71 | H21: 217.56 | J21: =SUM(C21:I21) -> 650.64
A22: Dirty "D" | B22: M/S | C22: 5 | D22: 105.78 | E22: 136.65 | F22: 76.63 | H22: 117.88 | J22: =SUM(C22:I22) -> 441.94
A23: B.T. Smithereens | B23: T | C23: 3 | D23: 81.15 | E23: 107.89 | F23: 56.93 | G23: 125.65 | H23: 124.18 | J23: =SUM(C23:I23) -> 498.8
A24: Bad Boy Eric Johnston | B24: T | C24: 1 | D24: 143.21 | E24: 168.88 | F24: 94.09 | G24: 190.08 | H24: 214.81 | J24: =SUM(C24:I24) -> 812.07
A25: Cart Ridge | B25: T | C25: 3 | D25: 60.5 | E25: 75.86 | F25: 54.64 | G25: 73.69 | H25: 77.51 | J25: =SUM(C25:I25) -> 345.2
A26: CC Morgan | B26: T | C26: 2 | D26: 59.1 | E26: 97.42 | F26: 64.4 | G26: 92.02 | H26: 86.59 | J26: =SUM(C26:I26) -> 401.53
A27: City Slicker | B27: T | C27: 5 | D27: 140.04 | E27: 152.66 | F27: 126.32 | G27: 138.81 | H27: 163.2 | J27: =SUM(C27:I27) -> 726.03
A28: Deacun | B28: T | C28: 3 | D28: 118.67 | E28: 120.64 | F28: 99.35 | G28: 195.14 | H28: 148.83 | J28: =SUM(C28:I28) -> 685.63
A29: Deadly "D" | B29: T | C29: 1 | D29: 99.09 | E29: 91.46 | F29: 58.84 | G29: 143.07 | H29: 96.24 | J29: =SUM(C29:I29) -> 489.7
A30: Destiny West | B30: T | C30: 4 | D30: 99.27 | E30: 84.88 | F30: 94.71 | G30: 120.36 | H30: 99.96 | J30: =SUM(C30:I30) -> 503.18
A31: Dirt Water Dan | B31: T | C31: 1 | D31: 113.71 | E31: 142.07 | F31: 79.82 | G31: 165.49 | H31: 128.63 | J31: =SUM(C31:I31) -> 630.72
A32: Dirty Mo Steve | B32: T | C32: 5 | D32: 64.09 | E32: 56.79 | F32: 32.24 | G32: 66.51 | H32: 65.83 | J32: =SUM(C32:I32) -> 290.46
A33: Dusty Rivers | B33: T | C33: 5 | D33: 79.61 | E33: 112.44 | F33: 70.75 | G33: 122.73 | H33: 100.14 | J33: =SUM(C33:I33) -> 490.67
A34: Dusty Waters | B34: T | C34: 3 | D34: 75.84 | E34: 95.71 | F34: 54.13 | G34: 126.29 | H34: 96.03 | J34: =SUM(C34:I34) -> 451
A35: Dutch Billy Lee | B35: T | C35: 1 | D35: 97.8 | E35: 106.26 | F35: 53.46 | G35: 103.03 | H35: 64.2 | J35: =SUM(C35:I35) -> 425.75
A36: Flat Land Phil | B36: T | C36: 2 | D36: 58.84 | E36: 63.02 | F36: 57.23 | G36: 90.06 | H36: 60.38 | J36: =SUM(C36:I36) -> 331.53
A37: J.D. Webfoot | B37: T | C37: 1 | D37: 76.87 | E37: 102.25 | F37: 58.74 | G37: 98.64 | H37: 115.5 | J37: =SUM(C37:I37) -> 453
A38: Jimmy John Daniels | B38: T | C38: 5 | D38: 78.73 | E38: 84.93 | F38: 47.03 | G38: 97.4 | H38: 81.7 | J38: =SUM(C38:I38) -> 394.79
A39: Joe Lefores | B39: T | C39: 2 | D39: 81.77 | E39: 122.36 | F39: 86.44 | G39: 104.56 | H39: 101.17 | J39: =SUM(C39:I39) -> 498.3
A40: Joe Lefores | B40: T | C40: 3 | D40: 118.83 | E40: 147.77 | F40: 116.28 | G40: 165.09 | H40: 136.25 | J40: =SUM(C40:I40) -> 687.22
A41: Johny 1 Horse | B41: T | C41: 1 | D41: 107.55 | E41: 98.93 | F41: 79.66 | G41: 136.59 | H41: 101.22 | J41: =SUM(C41:I41) -> 524.95
A42: Kentucky Buck | B42: T | C42: 4 | D42: 141.69 | E42: 111.38 | F42: 99.19 | G42: 113.15 | H42: 107.91 | J42: =SUM(C42:I42) -> 577.32
A43: Kid Cole | B43: T | C43: 3 | D43: 71.56 | E43: 84.95 | F43: 71.74 | G43: 97.11 | H43: 84.14 | J43: =SUM(C43:I43) -> 412.5
A44: Kid Klondike | B44: T | C44: 2 | D44: 82.74 | E44: 106.66 | F44: 98.77 | G44: 104.12 | H44: 91.38 | J44: =SUM(C44:I44) -> 485.67
A45: Lefty | B45: T | C45: 1 | D45: 93.66 | E45: 92.1 | F45: 74.65 | G45: 122.07 | H45: 108.83 | J45: =SUM(C45:I45) -> 492.31
A46: Marshal Zeke | B46: T | C46: 4 | D46: 73.14 | E46: 89.85 | F46: 74.16 | G46: 115.72 | H46: 112.02 | J46: =SUM(C46:I46) -> 468.89
A47: Moss Nobody | B47: T | C47: 5 | D47: 42.04 | E47: 39.34 | F47: 45.43 | G47: 68.76 | H47: 47.95 | J47: =SUM(C47:I47) -> 248.52
A48: Rancher | B48: T | C48: 5 | D48: 94.65 | E48: 120 | F48: 77.32 | G48: 119.11 | H48: 107.85 | J48: =SUM(C48:I48) -> 523.93
A49: Ranger | B49: T | C49: 4 | D49: 69.35 | E49: 74.69 | F49: 53.38 | G49: 81.77 | H49: 78.96 | J49: =SUM(C49:I49) -> 362.15
A50: St. Louis Reb | B50: T | C50: 5 | D50: 156.03 | H50: 159.49 | J50: =SUM(C50:I50) -> 320.52
A51: T Bone McNasty | B51: T | C51: 5 | D51: 106.85 | E51: 109.29 | G51: 158.43 | H51: 128.2 | J51: =SUM(C51:I51) -> 507.77
A52: Trapper | B52: T | C52: 2 | D52: 56.5 | E52: 63.24 | F52: 56.54 | G52: 94.54 | H52: 76.81 | J52: =SUM(C52:I52) -> 349.63
A53: Red Ryder` | B53: T/S | C53: 3 | D53: 81.15 | E53: 101.43 | F53: 102.92 | G53: 117.92 | H53: 106.13 | J53: =SUM(C53:I53) -> 512.55
A54: Stumpe | B54: T/S | C54: 1 | D54: 94.8 | E54: 100.94 | F54: 69.09 | G54: 111.97 | H54: 101.75 | J54: =SUM(C54:I54) -> 479.55
A55: Uncle Leonard | B55: T/S | C55: 5 | D55: 135.72 | E55: 151.5 | F55: 85.12 | G55: 157.72 | H55: 178.73 | J55: =SUM(C55:I55) -> 713.79
A56: Bonnie Tear | B56: T/W | C56: 4 | D56: 54 | E56: 53.97 | F56: 46.56 | G56: 97.11 | H56: 53.41 | J56: =SUM(C56:I56) -> 309.05
A57: Crazy Mary | B57: T/W | C57: 3 | D57: 77.86 | E57: 81.25 | F57: 61.9 | G57: 94.65 | H57: 118.33 | J57: =SUM(C57:I57) -> 436.99
A58: Ellie Oakely | B58: T/W | C58: 4 | D58: 109.29 | E58: 127.23 | F58: 74.37 | G58: 134.64 | H58: 113.24 | J58: =SUM(C58:I58) -> 562.77
A59: Miss Savella | B59: T/W | C59: 5 | D59: 124.88 | E59: 120.28 | F59: 86.44 | G59: 178.16 | H59: 134.39 | J59: =SUM(C59:I59) -> 649.15
A60: Nita Ryder | B60: T/W | C60: 2 | D60: 110.07 | E60: 168.03 | F60: 117.61 | G60: 217.81 | H60: 134.13 | J60: =SUM(C60:I60) -> 749.65
A62: Average Per Stage | D62: =SUM(D2:D61)/59 -> 91.238135593220349 | E62: =SUM(E2:E61)/59 -> 100.19135593220339 | F62: =SUM(F2:F61)/59 -> 69.876610169491514 | G62: =SUM(G2:G61)/59 -> 116.44677966101696 | H62: =SUM(H2:H61)/59 -> 106.36915254237289