A1: Name | B1: Effect | C1: Ranking | D1: AC | E1: STR | F1: STA | G1: AGI | H1: DEX | I1: WIS | J1: INT | K1: CHA | L1: HP | M1: MANA | N1: PR | O1: MR | P1: DR | Q1: FR | R1: CR | S1: WT | T1: WP | U1: Type
A2: Cloak of Thorns | B2: Thorny Shield | C2: =(I2*10)+M2+(D2*4)+G2+(L2/5)+(F2*2)+(E2*2)+(K2*2)+(O2/2)+(Q2/2)+(R2/2)+(N2/4)+(P2/4)+30 -> 443 | D2: 35.0 | E2: 12.0 | F2: 12.0 | H2: 12.0 | I2: 15.0 | L2: 100.0 | M2: 50.0 | N2: 10.0 | P2: 10.0 | S2: 0.0 | T2: =0-(QUOTIENT(S2, 5)) -> 0 | U2: back
A3: Cloak of the Sky | C3: =(I3*10)+M3+(D3*4)+G3+(L3/5)+(F3*2)+(E3*2)+(K3*2)+(O3/2)+(Q3/2)+(R3/2)+(N3/4)+(P3/4) -> 385 | D3: 25.0 | G3: 15.0 | I3: 15.0 | L3: 100.0 | M3: 100.0 | S3: 0.0 | T3: =0-(QUOTIENT(S3, 5)) -> 0 | U3: back
A4: Shroud of Veeshan | C4: =(I4*10)+M4+(D4*4)+G4+(L4/5)+(F4*2)+(E4*2)+(K4*2)+(O4/2)+(Q4/2)+(R4/2)+(N4/4)+(P4/4) -> 357 | D4: 15.0 | E4: 8.0 | F4: 8.0 | G4: 8.0 | H4: 8.0 | I4: 12.0 | J4: 12.0 | K4: 8.0 | L4: 55.0 | M4: 110.0 | S4: 1.0 | T4: =0-(QUOTIENT(S4, 5)) -> 0 | U4: back
A5: Shroud of the Dar Brood | B5: Haste | C5: =(I5*10)+M5+(D5*4)+G5+(L5/5)+(F5*2)+(E5*2)+(K5*2)+(O5/2)+(Q5/2)+(R5/2)+(N5/4)+(P5/4)+30 -> 261 | D5: 14.0 | F5: 8.0 | I5: 9.0 | J5: 9.0 | L5: 20.0 | M5: 50.0 | O5: 10.0 | Q5: 10.0 | R5: 10.0 | S5: 1.0 | T5: =0-(QUOTIENT(S5, 5)) -> 0 | U5: back
A6: Cloak of Piety | B6: Haste | C6: =(I6*10)+M6+(D6*4)+G6+(L6/5)+(F6*2)+(E6*2)+(K6*2)+(O6/2)+(Q6/2)+(R6/2)+(N6/4)+(P6/4)+30 -> 232 | D6: 12.0 | E6: 12.0 | I6: 12.0 | J6: 12.0 | O6: 10.0 | Q6: 10.0 | S6: 1.5 | T6: =0-(QUOTIENT(S6, 5)) -> 0 | U6: back
A7: Frostreaver's Embroidered Cloak | C7: =(I7*10)+M7+(D7*4)+G7+(L7/5)+(F7*2)+(E7*2)+(K7*2)+(O7/2)+(Q7/2)+(R7/2)+(N7/4)+(P7/4) -> 221 | D7: 15.0 | I7: 8.0 | J7: 8.0 | K7: 8.0 | M7: 50.0 | Q7: 15.0 | R7: 15.0 | S7: 2.0 | T7: =0-(QUOTIENT(S7, 5)) -> 0 | U7: back
A8: White Dragonscale Cloak | C8: =(I8*10)+M8+(D8*4)+G8+(L8/5)+(F8*2)+(E8*2)+(K8*2)+(O8/2)+(Q8/2)+(R8/2)+(N8/4)+(P8/4) -> 217.5 | D8: 10.0 | I8: 9.0 | J8: 9.0 | M8: 75.0 | R8: 25.0 | S8: 0.0 | T8: =0-(QUOTIENT(S8, 5)) -> 0 | U8: back
A9: Hierophant's Cloak | C9: =(I9*10)+M9+(D9*4)+G9+(L9/5)+(F9*2)+(E9*2)+(K9*2)+(O9/2)+(Q9/2)+(R9/2)+(N9/4)+(P9/4) -> 198 | D9: 10.0 | E9: 4.0 | F9: 4.0 | G9: 4.0 | H9: 4.0 | I9: 4.0 | J9: 4.0 | K9: 4.0 | L9: 75.0 | M9: 75.0 | S9: 1.0 | T9: =0-(QUOTIENT(S9, 5)) -> 0 | U9: back
A10: Tattered Hide Cloak | C10: =(I10*10)+M10+(D10*4)+G10+(L10/5)+(F10*2)+(E10*2)+(K10*2)+(O10/2)+(Q10/2)+(R10/2)+(N10/4)+(P10/4) -> 176 | D10: 9 | F10: 6 | I10: 6 | L10: 55 | M10: 55 | P10: 8 | S10: 1 | U10: back
A11: Cloak of Truth | C11: =(I11*10)+M11+(D11*4)+G11+(L11/5)+(F11*2)+(E11*2)+(K11*2)+(O11/2)+(Q11/2)+(R11/2)+(N11/4)+(P11/4) -> 170 | D11: 15 | E11: 10 | H11: 5 | I11: 8 | K11: 5 | S11: 13 | U11: back
A12: Diamond Studded Cape | C12: =(I12*10)+M12+(D12*4)+G12+(L12/5)+(F12*2)+(E12*2)+(K12*2)+(O12/2)+(Q12/2)+(R12/2)+(N12/4)+(P12/4) -> 170 | D12: 9.0 | I12: 10.0 | L12: 20.0 | M12: 20.0 | N12: 10.0 | O12: 10.0 | P12: 10.0 | S12: 1.0 | T12: =0-(QUOTIENT(S12, 5)) -> 0 | U12: back
A13: Grayder's Cloak | C13: =(I13*10)+M13+(D13*4)+G13+(L13/5)+(F13*2)+(E13*2)+(K13*2)+(O13/2)+(Q13/2)+(R13/2)+(N13/4)+(P13/4) -> 165 | D13: 12.0 | I13: 9.0 | M13: 20.0 | O13: 7.0 | R13: 7.0 | S13: 1.0 | T13: =0-(QUOTIENT(S13, 5)) -> 0 | U13: back
A14: Cloak of Confusion | C14: =(I14*10)+M14+(D14*4)+G14+(L14/5)+(F14*2)+(E14*2)+(K14*2)+(O14/2)+(Q14/2)+(R14/2)+(N14/4)+(P14/4) -> 157.5 | D14: 14.0 | E14: 10.0 | F14: 15.0 | K14: 15.0 | L14: 45.0 | N14: 5.0 | O14: 10.0 | P14: 5.0 | Q14: 5.0 | R14: 5.0 | S14: 0.0 | T14: =0-(QUOTIENT(S14, 5)) -> 0 | U14: back
A15: Iksar Hide Cape | C15: =(I15*10)+M15+(D15*4)+G15+(L15/5)+(F15*2)+(E15*2)+(K15*2)+(O15/2)+(Q15/2)+(R15/2)+(N15/4)+(P15/4) -> 137.5 | D15: 10.0 | L15: 75.0 | M15: 75.0 | N15: 15.0 | P15: 15.0 | S15: 3.0 | T15: =0-(QUOTIENT(S15, 5)) -> 0 | U15: back
A16: Cloak of Crystalline Waters | B16: Haste | C16: =(I16*10)+M16+(D16*4)+G16+(L16/5)+(F16*2)+(E16*2)+(K16*2)+(O16/2)+(Q16/2)+(R16/2)+(N16/4)+(P16/4)+30 -> 136.5 | D16: 10.0 | G16: 9.0 | H16: 9.0 | M16: 50.0 | R16: 15.0 | S16: 00.1 | T16: =0-(QUOTIENT(S16, 5)) -> 0 | U16: back
A17: Cloak of Leaves | C17: =(I17*10)+M17+(D17*4)+G17+(L17/5)+(F17*2)+(E17*2)+(K17*2)+(O17/2)+(Q17/2)+(R17/2)+(N17/4)+(P17/4) -> 134 | D17: 12.0 | I17: 5.0 | L17: 30.0 | M17: 30.0 | S17: 0.0 | T17: =0-(QUOTIENT(S17, 5)) -> 0 | U17: back
A18: Siblisian Berserker Cloak | B18: Haste | C18: =(I18*10)+M18+(D18*4)+G18+(L18/5)+(F18*2)+(E18*2)+(K18*2)+(O18/2)+(Q18/2)+(R18/2)+(N18/4)+(P18/4)+30 -> 121 | D18: 9.0 | E18: 9.0 | F18: 9.0 | G18: 9.0 | H18: 9.0 | L18: 50.0 | S18: 00.1 | T18: =0-(QUOTIENT(S18, 5)) -> 0 | U18: back
A19: Cobalt Drake Cloak | C19: =(I19*10)+M19+(D19*4)+G19+(L19/5)+(F19*2)+(E19*2)+(K19*2)+(O19/2)+(Q19/2)+(R19/2)+(N19/4)+(P19/4) -> 119 | D19: 9.0 | E19: 8.0 | I19: 4.0 | M19: 23.0 | R19: 8.0 | S19: 2.0 | T19: =0-(QUOTIENT(S19, 5)) -> 0 | U19: back
A20: Emerald Cloak of the Faydark | B20: Gate to Faydark | C20: =(I20*10)+M20+(D20*4)+G20+(L20/5)+(F20*2)+(E20*2)+(K20*2)+(O20/2)+(Q20/2)+(R20/2)+(N20/4)+(P20/4)+30 -> 105 | D20: 5.0 | K20: 10.0 | L20: 25.0 | M20: 25.0 | N20: 10.0 | P20: 10.0 | S20: 0.0 | T20: =0-(QUOTIENT(S20, 5)) -> 0 | U20: back
A21: Dabner's Traveling Cloak | C21: =(I21*10)+M21+(D21*4)+G21+(L21/5)+(F21*2)+(E21*2)+(K21*2)+(O21/2)+(Q21/2)+(R21/2)+(N21/4)+(P21/4) -> 104.5 | D21: 8.0 | I21: 5.0 | M21: 15.0 | O21: 5.0 | Q21: 5.0 | R21: 5.0 | S21: 1.0 | T21: =0-(QUOTIENT(S21, 5)) -> 0 | U21: back
A22: Windy Cloak | C22: =(I22*10)+M22+(D22*4)+G22+(L22/5)+(F22*2)+(E22*2)+(K22*2)+(O22/2)+(Q22/2)+(R22/2)+(N22/4)+(P22/4) -> 100 | D22: 10 | I22: 3 | J22: 3 | M22: 25 | O22: 10 | S22: 1.5 | U22: back
A23: Shissar Scale Cloak | C23: =(I23*10)+M23+(D23*4)+G23+(L23/5)+(F23*2)+(E23*2)+(K23*2)+(O23/2)+(Q23/2)+(R23/2)+(N23/4)+(P23/4) -> 99 | D23: 6 | I23: 5 | J23: 5 | M23: 25 | S23: 2.5 | U23: back
A24: Cloak of Flames | B24: Haste | C24: =(I24*10)+M24+(D24*4)+G24+(L24/5)+(F24*2)+(E24*2)+(K24*2)+(O24/2)+(Q24/2)+(R24/2)+(N24/4)+(P24/4)+30 -> 96.5 | D24: 10.0 | G24: 9.0 | H24: 9.0 | L24: 50.0 | Q24: 15.0 | S24: 00.1 | T24: =0-(QUOTIENT(S24, 5)) -> 0 | U24: back
A25: Cloak of Torment | C25: =(I25*10)+M25+(D25*4)+G25+(L25/5)+(F25*2)+(E25*2)+(K25*2)+(O25/2)+(Q25/2)+(R25/2)+(N25/4)+(P25/4) -> 88 | D25: 10 | E25: 4 | I25: 4 | J25: 4 | S25: 1 | U25: back
A26: Othmir Fur Cloak | C26: =(I26*10)+M26+(D26*4)+G26+(L26/5)+(F26*2)+(E26*2)+(K26*2)+(O26/2)+(Q26/2)+(R26/2)+(N26/4)+(P26/4) -> 87 | D26: 6.0 | F26: 6.0 | I26: 4.0 | K26: 2.0 | M26: 5.0 | O26: 2.0 | P26: 4.0 | S26: 1.6 | T26: =0-(QUOTIENT(S26, 5)) -> 0 | U26: back
A27: Danak's Cloak of Battle | C27: =(I27*10)+M27+(D27*4)+G27+(L27/5)+(F27*2)+(E27*2)+(K27*2)+(O27/2)+(Q27/2)+(R27/2)+(N27/4)+(P27/4) -> 86 | D27: 6.0 | E27: 4.0 | F27: 7.0 | I27: 4.0 | S27: 00.1 | T27: =0-(QUOTIENT(S27, 5)) -> 0 | U27: back
A28: Earth Blessed Cape | C28: =(I28*10)+M28+(D28*4)+G28+(L28/5)+(F28*2)+(E28*2)+(K28*2)+(O28/2)+(Q28/2)+(R28/2)+(N28/4)+(P28/4) -> 84.6 | D28: 8 | F28: 3 | H28: 1 | I28: 4 | L28: 3 | M28: 5 | Q28: 1 | R28: 1 | S28: 1 | U28: back
A29: Zavo's Cloak of the Mortals | C29: =(I29*10)+M29+(D29*4)+G29+(L29/5)+(F29*2)+(E29*2)+(K29*2)+(O29/2)+(Q29/2)+(R29/2)+(N29/4)+(P29/4) -> 82.5 | D29: 5.0 | E29: 5.0 | H29: 5.0 | I29: 3.0 | J29: 3.0 | O29: 15.0 | Q29: 15.0 | R29: 15.0 | S29: 3.0 | T29: =0-(QUOTIENT(S29, 5)) -> 0 | U29: back
A30: Validus Scout Cloak | B30: Camouflage | C30: =(I30*10)+M30+(D30*4)+G30+(L30/5)+(F30*2)+(E30*2)+(K30*2)+(O30/2)+(Q30/2)+(R30/2)+(N30/4)+(P30/4) -> 82 | D30: 8 | F30: 6 | G30: 8 | M30: 30 | S30: 0.5 | U30: cloak
A31: Slick Leather Courier's Cape | C31: =(I31*10)+M31+(D31*4)+G31+(L31/5)+(F31*2)+(E31*2)+(K31*2)+(O31/2)+(Q31/2)+(R31/2)+(N31/4)+(P31/4) -> 77 | D31: 9.0 | E31: 5.0 | F31: 8.0 | G31: 5.0 | J31: 5.0 | L31: 50.0 | S31: 2.0 | T31: =0-(QUOTIENT(S31, 5)) -> 0 | U31: back
A32: Onyx Drakescale Cloak | C32: =(I32*10)+M32+(D32*4)+G32+(L32/5)+(F32*2)+(E32*2)+(K32*2)+(O32/2)+(Q32/2)+(R32/2)+(N32/4)+(P32/4) -> 76 | D32: 8.0 | G32: 9.0 | M32: 35.0 | S32: 2.5 | T32: =0-(QUOTIENT(S32, 5)) -> 0 | U32: back
A33: Imbued Elven Chainmail Cloak | C33: =(I33*10)+M33+(D33*4)+G33+(L33/5)+(F33*2)+(E33*2)+(K33*2)+(O33/2)+(Q33/2)+(R33/2)+(N33/4)+(P33/4) -> 74 | D33: 7.0 | I33: 4.0 | J33: 4.0 | K33: 2.0 | O33: 4.0 | S33: 00.7 | T33: =0-(QUOTIENT(S33, 5)) -> 0 | U33: back
A34: Cloak of the Maelstrom | C34: =(I34*10)+M34+(D34*4)+G34+(L34/5)+(F34*2)+(E34*2)+(K34*2)+(O34/2)+(Q34/2)+(R34/2)+(N34/4)+(P34/4) -> 73 | D34: 11.0 | E34: 3.0 | F34: 6.0 | H34: 10.0 | J34: 5.0 | L34: 55.0 | S34: 20.0 | T34: =0-(QUOTIENT(S34, 5)) -> -4 | U34: back
A35: Velium Hound Fur Cloak | C35: =(I35*10)+M35+(D35*4)+G35+(L35/5)+(F35*2)+(E35*2)+(K35*2)+(O35/2)+(Q35/2)+(R35/2)+(N35/4)+(P35/4) -> 73 | D35: 8.0 | E35: 8.0 | F35: 10.0 | Q35: 5.0 | R35: 5.0 | S35: 1.9 | T35: =0-(QUOTIENT(S35, 5)) -> 0 | U35: back
A36: Cape of the Corpsemaster | C36: =(I36*10)+M36+(D36*4)+G36+(L36/5)+(F36*2)+(E36*2)+(K36*2)+(O36/2)+(Q36/2)+(R36/2)+(N36/4)+(P36/4) -> 72 | D36: 8 | E36: 2 | L36: 30 | M36: 30 | S36: 00.3 | U36: back
A37: Mammoth Hide Cloak | C37: =(I37*10)+M37+(D37*4)+G37+(L37/5)+(F37*2)+(E37*2)+(K37*2)+(O37/2)+(Q37/2)+(R37/2)+(N37/4)+(P37/4) -> 70.5 | D37: 7.0 | I37: 4.0 | R37: 5.0 | S37: 2.5 | T37: =0-(QUOTIENT(S37, 5)) -> 0 | U37: back
A38: Wurm Scale Cape | C38: =(I38*10)+M38+(D38*4)+G38+(L38/5)+(F38*2)+(E38*2)+(K38*2)+(O38/2)+(Q38/2)+(R38/2)+(N38/4)+(P38/4) -> 67.5 | D38: 9.0 | E38: 7.0 | F38: 7.0 | O38: 7.0 | S38: 1.4 | T38: =0-(QUOTIENT(S38, 5)) -> 0 | U38: back
A39: Dire Wolf-Hide Cloak | C39: =(I39*10)+M39+(D39*4)+G39+(L39/5)+(F39*2)+(E39*2)+(K39*2)+(O39/2)+(Q39/2)+(R39/2)+(N39/4)+(P39/4) -> 63 | D39: 8.0 | E39: 6.0 | F39: 6.0 | L39: 35.0 | S39: 0.5 | T39: =0-(QUOTIENT(S39, 5)) -> 0 | U39: back
A40: Wet Thorn Cloak | C40: =(I40*10)+M40+(D40*4)+G40+(L40/5)+(F40*2)+(E40*2)+(K40*2)+(O40/2)+(Q40/2)+(R40/2)+(N40/4)+(P40/4) -> 62.5 | D40: 10 | I40: 2 | J40: 2 | N40: 5 | P40: 5 | S40: 1.3 | U40: back
A41: Scaled Robe of the Elder Serpents | C41: =(I41*10)+M41+(D41*4)+G41+(L41/5)+(F41*2)+(E41*2)+(K41*2)+(O41/2)+(Q41/2)+(R41/2)+(N41/4)+(P41/4) -> 61.75 | D41: 8.0 | E41: 4.0 | J41: 3.0 | K41: 9.0 | N41: 15.0 | S41: 1.5 | T41: =0-(QUOTIENT(S41, 5)) -> 0 | U41: back
A42: Cloak of the Ry`Gorr Oracles | C42: =(I42*10)+M42+(D42*4)+G42+(L42/5)+(F42*2)+(E42*2)+(K42*2)+(O42/2)+(Q42/2)+(R42/2)+(N42/4)+(P42/4) -> 61.5 | D42: 6.0 | I42: 2.0 | J42: 2.0 | M42: 10.0 | O42: 5.0 | R42: 10.0 | S42: 2.0 | T42: =0-(QUOTIENT(S42, 5)) -> 0 | U42: back
A43: Withered Leather Cloak | C43: =(I43*10)+M43+(D43*4)+G43+(L43/5)+(F43*2)+(E43*2)+(K43*2)+(O43/2)+(Q43/2)+(R43/2)+(N43/4)+(P43/4) -> 61 | D43: 5.0 | E43: 5.0 | F43: 8.0 | M43: 15.0 | S43: 2.0 | T43: =0-(QUOTIENT(S43, 5)) -> 0 | U43: back
A44: Enchanted Elven Chainmail Cloak | C44: =(I44*10)+M44+(D44*4)+G44+(L44/5)+(F44*2)+(E44*2)+(K44*2)+(O44/2)+(Q44/2)+(R44/2)+(N44/4)+(P44/4) -> 60 | D44: 7.0 | I44: 3.0 | J44: 3.0 | O44: 4.0 | S44: 00.7 | T44: =0-(QUOTIENT(S44, 5)) -> 0 | U44: back
A45: Hooded Black Cloak | C45: =(I45*10)+M45+(D45*4)+G45+(L45/5)+(F45*2)+(E45*2)+(K45*2)+(O45/2)+(Q45/2)+(R45/2)+(N45/4)+(P45/4) -> 59 | D45: 10.0 | E45: 5.0 | L45: 45.0 | S45: 2.5 | T45: =0-(QUOTIENT(S45, 5)) -> 0 | U45: back
A46: Spider Fur Cloak | C46: =(I46*10)+M46+(D46*4)+G46+(L46/5)+(F46*2)+(E46*2)+(K46*2)+(O46/2)+(Q46/2)+(R46/2)+(N46/4)+(P46/4) -> 59 | D46: 10.0 | E46: 4.0 | F46: 4.0 | R46: 6.0 | S46: 0.0 | T46: =0-(QUOTIENT(S46, 5)) -> 0 | U46: back
A47: Molten Cloak | C47: =(I47*10)+M47+(D47*4)+G47+(L47/5)+(F47*2)+(E47*2)+(K47*2)+(O47/2)+(Q47/2)+(R47/2)+(N47/4)+(P47/4) -> 56 | D47: 4.0 | I47: 4.0 | J47: 4.0 | S47: 2.5 | T47: =0-(QUOTIENT(S47, 5)) -> 0 | U47: back
A48: Giant Scalemail Cloak | C48: =(I48*10)+M48+(D48*4)+G48+(L48/5)+(F48*2)+(E48*2)+(K48*2)+(O48/2)+(Q48/2)+(R48/2)+(N48/4)+(P48/4) -> 54 | D48: 7.0 | F48: 5.0 | L48: 30.0 | M48: 10.0 | S48: 5.0 | T48: =0-(QUOTIENT(S48, 5)) -> -1 | U48: back
A49: Imbued Vale Reinforced Cloak (K) | C49: =(I49*10)+M49+(D49*4)+G49+(L49/5)+(F49*2)+(E49*2)+(K49*2)+(O49/2)+(Q49/2)+(R49/2)+(N49/4)+(P49/4) -> 54 | D49: 7.0 | F49: 3.0 | I49: 2.0 | S49: 1.0 | T49: =0-(QUOTIENT(S49, 5)) -> 0 | U49: back
A50: Kunzar Cloak | C50: =(I50*10)+M50+(D50*4)+G50+(L50/5)+(F50*2)+(E50*2)+(K50*2)+(O50/2)+(Q50/2)+(R50/2)+(N50/4)+(P50/4) -> 53 | D50: 7.0 | I50: 2.0 | J50: 2.0 | Q50: 10.0 | S50: 00.1 | T50: =0-(QUOTIENT(S50, 5)) -> 0 | U50: back
A51: Cloak of Shadows | C51: =(I51*10)+M51+(D51*4)+G51+(L51/5)+(F51*2)+(E51*2)+(K51*2)+(O51/2)+(Q51/2)+(R51/2)+(N51/4)+(P51/4) -> 50.5 | D51: 12.0 | H51: 13.0 | P51: 10.0 | S51: 0.0 | T51: =0-(QUOTIENT(S51, 5)) -> 0 | U51: back
A52: Imbued Mithril Studded Cloak | C52: =(I52*10)+M52+(D52*4)+G52+(L52/5)+(F52*2)+(E52*2)+(K52*2)+(O52/2)+(Q52/2)+(R52/2)+(N52/4)+(P52/4) -> 50 | D52: 6.0 | I52: 2.0 | K52: 3.0 | S52: 1.0 | T52: =0-(QUOTIENT(S52, 5)) -> 0 | U52: back
A53: Imbued Vale Studded Cloak (K) | C53: =(I53*10)+M53+(D53*4)+G53+(L53/5)+(F53*2)+(E53*2)+(K53*2)+(O53/2)+(Q53/2)+(R53/2)+(N53/4)+(P53/4) -> 50 | D53: 6.0 | F53: 3.0 | I53: 2.0 | S53: 1.0 | T53: =0-(QUOTIENT(S53, 5)) -> 0 | U53: back
A54: Nightmare Hide | B54: Restore Sight | C54: =(I54*10)+M54+(D54*4)+G54+(L54/5)+(F54*2)+(E54*2)+(K54*2)+(O54/2)+(Q54/2)+(R54/2)+(N54/4)+(P54/4)+30 -> 50 | D54: 5.0 | S54: 2.0 | T54: =0-(QUOTIENT(S54, 5)) -> 0 | U54: back
A55: Shimmering Terror Hide Cloak | C55: =(I55*10)+M55+(D55*4)+G55+(L55/5)+(F55*2)+(E55*2)+(K55*2)+(O55/2)+(Q55/2)+(R55/2)+(N55/4)+(P55/4) -> 50 | D55: 8.0 | E55: 4.0 | H55: 4.0 | L55: 50.0 | S55: 0.0 | T55: =0-(QUOTIENT(S55, 5)) -> 0 | U55: back
A56: Wyvern Wing Cape | C56: =(I56*10)+M56+(D56*4)+G56+(L56/5)+(F56*2)+(E56*2)+(K56*2)+(O56/2)+(Q56/2)+(R56/2)+(N56/4)+(P56/4) -> 46 | D56: 7.0 | E56: 4.0 | F56: 3.0 | L56: 20.0 | S56: 2.0 | T56: =0-(QUOTIENT(S56, 5)) -> 0 | U56: back
A57: A Shimmering White Shroud | C57: =(I57*10)+M57+(D57*4)+G57+(L57/5)+(F57*2)+(E57*2)+(K57*2)+(O57/2)+(Q57/2)+(R57/2)+(N57/4)+(P57/4) -> 44 | D57: 5.0 | M57: 20.0 | N57: 8.0 | P57: 8.0 | S57: 2.5 | T57: =0-(QUOTIENT(S57, 5)) -> 0 | U57: back
A58: Cloak of the Ice Bear | C58: =(I58*10)+M58+(D58*4)+G58+(L58/5)+(F58*2)+(E58*2)+(K58*2)+(O58/2)+(Q58/2)+(R58/2)+(N58/4)+(P58/4) -> 44 | D58: 8.0 | L58: 10.0 | R58: 20.0 | S58: 3.5 | T58: =0-(QUOTIENT(S58, 5)) -> 0 | U58: back
A59: Dreadskin Cloak | C59: =(I59*10)+M59+(D59*4)+G59+(L59/5)+(F59*2)+(E59*2)+(K59*2)+(O59/2)+(Q59/2)+(R59/2)+(N59/4)+(P59/4) -> 43 | D59: 6.0 | G59: 6.0 | I59: 1.0 | Q59: 6.0 | S59: 3.5 | T59: =0-(QUOTIENT(S59, 5)) -> 0 | U59: back
A60: Joined Ethereal Cape | C60: =(I60*10)+M60+(D60*4)+G60+(L60/5)+(F60*2)+(E60*2)+(K60*2)+(O60/2)+(Q60/2)+(R60/2)+(N60/4)+(P60/4) -> 41 | D60: 4.0 | J60: 4.0 | M60: 25.0 | S60: 00.8 | T60: =0-(QUOTIENT(S60, 5)) -> 0 | U60: back
A61: Netted Kelp Cloak | C61: =(I61*10)+M61+(D61*4)+G61+(L61/5)+(F61*2)+(E61*2)+(K61*2)+(O61/2)+(Q61/2)+(R61/2)+(N61/4)+(P61/4) -> 40.5 | D61: 6.0 | E61: 2.0 | F61: 8.0 | J61: 3.0 | K61: -3.0 | Q61: 5.0 | S61: 0.5 | T61: =0-(QUOTIENT(S61, 5)) -> 0 | U61: back
A62: Cloak of the Cave Bear | C62: =(I62*10)+M62+(D62*4)+G62+(L62/5)+(F62*2)+(E62*2)+(K62*2)+(O62/2)+(Q62/2)+(R62/2)+(N62/4)+(P62/4) -> 38 | D62: 8.0 | L62: 5.0 | R62: 10.0 | S62: 2.0 | T62: =0-(QUOTIENT(S62, 5)) -> 0 | U62: back
A63: White Wolf-hide Cloak | C63: =(I63*10)+M63+(D63*4)+G63+(L63/5)+(F63*2)+(E63*2)+(K63*2)+(O63/2)+(Q63/2)+(R63/2)+(N63/4)+(P63/4) -> 36.5 | D63: 7.0 | E63: 3.0 | H63: 3.0 | R63: 5.0 | S63: 00.3 | T63: =0-(QUOTIENT(S63, 5)) -> 0 | U63: back
A64: Gnomish Pirate Cloak | C64: =(I64*10)+M64+(D64*4)+G64+(L64/5)+(F64*2)+(E64*2)+(K64*2)+(O64/2)+(Q64/2)+(R64/2)+(N64/4)+(P64/4) -> 34 | D64: 6.0 | G64: 10.0 | S64: 1.0 | T64: =0-(QUOTIENT(S64, 5)) -> 0 | U64: back
A65: Blood Crusted Burlap Cloak | C65: =(I65*10)+M65+(D65*4)+G65+(L65/5)+(F65*2)+(E65*2)+(K65*2)+(O65/2)+(Q65/2)+(R65/2)+(N65/4)+(P65/4) -> 32 | D65: 5.0 | E65: 2.0 | M65: 8.0 | S65: 00.4 | T65: =0-(QUOTIENT(S65, 5)) -> 0 | U65: back
A66: Lizardscale Cloak | C66: =(I66*10)+M66+(D66*4)+G66+(L66/5)+(F66*2)+(E66*2)+(K66*2)+(O66/2)+(Q66/2)+(R66/2)+(N66/4)+(P66/4) -> 32 | D66: 8.0 | H66: 5.0 | S66: 2.5 | T66: =0-(QUOTIENT(S66, 5)) -> 0 | U66: back
A67: Werewolf Skin Cloak | C67: =(I67*10)+M67+(D67*4)+G67+(L67/5)+(F67*2)+(E67*2)+(K67*2)+(O67/2)+(Q67/2)+(R67/2)+(N67/4)+(P67/4) -> 32 | D67: 5.0 | E67: 3.0 | F67: 3.0 | S67: 00.3 | T67: =0-(QUOTIENT(S67, 5)) -> 0 | U67: back
A68: Coterie Cloak | C68: =(I68*10)+M68+(D68*4)+G68+(L68/5)+(F68*2)+(E68*2)+(K68*2)+(O68/2)+(Q68/2)+(R68/2)+(N68/4)+(P68/4) -> 30.2 | D68: 7 | E68: 1 | J68: 1 | L68: 6 | Q68: -2 | S68: 2 | U68: back
A69: Cloak of Defence | C69: =(I69*10)+M69+(D69*4)+G69+(L69/5)+(F69*2)+(E69*2)+(K69*2)+(O69/2)+(Q69/2)+(R69/2)+(N69/4)+(P69/4) -> 30 | D69: 6.0 | N69: 3.0 | O69: 3.0 | P69: 3.0 | Q69: 3.0 | R69: 3.0 | S69: 0.5 | T69: =0-(QUOTIENT(S69, 5)) -> 0 | U69: back
A70: Spore Covered Cloak | C70: =(I70*10)+M70+(D70*4)+G70+(L70/5)+(F70*2)+(E70*2)+(K70*2)+(O70/2)+(Q70/2)+(R70/2)+(N70/4)+(P70/4) -> 30 | D70: 5 | I70: 1 | S70: 00.4 | U70: back
A71: Grey Fur Cape | C71: =(I71*10)+M71+(D71*4)+G71+(L71/5)+(F71*2)+(E71*2)+(K71*2)+(O71/2)+(Q71/2)+(R71/2)+(N71/4)+(P71/4) -> 29.6 | D71: 5.0 | E71: 3.0 | L71: 18.0 | S71: 1.0 | T71: =0-(QUOTIENT(S71, 5)) -> 0 | U71: back
A72: Cloak of Leaves | C72: =(I72*10)+M72+(D72*4)+G72+(L72/5)+(F72*2)+(E72*2)+(K72*2)+(O72/2)+(Q72/2)+(R72/2)+(N72/4)+(P72/4) -> 28 | D72: 5.0 | G72: 7.0 | L72: 5.0 | S72: 2.0 | T72: =0-(QUOTIENT(S72, 5)) -> 0 | U72: back
A73: Scaled Prowler Cloak | C73: =(I73*10)+M73+(D73*4)+G73+(L73/5)+(F73*2)+(E73*2)+(K73*2)+(O73/2)+(Q73/2)+(R73/2)+(N73/4)+(P73/4) -> 28 | D73: 6.0 | E73: 2.0 | S73: 2.0 | T73: =0-(QUOTIENT(S73, 5)) -> 0 | U73: back
A74: Vale Reinforced Cloak | C74: =(I74*10)+M74+(D74*4)+G74+(L74/5)+(F74*2)+(E74*2)+(K74*2)+(O74/2)+(Q74/2)+(R74/2)+(N74/4)+(P74/4) -> 28 | D74: 7.0 | S74: 1.0 | T74: =0-(QUOTIENT(S74, 5)) -> 0 | U74: back
A75: Polar Bear Cloak | C75: =(I75*10)+M75+(D75*4)+G75+(L75/5)+(F75*2)+(E75*2)+(K75*2)+(O75/2)+(Q75/2)+(R75/2)+(N75/4)+(P75/4) -> 27.5 | D75: 5.0 | R75: 15.0 | S75: 3.5 | T75: =0-(QUOTIENT(S75, 5)) -> 0 | U75: back
A76: Holgresh Fur Cloak | C76: =(I76*10)+M76+(D76*4)+G76+(L76/5)+(F76*2)+(E76*2)+(K76*2)+(O76/2)+(Q76/2)+(R76/2)+(N76/4)+(P76/4) -> 27 | D76: 6.0 | H76: 5.0 | J76: 4.0 | O76: 6.0 | S76: 1.8 | T76: =0-(QUOTIENT(S76, 5)) -> 0 | U76: back
A77: Ancient Sensateh Cloak | C77: =(I77*10)+M77+(D77*4)+G77+(L77/5)+(F77*2)+(E77*2)+(K77*2)+(O77/2)+(Q77/2)+(R77/2)+(N77/4)+(P77/4) -> 26 | D77: 3 | F77: 2 | M77: 10 | S77: 2 | U77: back
A78: Burynai Hide Cloak | C78: =(I78*10)+M78+(D78*4)+G78+(L78/5)+(F78*2)+(E78*2)+(K78*2)+(O78/2)+(Q78/2)+(R78/2)+(N78/4)+(P78/4) -> 26 | D78: 5.0 | E78: 2.0 | G78: 2.0 | S78: 2.0 | T78: =0-(QUOTIENT(S78, 5)) -> 0 | U78: back
A79: Grizzly-hide Cloak | C79: =(I79*10)+M79+(D79*4)+G79+(L79/5)+(F79*2)+(E79*2)+(K79*2)+(O79/2)+(Q79/2)+(R79/2)+(N79/4)+(P79/4) -> 25 | D79: 6.0 | L79: 5.0 | S79: 3.5 | T79: =0-(QUOTIENT(S79, 5)) -> 0 | U79: back
A80: Bear-hide Cape | C80: =(I80*10)+M80+(D80*4)+G80+(L80/5)+(F80*2)+(E80*2)+(K80*2)+(O80/2)+(Q80/2)+(R80/2)+(N80/4)+(P80/4) -> 24 | D80: 6.0 | S80: 2.5 | T80: =0-(QUOTIENT(S80, 5)) -> 0 | U80: back
A81: Cloak of Jaggedpine | C81: =(I81*10)+M81+(D81*4)+G81+(L81/5)+(F81*2)+(E81*2)+(K81*2)+(O81/2)+(Q81/2)+(R81/2)+(N81/4)+(P81/4) -> 24 | D81: 6.0 | H81: 3.0 | S81: 1.5 | T81: =0-(QUOTIENT(S81, 5)) -> 0 | U81: back
A82: Elven Chainmail Cloak | C82: =(I82*10)+M82+(D82*4)+G82+(L82/5)+(F82*2)+(E82*2)+(K82*2)+(O82/2)+(Q82/2)+(R82/2)+(N82/4)+(P82/4) -> 24 | D82: 6.0 | S82: 1.5 | T82: =0-(QUOTIENT(S82, 5)) -> 0 | U82: back
A83: Mithril Studded Cloak | C83: =(I83*10)+M83+(D83*4)+G83+(L83/5)+(F83*2)+(E83*2)+(K83*2)+(O83/2)+(Q83/2)+(R83/2)+(N83/4)+(P83/4) -> 24 | D83: 6.0 | S83: 1.0 | T83: =0-(QUOTIENT(S83, 5)) -> 0 | U83: back
A84: Vale Studded Cloak | C84: =(I84*10)+M84+(D84*4)+G84+(L84/5)+(F84*2)+(E84*2)+(K84*2)+(O84/2)+(Q84/2)+(R84/2)+(N84/4)+(P84/4) -> 24 | D84: 6.0 | S84: 1.0 | T84: =0-(QUOTIENT(S84, 5)) -> 0 | U84: back
A85: Spectral Shroud | C85: =(I85*10)+M85+(D85*4)+G85+(L85/5)+(F85*2)+(E85*2)+(K85*2)+(O85/2)+(Q85/2)+(R85/2)+(N85/4)+(P85/4) -> 23.75 | D85: 5.0 | N85: 5.0 | O85: 5.0 | S85: 1.5 | T85: =0-(QUOTIENT(S85, 5)) -> 0 | U85: back
A86: Mesh Cloak | C86: =(I86*10)+M86+(D86*4)+G86+(L86/5)+(F86*2)+(E86*2)+(K86*2)+(O86/2)+(Q86/2)+(R86/2)+(N86/4)+(P86/4) -> 20 | D86: 5.0 | S86: 00.4 | T86: =0-(QUOTIENT(S86, 5)) -> 0 | U86: back
A87: Mountain Lion Cape | C87: =(I87*10)+M87+(D87*4)+G87+(L87/5)+(F87*2)+(E87*2)+(K87*2)+(O87/2)+(Q87/2)+(R87/2)+(N87/4)+(P87/4) -> 20 | D87: 5.0 | S87: 3.0 | T87: =0-(QUOTIENT(S87, 5)) -> 0 | U87: back
A88: Reinforced Cloak | C88: =(I88*10)+M88+(D88*4)+G88+(L88/5)+(F88*2)+(E88*2)+(K88*2)+(O88/2)+(Q88/2)+(R88/2)+(N88/4)+(P88/4) -> 20 | D88: 5.0 | S88: 2.0 | T88: =0-(QUOTIENT(S88, 5)) -> 0 | U88: back
A89: Shaded Cloak | C89: =(I89*10)+M89+(D89*4)+G89+(L89/5)+(F89*2)+(E89*2)+(K89*2)+(O89/2)+(Q89/2)+(R89/2)+(N89/4)+(P89/4) -> 20 | D89: 5 | S89: 1 | U89: back
A90: Shaded Cloak | C90: =(I90*10)+M90+(D90*4)+G90+(L90/5)+(F90*2)+(E90*2)+(K90*2)+(O90/2)+(Q90/2)+(R90/2)+(N90/4)+(P90/4) -> 20 | D90: 5 | S90: 1 | U90: back
A91: Wolf-hide Cape | C91: =(I91*10)+M91+(D91*4)+G91+(L91/5)+(F91*2)+(E91*2)+(K91*2)+(O91/2)+(Q91/2)+(R91/2)+(N91/4)+(P91/4) -> 20 | D91: 5.0 | S91: 2.0 | T91: =0-(QUOTIENT(S91, 5)) -> 0 | U91: back
A92: Patched Gnoll Fur Bundle | C92: =(I92*10)+M92+(D92*4)+G92+(L92/5)+(F92*2)+(E92*2)+(K92*2)+(O92/2)+(Q92/2)+(R92/2)+(N92/4)+(P92/4) -> 18.5 | D92: 4.0 | R92: 5.0 | S92: 4.0 | T92: =0-(QUOTIENT(S92, 5)) -> 0 | U92: back
A93: Crystalline Silk Cloak | C93: =(I93*10)+M93+(D93*4)+G93+(L93/5)+(F93*2)+(E93*2)+(K93*2)+(O93/2)+(Q93/2)+(R93/2)+(N93/4)+(P93/4) -> 17 | D93: 4.0 | O93: 2.0 | S93: 00.1 | T93: =0-(QUOTIENT(S93, 5)) -> 0 | U93: back
A94: Fungal Field Membrane Cape | C94: =(I94*10)+M94+(D94*4)+G94+(L94/5)+(F94*2)+(E94*2)+(K94*2)+(O94/2)+(Q94/2)+(R94/2)+(N94/4)+(P94/4) -> 16 | D94: 4 | S94: 00.4 | U94: back
A95: Gargantuan Panda Pelt | C95: =(I95*10)+M95+(D95*4)+G95+(L95/5)+(F95*2)+(E95*2)+(K95*2)+(O95/2)+(Q95/2)+(R95/2)+(N95/4)+(P95/4) -> 16 | D95: 3.0 | E95: 2.0 | H95: 1.0 | S95: 2.0 | T95: =0-(QUOTIENT(S95, 5)) -> 0 | U95: back
A96: Hopperhide Cloak | C96: =(I96*10)+M96+(D96*4)+G96+(L96/5)+(F96*2)+(E96*2)+(K96*2)+(O96/2)+(Q96/2)+(R96/2)+(N96/4)+(P96/4) -> 16 | D96: 4 | S96: 2 | U96: back
A97: Kodiak Pelt | C97: =(I97*10)+M97+(D97*4)+G97+(L97/5)+(F97*2)+(E97*2)+(K97*2)+(O97/2)+(Q97/2)+(R97/2)+(N97/4)+(P97/4) -> 16 | D97: 3.0 | E97: 2.0 | H97: 1.0 | S97: 2.0 | T97: =0-(QUOTIENT(S97, 5)) -> 0 | U97: back
A98: Leather Cloak | C98: =(I98*10)+M98+(D98*4)+G98+(L98/5)+(F98*2)+(E98*2)+(K98*2)+(O98/2)+(Q98/2)+(R98/2)+(N98/4)+(P98/4) -> 16 | D98: 4.0 | S98: 2.0 | T98: =0-(QUOTIENT(S98, 5)) -> 0 | U98: back
A99: Raw-hide Cloak | C99: =(I99*10)+M99+(D99*4)+G99+(L99/5)+(F99*2)+(E99*2)+(K99*2)+(O99/2)+(Q99/2)+(R99/2)+(N99/4)+(P99/4) -> 16 | D99: 4.0 | S99: 3.0 | T99: =0-(QUOTIENT(S99, 5)) -> 0 | U99: back
A100: Soft Wicker Cloak | C100: =(I100*10)+M100+(D100*4)+G100+(L100/5)+(F100*2)+(E100*2)+(K100*2)+(O100/2)+(Q100/2)+(R100/2)+(N100/4)+(P100/4) -> 16 | D100: 4.0 | S100: 3.0 | T100: =0-(QUOTIENT(S100, 5)) -> 0 | U100: back
A101: Studded Cape | C101: =(I101*10)+M101+(D101*4)+G101+(L101/5)+(F101*2)+(E101*2)+(K101*2)+(O101/2)+(Q101/2)+(R101/2)+(N101/4)+(P101/4) -> 16 | D101: 4.0 | S101: 2.0 | T101: =0-(QUOTIENT(S101, 5)) -> 0 | U101: back
A102: Scaled Wolf Hide Cloak | C102: =(I102*10)+M102+(D102*4)+G102+(L102/5)+(F102*2)+(E102*2)+(K102*2)+(O102/2)+(Q102/2)+(R102/2)+(N102/4)+(P102/4) -> 14 | D102: 3.0 | Q102: 2.0 | R102: 2.0 | S102: 1.3 | T102: =0-(QUOTIENT(S102, 5)) -> 0 | U102: back
A103: Curscale Cape | C103: =(I103*10)+M103+(D103*4)+G103+(L103/5)+(F103*2)+(E103*2)+(K103*2)+(O103/2)+(Q103/2)+(R103/2)+(N103/4)+(P103/4) -> 13 | D103: 3.0 | R103: 2.0 | S103: 0.5 | T103: =0-(QUOTIENT(S103, 5)) -> 0 | U103: back
A104: Patchwork Cloak | C104: =(I104*10)+M104+(D104*4)+G104+(L104/5)+(F104*2)+(E104*2)+(K104*2)+(O104/2)+(Q104/2)+(R104/2)+(N104/4)+(P104/4) -> 12 | D104: 3.0 | S104: 2.0 | T104: =0-(QUOTIENT(S104, 5)) -> 0 | U104: back
A105: Woven Cape | C105: =(I105*10)+M105+(D105*4)+G105+(L105/5)+(F105*2)+(E105*2)+(K105*2)+(O105/2)+(Q105/2)+(R105/2)+(N105/4)+(P105/4) -> 12 | D105: 3.0 | S105: 00.4 | T105: =0-(QUOTIENT(S105, 5)) -> 0 | U105: back
A106: Cloth Cape | C106: =(I106*10)+M106+(D106*4)+G106+(L106/5)+(F106*2)+(E106*2)+(K106*2)+(O106/2)+(Q106/2)+(R106/2)+(N106/4)+(P106/4) -> 8 | D106: 2.0 | S106: 0.5 | T106: =0-(QUOTIENT(S106, 5)) -> 0 | U106: back
A107: Dusty Burlap Cape | C107: =(I107*10)+M107+(D107*4)+G107+(L107/5)+(F107*2)+(E107*2)+(K107*2)+(O107/2)+(Q107/2)+(R107/2)+(N107/4)+(P107/4) -> 8 | D107: 2.0 | S107: 00.4 | T107: =0-(QUOTIENT(S107, 5)) -> 0 | U107: back
A108: Netted Cape | C108: =(I108*10)+M108+(D108*4)+G108+(L108/5)+(F108*2)+(E108*2)+(K108*2)+(O108/2)+(Q108/2)+(R108/2)+(N108/4)+(P108/4) -> 8 | D108: 2.0 | S108: 00.4 | T108: =0-(QUOTIENT(S108, 5)) -> 0 | U108: back
A109: Rat Pelt Cape | C109: =(I109*10)+M109+(D109*4)+G109+(L109/5)+(F109*2)+(E109*2)+(K109*2)+(O109/2)+(Q109/2)+(R109/2)+(N109/4)+(P109/4) -> 5 | D109: 1.0 | R109: 2.0 | S109: 0.5 | T109: =0-(QUOTIENT(S109, 5)) -> 0 | U109: back