A1: Name | B1: Effect | C1: Ranking | D1: AC | E1: STR | F1: STA | G1: AGI | H1: DEX | I1: WIS | J1: INT | K1: CHA | L1: HP | M1: MANA | N1: PR | O1: MR | P1: DR | Q1: FR | R1: CR | S1: WT | T1: Type
A2: Tunarean Signet Ring | C2: =(I2*10)+M2+(D2*4)+G2+(L2/5)+(F2*2)+(E2*2)+(K2*2)+(O2/2)+(Q2/2)+(R2/2)+(N2/4)+(P2/4) -> 138.0 | D2: 2.0 | I2: 10.0 | K2: 10.0 | L2: 15.0 | N2: 5.0 | O2: 3.0 | P2: 5.0 | Q2: 3.0 | R2: 3.0 | S2: 00.1 | T2: ring
A3: Unadorned Ring | C3: =(I3*10)+M3+(D3*4)+G3+(L3/5)+(F3*2)+(E3*2)+(K3*2)+(O3/2)+(Q3/2)+(R3/2)+(N3/4)+(P3/4) -> 15.0 | D3: 4.0 | E3: 3.0 | H3: 3.0 | K3: -5.0 | L3: 15.0 | S3: 4.0 | U3: ring
A4: Velium Amber Ring | C4: =(I4*10)+M4+(D4*4)+G4+(L4/5)+(F4*2)+(E4*2)+(K4*2)+(O4/2)+(Q4/2)+(R4/2)+(N4/4)+(P4/4) -> 10.0 | D4: 0.0 | E4: 5.0 | S4: 00.1 | T4: ring
A5: Velium Black Pearl Ring | C5: =(I5*10)+M5+(D5*4)+G5+(L5/5)+(F5*2)+(E5*2)+(K5*2)+(O5/2)+(Q5/2)+(R5/2)+(N5/4)+(P5/4) -> 7.0 | D5: 0.0 | G5: 7.0 | H5: 7.0 | S5: 00.1 | T5: ring
A6: Velium Carnelian Wedding Ring | C6: =(I6*10)+M6+(D6*4)+G6+(L6/5)+(F6*2)+(E6*2)+(K6*2)+(O6/2)+(Q6/2)+(R6/2)+(N6/4)+(P6/4) -> 8.0 | D6: 0.0 | G6: 8.0 | S6: 00.1 | T6: ring
A7: Velium Coldain Insignia Ring | B7: Shield of the Eighth | C7: =(I7*10)+M7+(D7*4)+G7+(L7/5)+(F7*2)+(E7*2)+(K7*2)+(O7/2)+(Q7/2)+(R7/2)+(N7/4)+(P7/4)+30 -> 82.0 | D7: 8.0 | E7: 8.0 | O7: 8.0 | S7: 1.0 | T7: ring
A8: Velium Diamond Ring | C8: =(I8*10)+M8+(D8*4)+G8+(L8/5)+(F8*2)+(E8*2)+(K8*2)+(O8/2)+(Q8/2)+(R8/2)+(N8/4)+(P8/4) -> 16.0 | D8: 0.0 | N8: 8.0 | O8: 8.0 | P8: 8.0 | Q8: 8.0 | R8: 8.0 | S8: 00.1 | T8: ring
A9: Velium Emerald Ring | C9: =(I9*10)+M9+(D9*4)+G9+(L9/5)+(F9*2)+(E9*2)+(K9*2)+(O9/2)+(Q9/2)+(R9/2)+(N9/4)+(P9/4) -> 25.5 | D9: 5.0 | Q9: 11.0 | S9: 00.1 | T9: ring
A10: Velium Fire Emerald Ring | C10: =(I10*10)+M10+(D10*4)+G10+(L10/5)+(F10*2)+(E10*2)+(K10*2)+(O10/2)+(Q10/2)+(R10/2)+(N10/4)+(P10/4) -> 12.0 | D10: 0.0 | E10: 6.0 | H10: 6.0 | S10: 00.1 | T10: ring
A11: Velium Fire Wedding Ring | C11: =(I11*10)+M11+(D11*4)+G11+(L11/5)+(F11*2)+(E11*2)+(K11*2)+(O11/2)+(Q11/2)+(R11/2)+(N11/4)+(P11/4) -> 37.0 | D11: 6.0 | L11: 65.0 | S11: 00.1 | T11: ring
A12: Velium Hematite Ring | C12: =(I12*10)+M12+(D12*4)+G12+(L12/5)+(F12*2)+(E12*2)+(K12*2)+(O12/2)+(Q12/2)+(R12/2)+(N12/4)+(P12/4) -> 4.0 | D12: 0.0 | Q12: 8.0 | S12: 00.1 | T12: ring
A13: Velium Jacinth Wedding Ring | C13: =(I13*10)+M13+(D13*4)+G13+(L13/5)+(F13*2)+(E13*2)+(K13*2)+(O13/2)+(Q13/2)+(R13/2)+(N13/4)+(P13/4) -> 7.0 | D13: 0.0 | O13: 14.0 | S13: 00.1 | T13: ring
A14: Velium Jasper Ring | C14: =(I14*10)+M14+(D14*4)+G14+(L14/5)+(F14*2)+(E14*2)+(K14*2)+(O14/2)+(Q14/2)+(R14/2)+(N14/4)+(P14/4) -> 70.0 | D14: 0.0 | I14: 7.0 | S14: 00.1 | T14: ring
A15: Velium Malachite Ring | C15: =(I15*10)+M15+(D15*4)+G15+(L15/5)+(F15*2)+(E15*2)+(K15*2)+(O15/2)+(Q15/2)+(R15/2)+(N15/4)+(P15/4) -> 2.0 | D15: 0.0 | N15: 8.0 | S15: 0.0 | T15: ring
A16: Velium Opal Engagement Ring | C16: =(I16*10)+M16+(D16*4)+G16+(L16/5)+(F16*2)+(E16*2)+(K16*2)+(O16/2)+(Q16/2)+(R16/2)+(N16/4)+(P16/4) -> 22.0 | D16: 0.0 | F16: 8.0 | G16: 6.0 | S16: 00.1 | T16: ring
A17: Velium Pearl Ring | C17: =(I17*10)+M17+(D17*4)+G17+(L17/5)+(F17*2)+(E17*2)+(K17*2)+(O17/2)+(Q17/2)+(R17/2)+(N17/4)+(P17/4) -> 22.75 | D17: 5.0 | N17: 11.0 | S17: 00.1 | T17: ring
A18: Velium Peridot Ring | C18: =(I18*10)+M18+(D18*4)+G18+(L18/5)+(F18*2)+(E18*2)+(K18*2)+(O18/2)+(Q18/2)+(R18/2)+(N18/4)+(P18/4) -> 25.5 | D18: 5.0 | R18: 11.0 | S18: 00.1 | T18: ring
A19: Wurm Bone Ring | C19: =(I19*10)+M19+(D19*4)+G19+(L19/5)+(F19*2)+(E19*2)+(K19*2)+(O19/2)+(Q19/2)+(R19/2)+(N19/4)+(P19/4) -> 29.5 | D19: 3.0 | E19: 5.0 | G19: 3.0 | H19: 5.0 | O19: 3.0 | Q19: 3.0 | R19: 3.0 | S19: 00.4 | T19: ring