A1: Comments | C1: Points Earned | D1: Points Spent | E1: Adjustments (None so far) | F1: Current Points
A3: Wraith
A5: Aguilera / Ittee | C5: 4.75 | D5: 0.0 | F5: =100+C5-D5-E5 -> 104.75
A6: Alver | C6: 3.10 | D6: 0.0 | F6: =100+C6-D6-E6 -> 103.10
A7: Alzedo | C7: 5.65 | D7: 0.0 | F7: =100+C7-D7-E7 -> 105.65
A8: Ambi | C8: 0.30 | D8: 0.0 | F8: =100+C8-D8-E8 -> 100.30
A9: Aminos | C9: 2.70 | D9: 0.0 | F9: =100+C9-D9-E9 -> 102.70
A10: Annalyse | C10: 0.95 | D10: 0.0 | F10: =100+C10-D10-E10 -> 100.95
A11: Anyelle | C11: 5.15 | D11: 0.0 | F11: =100+C11-D11-E11 -> 105.15
A12: Azmidian | C12: 0.10 | D12: 0.0 | F12: =100+C12-D12-E12 -> 100.10
A13: Asion | C13: 0.10 | D13: 0.0 | F13: =100+C13-D13-E13 -> 100.10
A14: Asos | C14: 2.45 | D14: 0.0 | F14: =100+C14-D14-E14 -> 102.45
A15: Batto | C15: 2.00 | D15: 0.0 | F15: =100+C15-D15-E15 -> 102.00
A16: Blessin | C16: 0.10 | D16: 0.0 | F16: =100+C16-D16-E16 -> 100.10
A17: Boldair (Oraa) | C17: 1.20 | D17: 0.0 | F17: =100+C17-D17-E17 -> 