A1: Active Roster
B2: Levels | C2: Title | D2: Race | E2: Epic | F2: VP Key | G2: ST Key | H2: EMP Key | I2: VT Key | J2: PoJ Trials | K2: PoS Medals | L2: Agnarr | M2: PoN Hedge | N2: Teris Thule | O2: Saryn | P2: Aerin Dar | Q2: 3 Trials | R2: Mith Marr | S2: Grummus | T2: Carpin | U2: Bertolox | V2: PoI Dragon | W2: MB | X2: Talon Zek | Y2: Vallon Zek | Z2: RZTW | AA2: Solusek Ro | AB2: Air Water Earth | AC2: Fire | AD2: Status
A3: Bard
A4: =HYPERLINK("http://www.magelo.com/eq_view_profile.html?num=541753","Arsis") -> Arsis | B4: 65 | C4: Veteran | D4: Wood Elf | E4: YES | G4: 1 | H4: 1 | I4: 1 | J4: 1 | K4: 1 | L4: 1 | M4: 1 | N4: 1 | O4: 1 | P4: 1 | Q4: 1 | R4: 1 | S4: 1 | T4: 1 | U4: 1 | V4: 1 | W4: 1 | X4: 1 | Y4: 1 | Z4: 1 | AB4: 1 | AD4: Member | AE4: 1
A5: Cappenvara | B5: 64 | D5: Half Elf | J5: 1 | K5: 1 | L5: 1 | M5: 1 | N5: 1 | O5: 1 | P5: 1 | Q5: 1 | R5: 1 | S5: 1 | T5: 1 | U5: 1 | W5: 1 | X5: 1 | Y5: 1 | Z5: 1 | AA5: 1 | AB5: 1 | AC5: 1 | AD5: Member | AE5: 1
A6: =HYPERLINK("http://www.magelo.com/eq_view_profile.html?num=632813","Deolwen") -> Deolwen | B6: 65 | D6: Wood Elf | E6: YES | J6: 1 | K6: 1 | L6: 1 | M6: 1 | N6: 1 | O6: 1 | P6: 1 | Q6: 1 | R6: 1 | S6: 1 | T6: 1 | U6: 1 | V6: 1 | W6: 1 | X6: 1 | Y6: 1 | Z6: 1 | AA6: 1 | AB6: 1 | AC6: 1 | AD6: Member | AE6: 1
A7: =HYPERLINK("http://www.magelo.com/eq_view_profile.html?num=344746","Rosha") -> Rosha | B7: 65 | C7: Impresario | D7: Wood Elf | E7: YES | F7: 1 | G7: 1 | H7: 1 | I7: 1 | J7: 1 | K7: 1 | L7: 1 | M7: 1 | N7: 1 | O7: 1 | P7: 1 | Q7: 1 | R7: 1 | S7: 1 | T7: 1 | U7: 1 | W7: 1 | X7: 1 | Y7: 1 | Z7: 1 | AA7: 1 | AB7: 1 | AC7: 1 | AD7: Leader | AE7: 1
A8: Paramour | B8: 65 | C8: Veteran | D8: Half Elf | E8: YES | J8: 1 | K8: 1 | L8: 1 | M8: 1 | N8: 1 | O8: 1 | P8: 1 | Q8: 1 | R8: 1 | S8: 1 | T8: 1 | U8: 1 | V8: 1 | W8: 1 | X8: 1 | Y8: 1 | Z8: 1 | AA8: 1 | AB8: 1 | AC8: 1 | AD8: Member | AE8: 1
A9: =HYPERLINK("http://www.magelo.com/eq_view_profile.html?num=663136","Taluwen") -> Taluwen | B9: 65 | C9: Impresario | D9: Half Elf | E9: YES | G9: 1 | H9: 1 | I9: 1 | J9: 1 | K9: 1 | L9: 1 | M9: 1 | N9: 1 | O9: 1 | P9: 1 | Q9: 1 | R9: 1 | S9: 1 | T9: 1 | U9: 1 | V9: 1 | W9: 1 | X9: 1 | Y9: 1 | Z9: 1 | AA9: 1 | AB9: 1 | AC9: 1 | AD9: Officer | AE9: 1
A10: =HYPERLINK("http://www.magelo.com/eq_view_profile.html?num=182277","Yorke") -> Yorke | B10: 65 | C10: Veteran | D10: Half Elf | E10: YES | F10: 1 | G10: 1 | H10: 1 | I10: 1 | L10: 1 | W10: 1 | X10: 1 | AD10: On Break
A11: =HYPERLINK("http://www.magelo.com/eq_view_profile.html?num=194601","Cranth") -> Cranth | B11: 65 | C11: Veteran | D11: Wood Elf | E11: YES | F11: X | G11: X | H11: X | I11: X | AD11: On Break
A12: =HYPERLINK("http://www.magelo.com/eq_view_profile.html?num=84086","Mioawara") -> Mioawara | B12: 65 | C12: Baron | D12: Vah Shir | E12: YES | G12: X | H12: X | I12: X | AD12: On Break
A13: =HYPERLINK("http://www.magelo.com/eq_view_profile.html?num=602833","Gymi") -> Gymi | B13: 63 | D13: Wood Elf | E13: YES | AD13: On Break
A14: Renasfhlar | B14: 65 | D14: Wood Elf | E14: YES | H14: 1 | I14: 1 | P14: x | W14: x | AD14: On Break
A15: Beastlord
A16: =HYPERLINK("http://www.magelo.com/eq_view_profile.html?num=587698","Meeoww") -> Meeoww | B16: 65 | C16: Elder | D16: Vah Shir | E16: YES | G16: 1 | H16: 1 | I16: 1 | N16: 1 | R16: 1 | S16: 1 | T16: 1 | U16: 1 | Y16: 1 | AD16: Member | AE16: 1
A17: =HYPERLINK("http://www.magelo.com/eq_view_profile.html?num=595579","Sarisha") -> Sarisha | B17: 65 | C17: Baroness | D17: Vah Shir | E17: YES | O17: 1 | Y17: 1 | AD17: Member | AE17: 1
A18: =HYPERLINK("http://www.magelo.com/eq_view_profile.html?num=527672","Skilor") -> Skilor | B18: 62 | D18: Vah Shir | E18: NO | H18: X | J18: 1 | L18: 1 | S18: 1 | T18: 1 | Y18: 1 | AD18: Member | AE18: 1
A19: Sharppawz | B19: 65 | D19: Vah Shir | J19: x | K19: x | L19: x | M19: x | N19: x | O19: x | P19: x | Q19: x | R19: x | S19: x | T19: x | U19: x | W19: x | X19: x | Y19: x | Z19: x | AA19: x | AB19: x | AC19: x | AD19: Alternate
A20: Nermel | B20: 61 | D20: Vah Shir | E20: YES | AD20: Alternate
B21: Levels | C21: Title | D21: Race | E21: Epic | F21: VP Key | G21: ST Key | H21: EMP Key | I21: VT Key | J21: PoJ Trials | K21: PoS Medals | L21: Agnarr | M21: PoN Hedge | N21: Teris Thule | O21: Saryn | P21: Aerin Dar | Q21: 3 Trials | R21: Mith Marr | S21: Grummus | T21: Carpin | U21: Bertolox | V21: PoI Dragon | W21: MB | X21: Talon Zek | Y21: Vallon Zek | Z21: RZTW | AA21: Solusek Ro | AB21: Air Water Earth | AC21: Fire | AD21: Status
A22: Clerics
A23: =HYPERLINK("http://www.magelo.com/eq_view_profile.html?num=642183","Aader") -> Aader | B23: 65 | C23: Venerable | D23: Dwarf | E23: YES | G23: 1 | H23: 1 | I23: 1 | J23: 1 | K23: 1 | L23: 1 | M23: 1 | N23: 1 | O23: 1 | P23: 1 | Q23: 1 | R23: 1 | S23: 1 | T23: 1 | U23: 1 | V23: 1 | W23: 1 | X23: 1 | Y23: 1 | Z23: 1 | AA23: 1 | AB23: 1 | AC23: 1 | AD23: Member | AE23: 1
A24: =HYPERLINK("http://www.magelo.com/eq_view_profile.html?num=342919","Dinanin") -> Dinanin | B24: 65 | C24: Exarch | D24: Dwarf | E24: YES | F24: X | G24: X | H24: X | I24: X | J24: 1 | K24: 1 | L24: 1 | M24: 1 | N24: 1 | O24: 1 | P24: 1 | Q24: 1 | R24: 1 | S24: 1 | V24: 1 | W24: 1 | X24: 1 | Y24: 1 | Z24: 1 | AD24: Member | AE24: 1
A25: Giverliffe | B25: 65 | D25: High Elf | E25: NO | H25: 1 | I25: 1 | J25: 1 | K25: 1 | L25: 1 | M25: 1 | N25: 1 | O25: 1 | P25: 1 | Q25: 1 | R25: 1 | S25: 1 | T25: 1 | U25: 1 | V25: 1 | W25: 1 | X25: 1 | Y25: 1 | Z25: 1 | AD25: Member | AE25: 1
A26: =HYPERLINK("http://www.magelo.com/eq_view_profile.html?num=151159","Mediloks") -> Mediloks | B26: 65 | D26: High Elf | E26: YES | G26: 1 | H26: 1 | I26: 1 | J26: 1 | K26: 1 | L26: 1 | M26: 1 | N26: 1 | O26: 1 | P26: 1 | Q26: 1 | R26: 1 | S26: 1 | T26: 1 | U26: 1 | V26: 1 | W26: 1 | X26: 1 | Y26: 1 | Z26: 1 | AA26: 1 | AB26: 1 | AC26: 1 | AD26: Member | AE26: 1
A27: =HYPERLINK("http://www.magelo.com/eq_view_profile.html?num=71953","Philander") -> Philander | B27: 65 | C27: Venerable | D27: Dwarf | E27: YES | F27: 1 | G27: 1 | H27: 1 | I27: 1 | J27: 1 | K27: 1 | L27: 1 | M27: 1 | N27: 1 | O27: 1 | P27: 1 | Q27: 1 | R27: 1 | S27: 1 | T27: 1 | U27: 1 | V27: 1 | W27: 1 | X27: 1 | Y27: 1 | Z27: 1 | AA27: 1 | AB27: 1 | AC27: 1 | AD27: Officer | AE27: 1
A28: =HYPERLINK("http://www.magelo.com/eq_view_profile.html?num=851485","Relaeh") -> Relaeh | B28: 65 | D28: High Elf | E28: YES | J28: 1 | K28: 1 | L28: 1 | M28: 1 | N28: 1 | O28: 1 | P28: 1 | Q28: 1 | R28: 1 | S28: 1 | T28: 1 | U28: 1 | V28: 1 | W28: 1 | X28: 1 | Y28: 1 | Z28: 1 | AB28: 1 | AD28: Member | AE28: 1
A29: =HYPERLINK("http://www.magelo.com/eq_view_profile.html?num=495320","Vyera") -> Vyera | B29: 65 | C29: Exarch | D29: Dark Elf | E29: YES | H29: X | J29: 1 | K29: 1 | L29: 1 | M29: 1 | N29: 1 | O29: 1 | P29: 1 | Q29: 1 | S29: 1 | T29: 1 | U29: 1 | W29: 1 | X29: 1 | Y29: 1 | AD29: Member | AE29: 1
A30: =HYPERLINK("http://www.magelo.com/eq_view_profile.html?num=62008","Xorolorn") -> Xorolorn | B30: 65 | C30: Exarch | D30: High Elf | E30: YES | F30: 1 | G30: 1 | H30: 1 | I30: 1 | J30: 1 | K30: 1 | M30: 1 | N30: 1 | O30: 1 | P30: 1 | Q30: 1 | R30: 1 | S30: 1 | T30: 1 | U30: 1 | V30: 1 | W30: 1 | X30: 1 | Y30: 1 | Z30: 1 | AD30: Member | AE30: 1
A31: Bohric | B31: 65 | C31: Baron | D31: Dwarf | E31: NO | F31: X | G31: X | AD31: On Break
A32: =HYPERLINK("http://www.magelo.com/eq_view_profile.html?num=84050","Gerweena") -> Gerweena | B32: 65 | C32: Venerable | D32: Halfling | E32: YES | G32: X | H32: X | J32: 1 | K32: 1 | L32: 1 | M32: 1 | N32: 1 | O32: 1 | P32: 1 | Q32: 1 | R32: 1 | S32: 1 | T32: 1 | U32: 1 | W32: 1 | X32: 1 | Y32: 1 | Z32: 1 | AA32: 1 | AB32: 1 | AC32: 1 | AD32: Member | AE32: 1
A33: =HYPERLINK("http://www.magelo.com/eq_view_profile.html?num=115196","Iendaar") -> Iendaar | B33: 65 | C33: Baron | D33: High Elf | E33: YES | H33: X | I33: X | AD33: On Break
A34: =HYPERLINK("http://www.magelo.com/eq_view_profile.html?num=581769","Samine") -> Samine | B34: 65 | C34: Venerable | D34: High Elf | E34: NO | F34: X | G34: X | M34: x | AD34: On Break
A35: =HYPERLINK("http://www.magelo.com/eq_view_profile.html?num=141442","Adella") -> Adella | B35: 65 | D35: Dwarf | E35: YES | F35: X | J35: x | K35: x | S35: x | W35: x | Z35: x | AD35: Alternate
A36: =HYPERLINK("http://www.magelo.com/eq_view_profile.html?num=345649","Andromache") -> Andromache | B36: 65 | C36: Venerable | D36: Dark Elf | E36: YES | H36: X | I36: X | J36: x | K36: x | L36: x | M36: x | N36: x | O36: x | P36: x | Q36: x | R36: x | S36: x | T36: x | U36: x | V36: x | W36: x | X36: x | Y36: x | AD36: Alternate
A37: Elan | B37: 65 | D37: High Elf | E37: NO | J37: x | K37: x | L37: x | M37: x | N37: x | O37: x | P37: x | Q37: x | R37: x | S37: x | T37: x | U37: x | V37: 1 | W37: x | X37: x | Y37: x | Z37: x | AA37: x | AB37: x | AC37: x | AD37: Alternate
A38: Fryar | B38: 65 | D38: Dwarf | E38: YES | AD38: Alternate
A39: =HYPERLINK("http://www.magelo.com/eq_view_profile.html?num=596866","Fuzella") -> Fuzella | B39: 65 | C39: Exarch | D39: Halfling | E39: YES | H39: X | J39: x | K39: x | L39: 1 | M39: x | N39: x | O39: x | P39: x | Q39: x | R39: x | S39: x | T39: x | U39: x | V39: X | W39: x | X39: x | Y39: x | AD39: Alternate
A40: Harrys | B40: 65 | C40: Exarch | D40: Dwarf | E40: YES | H40: 1 | I40: 1 | J40: x | K40: x | L40: x | M40: x | N40: x | O40: x | P40: x | Q40: x | R40: x | S40: x | T40: x | U40: x | V40: 1 | W40: x | X40: x | Y40: x | Z40: x | AD40: On Break
A41: =HYPERLINK("http://www.magelo.com/eq_view_profile.html?num=824717","Moogi") -> Moogi | B41: 63 | C41: Baroness | D41: High Elf | E41: YES | J41: x | K41: x | M41: x | N41: x | P41: x | S41: x | T41: x | W41: x | AD41: Alternate
A42: Pria | B42: 65 | D42: High Elf | E42: YES | J42: x | K42: x | L42: x | M42: x | N42: x | O42: x | P42: x | Q42: x | R42: x | S42: x | T42: x | U42: x | W42: x | X42: x | Y42: x | Z42: x | AD42: Alternate
A43: Restora | B43: 65 | D43: High Elf | E43: YES | H43: X | I43: X | J43: x | K43: x | M43: x | N43: x | O43: x | P43: x | Q43: x | R43: x | S43: x | T43: x | U43: x | V43: x | W43: x | X43: x | Y43: x | AD43: Alternate
A44: Sarigus | B44: 60 | C44: Venerable | D44: Halfling | E44: YES | F44: X | AD44: Alternate
B45: Levels | C45: Title | D45: Race | E45: Epic | F45: VP Key | G45: ST Key | H45: EMP Key | I45: VT Key | J45: PoJ Trials | K45: PoS Medals | L45: Agnarr | M45: PoN Hedge | N45: Teris Thule | O45: Saryn | P45: Aerin Dar | Q45: 3 Trials | R45: Mith Marr | S45: Grummus | T45: Carpin | U45: Bertolox | V45: PoI Dragon | W45: MB | X45: Talon Zek | Y45: Vallon Zek | Z45: RZTW | AA45: Solusek Ro | AB45: Air Water Earth | AC45: Fire | AD45: Status
A46: Druid
A47: =HYPERLINK("http://www.magelo.com/eq_view_profile.html?num=107624","Edylc") -> Edylc | B47: 65 | D47: Wood Elf | E47: YES | F47: 1 | G47: 1 | H47: 1 | I47: 1 | J47: 1 | K47: 1 | L47: 1 | M47: 1 | N47: 1 | O47: 1 | P47: 1 | Q47: 1 | R47: 1 | S47: 1 | T47: 1 | U47: 1 | V47: 1 | W47: 1 | X47: 1 | Y47: 1 | Z47: 1 | AA47: 1 | AB47: 1 | AC47: 1 | AD47: Member | AE47: 1
A48: =HYPERLINK("http://www.magelo.com/eq_view_profile.html?num=186512","Gweeto") -> Gweeto | B48: 65 | D48: Halfling | E48: YES | F48: 1 | G48: 1 | H48: 1 | I48: 1 | J48: 1 | K48: 1 | L48: 1 | M48: 1 | N48: 1 | O48: 1 | P48: 1 | Q48: 1 | R48: 1 | S48: 1 | T48: 1 | U48: 1 | V48: 1 | W48: 1 | X48: 1 | Y48: 1 | Z48: 1 | AD48: Member | AE48: 1
A49: =HYPERLINK("http://www.magelo.com/eq_view_profile.html?num=54717","Lilee") -> Lilee | B49: 65 | C49: Elder | D49: Wood Elf | E49: YES | H49: 1 | I49: 1 | J49: 1 | K49: 1 | L49: 1 | M49: 1 | N49: 1 | O49: 1 | P49: 1 | Q49: 1 | R49: 1 | S49: 1 | T49: 1 | U49: 1 | V49: 1 | W49: 1 | X49: 1 | Y49: 1 | Z49: 1 | AA49: 1 | AB49: 1 | AC49: 1 | AD49: Member | AE49: 1
A50: Panzon | B50: 65 | D50: Halfling | E50: YES | H50: 1 | I50: 1 | L50: 1 | R50: 1 | S50: 1 | T50: 1 | U50: 1 | W50: 1 | X50: 1 | Y50: 1 | Z50: 1 | AD50: Member | AE50: 1
A51: =HYPERLINK("http://www.magelo.com/eq_view_profile.html?num=12316","Thunderheart") -> Thunderheart | B51: 65 | C51: Elder | D51: Wood Elf | E51: YES | F51: 1 | H51: 1 | I51: 1 | J51: 1 | K51: 1 | L51: 1 | M51: 1 | N51: 1 | O51: 1 | P51: 1 | Q51: 1 | R51: 1 | S51: 1 | T51: 1 | U51: 1 | V51: 1 | W51: 1 | X51: 1 | Y51: 1 | AD51: Member | AE51: 1
A52: Tullane | B52: 65 | D52: Halfling | E52: YES | H52: 1 | I52: 1 | J52: 1 | N52: 1 | O52: 1 | S52: 1 | T52: 1 | Z52: 1 | AD52: Member | AE52: 1
A53: =HYPERLINK("http://www.magelo.com/eq_view_profile.html?num=126384","Denari") -> Denari | B53: 65 | D53: Half Elf | E53: YES | H53: X | I53: X | J53: 1 | K53: 1 | L53: 1 | M53: 1 | N53: 1 | O53: 1 | P53: 1 | Q53: 1 | R53: 1 | S53: 1 | T53: 1 | U53: 1 | W53: 1 | X53: 1 | Y53: 1 | Z53: 1 | AA53: 1 | AB53: 1 | AC53: 1 | AD53: Member | AE53: 1
A54: Trouble | B54: 65 | D54: Wood Elf | J54: 1 | K54: 1 | L54: 1 | M54: 1 | N54: 1 | O54: 1 | P54: 1 | Q54: 1 | R54: 1 | S54: 1 | T54: 1 | U54: 1 | W54: 1 | X54: 1 | Y54: 1 | Z54: 1 | AA54: 1 | AB54: 1 | AC54: 1 | AD54: Member | AE54: 1
A55: Leaya | B55: 62 | D55: Wood Elf | E55: YES | AD55: On Break
A56: =HYPERLINK("http://www.magelo.com/eq_view_profile.html?num=19213","Madgegal") -> Madgegal | B56: 65 | C56: Baroness | D56: Wood Elf | E56: YES | H56: X | I56: X | AD56: On Break
A57: =HYPERLINK("http://www.magelo.com/eq_view_profile.html?num=343679","Fellan") -> Fellan | B57: 61 | D57: Halfling | E57: NO | AD57: Alternate
A58: =HYPERLINK("http://www.magelo.com/eq_view_profile.html?num=226868","Padain") -> Padain | B58: 65 | C58: Elder | D58: Wood Elf | E58: YES | F58: X | G58: X | AD58: Alternate
A59: Enchanter
A60: =HYPERLINK("http://www.magelo.com/eq_view_profile.html?num=120701","Azlaan") -> Azlaan | B60: 65 | C60: Sage | D60: Erudite | E60: YES | F60: 1 | G60: 1 | H60: 1 | I60: 1 | J60: 1 | K60: 1 | L60: 1 | M60: 1 | N60: 1 | O60: 1 | P60: 1 | Q60: 1 | R60: 1 | S60: 1 | T60: 1 | U60: 1 | W60: 1 | X60: 1 | Y60: 1 | Z60: 1 | AA60: 1 | AB60: 1 | AC60: 1 | AD60: Member | AE60: 1
A61: Canny | B61: 65 | C61: Mistress | D61: High Elf | E61: NO | G61: 1 | H61: 1 | I61: 1 | J61: 1 | K61: 1 | M61: 1 | N61: 1 | O61: 1 | P61: 1 | Q61: 1 | R61: 1 | S61: 1 | T61: 1 | V61: 1 | W61: 1 | X61: 1 | Y61: 1 | AD61: Member | AE61: 1
A62: =HYPERLINK("http://www.magelo.com/eq_view_profile.html?num=345631","Cwell") -> Cwell | B62: 65 | C62: Master | D62: Erudite | E62: YES | F62: 1 | G62: 1 | H62: 1 | I62: 1 | J62: 1 | K62: 1 | L62: 1 | M62: 1 | N62: 1 | O62: 1 | P62: 1 | Q62: 1 | R62: 1 | S62: 1 | T62: 1 | U62: 1 | V62: 1 | W62: 1 | X62: 1 | Y62: 1 | AD62: Member | AE62: 1
A63: =HYPERLINK("http://www.magelo.com/eq_view_profile.html?num=773753","Morphos") -> Morphos | B63: 65 | C63: Sage | D63: High Elf | E63: NO | H63: 1 | I63: 1 | J63: 1 | K63: 1 | L63: 1 | M63: 1 | N63: 1 | O63: 1 | Q63: 1 | R63: 1 | S63: 1 | T63: 1 | U63: 1 | W63: 1 | X63: 1 | Y63: 1 | Z63: 1 | AA63: 1 | AB63: 1 | AC63: 1 | AD63: Member | AE63: 1
A64: =HYPERLINK("http://www.magelo.com/eq_view_profile.html?num=18992","Qyzus") -> Qyzus | B64: 65 | C64: Mistress | D64: High Elf | E64: YES | H64: 1 | I64: 1 | J64: 1 | K64: 1 | L64: 1 | M64: 1 | N64: 1 | O64: 1 | P64: 1 | Q64: 1 | R64: 1 | S64: 1 | T64: 1 | U64: 1 | V64: 1 | W64: 1 | X64: 1 | Y64: 1 | Z64: 1 | AA64: 1 | AB64: 1 | AC64: 1 | AD64: Member | AE64: 1
A65: Sadine | B65: 65 | D65: High Elf | K65: 1 | L65: 1 | M65: 1 | N65: 1 | O65: 1 | Q65: 1 | S65: 1 | T65: 1 | U65: 1 | W65: 1 | X65: 1 | Y65: 1 | AD65: Member | AE65: 1
A66: Skybye | B66: 65 | C66: Mistress | D66: High Elf | E66: YES | J66: 1 | K66: 1 | L66: 1 | M66: 1 | N66: 1 | O66: 1 | P66: 1 | Q66: 1 | R66: 1 | S66: 1 | T66: 1 | U66: 1 | V66: 1 | W66: 1 | X66: 1 | Y66: 1 | Z66: 1 | AA66: 1 | AB66: 1 | AC66: 1 | AD66: Member | AE66: 1
A67: =HYPERLINK("http://www.magelo.com/eq_view_profile.html?num=363509","Sakuma") -> Sakuma | B67: 64 | D67: High Elf | E67: NO | F67: X | G67: X | H67: X | AD67: On Break
A68: Amantus | B68: 64 | C68: Master | D68: High Elf | E68: NO | H68: X | J68: x | K68: x | M68: x | N68: x | O68: x | P68: x | Q68: x | R68: x | S68: x | T68: x | U68: x | V68: x | W68: x | X68: x | Y68: x | AD68: Alternate
A69: Jaquinetta | B69: 65 | D69: Dark Elf | E69: NO | AD69: Alternate
B70: Levels | C70: Title | D70: Race | E70: Epic | F70: VP Key | G70: ST Key | H70: EMP Key | I70: VT Key | J70: PoJ Trials | K70: PoS Medals | L70: Agnarr | M70: PoN Hedge | N70: Teris Thule | O70: Saryn | P70: Aerin Dar | Q70: 3 Trials | R70: Mith Marr | S70: Grummus | T70: Carpin | U70: Bertolox | V70: PoI Dragon | W70: MB | X70: Talon Zek | Y70: Vallon Zek | Z70: RZTW | AA70: Solusek Ro | AB70: Air Water Earth | AC70: Fire | AD70: Status
A71: Mages
A72: =HYPERLINK("http://www.magelo.com/eq_view_profile.html?num=458201","Crimsen") -> Crimsen | B72: 65 | C72: Master | D72: Gnome | E72: NO | H72: 1 | I72: 1 | J72: 1 | K72: 1 | L72: 1 | M72: 1 | N72: 1 | O72: 1 | P72: 1 | Q72: 1 | R72: 1 | S72: 1 | T72: 1 | U72: 1 | V72: 1 | W72: 1 | X72: 1 | Y72: 1 | Z72: 1 | AA72: 1 | AB72: 1 | AC72: 1 | AD72: Member | AE72: 1
A73: =HYPERLINK("http://www.magelo.com/eq_view_profile.html?num=466839","Almorzar") -> Almorzar | B73: 65 | C73: Sage | D73: Erudite | E73: NO | F73: X | G73: X | H73: X | I73: X | J73: 1 | K73: 1 | M73: 1 | N73: 1 | P73: 1 | Q73: 1 | S73: 1 | T73: 1 | V73: 1 | W73: 1 | AD73: Member | AE73: 1
A74: =HYPERLINK("http://www.magelo.com/eq_view_profile.html?num=191052","Canda") -> Canda | B74: 64 | C74: Baron | D74: High Elf | E74: YES | F74: X | G74: X | H74: X | I74: X | AD74: On Break
A75: Gaidar | B75: 63 | D75: Human | E75: NO | AD75: On Break
A76: =HYPERLINK("http://www.magelo.com/eq_view_profile.html?num=855868","Elementus") -> Elementus | B76: 64 | C76: Master | D76: Erudite | E76: NO | J76: x | K76: x | M76: x | N76: x | O76: x | P76: x | Q76: x | S76: x | W76: x | X76: x | Y76: x | AD76: Alternate
A77: Mandrayke | B77: 63 | E77: NO | AD77: Alternate
A78: Monks
A79: Kalmarr | B79: 56 | AD79: Member | AE79: 1
A80: =HYPERLINK("http://www.magelo.com/eq_view_profile.html?num=93986","Quogin") -> Quogin | B80: 65 | C80: Sensei | D80: Human | E80: YES | G80: 1 | H80: 1 | I80: 1 | J80: 1 | K80: 1 | L80: 1 | M80: 1 | N80: 1 | O80: 1 | P80: 1 | Q80: 1 | R80: 1 | S80: 1 | T80: 1 | U80: 1 | W80: 1 | X80: 1 | Y80: 1 | AD80: On Break
A81: Omgmise | B81: 65 | D81: Iksar | E81: YES | G81: 1 | H81: 1 | I81: 1 | J81: 1 | K81: 1 | L81: 1 | M81: 1 | N81: 1 | O81: 1 | P81: 1 | Q81: 1 | R81: 1 | S81: 1 | T81: 1 | U81: 1 | W81: 1 | X81: 1 | Y81: 1 | AD81: Member | AE81: 1
A82: Stormin | B82: 65 | C82: Sensei | D82: Human | E82: YES | F82: 1 | G82: 1 | H82: 1 | I82: 1 | J82: 1 | K82: 1 | L82: 1 | M82: 1 | N82: 1 | O82: 1 | P82: 1 | Q82: 1 | R82: 1 | S82: 1 | T82: 1 | U82: 1 | V82: 1 | W82: 1 | X82: 1 | Y82: 1 | AD82: Member | AE82: 1
A83: =HYPERLINK("http://www.magelo.com/eq_view_profile.html?num=54695","Talinsyn") -> Talinsyn | B83: 65 | C83: Sensei | D83: Human | E83: YES | F83: 1 | G83: 1 | H83: 1 | I83: 1 | J83: 1 | K83: 1 | L83: 1 | M83: 1 | N83: 1 | O83: 1 | P83: 1 | Q83: 1 | R83: 1 | S83: 1 | T83: 1 | U83: 1 | V83: 1 | W83: 1 | X83: 1 | Y83: 1 | Z83: 1 | AA83: 1 | AB83: 1 | AC83: 1 | AD83: Officer | AE83: 1
A84: Voir | B84: 65 | D84: Iksar | J84: 1 | K84: 1 | L84: 1 | M84: 1 | N84: 1 | O84: 1 | P84: 1 | Q84: 1 | R84: 1 | S84: 1 | T84: 1 | U84: 1 | W84: 1 | X84: 1 | Y84: 1 | Z84: 1 | AA84: 1 | AB84: 1 | AC84: 1 | AD84: Member | AE84: 1
A85: Necromancer
A86: =HYPERLINK("http://www.magelo.com/eq_view_profile.html?num=799806","Beaa") -> Beaa | B86: 65 | C86: Archlich | D86: Gnome | E86: NO | H86: 1 | I86: 1 | J86: 1 | K86: 1 | M86: 1 | N86: 1 | O86: 1 | P86: 1 | Q86: 1 | R86: 1 | S86: 1 | T86: 1 | U86: 1 | V86: 1 | W86: 1 | X86: 1 | Y86: 1 | Z86: 1 | AD86: Member | AE86: 1
A87: Drexen | B87: 65 | C87: Sage | D87: Dark Elf | E87: NO | H87: 1 | I87: 1 | J87: 1 | K87: 1 | L87: 1 | M87: 1 | N87: 1 | O87: 1 | P87: 1 | Q87: 1 | S87: 1 | T87: 1 | U87: 1 | V87: 1 | W87: 1 | X87: 1 | Y87: 1 | AD87: Member | AE87: 1
A88: Scraps | B88: 65 | C88: Archlich | D88: Gnome | E88: YES | G88: 1 | H88: 1 | I88: 1 | J88: 1 | K88: 1 | L88: 1 | M88: 1 | N88: 1 | O88: 1 | P88: 1 | Q88: 1 | R88: 1 | S88: 1 | T88: 1 | U88: 1 | V88: 1 | W88: 1 | X88: 1 | Y88: 1 | Z88: 1 | AA88: 1 | AB88: 1 | AC88: 1 | AD88: Member | AE88: 1
A89: =HYPERLINK("http://www.magelo.com/eq_view_profile.html?num=434407","Evilgrim") -> Evilgrim | B89: 64 | C89: Baron | D89: Gnome | E89: YES | F89: X | H89: X | AD89: On Break
A90: Lifesteler | B90: 65 | D90: Dark Elf | E90: NO | J90: x | K90: x | L90: x | M90: x | N90: x | O90: x | Q90: x | R90: x | S90: x | T90: x | U90: x | W90: x | X90: x | Y90: x | Z90: x | AA90: x | AB90: x | AC90: x | AD90: On Break
B91: Levels | C91: Title | D91: Race | E91: Epic | F91: VP Key | G91: ST Key | H91: EMP Key | I91: VT Key | J91: PoJ Trials | K91: PoS Medals | L91: Agnarr | M91: PoN Hedge | N91: Teris Thule | O91: Saryn | P91: Aerin Dar | Q91: 3 Trials | R91: Mith Marr | S91: Grummus | T91: Carpin | U91: Bertolox | V91: PoI Dragon | W91: MB | X91: Talon Zek | Y91: Vallon Zek | Z91: RZTW | AA91: Solusek Ro | AB91: Air Water Earth | AC91: Fire | AD91: Status
A92: Paladins
A93: =HYPERLINK("http://www.magelo.com/eq_view_profile.html?num=753329","Chantarin") -> Chantarin | B93: 65 | D93: Human | E93: NO | H93: 1 | I93: 1 | J93: 1 | K93: 1 | L93: 1 | M93: 1 | N93: 1 | O93: 1 | P93: 1 | Q93: 1 | R93: 1 | S93: 1 | T93: 1 | U93: 1 | V93: 1 | W93: 1 | X93: 1 | Y93: 1 | AD93: Member | AE93: 1
A94: Glloinn | B94: 65 | C94: Duke | D94: Dwarf | E94: NO | H94: 1 | I94: 1 | J94: 1 | K94: 1 | M94: 1 | N94: 1 | O94: 1 | P94: 1 | Q94: 1 | R94: 1 | S94: 1 | T94: 1 | V94: 1 | W94: 1 | X94: 1 | Y94: 1 | AD94: Member | AE94: 1
A95: =HYPERLINK("http://www.magelo.com/eq_view_profile.html?num=350082","Infirit") -> Infirit | B95: 65 | C95: Baron | D95: Half Elf | E95: YES | G95: X | H95: X | J95: 1 | K95: 1 | L95: 1 | M95: 1 | N95: 1 | O95: 1 | P95: 1 | Q95: 1 | R95: 1 | S95: 1 | T95: 1 | U95: 1 | W95: 1 | X95: 1 | Y95: 1 | Z95: 1 | AA95: 1 | AB95: 1 | AC95: 1 | AD95: Member | AE95: 1
A96: =HYPERLINK("http://www.magelo.com/eq_view_profile.html?num=615440","Kwaidd") -> Kwaidd | B96: 65 | D96: Dwarf | E96: NO | G96: 1 | H96: 1 | I96: 1 | J96: 1 | K96: 1 | M96: 1 | N96: 1 | O96: 1 | Q96: 1 | R96: 1 | S96: 1 | T96: 1 | U96: 1 | W96: 1 | X96: 1 | Y96: 1 | AD96: Member | AE96: 1
A97: Stpauli | B97: 65 | C97: Duchess | D97: High Elf | E97: NO | J97: 1 | K97: 1 | L97: 1 | M97: 1 | N97: 1 | O97: 1 | P97: 1 | Q97: 1 | R97: 1 | S97: 1 | T97: 1 | U97: 1 | V97: 1 | W97: 1 | X97: 1 | Y97: 1 | Z97: 1 | AA97: 1 | AB97: 1 | AC97: 1 | AD97: Member | AE97: 1
A98: Thorveld | B98: 65 | C98: Duke | D98: Dwarf | E98: NO | H98: 1 | I98: 1 | J98: x | K98: x | M98: x | N98: x | O98: x | P98: x | Q98: x | R98: x | S98: x | T98: x | U98: x | V98: 1 | W98: x | X98: x | Y98: x | AD98: On Break
A99: Uniqs | B99: 65 | D99: Dwarf | E99: NO | J99: 1 | K99: 1 | M99: 1 | N99: 1 | O99: 1 | P99: 1 | Q99: 1 | R99: 1 | S99: 1 | T99: 1 | U99: 1 | V99: 1 | W99: 1 | X99: 1 | Y99: 1 | AD99: Member | AE99: 1
A100: Wyllo | B100: 65 | C100: Lady | D100: Half Elf | E100: NO | J100: 1 | K100: 1 | L100: 1 | M100: 1 | N100: 1 | O100: 1 | P100: 1 | Q100: 1 | R100: 1 | S100: 1 | T100: 1 | U100: 1 | W100: 1 | X100: 1 | Y100: 1 | Z100: 1 | AA100: 1 | AB100: 1 | AC100: 1 | AD100: Member | AE100: 1
A101: Ranger
A102: Britania | B102: 65 | D102: Wood Elf | E102: NO | H102: 1 | I102: 1 | J102: 1 | M102: 1 | N102: 1 | P102: 1 | S102: 1 | T102: 1 | W102: 1 | X102: 1 | Y102: 1 | AD102: Member | AE102: 1
A103: =HYPERLINK("http://www.magelo.com/eq_view_profile.html?num=66546","Canis") -> Canis | B103: 65 | C103: Hunter | D103: Wood Elf | E103: YES | G103: 1 | H103: 1 | I103: 1 | J103: 1 | K103: 1 | L103: 1 | M103: 1 | N103: 1 | O103: 1 | P103: 1 | Q103: 1 | R103: 1 | S103: 1 | T103: 1 | U103: 1 | V103: 1 | W103: 1 | X103: 1 | Y103: 1 | Z103: 1 | AA103: 1 | AB103: 1 | AC103: 1 | AD103: Member | AE103: 1
A104: =HYPERLINK("http://www.magelo.com/eq_view_profile.html?num=11263","Kaziel") -> Kaziel | B104: 65 | C104: Hunter | D104: Wood Elf | E104: YES | H104: 1 | I104: 1 | J104: 1 | K104: 1 | L104: 1 | M104: 1 | N104: 1 | O104: 1 | P104: 1 | Q104: 1 | R104: 1 | S104: 1 | T104: 1 | U104: 1 | V104: 1 | W104: 1 | X104: 1 | Y104: 1 | Z104: 1 | AA104: 1 | AB104: 1 | AC104: 1 | AD104: Member | AE104: 1
A105: Microndew | B105: 65 | D105: Wood Elf | Y105: 1 | AD105: Member | AE105: 1
A106: Oakken | B106: 63 | D106: Wood Elf | E106: YES | S106: 1 | AD106: Member | AE106: 1
A107: =HYPERLINK("http://www.magelo.com/eq_view_profile.html?num=100067","Rothe") -> Rothe | B107: 65 | C107: Hunter | D107: Wood Elf | E107: YES | H107: 1 | I107: 1 | J107: 1 | K107: 1 | M107: 1 | N107: 1 | O107: 1 | P107: 1 | Q107: 1 | R107: 1 | S107: 1 | T107: 1 | U107: 1 | W107: 1 | X107: 1 | Y107: 1 | AD107: Member | AE107: 1
A108: =HYPERLINK("http://www.magelo.com/eq_view_profile.html?num=578910","Tano") -> Tano | B108: 65 | D108: Wood Elf | E108: YES | H108: 1 | I108: 1 | J108: 1 | K108: 1 | M108: 1 | N108: 1 | O108: 1 | P108: 1 | Q108: 1 | R108: 1 | S108: 1 | T108: 1 | U108: 1 | V108: 1 | W108: 1 | X108: 1 | Y108: 1 | AD108: Member | AE108: 1
A109: Saluki | B109: 65 | D109: Half Elf | E109: YES | G109: 1 | H109: 1 | I109: 1 | J109: 1 | K109: 1 | L109: 1 | M109: 1 | N109: 1 | O109: 1 | P109: 1 | Q109: 1 | R109: 1 | S109: 1 | T109: 1 | U109: 1 | V109: 1 | W109: 1 | X109: 1 | Y109: 1 | Z109: 1 | AD109: Member | AE109: 1
A110: =HYPERLINK("http://www.magelo.com/eq_view_profile.html?num=799168","Tyndall") -> Tyndall | B110: 65 | C110: Hunter | D110: Half Elf | E110: NO | G110: 1 | H110: 1 | I110: 1 | J110: 1 | K110: 1 | L110: 1 | M110: 1 | N110: 1 | O110: 1 | P110: 1 | Q110: 1 | R110: 1 | S110: 1 | T110: 1 | U110: 1 | V110: 1 | W110: 1 | X110: 1 | Y110: 1 | Z110: 1 | AB110: 1 | AD110: Member | AE110: 1
A111: Andriul | B111: 60 | D111: Wood Elf | E111: YES | AD111: On Break
A112: =HYPERLINK("http://www.magelo.com/eq_view_profile.html?num=350545","Moshady") -> Moshady | B112: 65 | C112: Veteran | D112: Wood Elf | E112: YES | G112: X | H112: X | I112: X | AD112: On Break
B113: Levels | C113: Title | D113: Race | E113: Epic | F113: VP Key | G113: ST Key | H113: EMP Key | I113: VT Key | J113: PoJ Trials | K113: PoS Medals | L113: Agnarr | M113: PoN Hedge | N113: Teris Thule | O113: Saryn | P113: Aerin Dar | Q113: 3 Trials | R113: Mith Marr | S113: Grummus | T113: Carpin | U113: Bertolox | V113: PoI Dragon | W113: MB | X113: Talon Zek | Y113: Vallon Zek | Z113: RZTW | AA113: Solusek Ro | AB113: Air Water Earth | AC113: Fire | AD113: Status
A114: Rogues
A115: =HYPERLINK("http://www.magelo.com/eq_view_profile.html?num=524849","Gerhardt") -> Gerhardt | B115: 65 | C115: Marauder | D115: Dwarf | E115: YES | F115: 1 | G115: 1 | H115: 1 | I115: 1 | J115: 1 | K115: 1 | M115: 1 | N115: 1 | O115: 1 | P115: 1 | Q115: 1 | R115: 1 | S115: 1 | T115: 1 | U115: 1 | V115: 1 | W115: 1 | X115: 1 | Y115: 1 | AD115: Member | AE115: 1
A116: =HYPERLINK("http://www.magelo.com/eq_view_profile.html?num=319473","Less") -> Less | B116: 65 | C116: Marauder | D116: Barbarian | E116: YES | G116: 1 | H116: 1 | I116: 1 | J116: 1 | K116: 1 | M116: 1 | N116: 1 | O116: 1 | P116: 1 | Q116: 1 | R116: 1 | S116: 1 | T116: 1 | U116: 1 | V116: 1 | W116: 1 | X116: 1 | Y116: 1 | Z116: 1 | AD116: Officer | AE116: 1
A117: =HYPERLINK("http://www.magelo.com/eq_view_profile.html?num=176420","Morisan") -> Morisan | B117: 65 | C117: Marauder | D117: Dwarf | E117: YES | F117: 1 | G117: 1 | H117: 1 | I117: 1 | J117: 1 | K117: 1 | L117: 1 | M117: 1 | N117: 1 | O117: 1 | P117: 1 | Q117: 1 | R117: 1 | S117: 1 | T117: 1 | U117: 1 | V117: 1 | W117: 1 | X117: 1 | Y117: 1 | Z117: 1 | AD117: Member | AE117: 1
A118: =HYPERLINK("http://www.magelo.com/eq_view_profile.html?num=123933","Rebbats") -> Rebbats | B118: 65 | D118: Barbarian | E118: YES | J118: 1 | K118: 1 | M118: 1 | N118: 1 | O118: 1 | P118: 1 | Q118: 1 | R118: 1 | S118: 1 | T118: 1 | U118: 1 | V118: 1 | W118: 1 | X118: 1 | Y118: 1 | Z118: 1 | AA118: 1 | AB118: 1 | AC118: 1 | AD118: Member | AE118: 1
A119: Tryol | B119: 65 | D119: Barbarian | E119: YES | J119: 1 | K119: 1 | L119: 1 | M119: 1 | N119: 1 | O119: 1 | P119: 1 | Q119: 1 | R119: 1 | S119: 1 | T119: 1 | U119: 1 | V119: 1 | W119: 1 | X119: 1 | Y119: 1 | Z119: 1 | AA119: 1 | AB119: 1 | AC119: 1 | AD119: Member | AE119: 1
A120: =HYPERLINK("http://www.magelo.com/eq_view_profile.html?num=92314","Vestrial") -> Vestrial | B120: 65 | C120: Marauder | D120: Half Elf | E120: YES | F120: 1 | G120: 1 | H120: 1 | I120: 1 | J120: 1 | K120: 1 | M120: 1 | N120: 1 | O120: 1 | P120: 1 | Q120: 1 | R120: 1 | S120: 1 | T120: 1 | U120: 1 | V120: 1 | W120: 1 | X120: 1 | Y120: 1 | AD120: Officer | AE120: 1
A121: O'Grady | B121: 65 | D121: Dwarf | E121: YES | G121: X | H121: X | I121: X | AD121: On Break
A122: Shadow Knights
A123: =HYPERLINK("http:www.magelo.com/eq_view_profile.html?num=362550","Asdrubael") -> Asdrubael | B123: 65 | C123: Duke | D123: Dark Elf | E123: YES | F123: 1 | G123: 1 | H123: 1 | I123: 1 | J123: 1 | K123: 1 | M123: 1 | N123: 1 | O123: 1 | P123: 1 | Q123: 1 | R123: 1 | S123: 1 | T123: 1 | U123: 1 | V123: 1 | W123: 1 | X123: 1 | Y123: 1 | AD123: Member | AE123: 1
A124: =HYPERLINK("http:www.magelo.com/eq_view_profile.html?num=313032","Groldar") -> Groldar | B124: 65 | D124: Iksar | E124: NO | G124: X | H124: X | J124: 1 | K124: 1 | L124: 1 | M124: 1 | N124: 1 | O124: 1 | P124: 1 | Q124: 1 | R124: 1 | S124: 1 | T124: 1 | U124: 1 | W124: 1 | X124: 1 | Y124: 1 | Z124: 1 | AA124: 1 | AB124: 1 | AC124: 1 | AD124: Member | AE124: 1
A125: =HYPERLINK("http://www.magelo.com/eq_view_profile.html?num=70519","Rakum") -> Rakum | B125: 65 | C125: Duke | D125: Troll | E125: NO | G125: 1 | H125: 1 | I125: 1 | J125: 1 | K125: 1 | L125: 1 | M125: 1 | N125: 1 | O125: 1 | P125: 1 | Q125: 1 | R125: 1 | S125: 1 | T125: 1 | U125: 1 | V125: 1 | W125: 1 | X125: 1 | Y125: 1 | Z125: 1 | AA125: 1 | AB125: 1 | AC125: 1 | AD125: Member | AE125: 1
A126: =HYPERLINK("http://www.magelo.com/eq_view_profile.html?num=686618","Sssanarok") -> Sssanarok | B126: 65 | C126: Duke | D126: Iksar | E126: NO | H126: 1 | I126: 1 | J126: 1 | K126: 1 | M126: 1 | N126: 1 | O126: 1 | P126: 1 | Q126: 1 | S126: 1 | T126: 1 | U126: 1 | V126: 1 | W126: 1 | X126: 1 | AD126: Member | AE126: 1
A127: =HYPERLINK("http://www.magelo.com/eq_view_profile.html?num=359742","Tobak") -> Tobak | B127: 64 | D127: Ogre | E127: YES | F127: 1 | G127: 1 | H127: 1 | AD127: Alternate
A128: =HYPERLINK("http://www.magelo.com/eq_view_profile.html?num=877173","Veya") -> Veya | B128: 65 | D128: Iksar | E128: NO | G128: X | H128: X | I128: X | J128: 1 | K128: 1 | L128: 1 | M128: 1 | N128: 1 | O128: 1 | P128: 1 | Q128: 1 | R128: 1 | S128: 1 | T128: 1 | U128: 1 | V128: 1 | W128: 1 | X128: 1 | Y128: 1 | Z128: 1 | AD128: Officer | AE128: 1
A129: =HYPERLINK("http://www.legendsoftherealm.com/legends/","Lunna") -> Lunna | B129: 65 | C129: Baroness | D129: Erudite | E129: NO | G129: X | H129: X | I129: X | AD129: On Break
A130: =HYPERLINK("http://www.magelo.com/eq_view_profile.html?num=350162","Zolgar") -> Zolgar | B130: 65 | C130: Sir | D130: Troll | E130: YES | F130: X | G130: X | H130: X | I130: X | AD130: On Break
A131: =HYPERLINK("http://www.magelo.com/eq_view_profile.html?num=309090","Niudan") -> Niudan | B131: 58 | C131: Baron | D131: Erudite | E131: YES | J131: x | K131: x | O131: x | P131: x | S131: x | T131: x | V131: x | W131: x | X131: x | Y131: x | Z131: x | AD131: Alternate
B132: Levels | C132: Title | D132: Race | E132: Epic | F132: VP Key | G132: ST Key | H132: EMP Key | I132: VT Key | J132: PoJ Trials | K132: PoS Medals | L132: Agnarr | M132: PoN Hedge | N132: Teris Thule | O132: Saryn | P132: Aerin Dar | Q132: 3 Trials | R132: Mith Marr | S132: Grummus | T132: Carpin | U132: Bertolox | V132: PoI Dragon | W132: MB | X132: Talon Zek | Y132: Vallon Zek | Z132: RZTW | AA132: Solusek Ro | AB132: Air Water Earth | AC132: Fire | AD132: Status
A133: Shamans
A134: =HYPERLINK("http://www.magelo.com/eq_view_profile.html?num=557618","Aldarien") -> Aldarien | B134: 65 | C134: Elder | D134: Barbarian | E134: YES | G134: 1 | H134: 1 | I134: 1 | J134: 1 | K134: 1 | L134: 1 | M134: 1 | N134: 1 | O134: 1 | P134: 1 | Q134: 1 | R134: 1 | S134: 1 | T134: 1 | U134: 1 | V134: 1 | W134: 1 | X134: 1 | Y134: 1 | AD134: Member | AE134: 1
A135: =HYPERLINK("http://www.magelo.com/eq_view_profile.html?num=29294","Angryor") -> Angryor | B135: 65 | C135: Venerable | D135: Barbarian | E135: YES | H135: 1 | I135: 1 | J135: 1 | M135: 1 | N135: 1 | O135: 1 | Q135: 1 | R135: 1 | S135: 1 | T135: 1 | U135: 1 | W135: 1 | X135: 1 | Y135: 1 | AD135: Member | AE135: 1
A136: Bamslam | B136: 65 | C136: Venerable | D136: Troll | E136: YES | F136: 1 | G136: 1 | H136: 1 | I136: 1 | J136: 1 | K136: 1 | L136: 1 | M136: 1 | N136: 1 | O136: 1 | P136: 1 | Q136: 1 | R136: 1 | S136: 1 | T136: 1 | U136: 1 | X136: 1 | Y136: 1 | AD136: Member | AE136: 1
A137: =HYPERLINK("http://www.magelo.com/eq_view_profile.html?num=627547","Blisk") -> Blisk | B137: 65 | C137: Baron | D137: Iksar | E137: YES | G137: 1 | H137: 1 | I137: 1 | Y137: 1 | AD137: Member | AE137: 1
A138: Bulvyne | B138: 65 | C138: Elder | D138: Barbarian | E138: YES | G138: 1 | H138: 1 | I138: 1 | J138: 1 | K138: 1 | M138: 1 | N138: 1 | O138: 1 | P138: 1 | Q138: 1 | R138: 1 | S138: 1 | T138: 1 | U138: 1 | X138: 1 | Y138: 1 | AD138: Member | AE138: 1
A139: =HYPERLINK("http://www.magelo.com/eq_view_profile.html?num=54513","Gart") -> Gart | B139: 65 | D139: Barbarian | E139: YES | H139: 1 | I139: 1 | J139: 1 | K139: 1 | L139: 1 | M139: 1 | N139: 1 | O139: 1 | P139: 1 | Q139: 1 | R139: 1 | S139: 1 | T139: 1 | U139: 1 | V139: 1 | W139: 1 | X139: 1 | Y139: 1 | Z139: 1 | AD139: Member | AE139: 1
A140: Kroze | B140: 65 | D140: Barbarian | E140: YES | H140: 1 | I140: 1 | Y140: 1 | AD140: Member | AE140: 1
A141: =HYPERLINK("http://www.magelo.com/eq_view_profile.html?num=347641","Ruanu") -> Ruanu | B141: 65 | C141: Venerable | D141: Troll | E141: YES | F141: 1 | G141: 1 | H141: 1 | I141: 1 | J141: 1 | K141: 1 | L141: 1 | M141: 1 | N141: 1 | O141: 1 | Q141: 1 | R141: 1 | S141: 1 | T141: 1 | U141: 1 | W141: 1 | X141: 1 | Y141: 1 | AA141: 1 | AC141: 1 | AD141: Member | AE141: 1
A142: =HYPERLINK("http://www.magelo.com/eq_view_profile.html?num=197796","Saramina") -> Saramina | B142: 65 | C142: Elder | D142: Barbarian | E142: YES | F142: 1 | G142: 1 | H142: 1 | I142: 1 | J142: 1 | K142: 1 | L142: 1 | M142: 1 | N142: 1 | O142: 1 | P142: 1 | Q142: 1 | R142: 1 | S142: 1 | T142: 1 | U142: 1 | W142: 1 | X142: 1 | Y142: 1 | Z142: 1 | AB142: 1 | AD142: Member | AE142: 1
A143: =HYPERLINK("http://www.magelo.com/eq_view_profile.html?num=194845","Ulskun") -> Ulskun | B143: 65 | C143: Elder | D143: Barbarian | E143: YES | G143: 1 | H143: 1 | I143: 1 | J143: 1 | K143: 1 | M143: 1 | N143: 1 | O143: 1 | P143: 1 | Q143: 1 | R143: 1 | S143: 1 | T143: 1 | U143: 1 | W143: 1 | X143: 1 | Y143: 1 | AD143: Member | AE143: 1
A144: =HYPERLINK("http://www.magelo.com/eq_view_profile.html?num=412675","Walknot") -> Walknot | B144: 65 | D144: Ogre | E144: YES | H144: 1 | I144: 1 | J144: 1 | K144: 1 | M144: 1 | N144: 1 | O144: 1 | P144: 1 | Q144: 1 | R144: 1 | S144: 1 | T144: 1 | U144: 1 | V144: 1 | W144: 1 | X144: 1 | Y144: 1 | AD144: Member | AE144: 1
A145: =HYPERLINK("http://www.magelo.com/eq_view_profile.html?num=356943","Zurs") -> Zurs | B145: 65 | C145: Venerable | D145: Barbarian | E145: YES | F145: 1 | G145: 1 | H145: 1 | I145: 1 | J145: 1 | K145: 1 | M145: 1 | N145: 1 | O145: 1 | P145: 1 | Q145: 1 | S145: 1 | T145: 1 | U145: 1 | W145: 1 | X145: 1 | Y145: 1 | AD145: Member | AE145: 1
A146: Indar | B146: 65 | D146: Barbarian | E146: YES | H146: 1 | I146: 1 | AD146: On Break
A147: Kikshaaz | B147: 55 | E147: NO | AD147: Alternate
A148: =HYPERLINK("http://www.magelo.com/eq_view_profile.html?num=341926","Oenone") -> Oenone | B148: 60 | C148: Venerable | D148: Troll | E148: YES | F148: X | Z148: x | AD148: Alternate
A149: Gzzak | B149: 63 | D149: Troll | Q149: x | S149: x | T149: x | X149: x | Y149: x | AD149: Member | AE149: 1
A150: Warriors
A151: =HYPERLINK("http://www.magelo.com/eq_view_profile.html?num=343105","Hearsay") -> Hearsay | B151: 65 | C151: Veteran | D151: Barbarian | E151: YES | F151: 1 | G151: 1 | H151: 1 | I151: 1 | J151: 1 | K151: 1 | L151: 1 | M151: 1 | N151: 1 | O151: 1 | P151: 1 | Q151: 1 | R151: 1 | S151: 1 | T151: 1 | U151: 1 | V151: 1 | W151: 1 | X151: 1 | Y151: 1 | Z151: 1 | AD151: Member | AE151: 1
A152: =HYPERLINK("http://www.magelo.com/eq_view_profile.html?num=641141","Kylliyn") -> Kylliyn | B152: 65 | C152: Veteran | D152: Dwarf | E152: NO | G152: 1 | H152: 1 | I152: 1 | J152: 1 | K152: 1 | M152: 1 | N152: 1 | O152: 1 | P152: 1 | Q152: 1 | R152: 1 | S152: 1 | T152: 1 | U152: 1 | V152: 1 | W152: 1 | X152: 1 | Y152: 1 | Z152: 1 | AA152: 1 | AB152: 1 | AC152: 1 | AD152: Member | AE152: 1
A153: Kroe | B153: 65 | D153: Barbarian | Y153: 1 | AD153: Member | AE153: 1
A154: =HYPERLINK("http://www.magelo.com/eq_view_profile.html?num=430840","Makyaded") -> Makyaded | B154: 65 | D154: Barbarian | E154: NO | H154: 1 | I154: 1 | J154: 1 | K154: 1 | M154: 1 | N154: 1 | P154: 1 | Q154: 1 | R154: 1 | S154: 1 | T154: 1 | U154: 1 | V154: 1 | W154: 1 | X154: 1 | Y154: 1 | AD154: Member | AE154: 1
A155: Panzona | B155: 65 | D155: Halfling | E155: NO | H155: 1 | I155: 1 | R155: 1 | S155: 1 | T155: 1 | U155: 1 | V155: 1 | W155: 1 | X155: 1 | Y155: 1 | Z155: 1 | AD155: Member | AE155: 1
A156: =HYPERLINK("http://www.magelo.com/eq_view_profile.html?num=265387","Sarelin") -> Sarelin | B156: 65 | C156: Marshall | D156: Barbarian | E156: NO | H156: 1 | I156: 1 | J156: 1 | K156: 1 | L156: 1 | M156: 1 | N156: 1 | P156: 1 | Q156: 1 | R156: 1 | S156: 1 | T156: 1 | U156: 1 | V156: 1 | W156: 1 | X156: 1 | Y156: 1 | Z156: 1 | AD156: Member | AE156: 1
A157: =HYPERLINK("http://www.magelo.com/eq_view_profile.html?num=140750","Tugurok") -> Tugurok | B157: 65 | C157: Veteran | D157: Ogre | E157: YES | H157: 1 | I157: 1 | J157: 1 | K157: 1 | L157: 1 | M157: 1 | N157: 1 | O157: 1 | P157: 1 | Q157: 1 | R157: 1 | S157: 1 | T157: 1 | U157: 1 | V157: 1 | W157: 1 | X157: 1 | Y157: 1 | Z157: 1 | AD157: Member | AE157: 1
A158: =HYPERLINK("http://www.magelo.com/eq_view_profile.html?num=361707","Veera") -> Veera | B158: 55 | D158: Barbarian | E158: NO | AD158: On Break
A159: Caldok | B159: 65 | D159: Dwarf | E159: NO | G159: X | H159: X | I159: X | J159: 1 | K159: 1 | L159: 1 | M159: 1 | N159: 1 | O159: 1 | P159: 1 | Q159: 1 | R159: 1 | S159: 1 | T159: 1 | U159: 1 | W159: 1 | X159: 1 | Y159: 1 | Z159: 1 | AB159: 1 | AD159: Member | AE159: 1
A160: =HYPERLINK("http://www.magelo.com/eq_view_profile.html?num=70247","Ghazhagh") -> Ghazhagh | B160: 65 | C160: Veteran | D160: Dwarf | E160: YES | G160: X | H160: X | I160: X | J160: 1 | K160: 1 | L160: 1 | M160: 1 | N160: 1 | O160: 1 | P160: 1 | Q160: 1 | R160: 1 | S160: 1 | T160: 1 | U160: 1 | V160: x | W160: 1 | X160: 1 | Y160: 1 | Z160: 1 | AA160: 1 | AB160: 1 | AC160: 1 | AD160: Member | AE160: 1
A161: =HYPERLINK("http://www.magelo.com/eq_view_profile.html?num=244458","Mouxxie") -> Mouxxie | B161: 65 | C161: Baroness | D161: Halfling | E161: NO | F161: X | G161: X | H161: X | AD161: On Break
A162: =HYPERLINK("http://www.magelo.com/eq_view_profile.html?num=98879","Silph") -> Silph | B162: 65 | C162: Marshall | D162: Human | E162: YES | F162: X | G162: X | AD162: On Break
A163: =HYPERLINK("http://www.magelo.com/eq_view_profile.html?num=357231","Feersum") -> Feersum | B163: 65 | D163: Barbarian | E163: NO | G163: X | H163: X | I163: X | AD163: Alternate
A164: Kalmak | B164: 65 | C164: Veteran | D164: Ogre | E164: YES | H164: 1 | I164: 1 | AD164: On Break
A165: =HYPERLINK("http://www.magelo.com/eq_view_profile.html?num=599043","Matsu") -> Matsu | B165: 65 | C165: Veteran | D165: Halfling | E165: YES | F165: 1 | G165: 1 | H165: 1 | I165: 1 | J165: x | K165: x | L165: x | M165: x | N165: x | O165: x | P165: x | Q165: x | R165: x | S165: x | T165: x | U165: x | V165: 1 | W165: x | X165: x | Y165: x | Z165: x | AD165: Alternate
A166: Zeal | B166: 65 | D166: Ogre | E166: NO | R166: x | AD166: Alternate
B167: Levels | C167: Title | D167: Race | E167: Epic | F167: VP Key | G167: ST Key | H167: EMP Key | I167: VT Key | J167: PoJ Trials | K167: PoS Medals | L167: Agnarr | M167: PoN Hedge | N167: Teris Thule | O167: Saryn | P167: Aerin Dar | Q167: 3 Trials | R167: Mith Marr | S167: Grummus | T167: Carpin | U167: Bertolox | V167: PoI Dragon | W167: MB | X167: Talon Zek | Y167: Vallon Zek | Z167: RZTW | AA167: Solusek Ro | AB167: Air Water Earth | AC167: Fire | AD167: Status
A168: Wizards
A169: =HYPERLINK("http://www.magelo.com/eq_view_profile.html?num=202761","Aylith") -> Aylith | B169: 65 | C169: Mistress | D169: High Elf | E169: YES | F169: 1 | G169: 1 | H169: 1 | I169: 1 | J169: 1 | K169: 1 | L169: 1 | M169: 1 | N169: 1 | O169: 1 | P169: 1 | Q169: 1 | R169: 1 | S169: 1 | T169: 1 | U169: 1 | V169: 1 | W169: 1 | X169: 1 | Y169: 1 | Z169: 1 | AA169: 1 | AB169: 1 | AC169: 1 | AD169: Member | AE169: 1
A170: Cacius | B170: 65 | C170: Sage | D170: Erudite | E170: YES | H170: 1 | I170: 1 | J170: 1 | K170: 1 | L170: 1 | M170: 1 | N170: 1 | O170: 1 | P170: 1 | Q170: 1 | R170: 1 | S170: 1 | T170: 1 | U170: 1 | V170: 1 | W170: 1 | X170: 1 | Y170: 1 | Z170: 1 | AD170: Member | AE170: 1
A171: Glenwall | B171: 65 | D171: High Elf | E171: YES | H171: 1 | I171: 1 | J171: 1 | K171: 1 | L171: 1 | M171: 1 | N171: 1 | O171: 1 | Q171: 1 | R171: 1 | S171: 1 | T171: 1 | U171: 1 | W171: 1 | X171: 1 | Y171: 1 | Z171: 1 | AA171: 1 | AB171: 1 | AC171: 1 | AD171: Member | AE171: 1
A172: Rosewynde | B172: 62 | D172: High Elf | E172: YES | J172: 1 | K172: 1 | L172: 1 | M172: 1 | N172: 1 | O172: 1 | P172: 1 | Q172: 1 | R172: 1 | S172: 1 | T172: 1 | U172: 1 | W172: 1 | X172: 1 | Y172: 1 | Z172: 1 | AA172: 1 | AB172: 1 | AC172: 1 | AD172: Member | AE172: 1
A173: =HYPERLINK("http://www.magelo.com/eq_view_profile.html?num=82670","Senspot") -> Senspot | B173: 65 | C173: Master | D173: Erudite | E173: YES | H173: 1 | I173: 1 | J173: 1 | K173: 1 | L173: 1 | M173: 1 | N173: 1 | O173: 1 | P173: 1 | Q173: 1 | R173: 1 | S173: 1 | T173: 1 | U173: 1 | W173: 1 | X173: 1 | Y173: 1 | Z173: 1 | AD173: Member | AE173: 1
A174: Soladena | B174: 65 | D174: Dark Elf | E174: YES | H174: 1 | I174: 1 | J174: 1 | K174: 1 | L174: 1 | M174: 1 | N174: 1 | O174: 1 | P174: 1 | Q174: 1 | R174: 1 | S174: 1 | T174: 1 | U174: 1 | W174: 1 | X174: 1 | Y174: 1 | Z174: 1 | AD174: Member | AE174: 1
A175: Fairuza | B175: 62 | D175: Erudite | E175: YES | AD175: On Break
A176: Zeanith | B176: 58 | D176: Dark Elf | E176: NO | AD176: On Break
A177: Aurillicus | B177: 65 | D177: High Elf | E177: NO | H177: X | I177: X | J177: x | K177: x | L177: x | M177: x | N177: x | O177: x | P177: x | Q177: x | R177: x | S177: x | T177: x | U177: x | W177: x | X177: x | Y177: x | AA177: x | AC177: x | AD177: Alternate
A178: Siobahn | B178: 65 | D178: Erudite | E178: YES | AD178: Alternate
A179: =HYPERLINK("http://www.magelo.com/eq_view_profile.html?num=791389","Ticktick") -> Ticktick | B179: 65 | C179: Master | D179: Froglock | E179: NO | H179: X | I179: X | J179: x | K179: x | L179: x | M179: x | N179: x | O179: x | P179: x | Q179: x | R179: x | S179: x | T179: x | U179: x | W179: x | X179: x | Y179: x | AA179: x | AC179: x | AD179: Alternate
A180: # of Active Members | B180: =SUM(AE4:AE179) -> 98 | F180: =SUM(F4:F179)/B180*1 -> 0.23469387755102042 | G180: =SUM(G4:G179)/B180*1 -> 0.42857142857142855 | H180: =SUM(H4:H179)/B180*1 -> 0.77551020408163263 | I180: =SUM(I4:I179)/B180*1 -> 0.76530612244897955 | J180: =SUM(J4:J179)/B180*1 -> 0.88775510204081631 | K180: =SUM(K4:K179)/B180*1 -> 0.8571428571428571 | L180: =SUM(L4:L179)/B180*1 -> 0.68367346938775508 | M180: =SUM(M4:M179)/B180*1 -> 0.87755102040816324 | N180: =SUM(N4:N179)/$B$180*1 -> 0.89795918367346939 | O180: =SUM(O4:O179)/$B$180*1 -> 0.8571428571428571 | P180: =SUM(P4:P179)/$B$180*1 -> 0.81632653061224492 | Q180: =SUM(Q4:Q179)/$B$180*1 -> 0.86734693877551017 | R180: =SUM(R4:R179)/$B$180*1 -> 0.83673469387755106 | S180: =SUM(S4:S179)/$B$180*1 -> 0.93877551020408168 | T180: =SUM(T4:T179)/$B$180*1 -> 0.91836734693877553 | U180: =SUM(U4:U179)/$B$180*1 -> 0.8571428571428571 | V180: =SUM(V4:V179)/$B$180*1 -> 0.61224489795918369 | W180: =SUM(W4:W179)/$B$180*1 -> 0.88775510204081631 | X180: =SUM(X4:X179)/$B$180*1 -> 0.89795918367346939 | Y180: =SUM(Y4:Y179)/$B$180*1 -> 0.94897959183673475 | Z180: =SUM(Z4:Z179)/$B$180*1 -> 0.60204081632653061 | AA180: =SUM(AA4:AA179)/$B$180*1 -> 0.36734693877551022 | AB180: =SUM(AB4:AB179)/$B$180*1 -> 0.40816326530612246 | AC180: =SUM(AC4:AC179)/$B$180*1 -> 0.36734693877551022 | AD180: =TODAY() -> 38085
A181: Average Level | B181: =AVERAGE(B23:B36,B72:B74,B169:B175,B151:B162,B123:B131,B93:B100,B134:B145,B115:B121,B4:B12,B60:B67,B80:B83,B47:B56,B102:B112,B86:B88,B16:B20) -> 64.639344262295083