A1: Number of No Votes (n=) | B1: Additional Yes Votes needed (2n=) | C1: Total Yes Votes Required (25+2n=)
A2: 0 | B2: =2*A2 -> 0 | C2: =B2+25 -> 25
A3: 1 | B3: =2*A3 -> 2 | C3: =B3+25 -> 27
A4: 2 | B4: =2*A4 -> 4 | C4: =B4+25 -> 29
A5: 3 | B5: =2*A5 -> 6 | C5: =B5+25 -> 31
A6: 4 | B6: =2*A6 -> 8 | C6: =B6+25 -> 33
A7: 5 | B7: =2*A7 -> 10 | C7: =B7+25 -> 35
A8: 6 | B8: =2*A8 -> 12 | C8: =B8+25 -> 37
A9: 7 | B9: =2*A9 -> 14 | C9: =B9+25 -> 39
A10: 8 | B10: =2*A10 -> 16 | C10: =B10+25 -> 41
A11: 9 | B11: =2*A11 -> 18 | C11: =B11+25 -> 43
A12: 10 | B12: =2*A12 -> 20 | C12: =B12+25 -> 45
A13: 11 | B13: =2*A13 -> 22 | C13: =B13+25 -> 47
A14: 12 | B14: =2*A14 -> 24 | C14: =B14+25 -> 49
A15: 13 | B15: =2*A15 -> 26 | C15: =B15+25 -> 51
A16: 14 | B16: =2*A16 -> 28 | C16: =B16+25 -> 53
A17: 15 | B17: =2*A17 -> 30 | C17: =B17+25 -> 55
A18: 16 | B18: =2*A18 -> 32 | C18: =B18+25 -> 57
A19: 17 | B19: =2*A19 -> 34 | C19: =B19+25 -> 59
A20: 18 | B20: =2*A20 -> 36 | C20: =B20+25 -> 61
A21: 19 | B21: =2*A21 -> 38 | C21: =B21+25 -> 63
A22: 20 | B22: =2*A22 -> 40 | C22: =B22+25 -> 65