A1: ARNOLD - MARCH 16, 2003
B2: Class | C2: Possee | D2: Stage 1 | E2: Stage 2 | F2: Stage 3 | G2: Stage 4 | H2: Stage 5 | I2: TOTAL | J2: RANK
A3: J. J. Drifter | B3: D | C3: 4 | D3: 71.51 | E3: 83.24 | F3: 54.14 | G3: 96.45 | H3: 50.81 | I3: =SUM(D3:H3) -> 356.15 | J3: =J26+1 -> 3
A4: Cole Black Hart | B4: D | C4: 4 | D4: 69.02 | E4: 81.01 | F4: 63.40 | G4: 86.56 | H4: 76.40 | I4: =SUM(D4:H4) -> 376.39 | J4: =J28+1 -> 7
A5: Dupo Kid | B5: D | C5: 5 | D5: 69.39 | E5: 71.23 | F5: 59.22 | G5: 103.85 | H5: 82.89 | I5: =SUM(D5:H5) -> 386.58 | J5: =J30+1 -> 10
A6: Missouri Buck | B6: D | C6: 2 | D6: 63.22 | E6: 81.80 | F6: 79.62 | G6: 106.22 | H6: 74.71 | I6: =SUM(D6:H6) -> 405.57 | J6: =J33+1 -> 14
A7: Old Man Sykes | B7: D | C7: 4 | D7: 72.34 | E7: 80.54 | F7: 64.57 | G7: 111.46 | H7: 81.35 | I7: =SUM(D7:H7) -> 410.26 | J7: =J20+1 -> 16
A8: Railroad Bill | B8: D | C8: 5 | D8: 78.38 | E8: 89.34 | F8: 70.89 | G8: 130.37 | H8: 76.23 | I8: =SUM(D8:H8) -> 445.21 | J8: =J36+1 -> 21
A9: Bounty Seeker | B9: D | C9: 2 | D9: 57.70 | E9: 112.85 | F9: 90.72 | G9: 120.50 | H9: 78.38 | I9: =SUM(D9:H9) -> 460.15 | J9: =J37+1 -> 23
A10: Nathan Ward | B10: D | C10: 4 | D10: 82.44 | E10: 94.05 | F10: 79.09 | G10: 144.04 | H10: 79.74 | I10: =SUM(D10:H10) -> 479.36 | J10: =J22+1 -> 27
A11: Missouri Bull | B11: D | C11: 3 | D11: 107.84 | E11: 96.63 | F11: 93.13 | G11: 112.98 | H11: 96.11 | I11: =SUM(D11:H11) -> 506.69 | J11: =J46+1 -> 37
A12: Tomestone | B12: D | C12: 3 | D12: 54.06 | E12: 87.10 | F12: 112.90 | G12: 132.85 | H12: 136.80 | I12: =SUM(D12:H12) -> 523.71 | J12: =J47+1 -> 40
A13: Insane Wayne | B13: D | C13: 2 | D13: 131.45 | E13: 115.70 | F13: 81.73 | G13: 126.34 | H13: 94.72 | I13: =SUM(D13:H13) -> 549.94 | J13: =J65+1 -> 47
A14: Cripple Creek Craig | B14: D | C14: 4 | D14: 105.95 | E14: 123.60 | F14: 82.01 | G14: 136.13 | H14: 111.40 | I14: =SUM(D14:H14) -> 559.09 | J14: =J52+1 -> 49
A15: Packin Paul | B15: D | C15: 3 | D15: 128.25 | E15: 119.83 | F15: 114.46 | G15: 163.28 | H15: 132.20 | I15: =SUM(D15:H15) -> 658.02 | J15: =J67+1 -> 60
A16: Remy McSwain | B16: D | C16: 1 | D16: 98.69 | E16: 97.84 | F16: 114.17 | G16: 182.15 | H16: 93.20 | I16: =SUM(D16:H16) -> 586.05 | J16: =J55+1 -> 55
A17: Will Shorty | B17: D/49r | C17: 1 | D17: 61.82 | E17: 90.05 | F17: 78.31 | G17: 141.16 | H17: 102.59 | I17: =SUM(D17:H17) -> 473.93 | J17: =J9+1 -> 24
A18: Crowfoot | B18: D/49r | C18: 1 | D18: 107.31 | E18: 130.26 | F18: 107.27 | G18: 140.18 | H18: 97.52 | I18: =SUM(D18:H18) -> 582.54 | J18: =J54+1 -> 53
A19: Samuel Oshmier | B19: F | C19: 3 | D19: 89.76 | E19: 132.44 | F19: 155.36 | G19: 163.13 | H19: 128.90 | I19: =SUM(D19:H19) -> 669.59 | J19: =J59+1 -> 62
A20: Possom Creek Bill | B20: FC | C20: 5 | D20: 64.04 | E20: 65.94 | F20: 84.36 | G20: 100.47 | H20: 92.15 | I20: =SUM(D20:H20) -> 406.96 | J20: =J6+1 -> 15
A21: Turkey Creek Kid | B21: J | C21: 5 | D21: 71.73 | E21: 92.41 | F21: 91.22 | G21: 147.45 | H21: 111.00 | I21: =SUM(D21:H21) -> 513.81 | J21: =J11+1 -> 38
A22: Ranger Marlin Ruger | B22: M | C22: 2 | D22: 70.39 | E22: 83.42 | F22: 76.76 | G22: 175.06 | H22: 73.61 | I22: =SUM(D22:H22) -> 479.24 | J22: =J38+1 -> 26
A23: Whiskey Will | B23: M | C23: 3 | D23: 77.83 | E23: 98.87 | F23: 97.58 | G23: 127.22 | H23: 80.03 | I23: =SUM(D23:H23) -> 481.53 | J23: =J10+1 -> 28
A24: Squire Lawrence | B24: MS | C24: 3 | D24: 53.66 | E24: 79.22 | F24: 84.34 | G24: 114.37 | H24: 91.90 | I24: =SUM(D24:H24) -> 423.49 | J24: =J34+1 -> 18
A25: Highridge Drifter | B25: T | C25: 4 | D25: 47.79 | E25: 69.53 | F25: 45.63 | G25: 96.96 | H25: 56.50 | I25: =SUM(D25:H25) -> 316.41 | J25: 1
A26: Billy The Kidder | B26: T | C26: 4 | D26: 81.72 | E26: 68.42 | F26: 58.66 | G26: 76.30 | H26: 56.19 | I26: =SUM(D26:H26) -> 341.29 | J26: =J25+1 -> 2
A27: Bullshooter Bob | B27: T | C27: 2 | D27: 65.58 | E27: 91.38 | F27: 74.15 | G27: 121.10 | H27: 76.90 | I27: =SUM(E27:H27) -> 363.53 | J27: =J3+1 -> 4
A28: Bushy Cap | B28: T | C28: 5 | D28: 45.92 | E28: 76.81 | F28: 62.01 | G28: 112.55 | H28: 77.32 | I28: =SUM(D28:H28) -> 374.61 | J28: =J64+1 -> 6
A29: MO Cart Ridge | B29: T | C29: 3 | D29: 42.74 | E29: 100.69 | F29: 59.90 | G29: 105.71 | H29: 69.82 | I29: =SUM(D29:H29) -> 378.86 | J29: =J4+1 -> 8
A30: C C Morgan | B30: T | C30: 5 | D30: 83.77 | E30: 60.46 | F30: 67.66 | G30: 97.18 | H30: 74.18 | I30: =SUM(D30:H30) -> 383.25 | J30: =J29+1 -> 9
A31: Chuckwagon Willie | B31: T | C31: 2 | D31: 65.44 | E31: 82.80 | F31: 69.48 | G31: 99.97 | H31: 73.81 | I31: =SUM(D31:H31) -> 391.50 | J31: =J5+1 -> 11
A32: Trapper | B32: T | C32: 5 | D32: 71.09 | E32: 86.32 | F32: 79.32 | G32: 97.21 | H32: 69.54 | I32: =SUM(D32:H32) -> 403.48 | J32: =J31+1 -> 12
A33: Colt Rampant | B33: T | C33: 1 | D33: 56.84 | E33: 104.06 | F33: 63.12 | G33: 89.33 | H33: 90.72 | I33: =SUM(D33:H33) -> 404.07 | J33: =J32+1 -> 13
A34: Yuma Tom | B34: T | C34: 2 | D34: 67.16 | E34: 78.52 | F34: 90.49 | G34: 106.81 | H34: 72.64 | I34: =SUM(D34:H34) -> 415.62 | J34: =J7+1 -> 17
A35: Three Rivers | B35: T | C35: 2 | D35: 65.82 | E35: 80.64 | F35: 105.22 | G35: 110.08 | H35: 75.13 | I35: =SUM(D35:H35) -> 436.89 | J35: =J24+1 -> 19
A36: Alamo Kid | B36: T | C36: 5 | D36: 66.51 | E36: 103.78 | F36: 57.87 | G36: 141.74 | H36: 69.71 | I36: =SUM(D36:H36) -> 439.61 | J36: =J35+1 -> 20
A37: Sharpshooter Steve | B37: T | C37: 4 | D37: 77.55 | E37: 104.46 | F37: 74.59 | G37: 109.19 | H37: 90.08 | I37: =SUM(D37:H37) -> 455.87 | J37: =J8+1 -> 22
A38: Joe Lefores | B38: T | C38: 4 | D38: 68.15 | E38: 103.66 | F38: 87.00 | G38: 136.26 | H38: 82.79 | I38: =SUM(D38:H38) -> 477.86 | J38: =J17+1 -> 25
A39: Doc | B39: T | C39: 3 | D39: 56.58 | E39: 96.29 | F39: 107.22 | G39: 127.35 | H39: 97.14 | I39: =SUM(D39:H39) -> 484.58 | J39: =J23+1 -> 29
A40: J. D. Hardrider | B40: T | C40: 2 | D40: 94.74 | E40: 98.47 | F40: 95.53 | G40: 115.19 | H40: 80.90 | I40: =SUM(D40:H40) -> 484.83 | J40: =J39+1 -> 30
A41: Deadly "D" | B41: T | C41: 1 | D41: 54.69 | E41: 105.20 | F41: 75.01 | G41: 168.50 | H41: 83.97 | I41: =SUM(D41:H41) -> 487.37 | J41: =J40+1 -> 31
A42: Dusty Waters | B42: T | C42: 4 | D42: 72.87 | E42: 117.75 | F42: 101.12 | G42: 117.47 | H42: 85.72 | I42: =SUM(D42:H42) -> 494.93 | J42: =J41+1 -> 32
A43: J. D. Webfoot | B43: T | C43: 1 | D43: 78.46 | E43: 94.50 | F43: 89.10 | G43: 145.33 | H43: 88.94 | I43: =SUM(D43:H43) -> 496.33 | J43: =J42+1 -> 33
A44: Pard N Me | B44: T | C44: 4 | D44: 70.87 | E44: 128.44 | F44: 91.84 | G44: 132.43 | H44: 73.30 | I44: =SUM(D44:H44) -> 496.88 | J44: =J43+1 -> 34
A45: Kentucky Buck | B45: T | C45: 5 | D45: 69.32 | E45: 100.89 | F45: 85.66 | G45: 142.79 | H45: 104.99 | I45: =SUM(D45:H45) -> 503.65 | J45: =J44+1 -> 35
A46: One Eyed Pete | B46: T | C46: 2 | D46: 60.52 | E46: 110.71 | F46: 108.88 | G46: 132.37 | H46: 91.17 | I46: =SUM(D46:H46) -> 503.65 | J46: =J45+1 -> 36
A47: Curly Bill S? | B47: T | C47: 4 | D47: 97.12 | E47: 96.61 | F47: 85.14 | G47: 139.75 | H47: 97.05 | I47: =SUM(D47:H47) -> 515.67 | J47: =J21+1 -> 39
A48: Lefty | B48: T | C48: 1 | D48: 114.42 | E48: 116.11 | F48: 95.36 | G48: 120.13 | H48: 81.27 | I48: =SUM(D48:H48) -> 527.29 | J48: =J12+1 -> 41
A49: B. T. Smithereens | B49: T | C49: 4 | D49: 75.29 | E49: 112.74 | F49: 113.24 | G49: 134.06 | H49: 93.51 | I49: =SUM(D49:H49) -> 528.84 | J49: =J48+1 -> 42
A50: Dusty Rivers | B50: T | C50: 3 | D50: 71.16 | E50: 108.70 | F50: 111.80 | G50: 152.49 | H50: 88.89 | I50: =SUM(D50:H50) -> 533.04 | J50: =J49+1 -> 43
A51: Rancher | B51: T | C51: 3 | D51: 58.46 | E51: 130.64 | F51: 100.00 | G51: 136.36 | H51: 109.93 | I51: =SUM(D51:H51) -> 535.39 | J51: =J63+1 -> 45
A52: Jimmy John Daniels | B52: T | C52: 4 | D52: 99.87 | E52: 95.85 | F52: 111.70 | G52: 161.32 | H52: 88.93 | I52: =SUM(D52:H52) -> 557.67 | J52: =J13+1 -> 48
A53: Johnny 1 Horse | B53: T | C53: 1 | D53: 98.61 | E53: 138.25 | F53: 94.98 | G53: 141.83 | H53: 92.38 | I53: =SUM(D53:H53) -> 566.05 | J53: =J66+1 -> 51
A54: Lemay Kid | B54: T | C54: 5 | D54: 91.93 | E54: 129.74 | F54: 104.81 | G54: 136.37 | H54: 115.83 | I54: =SUM(D54:H54) -> 578.68 | J54: =J53+1 -> 52
A55: T-Bone McNasty | B55: T | C55: 1 | D55: 86.56 | E55: 113.83 | F55: 140.54 | G55: 141.35 | H55: 101.75 | I55: =SUM(D55:H55) -> 584.03 | J55: =J18+1 -> 54
A56: Arciada Kid | B56: T | C56: 5 | D56: 99.94 | E56: 82.92 | F56: 100.85 | G56: 205.51 | H56: 102.93 | I56: =SUM(D56:H56) -> 592.15 | J56: =J16+1 -> 56
A57: Studyly Doright | B57: T | C57: 2 | D57: 117.84 | E57: 138.39 | F57: 144.02 | G57: 177.50 | H57: 135.71 | I57: =SUM(E57:H57) -> 595.62 | J57: =J56+1 -> 57
A58: Ole Mulungeon J.B. | B58: T | C58: 2 | D58: 100.87 | E58: 147.05 | F58: 95.91 | G58: 158.89 | H58: 96.83 | I58: =SUM(D58:H58) -> 599.55 | J58: =J57+1 -> 58
A59: Crooked Eye Jack | B59: T | C59: 1 | D59: 121.40 | E59: 117.34 | F59: 154.89 | G59: 165.98 | H59: 101.47 | I59: =SUM(D59:H59) -> 661.08 | J59: =J15+1 -> 61
A60: Charlie Ketchpaw | B60: T | C60: 3 | D60: 102.11 | E60: 201.90 | F60: 101.88 | G60: 163.44 | H60: 131.91 | I60: =SUM(D60:H60) -> 701.24 | J60: =J19+1 -> 63
A61: Coffin Sam | B61: T | C61: 3 | D61: 999.99 | E61: 999.99 | F61: 100.97 | G61: 116.48 | H61: 100.90 | I61: =SUM(D61:H61) -> 2318.33 | J61: =J70+1 -> 67
A62: Catlin Kid | B62: T | C62: 1 | D62: 999.99 | E62: 89.72 | F62: 101.81 | G62: 999.99 | H62: 999.99 | I62: =SUM(D62:H62) -> 3191.50 | J62: =J61+1 -> 68
A63: Stumpe | B63: TS | C63: 1 | D63: 88.31 | E63: 114.11 | F63: 107.72 | G63: 137.64 | H63: 87.31 | I63: =SUM(D63:H63) -> 535.09 | J63: =J50+1 -> 44
A64: Bonnie Tear | B64: TW | C64: 5 | D64: 43.35 | E64: 79.71 | F64: 55.38 | G64: 107.42 | H64: 84.70 | I64: =SUM(D64:H64) -> 370.56 | J64: =J27+1 -> 5
A65: Ellie Oakley | B65: TW | C65: 5 | D65: 79.51 | E65: 117.11 | F65: 91.41 | G65: 158.05 | H65: 96.29 | I65: =SUM(D65:H65) -> 542.37 | J65: =J51+1 -> 46
A66: Crazy Mary | B66: TW | C66: 1 | D66: 86.35 | E66: 147.26 | F66: 103.87 | G66: 138.07 | H66: 89.53 | I66: =SUM(D66:H66) -> 565.08 | J66: =J14+1 -> 50
A67: Yuma Rose | B67: TW | C67: 2 | D67: 108.89 | E67: 126.94 | F67: 127.96 | G67: 179.42 | H67: 107.55 | I67: =SUM(D67:H67) -> 650.76 | J67: =J58+1 -> 59
A68: Karen Ketchpaw | B68: TW | C68: 3 | D68: 90.65 | E68: 143.00 | F68: 148.07 | G68: 200.89 | H68: 138.19 | I68: =SUM(D68:H68) -> 720.80 | J68: =J60+1 -> 64
A69: Miss Savella | B69: TW | C69: 1 | D69: 125.71 | E69: 190.68 | F69: 123.01 | G69: 203.46 | H69: 124.67 | I69: =SUM(D69:H69) -> 767.53 | J69: =J68+1 -> 65
A70: Boston 'Lil | B70: TW | C70: 1 | D70: 103.52 | E70: 197.86 | F70: 150.34 | G70: 220.44 | H70: 130.60 | I70: =SUM(D70:H70) -> 802.76 | J70: =J69+1 -> 66
A72: Average Per Stage | D72: =SUM(D25:D71)/68 -> 81.264411764705912 | E72: =SUM(E25:E71)/68 -> 88.238676470588217 | F72: =SUM(F25:F71)/68 -> 64.928235294117627 | G72: =SUM(G25:G71)/68 -> 105.56852941176469 | H72: =SUM(H25:H71)/68 -> 75.582058823529408 | I72: =SUM(I25:I71)/68 -> 412.88455882352946
A74: COWBOY TO SHOOT ALL STAGES CLEAN
A76: SIDE MATCH OVERALL
A77: Squire Lawrence

A1: ALIAS