A1: Cleric Magelo Listing with Stats
A3: This list of Magelo Profiles was complied over the week of June 17, 2002, in order to have some comparison on different stats. While much of the information will (has) become outdated all of the magelo profiles should remain unchanged. Please excuse the poor HTML on some of the pages. Microsoft Excell was used to sort and produce totals of each of the data sets, if the page does not display properly please re-load the page (possibly more then once), which usually corrects the formatting errors. Note that profiles that do not include HP/AC/Mana totals are not included in the average totals due to the incorrect AC information that would skew averages.
A5: Update 6/25/02: Added more profiles (and will continue to do so), but the sub-pages will not be updated quite as often and will be done on a long but regular pace.
A7: Update 6/26/02: Added more profiles (260 total) and started the poccess of re inputing Deity, Resists, Flowing Though, and Regen into the data.
A9: Update 6/28/02: Finished the inputing of Deity, Resists, Flowing Though, and Regen into the data. Please note that the sub sortings have yet to be updated.
A11: Update 7/8/02: Added a few more profiles.
A13: Update 8/15/02: Added a few more profiles and recompiled the stats. Please note to a error on my part that the Weighted Stats only appear on that specific page
A15: In attempts to balance the totals a weighted total is used. This formula was used in attempts to balance each of the statistical categories. The formula is as follows…..
A17: (HP/2.096)+(AC/1.069)+(MANA/3.69)+(RESISTS/0.465)+(FT/0.005)+(REGEN/0.002)
A19: Sort by...
A21: Name
A22: Level (Inlcuding Averages)
A23: Race
A24: Deity
A25: Server
A26: Hit Points
A27: AC
A28: Mana
A29: Flowing Though
A30: Regen
A31: Stat Totals
A32: Weighted Total
A34: Yamile
A35: Appotus Dominus
A36: Vazaelle
A38: Name | B38: Level | C38: Race | D38: Deity | E38: Server | F38: Hit Points | G38: AC | H38: Mana | I38: Resists | J38: FT | K38: Regen | L38: Total | M38: Weighted Total
A40: Sendari | B40: 20 | C40: Human | D40: Karana | E40: Quellious | F40: 407 | G40: 167 | H40: 526 | I40: 149 | J40: 0 | K40: 0 | L40: =SUM(F40:K40) -> 1249 | M40: =SUM(F40/2.096+G40/1.069+H40/3.69+I40/0.465+J40/0.005+K40/0.002) -> 813.3776893861434
A41: Thotam | B41: 20 | C41: Dark Elf | D41: Innoruuk | E41: Antonius Bayle | F41: 447 | G41: 290 | H41: 606 | I41: 117 | J41: 0 | K41: 0 | L41: =SUM(F41:K41) -> 1460 | M41: =SUM(F41/2.096+G41/1.069+H41/3.69+I41/0.465+J41/0.005+K41/0.002) -> 900.38547584306286
A42: Maeladin | B42: 25 | C42: Dark Elf | D42: Innoruuk | E42: Solusek Ro | F42: 504 | G42: 151 | H42: 1063 | I42: 146 | J42: 0 | K42: 0 | L42: =SUM(F42:K42) -> 1864 | M42: =SUM(F42/2.096+G42/1.069+H42/3.69+I42/0.465+J42/0.005+K42/0.002) -> 983.76589860099557
A43: Kinnopio | B43: 27 | C43: Erudite | D43: Quellious | E43: Tribunal | F43: 683 | G43: 188 | H43: 811 | I43: 153 | J43: 0 | K43: 0 | L43: =SUM(F43:K43) -> 1835 | M43: =SUM(F43/2.096+G43/1.069+H43/3.69+I43/0.465+J43/0.005+K43/0.002) -> 1050.5395291903626
A44: Trastus | B44: 19 | C44: Human | D44: Rodcet Nife | E44: Innoruuk | F44: 441 | G44: 310 | H44: 874 | I44: 172 | J44: 0 | K44: 0 | L44: =SUM(F44:K44) -> 1797 | M44: =SUM(F44/2.096+G44/1.069+H44/3.69+I44/0.465+J44/0.005+K44/0.002) -> 1107.1402505037936
A45: Alerias | B45: 44 | C45: High Elf | D45: Karana | E45: Luclin | F45: 854 | G45: 0 | H45: 1594 | I45: 140 | J45: 0 | K45: 0 | L45: =SUM(F45:K45) -> 2588 | M45: =SUM(F45/2.096+G45/1.069+H45/3.69+I45/0.465+J45/0.005+K45/0.002) -> 1140.4963366920051
A46: Rawnlissa | B46: 30 | C46: Human | D46: Erollisi Marr | E46: Seventh Hammer | F46: 709 | G46: 401 | H46: 1115 | I46: 137 | J46: 0 | K46: 0 | L46: =SUM(F46:K46) -> 2362 | M46: =SUM(F46/2.096+G46/1.069+H46/3.69+I46/0.465+J46/0.005+K46/0.002) -> 1310.1719680847013
A47: Sylphiel | B47: 46 | C47: Human | D47: Karana | E47: Fennin Ro | F47: 1036 | G47: 470 | H47: 1805 | I47: 161 | J47: 0 | K47: 0 | L47: =SUM(F47:K47) -> 3472 | M47: =SUM(F47/2.096+G47/1.069+H47/3.69+I47/0.465+J47/0.005+K47/0.002) -> 1769.3344965687911
A48: Leilei | B48: 48 | C48: High Elf | D48: Tunare | E48: Nameless | F48: 930 | G48: 632 | H48: 1740 | I48: 125 | J48: 0 | K48: 0 | L48: =SUM(F48:K48) -> 3427 | M48: =SUM(F48/2.096+G48/1.069+H48/3.69+I48/0.465+J48/0.005+K48/0.002) -> 1775.27094509117
A49: Zandilar | B49: 49 | C49: Human | D49: Erollisi Marr | E49: Erollisi Marr | F49: 1011 | G49: 531 | H49: 1863 | I49: 137 | J49: 0 | K49: 0 | L49: =SUM(F49:K49) -> 3542 | M49: =SUM(F49/2.096+G49/1.069+H49/3.69+I49/0.465+J49/0.005+K49/0.002) -> 1778.5749450060935
A50: Fenlayen | B50: 46 | C50: High Elf | D50: Tunare | E50: Erollisi Marr | F50: 932 | G50: 598 | H50: 1862 | I50: 140 | J50: 0 | K50: 0 | L50: =SUM(F50:K50) -> 3532 | M50: =SUM(F50/2.096+G50/1.069+H50/3.69+I50/0.465+J50/0.005+K50/0.002) -> 1809.7401130724563
A51: Ikeren | B51: 43 | C51: Erudite | D51: Quellious | E51: Antonius Bayle | F51: 887 | G51: 632 | H51: 1708 | I51: 155 | J51: 0 | K51: 0 | L51: =SUM(F51:K51) -> 3382 | M51: =SUM(F51/2.096+G51/1.069+H51/3.69+I51/0.465+J51/0.005+K51/0.002) -> 1810.5997202269882
A52: Pomaikai | B52: 45 | C52: High Elf | D52: Tunare | E52: Zebuxoruk | F52: 891 | G52: 665 | H52: 2104 | I52: 120 | J52: 0 | K52: 0 | L52: =SUM(F52:K52) -> 3780 | M52: =SUM(F52/2.096+G52/1.069+H52/3.69+I52/0.465+J52/0.005+K52/0.002) -> 1875.4263450763729
A53: Durley | B53: 40 | C53: Halfling | D53: Bristlebane | E53: Antonius Bayle | F53: 839 | G53: 745 | H53: 1702 | I53: 163 | J53: 0 | K53: 0 | L53: =SUM(F53:K53) -> 3449 | M53: =SUM(F53/2.096+G53/1.069+H53/3.69+I53/0.465+J53/0.005+K53/0.002) -> 1908.9835092230724
A54: Velma | B54: 40 | C54: Dwarf | D54: Brell Serilis | E54: Fennin Ro | F54: 835 | G54: 728 | H54: 1695 | I54: 177 | J54: 0 | K54: 0 | L54: =SUM(F54:K54) -> 3435 | M54: =SUM(F54/2.096+G54/1.069+H54/3.69+I54/0.465+J54/0.005+K54/0.002) -> 1919.3829073723227
A55: Sublym | B55: 51 | C55: Dark Elf | D55: Innoruuk | E55: Kane Bayle | F55: 1053 | G55: 627 | H55: 2048 | I55: 130 | J55: 0 | K55: 0 | L55: =SUM(F55:K55) -> 3858 | M55: =SUM(F55/2.096+G55/1.069+H55/3.69+I55/0.465+J55/0.005+K55/0.002) -> 1923.4984055832194
A56: Serenya | B56: 42 | C56: Dwarf | D56: Brell Serilis | E56: Tribunal | F56: 961 | G56: 763 | H56: 1710 | I56: 148 | J56: 0 | K56: 0 | L56: =SUM(F56:K56) -> 3582 | M56: =SUM(F56/2.096+G56/1.069+H56/3.69+I56/0.465+J56/0.005+K56/0.002) -> 1953.9377397681471
A57: Quotison | B57: 51 | C57: Dwarf | D57: Brell Serilis | E57: Tarew Marr | F57: 1095 | G57: 580 | H57: 2070 | I57: 154 | J57: 0 | K57: 0 | L57: =SUM(F57:K57) -> 3899 | M57: =SUM(F57/2.096+G57/1.069+H57/3.69+I57/0.465+J57/0.005+K57/0.002) -> 1957.1452127015752
A58: Bartel | B58: 41 | C58: Dwarf | D58: Brell Serilis | E58: Vazaelle | F58: 856 | G58: 785 | H58: 1650 | I58: 176 | J58: 0 | K58: 0 | L58: =SUM(F58:K58) -> 3467 | M58: =SUM(F58/2.096+G58/1.069+H58/3.69+I58/0.465+J58/0.005+K58/0.002) -> 1968.3771923735599
A59: Jalaran | B59: 55 | C59: High Elf | D59: Tunare | E59: Mithaniel Marr | F59: 1022 | G59: 565 | H59: 2387 | I59: 151 | J59: 0 | K59: 0 | L59: =SUM(F59:K59) -> 4125 | M59: =SUM(F59/2.096+G59/1.069+H59/3.69+I59/0.465+J59/0.005+K59/0.002) -> 1987.7414091764992
A60: Kerowen | B60: 47 | C60: High Elf | D60: Tunare | E60: Drinal | F60: 933 | G60: 641 | H60: 2111 | I60: 175 | J60: 0 | K60: 0 | L60: =SUM(F60:K60) -> 3860 | M60: =SUM(F60/2.096+G60/1.069+H60/3.69+I60/0.465+J60/0.005+K60/0.002) -> 1993.1902131969566
A61: Grogs | B61: 46 | C61: Dwarf | D61: Brell Serilis | E61: Tarew Marr | F61: 952 | G61: 748 | H61: 1784 | I61: 169 | J61: 0 | K61: 0 | L61: =SUM(F61:K61) -> 3653 | M61: =SUM(F61/2.096+G61/1.069+H61/3.69+I61/0.465+J61/0.005+K61/0.002) -> 2000.8275320773309
A62: Aaelandri | B62: 39 | C62: Dark Elf | D62: Innoruuk | E62: Tribunal | F62: 1029 | G62: 822 | H62: 1685 | I62: 135 | J62: 0 | K62: 0 | L62: =SUM(F62:K62) -> 3671 | M62: =SUM(F62/2.096+G62/1.069+H62/3.69+I62/0.465+J62/0.005+K62/0.002) -> 2006.8401988692444
A63: Ancarett | B63: 44 | C63: High Elf | D63: Tunare | E63: Veeshan | F63: 867 | G63: 663 | H63: 2039 | I63: 211 | J63: 0 | K63: 0 | L63: =SUM(F63:K63) -> 3780 | M63: =SUM(F63/2.096+G63/1.069+H63/3.69+I63/0.465+J63/0.005+K63/0.002) -> 2040.1888045863207
A64: Bombidil | B64: 52 | C64: Dwarf | D64: Brell Serilis | E64: Terris-Thule | F64: 1108 | G64: 585 | H64: 2355 | I64: 153 | J64: 0 | K64: 0 | L64: =SUM(F64:K64) -> 4201 | M64: =SUM(F64/2.096+G64/1.069+H64/3.69+I64/0.465+J64/0.005+K64/0.002) -> 2043.1100059764365
A65: Fattima | B65: 51 | C65: Dwarf | D65: Breel Serilis | E65: Innoruuk | F65: 1087 | G65: 632 | H65: 2142 | I65: 165 | J65: 0 | K65: 0 | L65: =SUM(F65:K65) -> 4026 | M65: =SUM(F65/2.096+G65/1.069+H65/3.69+I65/0.465+J65/0.005+K65/0.002) -> 2045.1401200510802
A66: Arolily | B66: 52 | C66: High Elf | D66: Tunare | E66: Morell-Thulle | F66: 1026 | G66: 625 | H66: 2325 | I66: 161 | J66: 0 | K66: 0 | L66: =SUM(F66:K66) -> 4137 | M66: =SUM(F66/2.096+G66/1.069+H66/3.69+I66/0.465+J66/0.005+K66/0.002) -> 2050.4802361479956
A67: Piikaa | B67: 46 | C67: Dwarf | D67: Brell Serilis | E67: Bertoxxulous | F67: 943 | G67: 763 | H67: 2011 | I67: 164 | J67: 0 | K67: 0 | L67: =SUM(F67:K67) -> 3881 | M67: =SUM(F67/2.096+G67/1.069+H67/3.69+I67/0.465+J67/0.005+K67/0.002) -> 2061.3303713772998
A68: Expiere | B68: 41 | C68: Dark Elf | D68: Innoruuk | E68: Prexus | F68: 942 | G68: 854 | H68: 1813 | I68: 150 | J68: 0 | K68: 0 | L68: =SUM(F68:K68) -> 3759 | M68: =SUM(F68/2.096+G68/1.069+H68/3.69+I68/0.465+J68/0.005+K68/0.002) -> 2062.2134949224032
A69: Halthek | B69: 53 | C69: Dwarf | D69: Brell Serilis | E69: Mithaniel Marr | F69: 1125 | G69: 679 | H69: 2193 | I69: 149 | J69: 0 | K69: 0 | L69: =SUM(F69:K69) -> 4146 | M69: =SUM(F69/2.096+G69/1.069+H69/3.69+I69/0.465+J69/0.005+K69/0.002) -> 2086.6487507712695
A70: Agmyleez | B70: 52 | C70: Erudite | D70: Cazic Thule | E70: Karana | F70: 1055 | G70: 652 | H70: 2314 | I70: 164 | J70: 0 | K70: 0 | L70: =SUM(F70:K70) -> 4185 | M70: =SUM(F70/2.096+G70/1.069+H70/3.69+I70/0.465+J70/0.005+K70/0.002) -> 2093.0439468696554
A71: Dyvin | B71: 52 | C71: Dark Elf | D71: Innoruuk | E71: Terris-Thule | F71: 994 | G71: 741 | H71: 2341 | I71: 138 | J71: 0 | K71: 0 | L71: =SUM(F71:K71) -> 4214 | M71: =SUM(F71/2.096+G71/1.069+H71/3.69+I71/0.465+J71/0.005+K71/0.002) -> 2098.5993669693953
A72: Javara | B72: 52 | C72: High Elf | D72: Tunare | E72: Brell Serilis | F72: 1059 | G72: 728 | H72: 2191 | I72: 160 | J72: 0 | K72: 0 | L72: =SUM(F72:K72) -> 4138 | M72: =SUM(F72/2.096+G72/1.069+H72/3.69+I72/0.465+J72/0.005+K72/0.002) -> 2124.111340768452
A73: Lithele | B73: 51 | C73: Human | D73: Rodcet Nife | E73: Antonius Bayle | F73: 1019 | G73: 773 | H73: 2273 | I73: 164 | J73: 0 | K73: 0 | L73: =SUM(F73:K73) -> 4229 | M73: =SUM(F73/2.096+G73/1.069+H73/3.69+I73/0.465+J73/0.005+K73/0.002) -> 2177.9471603395536
A74: Nyvn | B74: 51 | C74: Dwarf | D74: Brell Serilis | E74: Ayonae Ro | F74: 1055 | G74: 769 | H74: 2374 | I74: 166 | J74: 0 | K74: 0 | L74: =SUM(F74:K74) -> 4364 | M74: =SUM(F74/2.096+G74/1.069+H74/3.69+I74/0.465+J74/0.005+K74/0.002) -> 2223.0532670600237
A75: Micherick | B75: 57 | C75: Human | D75: Mithaniel Marr | E75: Rathe | F75: 1191 | G75: 723 | H75: 2524 | I75: 164 | J75: 0 | K75: 0 | L75: =SUM(F75:K75) -> 4602 | M75: =SUM(F75/2.096+G75/1.069+H75/3.69+I75/0.465+J75/0.005+K75/0.002) -> 2281.2572245065412
A76: Fhylden | B76: 54 | C76: Halfling | D76: Bristlebane | E76: Ayonae Ro | F76: 1086 | G76: 782 | H76: 2370 | I76: 192 | J76: 0 | K76: 0 | L76: =SUM(F76:K76) -> 4430 | M76: =SUM(F76/2.096+G76/1.069+H76/3.69+I76/0.465+J76/0.005+K76/0.002) -> 2304.8342090859642
A77: Ayenya | B77: 52 | C77: High Elf | D77: Tunare | E77: Xegony | F77: 1045 | G77: 830 | H77: 2262 | I77: 198 | J77: 0 | K77: 0 | L77: =SUM(F77:K77) -> 4335 | M77: =SUM(F77/2.096+G77/1.069+H77/3.69+I77/0.465+J77/0.005+K77/0.002) -> 2313.8098508692196
A78: Yumanea | B78: 54 | C78: High Elf | D78: Tunare | E78: Erollisi Marr | F78: 1203 | G78: 741 | H78: 2340 | I78: 193 | J78: 0 | K78: 0 | L78: =SUM(F78:K78) -> 4477 | M78: =SUM(F78/2.096+G78/1.069+H78/3.69+I78/0.465+J78/0.005+K78/0.002) -> 2316.3216746098565
A79: Bindol | B79: 53 | C79: Dwarf | D79: Brell Serilis | E79: Solusek Ro | F79: 1145 | G79: 777 | H79: 2618 | I79: 158 | J79: 0 | K79: 0 | L79: =SUM(F79:K79) -> 4698 | M79: =SUM(F79/2.096+G79/1.069+H79/3.69+I79/0.465+J79/0.005+K79/0.002) -> 2322.396188089414
A80: Skwar | B80: 52 | C80: Halfling | D80: Bristlebane | E80: Xev | F80: 1188 | G80: 660 | H80: 2508 | I80: 221 | J80: 0 | K80: 0 | L80: =SUM(F80:K80) -> 4577 | M80: =SUM(F80/2.096+G80/1.069+H80/3.69+I80/0.465+J80/0.005+K80/0.002) -> 2339.1369458098225
A81: Camien | B81: 53 | C81: Dark Elf | D81: Innoruuk | E81: Erollisi Marr | F81: 1083 | G81: 775 | H81: 2491 | I81: 200 | J81: 0 | K81: 0 | L81: =SUM(F81:K81) -> 4549 | M81: =SUM(F81/2.096+G81/1.069+H81/3.69+I81/0.465+J81/0.005+K81/0.002) -> 2346.8503644992938
A82: Atlin | B82: 51 | C82: Dwarf | D82: Brell Serills | E82: Cazic-Thule | F82: 1155 | G82: 816 | H82: 2278 | I82: 204 | J82: 0 | K82: 0 | L82: =SUM(F82:K82) -> 4453 | M82: =SUM(F82/2.096+G82/1.069+H82/3.69+I82/0.465+J82/0.005+K82/0.002) -> 2370.4336843360493
A83: Johrena | B83: 54 | C83: Halfling | D83: Bristlebane | E83: Torvonnilous | F83: 1106 | G83: 540 | H83: 2816 | I83: 270 | J83: 0 | K83: 0 | L83: =SUM(F83:K83) -> 4732 | M83: =SUM(F83/2.096+G83/1.069+H83/3.69+I83/0.465+J83/0.005+K83/0.002) -> 2376.6055437745595
A84: Miette | B84: 53 | C84: High Elf | D84: Tunare | E84: Tholuxe Paells | F84: 1216 | G84: 789 | H84: 2497 | I84: 183 | J84: 0 | K84: 0 | L84: =SUM(F84:K84) -> 4685 | M84: =SUM(F84/2.096+G84/1.069+H84/3.69+I84/0.465+J84/0.005+K84/0.002) -> 2388.467791178382
A85: Bezil | B85: 54 | C85: Dwarf | D85: Brell Serilis | E85: Rathe | F85: 1123 | G85: 791 | H85: 2448 | I85: 210 | J85: 0 | K85: 0 | L85: =SUM(F85:K85) -> 4572 | M85: =SUM(F85/2.096+G85/1.069+H85/3.69+I85/0.465+J85/0.005+K85/0.002) -> 2390.7538528985369
A86: Cartmean | B86: 59 | C86: High Elf | D86: Tunare | E86: Quesllious | F86: 1166 | G86: 809 | H86: 2642 | I86: 172 | J86: 0 | K86: 0 | L86: =SUM(F86:K86) -> 4789 | M86: =SUM(F86/2.096+G86/1.069+H86/3.69+I86/0.465+J86/0.005+K86/0.002) -> 2398.9613822225979
A87: Balanar | B87: 56 | C87: Dwarf | D87: Brell Serilis | E87: Tunare | F87: 1254 | G87: 745 | H87: 2520 | I87: 201 | J87: 0 | K87: 0 | L87: =SUM(F87:K87) -> 4720 | M87: =SUM(F87/2.096+G87/1.069+H87/3.69+I87/0.465+J87/0.005+K87/0.002) -> 2410.3803393388744
A88: Omzen | B88: 53 | C88: Erudite | D88: Cazuc Thule | E88: Xegony | F88: 1155 | G88: 876 | H88: 2374 | I88: 200 | J88: 0 | K88: 0 | L88: =SUM(F88:K88) -> 4605 | M88: =SUM(F88/2.096+G88/1.069+H88/3.69+I88/0.465+J88/0.005+K88/0.002) -> 2443.9750156635428
A89: Tofe | B89: 56 | C89: Dwarf | D89: Brell Serilis | E89: Antonius Bayle | F89: 1179 | G89: 859 | H89: 2446 | I89: 212 | J89: 0 | K89: 0 | L89: =SUM(F89:K89) -> 4696 | M89: =SUM(F89/2.096+G89/1.069+H89/3.69+I89/0.465+J89/0.005+K89/0.002) -> 2484.841331262071
A90: Jessamyn | B90: 55 | C90: Dwarf | D90: Brell Serilis | E90: Tholuxe Paells | F90: 1285 | G90: 777 | H90: 2610 | I90: 209 | J90: 0 | K90: 0 | L90: =SUM(F90:K90) -> 4881 | M90: =SUM(F90/2.096+G90/1.069+H90/3.69+I90/0.465+J90/0.005+K90/0.002) -> 2496.6994788938073
A91: Daerv | B91: 54 | C91: Human | D91: Erollisi Marr | E91: Vazaelle | F91: 1126 | G91: 681 | H91: 2464 | I91: 219 | J91: 1 | K91: 0 | L91: =SUM(F91:K91) -> 4491 | M91: =SUM(F91/2.096+G91/1.069+H91/3.69+I91/0.465+J91/0.005+K91/0.002) -> 2512.9761262239413
A92: Lerman | B92: 54 | C92: High Elf | D92: Tunare | E92: Seventh Hammer | F92: 1126 | G92: 784 | H92: 2386 | I92: 283 | J92: 0 | K92: 0 | L92: =SUM(F92:K92) -> 4579 | M92: =SUM(F92/2.096+G92/1.069+H92/3.69+I92/0.465+J92/0.005+K92/0.002) -> 2525.8240540333136
A93: Leiren | B93: 58 | C93: Human | D93: Mithaniel Marr | E93: Tarew Marr | F93: 1372 | G93: 839 | H93: 2720 | I93: 163 | J93: 0 | K93: 0 | L93: =SUM(F93:K93) -> 5094 | M93: =SUM(F93/2.096+G93/1.069+H93/3.69+I93/0.465+J93/0.005+K93/0.002) -> 2527.090808494389
A94: Aean | B94: 53 | C94: Human | D94: Mithaniel Marr | E94: Xegony | F94: 1254 | G94: 899 | H94: 2473 | I94: 195 | J94: 0 | K94: 0 | L94: =SUM(F94:K94) -> 4821 | M94: =SUM(F94/2.096+G94/1.069+H94/3.69+I94/0.465+J94/0.005+K94/0.002) -> 2528.799855197632
A95: Ragnon | B95: 58 | C95: High Elf | D95: Tunare | E95: Morell-Thule | F95: 1267 | G95: 814 | H95: 2813 | I95: 187 | J95: 0 | K95: 0 | L95: =SUM(F95:K95) -> 5081 | M95: =SUM(F95/2.096+G95/1.069+H95/3.69+I95/0.465+J95/0.005+K95/0.002) -> 2530.425201529335
A96: Ycarus | B96: 54 | C96: Halfling | D96: Bristlebane | E96: E'cil | F96: 1203 | G96: 863 | H96: 2419 | I96: 230 | J96: 0 | K96: 0 | L96: =SUM(F96:K96) -> 4715 | M96: =SUM(F96/2.096+G96/1.069+H96/3.69+I96/0.465+J96/0.005+K96/0.002) -> 2531.4261319702514
A97: Chrisking | B97: 53 | C97: Dwarf | D97: Brell Serilis | E97: Morell-Thule | F97: 1182 | G97: 693 | H97: 2556 | I97: 227 | J97: 1 | K97: 0 | L97: =SUM(F97:K97) -> 4659 | M97: =SUM(F97/2.096+G97/1.069+H97/3.69+I97/0.465+J97/0.005+K97/0.002) -> 2593.0556782141171
A98: Naxy | B98: 57 | C98: Human | D98: Karana | E98: Bristlebane | F98: 1351 | G98: 895 | H98: 2736 | I98: 174 | J98: 0 | K98: 0 | L98: =SUM(F98:K98) -> 5156 | M98: =SUM(F98/2.096+G98/1.069+H98/3.69+I98/0.465+J98/0.005+K98/0.002) -> 2597.4490887862084
A99: Dakin | B99: 55 | C99: Dwarf | D99: Brell Serilis | E99: Innoruuk | F99: 1413 | G99: 877 | H99: 2534 | I99: 201 | J99: 0 | K99: 0 | L99: =SUM(F99:K99) -> 5025 | M99: =SUM(F99/2.096+G99/1.069+H99/3.69+I99/0.465+J99/0.005+K99/0.002) -> 2613.5130436507643
A100: Grundersoltec | B100: 56 | C100: Halfling | D100: Bristlebane | E100: Tholuxe Paells | F100: 1196 | G100: 922 | H100: 2662 | I100: 230 | J100: 0 | K100: 0 | L100: =SUM(F100:K100) -> 5010 | M100: =SUM(F100/2.096+G100/1.069+H100/3.69+I100/0.465+J100/0.005+K100/0.002) -> 2649.1318638578318
A101: Ladile | B101: 58 | C101: Human | D101: Erollisi Marr | E101: Solusek Ro | F101: 1256 | G101: 866 | H101: 2814 | I101: 235 | J101: 0 | K101: 0 | L101: =SUM(F101:K101) -> 5171 | M101: =SUM(F101/2.096+G101/1.069+H101/3.69+I101/0.465+J101/0.005+K101/0.002) -> 2677.3175112301105
A102: Nrewfin | B102: 55 | C102: Dwarf | D102: Brell Serilis | E102: Seventh Hammer | F102: 1219 | G102: 710 | H102: 2068 | I102: 407 | J102: 0 | K102: 0 | L102: =SUM(F102:K102) -> 4404 | M102: =SUM(F102/2.096+G102/1.069+H102/3.69+I102/0.465+J102/0.005+K102/0.002) -> 2681.4585144858811
A103: Daymondd | B103: 56 | C103: Dwarf | D103: Mithaniel Marr | E103: Mithaniel Marr | F103: 1383 | G103: 940 | H103: 2753 | I103: 216 | J103: 0 | K103: 0 | L103: =SUM(F103:K103) -> 5292 | M103: =SUM(F103/2.096+G103/1.069+H103/3.69+I103/0.465+J103/0.005+K103/0.002) -> 2749.7413073512439
A104: Kaysha | B104: 55 | C104: Human | D104: Erolisi Marr | E104: Lanys T'Vyl | F104: 1391 | G104: 828 | H104: 2954 | I104: 247 | J104: 0 | K104: 0 | L104: =SUM(F104:K104) -> 5420 | M104: =SUM(F104/2.096+G104/1.069+H104/3.69+I104/0.465+J104/0.005+K104/0.002) -> 2769.9254987817731
A105: Yueana | B105: 57 | C105: High Elf | D105: Tunare | E105: Quellious | F105: 1422 | G105: 947 | H105: 2932 | I105: 201 | J105: 0 | K105: 0 | L105: =SUM(F105:K105) -> 5502 | M105: =SUM(F105/2.096+G105/1.069+H105/3.69+I105/0.465+J105/0.005+K105/0.002) -> 2791.1477740242681
A106: Lorelai | B106: 53 | C106: High Elf | D106: Tunare | E106: Quellious | F106: 1451 | G106: 844 | H106: 2753 | I106: 268 | J106: 0 | K106: 0 | L106: =SUM(F106:K106) -> 5316 | M106: =SUM(F106/2.096+G106/1.069+H106/3.69+I106/0.465+J106/0.005+K106/0.002) -> 2804.2084577080532
A107: Altheia | B107: 55 | C107: Dark Elf | D107: Innoruuk | E107: Vazaelle | F107: 1307 | G107: 847 | H107: 2782 | I107: 203 | J107: 1 | K107: 0 | L107: =SUM(F107:K107) -> 5140 | M107: =SUM(F107/2.096+G107/1.069+H107/3.69+I107/0.465+J107/0.005+K107/0.002) -> 2806.3866610710706
A108: Cedelia | B108: 56 | C108: High Elf | D108: Tunare | E108: Vazaelle | F108: 1366 | G108: 801 | H108: 3228 | I108: 228 | J108: 1 | K108: 0 | L108: =SUM(F108:K108) -> 5624 | M108: =SUM(F108/2.096+G108/1.069+H108/3.69+I108/0.465+J108/0.005+K108/0.002) -> 2966.1352955932675
A109: Yirkin | B109: 60 | C109: Dwarf | D109: Brell Serilis | E109: Povar | F109: 1503 | G109: 985 | H109: 3051 | I109: 238 | J109: 0 | K109: 0 | L109: =SUM(F109:K109) -> 5777 | M109: =SUM(F109/2.096+G109/1.069+H109/3.69+I109/0.465+J109/0.005+K109/0.002) -> 2977.1592675701504
A110: Gragner | B110: 57 | C110: Dwarf | D110: Brell Serilis | E110: Test | F110: 1445 | G110: 866 | H110: 2850 | I110: 328 | J110: 0 | K110: 0 | L110: =SUM(F110:K110) -> 5489 | M110: =SUM(F110/2.096+G110/1.069+H110/3.69+I110/0.465+J110/0.005+K110/0.002) -> 2977.2453645162768
A111: Lifeheart | B111: 60 | C111: Dark Elf | D111: Innoruuk | E111: Povar | F111: 1492 | G111: 937 | H111: 3021 | I111: 277 | J111: 0 | K111: 0 | L111: =SUM(F111:K111) -> 5727 | M111: =SUM(F111/2.096+G111/1.069+H111/3.69+I111/0.465+J111/0.005+K111/0.002) -> 3002.7502850461983
A112: Trynnity | B112: 60 | C112: Dark Elf | D112: Innoruuk | E112: Fennin Ro | F112: 1617 | G112: 853 | H112: 3326 | I112: 258 | J112: 0 | K112: 0 | L112: =SUM(F112:K112) -> 6054 | M112: =SUM(F112/2.096+G112/1.069+H112/3.69+I112/0.465+J112/0.005+K112/0.002) -> 3025.6051907473175
A113: Trixxey | B113: 60 | C113: Erudite | D113: Prexus | E113: Xev | F113: 1733 | G113: 851 | H113: 3413 | I113: 228 | J113: 0 | K113: 0 | L113: =SUM(F113:K113) -> 6225 | M113: =SUM(F113/2.096+G113/1.069+H113/3.69+I113/0.465+J113/0.005+K113/0.002) -> 3038.1389015477143
A114: Ariene | B114: 60 | C114: High Elf | D114: Tunare | E114: Bristlebane | F114: 1468 | G114: 838 | H114: 3304 | I114: 312 | J114: 0 | K114: 0 | L114: =SUM(F114:K114) -> 5922 | M114: =SUM(F114/2.096+G114/1.069+H114/3.69+I114/0.465+J114/0.005+K114/0.002) -> 3050.6525716996121
A115: Qutie | B115: 57 | C115: Human | D115: Erollisi Marr | E115: Tarew Marr | F115: 1342 | G115: 727 | H115: 2901 | I115: 210 | J115: 0 | K115: 1 | L115: =SUM(F115:K115) -> 5181 | M115: =SUM(F115/2.096+G115/1.069+H115/3.69+I115/0.465+J115/0.005+K115/0.002) -> 3058.1337768825465
A116: Miquel | B116: 60 | C116: Dwarf | D116: Brell Serilis | E116: Terris-Thule | F116: 1612 | G116: 887 | H116: 3063 | I116: 310 | J116: 0 | K116: 0 | L116: =SUM(F116:K116) -> 5872 | M116: =SUM(F116/2.096+G116/1.069+H116/3.69+I116/0.465+J116/0.005+K116/0.002) -> 3095.5793644476621
A117: Bigg | B117: 60 | C117: High Elf | D117: Tunare | E117: Innoruuk | F117: 1533 | G117: 940 | H117: 3129 | I117: 298 | J117: 0 | K117: 0 | L117: =SUM(F117:K117) -> 5900 | M117: =SUM(F117/2.096+G117/1.069+H117/3.69+I117/0.465+J117/0.005+K117/0.002) -> 3099.5472978391226
A118: Cryogenic | B118: 57 | C118: High Elf | D118: Tunare | E118: Antonius Bayle | F118: 1652 | G118: 750 | H118: 3228 | I118: 347 | J118: 0 | K118: 0 | L118: =SUM(F118:K118) -> 5977 | M118: =SUM(F118/2.096+G118/1.069+H118/3.69+I118/0.465+J118/0.005+K118/0.002) -> 3110.7915173201336
A119: Kjia | B119: 57 | C119: Gnome | D119: Bristlebane | E119: Antonius Bayle | F119: 1752 | G119: 1005 | H119: 3037 | I119: 242 | J119: 0 | K119: 0 | L119: =SUM(F119:K119) -> 6036 | M119: =SUM(F119/2.096+G119/1.069+H119/3.69+I119/0.465+J119/0.005+K119/0.002) -> 3119.4741639919112
A120: Laithia | B120: 60 | C120: High Elf | D120: Tunare | E120: Innoruuk | F120: 1393 | G120: 998 | H120: 3069 | I120: 323 | J120: 0 | K120: 0 | L120: =SUM(F120:K120) -> 5783 | M120: =SUM(F120/2.096+G120/1.069+H120/3.69+I120/0.465+J120/0.005+K120/0.002) -> 3124.512997280382
A121: Malf | B121: 56 | C121: Dwarf | D121: Brell Serilis | E121: Torvonnilous | F121: 1679 | G121: 981 | H121: 2854 | I121: 306 | J121: 0 | K121: 0 | L121: =SUM(F121:K121) -> 5820 | M121: =SUM(F121/2.096+G121/1.069+H121/3.69+I121/0.465+J121/0.005+K121/0.002) -> 3150.2359437032828
A122: Dorim | B122: 60 | C122: Dwarf | D122: Brell Serilis | E122: Innoruuk | F122: 1836 | G122: 900 | H122: 3272 | I122: 293 | J122: 0 | K122: 0 | L122: =SUM(F122:K122) -> 6301 | M122: =SUM(F122/2.096+G122/1.069+H122/3.69+I122/0.465+J122/0.005+K122/0.002) -> 3234.6909181015608
A123: Phalia | B123: 60 | C123: Dwarf | D123: Brell Serilis | E123: Xegony | F123: 1797 | G123: 946 | H123: 3353 | I123: 285 | J123: 0 | K123: 0 | L123: =SUM(F123:K123) -> 6381 | M123: =SUM(F123/2.096+G123/1.069+H123/3.69+I123/0.465+J123/0.005+K123/0.002) -> 3263.8618362814159
A124: Mirixia | B124: 56 | C124: Dark Elf | D124: Innoruuk | E124: Vallon Zek | F124: 1408 | G124: 869 | H124: 2828 | I124: 382 | J124: 1 | K124: 0 | L124: =SUM(F124:K124) -> 5488 | M124: =SUM(F124/2.096+G124/1.069+H124/3.69+I124/0.465+J124/0.005+K124/0.002) -> 3272.5660264831463
A125: Treage | B125: 60 | C125: High Elf | D125: Tunare | E125: Erollisi Marr | F125: 1742 | G125: 1044 | H125: 3344 | I125: 260 | J125: 0 | K125: 0 | L125: =SUM(F125:K125) -> 6390 | M125: =SUM(F125/2.096+G125/1.069+H125/3.69+I125/0.465+J125/0.005+K125/0.002) -> 3273.0933751298153
A126: Eriond | B126: 60 | C126: Dwarf | D126: Brell Serilis | E126: Antonius Bayle | F126: 1770 | G126: 869 | H126: 3305 | I126: 345 | J126: 0 | K126: 0 | L126: =SUM(F126:K126) -> 6289 | M126: =SUM(F126/2.096+G126/1.069+H126/3.69+I126/0.465+J126/0.005+K126/0.002) -> 3294.9743503570771
A127: Lazarelle | B127: 60 | C127: High Elf | D127: Tunare | E127: Vazaelle | F127: 1351 | G127: 1130 | H127: 2911 | I127: 376 | J127: 0 | K127: 0 | L127: =SUM(F127:K127) -> 5768 | M127: =SUM(F127/2.096+G127/1.069+H127/3.69+I127/0.465+J127/0.005+K127/0.002) -> 3299.1147835263814
A128: Badany | B128: 58 | C128: Human | D128: Rodcet Nife | E128: Zebuxoruk | F128: 1824 | G128: 972 | H128: 3232 | I128: 301 | J128: 0 | K128: 0 | L128: =SUM(F128:K128) -> 6329 | M128: =SUM(F128/2.096+G128/1.069+H128/3.69+I128/0.465+J128/0.005+K128/0.002) -> 3302.6825859790815
A129: Luminar | B129: 60 | C129: Erudite | D129: Quelious | E129: Saryrn | F129: 1822 | G129: 975 | H129: 3224 | I129: 313 | J129: 0 | K129: 0 | L129: =SUM(F129:K129) -> 6334 | M129: =SUM(F129/2.096+G129/1.069+H129/3.69+I129/0.465+J129/0.005+K129/0.002) -> 3328.173178523612
A130: Tanilin | B130: 60 | C130: Erudite | D130: Quellious | E130: Rallos Zek | F130: 1660 | G130: 875 | H130: 3094 | I130: 316 | J130: 1 | K130: 0 | L130: =SUM(F130:K130) -> 5946 | M130: =SUM(F130/2.096+G130/1.069+H130/3.69+I130/0.465+J130/0.005+K130/0.002) -> 3328.5589932832277
A131: Zardnok | B131: 59 | C131: High Elf | D131: Tunare | E131: Druzzil Ro | F131: 1518 | G131: 976 | H131: 2942 | I131: 422 | J131: 0 | K131: 0 | L131: =SUM(F131:K131) -> 5858 | M131: =SUM(F131/2.096+G131/1.069+H131/3.69+I131/0.465+J131/0.005+K131/0.002) -> 3342.0563022026186
A132: Tekara | B132: 60 | C132: Erudite | D132: Cazic Thule | E132: Cazic-Thule | F132: 1634 | G132: 904 | H132: 3360 | I132: 291 | J132: 1 | K132: 0 | L132: =SUM(F132:K132) -> 6190 | M132: =SUM(F132/2.096+G132/1.069+H132/3.69+I132/0.465+J132/0.005+K132/0.002) -> 3361.6058502937703
A133: Aeler | B133: 54 | C133: Dark Elf | D133: Innoruuk | E133: Nameless | F133: 1455 | G133: 959 | H133: 2974 | I133: 217 | J133: 0 | K133: 1 | L133: =SUM(F133:K133) -> 5606 | M133: =SUM(F133/2.096+G133/1.069+H133/3.69+I133/0.465+J133/0.005+K133/0.002) -> 3363.9082091456089
A134: Confuzzed | B134: 60 | C134: High Elf | D134: Tunare | E134: Quellious | F134: 1636 | G134: 955 | H134: 3444 | I134: 360 | J134: 0 | K134: 0 | L134: =SUM(F134:K134) -> 6395 | M134: =SUM(F134/2.096+G134/1.069+H134/3.69+I134/0.465+J134/0.005+K134/0.002) -> 3381.4195116306691
A135: Lylliae | B135: 58 | C135: High Elf | D135: Tunare | E135: Vazaelle | F135: 1688 | G135: 976 | H135: 2952 | I135: 405 | J135: 0 | K135: 0 | L135: =SUM(F135:K135) -> 6021 | M135: =SUM(F135/2.096+G135/1.069+H135/3.69+I135/0.465+J135/0.005+K135/0.002) -> 3389.314059746951
A136: Mathilda | B136: 60 | C136: Halfing | D136: Bristelbane | E136: Test | F136: 1638 | G136: 972 | H136: 3470 | I136: 380 | J136: 0 | K136: 0 | L136: =SUM(F136:K136) -> 6460 | M136: =SUM(F136/2.096+G136/1.069+H136/3.69+I136/0.465+J136/0.005+K136/0.002) -> 3448.3332460685438
A137: Elrin | B137: 60 | C137: Human | D137: Mithaniel Marr | E137: Terris-Thule | F137: 1731 | G137: 1081 | H137: 3337 | I137: 338 | J137: 0 | K137: 0 | L137: =SUM(F137:K137) -> 6487 | M137: =SUM(F137/2.096+G137/1.069+H137/3.69+I137/0.465+J137/0.005+K137/0.002) -> 3468.3019867570006
A138: Aalamdara | B138: 58 | C138: High Elf | D138: Tunare | E138: Solusek Ro | F138: 1623 | G138: 963 | H138: 3202 | I138: 432 | J138: 0 | K138: 0 | L138: =SUM(F138:K138) -> 6220 | M138: =SUM(F138/2.096+G138/1.069+H138/3.69+I138/0.465+J138/0.005+K138/0.002) -> 3471.9569049655315
A139: Kellithe | B139: 59 | C139: Dwarf | D139: Brell Serilis | E139: Cazic-Thule | F139: 1802 | G139: 1033 | H139: 3212 | I139: 367 | J139: 0 | K139: 0 | L139: =SUM(F139:K139) -> 6414 | M139: =SUM(F139/2.096+G139/1.069+H139/3.69+I139/0.465+J139/0.005+K139/0.002) -> 3485.7645078409687
A140: Sadar | B140: 60 | C140: High Elf | D140: Tunare | E140: Seventh Hammer | F140: 1632 | G140: 964 | H140: 3116 | I140: 361 | J140: 1 | K140: 0 | L140: =SUM(F140:K140) -> 6074 | M140: =SUM(F140/2.096+G140/1.069+H140/3.69+I140/0.465+J140/0.005+K140/0.002) -> 3501.1918466850029
A141: Calimayrn | B141: 60 | C141: High Elf | D141: Tunare | E141: Veeshan | F141: 1833 | G141: 1097 | H141: 3219 | I141: 340 | J141: 0 | K141: 0 | L141: =SUM(F141:K141) -> 6489 | M141: =SUM(F141/2.096+G141/1.069+H141/3.69+I141/0.465+J141/0.005+K141/0.002) -> 3504.2561235006979
A142: Drekken | B142: 60 | C142: Human | D142: Mithaniel Marr | E142: Vazaelle | F142: 1515 | G142: 990 | H142: 3116 | I142: 307 | J142: 2 | K142: 0 | L142: =SUM(F142:K142) -> 5930 | M142: =SUM(F142/2.096+G142/1.069+H142/3.69+I142/0.465+J142/0.005+K142/0.002) -> 3553.56399981101
A143: Bertil | B143: 59 | C143: Dwarf | D143: Brell Serilis | E143: Xegony | F143: 1890 | G143: 1002 | H143: 3432 | I143: 379 | J143: 0 | K143: 0 | L143: =SUM(F143:K143) -> 6703 | M143: =SUM(F143/2.096+G143/1.069+H143/3.69+I143/0.465+J143/0.005+K143/0.002) -> 3584.1772239379561
A144: Sinafein | B144: 57 | C144: Dwarf | D144: Brell Serilis | E144: Morell-Thule | F144: 1474 | G144: 868 | H144: 3051 | I144: 302 | J144: 3 | K144: 0 | L144: =SUM(F144:K144) -> 5698 | M144: =SUM(F144/2.096+G144/1.069+H144/3.69+I144/0.465+J144/0.005+K144/0.002) -> 3591.50971598978
A145: Meadbh | B145: 60 | C145: Dark Elf | D145: Innoruuk | E145: Innoruuk | F145: 1431 | G145: 1031 | H145: 3205 | I145: 272 | J145: 0 | K145: 1 | L145: =SUM(F145:K145) -> 5940 | M145: =SUM(F145/2.096+G145/1.069+H145/3.69+I145/0.465+J145/0.005+K145/0.002) -> 3600.6916894179844
A146: Daryaen | B146: 60 | C146: High Elf | D146: Tunare | E146: Tunare | F146: 1850 | G146: 939 | H146: 3505 | I146: 332 | J146: 1 | K146: 0 | L146: =SUM(F146:K146) -> 6627 | M146: =SUM(F146/2.096+G146/1.069+H146/3.69+I146/0.465+J146/0.005+K146/0.002) -> 3624.8676006994292
A147: Indelron | B147: 59 | C147: Human | D147: Mithaniel Marr | E147: Tribunal | F147: 1614 | G147: 827 | H147: 3109 | I147: 302 | J147: 3 | K147: 0 | L147: =SUM(F147:K147) -> 5855 | M147: =SUM(F147/2.096+G147/1.069+H147/3.69+I147/0.465+J147/0.005+K147/0.002) -> 3635.6681648043968
A148: Grumbles | B148: 60 | C148: Dwarf | D148: Brell Serilis | E148: Drinal | F148: 1961 | G148: 953 | H148: 3615 | I148: 389 | J148: 0 | K148: 0 | L148: =SUM(F148:K148) -> 6918 | M148: =SUM(F148/2.096+G148/1.069+H148/3.69+I148/0.465+J148/0.005+K148/0.002) -> 3643.3129109614661
A149: Gorthe | B149: 58 | C149: Dwarf | D149: Brell Serilis | E149: Innoruuk | F149: 1679 | G149: 932 | H149: 3385 | I149: 399 | J149: 1 | K149: 0 | L149: =SUM(F149:K149) -> 6396 | M149: =SUM(F149/2.096+G149/1.069+H149/3.69+I149/0.465+J149/0.005+K149/0.002) -> 3648.3011516706101
A150: Ejkas | B150: 60 | C150: High Elf | D150: Tunare | E150: Solusek Ro | F150: 1341 | G150: 880 | H150: 2993 | I150: 226 | J150: 2 | K150: 1 | L150: =SUM(F150:K150) -> 5443 | M150: =SUM(F150/2.096+G150/1.069+H150/3.69+I150/0.465+J150/0.005+K150/0.002) -> 3660.1219444603767
A151: Loral | B151: 60 | C151: High Elf | D151: Tunare | E151: Quellious | F151: 1825 | G151: 1020 | H151: 3645 | I151: 318 | J151: 1 | K151: 0 | L151: =SUM(F151:K151) -> 6809 | M151: =SUM(F151/2.096+G151/1.069+H151/3.69+I151/0.465+J151/0.005+K151/0.002) -> 3696.5447216038824
A152: Marri | B152: 58 | C152: High Elf | D152: Tunare | E152: Innoruuk | F152: 1722 | G152: 1008 | H152: 3345 | I152: 412 | J152: 1 | K152: 0 | L152: =SUM(F152:K152) -> 6488 | M152: =SUM(F152/2.096+G152/1.069+H152/3.69+I152/0.465+J152/0.005+K152/0.002) -> 3757.0277805156097
A153: Amojoman | B153: 60 | C153: Dark Elf | D153: Innoruuk | E153: Tribunal | F153: 1503 | G153: 983 | H153: 3106 | I153: 276 | J153: 1 | K153: 1 | L153: =SUM(F153:K153) -> 5870 | M153: =SUM(F153/2.096+G153/1.069+H153/3.69+I153/0.465+J153/0.005+K153/0.002) -> 3771.9139393390833
A154: Higar | B154: 56 | C154: Dwarf | D154: Brell Serilis | E154: Drinal | F154: 1790 | G154: 893 | H154: 3259 | I154: 413 | J154: 2 | K154: 0 | L154: =SUM(F154:K154) -> 6357 | M154: =SUM(F154/2.096+G154/1.069+H154/3.69+I154/0.465+J154/0.005+K154/0.002) -> 3860.7376582494499
A155: Yari | B155: 60 | C155: High Elf | D155: Tunare | E155: Karana | F155: 1766 | G155: 1099 | H155: 3314 | I155: 508 | J155: 0 | K155: 0 | L155: =SUM(F155:K155) -> 6687 | M155: =SUM(F155/2.096+G155/1.069+H155/3.69+I155/0.465+J155/0.005+K155/0.002) -> 3861.1969620690402
A156: Adarii | B156: 60 | C156: Dark Elf | D156: Innoruuk | E156: Vazaelle | F156: 1741 | G156: 1051 | H156: 3545 | I156: 329 | J156: 2 | K156: 0 | L156: =SUM(F156:K156) -> 6668 | M156: =SUM(F156/2.096+G156/1.069+H156/3.69+I156/0.465+J156/0.005+K156/0.002) -> 3882.0230932481095
A157: Affinity | B157: 60 | C157: High Elf | D157: Tunare | E157: Rodcet Nife | F157: 1639 | G157: 1020 | H157: 3373 | I157: 388 | J157: 2 | K157: 0 | L157: =SUM(F157:K157) -> 6422 | M157: =SUM(F157/2.096+G157/1.069+H157/3.69+I157/0.465+J157/0.005+K157/0.002) -> 3884.6291608698461
A158: Thordoff | B158: 59 | C158: Dwarf | D158: Brell Serilis | E158: Druzzil Ro | F158: 1934 | G158: 1045 | H158: 3553 | I158: 390 | J158: 1 | K158: 0 | L158: =SUM(F158:K158) -> 6923 | M158: =SUM(F158/2.096+G158/1.069+H158/3.69+I158/0.465+J158/0.005+K158/0.002) -> 3901.8413411287538
A159: Hippocrat | B159: 60 | C159: Halfling | D159: Bristlebane | E159: Vazaelle | F159: 1754 | G159: 1012 | H159: 3157 | I159: 496 | J159: 1 | K159: 0 | L159: =SUM(F159:K159) -> 6420 | M159: =SUM(F159/2.096+G159/1.069+H159/3.69+I159/0.465+J159/0.005+K159/0.002) -> 3905.7334226735252
A160: Qamen | B160: 60 | C160: High Elf | D160: Tunare | E160: Fennin Ro | F160: 1890 | G160: 1049 | H160: 3681 | I160: 391 | J160: 1 | K160: 0 | L160: =SUM(F160:K160) -> 7012 | M160: =SUM(F160/2.096+G160/1.069+H160/3.69+I160/0.465+J160/0.005+K160/0.002) -> 3921.4296740145855
A161: Dianna | B161: 60 | C161: Halfling | D161: Bristelbane | E161: Vazaelle | F161: 1712 | G161: 1034 | H161: 3405 | I161: 385 | J161: 2 | K161: 0 | L161: =SUM(F161:K161) -> 6538 | M161: =SUM(F161/2.096+G161/1.069+H161/3.69+I161/0.465+J161/0.005+K161/0.002) -> 3934.7742306928858
A162: Erline | B162: 60 | C162: High Elf | D162: Tunare | E162: Vazaelle | F162: 1243 | G162: 727 | H162: 2981 | I162: 169 | J162: 0 | K162: 3 | L162: =SUM(F162:K162) -> 5123 | M162: =SUM(F162/2.096+G162/1.069+H162/3.69+I162/0.465+J162/0.005+K162/0.002) -> 3944.4091262464813
A163: Rommy | B163: 60 | C163: Dark Elf | D163: Innoruuk | E163: Povar | F163: 2033 | G163: 1002 | H163: 3453 | I163: 436 | J163: 1 | K163: 0 | L163: =SUM(F163:K163) -> 6925 | M163: =SUM(F163/2.096+G163/1.069+H163/3.69+I163/0.465+J163/0.005+K163/0.002) -> 3980.6741168495105
A164: Tietan | B164: 60 | C164: High Elf | D164: Tunare | E164: Zebuxxoruk | F164: 1993 | G164: 1011 | H164: 3586 | I164: 335 | J164: 2 | K164: 0 | L164: =SUM(F164:K164) -> 6927 | M164: =SUM(F164/2.096+G164/1.069+H164/3.69+I164/0.465+J164/0.005+K164/0.002) -> 3988.8482899975761
A165: Spawrhawk | B165: 60 | C165: Dwarf | D165: Brell Serilis | E165: Fennin Ro | F165: 1945 | G165: 1110 | H165: 3404 | I165: 524 | J165: 0 | K165: 0 | L165: =SUM(F165:K165) -> 6983 | M165: =SUM(F165/2.096+G165/1.069+H165/3.69+I165/0.465+J165/0.005+K165/0.002) -> 4015.6865621262577
A166: Letha | B166: 60 | C166: High Elf | D166: Tunare | E166: Vazaelle | F166: 1748 | G166: 1029 | H166: 3460 | I166: 420 | J166: 2 | K166: 0 | L166: =SUM(F166:K166) -> 6659 | M166: =SUM(F166/2.096+G166/1.069+H166/3.69+I166/0.465+J166/0.005+K166/0.002) -> 4037.4465009925507
A167: Treiz | B167: 60 | C167: High Elf | D167: Tunare | E167: Drinal | F167: 2035 | G167: 1016 | H167: 3740 | I167: 440 | J167: 1 | K167: 0 | L167: =SUM(F167:K167) -> 7232 | M167: =SUM(F167/2.096+G167/1.069+H167/3.69+I167/0.465+J167/0.005+K167/0.002) -> 4081.1045953687944
A168: Auroria | B168: 60 | C168: High Elf | D168: Tunare | E168: Mithaniel Marr | F168: 1970 | G168: 1076 | H168: 3825 | I168: 331 | J168: 2 | K168: 0 | L168: =SUM(F168:K168) -> 7204 | M168: =SUM(F168/2.096+G168/1.069+H168/3.69+I168/0.465+J168/0.005+K168/0.002) -> 4094.8469948914062
A169: Tappsek | B169: 60 | C169: Dwarf | D169: Brell Serilis | E169: Innoruuk | F169: 2010 | G169: 1068 | H169: 3568 | I169: 362 | J169: 2 | K169: 0 | L169: =SUM(F169:K169) -> 7010 | M169: =SUM(F169/2.096+G169/1.069+H169/3.69+I169/0.465+J169/0.005+K169/0.002) -> 4103.4663049864212
A170: Caliopy | B170: 60 | C170: Dark Elf | D170: Innoruuk | E170: Innoruuk | F170: 2014 | G170: 1080 | H170: 3623 | I170: 357 | J170: 2 | K170: 0 | L170: =SUM(F170:K170) -> 7076 | M170: =SUM(F170/2.096+G170/1.069+H170/3.69+I170/0.465+J170/0.005+K170/0.002) -> 4120.7526071529383
A171: Fethos | B171: 60 | C171: Human | D171: Mithaniel Marr | E171: Tholuxe Paells | F171: 1809 | G171: 1063 | H171: 3517 | I171: 425 | J171: 2 | K171: 0 | L171: =SUM(F171:K171) -> 6816 | M171: =SUM(F171/2.096+G171/1.069+H171/3.69+I171/0.465+J171/0.005+K171/0.002) -> 4124.5548227026848
A172: Noryaka | B172: 60 | C172: Dark Elf | D172: Innoruuk | E172: Innoruuk | F172: 1891 | G172: 1112 | H172: 3675 | I172: 385 | J172: 2 | K172: 0 | L172: =SUM(F172:K172) -> 7065 | M172: =SUM(F172/2.096+G172/1.069+H172/3.69+I172/0.465+J172/0.005+K172/0.002) -> 4166.311113972265
A173: Binadint | B173: 60 | C173: Dwarf | D173: Brell Serilis | E173: Solusek Ro | F173: 1601 | G173: 1013 | H173: 3009 | I173: 323 | J173: 0 | K173: 2 | L173: =SUM(F173:K173) -> 5948 | M173: =SUM(F173/2.096+G173/1.069+H173/3.69+I173/0.465+J173/0.005+K173/0.002) -> 4221.5212813257613
A174: Noraseas | B174: 60 | C174: Dark Elf | D174: Innoruuk | E174: Prexus | F174: 1932 | G174: 1070 | H174: 3710 | I174: 522 | J174: 1 | K174: 0 | L174: =SUM(F174:K174) -> 7235 | M174: =SUM(F174/2.096+G174/1.069+H174/3.69+I174/0.465+J174/0.005+K174/0.002) -> 4250.6918782477142
A175: Schatje | B175: 60 | C175: Dark Elf | D175: Innoruuk | E175: Rathe | F175: 2120 | G175: 1077 | H175: 3835 | I175: 462 | J175: 1 | K175: 0 | L175: =SUM(F175:K175) -> 7495 | M175: =SUM(F175/2.096+G175/1.069+H175/3.69+I175/0.465+J175/0.005+K175/0.002) -> 4251.7777912904294
A176: Haels | B176: 60 | C176: Dwarf | D176: Brell Serilis | E176: Vazaelle | F176: 1752 | G176: 893 | H176: 3228 | I176: 332 | J176: 0 | K176: 2 | L176: =SUM(F176:K176) -> 6207 | M176: =SUM(F176/2.096+G176/1.069+H176/3.69+I176/0.465+J176/0.005+K176/0.002) -> 4260.0132548591464
A177: Sutiea | B177: 60 | C177: High Elf | D177: Tunare | E177: Nameless | F177: 1785 | G177: 977 | H177: 3393 | I177: 295 | J177: 0 | K177: 2 | L177: =SUM(F177:K177) -> 6452 | M177: =SUM(F177/2.096+G177/1.069+H177/3.69+I177/0.465+J177/0.005+K177/0.002) -> 4319.4811947331964
A178: Sherazade | B178: 60 | C178: High Elf | D178: Tunare | E178: Prexus | F178: 1754 | G178: 1064 | H178: 3490 | I178: 446 | J178: 3 | K178: 0 | L178: =SUM(F178:K178) -> 6757 | M178: =SUM(F178/2.096+G178/1.069+H178/3.69+I178/0.465+J178/0.005+K178/0.002) -> 4337.0940355343082
A179: Nanilya | B179: 60 | C179: High Elf | D179: Tunare | E179: Zebuxoruk | F179: 2455 | G179: 1171 | H179: 3766 | I179: 438 | J179: 1 | K179: 0 | L179: =SUM(F179:K179) -> 7831 | M179: =SUM(F179/2.096+G179/1.069+H179/3.69+I179/0.465+J179/0.005+K179/0.002) -> 4429.2265926815198
A180: Torriana | B180: 60 | C180: High Elf | D180: Tunare | E180: Brell Serilis | F180: 2065 | G180: 878 | H180: 3945 | I180: 455 | J180: 3 | K180: 0 | L180: =SUM(F180:K180) -> 7346 | M180: =SUM(F180/2.096+G180/1.069+H180/3.69+I180/0.465+J180/0.005+K180/0.002) -> 4454.1385826239057
A181: Mathiddae | B181: 60 | C181: High Elf | D181: Tunare | E181: Vazaelle | F181: 1758 | G181: 948 | H181: 3443 | I181: 514 | J181: 1 | K181: 1 | L181: =SUM(F181:K181) -> 6665 | M181: =SUM(F181/2.096+G181/1.069+H181/3.69+I181/0.465+J181/0.005+K181/0.002) -> 4463.9892356245009
A182: Balamor | B182: 60 | C182: Dwarf | D182: Brell Serilis | E182: Fennin Ro | F182: 1722 | G182: 932 | H182: 3432 | I182: 300 | J182: 6 | K182: 0 | L182: =SUM(F182:K182) -> 6392 | M182: =SUM(F182/2.096+G182/1.069+H182/3.69+I182/0.465+J182/0.005+K182/0.002) -> 4468.6503204110049
A183: Litermin | B183: 60 | C183: Halfling | D183: Bristlebane | E183: Erollisi Marr | F183: 1984 | G183: 1050 | H183: 3770 | I183: 524 | J183: 2 | K183: 0 | L183: =SUM(F183:K183) -> 7330 | M183: =SUM(F183/2.096+G183/1.069+H183/3.69+I183/0.465+J183/0.005+K183/0.002) -> 4477.3532025226586
A184: Elronde | B184: 60 | C184: Human | D184: Karana | E184: Seventh Hammer | F184: 1995 | G184: 1055 | H184: 3810 | I184: 423 | J184: 3 | K184: 0 | L184: =SUM(F184:K184) -> 7286 | M184: =SUM(F184/2.096+G184/1.069+H184/3.69+I184/0.465+J184/0.005+K184/0.002) -> 4480.9143699267379
A185: Morrun | B185: 60 | C185: Halfling | D185: Bristlebane | E185: Cazic-Thule | F185: 1618 | G185: 944 | H185: 2988 | I185: 247 | J185: 0 | K185: 3 | L185: =SUM(F185:K185) -> 5800 | M185: =SUM(F185/2.096+G185/1.069+H185/3.69+I185/0.465+J185/0.005+K185/0.002) -> 4495.9537462651342
A186: Charitey | B186: 60 | C186: Gnome | D186: Brell Serilis | E186: Morell-Thule | F186: 1828 | G186: 1035 | H186: 3438 | I186: 470 | J186: 4 | K186: 0 | L186: =SUM(F186:K186) -> 6775 | M186: =SUM(F186/2.096+G186/1.069+H186/3.69+I186/0.465+J186/0.005+K186/0.002) -> 4582.7919841939356
A187: Windeliane | B187: 60 | C187: High Elf | D187: Tunare | E187: Terris-Thule | F187: 1645 | G187: 958 | H187: 3230 | I187: 251 | J187: 0 | K187: 3 | L187: =SUM(F187:K187) -> 6087 | M187: =SUM(F187/2.096+G187/1.069+H187/3.69+I187/0.465+J187/0.005+K187/0.002) -> 4596.1165837492299
A188: Gryfalia | B188: 60 | C188: Dwarf | D188: Brell Serilis | E188: Druzzil Ro | F188: 2402 | G188: 1120 | H188: 3948 | I188: 458 | J188: 2 | K188: 0 | L188: =SUM(F188:K188) -> 7930 | M188: =SUM(F188/2.096+G188/1.069+H188/3.69+I188/0.465+J188/0.005+K188/0.002) -> 4648.5654406054919
A189: Ruloe | B189: 60 | C189: Dwarf | D189: Brell Serilis | E189: Bristlebane | F189: 2073 | G189: 961 | H189: 3720 | I189: 363 | J189: 5 | K189: 0 | L189: =SUM(F189:K189) -> 7122 | M189: =SUM(F189/2.096+G189/1.069+H189/3.69+I189/0.465+J189/0.005+K189/0.002) -> 4676.7729610838414
A190: Ingraban | B190: 60 | C190: Dwarf | D190: Brell Serilis | E190: Solusek Ro | F190: 2151 | G190: 1073 | H190: 3755 | I190: 312 | J190: 5 | K190: 0 | L190: =SUM(F190:K190) -> 7296 | M190: =SUM(F190/2.096+G190/1.069+H190/3.69+I190/0.465+J190/0.005+K190/0.002) -> 4718.5651908826812
A191: Battas | B191: 60 | C191: Halfling | D191: Bristlebane | E191: Vazaelle | F191: 1639 | G191: 1010 | H191: 2973 | I191: 334 | J191: 0 | K191: 3 | L191: =SUM(F191:K191) -> 5959 | M191: =SUM(F191/2.096+G191/1.069+H191/3.69+I191/0.465+J191/0.005+K191/0.002) -> 4750.7445076505201
A192: Clenzz | B192: 60 | C192: Dwarf | D192: Brell Serilis | E192: Tarew Marr | F192: 2509 | G192: 1056 | H192: 3755 | I192: 444 | J192: 3 | K192: 0 | L192: =SUM(F192:K192) -> 7767 | M192: =SUM(F192/2.096+G192/1.069+H192/3.69+I192/0.465+J192/0.005+K192/0.002) -> 4757.3349725264579
A193: Yamile | B193: 60 | C193: High Elf | D193: Tunare | E193: Vazaelle | F193: 1806 | G193: 1000 | H193: 3586 | I193: 380 | J193: 6 | K193: 0 | L193: =SUM(F193:K193) -> 6778 | M193: =SUM(F193/2.096+G193/1.069+H193/3.69+I193/0.465+J193/0.005+K193/0.002) -> 4786.1149356485912
A194: Kendal | B194: 60 | C194: High Elf | D194: Tunare | E194: Morell-Thule | F194: 2013 | G194: 1020 | H194: 3795 | I194: 416 | J194: 5 | K194: 0 | L194: =SUM(F194:K194) -> 7249 | M194: =SUM(F194/2.096+G194/1.069+H194/3.69+I194/0.465+J194/0.005+K194/0.002) -> 4837.6424727685398
A195: Cyzia | B195: 60 | C195: High Elf | D195: Tunare | E195: Cazic-Thule | F195: 1783 | G195: 1000 | H195: 3500 | I195: 494 | J195: 3 | K195: 1 | L195: =SUM(F195:K195) -> 6781 | M195: =SUM(F195/2.096+G195/1.069+H195/3.69+I195/0.465+J195/0.005+K195/0.002) -> 4896.9967104660936
A196: Mowang | B196: 60 | C196: Dark Elf | D196: Innoruuk | E196: Luclin | F196: 2002 | G196: 1227 | H196: 3898 | I196: 402 | J196: 2 | K196: 1 | L196: =SUM(F196:K196) -> 7532 | M196: =SUM(F196/2.096+G196/1.069+H196/3.69+I196/0.465+J196/0.005+K196/0.002) -> 4923.8390482902705
A197: Jilanya | B197: 60 | C197: High Elf | D197: Tunare | E197: Innoruuk | F197: 2208 | G197: 1114 | H197: 3805 | I197: 427 | J197: 2 | K197: 1 | L197: =SUM(F197:K197) -> 7557 | M197: =SUM(F197/2.096+G197/1.069+H197/3.69+I197/0.465+J197/0.005+K197/0.002) -> 4944.975412326301
A198: Callandre | B198: 60 | C198: High Elf | D198: Tunare | E198: Quesllious | F198: 1684 | G198: 864 | H198: 3463 | I198: 344 | J198: 1 | K198: 3 | L198: =SUM(F198:K198) -> 6359 | M198: =SUM(F198/2.096+G198/1.069+H198/3.69+I198/0.465+J198/0.005+K198/0.002) -> 4989.9344380805951
A199: Dalur | B199: 60 | C199: Dwarf | D199: Brell Serilis | E199: Veeshan | F199: 1783 | G199: 1043 | H199: 3118 | I199: 288 | J199: 1 | K199: 3 | L199: =SUM(F199:K199) -> 6236 | M199: =SUM(F199/2.096+G199/1.069+H199/3.69+I199/0.465+J199/0.005+K199/0.002) -> 4990.6874314343795
A200: Yizenthia | B200: 60 | C200: Erudite | D200: Quellious | E200: Tribunal | F200: 1934 | G200: 915 | H200: 3462 | I200: 269 | J200: 1 | K200: 3 | L200: =SUM(F200:K200) -> 6584 | M200: =SUM(F200/2.096+G200/1.069+H200/3.69+I200/0.465+J200/0.005+K200/0.002) -> 4995.3560603973747
A201: Electrae | B201: 60 | C201: High Elf | D201: Tunare | E201: Drinal | F201: 1505 | G201: 941 | H201: 3211 | I201: 488 | J201: 0 | K201: 3 | L201: =SUM(F201:K201) -> 6148 | M201: =SUM(F201/2.096+G201/1.069+H201/3.69+I201/0.465+J201/0.005+K201/0.002) -> 5017.9483456680664
A202: Stumpf | B202: 60 | C202: Dwarf | D202: Brell Serilis | E202: Erollisi Marr | F202: 2129 | G202: 998 | H202: 3895 | I202: 499 | J202: 5 | K202: 0 | L202: =SUM(F202:K202) -> 7526 | M202: =SUM(F202/2.096+G202/1.069+H202/3.69+I202/0.465+J202/0.005+K202/0.002) -> 5078.0008975866194
A203: Kornaena | B203: 60 | C203: Dark Elf | D203: Innoruuk | E203: Mithaniel Marr | F203: 1779 | G203: 1005 | H203: 3460 | I203: 356 | J203: 3 | K203: 2 | L203: =SUM(F203:K203) -> 6605 | M203: =SUM(F203/2.096+G203/1.069+H203/3.69+I203/0.465+J203/0.005+K203/0.002) -> 5092.1512800452674
A204: Darizra | B204: 60 | C204: Dark Elf | D204: Innoruuk | E204: Saryrn | F204: 2571 | G204: 1236 | H204: 4084 | I204: 567 | J204: 2 | K204: 0 | L204: =SUM(F204:K204) -> 8460 | M204: =SUM(F204/2.096+G204/1.069+H204/3.69+I204/0.465+J204/0.005+K204/0.002) -> 5108.9728109369644
A205: Shortyrez | B205: 60 | C205: Dwarf | D205: Brell Serilis | E205: Ayonae Ro | F205: 2121 | G205: 1067 | H205: 3944 | I205: 479 | J205: 5 | K205: 0 | L205: =SUM(F205:K205) -> 7616 | M205: =SUM(F205/2.096+G205/1.069+H205/3.69+I205/0.465+J205/0.005+K205/0.002) -> 5108.9987887545503
A206: Taleus | B206: 60 | C206: High Elf | D206: Tunare | E206: Prexus | F206: 1909 | G206: 960 | H206: 3371 | I206: 245 | J206: 2 | K206: 3 | L206: =SUM(F206:K206) -> 6490 | M206: =SUM(F206/2.096+G206/1.069+H206/3.69+I206/0.465+J206/0.005+K206/0.002) -> 5149.249845919966
A207: Benaa | B207: 60 | C207: Dark Elf | D207: Innoruuk | E207: Mithaniel Marr | F207: 1884 | G207: 973 | H207: 3550 | I207: 411 | J207: 0 | K207: 3 | L207: =SUM(F207:K207) -> 6821 | M207: =SUM(F207/2.096+G207/1.069+H207/3.69+I207/0.465+J207/0.005+K207/0.002) -> 5154.9819954461618
A208: Panteroo | B208: 60 | C208: High Elf | D208: Tunare | E208: Fennin Ro | F208: 1735 | G208: 982 | H208: 3225 | I208: 321 | J208: 2 | K208: 3 | L208: =SUM(F208:K208) -> 6268 | M208: =SUM(F208/2.096+G208/1.069+H208/3.69+I208/0.465+J208/0.005+K208/0.002) -> 5210.6890245864161
A209: Borick | B209: 60 | C209: Dwarf | D209: Brell Serilis | E209: Rathe | F209: 2261 | G209: 1142 | H209: 4010 | I209: 564 | J209: 4 | K209: 0 | L209: =SUM(F209:K209) -> 7981 | M209: =SUM(F209/2.096+G209/1.069+H209/3.69+I209/0.465+J209/0.005+K209/0.002) -> 5246.6335867989983
A210: Teacum | B210: 60 | C210: High Elf | D210: Tunare | E210: Test | F210: 2161 | G210: 1203 | H210: 3740 | I210: 624 | J210: 4 | K210: 0 | L210: =SUM(F210:K210) -> 7732 | M210: =SUM(F210/2.096+G210/1.069+H210/3.69+I210/0.465+J210/0.005+K210/0.002) -> 5311.8478648896426
A211: Deidda | B211: 60 | C211: Halfling | D211: Bristlebane | E211: Antonius Bayle | F211: 2426 | G211: 1167 | H211: 3934 | I211: 479 | J211: 5 | K211: 0 | L211: =SUM(F211:K211) -> 8011 | M211: =SUM(F211/2.096+G211/1.069+H211/3.69+I211/0.465+J211/0.005+K211/0.002) -> 5345.3493983340613
A212: Teclis | B212: 60 | C212: High Elf | D212: Tunare | E212: Rathe | F212: 1934 | G212: 1087 | H212: 3570 | I212: 466 | J212: 0 | K212: 3 | L212: =SUM(F212:K212) -> 7060 | M212: =SUM(F212/2.096+G212/1.069+H212/3.69+I212/0.465+J212/0.005+K212/0.002) -> 5409.1783026060366
A213: Seethur | B213: 60 | C213: High Elf | D213: Tunare | E213: Drinal | F213: 2348 | G213: 1148 | H213: 3740 | I213: 476 | J213: 6 | K213: 0 | L213: =SUM(F213:K213) -> 7718 | M213: =SUM(F213/2.096+G213/1.069+H213/3.69+I213/0.465+J213/0.005+K213/0.002) -> 5431.335899021763
A214: Alerna | B214: 60 | C214: Erudite | D214: Quellious | E214: Zebuxoruk | F214: 2271 | G214: 1076 | H214: 3925 | I214: 504 | J214: 6 | K214: 0 | L214: =SUM(F214:K214) -> 7782 | M214: =SUM(F214/2.096+G214/1.069+H214/3.69+I214/0.465+J214/0.005+K214/0.002) -> 5437.5971468758125
A215: Leesa | B215: 60 | C215: High Elf | D215: Tunare | E215: Rathe | F215: 1957 | G215: 1055 | H215: 3705 | I215: 526 | J215: 7 | K215: 0 | L215: =SUM(F215:K215) -> 7250 | M215: =SUM(F215/2.096+G215/1.069+H215/3.69+I215/0.465+J215/0.005+K215/0.002) -> 5455.8346907256118
A216: Cland | B216: 60 | C216: Dwarf | D216: Brell Serilis | E216: Rallos Zek | F216: 1493 | G216: 1290 | H216: 3162 | I216: 373 | J216: 2 | K216: 3 | L216: =SUM(F216:K216) -> 6323 | M216: =SUM(F216/2.096+G216/1.069+H216/3.69+I216/0.465+J216/0.005+K216/0.002) -> 5478.1055336497466
A217: Quistil | B217: 60 | C217: High Elf | D217: Tunare | E217: Erollisi Marr | F217: 2199 | G217: 1086 | H217: 3810 | I217: 533 | J217: 4 | K217: 1 | L217: =SUM(F217:K217) -> 7633 | M217: =SUM(F217/2.096+G217/1.069+H217/3.69+I217/0.465+J217/0.005+K217/0.002) -> 5543.8008185327981
A218: Barazon | B218: 60 | C218: Dwarf | D218: Brell Serilis | E218: Vazaelle | F218: 2037 | G218: 1159 | H218: 3518 | I218: 448 | J218: 8 | K218: 0 | L218: =SUM(F218:K218) -> 7170 | M218: =SUM(F218/2.096+G218/1.069+H218/3.69+I218/0.465+J218/0.005+K218/0.002) -> 5572.8703716823493
A219: Saela | B219: 60 | C219: Dwarf | D219: Brell Serilis | E219: Drinal | F219: 1995 | G219: 1042 | H219: 3555 | I219: 379 | J219: 2 | K219: 3 | L219: =SUM(F219:K219) -> 6976 | M219: =SUM(F219/2.096+G219/1.069+H219/3.69+I219/0.465+J219/0.005+K219/0.002) -> 5605.0241249203018
A220: Gravewalker | B220: 60 | C220: Halfling | D220: Bristlebane | E220: Solusek Ro | F220: 1869 | G220: 992 | H220: 3700 | I220: 326 | J220: 3 | K220: 3 | L220: =SUM(F220:K220) -> 6893 | M220: =SUM(F220/2.096+G220/1.069+H220/3.69+I220/0.465+J220/0.005+K220/0.002) -> 5623.4538346816771
A221: Thorgrimm | B221: 60 | C221: Dwarf | D221: Brell Serilis | E221: Antonius Bayle | F221: 2094 | G221: 1099 | H221: 3910 | I221: 438 | J221: 8 | K221: 0 | L221: =SUM(F221:K221) -> 7549 | M221: =SUM(F221/2.096+G221/1.069+H221/3.69+I221/0.465+J221/0.005+K221/0.002) -> 5628.6654924549102
A222: Absath | B222: 60 | C222: Dwarf | D222: Brell Serills | E222: Vazaelle | F222: 2137 | G222: 1211 | H222: 3725 | I222: 687 | J222: 0 | K222: 2 | L222: =SUM(F222:K222) -> 7762 | M222: =SUM(F222/2.096+G222/1.069+H222/3.69+I222/0.465+J222/0.005+K222/0.002) -> 5639.2999430879254
A223: Lalu | B223: 60 | C223: High Elf | D223: Tunare | E223: Rathe | F223: 2105 | G223: 1110 | H223: 4000 | I223: 547 | J223: 7 | K223: 0 | L223: =SUM(F223:K223) -> 7769 | M223: =SUM(F223/2.096+G223/1.069+H223/3.69+I223/0.465+J223/0.005+K223/0.002) -> 5703.0024207564029
A224: Bubus | B224: 60 | C224: Dwarf | D224: Brell Serilis | E224: Ayonae Ro | F224: 2688 | G224: 1130 | H224: 4010 | I224: 507 | J224: 6 | K224: 0 | L224: =SUM(F224:K224) -> 8341 | M224: =SUM(F224/2.096+G224/1.069+H224/3.69+I224/0.465+J224/0.005+K224/0.002) -> 5716.5488713430041
A225: Lyranna | B225: 60 | C225: Human | D225: Mithaniel Marr | E225: Tunare | F225: 2073 | G225: 991 | H225: 3630 | I225: 386 | J225: 5 | K225: 2 | L225: =SUM(F225:K225) -> 7087 | M225: =SUM(F225/2.096+G225/1.069+H225/3.69+I225/0.465+J225/0.005+K225/0.002) -> 5729.9086936240628
A226: Glorund | B226: 60 | C226: Dwarf | D226: Brell Serilis | E226: Prexus | F226: 2043 | G226: 1067 | H226: 3855 | I226: 519 | J226: 8 | K226: 0 | L226: =SUM(F226:K226) -> 7492 | M226: =SUM(F226/2.096+G226/1.069+H226/3.69+I226/0.465+J226/0.005+K226/0.002) -> 5733.687312480467
A227: Netorbesnom | B227: 60 | C227: Dwarf | D227: Brell Serilis | E227: Tribunal | F227: 2429 | G227: 1098 | H227: 4250 | I227: 651 | J227: 5 | K227: 0 | L227: =SUM(F227:K227) -> 8433 | M227: =SUM(F227/2.096+G227/1.069+H227/3.69+I227/0.465+J227/0.005+K227/0.002) -> 5737.7637205729243
A228: Rosieana | B228: 60 | C228: High Elf | D228: Karana | E228: Karana | F228: 1853 | G228: 1137 | H228: 3645 | I228: 513 | J228: 1 | K228: 3 | L228: =SUM(F228:K228) -> 7152 | M228: =SUM(F228/2.096+G228/1.069+H228/3.69+I228/0.465+J228/0.005+K228/0.002) -> 5738.7064212594396
A229: Jantos | B229: 60 | C229: Erudite | D229: Quellious | E229: Drinal | F229: 2139 | G229: 1069 | H229: 3820 | I229: 381 | J229: 2 | K229: 3 | L229: =SUM(F229:K229) -> 7414 | M229: =SUM(F229/2.096+G229/1.069+H229/3.69+I229/0.465+J229/0.005+K229/0.002) -> 5775.1004581887728
A230: Barahir | B230: 60 | C230: Dwarf | D230: Brell Serilis | E230: Solusek Ro | F230: 2537 | G230: 1187 | H230: 3820 | I230: 445 | J230: 0 | K230: 3 | L230: =SUM(F230:K230) -> 7992 | M230: =SUM(F230/2.096+G230/1.069+H230/3.69+I230/0.465+J230/0.005+K230/0.002) -> 5813.0038989890963
A231: Skidun | B231: 60 | C231: High Elf | D231: Tunare | E231: Druzzil Ro | F231: 2248 | G231: 1223 | H231: 3710 | I231: 530 | J231: 5 | K231: 1 | L231: =SUM(F231:K231) -> 7717 | M231: =SUM(F231/2.096+G231/1.069+H231/3.69+I231/0.465+J231/0.005+K231/0.002) -> 5861.7839534430495
A232: Markin | B232: 60 | C232: Dwarf | D232: Brell Serilis | E232: Rodcet Nife | F232: 2155 | G232: 1044 | H232: 3484 | I232: 425 | J232: 0 | K232: 4 | L232: =SUM(F232:K232) -> 7112 | M232: =SUM(F232/2.096+G232/1.069+H232/3.69+I232/0.465+J232/0.005+K232/0.002) -> 5862.9144489438531
A233: Lilcure | B233: 60 | C233: Halfling | D233: Bristlebane | E233: Cazic-Thule | F233: 1880 | G233: 1064 | H233: 3516 | I233: 364 | J233: 4 | K233: 3 | L233: =SUM(F233:K233) -> 6831 | M233: =SUM(F233/2.096+G233/1.069+H233/3.69+I233/0.465+J233/0.005+K233/0.002) -> 5927.9105237903013
A234: Ryoko | B234: 60 | C234: Human | D234: Bertoxxulous | E234: Vazaelle | F234: 2293 | G234: 1173 | H234: 4050 | I234: 485 | J234: 1 | K234: 3 | L234: =SUM(F234:K234) -> 8005 | M234: =SUM(F234/2.096+G234/1.069+H234/3.69+I234/0.465+J234/0.005+K234/0.002) -> 6031.847462200627
A235: Vera | B235: 60 | C235: Dark Elf | D235: Innoruuk | E235: Tholuxe Paelle | F235: 2291 | G235: 1183 | H235: 3665 | I235: 444 | J235: 2 | K235: 3 | L235: =SUM(F235:K235) -> 7588 | M235: =SUM(F235/2.096+G235/1.069+H235/3.69+I235/0.465+J235/0.005+K235/0.002) -> 6047.7397143065791
A236: Grubble | B236: 60 | C236: Dwarf | D236: Brell Serilis | E236: Nameless | F236: 2451 | G236: 1138 | H236: 3706 | I236: 473 | J236: 9 | K236: 0 | L236: =SUM(F236:K236) -> 7777 | M236: =SUM(F236/2.096+G236/1.069+H236/3.69+I236/0.465+J236/0.005+K236/0.002) -> 6055.4568784012408
A237: Lyllandra | B237: 60 | C237: High Elf | D237: Tunare | E237: Vazaelle | F237: 2353 | G237: 1152 | H237: 3955 | I237: 565 | J237: 3 | K237: 2 | L237: =SUM(F237:K237) -> 8030 | M237: =SUM(F237/2.096+G237/1.069+H237/3.69+I237/0.465+J237/0.005+K237/0.002) -> 6087.1266421033297
A238: Lanfeare | B238: 60 | C238: Dwarf | D238: Brell Serilis | E238: Stormhammer | F238: 2098 | G238: 1131 | H238: 3910 | I238: 468 | J238: 6 | K238: 2 | L238: =SUM(F238:K238) -> 7615 | M238: =SUM(F238/2.096+G238/1.069+H238/3.69+I238/0.465+J238/0.005+K238/0.002) -> 6325.0245366750805
A239: Dyschord | B239: 60 | C239: Dark Elf | D239: Innoruuk | E239: Ayonae Ro | F239: 2269 | G239: 1296 | H239: 4170 | I239: 511 | J239: 7 | K239: 1 | L239: =SUM(F239:K239) -> 8254 | M239: =SUM(F239/2.096+G239/1.069+H239/3.69+I239/0.465+J239/0.005+K239/0.002) -> 6423.8921887092911
A240: Maribella | B240: 60 | C240: High Elf | D240: Tunare | E240: Test | F240: 2041 | G240: 1068 | H240: 3990 | I240: 506 | J240: 4 | K240: 3 | L240: =SUM(F240:K240) -> 7612 | M240: =SUM(F240/2.096+G240/1.069+H240/3.69+I240/0.465+J240/0.005+K240/0.002) -> 6442.2969443085731
A241: Allden | B241: 60 | C241: Dark Elf | D241: Innoruuk | E241: Test | F241: 2048 | G241: 1063 | H241: 3965 | I241: 518 | J241: 4 | K241: 3 | L241: =SUM(F241:K241) -> 7601 | M241: =SUM(F241/2.096+G241/1.069+H241/3.69+I241/0.465+J241/0.005+K241/0.002) -> 6459.9907543520776
A242: Anika | B242: 60 | C242: Gnome | D242: Brell Serills | E242: Vazaelle | F242: 2199 | G242: 1071 | H242: 3918 | I242: 507 | J242: 4 | K242: 3 | L242: =SUM(F242:K242) -> 7702 | M242: =SUM(F242/2.096+G242/1.069+H242/3.69+I242/0.465+J242/0.005+K242/0.002) -> 6503.1233272954696
A243: Morinkhan | B243: 60 | C243: Dwarf | D243: Brell Serlis | E243: Morell-Thule | F243: 2362 | G243: 1105 | H243: 4095 | I243: 482 | J243: 6 | K243: 2 | L243: =SUM(F243:K243) -> 8052 | M243: =SUM(F243/2.096+G243/1.069+H243/3.69+I243/0.465+J243/0.005+K243/0.002) -> 6506.8999673140024
A244: Tabb | B244: 60 | C244: Dwarf | D244: Brell Serilis | E244: Test | F244: 2139 | G244: 1036 | H244: 3850 | I244: 552 | J244: 4 | K244: 3 | L244: =SUM(F244:K244) -> 7584 | M244: =SUM(F244/2.096+G244/1.069+H244/3.69+I244/0.465+J244/0.005+K244/0.002) -> 6520.1025030370674
A245: Klairen | B245: 60 | C245: High Elf | D245: Tunare | E245: Drinal | F245: 2242 | G245: 1075 | H245: 3870 | I245: 433 | J245: 5 | K245: 3 | L245: =SUM(F245:K245) -> 7628 | M245: =SUM(F245/2.096+G245/1.069+H245/3.69+I245/0.465+J245/0.005+K245/0.002) -> 6555.2324942236737
A246: Cadsuane | B246: 60 | C246: Dark Elf | D246: Innoruuk | E246: Morell-Thule | F246: 2133 | G246: 1333 | H246: 3925 | I246: 630 | J246: 2 | K246: 3 | L246: =SUM(F246:K246) -> 8026 | M246: =SUM(F246/2.096+G246/1.069+H246/3.69+I246/0.465+J246/0.005+K246/0.002) -> 6583.1367937806262
A247: Brambodious | B247: 60 | C247: Halfling | D247: Bristlebane | E247: Quellious | F247: 2544 | G247: 1224 | H247: 3655 | I247: 594 | J247: 5 | K247: 2 | L247: =SUM(F247:K247) -> 8024 | M247: =SUM(F247/2.096+G247/1.069+H247/3.69+I247/0.465+J247/0.005+K247/0.002) -> 6626.6700407345534
A248: Nukuki | B248: 60 | C248: High Elf | D248: Tunare | E248: Vazaelle | F248: 2129 | G248: 1185 | H248: 3885 | I248: 646 | J248: 3 | K248: 3 | L248: =SUM(F248:K248) -> 7851 | M248: =SUM(F248/2.096+G248/1.069+H248/3.69+I248/0.465+J248/0.005+K248/0.002) -> 6666.3497437172846
A249: Yimmarelle | B249: 60 | C249: Gnome | D249: Brell Serilis | E249: Rathe | F249: 2137 | G249: 1086 | H249: 3965 | I249: 500 | J249: 10 | K249: 1 | L249: =SUM(F249:K249) -> 7699 | M249: =SUM(F249/2.096+G249/1.069+H249/3.69+I249/0.465+J249/0.005+K249/0.002) -> 6685.258343979759
A250: Pacemaker | B250: 60 | C250: Human | D250: Agnostic | E250: Rathe | F250: 2221 | G250: 732 | H250: 3692 | I250: 588 | J250: 1 | K250: 5 | L250: =SUM(F250:K250) -> 7239 | M250: =SUM(F250/2.096+G250/1.069+H250/3.69+I250/0.465+J250/0.005+K250/0.002) -> 6709.447643803278
A251: Huneyy | B251: 60 | C251: High Elf | D251: Tunare | E251: Antonius Bayle | F251: 1835 | G251: 1043 | H251: 3815 | I251: 339 | J251: 9 | K251: 3 | L251: =SUM(F251:K251) -> 7044 | M251: =SUM(F251/2.096+G251/1.069+H251/3.69+I251/0.465+J251/0.005+K251/0.002) -> 6914.0628999834498
A252: Myriella | B252: 60 | C252: Human | D252: Mithaniel Marr | E252: Tribunal | F252: 2140 | G252: 1044 | H252: 3719 | I252: 404 | J252: 3 | K252: 5 | L252: =SUM(F252:K252) -> 7315 | M252: =SUM(F252/2.096+G252/1.069+H252/3.69+I252/0.465+J252/0.005+K252/0.002) -> 6974.282306928023
A253: Ladimor | B253: 60 | C253: High Elf | D253: Tunare | E253: Bristlebane | F253: 1994 | G253: 995 | H253: 3527 | I253: 588 | J253: 2 | K253: 5 | L253: =SUM(F253:K253) -> 7111 | M253: =SUM(F253/2.096+G253/1.069+H253/3.69+I253/0.465+J253/0.005+K253/0.002) -> 7002.4549917273216
A254: Luminent | B254: 60 | C254: High Elf | D254: Tunare | E254: Antonius Bayle | F254: 1864 | G254: 1105 | H254: 3565 | I254: 518 | J254: 5 | K254: 4 | L254: =SUM(F254:K254) -> 7061 | M254: =SUM(F254/2.096+G254/1.069+H254/3.69+I254/0.465+J254/0.005+K254/0.002) -> 7003.0924659910206
A255: Thistleburr | B255: 60 | C255: Halfling | D255: Bristlebane | E255: Tribunal | F255: 2386 | G255: 1141 | H255: 3845 | I255: 573 | J255: 8 | K255: 2 | L255: =SUM(F255:K255) -> 7955 | M255: =SUM(F255/2.096+G255/1.069+H255/3.69+I255/0.465+J255/0.005+K255/0.002) -> 7079.9749292393144
A256: Corunthia | B256: 60 | C256: Dwarf | D256: Brell Serilis | E256: Bristlebane | F256: 2330 | G256: 1077 | H256: 3825 | I256: 658 | J256: 8 | K256: 2 | L256: =SUM(F256:K256) -> 7900 | M256: =SUM(F256/2.096+G256/1.069+H256/3.69+I256/0.465+J256/0.005+K256/0.002) -> 7170.7639802289013
A257: Cayleu | B257: 60 | C257: High Elf | D257: Tunare | E257: Luclin | F257: 2036 | G257: 1111 | H257: 3775 | I257: 490 | J257: 3 | K257: 5 | L257: =SUM(F257:K257) -> 7420 | M257: =SUM(F257/2.096+G257/1.069+H257/3.69+I257/0.465+J257/0.005+K257/0.002) -> 7187.4617722058138
A258: Swiri | B258: 60 | C258: High Elf | D258: Tunare | E258: Tunare | F258: 2694 | G258: 1164 | H258: 4250 | I258: 776 | J258: 10 | K258: 0 | L258: =SUM(F258:K258) -> 8894 | M258: =SUM(F258/2.096+G258/1.069+H258/3.69+I258/0.465+J258/0.005+K258/0.002) -> 7194.7521664567003
A259: Mariaa | B259: 60 | C259: High Elf | D259: Tunare | E259: Xegony | F259: 2599 | G259: 624 | H259: 4140 | I259: 549 | J259: 8 | K259: 3 | L259: =SUM(F259:K259) -> 7923 | M259: =SUM(F259/2.096+G259/1.069+H259/3.69+I259/0.465+J259/0.005+K259/0.002) -> 7226.3004025393193
A260: Aiyre | B260: 60 | C260: High Elf | D260: Tunare | E260: Druzzil Ro | F260: 2071 | G260: 1072 | H260: 3820 | I260: 518 | J260: 8 | K260: 3 | L260: =SUM(F260:K260) -> 7492 | M260: =SUM(F260/2.096+G260/1.069+H260/3.69+I260/0.465+J260/0.005+K260/0.002) -> 7240.0877270962746
A261: Laldianne | B261: 60 | C261: High Elf | D261: Tunare | E261: Torvonnilous | F261: 2252 | G261: 1129 | H261: 3735 | I261: 523 | J261: 8 | K261: 3 | L261: =SUM(F261:K261) -> 7650 | M261: =SUM(F261/2.096+G261/1.069+H261/3.69+I261/0.465+J261/0.005+K261/0.002) -> 7367.4810073654744
A262: Joraca | B262: 60 | C262: High Elf | D262: Tunare | E262: Torvonnilous | F262: 2428 | G262: 1138 | H262: 3970 | I262: 683 | J262: 13 | K262: 0 | L262: =SUM(F262:K262) -> 8232 | M262: =SUM(F262/2.096+G262/1.069+H262/3.69+I262/0.465+J262/0.005+K262/0.002) -> 7367.6412146314533
A263: Keleios | B263: 60 | C263: Halfling | D263: Bristlebane | E263: Vazaelle | F263: 2226 | G263: 1126 | H263: 3925 | I263: 541 | J263: 8 | K263: 3 | L263: =SUM(F263:K263) -> 7829 | M263: =SUM(F263/2.096+G263/1.069+H263/3.69+I263/0.465+J263/0.005+K263/0.002) -> 7442.4702584521801
A264: Jubal | B264: 60 | C264: High Elf | D264: Tunare | E264: Torvonnilous | F264: 2017 | G264: 1099 | H264: 3910 | I264: 430 | J264: 5 | K264: 5 | L264: =SUM(F264:K264) -> 7466 | M264: =SUM(F264/2.096+G264/1.069+H264/3.69+I264/0.465+J264/0.005+K264/0.002) -> 7474.7245501582674
A265: Nasren | B265: 60 | C265: Gnome | D265: Bristlebane | E265: Brell Serilis | F265: 2043 | G265: 1111 | H265: 3925 | I265: 655 | J265: 8 | K265: 3 | L265: =SUM(F265:K265) -> 7745 | M265: =SUM(F265/2.096+G265/1.069+H265/3.69+I265/0.465+J265/0.005+K265/0.002) -> 7586.2905830437867
A266: Aliudyen | B266: 60 | C266: Human | D266: Mithaniel Marr | E266: Cazic-Thule | F266: 2782 | G266: 1233 | H266: 4315 | I266: 622 | J266: 13 | K266: 0 | L266: =SUM(F266:K266) -> 8965 | M266: =SUM(F266/2.096+G266/1.069+H266/3.69+I266/0.465+J266/0.005+K266/0.002) -> 7587.7155846918704
A267: Medik | B267: 60 | C267: Erudite | D267: Quellious | E267: Xev | F267: 2340 | G267: 1126 | H267: 4070 | I267: 519 | J267: 11 | K267: 2 | L267: =SUM(F267:K267) -> 8068 | M267: =SUM(F267/2.096+G267/1.069+H267/3.69+I267/0.465+J267/0.005+K267/0.002) -> 7588.8431364262196
A268: Areina | B268: 60 | C268: Dark Elf | D268: Innoruuk | E268: Mithaniel Marr | F268: 2100 | G268: 1038 | H268: 3612 | I268: 449 | J268: 11 | K268: 3 | L268: =SUM(F268:K268) -> 7213 | M268: =SUM(F268/2.096+G268/1.069+H268/3.69+I268/0.465+J268/0.005+K268/0.002) -> 7617.3625188676087
A269: Immune | B269: 60 | C269: Dark Elf | D269: Innoruuk | E269: Antonius Bayle | F269: 2546 | G269: 1078 | H269: 3930 | I269: 602 | J269: 8 | K269: 3 | L269: =SUM(F269:K269) -> 8167 | M269: =SUM(F269/2.096+G269/1.069+H269/3.69+I269/0.465+J269/0.005+K269/0.002) -> 7682.7780460644108
A270: Johann | B270: 60 | C270: Dwarf | D270: Brell Serilis | E270: Xegony | F270: 2294 | G270: 1004 | H270: 3940 | I270: 427 | J270: 11 | K270: 3 | L270: =SUM(F270:K270) -> 7679 | M270: =SUM(F270/2.096+G270/1.069+H270/3.69+I270/0.465+J270/0.005+K270/0.002) -> 7719.6914060764739
A271: Thuel | B271: 60 | C271: Dwarf | D271: Brell Serilis | E271: Xegony | F271: 2934 | G271: 1233 | H271: 4055 | I271: 625 | J271: 9 | K271: 2 | L271: =SUM(F271:K271) -> 8858 | M271: =SUM(F271/2.096+G271/1.069+H271/3.69+I271/0.465+J271/0.005+K271/0.002) -> 7796.2255769575149
A272: Sylvia | B272: 60 | C272: Erudite | D272: Cazic Thule | E272: Druzzil Ro | F272: 2520 | G272: 1059 | H272: 4090 | I272: 619 | J272: 9 | K272: 3 | L272: =SUM(F272:K272) -> 8300 | M272: =SUM(F272/2.096+G272/1.069+H272/3.69+I272/0.465+J272/0.005+K272/0.002) -> 7932.5194190952216
A273: Bramyanea | B273: 60 | C273: Dark Elf | D273: Innoruuk | E273: Bristlebane | F273: 2513 | G273: 1138 | H273: 4005 | I273: 558 | J273: 12 | K273: 2 | L273: =SUM(F273:K273) -> 8228 | M273: =SUM(F273/2.096+G273/1.069+H273/3.69+I273/0.465+J273/0.005+K273/0.002) -> 7948.8625402958305
A274: Slaani | B274: 60 | C274: High Elf | D274: Tunare | E274: Antonius Bayle | F274: 2738 | G274: 1183 | H274: 4120 | I274: 556 | J274: 9 | K274: 3 | L274: =SUM(F274:K274) -> 8609 | M274: =SUM(F274/2.096+G274/1.069+H274/3.69+I274/0.465+J274/0.005+K274/0.002) -> 8025.1695212012992
A275: Kanroc | B275: 60 | C275: Dwarf | D275: Brell Serilis | E275: Povar | F275: 2427 | G275: 996 | H275: 3597 | I275: 418 | J275: 13 | K275: 3 | L275: =SUM(F275:K275) -> 7454 | M275: =SUM(F275/2.096+G275/1.069+H275/3.69+I275/0.465+J275/0.005+K275/0.002) -> 8063.3532067404467
A276: Serina | B276: 60 | C276: High Elf | D276: Tunare | E276: Bertoxxulous | F276: 2941 | G276: 1223 | H276: 4345 | I276: 582 | J276: 8 | K276: 3 | L276: =SUM(F276:K276) -> 9102 | M276: =SUM(F276/2.096+G276/1.069+H276/3.69+I276/0.465+J276/0.005+K276/0.002) -> 8076.3284022918724
A277: Arturo | B277: 60 | C277: Human | D277: Mithaniel Marr | E277: Bristlebane | F277: 2711 | G277: 1089 | H277: 4110 | I277: 646 | J277: 9 | K277: 3 | L277: =SUM(F277:K277) -> 8568 | M277: =SUM(F277/2.096+G277/1.069+H277/3.69+I277/0.465+J277/0.005+K277/0.002) -> 8115.193554474532
A278: Kegwell | B278: 60 | C278: Dwarf | D278: Brell Serilis | E278: Xegony | F278: 2506 | G278: 1281 | H278: 3790 | I278: 718 | J278: 16 | K278: 0 | L278: =SUM(F278:K278) -> 8311 | M278: =SUM(F278/2.096+G278/1.069+H278/3.69+I278/0.465+J278/0.005+K278/0.002) -> 8165.1131628799121
A279: Rosalinde | B279: 60 | C279: High Elf | D279: Tunare | E279: Antonius Bayle | F279: 2389 | G279: 1048 | H279: 3535 | I279: 397 | J279: 9 | K279: 5 | L279: =SUM(F279:K279) -> 7383 | M279: =SUM(F279/2.096+G279/1.069+H279/3.69+I279/0.465+J279/0.005+K279/0.002) -> 8231.9035695460079
A280: Crystali | B280: 60 | C280: High Elf | D280: Tunare | E280: Morell-Thule | F280: 2462 | G280: 1201 | H280: 4090 | I280: 606 | J280: 13 | K280: 2 | L280: =SUM(F280:K280) -> 8374 | M280: =SUM(F280/2.096+G280/1.069+H280/3.69+I280/0.465+J280/0.005+K280/0.002) -> 8309.725098818697
A281: Atro | B281: 60 | C281: High Elf | D281: Tunare | E281: Tribunal | F281: 2162 | G281: 1223 | H281: 3740 | I281: 530 | J281: 8 | K281: 5 | L281: =SUM(F281:K281) -> 7668 | M281: =SUM(F281/2.096+G281/1.069+H281/3.69+I281/0.465+J281/0.005+K281/0.002) -> 8428.8835003927179
A282: Amberel | B282: 60 | C282: High Elf | D282: Tunare | E282: Druzzil Ro | F282: 3018 | G282: 1214 | H282: 4385 | I282: 706 | J282: 9 | K282: 3 | L282: =SUM(F282:K282) -> 9335 | M282: =SUM(F282/2.096+G282/1.069+H282/3.69+I282/0.465+J282/0.005+K282/0.002) -> 8582.152735325617
A283: Reymi | B283: 60 | C283: High Elf | D283: Tunare | E283: Vallon Zek | F283: 2103 | G283: 1074 | H283: 4040 | I283: 637 | J283: 9 | K283: 5 | L283: =SUM(F283:K283) -> 7868 | M283: =SUM(F283/2.096+G283/1.069+H283/3.69+I283/0.465+J283/0.005+K283/0.002) -> 8772.7603847594637
A284: Ceridwen | B284: 60 | C284: High Elf | D284: Tunare | E284: Beroxxulous | F284: 2793 | G284: 1188 | H284: 4185 | I284: 702 | J284: 11 | K284: 3 | L284: =SUM(F284:K284) -> 8882 | M284: =SUM(F284/2.096+G284/1.069+H284/3.69+I284/0.465+J284/0.005+K284/0.002) -> 8787.6809184671947
A285: Ebonlass | B285: 60 | C285: Dark Elf | D285: Innoruuk | E285: Tunare | F285: 2593 | G285: 1147 | H285: 4120 | I285: 613 | J285: 14 | K285: 3 | L285: =SUM(F285:K285) -> 8490 | M285: =SUM(F285/2.096+G285/1.069+H285/3.69+I285/0.465+J285/0.005+K285/0.002) -> 9044.8944440280975
A286: Mikar | B286: 60 | C286: Dwarf | D286: Brell Serilis | E286: Tribunal | F286: 2426 | G286: 1144 | H286: 4085 | I286: 600 | J286: 10 | K286: 5 | L286: =SUM(F286:K286) -> 8270 | M286: =SUM(F286/2.096+G286/1.069+H286/3.69+I286/0.465+J286/0.005+K286/0.002) -> 9124.9704263256262
A287: Pilsburry | B287: 60 | C287: Dwarf | D287: Brell Serilis | E287: Veeshan | F287: 2225 | G287: 1160 | H287: 3850 | I287: 688 | J287: 10 | K287: 5 | L287: =SUM(F287:K287) -> 7938 | M287: =SUM(F287/2.096+G287/1.069+H287/3.69+I287/0.465+J287/0.005+K287/0.002) -> 9169.6024138530029
A288: Eonwe | B288: 60 | C288: High Elf | D288: Tunare | E288: Morell-Thule | F288: 2685 | G288: 1300 | H288: 4395 | I288: 738 | J288: 12 | K288: 3 | L288: =SUM(F288:K288) -> 9133 | M288: =SUM(F288/2.096+G288/1.069+H288/3.69+I288/0.465+J288/0.005+K288/0.002) -> 9175.2549386990577
A289: Delheru | B289: 60 | C289: High Elf | D289: Tunare | E289: Rodcet Nife | F289: 3192 | G289: 1233 | H289: 4380 | I289: 770 | J289: 10 | K289: 4 | L289: =SUM(F289:K289) -> 9589 | M289: =SUM(F289/2.096+G289/1.069+H289/3.69+I289/0.465+J289/0.005+K289/0.002) -> 9519.2210177590059
A290: Alloria | B290: 60 | C290: High Elf | D290: Tunare | E290: Veeshan | F290: 3247 | G290: 1306 | H290: 4535 | I290: 1001 | J290: 17 | K290: 0 | L290: =SUM(F290:K290) -> 10106 | M290: =SUM(F290/2.096+G290/1.069+H290/3.69+I290/0.465+J290/0.005+K290/0.002) -> 9552.5292091149331
A291: Kampf | B291: 60 | C291: Dwarf | D291: Brell Serilis | E291: Cazic-Thule | F291: 2364 | G291: 1063 | H291: 4000 | I291: 496 | J291: 19 | K291: 3 | L291: =SUM(F291:K291) -> 7945 | M291: =SUM(F291/2.096+G291/1.069+H291/3.69+I291/0.465+J291/0.005+K291/0.002) -> 9572.9273800246629
A292: Eclectic | B292: 60 | C292: Halfling | D292: Bristlebane | E292: Nameless | F292: 2893 | G292: 1130 | H292: 4020 | I292: 647 | J292: 17 | K292: 3 | L292: =SUM(F292:K292) -> 8710 | M292: =SUM(F292/2.096+G292/1.069+H292/3.69+I292/0.465+J292/0.005+K292/0.002) -> 9818.1395107719291
A293: Xazy | B293: 60 | C293: Dark Elf | D293: Innoruuk | E293: Morell-Thule | F293: 2360 | G293: 1186 | H293: 3985 | I293: 633 | J293: 20 | K293: 3 | L293: =SUM(F293:K293) -> 8187 | M293: =SUM(F293/2.096+G293/1.069+H293/3.69+I293/0.465+J293/0.005+K293/0.002) -> 10176.638402831846
A294: Qwenya | B294: 60 | C294: High Elf | D294: Tunare | E294: Bristlebane | F294: 2856 | G294: 1204 | H294: 4260 | I294: 720 | J294: 13 | K294: 5 | L294: =SUM(F294:K294) -> 9058 | M294: =SUM(F294/2.096+G294/1.069+H294/3.69+I294/0.465+J294/0.005+K294/0.002) -> 10291.740310167652
A295: Cassiana | B295: 60 | C295: Dark Elf | D295: Innoruuk | E295: Vazaelle | F295: 2762 | G295: 1141 | H295: 4240 | I295: 648 | J295: 16 | K295: 5 | L295: =SUM(F295:K295) -> 8812 | M295: =SUM(F295/2.096+G295/1.069+H295/3.69+I295/0.465+J295/0.005+K295/0.002) -> 10627.700635257763
A296: Smegal | B296: 60 | C296: Dwarf | D296: Brell Serilis | E296: Mithaniel Marr | F296: 2998 | G296: 1221 | H296: 4260 | I296: 722 | J296: 10 | K296: 7 | L296: =SUM(F296:K296) -> 9218 | M296: =SUM(F296/2.096+G296/1.069+H296/3.69+I296/0.465+J296/0.005+K296/0.002) -> 10779.692189855239
A297: Adon | B297: 60 | C297: High Elf | D297: Tunare | E297: Zebuxoruk | F297: 2265 | G297: 1084 | H297: 3773 | I297: 415 | J297: 5 | K297: 12 | L297: =SUM(F297:K297) -> 7554 | M297: =SUM(F297/2.096+G297/1.069+H297/3.69+I297/0.465+J297/0.005+K297/0.002) -> 11009.627919629816
A298: Ryld | B298: 60 | C298: High Elf | D298: Tunare | E298: Prexus | F298: 2803 | G298: 1261 | H298: 4180 | I298: 670 | J298: 19 | K298: 5 | L298: =SUM(F298:K298) -> 8938 | M298: =SUM(F298/2.096+G298/1.069+H298/3.69+I298/0.465+J298/0.005+K298/0.002) -> 11390.567812720468
A299: Arakias | B299: 60 | C299: Dark Elf | D299: Innoruuk | E299: Torconnilous | F299: 3174 | G299: 1255 | H299: 4315 | I299: 710 | J299: 19 | K299: 5 | L299: =SUM(F299:K299) -> 9478 | M299: =SUM(F299/2.096+G299/1.069+H299/3.69+I299/0.465+J299/0.005+K299/0.002) -> 11684.565778574113
A300: Varya | B300: 60 | C300: Dwarf | D300: Brell Serills | E300: Veeshan | F300: 3034 | G300: 1276 | H300: 4475 | I300: 862 | J300: 23 | K300: 5 | L300: =SUM(F300:K300) -> 9675 | M300: =SUM(F300/2.096+G300/1.069+H300/3.69+I300/0.465+J300/0.005+K300/0.002) -> 12807.658567074668
A301: Arele | B301: 60 | C301: High Elf | D301: Tunare | E301: Mithaniel Marr | F301: 3458 | G301: 1374 | H301: 4730 | I301: 935 | J301: 27 | K301: 13 | L301: =SUM(F301:K301) -> 10537 | M301: =SUM(F301/2.096+G301/1.069+H301/3.69+I301/0.465+J301/0.005+K301/0.002) -> 18127.718043893408
A302: Boulvi | B302: 52 | C302: High Elf | D302: Tunare | E302: Povar | F302: 994 | G302: x | H302: 2477 | I302: 169 | J302: 0 | K302: 0
A303: Chaldaea | B303: 60 | C303: Erudite | D303: Quellious | E303: Bertoxxulous | F303: 1892 | G303: x | H303: 3610 | I303: 394 | J303: 1 | K303: 3
A304: Dynarik | B304: 51 | C304: High Elf | D304: Tunare | E304: E'ci | F304: 996 | G304: x | H304: 2328 | I304: 183 | J304: 0 | K304: 0
A305: Etumaru | B305: 52 | C305: Erudite | E305: Erollisi Marr | F305: 1060 | G305: 776 | H305: 2278
A306: Faena | B306: 59 | C306: High Elf | D306: Tunare | E306: Solusek Ro | F306: 1723 | G306: x | H306: 3191 | I306: 354 | J306: 0 | K306: 0
A307: Gvelz | B307: 36 | C307: Dwarf | D307: Brell Serilis | E307: Druzzil Ro | F307: 799 | G307: x | H307: 1256 | I307: 131 | J307: 0 | K307: 0
A308: Immunu | B308: 31 | C308: Erudite | D308: Prexus | E308: Xegony | F308: 624 | G308: x | H308: 1396 | I308: 143 | J308: 0 | K308: 0
A309: Jawn | B309: 32 | C309: Halfling | D309: Bristlebane | E309: Saryn | F309: 666 | G309: x | H309: 1561 | I309: 119 | J309: 0 | K309: 0
A310: Keyal | B310: 53 | C310: Dark Elf | D310: Innoruuk | E310: Xegony | F310: 1162 | G310: x | H310: 2426 | I310: 181 | J310: 0 | K310: 0
A311: Kimbera | B311: 52 | C311: Human | D311: Mithaniel Marr | E311: Povar | F311: 1000 | G311: x | H311: 2222 | I311: 127 | J311: 0 | K311: 0
A312: Laresa | B312: 60 | C312: High Elf | D312: Tunare | E312: Tarew Marr | F312: 1901 | G312: x | H312: 3840 | I312: 389 | J312: 6 | K312: 0
A313: Magada | B313: 59 | C313: High Elf | D313: Tunare | E313: Drinal | F313: 1705 | G313: x | H313: 3555 | I313: 443 | J313: 3 | K313: 0
A314: Minkee | B314: 60 | C314: Dark Elf | D314: Innoruuk | E314: Morell-Thule | F314: 1626 | G314: x | H314: 3039 | I314: 385 | J314: 3 | K314: 0
A315: Mooni | B315: 60 | C315: Halfling | D315: Bristlebane | E315: Rodcet Nife | F315: 1274 | G315: x | H315: 2962 | I315: 269 | J315: 0 | K315: 0
A316: Mystykal | B316: 60 | C316: Human | D316: Rodcet Nife | E316: Zebuxoruk | F316: 1831 | G316: x | H316: 3272 | I316: 340 | J316: 5 | K316: 3
A317: Nayeedah | B317: 51 | C317: Human | D317: Rodcet Nife | E317: Vazaelle | F317: 1049 | G317: x | H317: 2223 | I317: 133 | J317: 0 | K317: 0
A318: Nhyomee | B318: 46 | C318: High Elf | D318: Tunare | E318: Solusek Ro | F318: 971 | G318: x | H318: 2053 | I318: 150 | J318: 0 | K318: 0
A319: Nottall | B319: 60 | C319: Dwarf | D319: Brell Serilis | E319: Povar | F319: 1843 | G319: x | H319: 3500 | I319: 373 | J319: 0 | K319: 0
A320: Seamund | B320: 46 | C320: Dwarf | D320: Brell Serilis | E320: Morell-Thule | F320: 937 | G320: x | H320: 1914 | I320: 130 | J320: 0 | K320: 0
A321: Sindaria | B321: 53 | C321: Dark Elf | D321: Innoruuk | E321: Antonius Bayle | F321: 1113 | G321: x | H321: 2340 | I321: 233 | J321: 0 | K321: 0
A322: Solwene | B322: 60 | C322: High Elf | D322: Tunare | E322: Morell-Thule | F322: 2215 | G322: x | H322: 3960 | I322: 534 | J322: 9 | K322: 3
A323: Torlan | B323: 60 | C323: High Elf | D323: Tunare | E323: Vazaelle | F323: 1772 | G323: 1011 | H323: 3196
A324: Tyrina | B324: 32 | C324: High Elf | D324: Tunare | E324: Morell-Thule | F324: 622 | G324: x | H324: 1358 | I324: 155 | J324: 0 | K324: 0
A325: Woosh | B325: 49 | C325: Erudite | D325: Prexus | E325: Kane Bayle | F325: 984 | G325: x | H325: 1730 | I325: 128 | J325: 0 | K325: 0
E326: Average | F326: =AVERAGE(F40:F325) -> 1755.2412587412587 | G326: =AVERAGE(G40:G325) -> 959.42803030303025 | H326: =AVERAGE(H40:H325) -> 3200.5 | I326: =AVERAGE(I40:I325) -> 374.37323943661971 | J326: =AVERAGE(J40:J325) -> 3.1690140845070425 | K326: =AVERAGE(K40:K325) -> 1.1267605633802817 | L326: =AVERAGE(L40:L325) -> 6406.2633587786258 | M326: =SUM(F326/2+G326+H326/3.5+I326/0.37+J326/0.006+K326/0.25) -> 4295.9728534851774