A1: Name | B1: Effect | C1: Ranking | D1: AC | E1: STR | F1: STA | G1: AGI | H1: DEX | I1: WIS | J1: INT | K1: CHA | L1: HP | M1: MANA | N1: PR | O1: MR | P1: DR | Q1: FR | R1: CR | S1: WT | T1: WP | U1: Type
A2: Woven Grass Greaves | B2: Circle of Misty | C2: =(I2*10)+M2+(D2*4)+G2+(L2/5)+(F2*2)+(E2*2)+(K2*2)+(O2/2)+(Q2/2)+(R2/2)+(N2/4)+(P2/4)+30 -> 266.75 | D2: 9.0 | F2: 5.0 | G2: 6.0 | I2: 9.0 | L2: 20.0 | M2: 90.0 | N2: 3.0 | S2: 4.0 | T2: =0-QUOTIENT(S2,5) -> 0 | U2: legs
A3: Twisted Nature Leggings | B3: Ring of Misty | C3: =(I3*10)+M3+(D3*4)+G3+(L3/5)+(F3*2)+(E3*2)+(K3*2)+(O3/2)+(Q3/2)+(R3/2)+(N3/4)+(P3/4)+30 -> 237.75 | D3: 25.0 | F3: 10.0 | G3: 10.0 | I3: 5.0 | L3: 20.0 | M3: 20.0 | P3: 5.0 | R3: 5.0 | S3: 2.5 | T3: =0-QUOTIENT(S3,5) -> 0 | U3: legs
A4: Nature Walker's Greaves | B4: Circle of Misty | C4: =(I4*10)+M4+(D4*4)+G4+(L4/5)+(F4*2)+(E4*2)+(K4*2)+(O4/2)+(Q4/2)+(R4/2)+(N4/4)+(P4/4)+30 -> 233 | D4: 14.0 | H4: 6.0 | I4: 7.0 | L4: 20.0 | M4: 70.0 | Q4: 3.0 | R4: 3.0 | S4: 4.0 | T4: =0-QUOTIENT(S4,5) -> 0 | U4: legs
A5: Greaves of Harmony | B5: Circle of Misty | C5: =(I5*10)+M5+(D5*4)+G5+(L5/5)+(F5*2)+(E5*2)+(K5*2)+(O5/2)+(Q5/2)+(R5/2)+(N5/4)+(P5/4)+30 -> 228.5 | D5: 10.0 | E5: 6.0 | I5: 8.0 | M5: 65.0 | O5: 3.0 | S5: 4.0 | T5: =0-QUOTIENT(S5,5) -> 0 | U5: legs
A6: Ancient Wurm Hide Greaves | C6: =(I6*10)+M6+(D6*4)+G6+(L6/5)+(F6*2)+(E6*2)+(K6*2)+(O6/2)+(Q6/2)+(R6/2)+(N6/4)+(P6/4) -> 221.5 | D6: 46.0 | F6: 10.0 | L6: 50.0 | Q6: 15.0 | S6: 0.0 | T6: =0-QUOTIENT(S6,5) -> 0 | U6: legs
A7: Elder Spiritist's Greaves | B7: Skin like Diamond | C7: =(I7*10)+M7+(D7*4)+G7+(L7/5)+(F7*2)+(E7*2)+(K7*2)+(O7/2)+(Q7/2)+(R7/2)+(N7/4)+(P7/4)+30 -> 197 | D7: 10.0 | E7: 6.0 | I7: 6.0 | M7: 55.0 | S7: 7.5 | T7: =0-QUOTIENT(S7,5) -> -1 | U7: legs
A8: Rowyl's Greaves of Nature | B8: Circle of Misty | C8: =(I8*10)+M8+(D8*4)+G8+(L8/5)+(F8*2)+(E8*2)+(K8*2)+(O8/2)+(Q8/2)+(R8/2)+(N8/4)+(P8/4) -> 189.5 | D8: 9.0 | E8: 6.0 | I8: 7.0 | M8: 70.0 | R8: 3.0 | S8: 4.0 | T8: =0-QUOTIENT(S8,5) -> 0 | U8: legs
A9: Elysian Leggings | C9: =(I9*10)+M9+(D9*4)+G9+(L9/5)+(F9*2)+(E9*2)+(K9*2)+(O9/2)+(Q9/2)+(R9/2)+(N9/4)+(P9/4) -> 179 | D9: 16 | F9: 15 | I9: 7 | J9: 10 | L9: 50 | R9: 10 | S9: 6 | U9: leg
A10: Ancient Wyvern Hide Leggings | C10: =(I10*10)+M10+(D10*4)+G10+(L10/5)+(F10*2)+(E10*2)+(K10*2)+(O10/2)+(Q10/2)+(R10/2)+(N10/4)+(P10/4) -> 178.75 | D10: 25.0 | E10: 5.0 | F10: 15.0 | G10: 25.0 | L10: 50.0 | P10: 15.0 | S10: 2.0 | T10: =0-QUOTIENT(S10,5) -> 0 | U10: legs
A11: Gladiator's Chain Leggings | C11: =(I11*10)+M11+(D11*4)+G11+(L11/5)+(F11*2)+(E11*2)+(K11*2)+(O11/2)+(Q11/2)+(R11/2)+(N11/4)+(P11/4) -> 149 | D11: 17.0 | E11: 2.0 | I11: 6.0 | K11: 4.0 | L11: 20.0 | O11: 10.0 | S11: 0.0 | T11: =0-QUOTIENT(S11,5) -> 0 | U11: legs
A12: Brown Chitin Leggings | C12: =(I12*10)+M12+(D12*4)+G12+(L12/5)+(F12*2)+(E12*2)+(K12*2)+(O12/2)+(Q12/2)+(R12/2)+(N12/4)+(P12/4) -> 130 | D12: 12 | E12: 5 | I12: 4 | L12: 25 | M12: 25 | P12: 8 | S12: 6.5 | U12: leg
A13: Kromrif Military Leggings | C13: =(I13*10)+M13+(D13*4)+G13+(L13/5)+(F13*2)+(E13*2)+(K13*2)+(O13/2)+(Q13/2)+(R13/2)+(N13/4)+(P13/4) -> 121.75 | D13: 14.0 | E13: 6.0 | I13: 5.0 | P13: 5.0 | R13: 5.0 | S13: 4.0 | T13: =0-QUOTIENT(S13,5) -> 0 | U13: legs
A14: Nathsar Leggings | C14: =(I14*10)+M14+(D14*4)+G14+(L14/5)+(F14*2)+(E14*2)+(K14*2)+(O14/2)+(Q14/2)+(R14/2)+(N14/4)+(P14/4) -> 101.5 | D14: 12.0 | G14: 4.0 | I14: 4.0 | K14: 4.0 | N14: 2.0 | O14: 2.0 | S14: 1.0 | T14: =0-QUOTIENT(S14,5) -> 0 | U14: legs
A15: Crystal Chitin Leggings | C15: =(I15*10)+M15+(D15*4)+G15+(L15/5)+(F15*2)+(E15*2)+(K15*2)+(O15/2)+(Q15/2)+(R15/2)+(N15/4)+(P15/4) -> 95 | D15: 15.0 | F15: 5.0 | M15: 25.0 | S15: 4.0 | T15: =0-QUOTIENT(S15,5) -> 0 | U15: legs
A16: Sun Leggings | C16: =(I16*10)+M16+(D16*4)+G16+(L16/5)+(F16*2)+(E16*2)+(K16*2)+(O16/2)+(Q16/2)+(R16/2)+(N16/4)+(P16/4) -> 93.5 | D16: 10 | I16: 4 | L16: 10 | M16: 10 | Q16: 3 | S16: 2.5 | U16: leg
A17: Earth Blessed Leggings | C17: =(I17*10)+M17+(D17*4)+G17+(L17/5)+(F17*2)+(E17*2)+(K17*2)+(O17/2)+(Q17/2)+(R17/2)+(N17/4)+(P17/4) -> 93.5 | D17: 9 | F17: 3 | H17: 1 | I17: 4 | L17: 5 | M17: 10 | R17: 1 | S17: 1.5 | U17: leg
A18: Vermiculated Leggings | C18: =(I18*10)+M18+(D18*4)+G18+(L18/5)+(F18*2)+(E18*2)+(K18*2)+(O18/2)+(Q18/2)+(R18/2)+(N18/4)+(P18/4) -> 89.75 | D18: 8.0 | E18: 3.0 | I18: 5.0 | N18: 7.0 | S18: 7.0 | T18: =0-QUOTIENT(S18,5) -> -1 | U18: legs
A19: Flayed Paebala Leggings | C19: =(I19*10)+M19+(D19*4)+G19+(L19/5)+(F19*2)+(E19*2)+(K19*2)+(O19/2)+(Q19/2)+(R19/2)+(N19/4)+(P19/4) -> 89 | D19: 15.0 | J19: 6.0 | L19: 20.0 | M19: 20.0 | P19: 20.0 | S19: 2.0 | T19: =0-QUOTIENT(S19,5) -> 0 | U19: legs
A20: Oiled Greaves | C20: =(I20*10)+M20+(D20*4)+G20+(L20/5)+(F20*2)+(E20*2)+(K20*2)+(O20/2)+(Q20/2)+(R20/2)+(N20/4)+(P20/4) -> 83 | D20: 15.0 | E20: 7.0 | L20: 20.0 | M20: 5.0 | S20: 1.5 | T20: =0-QUOTIENT(S20,5) -> 0 | U20: legs
A21: Withered Leather Leggings | C21: =(I21*10)+M21+(D21*4)+G21+(L21/5)+(F21*2)+(E21*2)+(K21*2)+(O21/2)+(Q21/2)+(R21/2)+(N21/4)+(P21/4) -> 79.5 | D21: 6.0 | G21: 8.0 | I21: 4.0 | M21: 5.0 | P21: 10.0 | S21: 4.0 | T21: =0-QUOTIENT(S21,5) -> 0 | U21: legs
A22: Grey Flesh Trousers | C22: =(I22*10)+M22+(D22*4)+G22+(L22/5)+(F22*2)+(E22*2)+(K22*2)+(O22/2)+(Q22/2)+(R22/2)+(N22/4)+(P22/4) -> 72.5 | D22: 7 | L22: 35 | M22: 35 | R22: 5 | S22: 1 | U22: leg
A23: Cobalt Drake Leggings | C23: =(I23*10)+M23+(D23*4)+G23+(L23/5)+(F23*2)+(E23*2)+(K23*2)+(O23/2)+(Q23/2)+(R23/2)+(N23/4)+(P23/4) -> 71 | D23: 9.0 | K23: 3.0 | M23: 25.0 | R23: 8.0 | S23: 4.0 | T23: =0-QUOTIENT(S23,5) -> 0 | U23: legs
A24: Gatorscale Leggings | C24: =(I24*10)+M24+(D24*4)+G24+(L24/5)+(F24*2)+(E24*2)+(K24*2)+(O24/2)+(Q24/2)+(R24/2)+(N24/4)+(P24/4) -> 71 | D24: 7.0 | I24: 4.0 | L24: 15.0 | S24: 00.4 | T24: =0-QUOTIENT(S24,5) -> 0 | U24: legs
A25: Golden Efreeti Greaves | C25: =(I25*10)+M25+(D25*4)+G25+(L25/5)+(F25*2)+(E25*2)+(K25*2)+(O25/2)+(Q25/2)+(R25/2)+(N25/4)+(P25/4) -> 69 | D25: 15.0 | G25: 9.0 | H25: 10.0 | S25: 5.6 | T25: =0-QUOTIENT(S25,5) -> -1 | U25: legs
A26: Imbued Elven Chainmail Leggings | C26: =(I26*10)+M26+(D26*4)+G26+(L26/5)+(F26*2)+(E26*2)+(K26*2)+(O26/2)+(Q26/2)+(R26/2)+(N26/4)+(P26/4) -> 68 | D26: 8.0 | I26: 3.0 | J26: 3.0 | K26: 2.0 | O26: 4.0 | S26: 1.0 | T26: =0-QUOTIENT(S26,5) -> 0 | U26: legs
A27: Enduring Pants | C27: =(I27*10)+M27+(D27*4)+G27+(L27/5)+(F27*2)+(E27*2)+(K27*2)+(O27/2)+(Q27/2)+(R27/2)+(N27/4)+(P27/4) -> 67.5 | D27: 10 | F27: 10 | L27: 30 | N27: 3 | P27: 3 | S27: 1.5 | U27: leg
A28: Imbued Mithril Reinforced Leggings | C28: =(I28*10)+M28+(D28*4)+G28+(L28/5)+(F28*2)+(E28*2)+(K28*2)+(O28/2)+(Q28/2)+(R28/2)+(N28/4)+(P28/4) -> 58 | D28: 8.0 | I28: 2.0 | K28: 3.0 | S28: 3.0 | T28: =0-QUOTIENT(S28,5) -> 0 | U28: legs
A29: Imbued Vale Reinforced Pants (K) | C29: =(I29*10)+M29+(D29*4)+G29+(L29/5)+(F29*2)+(E29*2)+(K29*2)+(O29/2)+(Q29/2)+(R29/2)+(N29/4)+(P29/4) -> 58 | D29: 8.0 | F29: 3.0 | I29: 2.0 | S29: 3.0 | T29: =0-QUOTIENT(S29,5) -> 0 | U29: legs
A30: Pristine Studded Leather Leggings | C30: =(I30*10)+M30+(D30*4)+G30+(L30/5)+(F30*2)+(E30*2)+(K30*2)+(O30/2)+(Q30/2)+(R30/2)+(N30/4)+(P30/4) -> 58 | D30: 12.0 | F30: 5.0 | H30: 2.0 | S30: 5.0 | T30: =0-QUOTIENT(S30,5) -> -1 | U30: legs
A31: Enchanted Elven Chainmail Leggings | C31: =(I31*10)+M31+(D31*4)+G31+(L31/5)+(F31*2)+(E31*2)+(K31*2)+(O31/2)+(Q31/2)+(R31/2)+(N31/4)+(P31/4) -> 54 | D31: 8.0 | I31: 2.0 | J31: 2.0 | O31: 4.0 | S31: 1.0 | T31: =0-QUOTIENT(S31,5) -> 0 | U31: legs
A32: Imbued Mithril Studded Leggings | C32: =(I32*10)+M32+(D32*4)+G32+(L32/5)+(F32*2)+(E32*2)+(K32*2)+(O32/2)+(Q32/2)+(R32/2)+(N32/4)+(P32/4) -> 54 | D32: 7.0 | I32: 2.0 | K32: 3.0 | S32: 3.0 | T32: =0-QUOTIENT(S32,5) -> 0 | U32: legs
A33: Imbued Vale Studded Leggings (K) | C33: =(I33*10)+M33+(D33*4)+G33+(L33/5)+(F33*2)+(E33*2)+(K33*2)+(O33/2)+(Q33/2)+(R33/2)+(N33/4)+(P33/4) -> 54 | D33: 7.0 | F33: 3.0 | I33: 2.0 | S33: 3.0 | T33: =0-QUOTIENT(S33,5) -> 0 | U33: legs
A34: Ice Weave | C34: =(I34*10)+M34+(D34*4)+G34+(L34/5)+(F34*2)+(E34*2)+(K34*2)+(O34/2)+(Q34/2)+(R34/2)+(N34/4)+(P34/4) -> 52 | D34: 9.0 | E34: 8.0 | S34: 3.0 | T34: =0-QUOTIENT(S34,5) -> 0 | U34: legs
A35: Hardy Pants | C35: =(I35*10)+M35+(D35*4)+G35+(L35/5)+(F35*2)+(E35*2)+(K35*2)+(O35/2)+(Q35/2)+(R35/2)+(N35/4)+(P35/4) -> 45 | D35: 8 | F35: 5 | L35: 15 | S35: 1 | U35: leg
A36: Elusive Pantaloons | C36: =(I36*10)+M36+(D36*4)+G36+(L36/5)+(F36*2)+(E36*2)+(K36*2)+(O36/2)+(Q36/2)+(R36/2)+(N36/4)+(P36/4) -> 44 | D36: 10 | G36: 4 | H36: 4 | J36: 2 | S36: 2.3 | U36: pants
A37: Ulthork Hide Legs | C37: =(I37*10)+M37+(D37*4)+G37+(L37/5)+(F37*2)+(E37*2)+(K37*2)+(O37/2)+(Q37/2)+(R37/2)+(N37/4)+(P37/4) -> 42 | D37: 9.0 | J37: -3.0 | K37: 3.0 | S37: 4.0 | T37: =0-QUOTIENT(S37,5) -> 0 | U37: legs
A38: Netted Kelp Pantaloons | C38: =(I38*10)+M38+(D38*4)+G38+(L38/5)+(F38*2)+(E38*2)+(K38*2)+(O38/2)+(Q38/2)+(R38/2)+(N38/4)+(P38/4) -> 41 | D38: 6.0 | E38: 6.0 | F38: 8.0 | J38: 6.0 | K38: -8.0 | Q38: 10.0 | S38: 00.7 | T38: =0-QUOTIENT(S38,5) -> 0 | U38: legs
A39: Black Chitin Leggings | C39: =(I39*10)+M39+(D39*4)+G39+(L39/5)+(F39*2)+(E39*2)+(K39*2)+(O39/2)+(Q39/2)+(R39/2)+(N39/4)+(P39/4) -> 40 | D39: 7.0 | L39: 10.0 | M39: 10.0 | S39: 7.5 | T39: =0-QUOTIENT(S39,5) -> -1 | U39: legs
A40: Tishan's Kilt | C40: =(I40*10)+M40+(D40*4)+G40+(L40/5)+(F40*2)+(E40*2)+(K40*2)+(O40/2)+(Q40/2)+(R40/2)+(N40/4)+(P40/4) -> 40 | D40: 5.0 | E40: 4.0 | F40: 4.0 | L40: 20.0 | S40: 00.8 | T40: =0-QUOTIENT(S40,5) -> 0 | U40: legs
A41: Prowling Leopard Leggings | C41: =(I41*10)+M41+(D41*4)+G41+(L41/5)+(F41*2)+(E41*2)+(K41*2)+(O41/2)+(Q41/2)+(R41/2)+(N41/4)+(P41/4) -> 38 | D41: 6.0 | F41: 3.0 | G41: 8.0 | S41: 00.4 | T41: =0-QUOTIENT(S41,5) -> 0 | U41: legs
A42: Drakkel Wolfhide Leggings | C42: =(I42*10)+M42+(D42*4)+G42+(L42/5)+(F42*2)+(E42*2)+(K42*2)+(O42/2)+(Q42/2)+(R42/2)+(N42/4)+(P42/4) -> 37 | D42: 9.0 | R42: 2.0 | S42: 00.1 | T42: =0-QUOTIENT(S42,5) -> 0 | U42: legs
A43: Hand Woven Leggings | C43: =(I43*10)+M43+(D43*4)+G43+(L43/5)+(F43*2)+(E43*2)+(K43*2)+(O43/2)+(Q43/2)+(R43/2)+(N43/4)+(P43/4) -> 37 | D43: 8.0 | Q43: 10.0 | S43: 3.0 | T43: =0-QUOTIENT(S43,5) -> 0 | U43: legs
A44: Coterie Leggings | C44: =(I44*10)+M44+(D44*4)+G44+(L44/5)+(F44*2)+(E44*2)+(K44*2)+(O44/2)+(Q44/2)+(R44/2)+(N44/4)+(P44/4) -> 36.3 | D44: 8 | E44: 1 | G44: 2 | L44: 9 | Q44: -3 | S44: 4 | U44: leg
A45: Carrion Bettle Leggings | C45: =(I45*10)+M45+(D45*4)+G45+(L45/5)+(F45*2)+(E45*2)+(K45*2)+(O45/2)+(Q45/2)+(R45/2)+(N45/4)+(P45/4) -> 35.5 | D45: 7.0 | G45: 5.0 | N45: 5.0 | P45: 5.0 | S45: 3.0 | T45: =0-QUOTIENT(S45,5) -> 0 | U45: legs
A46: Otterhide Leggings | C46: =(I46*10)+M46+(D46*4)+G46+(L46/5)+(F46*2)+(E46*2)+(K46*2)+(O46/2)+(Q46/2)+(R46/2)+(N46/4)+(P46/4) -> 34.5 | D46: 8.0 | R46: 5.0 | S46: 2.0 | T46: =0-QUOTIENT(S46,5) -> 0 | U46: legs
A47: Scaled Wolf Hide Leggings | C47: =(I47*10)+M47+(D47*4)+G47+(L47/5)+(F47*2)+(E47*2)+(K47*2)+(O47/2)+(Q47/2)+(R47/2)+(N47/4)+(P47/4) -> 33 | D47: 7.0 | Q47: 5.0 | R47: 5.0 | S47: 4.0 | T47: =0-QUOTIENT(S47,5) -> 0 | U47: legs
A48: Mammoth Hide Leggings | C48: =(I48*10)+M48+(D48*4)+G48+(L48/5)+(F48*2)+(E48*2)+(K48*2)+(O48/2)+(Q48/2)+(R48/2)+(N48/4)+(P48/4) -> 32.5 | D48: 6.0 | F48: 3.0 | R48: 5.0 | S48: 4.0 | T48: =0-QUOTIENT(S48,5) -> 0 | U48: legs
A49: Tizmak Leggings | C49: =(I49*10)+M49+(D49*4)+G49+(L49/5)+(F49*2)+(E49*2)+(K49*2)+(O49/2)+(Q49/2)+(R49/2)+(N49/4)+(P49/4) -> 32 | D49: 8.0 | S49: 4.0 | T49: =0-QUOTIENT(S49,5) -> 0 | U49: legs
A50: Vale Reinforced Pants | C50: =(I50*10)+M50+(D50*4)+G50+(L50/5)+(F50*2)+(E50*2)+(K50*2)+(O50/2)+(Q50/2)+(R50/2)+(N50/4)+(P50/4) -> 32 | D50: 8.0 | S50: 3.0 | T50: =0-QUOTIENT(S50,5) -> 0 | U50: legs
A51: Bone Legplates | C51: =(I51*10)+M51+(D51*4)+G51+(L51/5)+(F51*2)+(E51*2)+(K51*2)+(O51/2)+(Q51/2)+(R51/2)+(N51/4)+(P51/4) -> 30 | D51: 6.0 | F51: 5.0 | G51: -4.0 | S51: 6.0 | T51: =0-QUOTIENT(S51,5) -> -1 | U51: legs
A52: Drake-hide Leggings | C52: =(I52*10)+M52+(D52*4)+G52+(L52/5)+(F52*2)+(E52*2)+(K52*2)+(O52/2)+(Q52/2)+(R52/2)+(N52/4)+(P52/4) -> 30 | D52: 5.0 | H52: 5.0 | K52: 5.0 | S52: 00.1 | T52: =0-QUOTIENT(S52,5) -> 0 | U52: legs
A53: Feathered Leggings | C53: =(I53*10)+M53+(D53*4)+G53+(L53/5)+(F53*2)+(E53*2)+(K53*2)+(O53/2)+(Q53/2)+(R53/2)+(N53/4)+(P53/4) -> 30 | D53: 4.0 | F53: 7.0 | S53: 2.0 | T53: =0-QUOTIENT(S53,5) -> 0 | U53: legs
A54: Spore Covered Leggings | C54: =(I54*10)+M54+(D54*4)+G54+(L54/5)+(F54*2)+(E54*2)+(K54*2)+(O54/2)+(Q54/2)+(R54/2)+(N54/4)+(P54/4) -> 29 | D54: 7 | R54: 2 | S54: 00.4 | U54: leg
A55: Burynai Hide Leggings | C55: =(I55*10)+M55+(D55*4)+G55+(L55/5)+(F55*2)+(E55*2)+(K55*2)+(O55/2)+(Q55/2)+(R55/2)+(N55/4)+(P55/4) -> 28 | D55: 6.0 | H55: 2.0 | K55: 2.0 | S55: 4.5 | T55: =0-QUOTIENT(S55,5) -> 0 | U55: legs
A56: Dark Muslin Leggings | C56: =(I56*10)+M56+(D56*4)+G56+(L56/5)+(F56*2)+(E56*2)+(K56*2)+(O56/2)+(Q56/2)+(R56/2)+(N56/4)+(P56/4) -> 28 | D56: 7.0 | S56: 00.7 | T56: =0-QUOTIENT(S56,5) -> 0 | U56: legs
A57: Elven Chainmail Leggings | C57: =(I57*10)+M57+(D57*4)+G57+(L57/5)+(F57*2)+(E57*2)+(K57*2)+(O57/2)+(Q57/2)+(R57/2)+(N57/4)+(P57/4) -> 28 | D57: 7.0 | S57: 2.0 | T57: =0-QUOTIENT(S57,5) -> 0 | U57: legs
A58: Mithril Studded Pants | C58: =(I58*10)+M58+(D58*4)+G58+(L58/5)+(F58*2)+(E58*2)+(K58*2)+(O58/2)+(Q58/2)+(R58/2)+(N58/4)+(P58/4) -> 28 | D58: 7.0 | S58: 3.0 | T58: =0-QUOTIENT(S58,5) -> 0 | U58: legs
A59: Vale Studded Pants | C59: =(I59*10)+M59+(D59*4)+G59+(L59/5)+(F59*2)+(E59*2)+(K59*2)+(O59/2)+(Q59/2)+(R59/2)+(N59/4)+(P59/4) -> 28 | D59: 7.0 | S59: 3.0 | T59: =0-QUOTIENT(S59,5) -> 0 | U59: legs
A60: Reinforced Leggings | C60: =(I60*10)+M60+(D60*4)+G60+(L60/5)+(F60*2)+(E60*2)+(K60*2)+(O60/2)+(Q60/2)+(R60/2)+(N60/4)+(P60/4) -> 24 | D60: 6.0 | S60: 4.0 | T60: =0-QUOTIENT(S60,5) -> 0 | U60: legs
A61: Shaded Leggings | C61: =(I61*10)+M61+(D61*4)+G61+(L61/5)+(F61*2)+(E61*2)+(K61*2)+(O61/2)+(Q61/2)+(R61/2)+(N61/4)+(P61/4) -> 24 | D61: 6 | S61: 1 | U61: leg
A62: Shaded Leggings | C62: =(I62*10)+M62+(D62*4)+G62+(L62/5)+(F62*2)+(E62*2)+(K62*2)+(O62/2)+(Q62/2)+(R62/2)+(N62/4)+(P62/4) -> 24 | D62: 6 | S62: 1 | U62: leg
A63: Xakra Kel Pants | C63: =(I63*10)+M63+(D63*4)+G63+(L63/5)+(F63*2)+(E63*2)+(K63*2)+(O63/2)+(Q63/2)+(R63/2)+(N63/4)+(P63/4) -> 24 | D63: 6 | S63: 00.4 | U63: leg
A64: Silversilk Leggings | C64: =(I64*10)+M64+(D64*4)+G64+(L64/5)+(F64*2)+(E64*2)+(K64*2)+(O64/2)+(Q64/2)+(R64/2)+(N64/4)+(P64/4) -> 22.4 | D64: 4.0 | G64: 4.0 | L64: 12.0 | S64: 00.7 | T64: =0-QUOTIENT(S64,5) -> 0 | U64: legs
A65: Gnome Skin Leggings | C65: =(I65*10)+M65+(D65*4)+G65+(L65/5)+(F65*2)+(E65*2)+(K65*2)+(O65/2)+(Q65/2)+(R65/2)+(N65/4)+(P65/4) -> 21.25 | D65: 5.0 | N65: 5.0 | S65: 1.0 | T65: =0-QUOTIENT(S65,5) -> 0 | U65: legs
A66: Large Leather Kilt | C66: =(I66*10)+M66+(D66*4)+G66+(L66/5)+(F66*2)+(E66*2)+(K66*2)+(O66/2)+(Q66/2)+(R66/2)+(N66/4)+(P66/4) -> 20 | D66: 5.0 | S66: 5.0 | T66: =0-QUOTIENT(S66,5) -> -1 | U66: legs
A67: Leather Leggings | C67: =(I67*10)+M67+(D67*4)+G67+(L67/5)+(F67*2)+(E67*2)+(K67*2)+(O67/2)+(Q67/2)+(R67/2)+(N67/4)+(P67/4) -> 20 | D67: 5.0 | S67: 4.0 | T67: =0-QUOTIENT(S67,5) -> 0 | U67: legs
A68: Mesh Leggings | C68: =(I68*10)+M68+(D68*4)+G68+(L68/5)+(F68*2)+(E68*2)+(K68*2)+(O68/2)+(Q68/2)+(R68/2)+(N68/4)+(P68/4) -> 20 | D68: 5.0 | S68: 0.5 | T68: =0-QUOTIENT(S68,5) -> 0 | U68: legs
A69: Soft Wicker Leggings | C69: =(I69*10)+M69+(D69*4)+G69+(L69/5)+(F69*2)+(E69*2)+(K69*2)+(O69/2)+(Q69/2)+(R69/2)+(N69/4)+(P69/4) -> 20 | D69: 5.0 | S69: 6.0 | T69: =0-QUOTIENT(S69,5) -> -1 | U69: legs
A70: Warthread Kilt | C70: =(I70*10)+M70+(D70*4)+G70+(L70/5)+(F70*2)+(E70*2)+(K70*2)+(O70/2)+(Q70/2)+(R70/2)+(N70/4)+(P70/4) -> 20 | D70: 5.0 | S70: 1.0 | T70: =0-QUOTIENT(S70,5) -> 0 | U70: legs
A71: Hopperhide Leggings | C71: =(I71*10)+M71+(D71*4)+G71+(L71/5)+(F71*2)+(E71*2)+(K71*2)+(O71/2)+(Q71/2)+(R71/2)+(N71/4)+(P71/4) -> 20 | D71: 5 | S71: 4 | U71: leg
A72: Fungal Field Membrane Legs | C72: =(I72*10)+M72+(D72*4)+G72+(L72/5)+(F72*2)+(E72*2)+(K72*2)+(O72/2)+(Q72/2)+(R72/2)+(N72/4)+(P72/4) -> 20 | D72: 5 | S72: 00.4 | U72: leg
A73: Giant Scalemail Leggings | C73: =(I73*10)+M73+(D73*4)+G73+(L73/5)+(F73*2)+(E73*2)+(K73*2)+(O73/2)+(Q73/2)+(R73/2)+(N73/4)+(P73/4) -> 18 | D73: 11.0 | I73: -3.0 | J73: 3.0 | L73: 20.0 | S73: 11.0 | T73: =0-QUOTIENT(S73,5) -> -2 | U73: legs
A74: Crystalline Silk Pantaloons | C74: =(I74*10)+M74+(D74*4)+G74+(L74/5)+(F74*2)+(E74*2)+(K74*2)+(O74/2)+(Q74/2)+(R74/2)+(N74/4)+(P74/4) -> 17.5 | D74: 4.0 | O74: 3.0 | S74: 00.1 | T74: =0-QUOTIENT(S74,5) -> 0 | U74: legs
A75: Curscale Leggings | C75: =(I75*10)+M75+(D75*4)+G75+(L75/5)+(F75*2)+(E75*2)+(K75*2)+(O75/2)+(Q75/2)+(R75/2)+(N75/4)+(P75/4) -> 17 | D75: 4.0 | R75: 2.0 | S75: 00.7 | T75: =0-QUOTIENT(S75,5) -> 0 | U75: legs
A76: Patchwork Pants | C76: =(I76*10)+M76+(D76*4)+G76+(L76/5)+(F76*2)+(E76*2)+(K76*2)+(O76/2)+(Q76/2)+(R76/2)+(N76/4)+(P76/4) -> 16 | D76: 4.0 | S76: 4.0 | T76: =0-QUOTIENT(S76,5) -> 0 | U76: legs
A77: Woven Leggings | C77: =(I77*10)+M77+(D77*4)+G77+(L77/5)+(F77*2)+(E77*2)+(K77*2)+(O77/2)+(Q77/2)+(R77/2)+(N77/4)+(P77/4) -> 16 | D77: 4.0 | S77: 00.4 | T77: =0-QUOTIENT(S77,5) -> 0 | U77: legs
A78: Gorilla Hide Leggings | C78: =(I78*10)+M78+(D78*4)+G78+(L78/5)+(F78*2)+(E78*2)+(K78*2)+(O78/2)+(Q78/2)+(R78/2)+(N78/4)+(P78/4) -> 14 | D78: 6.0 | E78: 3.0 | H78: 4.0 | K78: -8.0 | S78: 4.5 | T78: =0-QUOTIENT(S78,5) -> 0 | U78: legs
A79: Flayed Coldain-Skin Leggings | C79: =(I79*10)+M79+(D79*4)+G79+(L79/5)+(F79*2)+(E79*2)+(K79*2)+(O79/2)+(Q79/2)+(R79/2)+(N79/4)+(P79/4) -> 13 | D79: 5.0 | G79: -10.0 | J79: 3.0 | L79: 15.0 | S79: 4.0 | T79: =0-QUOTIENT(S79,5) -> 0 | U79: legs
A80: Cloth Pants | C80: =(I80*10)+M80+(D80*4)+G80+(L80/5)+(F80*2)+(E80*2)+(K80*2)+(O80/2)+(Q80/2)+(R80/2)+(N80/4)+(P80/4) -> 12 | D80: 3.0 | S80: 00.7 | T80: =0-QUOTIENT(S80,5) -> 0 | U80: legs
A81: Dusty Burlap Pants | C81: =(I81*10)+M81+(D81*4)+G81+(L81/5)+(F81*2)+(E81*2)+(K81*2)+(O81/2)+(Q81/2)+(R81/2)+(N81/4)+(P81/4) -> 12 | D81: 3.0 | S81: 00.7 | T81: =0-QUOTIENT(S81,5) -> 0 | U81: legs
A82: Netted Pants | C82: =(I82*10)+M82+(D82*4)+G82+(L82/5)+(F82*2)+(E82*2)+(K82*2)+(O82/2)+(Q82/2)+(R82/2)+(N82/4)+(P82/4) -> 12 | D82: 3.0 | S82: 00.4 | T82: =0-QUOTIENT(S82,5) -> 0 | U82: legs
A83: Fungus Flesh Pants | C83: =(I83*10)+M83+(D83*4)+G83+(L83/5)+(F83*2)+(E83*2)+(K83*2)+(O83/2)+(Q83/2)+(R83/2)+(N83/4)+(P83/4) -> 12 | D83: 3 | S83: 00.8 | U83: leg
A84: Eroded Leather Leggings | C84: =(I84*10)+M84+(D84*4)+G84+(L84/5)+(F84*2)+(E84*2)+(K84*2)+(O84/2)+(Q84/2)+(R84/2)+(N84/4)+(P84/4) -> 0 | D84: 0.0 | S84: 1.5 | T84: =0-QUOTIENT(S84,5) -> 0 | U84: legs