A1: Last Name | B1: First Name | C1: Alias | D1: Class | E1: SASS # | F1: Street | G1: City | H1: State | I1: Zip | J1: Phone | K1: E-Mail | L1: Stage 1 | M1: Stage 2 | N1: Stage 3 | O1: Stage 4 | P1: Stage 5 | R1: Total | S1: Stage 6 | T1: Stage 7 | U1: Stage 8 | V1: Stage 9 | W1: Stage 10 | X1: Day 2 | Y1: Total | Z1: Side 1 | AA1: Side 2 | AB1: Side 3 | AC1: Side 4 | AD1: Event 1 | AE1: Event 2 | AF1: Event 3 | AG1: Event 4 | AH1: Possee #
C2: Augustus | D2: D | L2: 150.03 | M2: 81.18 | N2: 105.37 | O2: 105.04 | P2: 113.05 | R2: =SUM(L2:P2) -> 554.67 | AH2: 2
C3: Bounty Seeker | D3: D | L3: 999.99 | M3: 73.68 | N3: 103.99 | O3: 85.42 | P3: 112.71 | R3: =SUM(L3:P3) -> 1375.79 | AH3: 2
A4: Sieck | B4: Bob | C4: California Franz | D4: D | L4: 163.13 | M4: 67.95 | N4: 98.47 | O4: 83.38 | P4: 97.82 | R4: =SUM(L4:P4) -> 510.75 | AH4: 2
A5: Counts | B5: Bob | C5: Cole "Black" Hart | D5: D | L5: 145.07 | M5: 51.29 | N5: 86.37 | O5: 103.1 | P5: 92.23 | R5: =SUM(L5:P5) -> 478.06 | AH5: 4
C6: Crowfoot | D6: D | L6: 180.44 | M6: 82.62 | N6: 108.78 | O6: 110.39 | P6: 119.92 | R6: =SUM(L6:P6) -> 602.15 | AH6: 3
A7: Stiles | B7: John | C7: In-Law | D7: D | L7: 186.43 | M7: 68.31 | N7: 103.77 | O7: 126.85 | P7: 110.28 | R7: =SUM(L7:P7) -> 595.64 | AH7: 1
A8: Dewhirst | B8: Edward | C8: J.D. Hardrider | D8: D | L8: 146.25 | M8: 68.23 | N8: 103.38 | O8: 93.61 | P8: 106.3 | R8: =SUM(L8:P8) -> 517.77 | AH8: 5
C9: JJ Drifter | D9: D | L9: 108.59 | M9: 49.69 | N9: 77.45 | O9: 91.83 | P9: 67.23 | R9: =SUM(L9:P9) -> 394.79 | AH9: 3
A10: Bolle | B10: Brian | C10: Joe | D10: D | L10: 153.5 | M10: 93.82 | N10: 151.43 | O10: 194.46 | P10: 141.48 | R10: =SUM(L10:P10) -> 734.69 | AH10: 5
A11: Anderws | B11: Robert E | C11: Nathan Ward | D11: D | F11: 1526 Cheryl Acres | G11: Arnold | H11: MO | I11: 63010 | L11: 199.85 | M11: 94.64 | N11: 110.14 | O11: 85.43 | P11: 140.34 | R11: =SUM(L11:P11) -> 630.4 | X11: =SUM(S11:W11) -> 0 | Y11: =SUM(R11+X11) -> 630.4 | AH11: 4
C12: Old Man Sykes | D12: D | L12: 162.91 | M12: 82.36 | N12: 95.96 | O12: 68.63 | P12: 89.69 | R12: =SUM(L12:P12) -> 499.55 | AH12: 2
C13: Possom Creek Bill | D13: D | L13: 146.42 | M13: 62.42 | N13: 113.57 | O13: 80.94 | P13: 106.94 | R13: =SUM(L13:P13) -> 510.29 | AH13: 3
C14: Remy McSwain | D14: D | E14: 13753 | F14: 611 Winding Creek Dr | G14: Wentzville | H14: MO | I14: 63385 | J14: 636-639-6968 | K14: poppydom@aol.com | L14: 163.57 | M14: 67.38 | N14: 106.22 | O14: 123.95 | P14: 96.83 | R14: =SUM(L14:P14) -> 557.95 | X14: =SUM(S14:W14) -> 0 | Y14: =SUM(R14+X14) -> 557.95 | AH14: 1
C15: Silver Creek Pete | D15: D | L15: 160.67 | M15: 61.43 | N15: 91.61 | O15: 99.1 | P15: 110.85 | R15: =SUM(L15:P15) -> 523.66 | AH15: 5
C16: Three Rivers | D16: D | E16: xxx | F16: 156 Big Four Pl | G16: Mitchell | H16: IL | I16: 62040 | J16: 618-773-1340 | L16: 196.46 | M16: 63.34 | N16: 84.8 | O16: 91.02 | P16: 93.04 | R16: =SUM(L16:P16) -> 528.66 | X16: =SUM(S16:W16) -> 0 | Y16: =SUM(R16+X16) -> 528.66 | AH16: 1
C17: Topkick Kalispel | D17: D | E17: 28622 | F17: 3242 S. Illinois St. | G17: Belleville | H17: IL | I17: 62220-5110 | J17: 618-233-3592 | K17: rippjr@peaknet.net | L17: 145.04 | M17: 64.06 | N17: 104.82 | O17: 92.1 | P17: 97.89 | R17: =SUM(L17:P17) -> 503.91 | X17: =SUM(S17:W17) -> 0 | Y17: =SUM(R17+X17) -> 503.91 | AH17: 5
A18: Sextro | B18: John | C18: Wes Dixon | D18: D | E18: 38829 | F18: 6920 Greenholly Dr | G18: St. Louis | H18: MO | I18: 63123 | J18: 314-752-9269 | K18: jpmcdonnell@swbell.net | L18: 165.7 | M18: 65.44 | N18: 102.64 | O18: 96.95 | P18: 999.99 | R18: =SUM(L18:P18) -> 1430.72 | X18: =SUM(S18:W18) -> 0 | Y18: =SUM(R18+X18) -> 1430.72 | AH18: 4
C19: Will Shorty | D19: D | E19: 7242 | F19: 3159 Arrowrock Dr. | G19: St. Charles | H19: MO | I19: 63303-6503 | K19: calhoon314@alo.com | L19: 139.55 | M19: 77.42 | N19: 105.54 | O19: 95.49 | P19: 95.73 | R19: =SUM(L19:P19) -> 513.73 | X19: =SUM(S19:W19) -> 0 | Y19: =SUM(R19+X19) -> 513.73 | AH19: 1
C20: Dirty D | D20: M | L20: 186.62 | M20: 81.3 | N20: 136.3 | O20: 104.25 | P20: 112.42 | R20: =SUM(L20:P20) -> 620.89 | AH20: 4
C21: Jack Blackhawk | D21: M | L21: 185.68 | M21: 64.11 | N21: 113.09 | O21: 100.71 | P21: 109.19 | R21: =SUM(L21:P21) -> 572.78 | AH21: 1
C22: Ranger Marlin Ruger | D22: M | L22: 139.17 | M22: 56.69 | N22: 91.1 | O22: 78.28 | P22: 121.83 | R22: =SUM(L22:P22) -> 487.07 | AH22: 2
C23: Squire Lawrence | D23: S | L23: 164.43 | M23: 56.77 | N23: 111.32 | O23: 85.69 | P23: 94.84 | R23: =SUM(L23:P23) -> 513.05 | AH23: 5
A24: Ripplinger | B24: Lawrence | C24: B.T. Smithorines | D24: T | E24: 32555 | F24: 5 Camp Hollow Ct | G24: Wildwood | H24: MO | I24: 63038 | J24: 636-458-6647 | K24: jmdillmon@aol.com | L24: 177.71 | M24: 57.66 | N24: 111.25 | O24: 129.32 | P24: 111.68 | R24: =SUM(L24:P24) -> 587.62 | X24: =SUM(S24:W24) -> 0 | Y24: =SUM(R24+X24) -> 587.62 | AH24: 4
A25: Myers | B25: Bill | C25: Bull Whip | D25: T | L25: 999.99 | M25: 77.83 | N25: 135.94 | O25: 115.15 | P25: 115.65 | R25: =SUM(L25:P25) -> 1444.56 | AH25: 2
A26: Rivas | B26: Barclay | C26: Bullshooter Bob | D26: T | L26: 150.88 | M26: 54.14 | N26: 88.95 | O26: 81.54 | P26: 93.78 | R26: =SUM(L26:P26) -> 469.29 | AH26: 4
A27: Pisciotta | B27: Dom | C27: CC Morgan | D27: T | L27: 116.67 | M27: 69.86 | N27: 91.23 | O27: 90.02 | P27: 79.98 | R27: =SUM(L27:P27) -> 447.76 | AH27: 2
A28: Peters | B28: Dwayne | C28: Colt Rampant | D28: T | L28: 142.69 | M28: 59.59 | N28: 74.27 | O28: 64.75 | P28: 97.67 | R28: =SUM(L28:P28) -> 438.97 | AH28: 1
C29: Crazy Steve | D29: T | L29: 199.17 | M29: 73.05 | N29: 154.15 | O29: 111.05 | P29: 123.28 | R29: =SUM(L29:P29) -> 660.7 | AH29: 3
C30: Destiny West | D30: T | L30: 176.27 | M30: 85.3 | N30: 124.47 | O30: 117.26 | P30: 123.86 | R30: =SUM(L30:P30) -> 627.16 | AH30: 5
C31: Dirts' Mo Steve | D31: T | F31: 127 Starling Community | G31: Arnold | H31: MO | I31: 63010 | L31: 95.54 | M31: 55.55 | N31: 63.33 | O31: 59.5 | P31: 88.14 | R31: =SUM(L31:P31) -> 362.06 | X31: =SUM(S31:W31) -> 0 | Y31: =SUM(R31+X31) -> 362.06 | AH31: 3 | AJ31: =SUM(A2:A59)/58 -> 0
C32: Dusty Rivers | D32: T | L32: 210.52 | M32: 76.23 | N32: 123.27 | O32: 93.05 | P32: 122.15 | R32: =SUM(L32:P32) -> 625.22 | AH32: 5
C33: Dusty Waters | D33: T | L33: 166.78 | M33: 59.11 | N33: 118.11 | O33: 102.91 | P33: 98.07 | R33: =SUM(L33:P33) -> 544.98 | AH33: 4
A34: Dillmon | B34: John | C34: Flat Land Phil | D34: T | E34: xxx | F34: 3260 Burning Tree Ln | G34: Festus | H34: MO | I34: 63028 | J34: 636-937-2025 | K34: bbolle@ucn.net | L34: 120.29 | M34: 41.21 | N34: 60.59 | O34: 60.21 | P34: 69.37 | R34: =SUM(L34:P34) -> 351.67 | X34: =SUM(S34:W34) -> 0 | Y34: =SUM(R34+X34) -> 351.67 | AH34: 4
C35: Half-cock | D35: T | L35: 221.39 | M35: 131.61 | N35: 211.93 | O35: 151.42 | P35: 160.73 | R35: =SUM(L35:P35) -> 877.08 | AH35: 2
A36: McDonnel | B36: James | C36: Inspector | D36: T | L36: 155.91 | M36: 58.32 | N36: 95.48 | O36: 88.78 | P36: 107.25 | R36: =SUM(L36:P36) -> 505.74 | AH36: 5
C37: Jimmy John Daniels | D37: T | L37: 131.62 | M37: 84.75 | N37: 90.17 | O37: 100.44 | P37: 101.06 | R37: =SUM(L37:P37) -> 508.04 | AH37: 4
A38: Vance | B38: Terry | C38: Kentucky Buck | D38: T | E38: ? | F38: 7252 Klondike Rd | G38: Hillsboro | H38: MO | I38: 63050 | J38: 636-274-2057 | L38: 185.34 | M38: 100.5 | N38: 145.26 | O38: 78.01 | P38: 96.06 | R38: =SUM(L38:P38) -> 605.17 | X38: =SUM(S38:W38) -> 0 | Y38: =SUM(R38+X38) -> 605.17 | AH38: 3
C39: Lefty | D39: T | L39: 138.8 | M39: 73.79 | N39: 111.84 | O39: 95.54 | P39: 93.55 | R39: =SUM(L39:P39) -> 513.52 | AH39: 1
C40: Pardon Me | D40: T | L40: 157.85 | M40: 67.77 | N40: 136.95 | O40: 80.84 | P40: 95.28 | R40: =SUM(L40:P40) -> 538.69 | AH40: 3
A41: Serra | B41: John | C41: Ponchatoula | D41: T | L41: 161.22 | M41: 81.4 | N41: 144.89 | O41: 94.67 | P41: 111.45 | R41: =SUM(L41:P41) -> 593.63 | AH41: 2
A42: Wilson | B42: Gary | C42: Railroad Bill | D42: T | L42: 156.25 | M42: 74.26 | N42: 81.79 | O42: 70.64 | P42: 101.83 | R42: =SUM(L42:P42) -> 484.77 | AH42: 5
C43: Rancher | D43: T | L43: 184.59 | M43: 84.35 | N43: 114.15 | O43: 86.13 | P43: 145.02 | R43: =SUM(L43:P43) -> 614.24 | AH43: 5
C44: Red Oak Ranger | D44: T | F44: 3540 Rock Creek Garden Rd | G44: Imperial | H44: MO | I44: 63052 | K44: magill@swbell.net | L44: 203.04 | M44: 60.96 | N44: 98.71 | O44: 114.77 | P44: 136.7 | R44: =SUM(L44:P44) -> 614.18 | X44: =SUM(S44:W44) -> 0 | Y44: =SUM(R44+X44) -> 614.18 | AH44: 2
C45: Slippery Earl | D45: T | L45: 124.76 | M45: 51.73 | N45: 135.29 | O45: 82.17 | P45: 88.45 | R45: =SUM(L45:P45) -> 482.4 | AH45: 3
C46: Snaggletooth | D46: T | L46: 170.12 | M46: 999.99 | N46: 112.76 | O46: 110.14 | P46: 118.28 | R46: =SUM(L46:P46) -> 1511.29 | AH46: 3
A47: Huffman | B47: Charles | C47: St. Louis Reb | D47: T | L47: 217.79 | M47: 81.02 | N47: 145.03 | O47: 132.02 | P47: 131.78 | R47: =SUM(L47:P47) -> 707.64 | AH47: 1
C48: Trapper | D48: T | L48: 103.87 | M48: 71.71 | N48: 83.09 | O48: 66.62 | P48: 82.32 | R48: =SUM(L48:P48) -> 407.61 | AH48: 2
C49: Yuma Tom | D49: T | L49: 999.99 | M49: 58.74 | N49: 83.37 | O49: 67.82 | P49: 97.85 | R49: =SUM(L49:P49) -> 1307.77 | AH49: 2
C50: Turkey Creek Cresswell | D50: T/J | L50: 203.9 | M50: 118.44 | N50: 146.87 | O50: 125.63 | P50: 152.52 | R50: =SUM(L50:P50) -> 747.36 | AH50: 3
C51: Elmo | D51: T/J/W | L51: 225.69 | M51: 115.45 | N51: 153.82 | O51: 106.18 | P51: 174.26 | R51: =SUM(L51:P51) -> 775.4 | AH51: 4
C52: One Foot Wednesday | D52: T/J/W | L52: 253.53 | M52: 85.78 | N52: 173.3 | O52: 134.29 | P52: 138.4 | R52: =SUM(L52:P52) -> 785.3 | AH52: 4
C53: Pecos Papa | D53: T/S | L53: 192.08 | M53: 82.46 | N53: 95.49 | O53: 96.8 | P53: 120.44 | R53: =SUM(L53:P53) -> 587.27 | AH53: 5
C54: Stumpe | D54: T/S | F54: 515 Fox Pointe Dr | G54: St. Charles | H54: MO | I54: 63304 | L54: 192.14 | M54: 81.72 | N54: 112.59 | O54: 94.7 | P54: 116.44 | R54: =SUM(L54:P54) -> 597.59 | X54: =SUM(S54:W54) -> 0 | Y54: =SUM(R54+X54) -> 597.59 | AH54: 1
C55: Bonnie Fear | D55: T/W | L55: 112 | M55: 62.63 | N55: 88.04 | O55: 61.74 | P55: 69.43 | R55: =SUM(L55:P55) -> 393.84 | AH55: 3
C56: Boston Lil | D56: T/W | L56: 287.24 | M56: 167.59 | N56: 247.97 | O56: 252.52 | P56: 190.38 | R56: =SUM(L56:P56) -> 1145.7 | AH56: 1
C57: Crazy Mary | D57: T/W | L57: 149.71 | M57: 57.91 | N57: 91.43 | O57: 82.81 | P57: 120.15 | R57: =SUM(L57:P57) -> 502.01 | AH57: 4
C58: Yuma Rose | D58: T/W | E58: 26212 | F58: 1328 Premio Dr | G58: Fenton | H58: MO | I58: 63026 | J58: 636-225-4741 | K58: gadgets2@juno.com | L58: 999.99 | M58: 111.58 | N58: 174.58 | O58: 128.2 | P58: 999.99 | R58: =SUM(L58:P58) -> 2414.34 | X58: =SUM(S58:W58) -> 0 | Y58: =SUM(R58+X58) -> 2414.34 | AH58: 2
C59: Ellie Oakley | D59: W | L59: 217.12 | M59: 88.18 | N59: 142.92 | O59: 118.52 | P59: 141.15 | R59: =SUM(L59:P59) -> 707.89 | AH59: 5
C61: Average Per Stage | L61: 156.76 | M61: =SUM(M2:M60)/58 -> 91.315517241379311 | N61: =SUM(N2:N60)/58 -> 114.98965517241379 | O61: =SUM(O2:O60)/58 -> 100.73758620689661 | P61: 124.91