B1: Total | D1: Item | E1: Item | F1: Item | X1: Spec. | Z1: Weight
A2: Rank | B2: Points | C2: Shields and ONLY Shields (30 pt minimum) | D2: TYPE | E2: Source | F2: Local | G2: Slot | H2: AC | I2: STR | J2: DEX | K2: STA | L2: CHA | M2: WIS | N2: INT | O2: AGI | P2: HP | Q2: MANA | R2: FR | S2: DR | T2: CR | U2: MR | V2: PR | W2: Special Effects | X2: Pts. | Y2: WT | Z2: Penalty
A3: #1 | B3: =(H3*4)+(I3*2)+(J3*0)+(K3*2)+(L3*2)+(M3*10)+(N3*0)+(O3*1)+(P3/2)+(Q3*1)+(R3/2)+(S3/4)+(T3/2)+(U3/2)+(V3/4)+(X3)-(Z3*2) -> 397.5 | C3: Buckler of Insight | D3: M L ND | E3: Q | F3: V | G3: S | H3: 20 | I3: 5 | J3: 5 | K3: 5 | L3: 5 | M3: 12 | N3: 12 | O3: 5 | P3: 75 | Q3: 75 | R3: 10 | S3: 10 | T3: 10 | U3: 10 | V3: 10 | W3: Effect: Flowing Thought I | X3: 30 | Y3: 0.5
A4: 2 | B4: =(H4*4)+(I4*2)+(J4*0)+(K4*2)+(L4*2)+(M4*10)+(N4*0)+(O4*1)+(P4/2)+(Q4*1)+(R4/2)+(S4/4)+(T4/2)+(U4/2)+(V4/4)+(X4)-(Z4*2) -> 353 | C4: Brell's Power | D4: M ND | E4: M | F4: V | G4: S | H4: 40 | I4: 5 | M4: 10 | P4: 50 | Q4: 50 | R4: 5 | S4: 5 | T4: 5 | U4: 5 | V4: 5 | W4: Effect: Flowing Thought I | Y4: 5 | Z4: 1
A5: 3 | B5: =(H5*4)+(I5*2)+(J5*0)+(K5*2)+(L5*2)+(M5*10)+(N5*0)+(O5*1)+(P5/2)+(Q5*1)+(R5/2)+(S5/4)+(T5/2)+(U5/2)+(V5/4)+(X5)-(Z5*2) -> 307 | C5: Shield of Thorns | D5: M L ND | E5: M | F5: V | G5: S | H5: 33 | M5: 12 | P5: 50 | Q5: 20 | R5: 5 | S5: 5 | T5: 5 | U5: 5 | V5: 5 | Y5: 1
A6: 4 | B6: =(H6*4)+(I6*2)+(J6*0)+(K6*2)+(L6*2)+(M6*10)+(N6*0)+(O6*1)+(P6/2)+(Q6*1)+(R6/2)+(S6/4)+(T6/2)+(U6/2)+(V6/4)+(X6)-(Z6*2) -> 278 | C6: Tanglewood Shield | D6: M L | E6: M | F6: V | G6: S | H6: 25 | I6: 10 | M6: 14 | O6: 10 | W6: Effect: Ensnare | X6: 10 | Y6: 5 | Z6: 1
A7: 5 | B7: =(H7*4)+(I7*2)+(J7*0)+(K7*2)+(L7*2)+(M7*10)+(N7*0)+(O7*1)+(P7/2)+(Q7*1)+(R7/2)+(S7/4)+(T7/2)+(U7/2)+(V7/4)+(X7)-(Z7*2) -> 260 | C7: Lodizal Shell Shield | D7: M L | E7: Q | F7: V | G7: S | H7: 23 | I7: 10 | L7: 5 | M7: 10 | O7: -5 | R7: 20 | T7: 20 | U7: 10 | W7: Effect: Enduring Breath | X7: 20 | Y7: 5 | Z7: 1
A8: 6 | B8: =(H8*4)+(I8*2)+(J8*0)+(K8*2)+(L8*2)+(M8*10)+(N8*0)+(O8*1)+(P8/2)+(Q8*1)+(R8/2)+(S8/4)+(T8/2)+(U8/2)+(V8/4)+(X8)-(Z8*2) -> 248.5 | C8: Ayill's Aged Stone Shield | D8: M L ND | E8: M | F8: V | G8: S | H8: 32 | I8: 5 | J8: -5 | K8: 25 | L8: 10 | R8: 15 | T8: 15 | U8: 15 | W8: Effect: See Invisible | X8: 20 | Y8: 5 | Z8: 1
A9: 7 | B9: =(H9*4)+(I9*2)+(J9*0)+(K9*2)+(L9*2)+(M9*10)+(N9*0)+(O9*1)+(P9/2)+(Q9*1)+(R9/2)+(S9/4)+(T9/2)+(U9/2)+(V9/4)+(X9)-(Z9*2) -> 221 | C9: Whitestone Shield | D9: M L ND | E9: M | F9: V | G9: S | H9: 39 | O9: 15 | P9: 100 | Y9: 0
A10: 8 | B10: =(H10*4)+(I10*2)+(J10*0)+(K10*2)+(L10*2)+(M10*10)+(N10*0)+(O10*1)+(P10/2)+(Q10*1)+(R10/2)+(S10/4)+(T10/2)+(U10/2)+(V10/4)+(X10)-(Z10*2) -> 163 | C10: Shield of the Water Dragon | D10: M L | E10: M | F10: TD | G10: S | H10: 25 | I10: 10 | L10: 10 | O10: -5 | R10: 5 | S10: 5 | T10: 25 | U10: 25 | V10: 5 | Y10: 5 | Z10: 1
A11: 9 | B11: =(H11*4)+(I11*2)+(J11*0)+(K11*2)+(L11*2)+(M11*10)+(N11*0)+(O11*1)+(P11/2)+(Q11*1)+(R11/2)+(S11/4)+(T11/2)+(U11/2)+(V11/4)+(X11)-(Z11*2) -> 160.5 | C11: Shield of the White Dragon | D11: M L | E11: M | F11: K | G11: S | H11: 25 | I11: 10 | L11: 10 | O11: -5 | R11: 5 | S11: 5 | T11: 40 | U11: 5 | V11: 5 | Y11: 5 | Z11: 1
A12: 9 | B12: =(H12*4)+(I12*2)+(J12*0)+(K12*2)+(L12*2)+(M12*10)+(N12*0)+(O12*1)+(P12/2)+(Q12*1)+(R12/2)+(S12/4)+(T12/2)+(U12/2)+(V12/4)+(X12)-(Z12*2) -> 160.5 | C12: Shield of the Red Dragon | D12: M L | E12: M | F12: K | G12: S | H12: 25 | I12: 10 | L12: 10 | O12: -5 | R12: 40 | S12: 5 | T12: 5 | U12: 5 | V12: 5 | Y12: 5 | Z12: 1
A13: 10 | B13: =(H13*4)+(I13*2)+(J13*0)+(K13*2)+(L13*2)+(M13*10)+(N13*0)+(O13*1)+(P13/2)+(Q13*1)+(R13/2)+(S13/4)+(T13/2)+(U13/2)+(V13/4)+(X13)-(Z13*2) -> 155.5 | C13: Shield of the Green Dragon | D13: M L | E13: M | F13: K | G13: S | H13: 25 | I13: 10 | L13: 10 | O13: -5 | R13: 5 | S13: 30 | T13: 5 | U13: 5 | V13: 30 | Y13: 5 | Z13: 1
A14: 11 | B14: =(H14*4)+(I14*2)+(J14*0)+(K14*2)+(L14*2)+(M14*10)+(N14*0)+(O14*1)+(P14/2)+(Q14*1)+(R14/2)+(S14/4)+(T14/2)+(U14/2)+(V14/4)+(X14)-(Z14*2) -> 155 | C14: Sarnak Battle Shield | D14: M L | E14: M | F14: K | G14: S | H14: 25 | I14: 5 | K14: 5 | P14: 40 | R14: 10 | T14: 10 | U14: 10 | Y14: 3
A15: 12 | B15: =(H15*4)+(I15*2)+(J15*0)+(K15*2)+(L15*2)+(M15*10)+(N15*0)+(O15*1)+(P15/2)+(Q15*1)+(R15/2)+(S15/4)+(T15/2)+(U15/2)+(V15/4)+(X15)-(Z15*2) -> 154 | C15: Shield of Battle | D15: M L | E15: Q | F15: V | G15: S | H15: 13 | I15: 2 | M15: 9 | Q15: 10 | Y15: 9.7 | Z15: 1
A16: 13 | B16: =(H16*4)+(I16*2)+(J16*0)+(K16*2)+(L16*2)+(M16*10)+(N16*0)+(O16*1)+(P16/2)+(Q16*1)+(R16/2)+(S16/4)+(T16/2)+(U16/2)+(V16/4)+(X16)-(Z16*2) -> 149.5 | C16: Runewood Shield | D16: M L ND | E16: M | F16: P | G16: S | H16: 16 | M16: 8 | R16: 15 | Y16: 6 | Z16: 1
A17: 14 | B17: =(H17*4)+(I17*2)+(J17*0)+(K17*2)+(L17*2)+(M17*10)+(N17*0)+(O17*1)+(P17/2)+(Q17*1)+(R17/2)+(S17/4)+(T17/2)+(U17/2)+(V17/4)+(X17)-(Z17*2) -> 148 | C17: Crystal Chitin Shield | D17: L | E17: M | F17: V | G17: S | H17: 12 | M17: 9 | Q17: 10 | Y17: 1
A18: 15 | B18: =(H18*4)+(I18*2)+(J18*0)+(K18*2)+(L18*2)+(M18*10)+(N18*0)+(O18*1)+(P18/2)+(Q18*1)+(R18/2)+(S18/4)+(T18/2)+(U18/2)+(V18/4)+(X18)-(Z18*2) -> 146 | C18: Ry'Gorr Oracle Shield | D18: M | E18: M | F18: V | G18: S | H18: 12 | M18: 5 | Q18: 50 | Y18: 8 | Z18: 1
A19: 16 | B19: =(H19*4)+(I19*2)+(J19*0)+(K19*2)+(L19*2)+(M19*10)+(N19*0)+(O19*1)+(P19/2)+(Q19*1)+(R19/2)+(S19/4)+(T19/2)+(U19/2)+(V19/4)+(X19)-(Z19*2) -> 132.5 | C19: Buckler of Doom | D19: M L ND | E19: Q | F19: P | G19: S | H19: 10 | I19: 15 | P19: 45 | Q19: 40 | Y19: 0
A20: 17 | B20: =(H20*4)+(I20*2)+(J20*0)+(K20*2)+(L20*2)+(M20*10)+(N20*0)+(O20*1)+(P20/2)+(Q20*1)+(R20/2)+(S20/4)+(T20/2)+(U20/2)+(V20/4)+(X20)-(Z20*2) -> 128 | C20: Charred Guardian Shield | D20: M | E20: M | F20: A | G20: S | H20: 10 | M20: 9 | Y20: 8 | Z20: 1
A21: 18 | B21: =(H21*4)+(I21*2)+(J21*0)+(K21*2)+(L21*2)+(M21*10)+(N21*0)+(O21*1)+(P21/2)+(Q21*1)+(R21/2)+(S21/4)+(T21/2)+(U21/2)+(V21/4)+(X21)-(Z21*2) -> 123 | C21: Shield of the Seneschal | D21: M L | E21: M | F21: V | G21: S | H21: 20 | I21: 7 | K21: 5 | O21: 5 | P21: 20 | R21: 3 | S21: 3 | T21: 3 | U21: 3 | V21: 3 | Y21: 5 | Z21: 1
A22: 19 | B22: =(H22*4)+(I22*2)+(J22*0)+(K22*2)+(L22*2)+(M22*10)+(N22*0)+(O22*1)+(P22/2)+(Q22*1)+(R22/2)+(S22/4)+(T22/2)+(U22/2)+(V22/4)+(X22)-(Z22*2) -> 118.5 | C22: Walrusbone Shield | D22: M L | E22: M | F22: V | G22: S | H22: 14 | I22: 5 | M22: 5 | U22: 5 | Y22: 3
A23: 20 | B23: =(H23*4)+(I23*2)+(J23*0)+(K23*2)+(L23*2)+(M23*10)+(N23*0)+(O23*1)+(P23/2)+(Q23*1)+(R23/2)+(S23/4)+(T23/2)+(U23/2)+(V23/4)+(X23)-(Z23*2) -> 95 | C23: Crystal Webshield | D23: M L | E23: M | F23: V | G23: S | H23: 15 | P23: 20 | Q23: 20 | T23: 10 | Y23: 0.2
A24: 21 | B24: =(H24*4)+(I24*2)+(J24*0)+(K24*2)+(L24*2)+(M24*10)+(N24*0)+(O24*1)+(P24/2)+(Q24*1)+(R24/2)+(S24/4)+(T24/2)+(U24/2)+(V24/4)+(X24)-(Z24*2) -> 80 | C24: Crustacean Shell Shield | D24: - | E24: M | F24: V | G24: S | H24: 17 | I24: 4 | K24: 10 | L24: -7 | Y24: 5 | Z24: 1
A25: 22 | B25: =(H25*4)+(I25*2)+(J25*0)+(K25*2)+(L25*2)+(M25*10)+(N25*0)+(O25*1)+(P25/2)+(Q25*1)+(R25/2)+(S25/4)+(T25/2)+(U25/2)+(V25/4)+(X25)-(Z25*2) -> 79 | C25: A Chetari Bonecrafted Shield | D25: M L | E25: M | F25: V | G25: S | H25: 19 | R25: 10 | Y25: 6.5 | Z25: 1
A26: 23 | B26: =(H26*4)+(I26*2)+(J26*0)+(K26*2)+(L26*2)+(M26*10)+(N26*0)+(O26*1)+(P26/2)+(Q26*1)+(R26/2)+(S26/4)+(T26/2)+(U26/2)+(V26/4)+(X26)-(Z26*2) -> 76 | C26: Scute Shield | D26: M | E26: M | F26: A | G26: S | H26: 15 | K26: 9 | Y26: 8 | Z26: 1
A27: 24 | B27: =(H27*4)+(I27*2)+(J27*0)+(K27*2)+(L27*2)+(M27*10)+(N27*0)+(O27*1)+(P27/2)+(Q27*1)+(R27/2)+(S27/4)+(T27/2)+(U27/2)+(V27/4)+(X27)-(Z27*2) -> 68 | C27: Imbued Woodlander's Shield - Tunare* | D27: M | E27: T | F27: - | G27: S | H27: 11 | I27: 2 | K27: 2 | M27: 2 | Y27: 10 | Z27: 2
A28: 25 | B28: =(H28*4)+(I28*2)+(J28*0)+(K28*2)+(L28*2)+(M28*10)+(N28*0)+(O28*1)+(P28/2)+(Q28*1)+(R28/2)+(S28/4)+(T28/2)+(U28/2)+(V28/4)+(X28)-(Z28*2) -> 65 | C28: Velium Round Shield | D28: M L | E28: M | F28: V | G28: S | H28: 15 | T28: 10 | Y28: 0.5
A29: 25 | B29: =(H29*4)+(I29*2)+(J29*0)+(K29*2)+(L29*2)+(M29*10)+(N29*0)+(O29*1)+(P29/2)+(Q29*1)+(R29/2)+(S29/4)+(T29/2)+(U29/2)+(V29/4)+(X29)-(Z29*2) -> 65 | C29: Sporestrand Shield | D29: L | E29: M | F29: A | G29: S | H29: 5 | M29: 2 | N29: 2 | Q29: 25 | Y29: 1
A30: 25 | B30: =(H30*4)+(I30*2)+(J30*0)+(K30*2)+(L30*2)+(M30*10)+(N30*0)+(O30*1)+(P30/2)+(Q30*1)+(R30/2)+(S30/4)+(T30/2)+(U30/2)+(V30/4)+(X30)-(Z30*2) -> 65 | C30: Bark Shield | D30: M | E30: M | F30: A | G30: S | H30: 15 | O30: 5 | Y30: 2.5
A31: 26 | B31: =(H31*4)+(I31*2)+(J31*0)+(K31*2)+(L31*2)+(M31*10)+(N31*0)+(O31*1)+(P31/2)+(Q31*1)+(R31/2)+(S31/4)+(T31/2)+(U31/2)+(V31/4)+(X31)-(Z31*2) -> 64 | C31: Cracked Darkwood Shield | D31: M L | E31: M | F31: A | G31: S | H31: 12 | I31: 9 | Y31: 5 | Z31: 1
A32: 27 | B32: =(H32*4)+(I32*2)+(J32*0)+(K32*2)+(L32*2)+(M32*10)+(N32*0)+(O32*1)+(P32/2)+(Q32*1)+(R32/2)+(S32/4)+(T32/2)+(U32/2)+(V32/4)+(X32)-(Z32*2) -> 62.5 | C32: Chitin Shell Shield | D32: - | E32: M | F32: A | G32: S | H32: 15 | V32: 10 | Y32: 4
A33: 27 | B33: =(H33*4)+(I33*2)+(J33*0)+(K33*2)+(L33*2)+(M33*10)+(N33*0)+(O33*1)+(P33/2)+(Q33*1)+(R33/2)+(S33/4)+(T33/2)+(U33/2)+(V33/4)+(X33)-(Z33*2) -> 62.5 | C33: Marr's Promise | D33: M L | E33: M | F33: A | G33: S | H33: 14 | P33: 25 | Y33: 15 | Z33: 3
A34: 28 | B34: =(H34*4)+(I34*2)+(J34*0)+(K34*2)+(L34*2)+(M34*10)+(N34*0)+(O34*1)+(P34/2)+(Q34*1)+(R34/2)+(S34/4)+(T34/2)+(U34/2)+(V34/4)+(X34)-(Z34*2) -> 54 | C34: A Giant Laceless Sandal | D34: - | E34: M | F34: A | G34: S | H34: 15 | K34: 5 | L34: -7 | Y34: 5 | Z34: 1
A35: 29 | B35: =(H35*4)+(I35*2)+(J35*0)+(K35*2)+(L35*2)+(M35*10)+(N35*0)+(O35*1)+(P35/2)+(Q35*1)+(R35/2)+(S35/4)+(T35/2)+(U35/2)+(V35/4)+(X35)-(Z35*2) -> 50 | C35: Shield of Prexus | D35: M | E35: M | F35: F | G35: S | H35: 8 | W35: Effect: Enduring Breath | X35: 20 | Y35: 6.5 | Z35: 1
A36: 30 | B36: =(H36*4)+(I36*2)+(J36*0)+(K36*2)+(L36*2)+(M36*10)+(N36*0)+(O36*1)+(P36/2)+(Q36*1)+(R36/2)+(S36/4)+(T36/2)+(U36/2)+(V36/4)+(X36)-(Z36*2) -> 51 | C36: Etched Chitin Shield | D36: M L ND | E36: M | F36: O | G36: S | H36: 11 | P36: 10 | R36: 7 | V36: 2 | W36: 2Charges: Rune I | X36: 0 | Y36: 9.8 | Z36: 1
A37: 31 | B37: =(H37*4)+(I37*2)+(J37*0)+(K37*2)+(L37*2)+(M37*10)+(N37*0)+(O37*1)+(P37/2)+(Q37*1)+(R37/2)+(S37/4)+(T37/2)+(U37/2)+(V37/4)+(X37)-(Z37*2) -> 48 | C37: Crested Mistmoore Shield | D37: M L | E37: M | F37: F | G37: S | H37: 10 | J37: 6 | S37: 10 | U37: 10 | V37: 10 | Y37: 6.5 | Z37: 1
A38: 32 | B38: =(H38*4)+(I38*2)+(J38*0)+(K38*2)+(L38*2)+(M38*10)+(N38*0)+(O38*1)+(P38/2)+(Q38*1)+(R38/2)+(S38/4)+(T38/2)+(U38/2)+(V38/4)+(X38)-(Z38*2) -> 47.75 | C38: Devlas Ilkvel | D38: M L | E38: M | F38: A | G38: S | H38: 12 | J38: 5 | V38: 7 | Y38: 7 | Z38: 1
A39: 33 | B39: =(H39*4)+(I39*2)+(J39*0)+(K39*2)+(L39*2)+(M39*10)+(N39*0)+(O39*1)+(P39/2)+(Q39*1)+(R39/2)+(S39/4)+(T39/2)+(U39/2)+(V39/4)+(X39)-(Z39*2) -> 47.5 | C39: Slithinis's Shield | D39: M L | E39: M | F39: K | G39: S | H39: 10 | R39: 15 | Y39: 0
A40: 34 | B40: =(H40*4)+(I40*2)+(J40*0)+(K40*2)+(L40*2)+(M40*10)+(N40*0)+(O40*1)+(P40/2)+(Q40*1)+(R40/2)+(S40/4)+(T40/2)+(U40/2)+(V40/4)+(X40)-(Z40*2) -> 43 | C40: Shield of Kurn | D40: M L | E40: M | F40: K | G40: S | H40: 10 | U40: 10 | Y40: 8 | Z40: 1
A41: 34 | B41: =(H41*4)+(I41*2)+(J41*0)+(K41*2)+(L41*2)+(M41*10)+(N41*0)+(O41*1)+(P41/2)+(Q41*1)+(R41/2)+(S41/4)+(T41/2)+(U41/2)+(V41/4)+(X41)-(Z41*2) -> 43 | C41: Shiny Brass Shield | D41: M L | E41: M | F41: F | G41: S | H41: 10 | U41: 10 | Y41: 8 | Z41: 1
A42: 35 | B42: =(H42*4)+(I42*2)+(J42*0)+(K42*2)+(L42*2)+(M42*10)+(N42*0)+(O42*1)+(P42/2)+(Q42*1)+(R42/2)+(S42/4)+(T42/2)+(U42/2)+(V42/4)+(X42)-(Z42*2) -> 38.5 | C42: Guard of Ik | D42: L | E42: Q | F42: K | G42: S | H42: 10 | U42: 5 | Y42: 10 | Z42: 2
A43: 36 | B43: =(H43*4)+(I43*2)+(J43*0)+(K43*2)+(L43*2)+(M43*10)+(N43*0)+(O43*1)+(P43/2)+(Q43*1)+(R43/2)+(S43/4)+(T43/2)+(U43/2)+(V43/4)+(X43)-(Z43*2) -> 30.25 | C43: Bone Shield | D43: M | E43: Q | F43: V | G43: S | H43: 8 | S43: 1 | Y43: 9.5 | Z43: 1