C1: Mana Chart Here you go, a chart for the mana derived. I used the more accepted formula of ((Wis/5)+2)*Level.

B1: Wisdom | C1: 70 | D1: 80 | E1: 90 | F1: 100 | G1: 110 | H1: 120 | I1: 130 | J1: 140 | K1: 150 | L1: 160 | M1: 170 | N1: 180 | O1: 190 | P1: 200
A2: Level
A3: 1 | C3: =((C$1/5)+2)*$A3 -> 16 | D3: =((D$1/5)+2)*$A3 -> 18 | E3: =((E$1/5)+2)*$A3 -> 20 | F3: =((F$1/5)+2)*$A3 -> 22 | G3: =((G$1/5)+2)*$A3 -> 24 | H3: =((H$1/5)+2)*$A3 -> 26 | I3: =((I$1/5)+2)*$A3 -> 28 | J3: =((J$1/5)+2)*$A3 -> 30 | K3: =((K$1/5)+2)*$A3 -> 32 | L3: =((L$1/5)+2)*$A3 -> 34 | M3: =((M$1/5)+2)*$A3 -> 36 | N3: =((N$1/5)+2)*$A3 -> 38 | O3: =((O$1/5)+2)*$A3 -> 40 | P3: =((P$1/5)+2)*$A3 -> 42
A4: 2 | C4: =((C$1/5)+2)*$A4 -> 32 | D4: =((D$1/5)+2)*$A4 -> 36 | E4: =((E$1/5)+2)*$A4 -> 40 | F4: =((F$1/5)+2)*$A4 -> 44 | G4: =((G$1/5)+2)*$A4 -> 48 | H4: =((H$1/5)+2)*$A4 -> 52 | I4: =((I$1/5)+2)*$A4 -> 56 | J4: =((J$1/5)+2)*$A4 -> 60 | K4: =((K$1/5)+2)*$A4 -> 64 | L4: =((L$1/5)+2)*$A4 -> 68 | M4: =((M$1/5)+2)*$A4 -> 72 | N4: =((N$1/5)+2)*$A4 -> 76 | O4: =((O$1/5)+2)*$A4 -> 80 | P4: =((P$1/5)+2)*$A4 -> 84
A5: 3 | C5: =((C$1/5)+2)*$A5 -> 48 | D5: =((D$1/5)+2)*$A5 -> 54 | E5: =((E$1/5)+2)*$A5 -> 60 | F5: =((F$1/5)+2)*$A5 -> 66 | G5: =((G$1/5)+2)*$A5 -> 72 | H5: =((H$1/5)+2)*$A5 -> 78 | I5: =((I$1/5)+2)*$A5 -> 84 | J5: =((J$1/5)+2)*$A5 -> 90 | K5: =((K$1/5)+2)*$A5 -> 96 | L5: =((L$1/5)+2)*$A5 -> 102 | M5: =((M$1/5)+2)*$A5 -> 108 | N5: =((N$1/5)+2)*$A5 -> 114 | O5: =((O$1/5)+2)*$A5 -> 120 | P5: =((P$1/5)+2)*$A5 -> 126
A6: 4 | C6: =((C$1/5)+2)*$A6 -> 64 | D6: =((D$1/5)+2)*$A6 -> 72 | E6: =((E$1/5)+2)*$A6 -> 80 | F6: =((F$1/5)+2)*$A6 -> 88 | G6: =((G$1/5)+2)*$A6 -> 96 | H6: =((H$1/5)+2)*$A6 -> 104 | I6: =((I$1/5)+2)*$A6 -> 112 | J6: =((J$1/5)+2)*$A6 -> 120 | K6: =((K$1/5)+2)*$A6 -> 128 | L6: =((L$1/5)+2)*$A6 -> 136 | M6: =((M$1/5)+2)*$A6 -> 144 | N6: =((N$1/5)+2)*$A6 -> 152 | O6: =((O$1/5)+2)*$A6 -> 160 | P6: =((P$1/5)+2)*$A6 -> 168
A7: 5 | C7: =((C$1/5)+2)*$A7 -> 80 | D7: =((D$1/5)+2)*$A7 -> 90 | E7: =((E$1/5)+2)*$A7 -> 100 | F7: =((F$1/5)+2)*$A7 -> 110 | G7: =((G$1/5)+2)*$A7 -> 120 | H7: =((H$1/5)+2)*$A7 -> 130 | I7: =((I$1/5)+2)*$A7 -> 140 | J7: =((J$1/5)+2)*$A7 -> 150 | K7: =((K$1/5)+2)*$A7 -> 160 | L7: =((L$1/5)+2)*$A7 -> 170 | M7: =((M$1/5)+2)*$A7 -> 180 | N7: =((N$1/5)+2)*$A7 -> 190 | O7: =((O$1/5)+2)*$A7 -> 200 | P7: =((P$1/5)+2)*$A7 -> 210
A8: 6 | C8: =((C$1/5)+2)*$A8 -> 96 | D8: =((D$1/5)+2)*$A8 -> 108 | E8: =((E$1/5)+2)*$A8 -> 120 | F8: =((F$1/5)+2)*$A8 -> 132 | G8: =((G$1/5)+2)*$A8 -> 144 | H8: =((H$1/5)+2)*$A8 -> 156 | I8: =((I$1/5)+2)*$A8 -> 168 | J8: =((J$1/5)+2)*$A8 -> 180 | K8: =((K$1/5)+2)*$A8 -> 192 | L8: =((L$1/5)+2)*$A8 -> 204 | M8: =((M$1/5)+2)*$A8 -> 216 | N8: =((N$1/5)+2)*$A8 -> 228 | O8: =((O$1/5)+2)*$A8 -> 240 | P8: =((P$1/5)+2)*$A8 -> 252
A9: 7 | C9: =((C$1/5)+2)*$A9 -> 112 | D9: =((D$1/5)+2)*$A9 -> 126 | E9: =((E$1/5)+2)*$A9 -> 140 | F9: =((F$1/5)+2)*$A9 -> 154 | G9: =((G$1/5)+2)*$A9 -> 168 | H9: =((H$1/5)+2)*$A9 -> 182 | I9: =((I$1/5)+2)*$A9 -> 196 | J9: =((J$1/5)+2)*$A9 -> 210 | K9: =((K$1/5)+2)*$A9 -> 224 | L9: =((L$1/5)+2)*$A9 -> 238 | M9: =((M$1/5)+2)*$A9 -> 252 | N9: =((N$1/5)+2)*$A9 -> 266 | O9: =((O$1/5)+2)*$A9 -> 280 | P9: =((P$1/5)+2)*$A9 -> 294
A10: 8 | C10: =((C$1/5)+2)*$A10 -> 128 | D10: =((D$1/5)+2)*$A10 -> 144 | E10: =((E$1/5)+2)*$A10 -> 160 | F10: =((F$1/5)+2)*$A10 -> 176 | G10: =((G$1/5)+2)*$A10 -> 192 | H10: =((H$1/5)+2)*$A10 -> 208 | I10: =((I$1/5)+2)*$A10 -> 224 | J10: =((J$1/5)+2)*$A10 -> 240 | K10: =((K$1/5)+2)*$A10 -> 256 | L10: =((L$1/5)+2)*$A10 -> 272 | M10: =((M$1/5)+2)*$A10 -> 288 | N10: =((N$1/5)+2)*$A10 -> 304 | O10: =((O$1/5)+2)*$A10 -> 320 | P10: =((P$1/5)+2)*$A10 -> 336
A11: 9 | C11: =((C$1/5)+2)*$A11 -> 144 | D11: =((D$1/5)+2)*$A11 -> 162 | E11: =((E$1/5)+2)*$A11 -> 180 | F11: =((F$1/5)+2)*$A11 -> 198 | G11: =((G$1/5)+2)*$A11 -> 216 | H11: =((H$1/5)+2)*$A11 -> 234 | I11: =((I$1/5)+2)*$A11 -> 252 | J11: =((J$1/5)+2)*$A11 -> 270 | K11: =((K$1/5)+2)*$A11 -> 288 | L11: =((L$1/5)+2)*$A11 -> 306 | M11: =((M$1/5)+2)*$A11 -> 324 | N11: =((N$1/5)+2)*$A11 -> 342 | O11: =((O$1/5)+2)*$A11 -> 360 | P11: =((P$1/5)+2)*$A11 -> 378
A12: 10 | C12: =((C$1/5)+2)*$A12 -> 160 | D12: =((D$1/5)+2)*$A12 -> 180 | E12: =((E$1/5)+2)*$A12 -> 200 | F12: =((F$1/5)+2)*$A12 -> 220 | G12: =((G$1/5)+2)*$A12 -> 240 | H12: =((H$1/5)+2)*$A12 -> 260 | I12: =((I$1/5)+2)*$A12 -> 280 | J12: =((J$1/5)+2)*$A12 -> 300 | K12: =((K$1/5)+2)*$A12 -> 320 | L12: =((L$1/5)+2)*$A12 -> 340 | M12: =((M$1/5)+2)*$A12 -> 360 | N12: =((N$1/5)+2)*$A12 -> 380 | O12: =((O$1/5)+2)*$A12 -> 400 | P12: =((P$1/5)+2)*$A12 -> 420
A13: 11 | C13: =((C$1/5)+2)*$A13 -> 176 | D13: =((D$1/5)+2)*$A13 -> 198 | E13: =((E$1/5)+2)*$A13 -> 220 | F13: =((F$1/5)+2)*$A13 -> 242 | G13: =((G$1/5)+2)*$A13 -> 264 | H13: =((H$1/5)+2)*$A13 -> 286 | I13: =((I$1/5)+2)*$A13 -> 308 | J13: =((J$1/5)+2)*$A13 -> 330 | K13: =((K$1/5)+2)*$A13 -> 352 | L13: =((L$1/5)+2)*$A13 -> 374 | M13: =((M$1/5)+2)*$A13 -> 396 | N13: =((N$1/5)+2)*$A13 -> 418 | O13: =((O$1/5)+2)*$A13 -> 440 | P13: =((P$1/5)+2)*$A13 -> 462
A14: 12 | C14: =((C$1/5)+2)*$A14 -> 192 | D14: =((D$1/5)+2)*$A14 -> 216 | E14: =((E$1/5)+2)*$A14 -> 240 | F14: =((F$1/5)+2)*$A14 -> 264 | G14: =((G$1/5)+2)*$A14 -> 288 | H14: =((H$1/5)+2)*$A14 -> 312 | I14: =((I$1/5)+2)*$A14 -> 336 | J14: =((J$1/5)+2)*$A14 -> 360 | K14: =((K$1/5)+2)*$A14 -> 384 | L14: =((L$1/5)+2)*$A14 -> 408 | M14: =((M$1/5)+2)*$A14 -> 432 | N14: =((N$1/5)+2)*$A14 -> 456 | O14: =((O$1/5)+2)*$A14 -> 480 | P14: =((P$1/5)+2)*$A14 -> 504
A15: 13 | C15: =((C$1/5)+2)*$A15 -> 208 | D15: =((D$1/5)+2)*$A15 -> 234 | E15: =((E$1/5)+2)*$A15 -> 260 | F15: =((F$1/5)+2)*$A15 -> 286 | G15: =((G$1/5)+2)*$A15 -> 312 | H15: =((H$1/5)+2)*$A15 -> 338 | I15: =((I$1/5)+2)*$A15 -> 364 | J15: =((J$1/5)+2)*$A15 -> 390 | K15: =((K$1/5)+2)*$A15 -> 416 | L15: =((L$1/5)+2)*$A15 -> 442 | M15: =((M$1/5)+2)*$A15 -> 468 | N15: =((N$1/5)+2)*$A15 -> 494 | O15: =((O$1/5)+2)*$A15 -> 520 | P15: =((P$1/5)+2)*$A15 -> 546
A16: 14 | C16: =((C$1/5)+2)*$A16 -> 224 | D16: =((D$1/5)+2)*$A16 -> 252 | E16: =((E$1/5)+2)*$A16 -> 280 | F16: =((F$1/5)+2)*$A16 -> 308 | G16: =((G$1/5)+2)*$A16 -> 336 | H16: =((H$1/5)+2)*$A16 -> 364 | I16: =((I$1/5)+2)*$A16 -> 392 | J16: =((J$1/5)+2)*$A16 -> 420 | K16: =((K$1/5)+2)*$A16 -> 448 | L16: =((L$1/5)+2)*$A16 -> 476 | M16: =((M$1/5)+2)*$A16 -> 504 | N16: =((N$1/5)+2)*$A16 -> 532 | O16: =((O$1/5)+2)*$A16 -> 560 | P16: =((P$1/5)+2)*$A16 -> 588
A17: 15 | C17: =((C$1/5)+2)*$A17 -> 240 | D17: =((D$1/5)+2)*$A17 -> 270 | E17: =((E$1/5)+2)*$A17 -> 300 | F17: =((F$1/5)+2)*$A17 -> 330 | G17: =((G$1/5)+2)*$A17 -> 360 | H17: =((H$1/5)+2)*$A17 -> 390 | I17: =((I$1/5)+2)*$A17 -> 420 | J17: =((J$1/5)+2)*$A17 -> 450 | K17: =((K$1/5)+2)*$A17 -> 480 | L17: =((L$1/5)+2)*$A17 -> 510 | M17: =((M$1/5)+2)*$A17 -> 540 | N17: =((N$1/5)+2)*$A17 -> 570 | O17: =((O$1/5)+2)*$A17 -> 600 | P17: =((P$1/5)+2)*$A17 -> 630
A18: 16 | C18: =((C$1/5)+2)*$A18 -> 256 | D18: =((D$1/5)+2)*$A18 -> 288 | E18: =((E$1/5)+2)*$A18 -> 320 | F18: =((F$1/5)+2)*$A18 -> 352 | G18: =((G$1/5)+2)*$A18 -> 384 | H18: =((H$1/5)+2)*$A18 -> 416 | I18: =((I$1/5)+2)*$A18 -> 448 | J18: =((J$1/5)+2)*$A18 -> 480 | K18: =((K$1/5)+2)*$A18 -> 512 | L18: =((L$1/5)+2)*$A18 -> 544 | M18: =((M$1/5)+2)*$A18 -> 576 | N18: =((N$1/5)+2)*$A18 -> 608 | O18: =((O$1/5)+2)*$A18 -> 640 | P18: =((P$1/5)+2)*$A18 -> 672
A19: 17 | C19: =((C$1/5)+2)*$A19 -> 272 | D19: =((D$1/5)+2)*$A19 -> 306 | E19: =((E$1/5)+2)*$A19 -> 340 | F19: =((F$1/5)+2)*$A19 -> 374 | G19: =((G$1/5)+2)*$A19 -> 408 | H19: =((H$1/5)+2)*$A19 -> 442 | I19: =((I$1/5)+2)*$A19 -> 476 | J19: =((J$1/5)+2)*$A19 -> 510 | K19: =((K$1/5)+2)*$A19 -> 544 | L19: =((L$1/5)+2)*$A19 -> 578 | M19: =((M$1/5)+2)*$A19 -> 612 | N19: =((N$1/5)+2)*$A19 -> 646 | O19: =((O$1/5)+2)*$A19 -> 680 | P19: =((P$1/5)+2)*$A19 -> 714
A20: 18 | C20: =((C$1/5)+2)*$A20 -> 288 | D20: =((D$1/5)+2)*$A20 -> 324 | E20: =((E$1/5)+2)*$A20 -> 360 | F20: =((F$1/5)+2)*$A20 -> 396 | G20: =((G$1/5)+2)*$A20 -> 432 | H20: =((H$1/5)+2)*$A20 -> 468 | I20: =((I$1/5)+2)*$A20 -> 504 | J20: =((J$1/5)+2)*$A20 -> 540 | K20: =((K$1/5)+2)*$A20 -> 576 | L20: =((L$1/5)+2)*$A20 -> 612 | M20: =((M$1/5)+2)*$A20 -> 648 | N20: =((N$1/5)+2)*$A20 -> 684 | O20: =((O$1/5)+2)*$A20 -> 720 | P20: =((P$1/5)+2)*$A20 -> 756
A21: 19 | C21: =((C$1/5)+2)*$A21 -> 304 | D21: =((D$1/5)+2)*$A21 -> 342 | E21: =((E$1/5)+2)*$A21 -> 380 | F21: =((F$1/5)+2)*$A21 -> 418 | G21: =((G$1/5)+2)*$A21 -> 456 | H21: =((H$1/5)+2)*$A21 -> 494 | I21: =((I$1/5)+2)*$A21 -> 532 | J21: =((J$1/5)+2)*$A21 -> 570 | K21: =((K$1/5)+2)*$A21 -> 608 | L21: =((L$1/5)+2)*$A21 -> 646 | M21: =((M$1/5)+2)*$A21 -> 684 | N21: =((N$1/5)+2)*$A21 -> 722 | O21: =((O$1/5)+2)*$A21 -> 760 | P21: =((P$1/5)+2)*$A21 -> 798
A22: 20 | C22: =((C$1/5)+2)*$A22 -> 320 | D22: =((D$1/5)+2)*$A22 -> 360 | E22: =((E$1/5)+2)*$A22 -> 400 | F22: =((F$1/5)+2)*$A22 -> 440 | G22: =((G$1/5)+2)*$A22 -> 480 | H22: =((H$1/5)+2)*$A22 -> 520 | I22: =((I$1/5)+2)*$A22 -> 560 | J22: =((J$1/5)+2)*$A22 -> 600 | K22: =((K$1/5)+2)*$A22 -> 640 | L22: =((L$1/5)+2)*$A22 -> 680 | M22: =((M$1/5)+2)*$A22 -> 720 | N22: =((N$1/5)+2)*$A22 -> 760 | O22: =((O$1/5)+2)*$A22 -> 800 | P22: =((P$1/5)+2)*$A22 -> 840
A23: 21 | C23: =((C$1/5)+2)*$A23 -> 336 | D23: =((D$1/5)+2)*$A23 -> 378 | E23: =((E$1/5)+2)*$A23 -> 420 | F23: =((F$1/5)+2)*$A23 -> 462 | G23: =((G$1/5)+2)*$A23 -> 504 | H23: =((H$1/5)+2)*$A23 -> 546 | I23: =((I$1/5)+2)*$A23 -> 588 | J23: =((J$1/5)+2)*$A23 -> 630 | K23: =((K$1/5)+2)*$A23 -> 672 | L23: =((L$1/5)+2)*$A23 -> 714 | M23: =((M$1/5)+2)*$A23 -> 756 | N23: =((N$1/5)+2)*$A23 -> 798 | O23: =((O$1/5)+2)*$A23 -> 840 | P23: =((P$1/5)+2)*$A23 -> 882
A24: 22 | C24: =((C$1/5)+2)*$A24 -> 352 | D24: =((D$1/5)+2)*$A24 -> 396 | E24: =((E$1/5)+2)*$A24 -> 440 | F24: =((F$1/5)+2)*$A24 -> 484 | G24: =((G$1/5)+2)*$A24 -> 528 | H24: =((H$1/5)+2)*$A24 -> 572 | I24: =((I$1/5)+2)*$A24 -> 616 | J24: =((J$1/5)+2)*$A24 -> 660 | K24: =((K$1/5)+2)*$A24 -> 704 | L24: =((L$1/5)+2)*$A24 -> 748 | M24: =((M$1/5)+2)*$A24 -> 792 | N24: =((N$1/5)+2)*$A24 -> 836 | O24: =((O$1/5)+2)*$A24 -> 880 | P24: =((P$1/5)+2)*$A24 -> 924
A25: 23 | C25: =((C$1/5)+2)*$A25 -> 368 | D25: =((D$1/5)+2)*$A25 -> 414 | E25: =((E$1/5)+2)*$A25 -> 460 | F25: =((F$1/5)+2)*$A25 -> 506 | G25: =((G$1/5)+2)*$A25 -> 552 | H25: =((H$1/5)+2)*$A25 -> 598 | I25: =((I$1/5)+2)*$A25 -> 644 | J25: =((J$1/5)+2)*$A25 -> 690 | K25: =((K$1/5)+2)*$A25 -> 736 | L25: =((L$1/5)+2)*$A25 -> 782 | M25: =((M$1/5)+2)*$A25 -> 828 | N25: =((N$1/5)+2)*$A25 -> 874 | O25: =((O$1/5)+2)*$A25 -> 920 | P25: =((P$1/5)+2)*$A25 -> 966
A26: 24 | C26: =((C$1/5)+2)*$A26 -> 384 | D26: =((D$1/5)+2)*$A26 -> 432 | E26: =((E$1/5)+2)*$A26 -> 480 | F26: =((F$1/5)+2)*$A26 -> 528 | G26: =((G$1/5)+2)*$A26 -> 576 | H26: =((H$1/5)+2)*$A26 -> 624 | I26: =((I$1/5)+2)*$A26 -> 672 | J26: =((J$1/5)+2)*$A26 -> 720 | K26: =((K$1/5)+2)*$A26 -> 768 | L26: =((L$1/5)+2)*$A26 -> 816 | M26: =((M$1/5)+2)*$A26 -> 864 | N26: =((N$1/5)+2)*$A26 -> 912 | O26: =((O$1/5)+2)*$A26 -> 960 | P26: =((P$1/5)+2)*$A26 -> 1008
A27: 25 | C27: =((C$1/5)+2)*$A27 -> 400 | D27: =((D$1/5)+2)*$A27 -> 450 | E27: =((E$1/5)+2)*$A27 -> 500 | F27: =((F$1/5)+2)*$A27 -> 550 | G27: =((G$1/5)+2)*$A27 -> 600 | H27: =((H$1/5)+2)*$A27 -> 650 | I27: =((I$1/5)+2)*$A27 -> 700 | J27: =((J$1/5)+2)*$A27 -> 750 | K27: =((K$1/5)+2)*$A27 -> 800 | L27: =((L$1/5)+2)*$A27 -> 850 | M27: =((M$1/5)+2)*$A27 -> 900 | N27: =((N$1/5)+2)*$A27 -> 950 | O27: =((O$1/5)+2)*$A27 -> 1000 | P27: =((P$1/5)+2)*$A27 -> 1050
A28: 26 | C28: =((C$1/5)+2)*$A28 -> 416 | D28: =((D$1/5)+2)*$A28 -> 468 | E28: =((E$1/5)+2)*$A28 -> 520 | F28: =((F$1/5)+2)*$A28 -> 572 | G28: =((G$1/5)+2)*$A28 -> 624 | H28: =((H$1/5)+2)*$A28 -> 676 | I28: =((I$1/5)+2)*$A28 -> 728 | J28: =((J$1/5)+2)*$A28 -> 780 | K28: =((K$1/5)+2)*$A28 -> 832 | L28: =((L$1/5)+2)*$A28 -> 884 | M28: =((M$1/5)+2)*$A28 -> 936 | N28: =((N$1/5)+2)*$A28 -> 988 | O28: =((O$1/5)+2)*$A28 -> 1040 | P28: =((P$1/5)+2)*$A28 -> 1092
A29: 27 | C29: =((C$1/5)+2)*$A29 -> 432 | D29: =((D$1/5)+2)*$A29 -> 486 | E29: =((E$1/5)+2)*$A29 -> 540 | F29: =((F$1/5)+2)*$A29 -> 594 | G29: =((G$1/5)+2)*$A29 -> 648 | H29: =((H$1/5)+2)*$A29 -> 702 | I29: =((I$1/5)+2)*$A29 -> 756 | J29: =((J$1/5)+2)*$A29 -> 810 | K29: =((K$1/5)+2)*$A29 -> 864 | L29: =((L$1/5)+2)*$A29 -> 918 | M29: =((M$1/5)+2)*$A29 -> 972 | N29: =((N$1/5)+2)*$A29 -> 1026 | O29: =((O$1/5)+2)*$A29 -> 1080 | P29: =((P$1/5)+2)*$A29 -> 1134
A30: 28 | C30: =((C$1/5)+2)*$A30 -> 448 | D30: =((D$1/5)+2)*$A30 -> 504 | E30: =((E$1/5)+2)*$A30 -> 560 | F30: =((F$1/5)+2)*$A30 -> 616 | G30: =((G$1/5)+2)*$A30 -> 672 | H30: =((H$1/5)+2)*$A30 -> 728 | I30: =((I$1/5)+2)*$A30 -> 784 | J30: =((J$1/5)+2)*$A30 -> 840 | K30: =((K$1/5)+2)*$A30 -> 896 | L30: =((L$1/5)+2)*$A30 -> 952 | M30: =((M$1/5)+2)*$A30 -> 1008 | N30: =((N$1/5)+2)*$A30 -> 1064 | O30: =((O$1/5)+2)*$A30 -> 1120 | P30: =((P$1/5)+2)*$A30 -> 1176
A31: 29 | C31: =((C$1/5)+2)*$A31 -> 464 | D31: =((D$1/5)+2)*$A31 -> 522 | E31: =((E$1/5)+2)*$A31 -> 580 | F31: =((F$1/5)+2)*$A31 -> 638 | G31: =((G$1/5)+2)*$A31 -> 696 | H31: =((H$1/5)+2)*$A31 -> 754 | I31: =((I$1/5)+2)*$A31 -> 812 | J31: =((J$1/5)+2)*$A31 -> 870 | K31: =((K$1/5)+2)*$A31 -> 928 | L31: =((L$1/5)+2)*$A31 -> 986 | M31: =((M$1/5)+2)*$A31 -> 1044 | N31: =((N$1/5)+2)*$A31 -> 1102 | O31: =((O$1/5)+2)*$A31 -> 1160 | P31: =((P$1/5)+2)*$A31 -> 1218
A32: 30 | C32: =((C$1/5)+2)*$A32 -> 480 | D32: =((D$1/5)+2)*$A32 -> 540 | E32: =((E$1/5)+2)*$A32 -> 600 | F32: =((F$1/5)+2)*$A32 -> 660 | G32: =((G$1/5)+2)*$A32 -> 720 | H32: =((H$1/5)+2)*$A32 -> 780 | I32: =((I$1/5)+2)*$A32 -> 840 | J32: =((J$1/5)+2)*$A32 -> 900 | K32: =((K$1/5)+2)*$A32 -> 960 | L32: =((L$1/5)+2)*$A32 -> 1020 | M32: =((M$1/5)+2)*$A32 -> 1080 | N32: =((N$1/5)+2)*$A32 -> 1140 | O32: =((O$1/5)+2)*$A32 -> 1200 | P32: =((P$1/5)+2)*$A32 -> 1260
A33: 31 | C33: =((C$1/5)+2)*$A33 -> 496 | D33: =((D$1/5)+2)*$A33 -> 558 | E33: =((E$1/5)+2)*$A33 -> 620 | F33: =((F$1/5)+2)*$A33 -> 682 | G33: =((G$1/5)+2)*$A33 -> 744 | H33: =((H$1/5)+2)*$A33 -> 806 | I33: =((I$1/5)+2)*$A33 -> 868 | J33: =((J$1/5)+2)*$A33 -> 930 | K33: =((K$1/5)+2)*$A33 -> 992 | L33: =((L$1/5)+2)*$A33 -> 1054 | M33: =((M$1/5)+2)*$A33 -> 1116 | N33: =((N$1/5)+2)*$A33 -> 1178 | O33: =((O$1/5)+2)*$A33 -> 1240 | P33: =((P$1/5)+2)*$A33 -> 1302
A34: 32 | C34: =((C$1/5)+2)*$A34 -> 512 | D34: =((D$1/5)+2)*$A34 -> 576 | E34: =((E$1/5)+2)*$A34 -> 640 | F34: =((F$1/5)+2)*$A34 -> 704 | G34: =((G$1/5)+2)*$A34 -> 768 | H34: =((H$1/5)+2)*$A34 -> 832 | I34: =((I$1/5)+2)*$A34 -> 896 | J34: =((J$1/5)+2)*$A34 -> 960 | K34: =((K$1/5)+2)*$A34 -> 1024 | L34: =((L$1/5)+2)*$A34 -> 1088 | M34: =((M$1/5)+2)*$A34 -> 1152 | N34: =((N$1/5)+2)*$A34 -> 1216 | O34: =((O$1/5)+2)*$A34 -> 1280 | P34: =((P$1/5)+2)*$A34 -> 1344
A35: 33 | C35: =((C$1/5)+2)*$A35 -> 528 | D35: =((D$1/5)+2)*$A35 -> 594 | E35: =((E$1/5)+2)*$A35 -> 660 | F35: =((F$1/5)+2)*$A35 -> 726 | G35: =((G$1/5)+2)*$A35 -> 792 | H35: =((H$1/5)+2)*$A35 -> 858 | I35: =((I$1/5)+2)*$A35 -> 924 | J35: =((J$1/5)+2)*$A35 -> 990 | K35: =((K$1/5)+2)*$A35 -> 1056 | L35: =((L$1/5)+2)*$A35 -> 1122 | M35: =((M$1/5)+2)*$A35 -> 1188 | N35: =((N$1/5)+2)*$A35 -> 1254 | O35: =((O$1/5)+2)*$A35 -> 1320 | P35: =((P$1/5)+2)*$A35 -> 1386
A36: 34 | C36: =((C$1/5)+2)*$A36 -> 544 | D36: =((D$1/5)+2)*$A36 -> 612 | E36: =((E$1/5)+2)*$A36 -> 680 | F36: =((F$1/5)+2)*$A36 -> 748 | G36: =((G$1/5)+2)*$A36 -> 816 | H36: =((H$1/5)+2)*$A36 -> 884 | I36: =((I$1/5)+2)*$A36 -> 952 | J36: =((J$1/5)+2)*$A36 -> 1020 | K36: =((K$1/5)+2)*$A36 -> 1088 | L36: =((L$1/5)+2)*$A36 -> 1156 | M36: =((M$1/5)+2)*$A36 -> 1224 | N36: =((N$1/5)+2)*$A36 -> 1292 | O36: =((O$1/5)+2)*$A36 -> 1360 | P36: =((P$1/5)+2)*$A36 -> 1428
A37: 35 | C37: =((C$1/5)+2)*$A37 -> 560 | D37: =((D$1/5)+2)*$A37 -> 630 | E37: =((E$1/5)+2)*$A37 -> 700 | F37: =((F$1/5)+2)*$A37 -> 770 | G37: =((G$1/5)+2)*$A37 -> 840 | H37: =((H$1/5)+2)*$A37 -> 910 | I37: =((I$1/5)+2)*$A37 -> 980 | J37: =((J$1/5)+2)*$A37 -> 1050 | K37: =((K$1/5)+2)*$A37 -> 1120 | L37: =((L$1/5)+2)*$A37 -> 1190 | M37: =((M$1/5)+2)*$A37 -> 1260 | N37: =((N$1/5)+2)*$A37 -> 1330 | O37: =((O$1/5)+2)*$A37 -> 1400 | P37: =((P$1/5)+2)*$A37 -> 1470
A38: 36 | C38: =((C$1/5)+2)*$A38 -> 576 | D38: =((D$1/5)+2)*$A38 -> 648 | E38: =((E$1/5)+2)*$A38 -> 720 | F38: =((F$1/5)+2)*$A38 -> 792 | G38: =((G$1/5)+2)*$A38 -> 864 | H38: =((H$1/5)+2)*$A38 -> 936 | I38: =((I$1/5)+2)*$A38 -> 1008 | J38: =((J$1/5)+2)*$A38 -> 1080 | K38: =((K$1/5)+2)*$A38 -> 1152 | L38: =((L$1/5)+2)*$A38 -> 1224 | M38: =((M$1/5)+2)*$A38 -> 1296 | N38: =((N$1/5)+2)*$A38 -> 1368 | O38: =((O$1/5)+2)*$A38 -> 1440 | P38: =((P$1/5)+2)*$A38 -> 1512
A39: 37 | C39: =((C$1/5)+2)*$A39 -> 592 | D39: =((D$1/5)+2)*$A39 -> 666 | E39: =((E$1/5)+2)*$A39 -> 740 | F39: =((F$1/5)+2)*$A39 -> 814 | G39: =((G$1/5)+2)*$A39 -> 888 | H39: =((H$1/5)+2)*$A39 -> 962 | I39: =((I$1/5)+2)*$A39 -> 1036 | J39: =((J$1/5)+2)*$A39 -> 1110 | K39: =((K$1/5)+2)*$A39 -> 1184 | L39: =((L$1/5)+2)*$A39 -> 1258 | M39: =((M$1/5)+2)*$A39 -> 1332 | N39: =((N$1/5)+2)*$A39 -> 1406 | O39: =((O$1/5)+2)*$A39 -> 1480 | P39: =((P$1/5)+2)*$A39 -> 1554
A40: 38 | C40: =((C$1/5)+2)*$A40 -> 608 | D40: =((D$1/5)+2)*$A40 -> 684 | E40: =((E$1/5)+2)*$A40 -> 760 | F40: =((F$1/5)+2)*$A40 -> 836 | G40: =((G$1/5)+2)*$A40 -> 912 | H40: =((H$1/5)+2)*$A40 -> 988 | I40: =((I$1/5)+2)*$A40 -> 1064 | J40: =((J$1/5)+2)*$A40 -> 1140 | K40: =((K$1/5)+2)*$A40 -> 1216 | L40: =((L$1/5)+2)*$A40 -> 1292 | M40: =((M$1/5)+2)*$A40 -> 1368 | N40: =((N$1/5)+2)*$A40 -> 1444 | O40: =((O$1/5)+2)*$A40 -> 1520 | P40: =((P$1/5)+2)*$A40 -> 1596
A41: 39 | C41: =((C$1/5)+2)*$A41 -> 624 | D41: =((D$1/5)+2)*$A41 -> 702 | E41: =((E$1/5)+2)*$A41 -> 780 | F41: =((F$1/5)+2)*$A41 -> 858 | G41: =((G$1/5)+2)*$A41 -> 936 | H41: =((H$1/5)+2)*$A41 -> 1014 | I41: =((I$1/5)+2)*$A41 -> 1092 | J41: =((J$1/5)+2)*$A41 -> 1170 | K41: =((K$1/5)+2)*$A41 -> 1248 | L41: =((L$1/5)+2)*$A41 -> 1326 | M41: =((M$1/5)+2)*$A41 -> 1404 | N41: =((N$1/5)+2)*$A41 -> 1482 | O41: =((O$1/5)+2)*$A41 -> 1560 | P41: =((P$1/5)+2)*$A41 -> 1638
A42: 40 | C42: =((C$1/5)+2)*$A42 -> 640 | D42: =((D$1/5)+2)*$A42 -> 720 | E42: =((E$1/5)+2)*$A42 -> 800 | F42: =((F$1/5)+2)*$A42 -> 880 | G42: =((G$1/5)+2)*$A42 -> 960 | H42: =((H$1/5)+2)*$A42 -> 1040 | I42: =((I$1/5)+2)*$A42 -> 1120 | J42: =((J$1/5)+2)*$A42 -> 1200 | K42: =((K$1/5)+2)*$A42 -> 1280 | L42: =((L$1/5)+2)*$A42 -> 1360 | M42: =((M$1/5)+2)*$A42 -> 1440 | N42: =((N$1/5)+2)*$A42 -> 1520 | O42: =((O$1/5)+2)*$A42 -> 1600 | P42: =((P$1/5)+2)*$A42 -> 1680
A43: 41 | C43: =((C$1/5)+2)*$A43 -> 656 | D43: =((D$1/5)+2)*$A43 -> 738 | E43: =((E$1/5)+2)*$A43 -> 820 | F43: =((F$1/5)+2)*$A43 -> 902 | G43: =((G$1/5)+2)*$A43 -> 984 | H43: =((H$1/5)+2)*$A43 -> 1066 | I43: =((I$1/5)+2)*$A43 -> 1148 | J43: =((J$1/5)+2)*$A43 -> 1230 | K43: =((K$1/5)+2)*$A43 -> 1312 | L43: =((L$1/5)+2)*$A43 -> 1394 | M43: =((M$1/5)+2)*$A43 -> 1476 | N43: =((N$1/5)+2)*$A43 -> 1558 | O43: =((O$1/5)+2)*$A43 -> 1640 | P43: =((P$1/5)+2)*$A43 -> 1722
A44: 42 | C44: =((C$1/5)+2)*$A44 -> 672 | D44: =((D$1/5)+2)*$A44 -> 756 | E44: =((E$1/5)+2)*$A44 -> 840 | F44: =((F$1/5)+2)*$A44 -> 924 | G44: =((G$1/5)+2)*$A44 -> 1008 | H44: =((H$1/5)+2)*$A44 -> 1092 | I44: =((I$1/5)+2)*$A44 -> 1176 | J44: =((J$1/5)+2)*$A44 -> 1260 | K44: =((K$1/5)+2)*$A44 -> 1344 | L44: =((L$1/5)+2)*$A44 -> 1428 | M44: =((M$1/5)+2)*$A44 -> 1512 | N44: =((N$1/5)+2)*$A44 -> 1596 | O44: =((O$1/5)+2)*$A44 -> 1680 | P44: =((P$1/5)+2)*$A44 -> 1764
A45: 43 | C45: =((C$1/5)+2)*$A45 -> 688 | D45: =((D$1/5)+2)*$A45 -> 774 | E45: =((E$1/5)+2)*$A45 -> 860 | F45: =((F$1/5)+2)*$A45 -> 946 | G45: =((G$1/5)+2)*$A45 -> 1032 | H45: =((H$1/5)+2)*$A45 -> 1118 | I45: =((I$1/5)+2)*$A45 -> 1204 | J45: =((J$1/5)+2)*$A45 -> 1290 | K45: =((K$1/5)+2)*$A45 -> 1376 | L45: =((L$1/5)+2)*$A45 -> 1462 | M45: =((M$1/5)+2)*$A45 -> 1548 | N45: =((N$1/5)+2)*$A45 -> 1634 | O45: =((O$1/5)+2)*$A45 -> 1720 | P45: =((P$1/5)+2)*$A45 -> 1806
A46: 44 | C46: =((C$1/5)+2)*$A46 -> 704 | D46: =((D$1/5)+2)*$A46 -> 792 | E46: =((E$1/5)+2)*$A46 -> 880 | F46: =((F$1/5)+2)*$A46 -> 968 | G46: =((G$1/5)+2)*$A46 -> 1056 | H46: =((H$1/5)+2)*$A46 -> 1144 | I46: =((I$1/5)+2)*$A46 -> 1232 | J46: =((J$1/5)+2)*$A46 -> 1320 | K46: =((K$1/5)+2)*$A46 -> 1408 | L46: =((L$1/5)+2)*$A46 -> 1496 | M46: =((M$1/5)+2)*$A46 -> 1584 | N46: =((N$1/5)+2)*$A46 -> 1672 | O46: =((O$1/5)+2)*$A46 -> 1760 | P46: =((P$1/5)+2)*$A46 -> 1848
A47: 45 | C47: =((C$1/5)+2)*$A47 -> 720 | D47: =((D$1/5)+2)*$A47 -> 810 | E47: =((E$1/5)+2)*$A47 -> 900 | F47: =((F$1/5)+2)*$A47 -> 990 | G47: =((G$1/5)+2)*$A47 -> 1080 | H47: =((H$1/5)+2)*$A47 -> 1170 | I47: =((I$1/5)+2)*$A47 -> 1260 | J47: =((J$1/5)+2)*$A47 -> 1350 | K47: =((K$1/5)+2)*$A47 -> 1440 | L47: =((L$1/5)+2)*$A47 -> 1530 | M47: =((M$1/5)+2)*$A47 -> 1620 | N47: =((N$1/5)+2)*$A47 -> 1710 | O47: =((O$1/5)+2)*$A47 -> 1800 | P47: =((P$1/5)+2)*$A47 -> 1890
A48: 46 | C48: =((C$1/5)+2)*$A48 -> 736 | D48: =((D$1/5)+2)*$A48 -> 828 | E48: =((E$1/5)+2)*$A48 -> 920 | F48: =((F$1/5)+2)*$A48 -> 1012 | G48: =((G$1/5)+2)*$A48 -> 1104 | H48: =((H$1/5)+2)*$A48 -> 1196 | I48: =((I$1/5)+2)*$A48 -> 1288 | J48: =((J$1/5)+2)*$A48 -> 1380 | K48: =((K$1/5)+2)*$A48 -> 1472 | L48: =((L$1/5)+2)*$A48 -> 1564 | M48: =((M$1/5)+2)*$A48 -> 1656 | N48: =((N$1/5)+2)*$A48 -> 1748 | O48: =((O$1/5)+2)*$A48 -> 1840 | P48: =((P$1/5)+2)*$A48 -> 1932
A49: 47 | C49: =((C$1/5)+2)*$A49 -> 752 | D49: =((D$1/5)+2)*$A49 -> 846 | E49: =((E$1/5)+2)*$A49 -> 940 | F49: =((F$1/5)+2)*$A49 -> 1034 | G49: =((G$1/5)+2)*$A49 -> 1128 | H49: =((H$1/5)+2)*$A49 -> 1222 | I49: =((I$1/5)+2)*$A49 -> 1316 | J49: =((J$1/5)+2)*$A49 -> 1410 | K49: =((K$1/5)+2)*$A49 -> 1504 | L49: =((L$1/5)+2)*$A49 -> 1598 | M49: =((M$1/5)+2)*$A49 -> 1692 | N49: =((N$1/5)+2)*$A49 -> 1786 | O49: =((O$1/5)+2)*$A49 -> 1880 | P49: =((P$1/5)+2)*$A49 -> 1974
A50: 48 | C50: =((C$1/5)+2)*$A50 -> 768 | D50: =((D$1/5)+2)*$A50 -> 864 | E50: =((E$1/5)+2)*$A50 -> 960 | F50: =((F$1/5)+2)*$A50 -> 1056 | G50: =((G$1/5)+2)*$A50 -> 1152 | H50: =((H$1/5)+2)*$A50 -> 1248 | I50: =((I$1/5)+2)*$A50 -> 1344 | J50: =((J$1/5)+2)*$A50 -> 1440 | K50: =((K$1/5)+2)*$A50 -> 1536 | L50: =((L$1/5)+2)*$A50 -> 1632 | M50: =((M$1/5)+2)*$A50 -> 1728 | N50: =((N$1/5)+2)*$A50 -> 1824 | O50: =((O$1/5)+2)*$A50 -> 1920 | P50: =((P$1/5)+2)*$A50 -> 2016
A51: 49 | C51: =((C$1/5)+2)*$A51 -> 784 | D51: =((D$1/5)+2)*$A51 -> 882 | E51: =((E$1/5)+2)*$A51 -> 980 | F51: =((F$1/5)+2)*$A51 -> 1078 | G51: =((G$1/5)+2)*$A51 -> 1176 | H51: =((H$1/5)+2)*$A51 -> 1274 | I51: =((I$1/5)+2)*$A51 -> 1372 | J51: =((J$1/5)+2)*$A51 -> 1470 | K51: =((K$1/5)+2)*$A51 -> 1568 | L51: =((L$1/5)+2)*$A51 -> 1666 | M51: =((M$1/5)+2)*$A51 -> 1764 | N51: =((N$1/5)+2)*$A51 -> 1862 | O51: =((O$1/5)+2)*$A51 -> 1960 | P51: =((P$1/5)+2)*$A51 -> 2058
A52: 50 | C52: =((C$1/5)+2)*$A52 -> 800 | D52: =((D$1/5)+2)*$A52 -> 900 | E52: =((E$1/5)+2)*$A52 -> 1000 | F52: =((F$1/5)+2)*$A52 -> 1100 | G52: =((G$1/5)+2)*$A52 -> 1200 | H52: =((H$1/5)+2)*$A52 -> 1300 | I52: =((I$1/5)+2)*$A52 -> 1400 | J52: =((J$1/5)+2)*$A52 -> 1500 | K52: =((K$1/5)+2)*$A52 -> 1600 | L52: =((L$1/5)+2)*$A52 -> 1700 | M52: =((M$1/5)+2)*$A52 -> 1800 | N52: =((N$1/5)+2)*$A52 -> 1900 | O52: =((O$1/5)+2)*$A52 -> 2000 | P52: =((P$1/5)+2)*$A52 -> 2100
A53: 51 | C53: =((C$1/5)+2)*$A53 -> 816 | D53: =((D$1/5)+2)*$A53 -> 918 | E53: =((E$1/5)+2)*$A53 -> 1020 | F53: =((F$1/5)+2)*$A53 -> 1122 | G53: =((G$1/5)+2)*$A53 -> 1224 | H53: =((H$1/5)+2)*$A53 -> 1326 | I53: =((I$1/5)+2)*$A53 -> 1428 | J53: =((J$1/5)+2)*$A53 -> 1530 | K53: =((K$1/5)+2)*$A53 -> 1632 | L53: =((L$1/5)+2)*$A53 -> 1734 | M53: =((M$1/5)+2)*$A53 -> 1836 | N53: =((N$1/5)+2)*$A53 -> 1938 | O53: =((O$1/5)+2)*$A53 -> 2040 | P53: =((P$1/5)+2)*$A53 -> 2142
A54: 52 | C54: =((C$1/5)+2)*$A54 -> 832 | D54: =((D$1/5)+2)*$A54 -> 936 | E54: =((E$1/5)+2)*$A54 -> 1040 | F54: =((F$1/5)+2)*$A54 -> 1144 | G54: =((G$1/5)+2)*$A54 -> 1248 | H54: =((H$1/5)+2)*$A54 -> 1352 | I54: =((I$1/5)+2)*$A54 -> 1456 | J54: =((J$1/5)+2)*$A54 -> 1560 | K54: =((K$1/5)+2)*$A54 -> 1664 | L54: =((L$1/5)+2)*$A54 -> 1768 | M54: =((M$1/5)+2)*$A54 -> 1872 | N54: =((N$1/5)+2)*$A54 -> 1976 | O54: =((O$1/5)+2)*$A54 -> 2080 | P54: =((P$1/5)+2)*$A54 -> 2184
A55: 53 | C55: =((C$1/5)+2)*$A55 -> 848 | D55: =((D$1/5)+2)*$A55 -> 954 | E55: =((E$1/5)+2)*$A55 -> 1060 | F55: =((F$1/5)+2)*$A55 -> 1166 | G55: =((G$1/5)+2)*$A55 -> 1272 | H55: =((H$1/5)+2)*$A55 -> 1378 | I55: =((I$1/5)+2)*$A55 -> 1484 | J55: =((J$1/5)+2)*$A55 -> 1590 | K55: =((K$1/5)+2)*$A55 -> 1696 | L55: =((L$1/5)+2)*$A55 -> 1802 | M55: =((M$1/5)+2)*$A55 -> 1908 | N55: =((N$1/5)+2)*$A55 -> 2014 | O55: =((O$1/5)+2)*$A55 -> 2120 | P55: =((P$1/5)+2)*$A55 -> 2226
A56: 54 | C56: =((C$1/5)+2)*$A56 -> 864 | D56: =((D$1/5)+2)*$A56 -> 972 | E56: =((E$1/5)+2)*$A56 -> 1080 | F56: =((F$1/5)+2)*$A56 -> 1188 | G56: =((G$1/5)+2)*$A56 -> 1296 | H56: =((H$1/5)+2)*$A56 -> 1404 | I56: =((I$1/5)+2)*$A56 -> 1512 | J56: =((J$1/5)+2)*$A56 -> 1620 | K56: =((K$1/5)+2)*$A56 -> 1728 | L56: =((L$1/5)+2)*$A56 -> 1836 | M56: =((M$1/5)+2)*$A56 -> 1944 | N56: =((N$1/5)+2)*$A56 -> 2052 | O56: =((O$1/5)+2)*$A56 -> 2160 | P56: =((P$1/5)+2)*$A56 -> 2268
A57: 55 | C57: =((C$1/5)+2)*$A57 -> 880 | D57: =((D$1/5)+2)*$A57 -> 990 | E57: =((E$1/5)+2)*$A57 -> 1100 | F57: =((F$1/5)+2)*$A57 -> 1210 | G57: =((G$1/5)+2)*$A57 -> 1320 | H57: =((H$1/5)+2)*$A57 -> 1430 | I57: =((I$1/5)+2)*$A57 -> 1540 | J57: =((J$1/5)+2)*$A57 -> 1650 | K57: =((K$1/5)+2)*$A57 -> 1760 | L57: =((L$1/5)+2)*$A57 -> 1870 | M57: =((M$1/5)+2)*$A57 -> 1980 | N57: =((N$1/5)+2)*$A57 -> 2090 | O57: =((O$1/5)+2)*$A57 -> 2200 | P57: =((P$1/5)+2)*$A57 -> 2310
A58: 56 | C58: =((C$1/5)+2)*$A58 -> 896 | D58: =((D$1/5)+2)*$A58 -> 1008 | E58: =((E$1/5)+2)*$A58 -> 1120 | F58: =((F$1/5)+2)*$A58 -> 1232 | G58: =((G$1/5)+2)*$A58 -> 1344 | H58: =((H$1/5)+2)*$A58 -> 1456 | I58: =((I$1/5)+2)*$A58 -> 1568 | J58: =((J$1/5)+2)*$A58 -> 1680 | K58: =((K$1/5)+2)*$A58 -> 1792 | L58: =((L$1/5)+2)*$A58 -> 1904 | M58: =((M$1/5)+2)*$A58 -> 2016 | N58: =((N$1/5)+2)*$A58 -> 2128 | O58: =((O$1/5)+2)*$A58 -> 2240 | P58: =((P$1/5)+2)*$A58 -> 2352
A59: 57 | C59: =((C$1/5)+2)*$A59 -> 912 | D59: =((D$1/5)+2)*$A59 -> 1026 | E59: =((E$1/5)+2)*$A59 -> 1140 | F59: =((F$1/5)+2)*$A59 -> 1254 | G59: =((G$1/5)+2)*$A59 -> 1368 | H59: =((H$1/5)+2)*$A59 -> 1482 | I59: =((I$1/5)+2)*$A59 -> 1596 | J59: =((J$1/5)+2)*$A59 -> 1710 | K59: =((K$1/5)+2)*$A59 -> 1824 | L59: =((L$1/5)+2)*$A59 -> 1938 | M59: =((M$1/5)+2)*$A59 -> 2052 | N59: =((N$1/5)+2)*$A59 -> 2166 | O59: =((O$1/5)+2)*$A59 -> 2280 | P59: =((P$1/5)+2)*$A59 -> 2394
A60: 58 | C60: =((C$1/5)+2)*$A60 -> 928 | D60: =((D$1/5)+2)*$A60 -> 1044 | E60: =((E$1/5)+2)*$A60 -> 1160 | F60: =((F$1/5)+2)*$A60 -> 1276 | G60: =((G$1/5)+2)*$A60 -> 1392 | H60: =((H$1/5)+2)*$A60 -> 1508 | I60: =((I$1/5)+2)*$A60 -> 1624 | J60: =((J$1/5)+2)*$A60 -> 1740 | K60: =((K$1/5)+2)*$A60 -> 1856 | L60: =((L$1/5)+2)*$A60 -> 1972 | M60: =((M$1/5)+2)*$A60 -> 2088 | N60: =((N$1/5)+2)*$A60 -> 2204 | O60: =((O$1/5)+2)*$A60 -> 2320 | P60: =((P$1/5)+2)*$A60 -> 2436
A61: 59 | C61: =((C$1/5)+2)*$A61 -> 944 | D61: =((D$1/5)+2)*$A61 -> 1062 | E61: =((E$1/5)+2)*$A61 -> 1180 | F61: =((F$1/5)+2)*$A61 -> 1298 | G61: =((G$1/5)+2)*$A61 -> 1416 | H61: =((H$1/5)+2)*$A61 -> 1534 | I61: =((I$1/5)+2)*$A61 -> 1652 | J61: =((J$1/5)+2)*$A61 -> 1770 | K61: =((K$1/5)+2)*$A61 -> 1888 | L61: =((L$1/5)+2)*$A61 -> 2006 | M61: =((M$1/5)+2)*$A61 -> 2124 | N61: =((N$1/5)+2)*$A61 -> 2242 | O61: =((O$1/5)+2)*$A61 -> 2360 | P61: =((P$1/5)+2)*$A61 -> 2478
A62: 60 | C62: =((C$1/5)+2)*$A62 -> 960 | D62: =((D$1/5)+2)*$A62 -> 1080 | E62: =((E$1/5)+2)*$A62 -> 1200 | F62: =((F$1/5)+2)*$A62 -> 1320 | G62: =((G$1/5)+2)*$A62 -> 1440 | H62: =((H$1/5)+2)*$A62 -> 1560 | I62: =((I$1/5)+2)*$A62 -> 1680 | J62: =((J$1/5)+2)*$A62 -> 1800 | K62: =((K$1/5)+2)*$A62 -> 1920 | L62: =((L$1/5)+2)*$A62 -> 2040 | M62: =((M$1/5)+2)*$A62 -> 2160 | N62: =((N$1/5)+2)*$A62 -> 2280 | O62: =((O$1/5)+2)*$A62 -> 2400 | P62: =((P$1/5)+2)*$A62 -> 2520

A1: EQDruids thanks all of its players and contributors to making this the most complete druid resource on the web! Back to EQ Druids Homepage This page was last modified December 06, 2000 since May 04, 1999 Webmaster :Twilight (c) EQDruids, 1999-2000. EQDruids is a division of Slategroup Everquest is a Trademark of Sony Corporation.

A2: Prev. 5 | B2: JOIN | C2: Next 5
A3: Previous | B3: List | C3: Next