<!DOCTYPE html PUBLIC "-//W3C//DTD XHTML 1.0 Transitional//EN" "http://www.w3.org/TR/xhtml1/DTD/xhtml1-transitional.dtd">
<html dir="ltr" lang="en">
<head>
	<title>EQInterface Forums - foofyspells (storyline mod)</title>
<meta http-equiv="Content-Type" content="text/html; charset=ISO-8859-1" />
<meta name="generator" content="vBulletin 3.0.10" />
<meta name="keywords" content="Everquest,Everquest II,EQ,EQ2,EQII,SOE,Interface,XML,TGA,Mods,Skins" />
<meta name="description" content="An Everquest II Interface site." />

<!-- CSS Stylesheet -->
<style type="text/css">
<!--
/* vBulletin 3 CSS For Style 'EQGUI Forums vBulletin 3 Style' (styleid: 1) */
body
{
	background-color: #FFFFFF;
	color: #000000;
	font: 10pt verdana, geneva, lucida, 'lucida grande', arial, helvetica, sans-serif;
	margin: 0px 0px 0px 0px;
}
a:link
{
	color: #044965;
}
a:visited
{
	color: #044965;
}
a:hover, a:active
{
	color: #FF4400;
}
.page
{
	color: #000000;
}
td, th, p, li
{
	font: 10pt verdana, geneva, lucida, 'lucida grande', arial, helvetica, sans-serif;
}
.tborder
{
	background-color: #FFFFFF;
	color: #000000;
	border: 1px solid #D2D4D5;
}
.tcat
{
	background: #0577A6 url(/images/gradients/gradient_tcat.gif) repeat-x top left;
	color: #FFFFFF;
	font: bold 10pt verdana, geneva, lucida, 'lucida grande', arial, helvetica, sans-serif;
}
.tcat a:link
{
	color: #ffffff;
	text-decoration: none;
}
.tcat a:visited
{
	color: #ffffff;
	text-decoration: none;
}
.tcat a:hover, .tcat a:active
{
	color: #FFFF66;
	text-decoration: underline;
}
.thead
{
	background-color: #1A5673;
	color: #E0E0E0;
	font: bold 11px tahoma, verdana, geneva, lucida, 'lucida grande', arial, helvetica, sans-serif;
}
.thead a:link
{
	color: #E0E0E0;
}
.thead a:visited
{
	color: #E0E0E0;
}
.thead a:hover, .thead a:active
{
	color: #FFFF00;
}
.tfoot
{
	background: #0577A6 url(/images/gradients/gradient_tcat.gif) repeat-x top left;
	color: #FFFFFF;
}
.tfoot a:link
{
	color: #FFFFFF;
}
.tfoot a:visited
{
	color: #FFFFFF;
}
.tfoot a:hover, .tfoot a:active
{
	color: #FFFFFF;
}
.alt1, .alt1Active
{
	background-color: #F5F5F5;
	color: #000000;
}
.alt2, .alt2Active
{
	background-color: #EEEEEE;
	color: #000000;
}
.wysiwyg
{
	background-color: #FBFBFB;
	color: #000000;
	font: 10pt verdana, geneva, lucida, 'lucida grande', arial, helvetica, sans-serif;
}
textarea, .bginput
{
	font: 10pt verdana, geneva, lucida, 'lucida grande', arial, helvetica, sans-serif;
}
.button
{
	font: 11px verdana, geneva, lucida, 'lucida grande', arial, helvetica, sans-serif;
}
select
{
	font: 11px verdana, geneva, lucida, 'lucida grande', arial, helvetica, sans-serif;
}
option, optgroup
{
	font-size: 11px;
	font-family: verdana, geneva, lucida, 'lucida grande', arial, helvetica, sans-serif;
}
.smallfont
{
	font: 11px verdana, geneva, lucida, 'lucida grande', arial, helvetica, sans-serif;
}
.time
{
	color: #000000;
}
.navbar
{
	font: 11px verdana, geneva, lucida, 'lucida grande', arial, helvetica, sans-serif;
}
.highlight
{
	color: #FF0000;
	font-weight: bold;
}
.fjsel
{
	background-color: #0577A6;
	color: #E0E0E0;
}
.fjdpth0
{
	background-color: #F7F7F7;
	color: #000000;
}
.panel
{
	background-color: #FBFBFB;
	color: #000000;
	padding: 10px;
	border: 2px outset;
}
.panelsurround
{
	background-color: #F4F4F4;
	color: #000000;
}
legend
{
	color: #22229C;
	font: 11px tahoma, verdana, geneva, lucida, 'lucida grande', arial, helvetica, sans-serif;
}
.vbmenu_control
{
	background: #0577A6 url(/images/gradients/gradient_tcat.gif) repeat-x top left;
	color: #FFFFFF;
	font: bold 11px tahoma, verdana, geneva, lucida, 'lucida grande', arial, helvetica, sans-serif;
	padding: 1px 3px 1px 3px;
	white-space: nowrap;
}
.vbmenu_control a:link
{
	color: #FFFFFF;
	text-decoration: none;
}
.vbmenu_control a:visited
{
	color: #FFFFFF;
	text-decoration: none;
}
.vbmenu_control a:hover, .vbmenu_control a:active
{
	color: #FFFFFF;
	text-decoration: underline;
}
.vbmenu_popup
{
	background-color: #FFFFFF;
	color: #000000;
	border: 1px solid #D2D4D5;
}
.vbmenu_option
{
	background-color: #F4F4F4;
	color: #000000;
	font: 11px verdana, geneva, lucida, 'lucida grande', arial, helvetica, sans-serif;
	white-space: nowrap;
	cursor: pointer;
}
.vbmenu_option a:link
{
	color: #22229C;
	text-decoration: none;
}
.vbmenu_option a:visited
{
	color: #22229C;
	text-decoration: none;
}
.vbmenu_option a:hover, .vbmenu_option a:active
{
	color: #FFFFFF;
	text-decoration: none;
}
.vbmenu_hilite
{
	background-color: #0577A6;
	color: #FFFFFF;
	font: 11px verdana, geneva, lucida, 'lucida grande', arial, helvetica, sans-serif;
	white-space: nowrap;
	cursor: pointer;
}
.vbmenu_hilite a:link
{
	color: #FFFFFF;
	text-decoration: none;
}
.vbmenu_hilite a:visited
{
	color: #FFFFFF;
	text-decoration: none;
}
.vbmenu_hilite a:hover, .vbmenu_hilite a:active
{
	color: #FFFFFF;
	text-decoration: none;
}
/* ***** styling for 'big' usernames on postbit etc. ***** */
.bigusername { font-size: 14pt; }

/* ***** small padding on 'thead' elements ***** */
td.thead, div.thead { padding: 4px; }

/* ***** basic styles for multi-page nav elements */
.pagenav a { text-decoration: none; }
.pagenav td { padding: 2px 4px 2px 4px; }

/* ***** define margin and font-size for elements inside panels ***** */
.fieldset { margin-bottom: 6px; }
.fieldset, .fieldset td, .fieldset p, .fieldset li { font-size: 11px; }

/* ***** don't change the following ***** */
form { display: inline; }
label { cursor: default; }
.normal { font-weight: normal; }
.inlineimg { vertical-align: middle; }
.vbmenu_top
{
	background-color: #626979;
	color: #FFFFFF;
	font: bold 11px tahoma, verdana, geneva, lucida, 'lucida grande', arial, helvetica, sans-serif;
	padding: 1px 3px 1px 3px;
	white-space: nowrap;
}
.vbmenu_top a:link
{
	color: #FFFFFF;
	text-decoration: none;
}
.vbmenu_top a:visited
{
	color: #FFFFFF;
	text-decoration: none;
}
.vbmenu_top a:hover, .vbmenu_control a:active
{
	color: #FFFFFF;
	text-decoration: underline;
}
.bshadow
{
	background: #FFFFFF url(/images/layout/body-shadow.gif) repeat-x top left;
	color: #000000;
	font: 11pt verdana, geneva, lucida, 'lucida grande', arial, helvetica, sans-serif;
}
.bline
{
	background: #FFFFFF url(/images/layout/black-line.gif) repeat-x top
left;
}
.eqi_cat {
	color:#525252;
	font-family:Verdana, Arial, Helvetica;
	font-size:10px;
	font-weight:normal;
	text-decoration:none;
}
.eqi_author {
	color:#525252;
	font-family:Verdana, Arial, Helvetica;
	font-size:10px;
	font-weight:normal;
	text-decoration:none;
}
.eqi_text {
	color:#000000;
	font-family:Verdana, Arial, Helvetica;
	font-size:10px;
	font-weight:bold;
	text-decoration:none;
}
a.eqi_link {
	color:#000000;
	font-family:Verdana, Arial, Helvetica;
	font-size:10px;
	font-weight:bold;
	text-decoration:none;
}
a.eqi_link:visited {
	color:#000000;
	font-size:10px;
	font-weight:bold;
	text-decoration:none;
}
a.eqi_link:hover {
	color:#FF6600;
	font-size: 10px;
	font-weight:bold;
	text-decoration:underline;
}
.boxes{
	border-left:2px solid #FFFFFF;
	border-bottom:2px solid #FFFFFF;
	margin:0px 0px 0px 0px;
	padding:0px 0px 0px 0px;
	clear: both;
}
#pictures{
	float:right;
	width:275px;
	margin-left: 7px;
	position:relative;
	z-index: 100
}
-->
</style>

<!-- / CSS Stylesheet -->

<script type="text/javascript">
<!--
var SESSIONURL = "s=08828acfcca8bf515aff0f08f5fc454a&amp;";
var IMGDIR_MISC = "/images/misc";
// -->
</script>

<script type="text/javascript" src="clientscript/vbulletin_global.js"></script>

<LINK REL="SHORTCUT ICON" HREF="/favicon.ico">
<link rel="stylesheet" type="text/css" href="http://www.eqinterface.com/ogmenu.css" />

</head>
<body onload="">

<form name="jump" size="2">
<table class="OGBar_table" width="100%" height="30" border="0" cellspacing="0" cellpadding="6">
  <tr>
	<td class="OGBar" width="107px" align="left"><a class="OGBar" href="http://www.ogaming.com"><img class="OGBar" src="http://www.ogaming.com/images/oglogo_blk.jpg" border="0" /></a></td>
	<td>&nbsp;</td>
<td class="OGBar" align="right" width="50%">
<a href="http://www.ogaming.com/data/4038~E3LatestUpdates.php" class="OGBar"><strong> <font color="#E07405">E3 2006 COVERAGE</font></strong></a>&nbsp;|&nbsp;<a href="http://guilds.ogaming.com" target="_blank" class="OGBar"><strong>FREE GUILD HOSTING </strong></a>&nbsp;|<a href="http://www.ogamingstore.com/" target="_blank" class="OGBar"><strong> BUY GAMES!</strong></a></span>&nbsp;|&nbsp;<a class="OGBar" href="http://www.ogaming.com/data/2734~Help.php">Help & FAQ</a> &nbsp;<select class="OGBar" name="menu" onChange="location=document.jump.menu.options[document.jump.menu.selectedIndex].value;" value="GO" bgcolor=#FFFFFF style="font-family : Verdana, Geneva, Arial, Helvetica, sans-serif;font-size : 10px;text-align : left;text-decoration : none;border: 0px solid #000000;padding : 0px;">
<option value="" selected>OGaming Network</option>
<option value="">&nbsp;</option>
<option value="">-- GENERAL --</option>
<option value="http://www.ogaming.com">OGaming Main</option>
<option value="http://www.ogamingstore.com/">OGaming Store</option>
<option value="http://radio.ogaming.com">Online Gaming Radio</option>
<option value="http://guilds.ogaming.com">Guild Services</option>
<option value="">&nbsp;</option>
<option value="">-- GAME DATABASES --</option>
<option value="http://www.thottbot.com">World of Warcraft</option>
<option value="http://eq.ogaming.com/db/">Everquest</option>
<option value="http://eq2.ogaming.com/db/">Everquest 2</option>
<option value="http://lineage2.ogaming.com/db/">Lineage 2</option>
<option value="http://www.thottbot.com">Thottbot</option>
<option value="">&nbsp;</option>
<option value="">-- GAME INTERFACES --</option>
<option value="http://www.eqinterface.com/">EQ Interface</option>
<option value="http://www.eq2interface.com/">EQ2 Interface</option>
<option value="http://www.wowinterface.com/">WoW Interface</option>
<option value="http://vginterface.com/">VG Intrerface</option>
<option value="">&nbsp;</option>
<option value="">-- OGAMING NETWORK --</option>
<option value="http://wow.ogaming.com">World of Warcraft</option>
<option value="http://eq.ogaming.com">Everquest</option>
<option value="http://eq2.ogaming.com">Everquest 2</option>
<option value="http://guildwars.ogaming.com">Guild Wars</option>
<option value="http://swg.ogaming.com">Star Wars Galaxies</option>
<option value="http://ddo.ogaming.com">Dungeons and Dragons Online</option>
<option value="http://meo.ogaming.com">Lord of the Rings Online</option>
<option value="http://vanguard.ogaming.com">Vanguard</option>
<option value="http://sto.ogaming.com">Star Trek Online</option>
<option value="http://tr.ogaming.com">Tabula Rasa</option>
<option value="http://coh.ogaming.com">City of Heroes</option>
<option value="http://matrix.ogaming.com">Matrix Online</option>
<option value="http://ragnarok.ogaming.com">Ragnarok Online</option>
<option value="http://www.mmoinsider.com">MMO Insider</option>
<option value="">&nbsp;</option>
<option value="">-- OGAMING AFFILIATES --</option>
<option value="http://www.thottbot.com">Thottbot</option>
<option value="http://www.warcraftcentral.com">Warcraft Central</option>
<option value="http://www.l2orphus.com">L2 Orphus</option>
<option value="http://www.rpgexpert.com">RPG Expert</option>
<option value="http://www.moghouse.net">MOG House</option>
<option value="http://www.thatffxisite.com">That FFXI Site</option>
<option value="http://www.guild-hall.net">The Guild Hall</option>
<option value="http://p203.ezboard.com/beqdruids24038">EQ Druids</option>
<option value="http://www.eqshaman.com">EQ Shaman</option>
<option value="http://www.everquestdruids.com">Everquest Druids</option>
<option value="http://www.monkly-business.com">Monkly Business</option>
<option value="http://shadowknight.ogaming.com/">Shadowknight</option>
<option value="http://www.interealms.com">Interealms</option>
<option value="http://www.everquestplatinum.com">Everquest Platinum</option>
<option value="http://www.drinal.com">Drinal</option>
<option value="http://www.luclin.com">Luclin</option>
<option value="http://www.prexus.com">Prexus</option>
<option value="http://www.quellious.com">Quellious</option>
<option value="http://www.maelinstarpyre.com">Maelin Starpyre</option>
<option value="http://www.gamelists.net">GameLists</option>
<option value="http://www.gamers200.com">Gamers 200</option>
<option value="http://www.rpgwh.net">RPG Warehouse</option>
</select>
</td>
	</tr>
</table>
</form>
<!-- logo -->
<a name="top"></a>
<table cellpadding="0" cellspacing="0" border="0" width="100%">
	<tr>
		<td bgcolor="#313840" background="/images/layout/topbar-bg.gif"><img src="/images/layout/pixel.gif" width="1" height="11" alt="" /></td>
	</tr>
</table>
<table cellpadding="0" cellspacing="0" border="0" width="100%">
	<tr>
		<td bgcolor="#0577A6" width="254"><img src="/images/layout/eqi-logo.jpg" width="254" height="95" alt="" /></td><td bgcolor="#0577A6" background="/images/layout/headerleft-bg.jpg" width="100%" valign="middle"><div align="center" >
<script language="JavaScript" type="text/javascript">
ord=Math.random()*10000000000000000;
document.write('<script language="JavaScript" src="http://ad.doubleclick.net/adj/ogn.eqinterface/EQ;tile=1;sz=728x90;ord=' + ord + '?" type="text/javascript"><\/script>');
</script><noscript><a href="http://ad.doubleclick.net/jump/ogn.eqinterface/EQ;tile=1;sz=728x90;ord=123456789?" target="_blank"><img src="http://ad.doubleclick.net/ad/ogn.eqinterface/EQ;tile=1;sz=468x60;ord=123456789?" width="728" height="90" border="0" alt=""></a></noscript></div>
		</td>
	</tr>
</table>
<table cellpadding="0" cellspacing="0" border="0" width="100%">
	<tr>
		<td bgcolor="#313840" background="/images/layout/bottombar2-bg.gif" colspan="2"><img src="/images/layout/pixel.gif" width="1" height="5" alt="" /></td>
	</tr>
	<tr>
		<td bgcolor="#626979" width="100%" align="center" valign="middle">
			<!-- nav buttons bar -->
			<div align="center">
				<table cellpadding="6" cellspacing="0" border="0" width="100%" align="center" style="border-top-width:0px">
					<tr align="center">	
						<td class="vbmenu_top"><a href="http://www.eqinterface.com/index.php?s=08828acfcca8bf515aff0f08f5fc454a&amp;">Home</a></td>
						<td class="vbmenu_top"><a href="http://www.eqinterface.com/forums/index.php?s=08828acfcca8bf515aff0f08f5fc454a&amp;">Forum</a></td>
						<td class="vbmenu_top"><a href="http://www.eqinterface.com/downloads/index.php?s=08828acfcca8bf515aff0f08f5fc454a&amp;">Downloads</a></td>
						<td class="vbmenu_top"><a href="/downloads/filecpl.php?s=08828acfcca8bf515aff0f08f5fc454a&amp;action=favorite">My Favorites</a></td>
						
						
							<td class="vbmenu_top"><a href="http://www.eqinterface.com/forums/register.php?s=08828acfcca8bf515aff0f08f5fc454a&amp;">Register</a></td>
						
						<td class="vbmenu_top"><a href="http://www.eqinterface.com/forums/faq.php?s=08828acfcca8bf515aff0f08f5fc454a&amp;">FAQ</a></td>
				
								
							
							<td class="vbmenu_top"><a href="http://www.eqinterface.com/forums/forumdisplay.php?s=08828acfcca8bf515aff0f08f5fc454a&amp;do=markread">Mark Forums Read</a></td>
										
						
					
				</tr>
				</table>
			</div>
			<!-- / nav buttons bar -->
		</td>
	</tr>
	<tr>
		<td bgcolor="#313840" background="/images/layout/bottombar3-bg.gif" colspan="2"><img src="/images/layout/pixel.gif" width="1" height="5" alt="" /></td>
	</tr>
</table>
<table cellpadding="0" cellspacing="0" border="0" width="100%">
	<tr>
		<td bgcolor="#313840" background="/images/layout/shadow.gif"><img src="/images/layout/pixel.gif" width="1" height="7" alt="" /></td>
	</tr>
</table>

<if condition="">
<!-- NAVBAR POPUP MENUS -->
	
	<if condition="">
				<!-- header quick search form -->
				<div class="vbmenu_popup" id="navbar_search_menu" style="display:none">
					<table cellpadding="4" cellspacing="1" border="0">
					<tr>
						<td class="thead">Search Forums</td>
					</tr>
					<tr>
						<td class="vbmenu_option" title="nohilite">
						<form action="http://www.eqinterface.com/forums/search.php" method="post">
							<input type="hidden" name="do" value="process" />
							<input type="hidden" name="showposts" value="0" />
							<input type="text" class="bginput" name="query" size="20" /><!-- go button -->
<input type="submit" class="button" value="Go"  /><br />
						</form>
						</td>
					</tr>
					<tr>
						<td class="vbmenu_option"><a href="http://www.eqinterface.com/forums/search.php?s=08828acfcca8bf515aff0f08f5fc454a&amp;">Advanced Search</a></td>
					</tr>
					</table>
								<table cellpadding="4" cellspacing="1" border="0">
								<tr>
									<td class="thead">Search Downloads</td>
								</tr>
								<tr>
									<td class="vbmenu_option" title="nohilite">
									<form action="http://www.eqinterface.com/downloads/search.php" method="post">
									<form action="search.php" method="post">
										<input type="hidden" name="s" value="">
										<input type="hidden" name="searchcat" value="all">
										<input type="hidden" name="searchdate" value="-1">
										<input type="hidden" name="so" value="desc">
										<input type="hidden" name="sb" value="date">
										<input type="hidden" name="showdetails" value="0">
										<input type="text" class="bginput" name="searchtext" size="20" /><!-- go button -->
<input type="submit" class="button" value="Go"  /><br />
										<input type="hidden" name="action" value="search">
									</form>
									</td>
								</tr>
								<tr>
									<td class="vbmenu_option"><a href="http://www.eqinterface.com/downloads/search.php?s=08828acfcca8bf515aff0f08f5fc454a&amp;">Advanced Search</a></td>
								</tr>
								</table>
				</div>
				<!-- / header quick search form -->
	</if>

	<if condition="">
	<!-- user cp tools menu -->
	<div class="vbmenu_popup" id="usercptools_menu" style="display:none">
		<table cellpadding="4" cellspacing="1" border="0">
		
		<tr><td class="thead">Quick Links</td></tr>		
		<tr><td class="vbmenu_option"><a href="http://www.eqinterface.com/forums/search.php?s=08828acfcca8bf515aff0f08f5fc454a&amp;do=getnew">New Posts</a></td></tr>
		<tr><td class="vbmenu_option"><a href="http://www.eqinterface.com/forums/forumdisplay.php?s=08828acfcca8bf515aff0f08f5fc454a&amp;do=markread">Mark Forums Read</a></td></tr>
		<tr><td class="vbmenu_option"><a href="http://www.eqinterface.com/forums/memberlist.php?s=08828acfcca8bf515aff0f08f5fc454a&amp;">Members List</a></td></tr>
		<tr><td class="vbmenu_option"><a href="#" onclick="window.open('misc.php?s=08828acfcca8bf515aff0f08f5fc454a&amp;do=buddylist&amp;focus=1','buddylist','statusbar=no,menubar=no,toolbar=no,scrollbars=yes,resizable=yes,width=250,height=300'); return false;">Open Buddy List</a></td></tr>
				
		<tr><td class="thead"><a href="http://www.eqinterface.com/forums/usercp.php?s=08828acfcca8bf515aff0f08f5fc454a&amp;">User Control Panel</a></td></tr>
		<if condition=""><tr><td class="vbmenu_option"><a href="profile.php?s=08828acfcca8bf515aff0f08f5fc454a&amp;do=editsignature">Edit Signature</a></td></tr></if>
		<if condition="1"><tr><td class="vbmenu_option"><a href="profile.php?s=08828acfcca8bf515aff0f08f5fc454a&amp;do=editavatar">Edit Avatar</a></td></tr></if>
		<tr><td class="vbmenu_option"><a href="http://www.eqinterface.com/forums/profile.php?s=08828acfcca8bf515aff0f08f5fc454a&amp;do=editprofile">Edit Profile</a></td></tr>
		<tr><td class="vbmenu_option"><a href="http://www.eqinterface.com/forums/profile.php?s=08828acfcca8bf515aff0f08f5fc454a&amp;do=editoptions">Edit Options</a></td></tr>
		
		<tr><td class="thead">Miscellaneous</td></tr>
		<if condition=""><tr><td class="vbmenu_option"><a href="http://www.eqinterface.com/forums/private.php?s=08828acfcca8bf515aff0f08f5fc454a&amp;">Private Messages</a></td></tr></if>
		<tr><td class="vbmenu_option"><a href="http://www.eqinterface.com/forums/subscription.php?s=08828acfcca8bf515aff0f08f5fc454a&amp;">Subscribed Threads</a></td></tr>
		<tr><td class="vbmenu_option"><a href="http://www.eqinterface.com/forums/member.php?s=08828acfcca8bf515aff0f08f5fc454a&amp;u=0">My Profile</a></td></tr>
		<if condition=""><tr><td class="vbmenu_option"><a href="http://www.eqinterface.com/forums/online.php?s=08828acfcca8bf515aff0f08f5fc454a&amp;">Who's Online</a></td></tr></if>
		
		</table>
	</div>
	<!-- / user cp tools menu -->
	</if>
<!-- / NAVBAR POPUP MENUS -->
<table cellpadding="0" cellspacing="0" border="0" width="100%">
	<tr>
		<td class="shadow" width="100%"><img src="/images/layout/pixel.gif" width="1" height="12" alt="" /></td>
	</tr>
</table>
<table cellpadding="0" cellspacing="0" border="0" width="100%">
	<tr>
		<td align="left">
			<table cellpadding="0" cellspacing="0" border="0">
				<tr>
					<td><img src="/images/layout/pixel.gif" width="5" height="19" alt="" /></td>
					<td title="Go to EQ2Interface.com"><a href="http://www.eq2interface.com"><img src="/images/layout/button-eq2.gif" width="98" height="19" border="0" alt="" /></a></td>
					<td title="Go to WoWInterface.com"><a href="http://www.wowinterface.com"><img src="/images/layout/button-wowi.gif" width="110" height="19" border="0" alt="" /></a></td>
					<td title="Go to VGInterface.com"><a href="http://www.vginterface.com"><img src="/images/layout/button-vgi.gif" width="101" height="19" border="0" alt="" /></a></td>
				</tr>
			</table>
		</td>
		<td width="100%" align="right">
			<table cellpadding="0" cellspacing="0" border="0">
				<tr>
					<td  title="Go to the EQInterface home page"><a href="http://www.eqinterface.com/index.php?s=08828acfcca8bf515aff0f08f5fc454a&amp;"><img src="/images/layout/button-home.gif" width="101" height="19" border="0" alt="" /></a></td>
					<td title="Go to the EQGui discussion forums"><a href="http://www.eqinterface.com/forums/index.php?s=08828acfcca8bf515aff0f08f5fc454a&amp;"><img src="/images/layout/button-forums.gif" width="89" height="19" border="0" alt="" /></a></td>
					<td title="Go to the EQInterface Downloads Section"><a href="http://www.eqinterface.com/downloads/index.php?s=08828acfcca8bf515aff0f08f5fc454a&amp;"><img src="/images/layout/button-downloads.gif" width="95" height="19" border="0" alt="" /></a></td>
					<td><img src="/images/layout/pixel.gif" width="5" height="19" alt="" /></td>
				</tr>
			</table>
		</td>
	</tr>
</table>
<table cellpadding="0" cellspacing="0" border="0" width="100%">
	<tr>
		<td class="bline" width="100%"><img src="/images/layout/pixel.gif" width="1" height="3" alt="" /></td>
	</tr>
</table>
<table cellpadding="0" cellspacing="0" border="0" width="100%">
	<tr>
		<td class="bshadow" width="100%">

<!-- content table -->
<!-- open content container -->

	<div align="center">
		<div class="page" style="width:100%; text-align:left">
			<div style="padding:0px 10px 0px 10px">


<script type="text/javascript">
<!--
function log_out()
{
	ht = document.getElementsByTagName("html");
	ht[0].style.filter = "progid:DXImageTransform.Microsoft.BasicImage(grayscale=1)";
	if (confirm('Are you sure you want to log out?'))
	{
		return true;
	}
	else
	{
		ht[0].style.filter = "";
		return false;
	}
}
//-->
</script>

<br />

<!-- breadcrumb, login, pm info -->
<table class="tborder" cellpadding="6" cellspacing="1" border="0" width="100%" align="center">
<tr>
	<td class="alt1" width="100%">
		
			<table cellpadding="0" cellspacing="0" border="0">
			<tr valign="bottom">
				<td><a href="#" onclick="history.back(1)"><img src="/images/misc/navbits_start.gif" alt="Go Back" border="0" /></a></td>
				<td>&nbsp;</td>
				<td width="100%"><span class="navbar"><a href="index.php?s=08828acfcca8bf515aff0f08f5fc454a&amp;">EQInterface Forums</a></span> 
	<span class="navbar">&gt; <a href="forumdisplay.php?s=08828acfcca8bf515aff0f08f5fc454a&amp;f=4">Interface Gallery Discussion</a></span>


	<span class="navbar">&gt; <a href="forumdisplay.php?s=08828acfcca8bf515aff0f08f5fc454a&amp;f=5">Released</a></span>

</td>
			</tr>
			<tr>
				<td class="navbar" style="font-size:10pt; padding-top:1px" colspan="3"><a href="/forums/showthread.php?t=9312&amp;amp;page=2"><img class="inlineimg" src="/images/misc/navbits_finallink.gif" alt="Reload this Page" border="0" /></a> <strong>
	foofyspells (storyline mod)

</strong></td>
			</tr>
			</table>			
		
	</td>	
	
	
		
		<td class="alt2" nowrap="nowrap" style="padding:0px">
			
		<!-- login form -->
		<form action="login.php" method="post" onsubmit="md5hash(vb_login_password,vb_login_md5password)">
		<script type="text/javascript" src="clientscript/vbulletin_md5.js"></script>
		<table cellpadding="0" cellspacing="3" border="0">
		<tr>
			<td class="smallfont">User Name</td>
			<td><input type="text" class="button" name="vb_login_username" id="navbar_username" size="10" accesskey="u" tabindex="1" value="User Name" onfocus="if (this.value == 'User Name') this.value = '';" /></td>
			<td class="smallfont" colspan="2" nowrap="nowrap"><label for="cb_cookieuser_navbar"><input type="checkbox" name="cookieuser" value="1" tabindex="3" id="cb_cookieuser_navbar" accesskey="c" checked="checked" />Remember Me?</label></td>
		</tr>
		<tr>
			<td class="smallfont">Password</td>
			<td><input type="password" class="button" name="vb_login_password" size="10" accesskey="p" tabindex="2" /></td>
			<td><input type="submit" class="button" value="Log in" tabindex="4" title="Enter your username and password in the boxes provided to login, or click the 'register' button to create a profile for yourself." accesskey="s" /></td>
		</tr>
		</table>
		<input type="hidden" name="s" value="08828acfcca8bf515aff0f08f5fc454a" />
		<input type="hidden" name="do" value="login" />
		<input type="hidden" name="forceredirect" value="1" />			
		<input type="hidden" name="vb_login_md5password" />
		</form>
		<!-- / login form -->
			
		</td>
		
		
	
</tr>
</table>
<!-- / breadcrumb, login, pm info -->
<br />



<a name="poststop" id="poststop"></a>

<!-- controls above postbits -->
<table cellpadding="0" cellspacing="0" border="0" width="100%" style="margin-bottom:3px">
<tr valign="bottom">
	
		<td class="smallfont"><a href="newreply.php?s=08828acfcca8bf515aff0f08f5fc454a&amp;do=newreply&amp;noquote=1&amp;p=48946"><img src="/images/buttons/reply.gif" alt="Reply" border="0" /></a></td>
	
	<td align="right"><div class="pagenav" align="right">
<table class="tborder" cellpadding="3" cellspacing="1" border="0">
<tr>
	<td class="vbmenu_control" style="font-weight:normal"><!--<img src="/images/misc/multipage.gif" alt="Showing results 1 to 15 of 79 (6 pages)" /> -->Page 1 of 6</td>
	
	
		<td class="alt2"><span class="smallfont" title="Showing results 1 to 15 of 79"><strong>1</strong></span></td>
 	<td class="alt1"><a class="smallfont" href="showthread.php?s=08828acfcca8bf515aff0f08f5fc454a&amp;t=9312&amp;page=2&amp;pp=15" title="Show results 16 to 30 of 79">2</a></td>
	<td class="alt1"><a class="smallfont" href="showthread.php?s=08828acfcca8bf515aff0f08f5fc454a&amp;t=9312&amp;page=3&amp;pp=15" title="Show results 31 to 45 of 79">3</a></td>

	<td class="alt1"><a class="smallfont" href="showthread.php?s=08828acfcca8bf515aff0f08f5fc454a&amp;t=9312&amp;page=2&amp;pp=15" title="Next Page - Results 16 to 30 of 79">&gt;</a></td>
	<td class="alt1"><a class="smallfont" href="showthread.php?s=08828acfcca8bf515aff0f08f5fc454a&amp;t=9312&amp;page=6&amp;pp=15" title="Last Page - Results 76 to 79 of 79">Last <strong>&raquo;</strong></a></td>
</tr>
</table>
</div>
</td>
</tr>
</table>
<!-- / controls above postbits -->

<!-- toolbar -->
<table class="tborder" cellpadding="6" cellspacing="1" border="0" width="100%" align="center" style="border-bottom-width:0px">
<tr>
	<td class="tcat" width="100%">
		<div class="smallfont">
		
		&nbsp;
		</div>
	</td>
	<td class="vbmenu_control" id="threadtools">
		<a href="#goto_threadtools">Thread Tools</a>
		
	</td>
	
	
	
	<td class="vbmenu_control" id="displaymodes">
		<a href="#goto_displaymodes">Display Modes</a>
		
	</td>
	
</tr>
</table>
<!-- / toolbar -->

<!-- end content table -->

		</div>	
	</div>
</div>

<!-- / close content container -->
<!-- / end content table -->



<div id="posts"><!-- post #48946 -->
<!-- open content container -->

	<div align="center">
		<div class="page" style="width:100%; text-align:left">
			<div style="padding:0px 10px 0px 10px">
<div style="padding:0px 0px 6px 0px">

<table class="tborder" cellpadding="6" cellspacing="0" border="0" width="100%" align="center">
<tr>
	<td class="thead" style="font-weight:normal" >		
			<!-- status icon and date -->
			<a name="post48946"><img class="inlineimg" src="/images/statusicon/post_old.gif" alt="Old" border="0" /></a>
			
				07-10-2003, 01:07 PM
			
			
			<!-- / status icon and date -->				
	</td>
	<td class="thead" style="font-weight:normal" align="right">
		&nbsp;
		#<a href="showpost.php?s=08828acfcca8bf515aff0f08f5fc454a&amp;p=48946&amp;postcount=1" target="new"><strong>1</strong></a>
	</td>
</tr>
<tr valign="top">
	<td class="alt2" width="165">
			
			<div id="postmenu_48946">
				
				<a class="bigusername" href="member.php?s=08828acfcca8bf515aff0f08f5fc454a&amp;u=25695">FennyX</a>
				<script type="text/javascript"> vbmenu_register("postmenu_48946", true); </script>
				
			</div>
			
			<div class="smallfont">A Snow Cougar</div>
			
		
			
			
			<div class="smallfont">
				&nbsp;<br />
				<div>Join Date: Sep 2002</div>
				
				<div>
					Posts: 45
					
				</div>
				
				
				
				
				
				<div><a href="http://www.eqinterface.com/list.php?s=08828acfcca8bf515aff0f08f5fc454a&amp;skinnerid=25695"><img src="/images/misc/badges/author-list-link.gif" width="37" height="39" border="0" alt="Interface Author - Click to view interfaces"></a></div>
				<div>   </div>
			</div>					
		
	</td>
	<td class="alt1">
	
		
			<!-- icon and title -->
			<div class="smallfont">
				<img class="inlineimg" src="images/icons/icon1.gif" alt="Default" border="0" />
				<strong>foofyspells (storyline mod)</strong>
			</div>
			<hr size="1" style="color:#FFFFFF" />
			<!-- / icon and title -->
		
		
		<!-- message -->
		<div><a href="http://www.eqinterface.com/sdownload/fileinfo.php?s=&amp;id=2171" target="_blank">Foofy's Spell Lists</a><br />
<b><font color="red"><font size="3"><br />
Current version is:   Live 2006-03-15 23:51:53<br />
</font><br />
</font></b><br />
<br />
This is a conversion of the Lucy spell database created/provided by <a href="http://lucy.allakhazam.com." target="_blank">http://lucy.allakhazam.com.</a>  Mostly it was for myself, but it got so handy I decided maybe other people would like it too.<br />
<br />
If you have any questions of comments feel free to post here <img src="images/smilies/smile.gif" border="0" alt="" title="smile" class="inlineimg" /> <br />
<br />
One question I get asked a lot is..<br />
<br />
<b>Q: I extracted this but it's not working.  What did I do wrong?</b><br />
<b>A:</b> When extracting the files, you need to make sure you preserve the stored folder names.  What this translates to in WinZip is picking &quot;Extract...&quot; from the &quot;Actions&quot; menu and checking the &quot;Use Folder Names&quot; box.  You need to type in the name of your Everquest\Storyline folder also; for me, that would be &quot;c:\program files\everquest\storyline&quot;.<br />
<br />
If you are using some other zip program I don't know what to tell you other than make sure you preserve the stored folder names.  When you have extracted things correctly, you should see the following items in your Everquest/Storyline folder:<ul><li>a file named storyFoofySpells.txt</li><li>a folder named foofy</li><li>a TON of files in the foofy folder named things like abc fxq bbq etc</li></ul>If you are still having trouble, try using the Windows &quot;Search&quot; or &quot;Find&quot; command to look for a file on your hard drive called &quot;storyGrobb.txt&quot;; this is one of the story files that is part of EQ, FoofySpells needs to be extracted into this folder.  When installed correctly, you will see a file &quot;storyFoofySpells.txt&quot; and a folder &quot;foofy&quot; in the same folder with &quot;storyGrobb.txt&quot;.<br />
<br />
Here's another one..<br />
<br />
<b>Q: Why don't your New &amp; Changed indexes match up with the things Lucy says are &quot;new&quot; and &quot;changed&quot;?</b><br />
<b>A:</b> Lucy calls a spell changed if even one field in the spell data changes.  Things like &quot;spell icon&quot;  or &quot;unknown180&quot; changing is enough to flag it changed.  FoofySpells only reports a change for a field that is displayed by FoofySpells.  Since it doesn't show things like &quot;spellicon&quot; or &quot;unknown176&quot;, changes to those fields in the spell data aren't counted as changes in FoofySpells.<br />
<br />
enjoy!<br />
<br />
<br />
<font color="red"><font size="3"><b>Update History</b></font></font><br />
---------------------------------------------------------------------------------<br />
03/20/06 - updated to  Live 2006-03-15 23:51:53, has info on fabled ae's<br />
02/22/06 - updated to Live 2006-02-22 10:06:37, changed query conditions on class specific lists to exclude spells with level 127 and 255.  lucy seems screwed up a bit and uses 127, -1, and 255 depending on class.  spdat uses 255.  also now lucy is passing the level 254 spells through (AA's) as well as a new level 225 spell for healers.   melees will see the old opening system aa's listed in some cases, notably ranger and rogue.<br />
11/17/05 - updated to Live 2005-11-16 12:59:26, removed the 'Game Description' field from the spell details page for the time being, sony has moved the data into a new file called dbstr_us.txt.<br />
10/12/05 - updated to Live 2005-10-12 13:57:39<br />
09/13/05 - updated to Live 2005-09-13 11:33:41, DoD<br />
07/14/05 - updated to Live 2005-07-13 13:31:27<br />
07/02/05 - updated to Live 2005-06-29 16:23:52<br />
06/03/05 - update was just a change to the description text, no actual data changes.<br />
05/19/05 - updated to Live 2005-05-18 12:36:25<br />
05/12/05 - updated to Live 2005-05-11 14:37:27<br />
05/04/05 - updated to Live 2005-04-20 13:21:22<br />
04/13/05 - updated to Live 2005-04-12 13:05:05<br />
03/11/05 - updated to Live 2005-03-17 10:31:08, has DoN info, haven't been playing eq and saw people wanted an update, my accounts are inactive so i can only verify it as working with my html version.  if you see errors like text not displaying correctly please post in this thread.<br />
01/09/05 - updated to Live 2004-12-15 10:29:01, sorry for the delay<br />
10/26/04 - updated to Live 2004-10-25 11:59:14, trying another version of class level index, maybe this one satisfies everyone<br />
10/13/04 - updated to Live 2004-10-13 12:03:27<br />
09/23/04 - updated to Live 2004-09-23 11:30:28<br />
09/16/04 - updated to Test 2004-09-14 22:03:35, lucy hasn't given a db for the live servers so this is based on the latest test server info.  attribute indices are bugged past attribute #255 because of how lucy is dumping the csv file. put the class-level based index back to how it was, i just liked it better.<br />
08/11/04 - updated to Live 2004-08-11 10:25:30, hearts at the bottom of the page take you to the main index, some cleaning up of appearances, converted some other indices to the fastindex style, let me know what you think of the new index style, i may put them back to the old way for eqinterfaces.<br />
07/17/04 - fixed a problem with where certain spells linked back into the new AllSpellsByName index.  changed ClassbyName/byLevel indexes to use the new fastindex.<br />
07/15/04 - updated to Live 2004-07-14 09:45:55, some changes to reduce file size a bit, definitely delete your old copy before installing, file layout and names are all changed.  replaced the old ABC all-spells index with a much faster index, we'll see how ppl like it <img src="images/smilies/smile.gif" border="0" alt="" title="smile" class="inlineimg" />  also added some info to donate!  plz get me another game card, i would love for eq to pay for itself <img src="images/smilies/tongue.gif" border="0" alt="" title="stick out tongue" class="inlineimg" />   removed the detrimental only versions of the messages index, and the &quot;cooked attributes&quot; index, they were sort of not so useful.   reorganized the allspells &amp; other lists sections a bit.<br />
06/16/04 - updated to Live 2004-06-16 10:05:51, lucy skipped a patch so there will be new/changed spells that are &quot;old&quot;, updated for level 70, the db lucy provides is sort of bugged atm because they are setting any attributes greater than 254 to 255 which is messing up the &quot;Unknown #255&quot; raw attribute list; probably a field width definition error in the CSV dumping code so bug them not me <img src="images/smilies/smile.gif" border="0" alt="" title="smile" class="inlineimg" /><br />
05/26/04 - updated to Live 2004-05-26 10:49:51<br />
05/13/04 - updated to Live 2004-05-12 10:26:49, removed the AE Detrimental index because it wasn't accurate; some AE target types are unknown.  slightly rearraged &quot;Other Lists&quot; on the main page.<br />
05/05/04 - i missed a whole update on 04-28, this adjusts the new/changed indexes to compare between 05-05 and 04-28 instead of 04-21.  Balance of the Nihil was a big change between 04-21 and 04-28 (just fyi).  sorry about that! <img src="images/smilies/smile.gif" border="0" alt="" title="smile" class="inlineimg" /><br />
05/05/04 - updated to Live 2004-05-05 11:15:35<br />
04/25/04 - updated to Live 2004-04-21 12:24:19<br />
04/20/04 - its not really new, just changed the description since backslashes mysteriously disappeared from the file path info<br />
04/14/04 - updated to Live 2004-04-14 12:00:37<br />
03/30/04 - updated to Live 2004-03-30 09:48:53, added some 'uknown' AE types to the AE Detrimental index<br />
03/24/04 - updated to Live 2004-03-23 10:00:50<br />
03/16/04 - updated to Live 2004-03-16 10:52:06<br />
03/10/04 - updated to Live 2004-03-10 09:47:24<br />
02/10/04 - updated to Live 2004-02-10 11:16:59, lots of new indexes, finally some *limited* backlinks, and uh.. well a bunch of other stuff <img src="images/smilies/smile.gif" border="0" alt="" title="smile" class="inlineimg" />  enjoy gates of discord!<br />
01/14/04 - just changed the install instructions a bit, its not really new <img src="images/smilies/tongue.gif" border="0" alt="" title="stick out tongue" class="inlineimg" /><br />
12/19/03 - updated to &quot;Live 2003-12-19 10:32:13&quot;<br />
12/18/03 - had left out hybrid disciplines from class indexes, sorry moderators! <img src="images/smilies/smile.gif" border="0" alt="" title="smile" class="inlineimg" /><br />
12/18/03 - updated to &quot;Live 2003-12-18 10:39:31&quot;, rearranged front page to make room for new melee sections, added endurance upkeep field for melee abilities<br />
12/07/03 - updated to &quot;Live 2003-12-06 00:56:40&quot;, this fixes the old data from the 11-15 version<br />
11/25/03 - updated to &quot;Live 2003-11-15 14:28:39&quot;, this is based on new downloads coming from db.allakhazam.com<br />
11/16/03 - updated to &quot;Live 2003-11-05 11:11:20&quot; .. lucy downloads are working again! <img src="images/smilies/biggrin.gif" border="0" alt="" title="big grin" class="inlineimg" /><br />
10/10/03 - updated to &quot;Live 2003-10-10 11:15:27&quot;<br />
10/09/03 - updated to &quot;Live 2003-10-09 15:43:27&quot;<br />
09/12/03 - updated to &quot;Live 2003-09-09 14:34:19&quot;, this is just an update to stay current with lucy's data.  they put up a new db, but the data hasnt changed so if you have the previous version of foofyspells you dont really need this one.  still no descriptions for ldon spells.<br />
09/09/03 - updated to &quot;Live 2003-09-09 10:47:32&quot;, added Attack buff index, LDoN!<br />
08/26/03 - updated to &quot;Live 2003-08-26 10:31:10&quot;<br />
08/06/03 - updated to &quot;Live 2003-08-06 15:00:12&quot;, added class alphabetical, tradeskill, cures, and detrimental only versions of CastOnXxx indexes. removed &quot;Updated&quot; field from details, added &quot;Deletable&quot; field to details.<br />
07/11/03 - really updated to &quot;Live 2003-07-11 11:22:38 &quot; this time <img src="images/smilies/smile.gif" border="0" alt="" title="smile" class="inlineimg" /> <br />
07/11/03 - updated to &quot;Live 2003-07-11 11:22:38 &quot;, added more info to CastOnYou/CastOnOther indexes, better sorting of class indexes, cleaned up alpha-bar in main index<br />
07/10/03 - updated to &quot;Live 2003-07-10 11:12:44 &quot;, paged long indexes, added CastOnYou/CastOnOther indexes, alpha-bar AllSpells listing on main index, eof markers<br />
06/18/03 - Fixed Bard and Ranger indexes, Level xx subheadings weren't being generated<br />
06/11/03 - updated to &quot;Live 2003-06-11 12:42:29 &quot;<br />
06/09/03 - based on &quot;Live 2003-06-05 02:15:18 &quot;</div>
		<!-- / message -->
	
		
		
		
		
		
		<!-- edit note -->
			<div class="smallfont">			<hr size="1" style="color:#FFFFFF" />
				<em>
				Last edited by FennyX : 03-21-2006 at <span class="time">01:57 AM</span>.
				
				</em>
			</div>
		<!-- / edit note -->
		
	
	</td>
</tr>
<tr>
	<td class="alt2">
		<img class="inlineimg" src="/images/statusicon/user_offline.gif" alt="FennyX is offline" border="0" />


		
		
		
		&nbsp;
	</td>
	<td class="alt1" align="right">
		<!-- controls -->
		
		
		
			<a href="newreply.php?s=08828acfcca8bf515aff0f08f5fc454a&amp;do=newreply&amp;p=48946"><img src="/images/buttons/quote.gif" alt="Reply With Quote" border="0" /></a>
		
		
		<!-- / controls -->
	</td>
</tr>
</table>

<!-- post 48946 popup menu -->
<div class="vbmenu_popup" id="postmenu_48946_menu" style="display:none">
	<table cellpadding="4" cellspacing="1" border="0">
	<tr>
		<td class="thead">FennyX</td>
	</tr>
	
		<tr><td class="vbmenu_option"><a href="member.php?s=08828acfcca8bf515aff0f08f5fc454a&amp;userid=25695">View Public Profile</a></td></tr>
	
	
		<tr><td class="vbmenu_option"><a href="private.php?s=08828acfcca8bf515aff0f08f5fc454a&amp;do=newpm&amp;userid=25695">Send a private message to FennyX</a></td></tr>
	
	
	
	
		<tr><td class="vbmenu_option"><a href="search.php?s=08828acfcca8bf515aff0f08f5fc454a&amp;do=finduser&amp;userid=25695">Find More Posts by FennyX</a></td></tr>
	
	
	<tr><td class="vbmenu_option"><a href="profile.php?s=08828acfcca8bf515aff0f08f5fc454a&amp;do=addlist&amp;userlist=buddy&amp;u=25695">Add FennyX to Your Buddy List</a></td></tr>
	
	</table>
</div>
<!-- / post 48946 popup menu -->

</div>
		</div>	
	</div>
</div>

<!-- / close content container -->
<!-- / post #48946 --><!-- post #48981 -->
<!-- open content container -->

	<div align="center">
		<div class="page" style="width:100%; text-align:left">
			<div style="padding:0px 10px 0px 10px">
<div style="padding:0px 0px 6px 0px">

<table class="tborder" cellpadding="6" cellspacing="0" border="0" width="100%" align="center">
<tr>
	<td class="thead" style="font-weight:normal" >		
			<!-- status icon and date -->
			<a name="post48981"><img class="inlineimg" src="/images/statusicon/post_old.gif" alt="Old" border="0" /></a>
			
				07-11-2003, 05:19 AM
			
			
			<!-- / status icon and date -->				
	</td>
	<td class="thead" style="font-weight:normal" align="right">
		&nbsp;
		#<a href="showpost.php?s=08828acfcca8bf515aff0f08f5fc454a&amp;p=48981&amp;postcount=2" target="new"><strong>2</strong></a>
	</td>
</tr>
<tr valign="top">
	<td class="alt2" width="165">
			
			<div id="postmenu_48981">
				
				<a class="bigusername" href="member.php?s=08828acfcca8bf515aff0f08f5fc454a&amp;u=190">Kunis Marfury</a>
				<script type="text/javascript"> vbmenu_register("postmenu_48981", true); </script>
				
			</div>
			
			<div class="smallfont">A Shissar Disciple</div>
			
		
			
			
			<div class="smallfont">
				&nbsp;<br />
				<div>Join Date: Jul 2002</div>
				<div>Server: Sébilis</div>
				<div>
					Posts: 122
					
				</div>
				
				
				
				
				
				<div><a href="http://www.eqinterface.com/list.php?s=08828acfcca8bf515aff0f08f5fc454a&amp;skinnerid=190"><img src="/images/misc/badges/author-list-link.gif" width="37" height="39" border="0" alt="Interface Author - Click to view interfaces"></a></div>
				<div>   </div>
			</div>					
		
	</td>
	<td class="alt1">
	
		
			<!-- icon and title -->
			<div class="smallfont">
				<img class="inlineimg" src="images/icons/icon1.gif" alt="Default" border="0" />
				
			</div>
			<hr size="1" style="color:#FFFFFF" />
			<!-- / icon and title -->
		
		
		<!-- message -->
		<div>that's a good idea ! <img src="images/smilies/smile.gif" border="0" alt="" title="smile" class="inlineimg" /><br />
<br />
since i play on a localised server, would you allow me to change it a little bit to put in the french names and description ? (if i ever have time to do it :/)<br />
<br />
otherwise, one little question : how do you install it ?</div>
		<!-- / message -->
	
		
		
		
		<!-- sig -->
			<div>
				__________________<br />
				<a href="http://www.magelo.com/eq_view_profile.html?num=553993" target="_blank"><img src="http://kunis.marfury.free.fr/signature_kunis.jpg" border="0" alt="" /></a>
			</div>
		<!-- / sig -->
		
		
		
	
	</td>
</tr>
<tr>
	<td class="alt2">
		<img class="inlineimg" src="/images/statusicon/user_offline.gif" alt="Kunis Marfury is offline" border="0" />


		
		
		
		&nbsp;
	</td>
	<td class="alt1" align="right">
		<!-- controls -->
		
		
		
			<a href="newreply.php?s=08828acfcca8bf515aff0f08f5fc454a&amp;do=newreply&amp;p=48981"><img src="/images/buttons/quote.gif" alt="Reply With Quote" border="0" /></a>
		
		
		<!-- / controls -->
	</td>
</tr>
</table>

<!-- post 48981 popup menu -->
<div class="vbmenu_popup" id="postmenu_48981_menu" style="display:none">
	<table cellpadding="4" cellspacing="1" border="0">
	<tr>
		<td class="thead">Kunis Marfury</td>
	</tr>
	
		<tr><td class="vbmenu_option"><a href="member.php?s=08828acfcca8bf515aff0f08f5fc454a&amp;userid=190">View Public Profile</a></td></tr>
	
	
		<tr><td class="vbmenu_option"><a href="private.php?s=08828acfcca8bf515aff0f08f5fc454a&amp;do=newpm&amp;userid=190">Send a private message to Kunis Marfury</a></td></tr>
	
	
	
	
		<tr><td class="vbmenu_option"><a href="search.php?s=08828acfcca8bf515aff0f08f5fc454a&amp;do=finduser&amp;userid=190">Find More Posts by Kunis Marfury</a></td></tr>
	
	
	<tr><td class="vbmenu_option"><a href="profile.php?s=08828acfcca8bf515aff0f08f5fc454a&amp;do=addlist&amp;userlist=buddy&amp;u=190">Add Kunis Marfury to Your Buddy List</a></td></tr>
	
	</table>
</div>
<!-- / post 48981 popup menu -->

</div>
		</div>	
	</div>
</div>

<!-- / close content container -->
<!-- / post #48981 --><!-- post #48985 -->
<!-- open content container -->

	<div align="center">
		<div class="page" style="width:100%; text-align:left">
			<div style="padding:0px 10px 0px 10px">
<div style="padding:0px 0px 6px 0px">

<table class="tborder" cellpadding="6" cellspacing="0" border="0" width="100%" align="center">
<tr>
	<td class="thead" style="font-weight:normal" >		
			<!-- status icon and date -->
			<a name="post48985"><img class="inlineimg" src="/images/statusicon/post_old.gif" alt="Old" border="0" /></a>
			
				07-11-2003, 05:39 AM
			
			
			<!-- / status icon and date -->				
	</td>
	<td class="thead" style="font-weight:normal" align="right">
		&nbsp;
		#<a href="showpost.php?s=08828acfcca8bf515aff0f08f5fc454a&amp;p=48985&amp;postcount=3" target="new"><strong>3</strong></a>
	</td>
</tr>
<tr valign="top">
	<td class="alt2" width="165">
			
			<div id="postmenu_48985">
				
				<a class="bigusername" href="member.php?s=08828acfcca8bf515aff0f08f5fc454a&amp;u=25695">FennyX</a>
				<script type="text/javascript"> vbmenu_register("postmenu_48985", true); </script>
				
			</div>
			
			<div class="smallfont">A Snow Cougar</div>
			
		
			
			
			<div class="smallfont">
				&nbsp;<br />
				<div>Join Date: Sep 2002</div>
				
				<div>
					Posts: 45
					
				</div>
				
				
				
				
				
				<div><a href="http://www.eqinterface.com/list.php?s=08828acfcca8bf515aff0f08f5fc454a&amp;skinnerid=25695"><img src="/images/misc/badges/author-list-link.gif" width="37" height="39" border="0" alt="Interface Author - Click to view interfaces"></a></div>
				<div>   </div>
			</div>					
		
	</td>
	<td class="alt1">
	
		
			<!-- icon and title -->
			<div class="smallfont">
				<img class="inlineimg" src="images/icons/icon1.gif" alt="Default" border="0" />
				
			</div>
			<hr size="1" style="color:#FFFFFF" />
			<!-- / icon and title -->
		
		
		<!-- message -->
		<div>You would need to get a french version of lucy's database.  The script I use only pulls values out of their file, it doesnt care english, french whatever.  Well ok maybe a little bit like the titles and field labels.<br />
<br />
See the download page for how to install, all you do is extract the zip to the right folder.</div>
		<!-- / message -->
	
		
		
		
		
		
	
	</td>
</tr>
<tr>
	<td class="alt2">
		<img class="inlineimg" src="/images/statusicon/user_offline.gif" alt="FennyX is offline" border="0" />


		
		
		
		&nbsp;
	</td>
	<td class="alt1" align="right">
		<!-- controls -->
		
		
		
			<a href="newreply.php?s=08828acfcca8bf515aff0f08f5fc454a&amp;do=newreply&amp;p=48985"><img src="/images/buttons/quote.gif" alt="Reply With Quote" border="0" /></a>
		
		
		<!-- / controls -->
	</td>
</tr>
</table>

<!-- post 48985 popup menu -->
<div class="vbmenu_popup" id="postmenu_48985_menu" style="display:none">
	<table cellpadding="4" cellspacing="1" border="0">
	<tr>
		<td class="thead">FennyX</td>
	</tr>
	
		<tr><td class="vbmenu_option"><a href="member.php?s=08828acfcca8bf515aff0f08f5fc454a&amp;userid=25695">View Public Profile</a></td></tr>
	
	
		<tr><td class="vbmenu_option"><a href="private.php?s=08828acfcca8bf515aff0f08f5fc454a&amp;do=newpm&amp;userid=25695">Send a private message to FennyX</a></td></tr>
	
	
	
	
		<tr><td class="vbmenu_option"><a href="search.php?s=08828acfcca8bf515aff0f08f5fc454a&amp;do=finduser&amp;userid=25695">Find More Posts by FennyX</a></td></tr>
	
	
	<tr><td class="vbmenu_option"><a href="profile.php?s=08828acfcca8bf515aff0f08f5fc454a&amp;do=addlist&amp;userlist=buddy&amp;u=25695">Add FennyX to Your Buddy List</a></td></tr>
	
	</table>
</div>
<!-- / post 48985 popup menu -->

</div>
		</div>	
	</div>
</div>

<!-- / close content container -->
<!-- / post #48985 --><!-- post #49360 -->
<!-- open content container -->

	<div align="center">
		<div class="page" style="width:100%; text-align:left">
			<div style="padding:0px 10px 0px 10px">
<div style="padding:0px 0px 6px 0px">

<table class="tborder" cellpadding="6" cellspacing="0" border="0" width="100%" align="center">
<tr>
	<td class="thead" style="font-weight:normal" >		
			<!-- status icon and date -->
			<a name="post49360"><img class="inlineimg" src="/images/statusicon/post_old.gif" alt="Old" border="0" /></a>
			
				07-19-2003, 11:43 AM
			
			
			<!-- / status icon and date -->				
	</td>
	<td class="thead" style="font-weight:normal" align="right">
		&nbsp;
		#<a href="showpost.php?s=08828acfcca8bf515aff0f08f5fc454a&amp;p=49360&amp;postcount=4" target="new"><strong>4</strong></a>
	</td>
</tr>
<tr valign="top">
	<td class="alt2" width="165">
			
			<div id="postmenu_49360">
				
				<a class="bigusername" href="member.php?s=08828acfcca8bf515aff0f08f5fc454a&amp;u=3279">Jahari Durden</a>
				<script type="text/javascript"> vbmenu_register("postmenu_49360", true); </script>
				
			</div>
			
			<div class="smallfont">A Tundra Mammoth</div>
			
		
			
			
			<div class="smallfont">
				&nbsp;<br />
				<div>Join Date: Aug 2002</div>
				
				<div>
					Posts: 65
					
				</div>
				
				
				
				
				
				
				<div>   </div>
			</div>					
		
	</td>
	<td class="alt1">
	
		
			<!-- icon and title -->
			<div class="smallfont">
				<img class="inlineimg" src="images/icons/icon14.gif" alt="Thumbs up" border="0" />
				
			</div>
			<hr size="1" style="color:#FFFFFF" />
			<!-- / icon and title -->
		
		
		<!-- message -->
		<div>Excellent work!<br />
<br />
One thing you could consider is offering this mod separately for each class. That way, every spell only appears once in each file, and the back 'n forth buttons would be a lot easier to implement.<br />
<br />
Also, this would actually make the filesize -smaller- as people would be able to decide for themselves what they want.. Like say.. Their own class, and NPC spells (didn't check if you included those, just an example).. This would decrease the download time for most people.<br />
<br />
And the spell nuts who want all the spells for all classes (like me, sigh :/) probably won't mind downloading an additional megabyte or two. <img src="images/smilies/smile.gif" border="0" alt="" title="smile" class="inlineimg" /></div>
		<!-- / message -->
	
		
		
		
		<!-- sig -->
			<div>
				__________________<br />
				[size=1]<a href="http://www.magelo.com/eq_view_profile.html?num=481045" target="_blank">Inspect me</a> || Level: 60 (at last count)
			</div>
		<!-- / sig -->
		
		
		
	
	</td>
</tr>
<tr>
	<td class="alt2">
		<img class="inlineimg" src="/images/statusicon/user_offline.gif" alt="Jahari Durden is offline" border="0" />


		
		
		
		&nbsp;
	</td>
	<td class="alt1" align="right">
		<!-- controls -->
		
		
		
			<a href="newreply.php?s=08828acfcca8bf515aff0f08f5fc454a&amp;do=newreply&amp;p=49360"><img src="/images/buttons/quote.gif" alt="Reply With Quote" border="0" /></a>
		
		
		<!-- / controls -->
	</td>
</tr>
</table>

<!-- post 49360 popup menu -->
<div class="vbmenu_popup" id="postmenu_49360_menu" style="display:none">
	<table cellpadding="4" cellspacing="1" border="0">
	<tr>
		<td class="thead">Jahari Durden</td>
	</tr>
	
		<tr><td class="vbmenu_option"><a href="member.php?s=08828acfcca8bf515aff0f08f5fc454a&amp;userid=3279">View Public Profile</a></td></tr>
	
	
		<tr><td class="vbmenu_option"><a href="private.php?s=08828acfcca8bf515aff0f08f5fc454a&amp;do=newpm&amp;userid=3279">Send a private message to Jahari Durden</a></td></tr>
	
	
	
		<tr><td class="vbmenu_option"><a href="http://heronmarked.backpages.org">Visit Jahari Durden's homepage!</a></td></tr>
	
	
		<tr><td class="vbmenu_option"><a href="search.php?s=08828acfcca8bf515aff0f08f5fc454a&amp;do=finduser&amp;userid=3279">Find More Posts by Jahari Durden</a></td></tr>
	
	
	<tr><td class="vbmenu_option"><a href="profile.php?s=08828acfcca8bf515aff0f08f5fc454a&amp;do=addlist&amp;userlist=buddy&amp;u=3279">Add Jahari Durden to Your Buddy List</a></td></tr>
	
	</table>
</div>
<!-- / post 49360 popup menu -->

</div>
		</div>	
	</div>
</div>

<!-- / close content container -->
<!-- / post #49360 --><!-- post #49370 -->
<!-- open content container -->

	<div align="center">
		<div class="page" style="width:100%; text-align:left">
			<div style="padding:0px 10px 0px 10px">
<div style="padding:0px 0px 6px 0px">

<table class="tborder" cellpadding="6" cellspacing="0" border="0" width="100%" align="center">
<tr>
	<td class="thead" style="font-weight:normal" >		
			<!-- status icon and date -->
			<a name="post49370"><img class="inlineimg" src="/images/statusicon/post_old.gif" alt="Old" border="0" /></a>
			
				07-19-2003, 02:21 PM
			
			
			<!-- / status icon and date -->				
	</td>
	<td class="thead" style="font-weight:normal" align="right">
		&nbsp;
		#<a href="showpost.php?s=08828acfcca8bf515aff0f08f5fc454a&amp;p=49370&amp;postcount=5" target="new"><strong>5</strong></a>
	</td>
</tr>
<tr valign="top">
	<td class="alt2" width="165">
			
			<div id="postmenu_49370">
				
				<a class="bigusername" href="member.php?s=08828acfcca8bf515aff0f08f5fc454a&amp;u=25695">FennyX</a>
				<script type="text/javascript"> vbmenu_register("postmenu_49370", true); </script>
				
			</div>
			
			<div class="smallfont">A Snow Cougar</div>
			
		
			
			
			<div class="smallfont">
				&nbsp;<br />
				<div>Join Date: Sep 2002</div>
				
				<div>
					Posts: 45
					
				</div>
				
				
				
				
				
				<div><a href="http://www.eqinterface.com/list.php?s=08828acfcca8bf515aff0f08f5fc454a&amp;skinnerid=25695"><img src="/images/misc/badges/author-list-link.gif" width="37" height="39" border="0" alt="Interface Author - Click to view interfaces"></a></div>
				<div>   </div>
			</div>					
		
	</td>
	<td class="alt1">
	
		
			<!-- icon and title -->
			<div class="smallfont">
				<img class="inlineimg" src="images/icons/icon1.gif" alt="Default" border="0" />
				
			</div>
			<hr size="1" style="color:#FFFFFF" />
			<!-- / icon and title -->
		
		
		<!-- message -->
		<div>thats a direction ill keep in mind as i make mods to the script.   its some flexibility i dont have right now so it would have to come gradually.  though i will say i dont exactly look forward to uploading 14 or 15 different mods after every patch <img src="images/smilies/eek.gif" border="0" alt="" title="eek!" class="inlineimg" /></div>
		<!-- / message -->
	
		
		
		
		
		
	
	</td>
</tr>
<tr>
	<td class="alt2">
		<img class="inlineimg" src="/images/statusicon/user_offline.gif" alt="FennyX is offline" border="0" />


		
		
		
		&nbsp;
	</td>
	<td class="alt1" align="right">
		<!-- controls -->
		
		
		
			<a href="newreply.php?s=08828acfcca8bf515aff0f08f5fc454a&amp;do=newreply&amp;p=49370"><img src="/images/buttons/quote.gif" alt="Reply With Quote" border="0" /></a>
		
		
		<!-- / controls -->
	</td>
</tr>
</table>

<!-- post 49370 popup menu -->
<div class="vbmenu_popup" id="postmenu_49370_menu" style="display:none">
	<table cellpadding="4" cellspacing="1" border="0">
	<tr>
		<td class="thead">FennyX</td>
	</tr>
	
		<tr><td class="vbmenu_option"><a href="member.php?s=08828acfcca8bf515aff0f08f5fc454a&amp;userid=25695">View Public Profile</a></td></tr>
	
	
		<tr><td class="vbmenu_option"><a href="private.php?s=08828acfcca8bf515aff0f08f5fc454a&amp;do=newpm&amp;userid=25695">Send a private message to FennyX</a></td></tr>
	
	
	
	
		<tr><td class="vbmenu_option"><a href="search.php?s=08828acfcca8bf515aff0f08f5fc454a&amp;do=finduser&amp;userid=25695">Find More Posts by FennyX</a></td></tr>
	
	
	<tr><td class="vbmenu_option"><a href="profile.php?s=08828acfcca8bf515aff0f08f5fc454a&amp;do=addlist&amp;userlist=buddy&amp;u=25695">Add FennyX to Your Buddy List</a></td></tr>
	
	</table>
</div>
<!-- / post 49370 popup menu -->

</div>
		</div>	
	</div>
</div>

<!-- / close content container -->
<!-- / post #49370 --><!-- post #50234 -->
<!-- open content container -->

	<div align="center">
		<div class="page" style="width:100%; text-align:left">
			<div style="padding:0px 10px 0px 10px">
<div style="padding:0px 0px 6px 0px">

<table class="tborder" cellpadding="6" cellspacing="0" border="0" width="100%" align="center">
<tr>
	<td class="thead" style="font-weight:normal" >		
			<!-- status icon and date -->
			<a name="post50234"><img class="inlineimg" src="/images/statusicon/post_old.gif" alt="Old" border="0" /></a>
			
				08-03-2003, 06:06 PM
			
			
			<!-- / status icon and date -->				
	</td>
	<td class="thead" style="font-weight:normal" align="right">
		&nbsp;
		#<a href="showpost.php?s=08828acfcca8bf515aff0f08f5fc454a&amp;p=50234&amp;postcount=6" target="new"><strong>6</strong></a>
	</td>
</tr>
<tr valign="top">
	<td class="alt2" width="165">
			
			<div id="postmenu_50234">
				
				<a class="bigusername" href="member.php?s=08828acfcca8bf515aff0f08f5fc454a&amp;u=1419">Borreny</a>
				<script type="text/javascript"> vbmenu_register("postmenu_50234", true); </script>
				
			</div>
			
			<div class="smallfont">A Gray Wolf</div>
			
		
			
			
			<div class="smallfont">
				&nbsp;<br />
				<div>Join Date: Aug 2002</div>
				
				<div>
					Posts: 5
					
				</div>
				
				
				
				
				
				
				<div>   </div>
			</div>					
		
	</td>
	<td class="alt1">
	
		
			<!-- icon and title -->
			<div class="smallfont">
				<img class="inlineimg" src="images/icons/icon1.gif" alt="Default" border="0" />
				
			</div>
			<hr size="1" style="color:#FFFFFF" />
			<!-- / icon and title -->
		
		
		<!-- message -->
		<div>This is a really awesome mod!!!  Now I don't have to do a web search while in game to see what a spell does if I'm not sure.<br />
<br />
I actually do like having the spells for all classes since I have a druid, shaman, and necro, and my husband has an enchanter and beastlord. Especially on our low level chars, we always have to keep checking to see what we get at the next spell level.<br />
<br />
I can live without the back and forth navigation - small price to pay to have this information directly in game.  Keep up the good work!</div>
		<!-- / message -->
	
		
		
		
		
		
	
	</td>
</tr>
<tr>
	<td class="alt2">
		<img class="inlineimg" src="/images/statusicon/user_offline.gif" alt="Borreny is offline" border="0" />


		
		
		
		&nbsp;
	</td>
	<td class="alt1" align="right">
		<!-- controls -->
		
		
		
			<a href="newreply.php?s=08828acfcca8bf515aff0f08f5fc454a&amp;do=newreply&amp;p=50234"><img src="/images/buttons/quote.gif" alt="Reply With Quote" border="0" /></a>
		
		
		<!-- / controls -->
	</td>
</tr>
</table>

<!-- post 50234 popup menu -->
<div class="vbmenu_popup" id="postmenu_50234_menu" style="display:none">
	<table cellpadding="4" cellspacing="1" border="0">
	<tr>
		<td class="thead">Borreny</td>
	</tr>
	
		<tr><td class="vbmenu_option"><a href="member.php?s=08828acfcca8bf515aff0f08f5fc454a&amp;userid=1419">View Public Profile</a></td></tr>
	
	
	
	
	
		<tr><td class="vbmenu_option"><a href="search.php?s=08828acfcca8bf515aff0f08f5fc454a&amp;do=finduser&amp;userid=1419">Find More Posts by Borreny</a></td></tr>
	
	
	<tr><td class="vbmenu_option"><a href="profile.php?s=08828acfcca8bf515aff0f08f5fc454a&amp;do=addlist&amp;userlist=buddy&amp;u=1419">Add Borreny to Your Buddy List</a></td></tr>
	
	</table>
</div>
<!-- / post 50234 popup menu -->

</div>
		</div>	
	</div>
</div>

<!-- / close content container -->
<!-- / post #50234 --><!-- post #50236 -->
<!-- open content container -->

	<div align="center">
		<div class="page" style="width:100%; text-align:left">
			<div style="padding:0px 10px 0px 10px">
<div style="padding:0px 0px 6px 0px">

<table class="tborder" cellpadding="6" cellspacing="0" border="0" width="100%" align="center">
<tr>
	<td class="thead" style="font-weight:normal" >		
			<!-- status icon and date -->
			<a name="post50236"><img class="inlineimg" src="/images/statusicon/post_old.gif" alt="Old" border="0" /></a>
			
				08-03-2003, 07:10 PM
			
			
			<!-- / status icon and date -->				
	</td>
	<td class="thead" style="font-weight:normal" align="right">
		&nbsp;
		#<a href="showpost.php?s=08828acfcca8bf515aff0f08f5fc454a&amp;p=50236&amp;postcount=7" target="new"><strong>7</strong></a>
	</td>
</tr>
<tr valign="top">
	<td class="alt2" width="165">
			
			<div id="postmenu_50236">
				
				<a class="bigusername" href="member.php?s=08828acfcca8bf515aff0f08f5fc454a&amp;u=13165">Kalysto</a>
				<script type="text/javascript"> vbmenu_register("postmenu_50236", true); </script>
				
			</div>
			
			<div class="smallfont">A Treant</div>
			
		
			
				<div class="smallfont">
					&nbsp;<br /><a href="member.php?s=08828acfcca8bf515aff0f08f5fc454a&amp;u=13165"><img src="image.php?s=08828acfcca8bf515aff0f08f5fc454a&amp;u=13165&amp;dateline=1057321449" alt="Kalysto's Avatar" border="0" /></a>
				</div>
			
			
			<div class="smallfont">
				&nbsp;<br />
				<div>Join Date: Sep 2002</div>
				<div>Server: Fennin Ro</div>
				<div>
					Posts: 27
					
				</div>
				
				
				
				
				
				
				<div>   </div>
			</div>					
		
	</td>
	<td class="alt1">
	
		
			<!-- icon and title -->
			<div class="smallfont">
				<img class="inlineimg" src="images/icons/icon3.gif" alt="Lightbulb" border="0" />
				
			</div>
			<hr size="1" style="color:#FFFFFF" />
			<!-- / icon and title -->
		
		
		<!-- message -->
		<div>I love this.  Someone asks about a Focus Effect or some spell, and I am all like &quot;Let me consult with Foofy!!&quot;  <img src="images/smilies/biggrin.gif" border="0" alt="" title="big grin" class="inlineimg" />  Seriously, it is very very useful, thanks!</div>
		<!-- / message -->
	
		
		
		
		
		
	
	</td>
</tr>
<tr>
	<td class="alt2">
		<img class="inlineimg" src="/images/statusicon/user_offline.gif" alt="Kalysto is offline" border="0" />


		
		
		
		&nbsp;
	</td>
	<td class="alt1" align="right">
		<!-- controls -->
		
		
		
			<a href="newreply.php?s=08828acfcca8bf515aff0f08f5fc454a&amp;do=newreply&amp;p=50236"><img src="/images/buttons/quote.gif" alt="Reply With Quote" border="0" /></a>
		
		
		<!-- / controls -->
	</td>
</tr>
</table>

<!-- post 50236 popup menu -->
<div class="vbmenu_popup" id="postmenu_50236_menu" style="display:none">
	<table cellpadding="4" cellspacing="1" border="0">
	<tr>
		<td class="thead">Kalysto</td>
	</tr>
	
		<tr><td class="vbmenu_option"><a href="member.php?s=08828acfcca8bf515aff0f08f5fc454a&amp;userid=13165">View Public Profile</a></td></tr>
	
	
		<tr><td class="vbmenu_option"><a href="private.php?s=08828acfcca8bf515aff0f08f5fc454a&amp;do=newpm&amp;userid=13165">Send a private message to Kalysto</a></td></tr>
	
	
	
	
		<tr><td class="vbmenu_option"><a href="search.php?s=08828acfcca8bf515aff0f08f5fc454a&amp;do=finduser&amp;userid=13165">Find More Posts by Kalysto</a></td></tr>
	
	
	<tr><td class="vbmenu_option"><a href="profile.php?s=08828acfcca8bf515aff0f08f5fc454a&amp;do=addlist&amp;userlist=buddy&amp;u=13165">Add Kalysto to Your Buddy List</a></td></tr>
	
	</table>
</div>
<!-- / post 50236 popup menu -->

</div>
		</div>	
	</div>
</div>

<!-- / close content container -->
<!-- / post #50236 --><!-- post #50238 -->
<!-- open content container -->

	<div align="center">
		<div class="page" style="width:100%; text-align:left">
			<div style="padding:0px 10px 0px 10px">
<div style="padding:0px 0px 6px 0px">

<table class="tborder" cellpadding="6" cellspacing="0" border="0" width="100%" align="center">
<tr>
	<td class="thead" style="font-weight:normal" >		
			<!-- status icon and date -->
			<a name="post50238"><img class="inlineimg" src="/images/statusicon/post_old.gif" alt="Old" border="0" /></a>
			
				08-03-2003, 09:08 PM
			
			
			<!-- / status icon and date -->				
	</td>
	<td class="thead" style="font-weight:normal" align="right">
		&nbsp;
		#<a href="showpost.php?s=08828acfcca8bf515aff0f08f5fc454a&amp;p=50238&amp;postcount=8" target="new"><strong>8</strong></a>
	</td>
</tr>
<tr valign="top">
	<td class="alt2" width="165">
			
			<div id="postmenu_50238">
				
				<a class="bigusername" href="member.php?s=08828acfcca8bf515aff0f08f5fc454a&amp;u=25695">FennyX</a>
				<script type="text/javascript"> vbmenu_register("postmenu_50238", true); </script>
				
			</div>
			
			<div class="smallfont">A Snow Cougar</div>
			
		
			
			
			<div class="smallfont">
				&nbsp;<br />
				<div>Join Date: Sep 2002</div>
				
				<div>
					Posts: 45
					
				</div>
				
				
				
				
				
				<div><a href="http://www.eqinterface.com/list.php?s=08828acfcca8bf515aff0f08f5fc454a&amp;skinnerid=25695"><img src="/images/misc/badges/author-list-link.gif" width="37" height="39" border="0" alt="Interface Author - Click to view interfaces"></a></div>
				<div>   </div>
			</div>					
		
	</td>
	<td class="alt1">
	
		
			<!-- icon and title -->
			<div class="smallfont">
				<img class="inlineimg" src="images/icons/icon1.gif" alt="Default" border="0" />
				
			</div>
			<hr size="1" style="color:#FFFFFF" />
			<!-- / icon and title -->
		
		
		<!-- message -->
		<div>great! im glad you like it <img src="images/smilies/smile.gif" border="0" alt="" title="smile" class="inlineimg" />   ill be updating after the patch on the 6th i think it is, i have a few new indexes as well.</div>
		<!-- / message -->
	
		
		
		
		
		
	
	</td>
</tr>
<tr>
	<td class="alt2">
		<img class="inlineimg" src="/images/statusicon/user_offline.gif" alt="FennyX is offline" border="0" />


		
		
		
		&nbsp;
	</td>
	<td class="alt1" align="right">
		<!-- controls -->
		
		
		
			<a href="newreply.php?s=08828acfcca8bf515aff0f08f5fc454a&amp;do=newreply&amp;p=50238"><img src="/images/buttons/quote.gif" alt="Reply With Quote" border="0" /></a>
		
		
		<!-- / controls -->
	</td>
</tr>
</table>

<!-- post 50238 popup menu -->
<div class="vbmenu_popup" id="postmenu_50238_menu" style="display:none">
	<table cellpadding="4" cellspacing="1" border="0">
	<tr>
		<td class="thead">FennyX</td>
	</tr>
	
		<tr><td class="vbmenu_option"><a href="member.php?s=08828acfcca8bf515aff0f08f5fc454a&amp;userid=25695">View Public Profile</a></td></tr>
	
	
		<tr><td class="vbmenu_option"><a href="private.php?s=08828acfcca8bf515aff0f08f5fc454a&amp;do=newpm&amp;userid=25695">Send a private message to FennyX</a></td></tr>
	
	
	
	
		<tr><td class="vbmenu_option"><a href="search.php?s=08828acfcca8bf515aff0f08f5fc454a&amp;do=finduser&amp;userid=25695">Find More Posts by FennyX</a></td></tr>
	
	
	<tr><td class="vbmenu_option"><a href="profile.php?s=08828acfcca8bf515aff0f08f5fc454a&amp;do=addlist&amp;userlist=buddy&amp;u=25695">Add FennyX to Your Buddy List</a></td></tr>
	
	</table>
</div>
<!-- / post 50238 popup menu -->

</div>
		</div>	
	</div>
</div>

<!-- / close content container -->
<!-- / post #50238 --><!-- post #50616 -->
<!-- open content container -->

	<div align="center">
		<div class="page" style="width:100%; text-align:left">
			<div style="padding:0px 10px 0px 10px">
<div style="padding:0px 0px 6px 0px">

<table class="tborder" cellpadding="6" cellspacing="0" border="0" width="100%" align="center">
<tr>
	<td class="thead" style="font-weight:normal" >		
			<!-- status icon and date -->
			<a name="post50616"><img class="inlineimg" src="/images/statusicon/post_old.gif" alt="Old" border="0" /></a>
			
				08-09-2003, 10:14 AM
			
			
			<!-- / status icon and date -->				
	</td>
	<td class="thead" style="font-weight:normal" align="right">
		&nbsp;
		#<a href="showpost.php?s=08828acfcca8bf515aff0f08f5fc454a&amp;p=50616&amp;postcount=9" target="new"><strong>9</strong></a>
	</td>
</tr>
<tr valign="top">
	<td class="alt2" width="165">
			
			<div id="postmenu_50616">
				
				<a class="bigusername" href="member.php?s=08828acfcca8bf515aff0f08f5fc454a&amp;u=3654">Lazaru5</a>
				<script type="text/javascript"> vbmenu_register("postmenu_50616", true); </script>
				
			</div>
			
			<div class="smallfont">An Icepaw Kobold</div>
			
		
			
			
			<div class="smallfont">
				&nbsp;<br />
				<div>Join Date: Aug 2002</div>
				
				<div>
					Posts: 87
					
				</div>
				
				
				
				
				
				
				<div>   </div>
			</div>					
		
	</td>
	<td class="alt1">
	
		
			<!-- icon and title -->
			<div class="smallfont">
				<img class="inlineimg" src="images/icons/icon1.gif" alt="Default" border="0" />
				
			</div>
			<hr size="1" style="color:#FFFFFF" />
			<!-- / icon and title -->
		
		
		<!-- message -->
		<div>Quick question on the installation process of this.......<br />
<br />
Your instructions say to &quot;Remember to check the &quot;Use Folder Names&quot; box or you will have a bigger mess than you know how to deal with.&quot;<br />
<br />
Forgive the stupidity if this is an obvious thing, as my brain is having problems with flatulence at the moment, but what check box are you referring to?</div>
		<!-- / message -->
	
		
		
		
		<!-- sig -->
			<div>
				__________________<br />
				<a href="http://www.magelo.com/eq_view_profile.html?num=255993" target="_blank">Silverklaw Lunarmight -- 66th Ascension of the Khati Sha<br />
Sign of One's Resident Feral Lord</a><br />
<br />
<br />
<i><font color="RoyalBlue">I am Pasquinel, and I come to you unafraid!</font></i>
			</div>
		<!-- / sig -->
		
		
		
	
	</td>
</tr>
<tr>
	<td class="alt2">
		<img class="inlineimg" src="/images/statusicon/user_offline.gif" alt="Lazaru5 is offline" border="0" />


		
		
		
		&nbsp;
	</td>
	<td class="alt1" align="right">
		<!-- controls -->
		
		
		
			<a href="newreply.php?s=08828acfcca8bf515aff0f08f5fc454a&amp;do=newreply&amp;p=50616"><img src="/images/buttons/quote.gif" alt="Reply With Quote" border="0" /></a>
		
		
		<!-- / controls -->
	</td>
</tr>
</table>

<!-- post 50616 popup menu -->
<div class="vbmenu_popup" id="postmenu_50616_menu" style="display:none">
	<table cellpadding="4" cellspacing="1" border="0">
	<tr>
		<td class="thead">Lazaru5</td>
	</tr>
	
		<tr><td class="vbmenu_option"><a href="member.php?s=08828acfcca8bf515aff0f08f5fc454a&amp;userid=3654">View Public Profile</a></td></tr>
	
	
		<tr><td class="vbmenu_option"><a href="private.php?s=08828acfcca8bf515aff0f08f5fc454a&amp;do=newpm&amp;userid=3654">Send a private message to Lazaru5</a></td></tr>
	
	
	
		<tr><td class="vbmenu_option"><a href="http://signofone.org">Visit Lazaru5's homepage!</a></td></tr>
	
	
		<tr><td class="vbmenu_option"><a href="search.php?s=08828acfcca8bf515aff0f08f5fc454a&amp;do=finduser&amp;userid=3654">Find More Posts by Lazaru5</a></td></tr>
	
	
	<tr><td class="vbmenu_option"><a href="profile.php?s=08828acfcca8bf515aff0f08f5fc454a&amp;do=addlist&amp;userlist=buddy&amp;u=3654">Add Lazaru5 to Your Buddy List</a></td></tr>
	
	</table>
</div>
<!-- / post 50616 popup menu -->

</div>
		</div>	
	</div>
</div>

<!-- / close content container -->
<!-- / post #50616 --><!-- post #50626 -->
<!-- open content container -->

	<div align="center">
		<div class="page" style="width:100%; text-align:left">
			<div style="padding:0px 10px 0px 10px">
<div style="padding:0px 0px 6px 0px">

<table class="tborder" cellpadding="6" cellspacing="0" border="0" width="100%" align="center">
<tr>
	<td class="thead" style="font-weight:normal" >		
			<!-- status icon and date -->
			<a name="post50626"><img class="inlineimg" src="/images/statusicon/post_old.gif" alt="Old" border="0" /></a>
			
				08-09-2003, 12:32 PM
			
			
			<!-- / status icon and date -->				
	</td>
	<td class="thead" style="font-weight:normal" align="right">
		&nbsp;
		#<a href="showpost.php?s=08828acfcca8bf515aff0f08f5fc454a&amp;p=50626&amp;postcount=10" target="new"><strong>10</strong></a>
	</td>
</tr>
<tr valign="top">
	<td class="alt2" width="165">
			
			<div id="postmenu_50626">
				
				<a class="bigusername" href="member.php?s=08828acfcca8bf515aff0f08f5fc454a&amp;u=25695">FennyX</a>
				<script type="text/javascript"> vbmenu_register("postmenu_50626", true); </script>
				
			</div>
			
			<div class="smallfont">A Snow Cougar</div>
			
		
			
			
			<div class="smallfont">
				&nbsp;<br />
				<div>Join Date: Sep 2002</div>
				
				<div>
					Posts: 45
					
				</div>
				
				
				
				
				
				<div><a href="http://www.eqinterface.com/list.php?s=08828acfcca8bf515aff0f08f5fc454a&amp;skinnerid=25695"><img src="/images/misc/badges/author-list-link.gif" width="37" height="39" border="0" alt="Interface Author - Click to view interfaces"></a></div>
				<div>   </div>
			</div>					
		
	</td>
	<td class="alt1">
	
		
			<!-- icon and title -->
			<div class="smallfont">
				<img class="inlineimg" src="images/icons/icon1.gif" alt="Default" border="0" />
				
			</div>
			<hr size="1" style="color:#FFFFFF" />
			<!-- / icon and title -->
		
		
		<!-- message -->
		<div>i was talking about in WinZip.   If you are using some other way to extract files then you'll have to find some method of preserving the file structure stored in the zip.<br />
<br />
For example, if you are using the built-in zip extractor in WinXP there are no options to choose, so don't worry about it.</div>
		<!-- / message -->
	
		
		
		
		
		
		<!-- edit note -->
			<div class="smallfont">			<hr size="1" style="color:#FFFFFF" />
				<em>
				Last edited by FennyX : 08-09-2003 at <span class="time">12:40 PM</span>.
				
				</em>
			</div>
		<!-- / edit note -->
		
	
	</td>
</tr>
<tr>
	<td class="alt2">
		<img class="inlineimg" src="/images/statusicon/user_offline.gif" alt="FennyX is offline" border="0" />


		
		
		
		&nbsp;
	</td>
	<td class="alt1" align="right">
		<!-- controls -->
		
		
		
			<a href="newreply.php?s=08828acfcca8bf515aff0f08f5fc454a&amp;do=newreply&amp;p=50626"><img src="/images/buttons/quote.gif" alt="Reply With Quote" border="0" /></a>
		
		
		<!-- / controls -->
	</td>
</tr>
</table>

<!-- post 50626 popup menu -->
<div class="vbmenu_popup" id="postmenu_50626_menu" style="display:none">
	<table cellpadding="4" cellspacing="1" border="0">
	<tr>
		<td class="thead">FennyX</td>
	</tr>
	
		<tr><td class="vbmenu_option"><a href="member.php?s=08828acfcca8bf515aff0f08f5fc454a&amp;userid=25695">View Public Profile</a></td></tr>
	
	
		<tr><td class="vbmenu_option"><a href="private.php?s=08828acfcca8bf515aff0f08f5fc454a&amp;do=newpm&amp;userid=25695">Send a private message to FennyX</a></td></tr>
	
	
	
	
		<tr><td class="vbmenu_option"><a href="search.php?s=08828acfcca8bf515aff0f08f5fc454a&amp;do=finduser&amp;userid=25695">Find More Posts by FennyX</a></td></tr>
	
	
	<tr><td class="vbmenu_option"><a href="profile.php?s=08828acfcca8bf515aff0f08f5fc454a&amp;do=addlist&amp;userlist=buddy&amp;u=25695">Add FennyX to Your Buddy List</a></td></tr>
	
	</table>
</div>
<!-- / post 50626 popup menu -->

</div>
		</div>	
	</div>
</div>

<!-- / close content container -->
<!-- / post #50626 --><!-- post #51933 -->
<!-- open content container -->

	<div align="center">
		<div class="page" style="width:100%; text-align:left">
			<div style="padding:0px 10px 0px 10px">
<div style="padding:0px 0px 6px 0px">

<table class="tborder" cellpadding="6" cellspacing="0" border="0" width="100%" align="center">
<tr>
	<td class="thead" style="font-weight:normal" >		
			<!-- status icon and date -->
			<a name="post51933"><img class="inlineimg" src="/images/statusicon/post_old.gif" alt="Old" border="0" /></a>
			
				08-28-2003, 01:53 AM
			
			
			<!-- / status icon and date -->				
	</td>
	<td class="thead" style="font-weight:normal" align="right">
		&nbsp;
		#<a href="showpost.php?s=08828acfcca8bf515aff0f08f5fc454a&amp;p=51933&amp;postcount=11" target="new"><strong>11</strong></a>
	</td>
</tr>
<tr valign="top">
	<td class="alt2" width="165">
			
			<div id="postmenu_51933">
				
				<a class="bigusername" href="member.php?s=08828acfcca8bf515aff0f08f5fc454a&amp;u=74556">Inusan</a>
				<script type="text/javascript"> vbmenu_register("postmenu_51933", true); </script>
				
			</div>
			
			<div class="smallfont">A Fire Beetle</div>
			
		
			
			
			<div class="smallfont">
				&nbsp;<br />
				<div>Join Date: Jan 2003</div>
				
				<div>
					Posts: 2
					
				</div>
				
				
				
				
				
				
				<div>   </div>
			</div>					
		
	</td>
	<td class="alt1">
	
		
			<!-- icon and title -->
			<div class="smallfont">
				<img class="inlineimg" src="images/icons/icon1.gif" alt="Default" border="0" />
				
			</div>
			<hr size="1" style="color:#FFFFFF" />
			<!-- / icon and title -->
		
		
		<!-- message -->
		<div>This UI mod kinda got some recent airtime on <a href="http://www.graffe.com/forums/" target="_blank">Graffe's (wiz forum)</a>, thanks to one of the moderators there. I installed it yesterday, and have to say, I'm very impressed.<br />
<br />
I have a suggestion, which will help with the issue of navigating back and forth, and which I believe should be pretty simple to add.<br />
<br />
Basically, in the spell description where it lists the class/level of that spell, you could make that link back to the Spells by Level list for that Class/Level.<br />
<br />
So for example, Minor Healing would have:<br />
<br />
Classes: CLR/1 PAL/9 RNG/9 DRU/1 SHM/1 BST/9 <br />
<br />
And each one of those would be a link, eg<br />
<br />
LEVEL-CLR.txt#level1<br />
LEVEL-PAL.txt#level9<br />
<br />
And so on.<br />
<br />
Obiviously, to do this, you'd need to add &lt;a name=level1&gt; tags into the level lists, but this can be done at the same time you already output the spell level.<br />
<br />
Alternatively, if you want to be more ambitious, the number above links to the spell list by level, and the class name links to the alphabetical spell list.<br />
<br />
While neither of these changes is absolutely required, I feel they would make this information much more accessible for users to browse - particularly for class-related spells.<br />
<br />
(Edit: add forum link. Oops, did I say Arcanist; I meant Graffe's)</div>
		<!-- / message -->
	
		
		
		
		
		
		<!-- edit note -->
			<div class="smallfont">			<hr size="1" style="color:#FFFFFF" />
				<em>
				Last edited by Inusan : 10-13-2003 at <span class="time">09:57 AM</span>.
				
				</em>
			</div>
		<!-- / edit note -->
		
	
	</td>
</tr>
<tr>
	<td class="alt2">
		<img class="inlineimg" src="/images/statusicon/user_offline.gif" alt="Inusan is offline" border="0" />


		
		
		
		&nbsp;
	</td>
	<td class="alt1" align="right">
		<!-- controls -->
		
		
		
			<a href="newreply.php?s=08828acfcca8bf515aff0f08f5fc454a&amp;do=newreply&amp;p=51933"><img src="/images/buttons/quote.gif" alt="Reply With Quote" border="0" /></a>
		
		
		<!-- / controls -->
	</td>
</tr>
</table>

<!-- post 51933 popup menu -->
<div class="vbmenu_popup" id="postmenu_51933_menu" style="display:none">
	<table cellpadding="4" cellspacing="1" border="0">
	<tr>
		<td class="thead">Inusan</td>
	</tr>
	
		<tr><td class="vbmenu_option"><a href="member.php?s=08828acfcca8bf515aff0f08f5fc454a&amp;userid=74556">View Public Profile</a></td></tr>
	
	
		<tr><td class="vbmenu_option"><a href="private.php?s=08828acfcca8bf515aff0f08f5fc454a&amp;do=newpm&amp;userid=74556">Send a private message to Inusan</a></td></tr>
	
	
	
	
		<tr><td class="vbmenu_option"><a href="search.php?s=08828acfcca8bf515aff0f08f5fc454a&amp;do=finduser&amp;userid=74556">Find More Posts by Inusan</a></td></tr>
	
	
	<tr><td class="vbmenu_option"><a href="profile.php?s=08828acfcca8bf515aff0f08f5fc454a&amp;do=addlist&amp;userlist=buddy&amp;u=74556">Add Inusan to Your Buddy List</a></td></tr>
	
	</table>
</div>
<!-- / post 51933 popup menu -->

</div>
		</div>	
	</div>
</div>

<!-- / close content container -->
<!-- / post #51933 --><!-- post #51970 -->
<!-- open content container -->

	<div align="center">
		<div class="page" style="width:100%; text-align:left">
			<div style="padding:0px 10px 0px 10px">
<div style="padding:0px 0px 6px 0px">

<table class="tborder" cellpadding="6" cellspacing="0" border="0" width="100%" align="center">
<tr>
	<td class="thead" style="font-weight:normal" >		
			<!-- status icon and date -->
			<a name="post51970"><img class="inlineimg" src="/images/statusicon/post_old.gif" alt="Old" border="0" /></a>
			
				08-28-2003, 11:50 AM
			
			
			<!-- / status icon and date -->				
	</td>
	<td class="thead" style="font-weight:normal" align="right">
		&nbsp;
		#<a href="showpost.php?s=08828acfcca8bf515aff0f08f5fc454a&amp;p=51970&amp;postcount=12" target="new"><strong>12</strong></a>
	</td>
</tr>
<tr valign="top">
	<td class="alt2" width="165">
			
			<div id="postmenu_51970">
				
				<a class="bigusername" href="member.php?s=08828acfcca8bf515aff0f08f5fc454a&amp;u=25695">FennyX</a>
				<script type="text/javascript"> vbmenu_register("postmenu_51970", true); </script>
				
			</div>
			
			<div class="smallfont">A Snow Cougar</div>
			
		
			
			
			<div class="smallfont">
				&nbsp;<br />
				<div>Join Date: Sep 2002</div>
				
				<div>
					Posts: 45
					
				</div>
				
				
				
				
				
				<div><a href="http://www.eqinterface.com/list.php?s=08828acfcca8bf515aff0f08f5fc454a&amp;skinnerid=25695"><img src="/images/misc/badges/author-list-link.gif" width="37" height="39" border="0" alt="Interface Author - Click to view interfaces"></a></div>
				<div>   </div>
			</div>					
		
	</td>
	<td class="alt1">
	
		
			<!-- icon and title -->
			<div class="smallfont">
				<img class="inlineimg" src="images/icons/icon1.gif" alt="Default" border="0" />
				
			</div>
			<hr size="1" style="color:#FFFFFF" />
			<!-- / icon and title -->
		
		
		<!-- message -->
		<div>thanks <img src="images/smilies/biggrin.gif" border="0" alt="" title="big grin" class="inlineimg" />   could you post a link to those forums?<br />
<br />
thats not a bad idea, my main concern with putting links into the spell pages is the download size.  links are the big thing everyone wants =\  thats the best idea yet and you're right its very doable.  i wish there was a way to handle the indexes that aren't class-based though.</div>
		<!-- / message -->
	
		
		
		
		
		
		<!-- edit note -->
			<div class="smallfont">			<hr size="1" style="color:#FFFFFF" />
				<em>
				Last edited by FennyX : 08-28-2003 at <span class="time">12:01 PM</span>.
				
				</em>
			</div>
		<!-- / edit note -->
		
	
	</td>
</tr>
<tr>
	<td class="alt2">
		<img class="inlineimg" src="/images/statusicon/user_offline.gif" alt="FennyX is offline" border="0" />


		
		
		
		&nbsp;
	</td>
	<td class="alt1" align="right">
		<!-- controls -->
		
		
		
			<a href="newreply.php?s=08828acfcca8bf515aff0f08f5fc454a&amp;do=newreply&amp;p=51970"><img src="/images/buttons/quote.gif" alt="Reply With Quote" border="0" /></a>
		
		
		<!-- / controls -->
	</td>
</tr>
</table>

<!-- post 51970 popup menu -->
<div class="vbmenu_popup" id="postmenu_51970_menu" style="display:none">
	<table cellpadding="4" cellspacing="1" border="0">
	<tr>
		<td class="thead">FennyX</td>
	</tr>
	
		<tr><td class="vbmenu_option"><a href="member.php?s=08828acfcca8bf515aff0f08f5fc454a&amp;userid=25695">View Public Profile</a></td></tr>
	
	
		<tr><td class="vbmenu_option"><a href="private.php?s=08828acfcca8bf515aff0f08f5fc454a&amp;do=newpm&amp;userid=25695">Send a private message to FennyX</a></td></tr>
	
	
	
	
		<tr><td class="vbmenu_option"><a href="search.php?s=08828acfcca8bf515aff0f08f5fc454a&amp;do=finduser&amp;userid=25695">Find More Posts by FennyX</a></td></tr>
	
	
	<tr><td class="vbmenu_option"><a href="profile.php?s=08828acfcca8bf515aff0f08f5fc454a&amp;do=addlist&amp;userlist=buddy&amp;u=25695">Add FennyX to Your Buddy List</a></td></tr>
	
	</table>
</div>
<!-- / post 51970 popup menu -->

</div>
		</div>	
	</div>
</div>

<!-- / close content container -->
<!-- / post #51970 --><!-- post #51995 -->
<!-- open content container -->

	<div align="center">
		<div class="page" style="width:100%; text-align:left">
			<div style="padding:0px 10px 0px 10px">
<div style="padding:0px 0px 6px 0px">

<table class="tborder" cellpadding="6" cellspacing="0" border="0" width="100%" align="center">
<tr>
	<td class="thead" style="font-weight:normal" >		
			<!-- status icon and date -->
			<a name="post51995"><img class="inlineimg" src="/images/statusicon/post_old.gif" alt="Old" border="0" /></a>
			
				08-28-2003, 03:11 PM
			
			
			<!-- / status icon and date -->				
	</td>
	<td class="thead" style="font-weight:normal" align="right">
		&nbsp;
		#<a href="showpost.php?s=08828acfcca8bf515aff0f08f5fc454a&amp;p=51995&amp;postcount=13" target="new"><strong>13</strong></a>
	</td>
</tr>
<tr valign="top">
	<td class="alt2" width="165">
			
			<div id="postmenu_51995">
				
				<a class="bigusername" href="member.php?s=08828acfcca8bf515aff0f08f5fc454a&amp;u=16156">kezzerdrix</a>
				<script type="text/javascript"> vbmenu_register("postmenu_51995", true); </script>
				
			</div>
			
			<div class="smallfont">A Bat</div>
			
		
			
			
			<div class="smallfont">
				&nbsp;<br />
				<div>Join Date: Sep 2002</div>
				
				<div>
					Posts: 1
					
				</div>
				
				
				
				
				
				
				<div> <a href="#" onclick="return imwindow('aim', '16156', 400, 200)"><img src="/images/misc/im_aim.gif" alt="Send a message via AIM to kezzerdrix" border="0" /></a>  </div>
			</div>					
		
	</td>
	<td class="alt1">
	
		
			<!-- icon and title -->
			<div class="smallfont">
				<img class="inlineimg" src="images/icons/icon1.gif" alt="Default" border="0" />
				
			</div>
			<hr size="1" style="color:#FFFFFF" />
			<!-- / icon and title -->
		
		
		<!-- message -->
		<div>I installed it right, but for some reasonw hen i click on the areas it doesnt do anything at all. Little help please</div>
		<!-- / message -->
	
		
		
		
		
		
	
	</td>
</tr>
<tr>
	<td class="alt2">
		<img class="inlineimg" src="/images/statusicon/user_offline.gif" alt="kezzerdrix is offline" border="0" />


		
		
		
		&nbsp;
	</td>
	<td class="alt1" align="right">
		<!-- controls -->
		
		
		
			<a href="newreply.php?s=08828acfcca8bf515aff0f08f5fc454a&amp;do=newreply&amp;p=51995"><img src="/images/buttons/quote.gif" alt="Reply With Quote" border="0" /></a>
		
		
		<!-- / controls -->
	</td>
</tr>
</table>

<!-- post 51995 popup menu -->
<div class="vbmenu_popup" id="postmenu_51995_menu" style="display:none">
	<table cellpadding="4" cellspacing="1" border="0">
	<tr>
		<td class="thead">kezzerdrix</td>
	</tr>
	
		<tr><td class="vbmenu_option"><a href="member.php?s=08828acfcca8bf515aff0f08f5fc454a&amp;userid=16156">View Public Profile</a></td></tr>
	
	
		<tr><td class="vbmenu_option"><a href="private.php?s=08828acfcca8bf515aff0f08f5fc454a&amp;do=newpm&amp;userid=16156">Send a private message to kezzerdrix</a></td></tr>
	
	
	
	
		<tr><td class="vbmenu_option"><a href="search.php?s=08828acfcca8bf515aff0f08f5fc454a&amp;do=finduser&amp;userid=16156">Find More Posts by kezzerdrix</a></td></tr>
	
	
	<tr><td class="vbmenu_option"><a href="profile.php?s=08828acfcca8bf515aff0f08f5fc454a&amp;do=addlist&amp;userlist=buddy&amp;u=16156">Add kezzerdrix to Your Buddy List</a></td></tr>
	
	</table>
</div>
<!-- / post 51995 popup menu -->

</div>
		</div>	
	</div>
</div>

<!-- / close content container -->
<!-- / post #51995 --><!-- post #52036 -->
<!-- open content container -->

	<div align="center">
		<div class="page" style="width:100%; text-align:left">
			<div style="padding:0px 10px 0px 10px">
<div style="padding:0px 0px 6px 0px">

<table class="tborder" cellpadding="6" cellspacing="0" border="0" width="100%" align="center">
<tr>
	<td class="thead" style="font-weight:normal" >		
			<!-- status icon and date -->
			<a name="post52036"><img class="inlineimg" src="/images/statusicon/post_old.gif" alt="Old" border="0" /></a>
			
				08-28-2003, 08:40 PM
			
			
			<!-- / status icon and date -->				
	</td>
	<td class="thead" style="font-weight:normal" align="right">
		&nbsp;
		#<a href="showpost.php?s=08828acfcca8bf515aff0f08f5fc454a&amp;p=52036&amp;postcount=14" target="new"><strong>14</strong></a>
	</td>
</tr>
<tr valign="top">
	<td class="alt2" width="165">
			
			<div id="postmenu_52036">
				
				<a class="bigusername" href="member.php?s=08828acfcca8bf515aff0f08f5fc454a&amp;u=25695">FennyX</a>
				<script type="text/javascript"> vbmenu_register("postmenu_52036", true); </script>
				
			</div>
			
			<div class="smallfont">A Snow Cougar</div>
			
		
			
			
			<div class="smallfont">
				&nbsp;<br />
				<div>Join Date: Sep 2002</div>
				
				<div>
					Posts: 45
					
				</div>
				
				
				
				
				
				<div><a href="http://www.eqinterface.com/list.php?s=08828acfcca8bf515aff0f08f5fc454a&amp;skinnerid=25695"><img src="/images/misc/badges/author-list-link.gif" width="37" height="39" border="0" alt="Interface Author - Click to view interfaces"></a></div>
				<div>   </div>
			</div>					
		
	</td>
	<td class="alt1">
	
		
			<!-- icon and title -->
			<div class="smallfont">
				<img class="inlineimg" src="images/icons/icon1.gif" alt="Default" border="0" />
				
			</div>
			<hr size="1" style="color:#FFFFFF" />
			<!-- / icon and title -->
		
		
		<!-- message -->
		<div>Make sure all the files are there.  It sounds like you only extracted one file; storyFooyfSpells.txt .. make sure you have the following in your Everquest folder:<br />
<br />
a file: Everquest\Storyline\storyFoofySpells.txt<br />
a folder: Everqeust\Storyline\foofy <br />
<br />
in the foofy folder there should be a ton of files.</div>
		<!-- / message -->
	
		
		
		
		
		
	
	</td>
</tr>
<tr>
	<td class="alt2">
		<img class="inlineimg" src="/images/statusicon/user_offline.gif" alt="FennyX is offline" border="0" />


		
		
		
		&nbsp;
	</td>
	<td class="alt1" align="right">
		<!-- controls -->
		
		
		
			<a href="newreply.php?s=08828acfcca8bf515aff0f08f5fc454a&amp;do=newreply&amp;p=52036"><img src="/images/buttons/quote.gif" alt="Reply With Quote" border="0" /></a>
		
		
		<!-- / controls -->
	</td>
</tr>
</table>

<!-- post 52036 popup menu -->
<div class="vbmenu_popup" id="postmenu_52036_menu" style="display:none">
	<table cellpadding="4" cellspacing="1" border="0">
	<tr>
		<td class="thead">FennyX</td>
	</tr>
	
		<tr><td class="vbmenu_option"><a href="member.php?s=08828acfcca8bf515aff0f08f5fc454a&amp;userid=25695">View Public Profile</a></td></tr>
	
	
		<tr><td class="vbmenu_option"><a href="private.php?s=08828acfcca8bf515aff0f08f5fc454a&amp;do=newpm&amp;userid=25695">Send a private message to FennyX</a></td></tr>
	
	
	
	
		<tr><td class="vbmenu_option"><a href="search.php?s=08828acfcca8bf515aff0f08f5fc454a&amp;do=finduser&amp;userid=25695">Find More Posts by FennyX</a></td></tr>
	
	
	<tr><td class="vbmenu_option"><a href="profile.php?s=08828acfcca8bf515aff0f08f5fc454a&amp;do=addlist&amp;userlist=buddy&amp;u=25695">Add FennyX to Your Buddy List</a></td></tr>
	
	</table>
</div>
<!-- / post 52036 popup menu -->

</div>
		</div>	
	</div>
</div>

<!-- / close content container -->
<!-- / post #52036 --><!-- post #53919 -->
<!-- open content container -->

	<div align="center">
		<div class="page" style="width:100%; text-align:left">
			<div style="padding:0px 10px 0px 10px">


<table class="tborder" cellpadding="6" cellspacing="0" border="0" width="100%" align="center">
<tr>
	<td class="thead" style="font-weight:normal" >		
			<!-- status icon and date -->
			<a name="post53919"><img class="inlineimg" src="/images/statusicon/post_old.gif" alt="Old" border="0" /></a>
			
				09-13-2003, 03:59 PM
			
			
			<!-- / status icon and date -->				
	</td>
	<td class="thead" style="font-weight:normal" align="right">
		&nbsp;
		#<a href="showpost.php?s=08828acfcca8bf515aff0f08f5fc454a&amp;p=53919&amp;postcount=15" target="new"><strong>15</strong></a>
	</td>
</tr>
<tr valign="top">
	<td class="alt2" width="165">
			
			<div id="postmenu_53919">
				
				<a class="bigusername" href="member.php?s=08828acfcca8bf515aff0f08f5fc454a&amp;u=31742">kasca</a>
				<script type="text/javascript"> vbmenu_register("postmenu_53919", true); </script>
				
			</div>
			
			<div class="smallfont">A Lost Soul</div>
			
		
			
			
			<div class="smallfont">
				&nbsp;<br />
				<div>Join Date: Oct 2002</div>
				<div>Server: the rathe</div>
				<div>
					Posts: 428
					
				</div>
				
				
				
				
				
				
				<div><a href="#" onclick="return imwindow('icq', '31742', 500, 450)"><img src="/images/misc/im_icq.gif" alt="Send a message via ICQ to kasca" border="0" /></a>   </div>
			</div>					
		
	</td>
	<td class="alt1">
	
		
			<!-- icon and title -->
			<div class="smallfont">
				<img class="inlineimg" src="images/icons/icon1.gif" alt="Default" border="0" />
				
			</div>
			<hr size="1" style="color:#FFFFFF" />
			<!-- / icon and title -->
		
		
		<!-- message -->
		<div>i like your spell list. I would take out the message you get. Give some idea as to where the spell can be located.</div>
		<!-- / message -->
	
		
		
		
		<!-- sig -->
			<div>
				__________________<br />
				Kill them All Let God,if there is one. Sort them out.
			</div>
		<!-- / sig -->
		
		
		
	
	</td>
</tr>
<tr>
	<td class="alt2">
		<img class="inlineimg" src="/images/statusicon/user_offline.gif" alt="kasca is offline" border="0" />


		
		
		
		&nbsp;
	</td>
	<td class="alt1" align="right">
		<!-- controls -->
		
		
		
			<a href="newreply.php?s=08828acfcca8bf515aff0f08f5fc454a&amp;do=newreply&amp;p=53919"><img src="/images/buttons/quote.gif" alt="Reply With Quote" border="0" /></a>
		
		
		<!-- / controls -->
	</td>
</tr>
</table>

<!-- post 53919 popup menu -->
<div class="vbmenu_popup" id="postmenu_53919_menu" style="display:none">
	<table cellpadding="4" cellspacing="1" border="0">
	<tr>
		<td class="thead">kasca</td>
	</tr>
	
		<tr><td class="vbmenu_option"><a href="member.php?s=08828acfcca8bf515aff0f08f5fc454a&amp;userid=31742">View Public Profile</a></td></tr>
	
	
		<tr><td class="vbmenu_option"><a href="private.php?s=08828acfcca8bf515aff0f08f5fc454a&amp;do=newpm&amp;userid=31742">Send a private message to kasca</a></td></tr>
	
	
	
	
		<tr><td class="vbmenu_option"><a href="search.php?s=08828acfcca8bf515aff0f08f5fc454a&amp;do=finduser&amp;userid=31742">Find More Posts by kasca</a></td></tr>
	
	
	<tr><td class="vbmenu_option"><a href="profile.php?s=08828acfcca8bf515aff0f08f5fc454a&amp;do=addlist&amp;userlist=buddy&amp;u=31742">Add kasca to Your Buddy List</a></td></tr>
	
	</table>
</div>
<!-- / post 53919 popup menu -->


		</div>	
	</div>
</div>

<!-- / close content container -->
<!-- / post #53919 --></div>

<!-- start content table -->
<!-- open content container -->

	<div align="center">
		<div class="page" style="width:100%; text-align:left">
			<div style="padding:0px 10px 0px 10px">

<!-- / start content table -->

<!-- controls below postbits -->
<table cellpadding="0" cellspacing="0" border="0" width="100%">
<tr valign="top">
	
