C1: Ynnos' Siegecrafting for Dummies - A Reference for the Rest of Us (yeah right...) I've always been facinated about how Siegecraft works in Dark Age of Camelot. However, there doesn't seem to be a lot of information out there regarding it. This page is a result of my on-going explorations and testing with the siege warfare elements. Please note that these are all via the "purchase method" of obtaining the components. Unfortunately I am not that skillful yet in creating these components. Main siegecraft information was gathered from: http://support.darkageofcamelot.com/guides/siegecraft/, which I found via the Dark Age of Camelot Tradeskills site I've updated their information and put it in table-form below, along with some basic information. As of 4/4/02, I've tested out and have successfully created the ram and ballista. Hope you will find the information useful. If you find any discrepancy or would like to add more, please let me know so I can update the info accordingly. Happy hunting!!! Ynnos Fyrestrike Hooded Nomads Galahad - Midgard Basic Information

B1: Level requirement: Lvl 1 in Siegecrafting - there is a misconception in popular belief, you need to be high level in different tradeskills to create the "components" of the siege equipment. However, once you have all the components ready, you only need to be lvl 1 in siegecrafting to create the siege equipment. I believe the higher in Siegecrafting you are, the faster you make the siege equipment.
B2: Where to buy components: unfortunately, the only place I've found this is at the furthest frontier keep, which in Midgard is at Bledmeer Faste. Now I think, if you control the similar keep in Albion or Hibernia, then you can get siege components there too, once the vendors are available.
B3: Commands: currently, there seems to be a bug once you create the siege equipment. You are automatically in control, however the control box doesn't pop up. Type "/control release" to remove control, and then target and type "/control" to take control of the siege equipment. A control box will pop up with the following commands:
B4: Movement: YOU CAN'T!!! Please make note of that. Once you deploy siege equipment, that's where they stand. So special care and planning need to be made when picking a spot to deploy at. And don't forget to have people defending your newly created equipment. Trust me, you will be attracting a lot of attention.

B1: ARM - click this right away to get your siege equipment ready
B2: LOAD - this command is only for ammo using equipment (ballistas and catapults), grab and drop the bolt/stone onto the siege equipment, THEN click LOAD to load the ammo. NOTE: don't drop more than one piece of ammo onto the equipment, unfortunately at the moment you cannot pre-load them, although it looks like you may able to do it in the future.
B3: AIM - click on a target you want to hit, you can use F5 to target ground (move ground targetting by holding the F5 key and using UP and DOWN arrow keys) or directly selecting a target such as the keep door or enemy players, THEN click AIM to position your equipment.
B4: FIRE - after the appropriate amount of secs, sometimes around 5 secs or so, click FIRE to launch your ammo or battering ram. Immediately click on ARM to get ready for the next round.
B5: /repair - the siege equipment will normally decay in time, and will also receive damage when hit by enemy players. Use this command to repair it. Currently, you don't need wood to repair the siege equipment, BUT there is a limit as to how many time you can repair the equipment. I usually wait till it's around 1/4 health when I use this command. It takes less than 10 secs for me to fully repair the siege equipment back to full health. However, I am not too sure on who can repair this, since this is a weapon. I currently am lvl 245 in weaponcrafting, and I read somewhere that you have to be around lvl 300+ to repair the weapon. Try it out and let me know what you find out.

A0: Component Information
A1: Ram | C1: + 300 wood
B2: # | C2: Type | D2: Wt. | E2: Price (in copper) | F2: Sum Wt. | G2: Sum Price
B3: 1 | C3: ram cladding | D3: 35 | E3: 29400 | F3: =+B3*D3 -> 35 | G3: =+B3*E3 -> 29400
B4: 2 | C4: swing harness | D4: 37 | E4: 18600 | F4: =+B4*D4 -> 74 | G4: =+B4*E4 -> 37200
B5: 1 | C5: ram beak | D5: 52 | E5: 29400 | F5: =+B5*D5 -> 52 | G5: =+B5*E5 -> 29400
E7: Totals: | F7: =SUM(F3:F5) -> 161 | G7: =SUM(G3:G5) -> 96000
A9: Ballista | C9: + 400 wood + ammo
B10: # | C10: Type | D10: Wt. | E10: Price (in copper) | F10: Sum Wt. | G10: Sum Price
B11: 1 | C11: gimbal | D11: 60 | E11: 84000 | F11: =+B11*D11 -> 60 | G11: =+B11*E11 -> 84000
B12: 1 | C12: balista trigger | D12: 35 | E12: 80400 | F12: =+B12*D12 -> 35 | G12: =+B12*E12 -> 80400
B13: 2 | C13: tanned torsion cables | D13: 40 | E13: 30000 | F13: =+B13*D13 -> 80 | G13: =+B13*E13 -> 60000
B14: 1 | C14: iron spring arms | D14: 55 | E14: 74700 | F14: =+B14*D14 -> 55 | G14: =+B14*E14 -> 74700
E16: Totals: | F16: =SUM(F11:F14) -> 230 | G16: =SUM(G11:G14) -> 299100
A18: Catapult | C18: + 600 wood + ammo
B19: # | C19: Type | D19: Wt. | E19: Price (in copper) | F19: Sum Wt. | G19: Sum Price
B20: 1 | C20: ammo bucket | D20: 50 | E20: 84000 | F20: =+B20*D20 -> 50 | G20: =+B20*E20 -> 84000
B21: 1 | C21: tanned arm cushion | D21: 30 | E21: 86400 | F21: =+B21*D21 -> 30 | G21: =+B21*E21 -> 86400
B22: 1 | C22: winding crank | D22: 52 | E22: 86700 | F22: =+B22*D22 -> 52 | G22: =+B22*E22 -> 86700
B23: 1 | C23: counterweight | D23: 60 | E23: 95700 | F23: =+B23*D23 -> 60 | G23: =+B23*E23 -> 95700
B24: 1 | C24: pivot | D24: 45 | E24: 94500 | F24: =+B24*D24 -> 45 | G24: =+B24*E24 -> 94500
E26: Totals: | F26: =SUM(F20:F24) -> 237 | G26: =SUM(G20:G24) -> 447300
A28: Ammo
B29: # | C29: Type | D29: Wt. | E29: Price (in copper)
B30: 1 | C30: ballista bolt | D30: 2 | E30: 500
B31: 1 | C31: catapult stone | D31: 5 | E31: 500

A1: Wood | C1: - calculation per (100) wood
B2: # | C2: Type | D2: Wt. | E2: Price (in copper) | F2: Sum Wt. | G2: Sum Price
B3: 5 | C3: elmwood - 20/stack | E3: 1200 | F3: =+B3*D3 ->  | G3: =+B3*E3 -> 6000 | H3: Produces Type 1 Siege equipment
B4: 5 | C4: oakwood - 20/stack | D4: 5 | F4: =+B4*D4 -> 25 | G4: =+B4*E4 ->  | H4: Produces Type 2 Siege equipment
B5: 5 | C5: ironwood - 20/stack | F5: =+B5*D5 ->  | G5: =+B5*E5 ->  | H5: Produces Type 3 Siege equipment

A1: Equipment Information
A2: Ram | B2: - melee-type damage
B3: Name | C3: Level | D3: Wood | E3: Dmg
B4: small ram | C4: Type 1 | D4: elmwood
B5: ram | C5: Type 2 | D5: oakwood | E5: 500
B6: siege ram | C6: Type 3 | D6: ironwood | E6: 750
A8: Ballista | B8: - area effect damage, but targetted person gets more damage
B9: Name | C9: Level | D9: Wood | E9: Dmg
B10: scorpion | C10: Type 1 | D10: elmwood
B11: ballista | C11: Type 2 | D11: oakwood
B12: palintone | C12: Type 3 | D12: ironwood
A14: Catapult | B14: - area effect damage
B15: Name | C15: Level | D15: Wood | E15: Dmg
B16: onager | C16: Type 1 | D16: elmwood
B17: catapult | C17: Type 2 | D17: oakwood
B18: trebuchet | C18: Type 3 | D18: ironwood

A1: Copyright 2001 by Hooded Nomads. All rights reserved. Revised: 17 Oct 2002 22:22:26 -0400 .