A1: Name | B1: Effect | C1: DMG | D1: DLY | E1: Dmg/Dly | F1: STR | G1: STA | H1: AGI | I1: DEX | J1: WIS | K1: INT | L1: CHA | M1: HP | N1: MANA | O1: PR | P1: MR | Q1: DR | R1: FR | S1: CR | T1: WT | U1: WP | V1: Type
A2: A Club Clad Blackjack | C2: 7.0 | D2: 21.0 | E2: =D2/C2 -> 3.0 | T2: 0.0 | U2: =0-QUOTIENT(T2,3) -> 0.0 | V2: 1hb
A3: Bamboo Tanto Bo | C3: 5.0 | D3: 33.0 | E3: =D3/C3 -> 6.6 | T3: 8.5 | U3: =0-QUOTIENT(T3,3) -> -2.0 | V3: 1hb
A4: Bamboo Wakizashi Bo | C4: 6.0 | D4: 38.0 | E4: =D4/C4 -> 6.333333333333333 | T4: 8.5 | U4: =0-QUOTIENT(T4,3) -> -2.0 | V4: 1hb
A5: Blackjack | C5: 7.0 | D5: 21.0 | E5: =D5/C5 -> 3.0 | T5: 1.9 | U5: =0-QUOTIENT(T5,3) -> 0.0 | V5: 1hb
A6: Blam Stick | C6: 30.0 | D6: 40.0 | E6: =D6/C6 -> 1.3333333333333333 | T6: 0.0 | U6: =0-QUOTIENT(T6,3) -> 0.0 | V6: 1hb
A7: Blood Crusted Kobold Mace | C7: 7.0 | D7: 38.0 | E7: =D7/C7 -> 5.4285714285714288 | F7: 3.0 | M7: 5.0 | T7: 9.0 | U7: =0-QUOTIENT(T7,3) -> -3.0 | V7: 1hb
A8: Blydreln's Bane | C8: 11.0 | D8: 24.0 | E8: =D8/C8 -> 2.1818181818181817 | F8: 10.0 | H8: 15.0 | M8: 50.0 | S8: 30.0 | T8: 4.5 | U8: =0-QUOTIENT(T8,3) -> -1.0 | V8: 1hb
A9: Brell's Keg Popper | B9: Yaulp II | C9: 15.0 | D9: 35.0 | E9: =D9/C9 -> 2.3333333333333335 | T9: 3.2 | U9: =0-QUOTIENT(T9,3) -> -1.0 | V9: 1hb
A10: Bronze Flail | C10: 6.0 | D10: 37.0 | E10: =D10/C10 -> 6.166666666666667 | T10: 10.0 | U10: =0-QUOTIENT(T10,3) -> -3.0 | V10: 1hb
A11: Bronze Mace | C11: 6.0 | D11: 38.0 | E11: =D11/C11 -> 6.333333333333333 | T11: 9.0 | U11: =0-QUOTIENT(T11,3) -> -3.0 | V11: 1hb
A12: Bronze Tonfa | C12: 5.0 | D12: 35.0 | E12: =D12/C12 -> 7.0 | T12: 6.0 | U12: =0-QUOTIENT(T12,3) -> -2.0 | V12: 1hb
A13: Bronze Warclub | C13: 5.0 | D13: 35.0 | E13: =D13/C13 -> 7.0 | T13: 6.0 | U13: =0-QUOTIENT(T13,3) -> -2.0 | V13: 1hb
A14: Cast Iron Stein | C14: 5.0 | D14: 31.0 | E14: =D14/C14 -> 6.2 | G14: 2.0 | J14: 3.0 | T14: 4.3 | U14: =0-QUOTIENT(T14,3) -> -1.0 | V14: 1hb
A15: Cast-Iron Warhammer | C15: 4.0 | D15: 30.0 | E15: =D15/C15 -> 7.5 | T15: 7.5 | U15: =0-QUOTIENT(T15,3) -> -2.0 | V15: 1hb
A16: Club | C16: 4.0 | D16: 27.0 | E16: =D16/C16 -> 6.75 | T16: 5.0 | U16: =0-QUOTIENT(T16,3) -> -1.0 | V16: 1hb
A17: Cold Iron Morning Star | C17: 9.0 | D17: 35.0 | E17: =D17/C17 -> 3.8888888888888888 | T17: 4.5 | U17: =0-QUOTIENT(T17,3) -> -1.0 | V17: 1hb
A18: Combine Morning Star | C18: 8.0 | D18: 38.0 | E18: =D18/C18 -> 4.75 | T18: 10.0 | U18: =0-QUOTIENT(T18,3) -> -3.0 | V18: 1hb
A19: Cracked Dragon Bone | C19: 5.0 | D19: 32.0 | E19: =D19/C19 -> 6.4 | T19: 8.5 | U19: =0-QUOTIENT(T19,3) -> -2.0 | V19: 1hb
A20: Cracked Staff | C20: 5.0 | D20: 32.0 | E20: =D20/C20 -> 6.4 | T20: 8.5 | U20: =0-QUOTIENT(T20,3) -> -2.0 | V20: 1hb
A21: Crystalized Shadow Hammer | C21: 7.0 | D21: 29.0 | E21: =D21/C21 -> 4.1428571428571432 | F21: 2.0 | G21: 2.0 | L21: 1.0 | M21: 5.0 | T21: 7.3 | U21: =0-QUOTIENT(T21,3) -> -2.0 | V21: 1hb
A22: Crystalized Shadow Star | C22: 9.0 | D22: 37.0 | E22: =D22/C22 -> 4.1111111111111107 | F22: 2.0 | G22: 2.0 | L22: 1.0 | M22: 5.0 | T22: 10.0 | U22: =0-QUOTIENT(T22,3) -> -3.0 | V22: 1hb
A23: Dark Ember | B23: Burn | C23: 13.0 | D23: 32.0 | E23: =D23/C23 -> 2.4615384615384617 | F23: 2.0 | J23: 5.0 | M23: 20.0 | N23: 20.0 | R23: 7.0 | T23: 5.0 | U23: =0-QUOTIENT(T23,3) -> -1.0 | V23: 1hb
A24: Darkwood Staff | C24: 5.0 | D24: 28.0 | E24: =D24/C24 -> 5.6 | T24: 6.5 | U24: =0-QUOTIENT(T24,3) -> -2.0 | V24: 1hb
A25: Delgin's Sceptre | C25: 8.0 | D25: 24.0 | E25: =D25/C25 -> 3.0 | F25: 5.0 | H25: 2.0 | J25: 3.0 | N25: 10.0 | P25: 3.0 | S25: 4.0 | T25: 1.5 | U25: =0-QUOTIENT(T25,3) -> 0.0 | V25: 1hb
A26: Di`zok Escape Staff | B26: Evacuate Nek | C26: 21.0 | D26: 40.0 | E26: =D26/C26 -> 1.9047619047619047 | T26: 5.0 | U26: =0-QUOTIENT(T26,3) -> -1.0 | V26: 1hb
A27: Di`zok Sceptre of Authority | C27: 10.0 | D27: 20.0 | E27: =D27/C27 -> 2.0 | J27: 5.0 | K27: 5.0 | N27: 25.0 | P27: 5.0 | T27: 3.0 | U27: =0-QUOTIENT(T27,3) -> -1.0 | V27: 1hb
A28: Dwarven Mace | C28: 8.0 | D28: 35.0 | E28: =D28/C28 -> 4.375 | T28: 4.5 | U28: =0-QUOTIENT(T28,3) -> -1.0 | V28: 1hb
A29: Dwarven Warhammer | C29: 7.0 | D29: 33.0 | E29: =D29/C29 -> 4.7142857142857144 | T29: 7.5 | U29: =0-QUOTIENT(T29,3) -> -2.0 | V29: 1hb
A30: Ebonwood Cudgel | C30: 8.0 | D30: 24.0 | E30: =D30/C30 -> 3.0 | F30: 5.0 | I30: 5.0 | T30: 4.5 | U30: =0-QUOTIENT(T30,3) -> -1.0 | V30: 1hb
A31: Efreeti Standard | C31: 3.0 | D31: 10.0 | E31: =D31/C31 -> 3.3333333333333335 | T31: 10.0 | U31: =0-QUOTIENT(T31,3) -> -3.0 | V31: 1hb
A32: Efreeti War Club | C32: 11.0 | D32: 26.0 | E32: =D32/C32 -> 2.3636363636363638 | T32: 1.0 | U32: =0-QUOTIENT(T32,3) -> 0.0 | V32: 1hb
A33: Enamelled Black Mace | C33: 8.0 | D33: 28.0 | E33: =D33/C33 -> 3.5 | T33: 4.5 | U33: =0-QUOTIENT(T33,3) -> -1.0 | V33: 1hb
A34: Enchanted Fine Steel Morning Star | C34: 7.0 | D34: 30.0 | E34: =D34/C34 -> 4.2857142857142856 | F34: 2.0 | J34: 5.0 | T34: 9.0 | U34: =0-QUOTIENT(T34,3) -> -3.0 | V34: 1hb
A35: Etched Steel Baton | C35: 14.0 | D35: 28.0 | E35: =D35/C35 -> 2.0 | O35: 10.0 | S35: 10.0 | T35: 3.0 | U35: =0-QUOTIENT(T35,3) -> -1.0 | V35: 1hb
A36: Etched Velium Battlehammer | C36: 11.0 | D36: 20.0 | E36: =D36/C36 -> 1.8181818181818181 | T36: 3.5 | U36: =0-QUOTIENT(T36,3) -> -1.0 | V36: 1hb
A37: Exquisite Velium Battlehammer | C37: 12.0 | D37: 20.0 | E37: =D37/C37 -> 1.6666666666666667 | T37: 3.5 | U37: =0-QUOTIENT(T37,3) -> -1.0 | V37: 1hb
A38: Fading Shadow Star | C38: 9.0 | D38: 37.0 | E38: =D38/C38 -> 4.1111111111111107 | M38: 2.0 | T38: 10.0 | U38: =0-QUOTIENT(T38,3) -> -3.0 | V38: 1hb
A39: Fatesealer | C39: 9.0 | D39: 18.0 | E39: =D39/C39 -> 2.0 | F39: 4.0 | I39: 4.0 | J39: 8.0 | K39: 8.0 | M39: 75.0 | N39: 75.0 | T39: 3.5 | U39: =0-QUOTIENT(T39,3) -> -1.0 | V39: 1hb
A40: Fine Steel Morning Star | C40: 8.0 | D40: 38.0 | E40: =D40/C40 -> 4.75 | T40: 10.0 | U40: =0-QUOTIENT(T40,3) -> -3.0 | V40: 1hb
A41: Fine Steel Tonfa | C41: 6.0 | D41: 29.0 | E41: =D41/C41 -> 4.833333333333333 | T41: 6.0 | U41: =0-QUOTIENT(T41,3) -> -2.0 | V41: 1hb
A42: Fine Steel Warhammer | C42: 6.0 | D42: 30.0 | E42: =D42/C42 -> 5.0 | T42: 7.4 | U42: =0-QUOTIENT(T42,3) -> -2.0 | V42: 1hb
A43: Flail | C43: 7.0 | D43: 36.0 | E43: =D43/C43 -> 5.1428571428571432 | T43: 9.0 | U43: =0-QUOTIENT(T43,3) -> -3.0 | V43: 1hb
A44: Focused Ethereal Morning Star | C44: 8.0 | D44: 37.0 | E44: =D44/C44 -> 4.625 | H44: 4.0 | I44: 2.0 | T44: 5.0 | U44: =0-QUOTIENT(T44,3) -> -1.0 | V44: 1hb
A45: Focused Ethereal Warhammer | C45: 6.0 | D45: 29.0 | E45: =D45/C45 -> 4.833333333333333 | H45: 4.0 | I45: 2.0 | T45: 3.7 | U45: =0-QUOTIENT(T45,3) -> -1.0 | V45: 1hb
A46: Fool's Gold Stein | C46: 2.0 | D46: 30.0 | E46: =D46/C46 -> 15.0 | T46: 1.0 | U46: =0-QUOTIENT(T46,3) -> 0.0 | V46: 1hb
A47: Forest Giant Hammer | C47: 10.0 | D47: 35.0 | E47: =D47/C47 -> 3.5 | T47: 8.0 | U47: =0-QUOTIENT(T47,3) -> -2.0 | V47: 1hb
A48: Forged Hammer of Dalnir | C48: 6.0 | D48: 50.0 | E48: =D48/C48 -> 8.3333333333333339 | T48: 15.0 | U48: =0-QUOTIENT(T48,3) -> -5.0 | V48: 1hb
A49: Forged Mace | C49: 7.0 | D49: 36.0 | E49: =D49/C49 -> 5.1428571428571432 | T49: 8.0 | U49: =0-QUOTIENT(T49,3) -> -2.0 | V49: 1hb
A50: Forged Morning Star | C50: 8.0 | D50: 38.0 | E50: =D50/C50 -> 4.75 | T50: 9.0 | U50: =0-QUOTIENT(T50,3) -> -3.0 | V50: 1hb
A51: Forged Velium Battlehammer | C51: 11.0 | D51: 23.0 | E51: =D51/C51 -> 2.0909090909090908 | T51: 3.5 | U51: =0-QUOTIENT(T51,3) -> -1.0 | V51: 1hb
A52: Forged Warhammer | C52: 6.0 | D52: 30.0 | E52: =D52/C52 -> 5.0 | T52: 7.5 | U52: =0-QUOTIENT(T52,3) -> -2.0 | V52: 1hb
A53: Forging Hammer | C53: 4.0 | D53: 38.0 | E53: =D53/C53 -> 9.5 | T53: 6.5 | U53: =0-QUOTIENT(T53,3) -> -2.0 | V53: 1hb
A54: Garou Bone Club | B54: Curse of the Garou | C54: 5.0 | D54: 25.0 | E54: =D54/C54 -> 5.0 | J54: 7.0 | K54: 7.0 | T54: 4.0 | U54: =0-QUOTIENT(T54,3) -> -1.0 | V54: 1hb
A55: Gavel | C55: 4.0 | D55: 38.0 | E55: =D55/C55 -> 9.5 | T55: 6.5 | U55: =0-QUOTIENT(T55,3) -> -2.0 | V55: 1hb
A56: Gem-Encrusted Scepter | C56: 7.0 | D56: 28.0 | E56: =D56/C56 -> 4.0 | J56: 5.0 | T56: 4.5 | U56: =0-QUOTIENT(T56,3) -> -1.0 | V56: 1hb
A57: Goblin Knee Cracker | C57: 5.0 | D57: 29.0 | E57: =D57/C57 -> 5.8 | T57: 3.8 | U57: =0-QUOTIENT(T57,3) -> -1.0 | V57: 1hb
A58: Goblin Shin Splinter | C58: 5.0 | D58: 30.0 | E58: =D58/C58 -> 6.0 | T58: 2.8 | U58: =0-QUOTIENT(T58,3) -> 0.0 | V58: 1hb
A59: Goblin Skull Crusher | B59: Stun | C59: 7.0 | D59: 32.0 | E59: =D59/C59 -> 4.5714285714285712 | S59: 6.0 | T59: 4.3 | U59: =0-QUOTIENT(T59,3) -> -1.0 | V59: 1hb
A60: Guard Captain's Mallet | C60: 11.0 | D60: 20.0 | E60: =D60/C60 -> 1.8181818181818181 | H60: 6.0 | I60: 6.0 | M60: 45.0 | T60: 5.0 | U60: =0-QUOTIENT(T60,3) -> -1.0 | V60: 1hb
A61: Hulking Spiked Club | C61: 6.0 | D61: 26.0 | E61: =D61/C61 -> 4.333333333333333 | T61: 4.5 | U61: =0-QUOTIENT(T61,3) -> -1.0 | V61: 1hb
A62: Humerus Handled Mace | C62: 5.0 | D62: 29.0 | E62: =D62/C62 -> 5.8 | S62: 2.0 | T62: 1.5 | U62: =0-QUOTIENT(T62,3) -> 0.0 | V62: 1hb
A63: Iceball | C63: 2.0 | D63: 20.0 | E63: =D63/C63 -> 10.0 | T63: 0.5 | U63: =0-QUOTIENT(T63,3) -> 0.0 | V63: 1hb
A64: Iceshaper's Staff | C64: 7.0 | D64: 24.0 | E64: =D64/C64 -> 3.4285714285714284 | F64: 3.0 | J64: 5.0 | N64: 30.0 | S64: 8.0 | T64: 4.0 | U64: =0-QUOTIENT(T64,3) -> -1.0 | V64: 1hb
A65: Iksar Berserker Club | B65: Fleeting Fury | C65: 7.0 | D65: 18.0 | E65: =D65/C65 -> 2.5714285714285716 | F65: 4.0 | J65: 4.0 | K65: -2.0 | T65: 8.0 | U65: =0-QUOTIENT(T65,3) -> -2.0 | V65: 1hb
A66: Iksar Stave | C66: 5.0 | D66: 23.0 | E66: =D66/C66 -> 4.6 | T66: 3.5 | U66: =0-QUOTIENT(T66,3) -> -1.0 | V66: 1hb
A67: Iron Bound Tome | B67: Cancel Magic | C67: 7.0 | D67: 38.0 | E67: =D67/C67 -> 5.4285714285714288 | N67: 5.0 | P67: 3.0 | R67: 5.0 | T67: 12.0 | U67: =0-QUOTIENT(T67,3) -> -4.0 | V67: 1hb
A68: Ivory Inlaid Staff | C68: 5.0 | D68: 25.0 | E68: =D68/C68 -> 5.0 | T68: 6.5 | U68: =0-QUOTIENT(T68,3) -> -2.0 | V68: 1hb
A69: Ivory Spiked Club | C69: 9.0 | D69: 40.0 | E69: =D69/C69 -> 4.4444444444444446 | T69: 10.0 | U69: =0-QUOTIENT(T69,3) -> -3.0 | V69: 1hb
A70: Jade Mace | C70: 9.0 | D70: 18.0 | E70: =D70/C70 -> 2.0 | T70: 2.1 | U70: =0-QUOTIENT(T70,3) -> 0.0 | V70: 1hb
A71: Jaggedpine Crook Staff | C71: 5.0 | D71: 31.0 | E71: =D71/C71 -> 6.2 | F71: 1.0 | M71: 5.0 | R71: 5.0 | T71: 8.5 | U71: =0-QUOTIENT(T71,3) -> -2.0 | V71: 1hb
A72: Journeyman's Walking Stick | B72: Tashani | C72: 9.0 | D72: 24.0 | E72: =D72/C72 -> 2.6666666666666665 | F72: 4.0 | J72: 4.0 | K72: 4.0 | T72: 1.6 | U72: =0-QUOTIENT(T72,3) -> 0.0 | V72: 1hb
A73: Kejekan Smithy Hammer | C73: 5.0 | D73: 42.0 | E73: =D73/C73 -> 8.4 | T73: 18.0 | U73: =0-QUOTIENT(T73,3) -> -6.0 | V73: 1hb
A74: Kerran Fishingpole | C74: 3.0 | D74: 17.0 | E74: =D74/C74 -> 5.666666666666667 | F74: 2.0 | T74: 4.0 | U74: =0-QUOTIENT(T74,3) -> -1.0 | V74: 1hb
A75: Knobbed Warclub | C75: 8.0 | D75: 24.0 | E75: =D75/C75 -> 3.0 | J75: 3.0 | T75: 2.0 | U75: =0-QUOTIENT(T75,3) -> 0.0 | V75: 1hb
A76: Light Velium Battlehammer | C76: 11.0 | D76: 24.0 | E76: =D76/C76 -> 2.1818181818181817 | T76: 3.5 | U76: =0-QUOTIENT(T76,3) -> -1.0 | V76: 1hb
A77: Mace | C77: 7.0 | D77: 37.0 | E77: =D77/C77 -> 5.2857142857142856 | T77: 8.0 | U77: =0-QUOTIENT(T77,3) -> -2.0 | V77: 1hb
A78: Massive Velium Battlehammer | C78: 12.0 | D78: 21.0 | E78: =D78/C78 -> 1.75 | T78: 3.5 | U78: =0-QUOTIENT(T78,3) -> -1.0 | V78: 1hb
A79: Mithril Fier'Dal Morning Star (K) | C79: 9.0 | D79: 35.0 | E79: =D79/C79 -> 3.8888888888888888 | H79: 4.0 | I79: 2.0 | J79: 2.0 | T79: 5.0 | U79: =0-QUOTIENT(T79,3) -> -1.0 | V79: 1hb
A80: Mithril Fier'Dal Morning Star (Tu) | C80: 9.0 | D80: 35.0 | E80: =D80/C80 -> 3.8888888888888888 | H80: 4.0 | J80: 2.0 | L80: 2.0 | T80: 5.0 | U80: =0-QUOTIENT(T80,3) -> -1.0 | V80: 1hb
A81: Modulating Rod | B81: Modulation | C81: 8.0 | D81: 26.0 | E81: =D81/C81 -> 3.25 | T81: 1.0 | U81: =0-QUOTIENT(T81,3) -> 0.0 | V81: 1hb
A82: Morning Star | C82: 8.0 | D82: 40.0 | E82: =D82/C82 -> 5.0 | T82: 10.0 | U82: =0-QUOTIENT(T82,3) -> -3.0 | V82: 1hb
A83: Mudman Enforcer | C83: 8.0 | D83: 20.0 | E83: =D83/C83 -> 2.5 | F83: 3.0 | T83: 1.9 | U83: =0-QUOTIENT(T83,3) -> 0.0 | V83: 1hb
A84: Neb's Warbone | C84: 15.0 | D84: 23.0 | E84: =D84/C84 -> 1.5333333333333334 | F84: 10.0 | R84: 15.0 | T84: 5.0 | U84: =0-QUOTIENT(T84,3) -> -1.0 | V84: 1hb
A85: Noble Walking Staff | C85: 8.0 | D85: 19.0 | E85: =D85/C85 -> 2.375 | F85: 2.0 | J85: 2.0 | K85: 2.0 | T85: 4.0 | U85: =0-QUOTIENT(T85,3) -> -1.0 | V85: 1hb
A86: Northman Mace | C86: 9.0 | D86: 36.0 | E86: =D86/C86 -> 4.0 | T86: 8.5 | U86: =0-QUOTIENT(T86,3) -> -2.0 | V86: 1hb
A87: Orcish Mace | C87: 7.0 | D87: 39.0 | E87: =D87/C87 -> 5.5714285714285712 | T87: 9.0 | U87: =0-QUOTIENT(T87,3) -> -3.0 | V87: 1hb
A88: Orcish Morning Star | C88: 8.0 | D88: 43.0 | E88: =D88/C88 -> 5.375 | T88: 11.0 | U88: =0-QUOTIENT(T88,3) -> -3.0 | V88: 1hb
A89: Paebala Fetish | C89: 12.0 | D89: 25.0 | E89: =D89/C89 -> 2.0833333333333335 | F89: 5.0 | J89: 9.0 | N89: 15.0 | O89: 5.0 | P89: 5.0 | Q89: 5.0 | R89: 5.0 | S89: 5.0 | T89: 0.0 | U89: =0-QUOTIENT(T89,3) -> 0.0 | V89: 1hb
A90: Paebala Warbone | B90: Bone Melt | C90: 15.0 | D90: 27.0 | E90: =D90/C90 -> 1.8 | T90: 5.0 | U90: =0-QUOTIENT(T90,3) -> -1.0 | V90: 1hb
A91: Polished Velium Battlehammer | C91: 11.0 | D91: 21.0 | E91: =D91/C91 -> 1.9090909090909092 | T91: 3.5 | U91: =0-QUOTIENT(T91,3) -> -1.0 | V91: 1hb
A92: Priceless Velium Battlehammer | C92: 13.0 | D92: 20.0 | E92: =D92/C92 -> 1.5384615384615385 | F92: 5.0 | G92: 5.0 | H92: 5.0 | I92: 5.0 | J92: 5.0 | K92: 5.0 | L92: 5.0 | M92: 25.0 | N92: 25.0 | O92: 5.0 | P92: 5.0 | Q92: 5.0 | R92: 5.0 | S92: 5.0 | T92: 3.5 | U92: =0-QUOTIENT(T92,3) -> -1.0 | V92: 1hb
A93: Primal Velium Battlehammer | B93: Avatar | C93: 13.0 | D93: 20.0 | E93: =D93/C93 -> 1.5384615384615385 | F93: 5.0 | G93: 5.0 | H93: 5.0 | I93: 5.0 | J93: 5.0 | K93: 5.0 | L93: 5.0 | M93: 50.0 | N93: 50.0 | O93: 5.0 | P93: 5.0 | Q93: 5.0 | R93: 5.0 | S93: 5.0 | T93: 1.5 | U93: =0-QUOTIENT(T93,3) -> 0.0 | V93: 1hb
A94: Purified Crystal Star | C94: 9.0 | D94: 37.0 | E94: =D94/C94 -> 4.1111111111111107 | L94: 4.0 | O94: 5.0 | P94: 5.0 | Q94: 5.0 | R94: 5.0 | S94: 5.0 | T94: 10.0 | U94: =0-QUOTIENT(T94,3) -> -3.0 | V94: 1hb
A95: Purified Star | C95: 9.0 | D95: 37.0 | E95: =D95/C95 -> 4.1111111111111107 | L95: 2.0 | O95: 3.0 | P95: 3.0 | Q95: 3.0 | R95: 3.0 | S95: 3.0 | T95: 10.0 | U95: =0-QUOTIENT(T95,3) -> -3.0 | V95: 1hb
A96: Purified Warhammer | C96: 7.0 | D96: 29.0 | E96: =D96/C96 -> 4.1428571428571432 | L96: 2.0 | O96: 3.0 | P96: 3.0 | Q96: 3.0 | R96: 3.0 | S96: 3.0 | T96: 7.3 | U96: =0-QUOTIENT(T96,3) -> -2.0 | V96: 1hb
A97: Reinforced Bamboo Tanto Bo | C97: 5.0 | D97: 31.0 | E97: =D97/C97 -> 6.2 | T97: 8.5 | U97: =0-QUOTIENT(T97,3) -> -2.0 | V97: 1hb
A98: Reinforced Bamboo Wakizashi Bo | C98: 6.0 | D98: 34.0 | E98: =D98/C98 -> 5.666666666666667 | T98: 9.0 | U98: =0-QUOTIENT(T98,3) -> -3.0 | V98: 1hb
A99: Ringed Mace of the Ykesha | B99: Ykesha | C99: 10.0 | D99: 22.0 | E99: =D99/C99 -> 2.2 | T99: 3.9 | U99: =0-QUOTIENT(T99,3) -> -1.0 | V99: 1hb
A100: Rod of Drones | B100: Drones of Doom | C100: 6.0 | D100: 30.0 | E100: =D100/C100 -> 5.0 | T100: 1.5 | U100: =0-QUOTIENT(T100,3) -> 0.0 | V100: 1hb
A101: Rod of Oblations | C101: 6.0 | D101: 27.0 | E101: =D101/C101 -> 4.5 | N101: 60.0 | R101: 10.0 | S101: 10.0 | T101: 00.1 | U101: =0-QUOTIENT(T101,3) -> 0.0 | V101: 1hb
A102: Ruined Battleworn Morning Star | C102: 7.0 | D102: 33.0 | E102: =D102/C102 -> 4.7142857142857144 | J102: 6.0 | Q102: -5.0 | T102: 9.0 | U102: =0-QUOTIENT(T102,3) -> -3.0 | V102: 1hb
A103: Runed Branding Iron | B103: Burst of Flame | C103: 8.0 | D103: 28.0 | E103: =D103/C103 -> 3.5 | T103: 5.5 | U103: =0-QUOTIENT(T103,3) -> -1.0 | V103: 1hb
A104: Runed Morning Star | C104: 12.0 | D104: 26.0 | E104: =D104/C104 -> 2.1666666666666665 | F104: 7.0 | G104: 3.0 | H104: 8.0 | J104: 6.0 | L104: 4.0 | P104: 8.0 | T104: 3.0 | U104: =0-QUOTIENT(T104,3) -> -1.0 | V104: 1hb
A105: Runed Velium Battlehammer | C105: 12.0 | D105: 24.0 | E105: =D105/C105 -> 2.0 | T105: 3.5 | U105: =0-QUOTIENT(T105,3) -> -1.0 | V105: 1hb
A106: Sap Encrusted Branch | B106: Ensnare | C106: 14.0 | D106: 19.0 | E106: =D106/C106 -> 1.3571428571428572 | G106: 16.0 | O106: 12.0 | Q106: 12.0 | R106: 12.0 | T106: 0.5 | U106: =0-QUOTIENT(T106,3) -> 0.0 | V106: 1hb
A107: Sap of Piety | C107: 13.0 | D107: 36.0 | E107: =D107/C107 -> 2.7692307692307692 | T107: 2.5 | U107: =0-QUOTIENT(T107,3) -> 0.0 | V107: 1hb
A108: Sarnak Enforcer | C108: 7.0 | D108: 28.0 | E108: =D108/C108 -> 4.0 | T108: 1.5 | U108: =0-QUOTIENT(T108,3) -> 0.0 | V108: 1hb
A109: Sarnak Lightning Caller | B109: Fury of Air | C109: 15.0 | D109: 28.0 | E109: =D109/C109 -> 1.8666666666666667 | T109: 1.5 | U109: =0-QUOTIENT(T109,3) -> 0.0 | V109: 1hb
A110: Scepter of Flame | C110: 7.0 | D110: 29.0 | E110: =D110/C110 -> 4.1428571428571432 | N110: 15.0 | P110: 5.0 | R110: 5.0 | T110: 4.5 | U110: =0-QUOTIENT(T110,3) -> -1.0 | V110: 1hb
A111: Scepter of Ixiblat Fer | C111: 15.0 | D111: 32.0 | E111: =D111/C111 -> 2.1333333333333333 | R111: 10.0 | T111: 00.1 | U111: =0-QUOTIENT(T111,3) -> 0.0 | V111: 1hb
A112: Scepter of Rahotep | C112: 9.0 | D112: 38.0 | E112: =D112/C112 -> 4.2222222222222223 | T112: 4.5 | U112: =0-QUOTIENT(T112,3) -> -1.0 | V112: 1hb
A113: Sceptre of Destruction | B113: Anarchy | C113: 12.0 | D113: 18.0 | E113: =D113/C113 -> 1.5 | F113: 10.0 | G113: 10.0 | I113: 10.0 | M113: 50.0 | N113: 50.0 | T113: 00.2 | U113: =0-QUOTIENT(T113,3) -> 0.0 | V113: 1hb
A114: Screaming Mace | B114: Yaulp I | C114: 8.0 | D114: 35.0 | E114: =D114/C114 -> 4.375 | T114: 8.0 | U114: =0-QUOTIENT(T114,3) -> -2.0 | V114: 1hb
A115: Sharkbone Warhammer | C115: 8.0 | D115: 26.0 | E115: =D115/C115 -> 3.25 | J115: 5.0 | T115: 3.0 | U115: =0-QUOTIENT(T115,3) -> -1.0 | V115: 1hb
A116: Shillelah | C116: 10.0 | D116: 25.0 | E116: =D116/C116 -> 2.5 | H116: 2.0 | J116: 9.0 | L116: 4.0 | N116: 50.0 | R116: 5.0 | T116: 4.0 | U116: =0-QUOTIENT(T116,3) -> -1.0 | V116: 1hb
A117: Shining Velium Battlehammer | C117: 12.0 | D117: 22.0 | E117: =D117/C117 -> 1.8333333333333333 | T117: 3.5 | U117: =0-QUOTIENT(T117,3) -> -1.0 | V117: 1hb
A118: Smoldering Brand | B118: Burn | C118: 9.0 | D118: 22.0 | E118: =D118/C118 -> 2.4444444444444446 | F118: 3.0 | T118: 5.0 | U118: =0-QUOTIENT(T118,3) -> -1.0 | V118: 1hb
A119: Smoldering Cudgel | B119: Blaze | C119: 18.0 | D119: 34.0 | E119: =D119/C119 -> 1.8888888888888888 | J119: 12.0 | N119: 50.0 | R119: 25.0 | T119: 00.8 | U119: =0-QUOTIENT(T119,3) -> 0.0 | V119: 1hb
A120: Springwood Club | C120: 9.0 | D120: 25.0 | E120: =D120/C120 -> 2.7777777777777777 | F120: 5.0 | J120: 5.0 | K120: 5.0 | T120: 1.2 | U120: =0-QUOTIENT(T120,3) -> 0.0 | V120: 1hb
A121: Sprinkler of the Spirits | C121: 7.0 | D121: 16.0 | E121: =D121/C121 -> 2.2857142857142856 | F121: 10.0 | J121: 15.0 | M121: 75.0 | N121: 75.0 | O121: 20.0 | P121: 20.0 | Q121: 20.0 | R121: 20.0 | S121: 20.0 | T121: 0.0 | U121: =0-QUOTIENT(T121,3) -> 0.0 | V121: 1hb
A122: Staff | C122: 5.0 | D122: 28.0 | E122: =D122/C122 -> 5.6 | T122: 6.5 | U122: =0-QUOTIENT(T122,3) -> -2.0 | V122: 1hb
A123: Staff of Fire | C123: 5.0 | D123: 25.0 | E123: =D123/C123 -> 5.0 | T123: 6.5 | U123: =0-QUOTIENT(T123,3) -> -2.0 | V123: 1hb
A124: Staff of Peace | C124: 0.0 | D124: 999.0 | E124: 999.0 | F124: 5.0 | J124: 10.0 | Q124: 20.0 | T124: 1.0 | U124: =0-QUOTIENT(T124,3) -> 0.0 | V124: 1hb
A125: Staff of the Gathering | C125: 16.0 | D125: 35.0 | E125: =D125/C125 -> 2.1875 | J125: 5.0 | K125: 5.0 | N125: 50.0 | T125: 00.1 | U125: =0-QUOTIENT(T125,3) -> 0.0 | V125: 1hb
A126: Staff of the Scaled | C126: 5.0 | D126: 38.0 | E126: =D126/C126 -> 7.6 | M126: 5.0 | R126: 10.0 | T126: 6.6 | U126: =0-QUOTIENT(T126,3) -> -2.0 | V126: 1hb
A127: Stone Thunder | C127: 10.0 | D127: 34.0 | E127: =D127/C127 -> 3.4 | T127: 6.5 | U127: =0-QUOTIENT(T127,3) -> -2.0 | V127: 1hb
A128: Stronghorn's Horn | B128: Knockback | C128: 18.0 | D128: 30.0 | E128: =D128/C128 -> 1.6666666666666667 | F128: 7.0 | G128: 15.0 | M128: 25.0 | Q128: 15.0 | T128: 7.5 | U128: =0-QUOTIENT(T128,3) -> -2.0 | V128: 1hb
A129: Thex Mallet | C129: 5.0 | D129: 33.0 | E129: =D129/C129 -> 6.6 | P129: 5.0 | T129: 8.5 | U129: =0-QUOTIENT(T129,3) -> -2.0 | V129: 1hb
A130: Tier'Dal Morning Star | C130: 8.0 | D130: 38.0 | E130: =D130/C130 -> 4.75 | T130: 9.5 | U130: =0-QUOTIENT(T130,3) -> -3.0 | V130: 1hb
A131: Tier'Dal Warhammer | C131: 6.0 | D131: 30.0 | E131: =D131/C131 -> 5.0 | T131: 6.7 | U131: =0-QUOTIENT(T131,3) -> -2.0 | V131: 1hb
A132: Torklar's Battle Hammer | C132: 6.0 | D132: 28.0 | E132: =D132/C132 -> 4.666666666666667 | T132: 5.0 | U132: =0-QUOTIENT(T132,3) -> -1.0 | V132: 1hb
A133: Tri-Plated Golden Hackle Hammer | B133: Arch Shielding | C133: 14.0 | D133: 24.0 | E133: =D133/C133 -> 1.7142857142857142 | F133: 10.0 | J133: 13.0 | K133: 13.0 | N133: 25.0 | O133: 5.0 | P133: 5.0 | Q133: 5.0 | R133: 5.0 | S133: 5.0 | T133: 2.0 | U133: =0-QUOTIENT(T133,3) -> 0.0 | V133: 1hb
A134: Tuuak's Fishing Pole | C134: 5.0 | D134: 30.0 | E134: =D134/C134 -> 6.0 | T134: 5.0 | U134: =0-QUOTIENT(T134,3) -> -1.0 | V134: 1hb
A135: Velium Etched Stone Mace | C135: 7.0 | D135: 22.0 | E135: =D135/C135 -> 3.1428571428571428 | F135: 3.0 | J135: 3.0 | T135: 6.0 | U135: =0-QUOTIENT(T135,3) -> -2.0 | V135: 1hb
A136: Velium Maul of Superiority | C136: 11.0 | D136: 18.0 | E136: =D136/C136 -> 1.6363636363636365 | F136: 3.0 | G136: 3.0 | H136: 3.0 | I136: 3.0 | J136: 3.0 | K136: 3.0 | L136: 3.0 | M136: 30.0 | N136: 30.0 | O136: 3.0 | P136: 3.0 | Q136: 3.0 | R136: 3.0 | S136: 3.0 | T136: 7.0 | U136: =0-QUOTIENT(T136,3) -> -2.0 | V136: 1hb
A137: Velium Morning Star | B137: Velium Shards | C137: 8.0 | D137: 38.0 | E137: =D137/C137 -> 4.75 | T137: 9.5 | U137: =0-QUOTIENT(T137,3) -> -3.0 | V137: 1hb
A138: Velium War Maul | B138: Velium Shards | C138: 9.0 | D138: 24.0 | E138: =D138/C138 -> 2.6666666666666665 | T138: 0.5 | U138: =0-QUOTIENT(T138,3) -> 0.0 | V138: 1hb
A139: Velium Warhammer | B139: Velium Shards | C139: 6.0 | D139: 30.0 | E139: =D139/C139 -> 5.0 | T139: 6.8 | U139: =0-QUOTIENT(T139,3) -> -2.0 | V139: 1hb
A140: Warclub | C140: 6.0 | D140: 32.0 | E140: =D140/C140 -> 5.333333333333333 | T140: 5.0 | U140: =0-QUOTIENT(T140,3) -> -1.0 | V140: 1hb
A141: Warhammer | C141: 6.0 | D141: 32.0 | E141: =D141/C141 -> 5.333333333333333 | T141: 7.5 | U141: =0-QUOTIENT(T141,3) -> -2.0 | V141: 1hb
A142: Weighted Velium Battlehammer | C142: 11.0 | D142: 22.0 | E142: =D142/C142 -> 2.0 | T142: 3.5 | U142: =0-QUOTIENT(T142,3) -> -1.0 | V142: 1hb
A143: Windetched Staff | B143: Careless Lightning | C143: 3.0 | D143: 20.0 | E143: =D143/C143 -> 6.666666666666667 | N143: 20.0 | T143: 1.5 | U143: =0-QUOTIENT(T143,3) -> 0.0 | V143: 1hb
A144: Wraith Bone Hammer | C144: 8.0 | D144: 26.0 | E144: =D144/C144 -> 3.25 | F144: 5.0 | J144: 2.0 | K144: 2.0 | T144: 7.3 | U144: =0-QUOTIENT(T144,3) -> -2.0 | V144: 1hb
A145: Ye Auld Ball Peen Hammer | C145: 4.0 | D145: 27.0 | E145: =D145/C145 -> 6.75 | F145: 2.0 | M145: 4.0 | T145: 4.5 | U145: =0-QUOTIENT(T145,3) -> -1.0 | V145: 1hb
A146: Ykeshan War Club | B146: Ykesha | C146: 9.0 | D146: 24.0 | E146: =D146/C146 -> 2.6666666666666665 | T146: 3.0 | U146: =0-QUOTIENT(T146,3) -> -1.0 | V146: 1hb