A1: Huntress Lair Guild Member Roster
A2: Mains | B2: Alternates | C2: Race | D2: Class | E2: Level | F2: Status
A4: Anther | C4: High Elf | D4: Cleric | E4: 40 | F4: M
A5: Aulilea | C5: Woodelf | D5: Druid | E5: 51 | F5: LCM
B6: Flailea | C6: High Elf | D6: Enchanter | E6: 25 | F6: M
B7: Eileni | C7: High Elf | D7: Wizard | E7: 27 | F7: M
B8: Clariise | C8: Dwarf | D8: Cleric | E8: 25 | F8: M
A9: Caladen | C9: High Elf | D9: Cleric | E9: 54 | F9: M
B10: Caleene | C10: High Elf | D10: Enchanter | E10: 51 | F10: A
B11: Veunay | C11: Dark Elf | D11: Necromancer | E11: 48 | F11: A
A12: Cherri | C12: Wood Elf | D12: Bard | E12: 45 | F12: A
A13: Cilk | C13: Iksar | D13: Monk | E13: 51 | F13: M
A14: Cozzi | C14: Erudite | D14: Enchanter | E14: 54 | F14: M
B15: Rikel | C15: Human | D15: Druid | E15: 37 | F15: A
A16: Darkvipor | C16: Wood Elf | D16: Ranger | E16: 51 | F16: M
B17: Braediiliez | C17: Dark Elf | D17: Shadow Knight | E17: 44 | F17: A
A18: Dedbeat | C18: Half Elf | D18: Paladin | E18: 42 | F18: M
A19: Delmon | C19: Wood Elf | D19: Druid | E19: 49 | F19: M
A20: Doomis | C20: Dark Elf | D20: Necromancer | E20: 47 | F20: M
A21: Dukes | C21: Human | D21: Monk | E21: 51 | F21: M
A22: Ellanon | C22: Wood Elf | D22: Druid | E22: 52 | F22: M
B23: Exchanter | C23: High Elf | D23: Enchanter | E23: 20 | F23: A
A24: Ennia | C24: Wood Elf | D24: Druid | E24: 41 | F24: M
B25: Pente | C25: High Elf | D25: Cleric | E25: 51 | F25: A
B26: Halley | C26: Erudite | D26: Enchanter | E26: 34 | F26: A
B27: Peny | C27: Wood Elf | D27: Rogue | E27: 42 | F27: A
A28: Everitt | C28: Dark Elf | D28: Cleric | E28: 48 | F28: M
A29: Gandrex | C29: Iksar | D29: Shaman | E29: 53 | F29: M
A30: Ganer | C30: Dark Elf | D30: Enchanter | E30: 52 | F30: M
B31: Llavitz | C31: Wood Elf | D31: Warrior | E31: 36 | F31: A
A32: Gerda | C32: Human | D32: Enchanter | E32: 51 | F32: O
A33: Goldenbane | C33: Wood Elf | D33: Ranger | E33: 51 | F33: M
B34: Silveroak | C34: Woodelf | D34: Druid | E34: 36 | F34: A
A35: Hamorgil | C35: Barbarian | D35: Warrior | E35: 47 | F35: M
A36: Kalekin | C36: Human | D36: Druid | E36: 45 | F36: M
A37: Kasheef | C37: Human | D37: Cleric | E37: 50 | F37: M
B38: Yaer | C38: Wood Elf | D38: Ranger | E38: 40 | F38: A
B39: Magyk | C39: High Elf | D39: Magician | E39: 41 | F39: A
B40: Tiaja | C40: Gnome | D40: Enchanter | E40: 29 | F40: A
A41: Kleedian | C41: Troll | D41: Shadow Knight | E41: 53 | F41: M
B42: Alkier | C42: High Elf | D42: Cleric | E42: 52 | F42: A
A43: Lillielane | C43: High Elf | D43: Enchanter | E43: 46 | F43: M
A44: Madrianna | C44: Wood Elf | D44: Druid | E44: 52 | F44: M
A45: Megonis | C45: Wood Elf | D45: Warrior | E45: 55 | F45: M
B46: Drakkith | C46: Gnome | D46: Enchanter | E46: 53 | F46: A
B47: Garko | C47: Wood Elf | D47: Druid | E47: 43 | F47: A
B48: Gnomatic | C48: Gnome | D48: Magician | E48: 41 | F48: A
A49: Midgetbarsh | D49: Shaman | E49: 47 | F49: M
A50: Mightyryan | C50: Human | D50: Druid | E50: 52 | F50: M
A51: Morain | C51: Wood | D51: Druid | E51: 44 | F51: M
A52: Morlife | C52: High Elf | D52: Cleric | E52: 61 | F52: M
B53: Iamfyl | C53: Half Elf | D53: Ranger | E53: 52 | F53: A
B54: Swiftie | C54: Halfling | D54: Druid | E54: 33 | F54: A
A55: Mushin | C55: Human | D55: Ranger | E55: 51 | F55: M
A56: Naithan | C56: Erudite | D56: Wizard | E56: 43 | F56: M
A57: Nefi | C57: Barbarian | D57: Shaman | E57: 49 | F57: M
A58: Onetonn | C58: Ogre | D58: Warrior | E58: 44 | F58: M
A59: Quelas | C59: Wood Elf | D59: Warrior | E59: 49 | F59: M
A60: Ragord | C60: Human | D60: Shadow Knight | E60: 51 | F60: LCM
B61: Krigseg | C61: Barbarian | D61: Shaman | E61: 52 | F61: A
B62: Kaukomieli | C62: Ogre | D62: Shaman | E62: 14 | F62: A
B63: Hithuai | C63: Human | D63: Monk | E63: 35 | F63: A
B64: Drogar | C64: Dark Elf | D64: Rogue | E64: 36 | F64: A
B65: Xerius | C65: Erudite | D65: Wizard | E65: 57 | F65: A
A66: Ralena | C66: High Elf | D66: Paladin | E66: 44 | F66: M
A67: Sarani | C67: High Elf | D67: Cleric | E67: 53 | F67: LCM
B68: Sareni | C68: Barbarian | D68: Warrior | E68: 50 | F68: A
B69: Sarrel | C69: High Elf | D69: Enchanter | E69: 23 | F69: A
B70: Solen | C70: Human | D70: Necromancer | E70: 54 | F70: A
B71: Jorus | C71: Human | D71: Druid | E71: 47 | F71: A
B72: Winidini | C72: Human | D72: Bard | E72: 25 | F72: M
A73: Saroiel | C73: Human | D73: Magician | E73: 51 | F73: M
A74: Saxo | C74: Halfing | D74: Druid | E74: 58 | F74: M
B75: Senlaven | C75: Dark Elf | D75: Necromancer | E75: 56 | F75: A
A76: Sethelapor | C76: Wood Elf | D76: Druid | E76: 31 | F76: M
A77: Shinria | C77: Wood Elf | D77: Druid | E77: 34 | F77: M
B78: Xtrapow | C78: Iksar | D78: Monk | E78: 52 | F78: A
A79: Sinniar | C79: Wood Elf | D79: Bard | E79: 46 | F79: M
B80: Sainte | D80: Wizard | E80: 51 | F80: A
B81: Dimitri | D81: Necromancer | E81: 12 | F81: A
A82: Somoney | C82: Dark Elf | D82: Enchanter | E82: 52 | F82: M
A83: Talowen | C83: Wood Elf | D83: Ranger | E83: 53 | F83: M
A84: Tauredil | C84: Wood Elf | D84: Ranger | E84: 51 | F84: M
A85: Teryenae | C85: Wood Elf | D85: Druid | E85: 53 | F85: M
B86: Tedie | C86: Dwarf | D86: Cleric | E86: 55 | F86: A
A87: Toggel | C87: Gnome | D87: Wizard | E87: 51 | F87: O
A88: Treyhugr | C88: Halfling | D88: Druid | E88: 46 | F88: M
A89: Vanin | C89: Halfling | D89: Druid | E89: 51 | F89: M
B90: Fightingfeet | C90: Halfling | D90: Warrior | E90: 42 | F90: A
B91: Namael | C91: Dark Elf | D91: Cleric | E91: 31 | F91: A
A92: Veneno | C92: High Elf | D92: Enchanter | E92: 48 | F92: M
B93: Reorna | C93: Human | D93: Bard | E93: 20 | F93: A
A94: Warrel | C94: Wood Elf | D94: Warrior | E94: 52 | F94: LCM
B95: Shiblon | C95: Half Elf | D95: Paladin | E95: 47 | F95: A
A96: Wrensong | C96: Wood Elf | D96: Bard | E96: 52 | F96: M
B97: Fraggenski | C97: Dwarf | D97: Cleric | E97: 20 | F97: A
A98: Xanmagia | C98: Gnome | D98: Magician | E98: 53 | F98: M
B99: Xania | C99: Human | D99: Enchanter | E99: 52 | F99: A
A100: Zayne | C100: Barbarian | D100: Shaman | E100: 50 | F100: M
A101: Zerath | C101: Erudite | D101: Wizard | E101: 52 | F101: M
A103: =COUNTA(A5:A101) -> 54 | B103: =COUNTA(B5:B101) -> 43 | D103: Average Level: | E103: =AVERAGE(E5:E101) -> 44.886597938144327
B105: LEGEND
B107: LCM = Leadership Council Member M = Member A = Alternate Member O = Officer
A113: MISSING IN ACTION
A115: Alexandros | C115: Dwarf | D115: Warrior | E115: 35 | F115: M
A116: Aphea | C116: High Elf | D116: Cleric | E116: 35 | F116: M
A117: Drewt | C117: Half Elf | D117: Bard | E117: 25 | F117: M
B118: Jeko | C118: VahShir | D118: Beastlord | E118: 35 | F118: A
A119: Raakli | C119: Half Elf | D119: Druid | E119: 31 | F119: M
A120: Raelila | C120: High Elf | D120: Enchanter | E120: 26 | F120: M
A121: Reije | C121: High Elf | D121: Wizard | E121: 27 | F121: M
B122: Bidou | C122: Human | D122: Enchanter | E122: 17 | F122: A
A123: Rokgar | C123: Dwarf | D123: Cleric | E123: 30 | F123: M
A124: Tempestwind | C124: Iksar | D124: Shadow Knight | E124: 35 | F124: M
B125: Windluna | C125: Human | D125: Cleric | E125: 35 | F125: A
A126: Tonac | C126: Barbarian | D126: Rogue | E126: 16 | F126: M
A127: Woopingsticks | C127: Human | D127: Monk | E127: 28 | F127: M
A128: Wzrathoz | C128: Iksar | D128: Warrior | E128: 37 | F128: M
A129: Zorakx | C129: Iksar | D129: Shadow Knight | E129: 35 | F129: M
B130: Squishanbash | C130: Ogre | D130: Warrior | E130: 35 | F130: A
A131: =COUNTA(A115:A130) -> 12 | B131: =COUNTA(B115:B130) -> 4 | D131: Average Level: | E131: =AVERAGE(E115:E130) -> 30.125