A1: weapon | B1: skill | C1: metalcost | D1: # bars | E1: xtracost | F1: # boards | G1: # squares | H1: base cost
A2: copper dirk | B2: 15 | C2: =175/20 -> 8.75 | D2: 8 | E2: =75/20 -> 3.75 | F2: 1 | G2: 2 | H2: =(C2*D2)+(E2*F2)+(E2*G2) -> 81.25
A3: copper dagger | B3: 35 | C3: =175/20 -> 8.75 | D3: 12 | E3: =75/20 -> 3.75 | F3: 1 | G3: 2 | H3: =(C3*D3)+(E3*F3)+(E3*G3) -> 116.25
A4: copper stilletto | B4: 55 | C4: =175/20 -> 8.75 | D4: 20 | E4: =75/20 -> 3.75 | F4: 1 | G4: 1 | H4: =(C4*D4)+(E4*F4)+(E4*G4) -> 182.5
A5: copper rapier | B5: 75 | C5: =175/20 -> 8.75 | D5: 24 | E5: =75/20 -> 3.75 | F5: 1 | G5: 1 | H5: =(C5*D5)+(E5*F5)+(E5*G5) -> 217.5
A6: copper curved dagger | B6: 95 | C6: =175/20 -> 8.75 | D6: 31 | E6: =75/20 -> 3.75 | F6: 1 | G6: 1 | H6: =(C6*D6)+(E6*F6)+(E6*G6) -> 278.75
A7: copper short sword | B7: 15 | C7: =175/20 -> 8.75 | D7: 10 | E7: =75/20 -> 3.75 | F7: 1 | G7: 2 | H7: =(C7*D7)+(E7*F7)+(E7*G7) -> 98.75
A8: copper falcata | B8: 35 | C8: =175/20 -> 8.75 | D8: 16 | E8: =75/20 -> 3.75 | F8: 1 | G8: 1 | H8: =(C8*D8)+(E8*F8)+(E8*G8) -> 147.5
A9: copper broadsword | B9: 55 | C9: =175/20 -> 8.75 | D9: 20 | E9: =75/20 -> 3.75 | F9: 1 | G9: 1 | H9: =(C9*D9)+(E9*F9)+(E9*G9) -> 182.5
A10: copper longsword | B10: 75 | C10: =175/20 -> 8.75 | D10: 27 | E10: =75/20 -> 3.75 | F10: 1 | G10: 2 | H10: =(C10*D10)+(E10*F10)+(E10*G10) -> 247.5
A11: copper bastard sword | B11: 95 | C11: =175/20 -> 8.75 | D11: 33 | E11: =75/20 -> 3.75 | F11: 1 | G11: 1 | H11: =(C11*D11)+(E11*F11)+(E11*G11) -> 296.25
A12: copper club | B12: 15 | C12: =175/20 -> 8.75 | D12: 3 | E12: =75/20 -> 3.75 | F12: 19 | G12: 0 | H12: =(C12*D12)+(E12*F12)+(E12*G12) -> 97.5
A13: copper mace | B13: 35 | C13: =175/20 -> 8.75 | D13: 16 | E13: =75/20 -> 3.75 | F13: 3 | G13: 0 | H13: =(C13*D13)+(E13*F13)+(E13*G13) -> 151.25
A14: copper spiked club | B14: 55 | C14: =175/20 -> 8.75 | D14: 7 | E14: =75/20 -> 3.75 | F14: 32 | G14: 0 | H14: =(C14*D14)+(E14*F14)+(E14*G14) -> 181.25
A15: copper hammer | B15: 75 | C15: =175/20 -> 8.75 | D15: 22 | E15: =75/20 -> 3.75 | F15: 6 | G15: 0 | H15: =(C15*D15)+(E15*F15)+(E15*G15) -> 215
A16: copper spiked mace | B16: 95 | C16: =175/20 -> 8.75 | D16: 30 | E16: =75/20 -> 3.75 | F16: 6 | G16: 0 | H16: =(C16*D16)+(E16*F16)+(E16*G16) -> 285
A17: copper short spear | B17: 15 | C17: =175/20 -> 8.75 | D17: 7 | E17: =75/20 -> 3.75 | F17: 10 | G17: 0 | H17: =(C17*D17)+(E17*F17)+(E17*G17) -> 98.75
A18: copper spear | B18: 35 | C18: =175/20 -> 8.75 | D18: 12 | E18: =75/20 -> 3.75 | F18: 12 | G18: 0 | H18: =(C18*D18)+(E18*F18)+(E18*G18) -> 150
A19: copper long spear | B19: 55 | C19: =175/20 -> 8.75 | D19: 19 | E19: =75/20 -> 3.75 | F19: 13 | G19: 0 | H19: =(C19*D19)+(E19*F19)+(E19*G19) -> 215
A20: copper war spear | B20: 75 | C20: =175/20 -> 8.75 | D20: 23 | E20: =75/20 -> 3.75 | F20: 12 | G20: 0 | H20: =(C20*D20)+(E20*F20)+(E20*G20) -> 246.25
A21: copper barbed spear | B21: 95 | C21: =175/20 -> 8.75 | D21: 27 | E21: =75/20 -> 3.75 | F21: 12 | G21: 0 | H21: =(C21*D21)+(E21*F21)+(E21*G21) -> 281.25
A22: copper big shillelagh | B22: 35 | C22: =175/20 -> 8.75 | D22: 22 | E22: =75/20 -> 3.75 | F22: 8 | G22: 0 | H22: =(C22*D22)+(E22*F22)+(E22*G22) -> 222.5
A23: copper two handed sword | B23: 35 | C23: =175/20 -> 8.75 | D23: 20 | E23: =75/20 -> 3.75 | F23: 1 | G23: 1 | H23: =(C23*D23)+(E23*F23)+(E23*G23) -> 182.5
A24: copper great hammer | B24: 55 | C24: =175/20 -> 8.75 | D24: 32 | E24: =75/20 -> 3.75 | F24: 8 | G24: 0 | H24: =(C24*D24)+(E24*F24)+(E24*G24) -> 310
A25: copper two-hand spiked mace | B25: 75 | C25: =175/20 -> 8.75 | D25: 30 | E25: =75/20 -> 3.75 | F25: 8 | G25: 0 | H25: =(C25*D25)+(E25*F25)+(E25*G25) -> 292.5
A26: copper great sword | B26: 95 | C26: =175/20 -> 8.75 | D26: 39 | E26: =75/20 -> 3.75 | F26: 1 | G26: 1 | H26: =(C26*D26)+(E26*F26)+(E26*G26) -> 348.75
A27: rowan kite shield | B27: 95 | C27: =175/20 -> 8.75 | D27: 3 | E27: =75/20 -> 3.75 | F27: 3 | G27: 1 | H27: =(C27*D27)+(E27*F27)+(E27*G27) -> 41.25
A28: rowan tower shield | B28: 95 | C28: =175/20 -> 8.75 | D28: 4 | E28: =75/20 -> 3.75 | F28: 3 | G28: 1 | H28: =(C28*D28)+(E28*F28)+(E28*G28) -> 50
A29: rowan round shield | B29: 95 | C29: =175/20 -> 8.75 | D29: 3 | E29: =75/20 -> 3.75 | F29: 2 | G29: 0 | H29: =(C29*D29)+(E29*F29)+(E29*G29) -> 33.75
A30: rowan heater shield | B30: 95 | C30: =175/20 -> 8.75 | D30: 5 | E30: =75/20 -> 3.75 | F30: 3 | G30: 1 | H30: =(C30*D30)+(E30*F30)+(E30*G30) -> 58.75
A31: Ferrite
A32: ferrite dirk | B32: 115 | C32: =2800/20 -> 140 | D32: 8 | E32: =1200/20 -> 60 | F32: 1 | G32: 2 | H32: =(C31*D31)+(E31*F31)+(E31*G31) -> 1300
A33: ferrite dagger | B33: 135 | C33: =2800/20 -> 140 | D33: 12 | E33: =1200/20 -> 60 | F33: 1 | G33: 2 | H33: =(C32*D32)+(E32*F32)+(E32*G32) -> 1860
A34: ferrite stilletto | B34: 155 | C34: =2800/20 -> 140 | D34: 20 | E34: =1200/20 -> 60 | F34: 1 | G34: 1 | H34: =(C33*D33)+(E33*F33)+(E33*G33) -> 2920
A35: ferrite rapier | B35: 175 | C35: =2800/20 -> 140 | D35: 24 | E35: =1200/20 -> 60 | F35: 1 | G35: 1 | H35: =(C34*D34)+(E34*F34)+(E34*G34) -> 3480
A36: ferrite curved dagger | B36: 195 | C36: =2800/20 -> 140 | D36: 31 | E36: =1200/20 -> 60 | F36: 1 | G36: 1 | H36: =(C35*D35)+(E35*F35)+(E35*G35) -> 4460
A37: ferrite short sword | B37: 115 | C37: =2800/20 -> 140 | D37: 10 | E37: =1200/20 -> 60 | F37: 1 | G37: 2 | H37: =(C36*D36)+(E36*F36)+(E36*G36) -> 1580
A38: ferrite falcata | B38: 135 | C38: =2800/20 -> 140 | D38: 16 | E38: =1200/20 -> 60 | F38: 1 | G38: 1 | H38: =(C37*D37)+(E37*F37)+(E37*G37) -> 2360
A39: ferrite broadsword | B39: 155 | C39: =2800/20 -> 140 | D39: 20 | E39: =1200/20 -> 60 | F39: 1 | G39: 1 | H39: =(C38*D38)+(E38*F38)+(E38*G38) -> 2920
A40: ferrite longsword | B40: 175 | C40: =2800/20 -> 140 | D40: 27 | E40: =1200/20 -> 60 | F40: 1 | G40: 2 | H40: =(C39*D39)+(E39*F39)+(E39*G39) -> 3960
A41: ferrite bastard sword | B41: 195 | C41: =2800/20 -> 140 | D41: 33 | E41: =1200/20 -> 60 | F41: 1 | G41: 1 | H41: =(C40*D40)+(E40*F40)+(E40*G40) -> 4740
A42: ferrite club | B42: 115 | C42: =2800/20 -> 140 | D42: 3 | E42: =1200/20 -> 60 | F42: 19 | G42: 0 | H42: =(C41*D41)+(E41*F41)+(E41*G41) -> 1560
A43: ferrite mace | B43: 135 | C43: =2800/20 -> 140 | D43: 16 | E43: =1200/20 -> 60 | F43: 3 | G43: 0 | H43: =(C42*D42)+(E42*F42)+(E42*G42) -> 2420
A44: ferrite spiked club | B44: 155 | C44: =2800/20 -> 140 | D44: 7 | E44: =1200/20 -> 60 | F44: 32 | G44: 0 | H44: =(C43*D43)+(E43*F43)+(E43*G43) -> 2900
A45: ferrite hammer | B45: 175 | C45: =2800/20 -> 140 | D45: 22 | E45: =1200/20 -> 60 | F45: 6 | G45: 0 | H45: =(C44*D44)+(E44*F44)+(E44*G44) -> 3440
A46: ferrite spiked mace | B46: 195 | C46: =2800/20 -> 140 | D46: 30 | E46: =1200/20 -> 60 | F46: 6 | G46: 0 | H46: =(C45*D45)+(E45*F45)+(E45*G45) -> 4560
A47: ferrite short spear | B47: 115 | C47: =2800/20 -> 140 | D47: 7 | E47: =1200/20 -> 60 | F47: 10 | G47: 0 | H47: =(C46*D46)+(E46*F46)+(E46*G46) -> 1580
A48: ferrite spear | B48: 135 | C48: =2800/20 -> 140 | D48: 12 | E48: =1200/20 -> 60 | F48: 12 | G48: 0 | H48: =(C47*D47)+(E47*F47)+(E47*G47) -> 2400
A49: ferrite long spear | B49: 155 | C49: =2800/20 -> 140 | D49: 19 | E49: =1200/20 -> 60 | F49: 13 | G49: 0 | H49: =(C48*D48)+(E48*F48)+(E48*G48) -> 3440
A50: ferrite war spear | B50: 175 | C50: =2800/20 -> 140 | D50: 23 | E50: =1200/20 -> 60 | F50: 12 | G50: 0 | H50: =(C49*D49)+(E49*F49)+(E49*G49) -> 3940
A51: ferrite barbed spear | B51: 195 | C51: =2800/20 -> 140 | D51: 27 | E51: =1200/20 -> 60 | F51: 12 | G51: 0 | H51: =(C50*D50)+(E50*F50)+(E50*G50) -> 4500
A52: ferrite big shillelagh | B52: 135 | C52: =2800/20 -> 140 | D52: 22 | E52: =1200/20 -> 60 | F52: 8 | G52: 0 | H52: =(C51*D51)+(E51*F51)+(E51*G51) -> 3560
A53: ferrite two handed sword | B53: 135 | C53: =2800/20 -> 140 | D53: 20 | E53: =1200/20 -> 60 | F53: 1 | G53: 1 | H53: =(C52*D52)+(E52*F52)+(E52*G52) -> 2920
A54: ferrite great hammer | B54: 155 | C54: =2800/20 -> 140 | D54: 32 | E54: =1200/20 -> 60 | F54: 8 | G54: 0 | H54: =(C53*D53)+(E53*F53)+(E53*G53) -> 4960
A55: ferrite two-hand spiked mace | B55: 175 | C55: =2800/20 -> 140 | D55: 30 | E55: =1200/20 -> 60 | F55: 8 | G55: 0 | H55: =(C54*D54)+(E54*F54)+(E54*G54) -> 4680
A56: ferrite great sword | B56: 195 | C56: =2800/20 -> 140 | D56: 39 | E56: =1200/20 -> 60 | F56: 1 | G56: 1 | H56: =(C55*D55)+(E55*F55)+(E55*G55) -> 5580
A57: elm kite shield | B57: 195 | C57: =2800/20 -> 140 | D57: 3 | E57: =1200/20 -> 60 | F57: 3 | G57: 1 | H57: =(C56*D56)+(E56*F56)+(E56*G56) -> 660
A58: elm tower shield | B58: 195 | C58: =2800/20 -> 140 | D58: 4 | E58: =1200/20 -> 60 | F58: 3 | G58: 1 | H58: =(C57*D57)+(E57*F57)+(E57*G57) -> 800
A59: elm round shield | B59: 195 | C59: =2800/20 -> 140 | D59: 3 | E59: =1200/20 -> 60 | F59: 2 | G59: 0 | H59: =(C58*D58)+(E58*F58)+(E58*G58) -> 540
A60: elm heater shield | B60: 195 | C60: =2800/20 -> 140 | D60: 5 | E60: =1200/20 -> 60 | F60: 3 | G60: 1 | H60: =(C59*D59)+(E59*F59)+(E59*G59) -> 940
A61: Quartz
A62: quartz dirk | B62: =B2+200 -> 215 | C62: =11200/20 -> 560 | D62: 8 | E62: =4800/20 -> 240 | F62: 1 | G62: 2 | H62: =(C60*D60)+(E60*F60)+(E60*G60) -> 5200
A63: quartz dagger | B63: =B3+200 -> 235 | C63: =11200/20 -> 560 | D63: 12 | E63: =4800/20 -> 240 | F63: 1 | G63: 2 | H63: =(C61*D61)+(E61*F61)+(E61*G61) -> 7440
A64: quartz stilletto | B64: =B4+200 -> 255 | C64: =11200/20 -> 560 | D64: 20 | E64: =4800/20 -> 240 | F64: 1 | G64: 1 | H64: =(C62*D62)+(E62*F62)+(E62*G62) -> 11680
A65: quartz rapier | B65: =B5+200 -> 275 | C65: =11200/20 -> 560 | D65: 24 | E65: =4800/20 -> 240 | F65: 1 | G65: 1 | H65: =(C63*D63)+(E63*F63)+(E63*G63) -> 13920
A66: quartz curved dagger | B66: =B6+200 -> 295 | C66: =11200/20 -> 560 | D66: 31 | E66: =4800/20 -> 240 | F66: 1 | G66: 1 | H66: =(C64*D64)+(E64*F64)+(E64*G64) -> 17840
A67: quartz short sword | B67: =B7+200 -> 215 | C67: =11200/20 -> 560 | D67: 10 | E67: =4800/20 -> 240 | F67: 1 | G67: 2 | H67: =(C65*D65)+(E65*F65)+(E65*G65) -> 6320
A68: quartz falcata | B68: =B8+200 -> 235 | C68: =11200/20 -> 560 | D68: 16 | E68: =4800/20 -> 240 | F68: 1 | G68: 1 | H68: =(C66*D66)+(E66*F66)+(E66*G66) -> 9440
A69: quartz broadsword | B69: =B9+200 -> 255 | C69: =11200/20 -> 560 | D69: 20 | E69: =4800/20 -> 240 | F69: 1 | G69: 1 | H69: =(C67*D67)+(E67*F67)+(E67*G67) -> 11680
A70: quartz longsword | B70: =B10+200 -> 275 | C70: =11200/20 -> 560 | D70: 27 | E70: =4800/20 -> 240 | F70: 1 | G70: 2 | H70: =(C68*D68)+(E68*F68)+(E68*G68) -> 15840
A71: quartz bastard sword | B71: =B11+200 -> 295 | C71: =11200/20 -> 560 | D71: 33 | E71: =4800/20 -> 240 | F71: 1 | G71: 1 | H71: =(C69*D69)+(E69*F69)+(E69*G69) -> 18960
A72: quartz club | B72: =B12+200 -> 215 | C72: =11200/20 -> 560 | D72: 3 | E72: =4800/20 -> 240 | F72: 19 | G72: 0 | H72: =(C70*D70)+(E70*F70)+(E70*G70) -> 6240
A73: quartz mace | B73: =B13+200 -> 235 | C73: =11200/20 -> 560 | D73: 16 | E73: =4800/20 -> 240 | F73: 3 | G73: 0 | H73: =(C71*D71)+(E71*F71)+(E71*G71) -> 9680
A74: quartz spiked club | B74: =B14+200 -> 255 | C74: =11200/20 -> 560 | D74: 7 | E74: =4800/20 -> 240 | F74: 32 | G74: 0 | H74: =(C72*D72)+(E72*F72)+(E72*G72) -> 11600
A75: quartz hammer | B75: =B15+200 -> 275 | C75: =11200/20 -> 560 | D75: 22 | E75: =4800/20 -> 240 | F75: 6 | G75: 0 | H75: =(C73*D73)+(E73*F73)+(E73*G73) -> 13760
A76: quartz spiked mace | B76: =B16+200 -> 295 | C76: =11200/20 -> 560 | D76: 30 | E76: =4800/20 -> 240 | F76: 6 | G76: 0 | H76: =(C74*D74)+(E74*F74)+(E74*G74) -> 18240
A77: quartz short spear | B77: =B17+200 -> 215 | C77: =11200/20 -> 560 | D77: 7 | E77: =4800/20 -> 240 | F77: 10 | G77: 0 | H77: =(C75*D75)+(E75*F75)+(E75*G75) -> 6320
A78: quartz spear | B78: =B18+200 -> 235 | C78: =11200/20 -> 560 | D78: 12 | E78: =4800/20 -> 240 | F78: 12 | G78: 0 | H78: =(C76*D76)+(E76*F76)+(E76*G76) -> 9600
A79: quartz long spear | B79: =B19+200 -> 255 | C79: =11200/20 -> 560 | D79: 19 | E79: =4800/20 -> 240 | F79: 13 | G79: 0 | H79: =(C77*D77)+(E77*F77)+(E77*G77) -> 13760
A80: quartz war spear | B80: =B20+200 -> 275 | C80: =11200/20 -> 560 | D80: 23 | E80: =4800/20 -> 240 | F80: 12 | G80: 0 | H80: =(C78*D78)+(E78*F78)+(E78*G78) -> 15760
A81: quartz barbed spear | B81: =B21+200 -> 295 | C81: =11200/20 -> 560 | D81: 27 | E81: =4800/20 -> 240 | F81: 12 | G81: 0 | H81: =(C79*D79)+(E79*F79)+(E79*G79) -> 18000
A82: quartz big shillelagh | B82: =B22+200 -> 235 | C82: =11200/20 -> 560 | D82: 22 | E82: =4800/20 -> 240 | F82: 8 | G82: 0 | H82: =(C80*D80)+(E80*F80)+(E80*G80) -> 14240
A83: quartz two handed sword | B83: =B23+200 -> 235 | C83: =11200/20 -> 560 | D83: 20 | E83: =4800/20 -> 240 | F83: 1 | G83: 1 | H83: =(C81*D81)+(E81*F81)+(E81*G81) -> 11680
A84: quartz great hammer | B84: =B24+200 -> 255 | C84: =11200/20 -> 560 | D84: 32 | E84: =4800/20 -> 240 | F84: 8 | G84: 0 | H84: =(C82*D82)+(E82*F82)+(E82*G82) -> 19840
A85: quartz two-hand spiked mace | B85: =B25+200 -> 275 | C85: =11200/20 -> 560 | D85: 30 | E85: =4800/20 -> 240 | F85: 8 | G85: 0 | H85: =(C83*D83)+(E83*F83)+(E83*G83) -> 18720
A86: quartz great sword | B86: =B26+200 -> 295 | C86: =11200/20 -> 560 | D86: 39 | E86: =4800/20 -> 240 | F86: 1 | G86: 1 | H86: =(C84*D84)+(E84*F84)+(E84*G84) -> 22320
A87: oak kite shield | B87: =B27+200 -> 295 | C87: =11200/20 -> 560 | D87: 3 | E87: =4800/20 -> 240 | F87: 3 | G87: 1 | H87: =(C85*D85)+(E85*F85)+(E85*G85) -> 2640
A88: oak tower shield | B88: =B28+200 -> 295 | C88: =11200/20 -> 560 | D88: 4 | E88: =4800/20 -> 240 | F88: 3 | G88: 1 | H88: =(C86*D86)+(E86*F86)+(E86*G86) -> 3200
A89: oak round shield | B89: =B29+200 -> 295 | C89: =11200/20 -> 560 | D89: 3 | E89: =4800/20 -> 240 | F89: 2 | G89: 0 | H89: =(C87*D87)+(E87*F87)+(E87*G87) -> 2160
A90: oak heater shield | B90: =B30+200 -> 295 | C90: =11200/20 -> 560 | D90: 5 | E90: =4800/20 -> 240 | F90: 3 | G90: 1 | H90: =(C88*D88)+(E88*F88)+(E88*G88) -> 3760
A91: Dolomite
A92: dolomite dirk | B92: =B2+300 -> 315 | C92: =33600/20 -> 1680 | D92: 8 | E92: =14400/20 -> 720 | F92: 1 | G92: 2 | H92: =(C89*D89)+(E89*F89)+(E89*G89) -> 15600
A93: dolomite dagger | B93: =B3+300 -> 335 | C93: =33600/20 -> 1680 | D93: 12 | E93: =14400/20 -> 720 | F93: 1 | G93: 2 | H93: =(C90*D90)+(E90*F90)+(E90*G90) -> 22320
A94: dolomite stilletto | B94: =B4+300 -> 355 | C94: =33600/20 -> 1680 | D94: 20 | E94: =14400/20 -> 720 | F94: 1 | G94: 1 | H94: =(C91*D91)+(E91*F91)+(E91*G91) -> 35040
A95: dolomite rapier | B95: =B5+300 -> 375 | C95: =33600/20 -> 1680 | D95: 24 | E95: =14400/20 -> 720 | F95: 1 | G95: 1 | H95: =(C92*D92)+(E92*F92)+(E92*G92) -> 41760
A96: dolomite curved dagger | B96: =B6+300 -> 395 | C96: =33600/20 -> 1680 | D96: 31 | E96: =14400/20 -> 720 | F96: 1 | G96: 1 | H96: =(C93*D93)+(E93*F93)+(E93*G93) -> 53520
A97: dolomite short sword | B97: =B7+300 -> 315 | C97: =33600/20 -> 1680 | D97: 10 | E97: =14400/20 -> 720 | F97: 1 | G97: 2 | H97: =(C94*D94)+(E94*F94)+(E94*G94) -> 18960
A98: dolomite falcata | B98: =B8+300 -> 335 | C98: =33600/20 -> 1680 | D98: 16 | E98: =14400/20 -> 720 | F98: 1 | G98: 1 | H98: =(C95*D95)+(E95*F95)+(E95*G95) -> 28320
A99: dolomite broadsword | B99: =B9+300 -> 355 | C99: =33600/20 -> 1680 | D99: 20 | E99: =14400/20 -> 720 | F99: 1 | G99: 1 | H99: =(C96*D96)+(E96*F96)+(E96*G96) -> 35040
A100: dolomite longsword | B100: =B10+300 -> 375 | C100: =33600/20 -> 1680 | D100: 27 | E100: =14400/20 -> 720 | F100: 1 | G100: 2 | H100: =(C97*D97)+(E97*F97)+(E97*G97) -> 47520
A101: dolomite bastard sword | B101: =B11+300 -> 395 | C101: =33600/20 -> 1680 | D101: 33 | E101: =14400/20 -> 720 | F101: 1 | G101: 1 | H101: =(C98*D98)+(E98*F98)+(E98*G98) -> 56880
A102: dolomite club | B102: =B12+300 -> 315 | C102: =33600/20 -> 1680 | D102: 3 | E102: =14400/20 -> 720 | F102: 19 | G102: 0 | H102: =(C99*D99)+(E99*F99)+(E99*G99) -> 18720
A103: dolomite mace | B103: =B13+300 -> 335 | C103: =33600/20 -> 1680 | D103: 16 | E103: =14400/20 -> 720 | F103: 3 | G103: 0 | H103: =(C100*D100)+(E100*F100)+(E100*G100) -> 29040
A104: dolomite spiked club | B104: =B14+300 -> 355 | C104: =33600/20 -> 1680 | D104: 7 | E104: =14400/20 -> 720 | F104: 32 | G104: 0 | H104: =(C101*D101)+(E101*F101)+(E101*G101) -> 34800
A105: dolomite hammer | B105: =B15+300 -> 375 | C105: =33600/20 -> 1680 | D105: 22 | E105: =14400/20 -> 720 | F105: 6 | G105: 0 | H105: =(C102*D102)+(E102*F102)+(E102*G102) -> 41280
A106: dolomite spiked mace | B106: =B16+300 -> 395 | C106: =33600/20 -> 1680 | D106: 30 | E106: =14400/20 -> 720 | F106: 6 | G106: 0 | H106: =(C103*D103)+(E103*F103)+(E103*G103) -> 54720
A107: dolomite short spear | B107: =B17+300 -> 315 | C107: =33600/20 -> 1680 | D107: 7 | E107: =14400/20 -> 720 | F107: 10 | G107: 0 | H107: =(C104*D104)+(E104*F104)+(E104*G104) -> 18960
A108: dolomite spear | B108: =B18+300 -> 335 | C108: =33600/20 -> 1680 | D108: 12 | E108: =14400/20 -> 720 | F108: 12 | G108: 0 | H108: =(C105*D105)+(E105*F105)+(E105*G105) -> 28800
A109: dolomite long spear | B109: =B19+300 -> 355 | C109: =33600/20 -> 1680 | D109: 19 | E109: =14400/20 -> 720 | F109: 13 | G109: 0 | H109: =(C106*D106)+(E106*F106)+(E106*G106) -> 41280
A110: dolomite war spear | B110: =B20+300 -> 375 | C110: =33600/20 -> 1680 | D110: 23 | E110: =14400/20 -> 720 | F110: 12 | G110: 0 | H110: =(C107*D107)+(E107*F107)+(E107*G107) -> 47280
A111: dolomite barbed spear | B111: =B21+300 -> 395 | C111: =33600/20 -> 1680 | D111: 27 | E111: =14400/20 -> 720 | F111: 12 | G111: 0 | H111: =(C108*D108)+(E108*F108)+(E108*G108) -> 54000
A112: dolomite big shillelagh | B112: =B22+300 -> 335 | C112: =33600/20 -> 1680 | D112: 22 | E112: =14400/20 -> 720 | F112: 8 | G112: 0 | H112: =(C109*D109)+(E109*F109)+(E109*G109) -> 42720
A113: dolomite two handed sword | B113: =B23+300 -> 335 | C113: =33600/20 -> 1680 | D113: 20 | E113: =14400/20 -> 720 | F113: 1 | G113: 1 | H113: =(C110*D110)+(E110*F110)+(E110*G110) -> 35040
A114: dolomite great hammer | B114: =B24+300 -> 355 | C114: =33600/20 -> 1680 | D114: 32 | E114: =14400/20 -> 720 | F114: 8 | G114: 0 | H114: =(C111*D111)+(E111*F111)+(E111*G111) -> 59520
A115: dolomite two-hand spiked mace | B115: =B25+300 -> 375 | C115: =33600/20 -> 1680 | D115: 30 | E115: =14400/20 -> 720 | F115: 8 | G115: 0 | H115: =(C112*D112)+(E112*F112)+(E112*G112) -> 56160
A116: dolomite great sword | B116: =B26+300 -> 395 | C116: =33600/20 -> 1680 | D116: 39 | E116: =14400/20 -> 720 | F116: 1 | G116: 1 | H116: =(C113*D113)+(E113*F113)+(E113*G113) -> 66960
A117: ironwood kite shield | B117: =B27+300 -> 395 | C117: =33600/20 -> 1680 | D117: 3 | E117: =14400/20 -> 720 | F117: 3 | G117: 1 | H117: =(C114*D114)+(E114*F114)+(E114*G114) -> 7920
A118: ironwood tower shield | B118: =B28+300 -> 395 | C118: =33600/20 -> 1680 | D118: 4 | E118: =14400/20 -> 720 | F118: 3 | G118: 1 | H118: =(C115*D115)+(E115*F115)+(E115*G115) -> 9600
A119: ironwood round shield | B119: =B29+300 -> 395 | C119: =33600/20 -> 1680 | D119: 3 | E119: =14400/20 -> 720 | F119: 2 | G119: 0 | H119: =(C116*D116)+(E116*F116)+(E116*G116) -> 6480
A120: ironwood heater shield | B120: =B30+300 -> 395 | C120: =33600/20 -> 1680 | D120: 5 | E120: =14400/20 -> 720 | F120: 3 | G120: 1 | H120: =(C117*D117)+(E117*F117)+(E117*G117) -> 11280
A121: Cobalt
A122: cobalt dirk | B122: =B2+400 -> 415 | C122: =100800/20 -> 5040 | D122: 8 | E122: =43200/20 -> 2160 | F122: 1 | G122: 2 | H122: =(C118*D118)+(E118*F118)+(E118*G118) -> 46800
A123: cobalt dagger | B123: =B3+400 -> 435 | C123: =100800/20 -> 5040 | D123: 12 | E123: =43200/20 -> 2160 | F123: 1 | G123: 2 | H123: =(C119*D119)+(E119*F119)+(E119*G119) -> 66960
A124: cobalt stilletto | B124: =B4+400 -> 455 | C124: =100800/20 -> 5040 | D124: 20 | E124: =43200/20 -> 2160 | F124: 1 | G124: 1 | H124: =(C120*D120)+(E120*F120)+(E120*G120) -> 105120
A125: cobalt rapier | B125: =B5+400 -> 475 | C125: =100800/20 -> 5040 | D125: 24 | E125: =43200/20 -> 2160 | F125: 1 | G125: 1 | H125: =(C121*D121)+(E121*F121)+(E121*G121) -> 125280
A126: cobalt curved dagger | B126: =B6+400 -> 495 | C126: =100800/20 -> 5040 | D126: 31 | E126: =43200/20 -> 2160 | F126: 1 | G126: 1 | H126: =(C122*D122)+(E122*F122)+(E122*G122) -> 160560
A127: cobalt short sword | B127: =B7+400 -> 415 | C127: =100800/20 -> 5040 | D127: 10 | E127: =43200/20 -> 2160 | F127: 1 | G127: 2 | H127: =(C123*D123)+(E123*F123)+(E123*G123) -> 56880
A128: cobalt falcata | B128: =B8+400 -> 435 | C128: =100800/20 -> 5040 | D128: 16 | E128: =43200/20 -> 2160 | F128: 1 | G128: 1 | H128: =(C124*D124)+(E124*F124)+(E124*G124) -> 84960
A129: cobalt broadsword | B129: =B9+400 -> 455 | C129: =100800/20 -> 5040 | D129: 20 | E129: =43200/20 -> 2160 | F129: 1 | G129: 1 | H129: =(C125*D125)+(E125*F125)+(E125*G125) -> 105120
A130: cobalt longsword | B130: =B10+400 -> 475 | C130: =100800/20 -> 5040 | D130: 27 | E130: =43200/20 -> 2160 | F130: 1 | G130: 2 | H130: =(C126*D126)+(E126*F126)+(E126*G126) -> 142560
A131: cobalt bastard sword | B131: =B11+400 -> 495 | C131: =100800/20 -> 5040 | D131: 33 | E131: =43200/20 -> 2160 | F131: 1 | G131: 1 | H131: =(C127*D127)+(E127*F127)+(E127*G127) -> 170640
A132: cobalt club | B132: =B12+400 -> 415 | C132: =100800/20 -> 5040 | D132: 3 | E132: =43200/20 -> 2160 | F132: 19 | G132: 0 | H132: =(C128*D128)+(E128*F128)+(E128*G128) -> 56160
A133: cobalt mace | B133: =B13+400 -> 435 | C133: =100800/20 -> 5040 | D133: 16 | E133: =43200/20 -> 2160 | F133: 3 | G133: 0 | H133: =(C129*D129)+(E129*F129)+(E129*G129) -> 87120
A134: cobalt spiked club | B134: =B14+400 -> 455 | C134: =100800/20 -> 5040 | D134: 7 | E134: =43200/20 -> 2160 | F134: 32 | G134: 0 | H134: =(C130*D130)+(E130*F130)+(E130*G130) -> 104400
A135: cobalt hammer | B135: =B15+400 -> 475 | C135: =100800/20 -> 5040 | D135: 22 | E135: =43200/20 -> 2160 | F135: 6 | G135: 0 | H135: =(C131*D131)+(E131*F131)+(E131*G131) -> 123840
A136: cobalt spiked mace | B136: =B16+400 -> 495 | C136: =100800/20 -> 5040 | D136: 30 | E136: =43200/20 -> 2160 | F136: 6 | G136: 0 | H136: =(C132*D132)+(E132*F132)+(E132*G132) -> 164160
A137: cobalt short spear | B137: =B17+400 -> 415 | C137: =100800/20 -> 5040 | D137: 7 | E137: =43200/20 -> 2160 | F137: 10 | G137: 0 | H137: =(C133*D133)+(E133*F133)+(E133*G133) -> 56880
A138: cobalt spear | B138: =B18+400 -> 435 | C138: =100800/20 -> 5040 | D138: 12 | E138: =43200/20 -> 2160 | F138: 12 | G138: 0 | H138: =(C134*D134)+(E134*F134)+(E134*G134) -> 86400
A139: cobalt long spear | B139: =B19+400 -> 455 | C139: =100800/20 -> 5040 | D139: 19 | E139: =43200/20 -> 2160 | F139: 13 | G139: 0 | H139: =(C135*D135)+(E135*F135)+(E135*G135) -> 123840
A140: cobalt war spear | B140: =B20+400 -> 475 | C140: =100800/20 -> 5040 | D140: 23 | E140: =43200/20 -> 2160 | F140: 12 | G140: 0 | H140: =(C136*D136)+(E136*F136)+(E136*G136) -> 141840
A141: cobalt barbed spear | B141: =B21+400 -> 495 | C141: =100800/20 -> 5040 | D141: 27 | E141: =43200/20 -> 2160 | F141: 12 | G141: 0 | H141: =(C137*D137)+(E137*F137)+(E137*G137) -> 162000
A142: cobalt big shillelagh | B142: =B22+400 -> 435 | C142: =100800/20 -> 5040 | D142: 22 | E142: =43200/20 -> 2160 | F142: 8 | G142: 0 | H142: =(C138*D138)+(E138*F138)+(E138*G138) -> 128160
A143: cobalt two handed sword | B143: =B23+400 -> 435 | C143: =100800/20 -> 5040 | D143: 20 | E143: =43200/20 -> 2160 | F143: 1 | G143: 1 | H143: =(C139*D139)+(E139*F139)+(E139*G139) -> 105120
A144: cobalt great hammer | B144: =B24+400 -> 455 | C144: =100800/20 -> 5040 | D144: 32 | E144: =43200/20 -> 2160 | F144: 8 | G144: 0 | H144: =(C140*D140)+(E140*F140)+(E140*G140) -> 178560
A145: cobalt two-hand spiked mace | B145: =B25+400 -> 475 | C145: =100800/20 -> 5040 | D145: 30 | E145: =43200/20 -> 2160 | F145: 8 | G145: 0 | H145: =(C141*D141)+(E141*F141)+(E141*G141) -> 168480
A146: cobalt great sword | B146: =B26+400 -> 495 | C146: =100800/20 -> 5040 | D146: 39 | E146: =43200/20 -> 2160 | F146: 1 | G146: 1 | H146: =(C142*D142)+(E142*F142)+(E142*G142) -> 200880
A147: heartwood kite shield | B147: =B27+400 -> 495 | C147: =100800/20 -> 5040 | D147: 3 | E147: =43200/20 -> 2160 | F147: 3 | G147: 1 | H147: =(C143*D143)+(E143*F143)+(E143*G143) -> 23760
A148: heartwood tower shield | B148: =B28+400 -> 495 | C148: =100800/20 -> 5040 | D148: 4 | E148: =43200/20 -> 2160 | F148: 3 | G148: 1 | H148: =(C144*D144)+(E144*F144)+(E144*G144) -> 28800
A149: heartwood round shield | B149: =B29+400 -> 495 | C149: =100800/20 -> 5040 | D149: 3 | E149: =43200/20 -> 2160 | F149: 2 | G149: 0 | H149: =(C145*D145)+(E145*F145)+(E145*G145) -> 19440
A150: heartwood heater shield | B150: =B30+400 -> 495 | C150: =100800/20 -> 5040 | D150: 5 | E150: =43200/20 -> 2160 | F150: 3 | G150: 1 | H150: =(C146*D146)+(E146*F146)+(E146*G146) -> 33840
A151: cobalt sickle | B151: 515 | C151: =100800/20 -> 5040 | D151: 40 | E151: =43200/20 -> 2160 | F151: 1 | G151: 2 | H151: =(C147*D147)+(E147*F147)+(E147*G147) -> 208080
A152: cobalt crescent sword | B152: 515 | C152: =100800/20 -> 5040 | D152: 40 | E152: =43200/20 -> 2160 | F152: 1 | G152: 2 | H152: =(C148*D148)+(E148*F148)+(E148*G148) -> 208080
A153: cobalt pick hammer | B153: 515 | C153: =100800/20 -> 5040 | D153: 35 | E153: =43200/20 -> 2160 | F153: 8 | G153: 0 | H153: =(C149*D149)+(E149*F149)+(E149*G149) -> 193680
A154: cobalt great falcata | B154: 515 | C154: =100800/20 -> 5040 | D154: 41 | E154: =43200/20 -> 2160 | F154: 1 | G154: 2 | H154: =(C150*D150)+(E150*F150)+(E150*G150) -> 213120
A155: cobalt sledge hammer | B155: 515 | C155: =100800/20 -> 5040 | D155: 44 | E155: =43200/20 -> 2160 | F155: 8 | G155: 0 | H155: =(C151*D151)+(E151*F151)+(E151*G151) -> 239040
A156: cobalt guarded rapier | B156: 515 | C156: =100800/20 -> 5040 | D156: 38 | E156: =43200/20 -> 2160 | F156: 1 | G156: 2 | H156: =(C152*D152)+(E152*F152)+(E152*G152) -> 198000
A157: cobalt hooked spear | B157: 515 | C157: =100800/20 -> 5040 | D157: 44 | E157: =43200/20 -> 2160 | F157: 8 | G157: 0 | H157: =(C152*D152)+(E152*F152)+(E152*G152) -> 239040
A158: Carbide
A159: carbide dirk | B159: =B2+500 -> 515 | C159: =201600/20 -> 10080 | D159: 8 | E159: =86400/20 -> 4320 | F159: 1 | G159: 2 | H159: =(C153*D153)+(E153*F153)+(E153*G153) -> 93600
A160: carbide dagger | B160: =B3+500 -> 535 | C160: =201600/20 -> 10080 | D160: 12 | E160: =86400/20 -> 4320 | F160: 1 | G160: 2 | H160: =(C154*D154)+(E154*F154)+(E154*G154) -> 133920
A161: carbide stilletto | B161: =B4+500 -> 555 | C161: =201600/20 -> 10080 | D161: 20 | E161: =86400/20 -> 4320 | F161: 1 | G161: 1 | H161: =(C155*D155)+(E155*F155)+(E155*G155) -> 210240
A162: carbide rapier | B162: =B5+500 -> 575 | C162: =201600/20 -> 10080 | D162: 24 | E162: =86400/20 -> 4320 | F162: 1 | G162: 1 | H162: =(C156*D156)+(E156*F156)+(E156*G156) -> 250560
A163: carbide curved dagger | B163: =B6+500 -> 595 | C163: =201600/20 -> 10080 | D163: 31 | E163: =86400/20 -> 4320 | F163: 1 | G163: 1 | H163: =(C157*D157)+(E157*F157)+(E157*G157) -> 321120
A164: carbide short sword | B164: =B7+500 -> 515 | C164: =201600/20 -> 10080 | D164: 10 | E164: =86400/20 -> 4320 | F164: 1 | G164: 2 | H164: =(C158*D158)+(E158*F158)+(E158*G158) -> 113760
A165: carbide falcata | B165: =B8+500 -> 535 | C165: =201600/20 -> 10080 | D165: 16 | E165: =86400/20 -> 4320 | F165: 1 | G165: 1 | H165: =(C159*D159)+(E159*F159)+(E159*G159) -> 169920
A166: carbide broadsword | B166: =B9+500 -> 555 | C166: =201600/20 -> 10080 | D166: 20 | E166: =86400/20 -> 4320 | F166: 1 | G166: 1 | H166: =(C160*D160)+(E160*F160)+(E160*G160) -> 210240
A167: carbide longsword | B167: =B10+500 -> 575 | C167: =201600/20 -> 10080 | D167: 27 | E167: =86400/20 -> 4320 | F167: 1 | G167: 2 | H167: =(C161*D161)+(E161*F161)+(E161*G161) -> 285120
A168: carbide bastard sword | B168: =B11+500 -> 595 | C168: =201600/20 -> 10080 | D168: 33 | E168: =86400/20 -> 4320 | F168: 1 | G168: 1 | H168: =(C162*D162)+(E162*F162)+(E162*G162) -> 341280
A169: carbide club | B169: =B12+500 -> 515 | C169: =201600/20 -> 10080 | D169: 3 | E169: =86400/20 -> 4320 | F169: 19 | G169: 0 | H169: =(C163*D163)+(E163*F163)+(E163*G163) -> 112320
A170: carbide mace | B170: =B13+500 -> 535 | C170: =201600/20 -> 10080 | D170: 16 | E170: =86400/20 -> 4320 | F170: 3 | G170: 0 | H170: =(C164*D164)+(E164*F164)+(E164*G164) -> 174240
A171: carbide spiked club | B171: =B14+500 -> 555 | C171: =201600/20 -> 10080 | D171: 7 | E171: =86400/20 -> 4320 | F171: 32 | G171: 0 | H171: =(C165*D165)+(E165*F165)+(E165*G165) -> 208800
A172: carbide hammer | B172: =B15+500 -> 575 | C172: =201600/20 -> 10080 | D172: 22 | E172: =86400/20 -> 4320 | F172: 6 | G172: 0 | H172: =(C166*D166)+(E166*F166)+(E166*G166) -> 247680
A173: carbide spiked mace | B173: =B16+500 -> 595 | C173: =201600/20 -> 10080 | D173: 30 | E173: =86400/20 -> 4320 | F173: 6 | G173: 0 | H173: =(C167*D167)+(E167*F167)+(E167*G167) -> 328320
A174: carbide short spear | B174: =B17+500 -> 515 | C174: =201600/20 -> 10080 | D174: 7 | E174: =86400/20 -> 4320 | F174: 10 | G174: 0 | H174: =(C168*D168)+(E168*F168)+(E168*G168) -> 113760
A175: carbide spear | B175: =B18+500 -> 535 | C175: =201600/20 -> 10080 | D175: 12 | E175: =86400/20 -> 4320 | F175: 12 | G175: 0 | H175: =(C169*D169)+(E169*F169)+(E169*G169) -> 172800
A176: carbide long spear | B176: =B19+500 -> 555 | C176: =201600/20 -> 10080 | D176: 19 | E176: =86400/20 -> 4320 | F176: 13 | G176: 0 | H176: =(C170*D170)+(E170*F170)+(E170*G170) -> 247680
A177: carbide war spear | B177: =B20+500 -> 575 | C177: =201600/20 -> 10080 | D177: 23 | E177: =86400/20 -> 4320 | F177: 12 | G177: 0 | H177: =(C171*D171)+(E171*F171)+(E171*G171) -> 283680
A178: carbide barbed spear | B178: =B21+500 -> 595 | C178: =201600/20 -> 10080 | D178: 27 | E178: =86400/20 -> 4320 | F178: 12 | G178: 0 | H178: =(C172*D172)+(E172*F172)+(E172*G172) -> 324000
A179: carbide big shillelagh | B179: =B22+500 -> 535 | C179: =201600/20 -> 10080 | D179: 22 | E179: =86400/20 -> 4320 | F179: 8 | G179: 0 | H179: =(C173*D173)+(E173*F173)+(E173*G173) -> 256320
A180: carbide two handed sword | B180: =B23+500 -> 535 | C180: =201600/20 -> 10080 | D180: 20 | E180: =86400/20 -> 4320 | F180: 1 | G180: 1 | H180: =(C174*D174)+(E174*F174)+(E174*G174) -> 210240
A181: carbide great hammer | B181: =B24+500 -> 555 | C181: =201600/20 -> 10080 | D181: 32 | E181: =86400/20 -> 4320 | F181: 8 | G181: 0 | H181: =(C175*D175)+(E175*F175)+(E175*G175) -> 357120
A182: carbide two-hand spiked mace | B182: =B25+500 -> 575 | C182: =201600/20 -> 10080 | D182: 30 | E182: =86400/20 -> 4320 | F182: 8 | G182: 0 | H182: =(C176*D176)+(E176*F176)+(E176*G176) -> 336960
A183: carbide great sword | B183: =B26+500 -> 595 | C183: =201600/20 -> 10080 | D183: 39 | E183: =86400/20 -> 4320 | F183: 1 | G183: 1 | H183: =(C177*D177)+(E177*F177)+(E177*G177) -> 401760
A184: runewood kite shield | B184: =B27+500 -> 595 | C184: =201600/20 -> 10080 | D184: 3 | E184: =86400/20 -> 4320 | F184: 3 | G184: 1 | H184: =(C178*D178)+(E178*F178)+(E178*G178) -> 47520
A185: runewood tower shield | B185: =B28+500 -> 595 | C185: =201600/20 -> 10080 | D185: 4 | E185: =86400/20 -> 4320 | F185: 3 | G185: 1 | H185: =(C179*D179)+(E179*F179)+(E179*G179) -> 57600
A186: runewood round shield | B186: =B29+500 -> 595 | C186: =201600/20 -> 10080 | D186: 3 | E186: =86400/20 -> 4320 | F186: 2 | G186: 0 | H186: =(C180*D180)+(E180*F180)+(E180*G180) -> 38880
A187: runewood heater shield | B187: =B30+500 -> 595 | C187: =201600/20 -> 10080 | D187: 5 | E187: =86400/20 -> 4320 | F187: 3 | G187: 1 | H187: =(C181*D181)+(E181*F181)+(E181*G181) -> 67680
A188: carbide sickle | B188: 615 | C188: =201600/20 -> 10080 | D188: 40 | E188: =86400/20 -> 4320 | F188: 1 | G188: 2 | H188: =(C182*D182)+(E182*F182)+(E182*G182) -> 416160
A189: carbide crescent sword | B189: 615 | C189: =201600/20 -> 10080 | D189: 40 | E189: =86400/20 -> 4320 | F189: 1 | G189: 2 | H189: =(C183*D183)+(E183*F183)+(E183*G183) -> 416160
A190: carbide pick hammer | B190: 615 | C190: =201600/20 -> 10080 | D190: 35 | E190: =86400/20 -> 4320 | F190: 8 | G190: 0 | H190: =(C184*D184)+(E184*F184)+(E184*G184) -> 387360
A191: carbide great falcata | B191: 615 | C191: =201600/20 -> 10080 | D191: 41 | E191: =86400/20 -> 4320 | F191: 1 | G191: 2 | H191: =(C185*D185)+(E185*F185)+(E185*G185) -> 426240
A192: carbide sledge hammer | B192: 615 | C192: =201600/20 -> 10080 | D192: 44 | E192: =86400/20 -> 4320 | F192: 8 | G192: 0 | H192: =(C186*D186)+(E186*F186)+(E186*G186) -> 478080
A193: carbide guarded rapier | B193: 615 | C193: =201600/20 -> 10080 | D193: 38 | E193: =86400/20 -> 4320 | F193: 1 | G193: 2 | H193: =(C187*D187)+(E187*F187)+(E187*G187) -> 396000
A194: carbide hooked spear | B194: 615 | C194: =201600/20 -> 10080 | D194: 44 | E194: =86400/20 -> 4320 | F194: 8 | G194: 0 | H194: =(C187*D187)+(E187*F187)+(E187*G187) -> 495360
A195: Sapphire
A196: sapphire dirk | B196: =B2+600 -> 615 | C196: =302400/20 -> 15120 | D196: 8 | E196: =129600/20 -> 6480 | F196: 1 | G196: 2 | H196: =(C188*D188)+(E188*F188)+(E188*G188) -> 140400
A197: sapphire dagger | B197: =B3+600 -> 635 | C197: =302400/20 -> 15120 | D197: 12 | E197: =129600/20 -> 6480 | F197: 1 | G197: 2 | H197: =(C189*D189)+(E189*F189)+(E189*G189) -> 200880
A198: sapphire stilletto | B198: =B4+600 -> 655 | C198: =302400/20 -> 15120 | D198: 20 | E198: =129600/20 -> 6480 | F198: 1 | G198: 1 | H198: =(C190*D190)+(E190*F190)+(E190*G190) -> 315360
A199: sapphire rapier | B199: =B5+600 -> 675 | C199: =302400/20 -> 15120 | D199: 24 | E199: =129600/20 -> 6480 | F199: 1 | G199: 1 | H199: =(C191*D191)+(E191*F191)+(E191*G191) -> 375840
A200: sapphire curved dagger | B200: =B6+600 -> 695 | C200: =302400/20 -> 15120 | D200: 31 | E200: =129600/20 -> 6480 | F200: 1 | G200: 1 | H200: =(C192*D192)+(E192*F192)+(E192*G192) -> 481680
A201: sapphire short sword | B201: =B7+600 -> 615 | C201: =302400/20 -> 15120 | D201: 10 | E201: =129600/20 -> 6480 | F201: 1 | G201: 2 | H201: =(C193*D193)+(E193*F193)+(E193*G193) -> 170640
A202: sapphire falcata | B202: =B8+600 -> 635 | C202: =302400/20 -> 15120 | D202: 16 | E202: =129600/20 -> 6480 | F202: 1 | G202: 1 | H202: =(C194*D194)+(E194*F194)+(E194*G194) -> 254880
A203: sapphire broadsword | B203: =B9+600 -> 655 | C203: =302400/20 -> 15120 | D203: 20 | E203: =129600/20 -> 6480 | F203: 1 | G203: 1 | H203: =(C195*D195)+(E195*F195)+(E195*G195) -> 315360
A204: sapphire longsword | B204: =B10+600 -> 675 | C204: =302400/20 -> 15120 | D204: 27 | E204: =129600/20 -> 6480 | F204: 1 | G204: 2 | H204: =(C196*D196)+(E196*F196)+(E196*G196) -> 427680
A205: sapphire bastard sword | B205: =B11+600 -> 695 | C205: =302400/20 -> 15120 | D205: 33 | E205: =129600/20 -> 6480 | F205: 1 | G205: 1 | H205: =(C197*D197)+(E197*F197)+(E197*G197) -> 511920
A206: sapphire club | B206: =B12+600 -> 615 | C206: =302400/20 -> 15120 | D206: 3 | E206: =129600/20 -> 6480 | F206: 19 | G206: 0 | H206: =(C198*D198)+(E198*F198)+(E198*G198) -> 168480
A207: sapphire mace | B207: =B13+600 -> 635 | C207: =302400/20 -> 15120 | D207: 16 | E207: =129600/20 -> 6480 | F207: 3 | G207: 0 | H207: =(C199*D199)+(E199*F199)+(E199*G199) -> 261360
A208: sapphire spiked club | B208: =B14+600 -> 655 | C208: =302400/20 -> 15120 | D208: 7 | E208: =129600/20 -> 6480 | F208: 32 | G208: 0 | H208: =(C200*D200)+(E200*F200)+(E200*G200) -> 313200
A209: sapphire hammer | B209: =B15+600 -> 675 | C209: =302400/20 -> 15120 | D209: 22 | E209: =129600/20 -> 6480 | F209: 6 | G209: 0 | H209: =(C201*D201)+(E201*F201)+(E201*G201) -> 371520
A210: sapphire spiked mace | B210: =B16+600 -> 695 | C210: =302400/20 -> 15120 | D210: 30 | E210: =129600/20 -> 6480 | F210: 6 | G210: 0 | H210: =(C202*D202)+(E202*F202)+(E202*G202) -> 492480
A211: sapphire short spear | B211: =B17+600 -> 615 | C211: =302400/20 -> 15120 | D211: 7 | E211: =129600/20 -> 6480 | F211: 10 | G211: 0 | H211: =(C203*D203)+(E203*F203)+(E203*G203) -> 170640
A212: sapphire spear | B212: =B18+600 -> 635 | C212: =302400/20 -> 15120 | D212: 12 | E212: =129600/20 -> 6480 | F212: 12 | G212: 0 | H212: =(C204*D204)+(E204*F204)+(E204*G204) -> 259200
A213: sapphire long spear | B213: =B19+600 -> 655 | C213: =302400/20 -> 15120 | D213: 19 | E213: =129600/20 -> 6480 | F213: 13 | G213: 0 | H213: =(C205*D205)+(E205*F205)+(E205*G205) -> 371520
A214: sapphire war spear | B214: =B20+600 -> 675 | C214: =302400/20 -> 15120 | D214: 23 | E214: =129600/20 -> 6480 | F214: 12 | G214: 0 | H214: =(C206*D206)+(E206*F206)+(E206*G206) -> 425520
A215: sapphire barbed spear | B215: =B21+600 -> 695 | C215: =302400/20 -> 15120 | D215: 27 | E215: =129600/20 -> 6480 | F215: 12 | G215: 0 | H215: =(C207*D207)+(E207*F207)+(E207*G207) -> 486000
A216: sapphire big shillelagh | B216: =B22+600 -> 635 | C216: =302400/20 -> 15120 | D216: 22 | E216: =129600/20 -> 6480 | F216: 8 | G216: 0 | H216: =(C208*D208)+(E208*F208)+(E208*G208) -> 384480
A217: sapphire two handed sword | B217: =B23+600 -> 635 | C217: =302400/20 -> 15120 | D217: 20 | E217: =129600/20 -> 6480 | F217: 1 | G217: 1 | H217: =(C209*D209)+(E209*F209)+(E209*G209) -> 315360
A218: sapphire great hammer | B218: =B24+600 -> 655 | C218: =302400/20 -> 15120 | D218: 32 | E218: =129600/20 -> 6480 | F218: 8 | G218: 0 | H218: =(C210*D210)+(E210*F210)+(E210*G210) -> 535680
A219: sapphire two-hand spiked mace | B219: =B25+600 -> 675 | C219: =302400/20 -> 15120 | D219: 30 | E219: =129600/20 -> 6480 | F219: 8 | G219: 0 | H219: =(C211*D211)+(E211*F211)+(E211*G211) -> 505440
A220: sapphire great sword | B220: =B26+600 -> 695 | C220: =302400/20 -> 15120 | D220: 39 | E220: =129600/20 -> 6480 | F220: 1 | G220: 1 | H220: =(C212*D212)+(E212*F212)+(E212*G212) -> 602640
A221: stonewood kite shield | B221: =B27+600 -> 695 | C221: =302400/20 -> 15120 | D221: 3 | E221: =129600/20 -> 6480 | F221: 3 | G221: 1 | H221: =(C213*D213)+(E213*F213)+(E213*G213) -> 71280
A222: stonewood tower shield | B222: =B28+600 -> 695 | C222: =302400/20 -> 15120 | D222: 4 | E222: =129600/20 -> 6480 | F222: 3 | G222: 1 | H222: =(C214*D214)+(E214*F214)+(E214*G214) -> 86400
A223: stonewood round shield | B223: =B29+600 -> 695 | C223: =302400/20 -> 15120 | D223: 3 | E223: =129600/20 -> 6480 | F223: 2 | G223: 0 | H223: =(C215*D215)+(E215*F215)+(E215*G215) -> 58320
A224: stonewood heater shield | B224: =B30+600 -> 695 | C224: =302400/20 -> 15120 | D224: 5 | E224: =129600/20 -> 6480 | F224: 3 | G224: 1 | H224: =(C216*D216)+(E216*F216)+(E216*G216) -> 101520
A225: sapphire sickle | B225: 715 | C225: =302400/20 -> 15120 | D225: 40 | E225: =129600/20 -> 6480 | F225: 1 | G225: 2 | H225: =(C217*D217)+(E217*F217)+(E217*G217) -> 624240
A226: sapphire crescent sword | B226: 715 | C226: =302400/20 -> 15120 | D226: 40 | E226: =129600/20 -> 6480 | F226: 1 | G226: 2 | H226: =(C218*D218)+(E218*F218)+(E218*G218) -> 624240
A227: sapphire pick hammer | B227: 715 | C227: =302400/20 -> 15120 | D227: 35 | E227: =129600/20 -> 6480 | F227: 8 | G227: 0 | H227: =(C219*D219)+(E219*F219)+(E219*G219) -> 581040
A228: sapphire great falcata | B228: 715 | C228: =302400/20 -> 15120 | D228: 41 | E228: =129600/20 -> 6480 | F228: 1 | G228: 2 | H228: =(C220*D220)+(E220*F220)+(E220*G220) -> 639360
A229: sapphire sledge hammer | B229: 715 | C229: =302400/20 -> 15120 | D229: 44 | E229: =129600/20 -> 6480 | F229: 8 | G229: 0 | H229: =(C221*D221)+(E221*F221)+(E221*G221) -> 717120
A230: sapphire guarded rapier | B230: 715 | C230: =302400/20 -> 15120 | D230: 38 | E230: =129600/20 -> 6480 | F230: 1 | G230: 2 | H230: =(C222*D222)+(E222*F222)+(E222*G222) -> 594000
A231: sapphire hooked spear | B231: 715 | C231: =302400/20 -> 15120 | D231: 44 | E231: =129600/20 -> 6480 | F231: 8 | G231: 0 | H231: =(C222*D222)+(E222*F222)+(E222*G222) -> 717120
A232: Diamond
A233: diamond dirk | B233: =B2+700 -> 715 | C233: =453600/20 -> 22680 | D233: 8 | E233: =194400/20 -> 9720 | F233: 1 | G233: 2 | H233: =(C223*D223)+(E223*F223)+(E223*G223) -> 210600
A234: diamond dagger | B234: =B3+700 -> 735 | C234: =453600/20 -> 22680 | D234: 12 | E234: =194400/20 -> 9720 | F234: 1 | G234: 2 | H234: =(C224*D224)+(E224*F224)+(E224*G224) -> 301320
A235: diamond stilletto | B235: =B4+700 -> 755 | C235: =453600/20 -> 22680 | D235: 20 | E235: =194400/20 -> 9720 | F235: 1 | G235: 1 | H235: =(C225*D225)+(E225*F225)+(E225*G225) -> 473040
A236: diamond rapier | B236: =B5+700 -> 775 | C236: =453600/20 -> 22680 | D236: 24 | E236: =194400/20 -> 9720 | F236: 1 | G236: 1 | H236: =(C226*D226)+(E226*F226)+(E226*G226) -> 563760
A237: diamond curved dagger | B237: =B6+700 -> 795 | C237: =453600/20 -> 22680 | D237: 31 | E237: =194400/20 -> 9720 | F237: 1 | G237: 1 | H237: =(C227*D227)+(E227*F227)+(E227*G227) -> 722520
A238: diamond short sword | B238: =B7+700 -> 715 | C238: =453600/20 -> 22680 | D238: 10 | E238: =194400/20 -> 9720 | F238: 1 | G238: 2 | H238: =(C228*D228)+(E228*F228)+(E228*G228) -> 255960
A239: diamond falcata | B239: =B8+700 -> 735 | C239: =453600/20 -> 22680 | D239: 16 | E239: =194400/20 -> 9720 | F239: 1 | G239: 1 | H239: =(C229*D229)+(E229*F229)+(E229*G229) -> 382320
A240: diamond broadsword | B240: =B9+700 -> 755 | C240: =453600/20 -> 22680 | D240: 20 | E240: =194400/20 -> 9720 | F240: 1 | G240: 1 | H240: =(C230*D230)+(E230*F230)+(E230*G230) -> 473040
A241: diamond longsword | B241: =B10+700 -> 775 | C241: =453600/20 -> 22680 | D241: 27 | E241: =194400/20 -> 9720 | F241: 1 | G241: 2 | H241: =(C231*D231)+(E231*F231)+(E231*G231) -> 641520
A242: diamond bastard sword | B242: =B11+700 -> 795 | C242: =453600/20 -> 22680 | D242: 33 | E242: =194400/20 -> 9720 | F242: 1 | G242: 1 | H242: =(C232*D232)+(E232*F232)+(E232*G232) -> 767880
A243: diamond club | B243: =B12+700 -> 715 | C243: =453600/20 -> 22680 | D243: 3 | E243: =194400/20 -> 9720 | F243: 19 | G243: 0 | H243: =(C233*D233)+(E233*F233)+(E233*G233) -> 252720
A244: diamond mace | B244: =B13+700 -> 735 | C244: =453600/20 -> 22680 | D244: 16 | E244: =194400/20 -> 9720 | F244: 3 | G244: 0 | H244: =(C234*D234)+(E234*F234)+(E234*G234) -> 392040
A245: diamond spiked club | B245: =B14+700 -> 755 | C245: =453600/20 -> 22680 | D245: 7 | E245: =194400/20 -> 9720 | F245: 32 | G245: 0 | H245: =(C235*D235)+(E235*F235)+(E235*G235) -> 469800
A246: diamond hammer | B246: =B15+700 -> 775 | C246: =453600/20 -> 22680 | D246: 22 | E246: =194400/20 -> 9720 | F246: 6 | G246: 0 | H246: =(C236*D236)+(E236*F236)+(E236*G236) -> 557280
A247: diamond spiked mace | B247: =B16+700 -> 795 | C247: =453600/20 -> 22680 | D247: 30 | E247: =194400/20 -> 9720 | F247: 6 | G247: 0 | H247: =(C237*D237)+(E237*F237)+(E237*G237) -> 738720
A248: diamond short spear | B248: =B17+700 -> 715 | C248: =453600/20 -> 22680 | D248: 7 | E248: =194400/20 -> 9720 | F248: 10 | G248: 0 | H248: =(C238*D238)+(E238*F238)+(E238*G238) -> 255960
A249: diamond spear | B249: =B18+700 -> 735 | C249: =453600/20 -> 22680 | D249: 12 | E249: =194400/20 -> 9720 | F249: 12 | G249: 0 | H249: =(C239*D239)+(E239*F239)+(E239*G239) -> 388800
A250: diamond long spear | B250: =B19+700 -> 755 | C250: =453600/20 -> 22680 | D250: 19 | E250: =194400/20 -> 9720 | F250: 13 | G250: 0 | H250: =(C240*D240)+(E240*F240)+(E240*G240) -> 557280
A251: diamond war spear | B251: =B20+700 -> 775 | C251: =453600/20 -> 22680 | D251: 23 | E251: =194400/20 -> 9720 | F251: 12 | G251: 0 | H251: =(C241*D241)+(E241*F241)+(E241*G241) -> 638280
A252: diamond barbed spear | B252: =B21+700 -> 795 | C252: =453600/20 -> 22680 | D252: 27 | E252: =194400/20 -> 9720 | F252: 12 | G252: 0 | H252: =(C242*D242)+(E242*F242)+(E242*G242) -> 729000
A253: diamond big shillelagh | B253: =B22+700 -> 735 | C253: =453600/20 -> 22680 | D253: 22 | E253: =194400/20 -> 9720 | F253: 8 | G253: 0 | H253: =(C243*D243)+(E243*F243)+(E243*G243) -> 576720
A254: diamond two handed sword | B254: =B23+700 -> 735 | C254: =453600/20 -> 22680 | D254: 20 | E254: =194400/20 -> 9720 | F254: 1 | G254: 1 | H254: =(C244*D244)+(E244*F244)+(E244*G244) -> 473040
A255: diamond great hammer | B255: =B24+700 -> 755 | C255: =453600/20 -> 22680 | D255: 32 | E255: =194400/20 -> 9720 | F255: 8 | G255: 0 | H255: =(C245*D245)+(E245*F245)+(E245*G245) -> 803520
A256: diamond two-hand spiked mace | B256: =B25+700 -> 775 | C256: =453600/20 -> 22680 | D256: 30 | E256: =194400/20 -> 9720 | F256: 8 | G256: 0 | H256: =(C246*D246)+(E246*F246)+(E246*G246) -> 758160
A257: diamond great sword | B257: =B26+700 -> 795 | C257: =453600/20 -> 22680 | D257: 39 | E257: =194400/20 -> 9720 | F257: 1 | G257: 1 | H257: =(C247*D247)+(E247*F247)+(E247*G247) -> 903960
A258: ebonwood kite shield | B258: =B27+700 -> 795 | C258: =453600/20 -> 22680 | D258: 3 | E258: =194400/20 -> 9720 | F258: 3 | G258: 1 | H258: =(C248*D248)+(E248*F248)+(E248*G248) -> 106920
A259: ebonwood tower shield | B259: =B28+700 -> 795 | C259: =453600/20 -> 22680 | D259: 4 | E259: =194400/20 -> 9720 | F259: 3 | G259: 1 | H259: =(C249*D249)+(E249*F249)+(E249*G249) -> 129600
A260: ebonwood round shield | B260: =B29+700 -> 795 | C260: =453600/20 -> 22680 | D260: 3 | E260: =194400/20 -> 9720 | F260: 2 | G260: 0 | H260: =(C250*D250)+(E250*F250)+(E250*G250) -> 87480
A261: ebonwood heater shield | B261: =B30+700 -> 795 | C261: =453600/20 -> 22680 | D261: 5 | E261: =194400/20 -> 9720 | F261: 3 | G261: 1 | H261: =(C251*D251)+(E251*F251)+(E251*G251) -> 152280
A262: diamond sickle | B262: 815 | C262: =453600/20 -> 22680 | D262: 40 | E262: =194400/20 -> 9720 | F262: 1 | G262: 2 | H262: =(C252*D252)+(E252*F252)+(E252*G252) -> 936360
A263: diamond crescent sword | B263: 815 | C263: =453600/20 -> 22680 | D263: 40 | E263: =194400/20 -> 9720 | F263: 1 | G263: 2 | H263: =(C253*D253)+(E253*F253)+(E253*G253) -> 936360
A264: diamond pick hammer | B264: 815 | C264: =453600/20 -> 22680 | D264: 35 | E264: =194400/20 -> 9720 | F264: 8 | G264: 0 | H264: =(C254*D254)+(E254*F254)+(E254*G254) -> 871560
A265: diamond great falcata | B265: 815 | C265: =453600/20 -> 22680 | D265: 41 | E265: =194400/20 -> 9720 | F265: 1 | G265: 2 | H265: =(C255*D255)+(E255*F255)+(E255*G255) -> 959040
A266: diamond sledge hammer | B266: 815 | C266: =453600/20 -> 22680 | D266: 44 | E266: =194400/20 -> 9720 | F266: 8 | G266: 0 | H266: =(C256*D256)+(E256*F256)+(E256*G256) -> 1075680
A267: diamond guarded rapier | B267: 815 | C267: =453600/20 -> 22680 | D267: 38 | E267: =194400/20 -> 9720 | F267: 1 | G267: 2 | H267: =(C257*D257)+(E257*F257)+(E257*G257) -> 891000
A268: diamond hooked spear | B268: 815 | C268: =453600/20 -> 22680 | D268: 44 | E268: =194400/20 -> 9720 | F268: 8 | G268: 0 | H268: =(C257*D257)+(E257*F257)+(E257*G257) -> 1075680