C1: Mana Chart Here you go, a chart for the mana derived. I used the more accepted formula of ((Wis/5)+2)*Level.

B1: Wis
A2: Level | B2: 70 | C2: 75 | D2: 80 | E2: 85 | F2: 90 | G2: 95 | H2: 100 | I2: 105 | J2: 110 | K2: 115 | L2: 120 | M2: 125 | N2: 130 | O2: 135 | P2: 140 | Q2: 145 | R2: 150 | S2: 155 | T2: 160 | U2: 165 | V2: 170 | W2: 175 | X2: 180 | Y2: 185 | Z2: 190 | AA2: 195 | AB2: 200
A3: 1 | B3: =((B$2/5)+2)*$A3 -> 16 | C3: =((C$2/5)+2)*$A3 -> 17 | D3: =((D$2/5)+2)*$A3 -> 18 | E3: =((E$2/5)+2)*$A3 -> 19 | F3: =((F$2/5)+2)*$A3 -> 20 | G3: =((G$2/5)+2)*$A3 -> 21 | H3: =((H$2/5)+2)*$A3 -> 22 | I3: =((I$2/5)+2)*$A3 -> 23 | J3: =((J$2/5)+2)*$A3 -> 24 | K3: =((K$2/5)+2)*$A3 -> 25 | L3: =((L$2/5)+2)*$A3 -> 26 | M3: =((M$2/5)+2)*$A3 -> 27 | N3: =((N$2/5)+2)*$A3 -> 28 | O3: =((O$2/5)+2)*$A3 -> 29 | P3: =((P$2/5)+2)*$A3 -> 30 | Q3: =((Q$2/5)+2)*$A3 -> 31 | R3: =((R$2/5)+2)*$A3 -> 32 | S3: =((S$2/5)+2)*$A3 -> 33 | T3: =((T$2/5)+2)*$A3 -> 34 | U3: =((U$2/5)+2)*$A3 -> 35 | V3: =((V$2/5)+2)*$A3 -> 36 | W3: =((W$2/5)+2)*$A3 -> 37 | X3: =((X$2/5)+2)*$A3 -> 38 | Y3: =((Y$2/5)+2)*$A3 -> 39 | Z3: =((Z$2/5)+2)*$A3 -> 40 | AA3: =((AA$2/5)+2)*$A3 -> 41 | AB3: =((AB$2/5)+2)*$A3 -> 42
A4: 2 | B4: =((B$2/5)+2)*$A4 -> 32 | C4: =((C$2/5)+2)*$A4 -> 34 | D4: =((D$2/5)+2)*$A4 -> 36 | E4: =((E$2/5)+2)*$A4 -> 38 | F4: =((F$2/5)+2)*$A4 -> 40 | G4: =((G$2/5)+2)*$A4 -> 42 | H4: =((H$2/5)+2)*$A4 -> 44 | I4: =((I$2/5)+2)*$A4 -> 46 | J4: =((J$2/5)+2)*$A4 -> 48 | K4: =((K$2/5)+2)*$A4 -> 50 | L4: =((L$2/5)+2)*$A4 -> 52 | M4: =((M$2/5)+2)*$A4 -> 54 | N4: =((N$2/5)+2)*$A4 -> 56 | O4: =((O$2/5)+2)*$A4 -> 58 | P4: =((P$2/5)+2)*$A4 -> 60 | Q4: =((Q$2/5)+2)*$A4 -> 62 | R4: =((R$2/5)+2)*$A4 -> 64 | S4: =((S$2/5)+2)*$A4 -> 66 | T4: =((T$2/5)+2)*$A4 -> 68 | U4: =((U$2/5)+2)*$A4 -> 70 | V4: =((V$2/5)+2)*$A4 -> 72 | W4: =((W$2/5)+2)*$A4 -> 74 | X4: =((X$2/5)+2)*$A4 -> 76 | Y4: =((Y$2/5)+2)*$A4 -> 78 | Z4: =((Z$2/5)+2)*$A4 -> 80 | AA4: =((AA$2/5)+2)*$A4 -> 82 | AB4: =((AB$2/5)+2)*$A4 -> 84
A5: 3 | B5: =((B$2/5)+2)*$A5 -> 48 | C5: =((C$2/5)+2)*$A5 -> 51 | D5: =((D$2/5)+2)*$A5 -> 54 | E5: =((E$2/5)+2)*$A5 -> 57 | F5: =((F$2/5)+2)*$A5 -> 60 | G5: =((G$2/5)+2)*$A5 -> 63 | H5: =((H$2/5)+2)*$A5 -> 66 | I5: =((I$2/5)+2)*$A5 -> 69 | J5: =((J$2/5)+2)*$A5 -> 72 | K5: =((K$2/5)+2)*$A5 -> 75 | L5: =((L$2/5)+2)*$A5 -> 78 | M5: =((M$2/5)+2)*$A5 -> 81 | N5: =((N$2/5)+2)*$A5 -> 84 | O5: =((O$2/5)+2)*$A5 -> 87 | P5: =((P$2/5)+2)*$A5 -> 90 | Q5: =((Q$2/5)+2)*$A5 -> 93 | R5: =((R$2/5)+2)*$A5 -> 96 | S5: =((S$2/5)+2)*$A5 -> 99 | T5: =((T$2/5)+2)*$A5 -> 102 | U5: =((U$2/5)+2)*$A5 -> 105 | V5: =((V$2/5)+2)*$A5 -> 108 | W5: =((W$2/5)+2)*$A5 -> 111 | X5: =((X$2/5)+2)*$A5 -> 114 | Y5: =((Y$2/5)+2)*$A5 -> 117 | Z5: =((Z$2/5)+2)*$A5 -> 120 | AA5: =((AA$2/5)+2)*$A5 -> 123 | AB5: =((AB$2/5)+2)*$A5 -> 126
A6: 4 | B6: =((B$2/5)+2)*$A6 -> 64 | C6: =((C$2/5)+2)*$A6 -> 68 | D6: =((D$2/5)+2)*$A6 -> 72 | E6: =((E$2/5)+2)*$A6 -> 76 | F6: =((F$2/5)+2)*$A6 -> 80 | G6: =((G$2/5)+2)*$A6 -> 84 | H6: =((H$2/5)+2)*$A6 -> 88 | I6: =((I$2/5)+2)*$A6 -> 92 | J6: =((J$2/5)+2)*$A6 -> 96 | K6: =((K$2/5)+2)*$A6 -> 100 | L6: =((L$2/5)+2)*$A6 -> 104 | M6: =((M$2/5)+2)*$A6 -> 108 | N6: =((N$2/5)+2)*$A6 -> 112 | O6: =((O$2/5)+2)*$A6 -> 116 | P6: =((P$2/5)+2)*$A6 -> 120 | Q6: =((Q$2/5)+2)*$A6 -> 124 | R6: =((R$2/5)+2)*$A6 -> 128 | S6: =((S$2/5)+2)*$A6 -> 132 | T6: =((T$2/5)+2)*$A6 -> 136 | U6: =((U$2/5)+2)*$A6 -> 140 | V6: =((V$2/5)+2)*$A6 -> 144 | W6: =((W$2/5)+2)*$A6 -> 148 | X6: =((X$2/5)+2)*$A6 -> 152 | Y6: =((Y$2/5)+2)*$A6 -> 156 | Z6: =((Z$2/5)+2)*$A6 -> 160 | AA6: =((AA$2/5)+2)*$A6 -> 164 | AB6: =((AB$2/5)+2)*$A6 -> 168
A7: 5 | B7: =((B$2/5)+2)*$A7 -> 80 | C7: =((C$2/5)+2)*$A7 -> 85 | D7: =((D$2/5)+2)*$A7 -> 90 | E7: =((E$2/5)+2)*$A7 -> 95 | F7: =((F$2/5)+2)*$A7 -> 100 | G7: =((G$2/5)+2)*$A7 -> 105 | H7: =((H$2/5)+2)*$A7 -> 110 | I7: =((I$2/5)+2)*$A7 -> 115 | J7: =((J$2/5)+2)*$A7 -> 120 | K7: =((K$2/5)+2)*$A7 -> 125 | L7: =((L$2/5)+2)*$A7 -> 130 | M7: =((M$2/5)+2)*$A7 -> 135 | N7: =((N$2/5)+2)*$A7 -> 140 | O7: =((O$2/5)+2)*$A7 -> 145 | P7: =((P$2/5)+2)*$A7 -> 150 | Q7: =((Q$2/5)+2)*$A7 -> 155 | R7: =((R$2/5)+2)*$A7 -> 160 | S7: =((S$2/5)+2)*$A7 -> 165 | T7: =((T$2/5)+2)*$A7 -> 170 | U7: =((U$2/5)+2)*$A7 -> 175 | V7: =((V$2/5)+2)*$A7 -> 180 | W7: =((W$2/5)+2)*$A7 -> 185 | X7: =((X$2/5)+2)*$A7 -> 190 | Y7: =((Y$2/5)+2)*$A7 -> 195 | Z7: =((Z$2/5)+2)*$A7 -> 200 | AA7: =((AA$2/5)+2)*$A7 -> 205 | AB7: =((AB$2/5)+2)*$A7 -> 210
A8: 6 | B8: =((B$2/5)+2)*$A8 -> 96 | C8: =((C$2/5)+2)*$A8 -> 102 | D8: =((D$2/5)+2)*$A8 -> 108 | E8: =((E$2/5)+2)*$A8 -> 114 | F8: =((F$2/5)+2)*$A8 -> 120 | G8: =((G$2/5)+2)*$A8 -> 126 | H8: =((H$2/5)+2)*$A8 -> 132 | I8: =((I$2/5)+2)*$A8 -> 138 | J8: =((J$2/5)+2)*$A8 -> 144 | K8: =((K$2/5)+2)*$A8 -> 150 | L8: =((L$2/5)+2)*$A8 -> 156 | M8: =((M$2/5)+2)*$A8 -> 162 | N8: =((N$2/5)+2)*$A8 -> 168 | O8: =((O$2/5)+2)*$A8 -> 174 | P8: =((P$2/5)+2)*$A8 -> 180 | Q8: =((Q$2/5)+2)*$A8 -> 186 | R8: =((R$2/5)+2)*$A8 -> 192 | S8: =((S$2/5)+2)*$A8 -> 198 | T8: =((T$2/5)+2)*$A8 -> 204 | U8: =((U$2/5)+2)*$A8 -> 210 | V8: =((V$2/5)+2)*$A8 -> 216 | W8: =((W$2/5)+2)*$A8 -> 222 | X8: =((X$2/5)+2)*$A8 -> 228 | Y8: =((Y$2/5)+2)*$A8 -> 234 | Z8: =((Z$2/5)+2)*$A8 -> 240 | AA8: =((AA$2/5)+2)*$A8 -> 246 | AB8: =((AB$2/5)+2)*$A8 -> 252
A9: 7 | B9: =((B$2/5)+2)*$A9 -> 112 | C9: =((C$2/5)+2)*$A9 -> 119 | D9: =((D$2/5)+2)*$A9 -> 126 | E9: =((E$2/5)+2)*$A9 -> 133 | F9: =((F$2/5)+2)*$A9 -> 140 | G9: =((G$2/5)+2)*$A9 -> 147 | H9: =((H$2/5)+2)*$A9 -> 154 | I9: =((I$2/5)+2)*$A9 -> 161 | J9: =((J$2/5)+2)*$A9 -> 168 | K9: =((K$2/5)+2)*$A9 -> 175 | L9: =((L$2/5)+2)*$A9 -> 182 | M9: =((M$2/5)+2)*$A9 -> 189 | N9: =((N$2/5)+2)*$A9 -> 196 | O9: =((O$2/5)+2)*$A9 -> 203 | P9: =((P$2/5)+2)*$A9 -> 210 | Q9: =((Q$2/5)+2)*$A9 -> 217 | R9: =((R$2/5)+2)*$A9 -> 224 | S9: =((S$2/5)+2)*$A9 -> 231 | T9: =((T$2/5)+2)*$A9 -> 238 | U9: =((U$2/5)+2)*$A9 -> 245 | V9: =((V$2/5)+2)*$A9 -> 252 | W9: =((W$2/5)+2)*$A9 -> 259 | X9: =((X$2/5)+2)*$A9 -> 266 | Y9: =((Y$2/5)+2)*$A9 -> 273 | Z9: =((Z$2/5)+2)*$A9 -> 280 | AA9: =((AA$2/5)+2)*$A9 -> 287 | AB9: =((AB$2/5)+2)*$A9 -> 294
A10: 8 | B10: =((B$2/5)+2)*$A10 -> 128 | C10: =((C$2/5)+2)*$A10 -> 136 | D10: =((D$2/5)+2)*$A10 -> 144 | E10: =((E$2/5)+2)*$A10 -> 152 | F10: =((F$2/5)+2)*$A10 -> 160 | G10: =((G$2/5)+2)*$A10 -> 168 | H10: =((H$2/5)+2)*$A10 -> 176 | I10: =((I$2/5)+2)*$A10 -> 184 | J10: =((J$2/5)+2)*$A10 -> 192 | K10: =((K$2/5)+2)*$A10 -> 200 | L10: =((L$2/5)+2)*$A10 -> 208 | M10: =((M$2/5)+2)*$A10 -> 216 | N10: =((N$2/5)+2)*$A10 -> 224 | O10: =((O$2/5)+2)*$A10 -> 232 | P10: =((P$2/5)+2)*$A10 -> 240 | Q10: =((Q$2/5)+2)*$A10 -> 248 | R10: =((R$2/5)+2)*$A10 -> 256 | S10: =((S$2/5)+2)*$A10 -> 264 | T10: =((T$2/5)+2)*$A10 -> 272 | U10: =((U$2/5)+2)*$A10 -> 280 | V10: =((V$2/5)+2)*$A10 -> 288 | W10: =((W$2/5)+2)*$A10 -> 296 | X10: =((X$2/5)+2)*$A10 -> 304 | Y10: =((Y$2/5)+2)*$A10 -> 312 | Z10: =((Z$2/5)+2)*$A10 -> 320 | AA10: =((AA$2/5)+2)*$A10 -> 328 | AB10: =((AB$2/5)+2)*$A10 -> 336
A11: 9 | B11: =((B$2/5)+2)*$A11 -> 144 | C11: =((C$2/5)+2)*$A11 -> 153 | D11: =((D$2/5)+2)*$A11 -> 162 | E11: =((E$2/5)+2)*$A11 -> 171 | F11: =((F$2/5)+2)*$A11 -> 180 | G11: =((G$2/5)+2)*$A11 -> 189 | H11: =((H$2/5)+2)*$A11 -> 198 | I11: =((I$2/5)+2)*$A11 -> 207 | J11: =((J$2/5)+2)*$A11 -> 216 | K11: =((K$2/5)+2)*$A11 -> 225 | L11: =((L$2/5)+2)*$A11 -> 234 | M11: =((M$2/5)+2)*$A11 -> 243 | N11: =((N$2/5)+2)*$A11 -> 252 | O11: =((O$2/5)+2)*$A11 -> 261 | P11: =((P$2/5)+2)*$A11 -> 270 | Q11: =((Q$2/5)+2)*$A11 -> 279 | R11: =((R$2/5)+2)*$A11 -> 288 | S11: =((S$2/5)+2)*$A11 -> 297 | T11: =((T$2/5)+2)*$A11 -> 306 | U11: =((U$2/5)+2)*$A11 -> 315 | V11: =((V$2/5)+2)*$A11 -> 324 | W11: =((W$2/5)+2)*$A11 -> 333 | X11: =((X$2/5)+2)*$A11 -> 342 | Y11: =((Y$2/5)+2)*$A11 -> 351 | Z11: =((Z$2/5)+2)*$A11 -> 360 | AA11: =((AA$2/5)+2)*$A11 -> 369 | AB11: =((AB$2/5)+2)*$A11 -> 378
A12: 10 | B12: =((B$2/5)+2)*$A12 -> 160 | C12: =((C$2/5)+2)*$A12 -> 170 | D12: =((D$2/5)+2)*$A12 -> 180 | E12: =((E$2/5)+2)*$A12 -> 190 | F12: =((F$2/5)+2)*$A12 -> 200 | G12: =((G$2/5)+2)*$A12 -> 210 | H12: =((H$2/5)+2)*$A12 -> 220 | I12: =((I$2/5)+2)*$A12 -> 230 | J12: =((J$2/5)+2)*$A12 -> 240 | K12: =((K$2/5)+2)*$A12 -> 250 | L12: =((L$2/5)+2)*$A12 -> 260 | M12: =((M$2/5)+2)*$A12 -> 270 | N12: =((N$2/5)+2)*$A12 -> 280 | O12: =((O$2/5)+2)*$A12 -> 290 | P12: =((P$2/5)+2)*$A12 -> 300 | Q12: =((Q$2/5)+2)*$A12 -> 310 | R12: =((R$2/5)+2)*$A12 -> 320 | S12: =((S$2/5)+2)*$A12 -> 330 | T12: =((T$2/5)+2)*$A12 -> 340 | U12: =((U$2/5)+2)*$A12 -> 350 | V12: =((V$2/5)+2)*$A12 -> 360 | W12: =((W$2/5)+2)*$A12 -> 370 | X12: =((X$2/5)+2)*$A12 -> 380 | Y12: =((Y$2/5)+2)*$A12 -> 390 | Z12: =((Z$2/5)+2)*$A12 -> 400 | AA12: =((AA$2/5)+2)*$A12 -> 410 | AB12: =((AB$2/5)+2)*$A12 -> 420
A13: 11 | B13: =((B$2/5)+2)*$A13 -> 176 | C13: =((C$2/5)+2)*$A13 -> 187 | D13: =((D$2/5)+2)*$A13 -> 198 | E13: =((E$2/5)+2)*$A13 -> 209 | F13: =((F$2/5)+2)*$A13 -> 220 | G13: =((G$2/5)+2)*$A13 -> 231 | H13: =((H$2/5)+2)*$A13 -> 242 | I13: =((I$2/5)+2)*$A13 -> 253 | J13: =((J$2/5)+2)*$A13 -> 264 | K13: =((K$2/5)+2)*$A13 -> 275 | L13: =((L$2/5)+2)*$A13 -> 286 | M13: =((M$2/5)+2)*$A13 -> 297 | N13: =((N$2/5)+2)*$A13 -> 308 | O13: =((O$2/5)+2)*$A13 -> 319 | P13: =((P$2/5)+2)*$A13 -> 330 | Q13: =((Q$2/5)+2)*$A13 -> 341 | R13: =((R$2/5)+2)*$A13 -> 352 | S13: =((S$2/5)+2)*$A13 -> 363 | T13: =((T$2/5)+2)*$A13 -> 374 | U13: =((U$2/5)+2)*$A13 -> 385 | V13: =((V$2/5)+2)*$A13 -> 396 | W13: =((W$2/5)+2)*$A13 -> 407 | X13: =((X$2/5)+2)*$A13 -> 418 | Y13: =((Y$2/5)+2)*$A13 -> 429 | Z13: =((Z$2/5)+2)*$A13 -> 440 | AA13: =((AA$2/5)+2)*$A13 -> 451 | AB13: =((AB$2/5)+2)*$A13 -> 462
A14: 12 | B14: =((B$2/5)+2)*$A14 -> 192 | C14: =((C$2/5)+2)*$A14 -> 204 | D14: =((D$2/5)+2)*$A14 -> 216 | E14: =((E$2/5)+2)*$A14 -> 228 | F14: =((F$2/5)+2)*$A14 -> 240 | G14: =((G$2/5)+2)*$A14 -> 252 | H14: =((H$2/5)+2)*$A14 -> 264 | I14: =((I$2/5)+2)*$A14 -> 276 | J14: =((J$2/5)+2)*$A14 -> 288 | K14: =((K$2/5)+2)*$A14 -> 300 | L14: =((L$2/5)+2)*$A14 -> 312 | M14: =((M$2/5)+2)*$A14 -> 324 | N14: =((N$2/5)+2)*$A14 -> 336 | O14: =((O$2/5)+2)*$A14 -> 348 | P14: =((P$2/5)+2)*$A14 -> 360 | Q14: =((Q$2/5)+2)*$A14 -> 372 | R14: =((R$2/5)+2)*$A14 -> 384 | S14: =((S$2/5)+2)*$A14 -> 396 | T14: =((T$2/5)+2)*$A14 -> 408 | U14: =((U$2/5)+2)*$A14 -> 420 | V14: =((V$2/5)+2)*$A14 -> 432 | W14: =((W$2/5)+2)*$A14 -> 444 | X14: =((X$2/5)+2)*$A14 -> 456 | Y14: =((Y$2/5)+2)*$A14 -> 468 | Z14: =((Z$2/5)+2)*$A14 -> 480 | AA14: =((AA$2/5)+2)*$A14 -> 492 | AB14: =((AB$2/5)+2)*$A14 -> 504
A15: 13 | B15: =((B$2/5)+2)*$A15 -> 208 | C15: =((C$2/5)+2)*$A15 -> 221 | D15: =((D$2/5)+2)*$A15 -> 234 | E15: =((E$2/5)+2)*$A15 -> 247 | F15: =((F$2/5)+2)*$A15 -> 260 | G15: =((G$2/5)+2)*$A15 -> 273 | H15: =((H$2/5)+2)*$A15 -> 286 | I15: =((I$2/5)+2)*$A15 -> 299 | J15: =((J$2/5)+2)*$A15 -> 312 | K15: =((K$2/5)+2)*$A15 -> 325 | L15: =((L$2/5)+2)*$A15 -> 338 | M15: =((M$2/5)+2)*$A15 -> 351 | N15: =((N$2/5)+2)*$A15 -> 364 | O15: =((O$2/5)+2)*$A15 -> 377 | P15: =((P$2/5)+2)*$A15 -> 390 | Q15: =((Q$2/5)+2)*$A15 -> 403 | R15: =((R$2/5)+2)*$A15 -> 416 | S15: =((S$2/5)+2)*$A15 -> 429 | T15: =((T$2/5)+2)*$A15 -> 442 | U15: =((U$2/5)+2)*$A15 -> 455 | V15: =((V$2/5)+2)*$A15 -> 468 | W15: =((W$2/5)+2)*$A15 -> 481 | X15: =((X$2/5)+2)*$A15 -> 494 | Y15: =((Y$2/5)+2)*$A15 -> 507 | Z15: =((Z$2/5)+2)*$A15 -> 520 | AA15: =((AA$2/5)+2)*$A15 -> 533 | AB15: =((AB$2/5)+2)*$A15 -> 546
A16: 14 | B16: =((B$2/5)+2)*$A16 -> 224 | C16: =((C$2/5)+2)*$A16 -> 238 | D16: =((D$2/5)+2)*$A16 -> 252 | E16: =((E$2/5)+2)*$A16 -> 266 | F16: =((F$2/5)+2)*$A16 -> 280 | G16: =((G$2/5)+2)*$A16 -> 294 | H16: =((H$2/5)+2)*$A16 -> 308 | I16: =((I$2/5)+2)*$A16 -> 322 | J16: =((J$2/5)+2)*$A16 -> 336 | K16: =((K$2/5)+2)*$A16 -> 350 | L16: =((L$2/5)+2)*$A16 -> 364 | M16: =((M$2/5)+2)*$A16 -> 378 | N16: =((N$2/5)+2)*$A16 -> 392 | O16: =((O$2/5)+2)*$A16 -> 406 | P16: =((P$2/5)+2)*$A16 -> 420 | Q16: =((Q$2/5)+2)*$A16 -> 434 | R16: =((R$2/5)+2)*$A16 -> 448 | S16: =((S$2/5)+2)*$A16 -> 462 | T16: =((T$2/5)+2)*$A16 -> 476 | U16: =((U$2/5)+2)*$A16 -> 490 | V16: =((V$2/5)+2)*$A16 -> 504 | W16: =((W$2/5)+2)*$A16 -> 518 | X16: =((X$2/5)+2)*$A16 -> 532 | Y16: =((Y$2/5)+2)*$A16 -> 546 | Z16: =((Z$2/5)+2)*$A16 -> 560 | AA16: =((AA$2/5)+2)*$A16 -> 574 | AB16: =((AB$2/5)+2)*$A16 -> 588
A17: 15 | B17: =((B$2/5)+2)*$A17 -> 240 | C17: =((C$2/5)+2)*$A17 -> 255 | D17: =((D$2/5)+2)*$A17 -> 270 | E17: =((E$2/5)+2)*$A17 -> 285 | F17: =((F$2/5)+2)*$A17 -> 300 | G17: =((G$2/5)+2)*$A17 -> 315 | H17: =((H$2/5)+2)*$A17 -> 330 | I17: =((I$2/5)+2)*$A17 -> 345 | J17: =((J$2/5)+2)*$A17 -> 360 | K17: =((K$2/5)+2)*$A17 -> 375 | L17: =((L$2/5)+2)*$A17 -> 390 | M17: =((M$2/5)+2)*$A17 -> 405 | N17: =((N$2/5)+2)*$A17 -> 420 | O17: =((O$2/5)+2)*$A17 -> 435 | P17: =((P$2/5)+2)*$A17 -> 450 | Q17: =((Q$2/5)+2)*$A17 -> 465 | R17: =((R$2/5)+2)*$A17 -> 480 | S17: =((S$2/5)+2)*$A17 -> 495 | T17: =((T$2/5)+2)*$A17 -> 510 | U17: =((U$2/5)+2)*$A17 -> 525 | V17: =((V$2/5)+2)*$A17 -> 540 | W17: =((W$2/5)+2)*$A17 -> 555 | X17: =((X$2/5)+2)*$A17 -> 570 | Y17: =((Y$2/5)+2)*$A17 -> 585 | Z17: =((Z$2/5)+2)*$A17 -> 600 | AA17: =((AA$2/5)+2)*$A17 -> 615 | AB17: =((AB$2/5)+2)*$A17 -> 630
A18: 16 | B18: =((B$2/5)+2)*$A18 -> 256 | C18: =((C$2/5)+2)*$A18 -> 272 | D18: =((D$2/5)+2)*$A18 -> 288 | E18: =((E$2/5)+2)*$A18 -> 304 | F18: =((F$2/5)+2)*$A18 -> 320 | G18: =((G$2/5)+2)*$A18 -> 336 | H18: =((H$2/5)+2)*$A18 -> 352 | I18: =((I$2/5)+2)*$A18 -> 368 | J18: =((J$2/5)+2)*$A18 -> 384 | K18: =((K$2/5)+2)*$A18 -> 400 | L18: =((L$2/5)+2)*$A18 -> 416 | M18: =((M$2/5)+2)*$A18 -> 432 | N18: =((N$2/5)+2)*$A18 -> 448 | O18: =((O$2/5)+2)*$A18 -> 464 | P18: =((P$2/5)+2)*$A18 -> 480 | Q18: =((Q$2/5)+2)*$A18 -> 496 | R18: =((R$2/5)+2)*$A18 -> 512 | S18: =((S$2/5)+2)*$A18 -> 528 | T18: =((T$2/5)+2)*$A18 -> 544 | U18: =((U$2/5)+2)*$A18 -> 560 | V18: =((V$2/5)+2)*$A18 -> 576 | W18: =((W$2/5)+2)*$A18 -> 592 | X18: =((X$2/5)+2)*$A18 -> 608 | Y18: =((Y$2/5)+2)*$A18 -> 624 | Z18: =((Z$2/5)+2)*$A18 -> 640 | AA18: =((AA$2/5)+2)*$A18 -> 656 | AB18: =((AB$2/5)+2)*$A18 -> 672
A19: 17 | B19: =((B$2/5)+2)*$A19 -> 272 | C19: =((C$2/5)+2)*$A19 -> 289 | D19: =((D$2/5)+2)*$A19 -> 306 | E19: =((E$2/5)+2)*$A19 -> 323 | F19: =((F$2/5)+2)*$A19 -> 340 | G19: =((G$2/5)+2)*$A19 -> 357 | H19: =((H$2/5)+2)*$A19 -> 374 | I19: =((I$2/5)+2)*$A19 -> 391 | J19: =((J$2/5)+2)*$A19 -> 408 | K19: =((K$2/5)+2)*$A19 -> 425 | L19: =((L$2/5)+2)*$A19 -> 442 | M19: =((M$2/5)+2)*$A19 -> 459 | N19: =((N$2/5)+2)*$A19 -> 476 | O19: =((O$2/5)+2)*$A19 -> 493 | P19: =((P$2/5)+2)*$A19 -> 510 | Q19: =((Q$2/5)+2)*$A19 -> 527 | R19: =((R$2/5)+2)*$A19 -> 544 | S19: =((S$2/5)+2)*$A19 -> 561 | T19: =((T$2/5)+2)*$A19 -> 578 | U19: =((U$2/5)+2)*$A19 -> 595 | V19: =((V$2/5)+2)*$A19 -> 612 | W19: =((W$2/5)+2)*$A19 -> 629 | X19: =((X$2/5)+2)*$A19 -> 646 | Y19: =((Y$2/5)+2)*$A19 -> 663 | Z19: =((Z$2/5)+2)*$A19 -> 680 | AA19: =((AA$2/5)+2)*$A19 -> 697 | AB19: =((AB$2/5)+2)*$A19 -> 714
A20: 18 | B20: =((B$2/5)+2)*$A20 -> 288 | C20: =((C$2/5)+2)*$A20 -> 306 | D20: =((D$2/5)+2)*$A20 -> 324 | E20: =((E$2/5)+2)*$A20 -> 342 | F20: =((F$2/5)+2)*$A20 -> 360 | G20: =((G$2/5)+2)*$A20 -> 378 | H20: =((H$2/5)+2)*$A20 -> 396 | I20: =((I$2/5)+2)*$A20 -> 414 | J20: =((J$2/5)+2)*$A20 -> 432 | K20: =((K$2/5)+2)*$A20 -> 450 | L20: =((L$2/5)+2)*$A20 -> 468 | M20: =((M$2/5)+2)*$A20 -> 486 | N20: =((N$2/5)+2)*$A20 -> 504 | O20: =((O$2/5)+2)*$A20 -> 522 | P20: =((P$2/5)+2)*$A20 -> 540 | Q20: =((Q$2/5)+2)*$A20 -> 558 | R20: =((R$2/5)+2)*$A20 -> 576 | S20: =((S$2/5)+2)*$A20 -> 594 | T20: =((T$2/5)+2)*$A20 -> 612 | U20: =((U$2/5)+2)*$A20 -> 630 | V20: =((V$2/5)+2)*$A20 -> 648 | W20: =((W$2/5)+2)*$A20 -> 666 | X20: =((X$2/5)+2)*$A20 -> 684 | Y20: =((Y$2/5)+2)*$A20 -> 702 | Z20: =((Z$2/5)+2)*$A20 -> 720 | AA20: =((AA$2/5)+2)*$A20 -> 738 | AB20: =((AB$2/5)+2)*$A20 -> 756
A21: 19 | B21: =((B$2/5)+2)*$A21 -> 304 | C21: =((C$2/5)+2)*$A21 -> 323 | D21: =((D$2/5)+2)*$A21 -> 342 | E21: =((E$2/5)+2)*$A21 -> 361 | F21: =((F$2/5)+2)*$A21 -> 380 | G21: =((G$2/5)+2)*$A21 -> 399 | H21: =((H$2/5)+2)*$A21 -> 418 | I21: =((I$2/5)+2)*$A21 -> 437 | J21: =((J$2/5)+2)*$A21 -> 456 | K21: =((K$2/5)+2)*$A21 -> 475 | L21: =((L$2/5)+2)*$A21 -> 494 | M21: =((M$2/5)+2)*$A21 -> 513 | N21: =((N$2/5)+2)*$A21 -> 532 | O21: =((O$2/5)+2)*$A21 -> 551 | P21: =((P$2/5)+2)*$A21 -> 570 | Q21: =((Q$2/5)+2)*$A21 -> 589 | R21: =((R$2/5)+2)*$A21 -> 608 | S21: =((S$2/5)+2)*$A21 -> 627 | T21: =((T$2/5)+2)*$A21 -> 646 | U21: =((U$2/5)+2)*$A21 -> 665 | V21: =((V$2/5)+2)*$A21 -> 684 | W21: =((W$2/5)+2)*$A21 -> 703 | X21: =((X$2/5)+2)*$A21 -> 722 | Y21: =((Y$2/5)+2)*$A21 -> 741 | Z21: =((Z$2/5)+2)*$A21 -> 760 | AA21: =((AA$2/5)+2)*$A21 -> 779 | AB21: =((AB$2/5)+2)*$A21 -> 798
A22: 20 | B22: =((B$2/5)+2)*$A22 -> 320 | C22: =((C$2/5)+2)*$A22 -> 340 | D22: =((D$2/5)+2)*$A22 -> 360 | E22: =((E$2/5)+2)*$A22 -> 380 | F22: =((F$2/5)+2)*$A22 -> 400 | G22: =((G$2/5)+2)*$A22 -> 420 | H22: =((H$2/5)+2)*$A22 -> 440 | I22: =((I$2/5)+2)*$A22 -> 460 | J22: =((J$2/5)+2)*$A22 -> 480 | K22: =((K$2/5)+2)*$A22 -> 500 | L22: =((L$2/5)+2)*$A22 -> 520 | M22: =((M$2/5)+2)*$A22 -> 540 | N22: =((N$2/5)+2)*$A22 -> 560 | O22: =((O$2/5)+2)*$A22 -> 580 | P22: =((P$2/5)+2)*$A22 -> 600 | Q22: =((Q$2/5)+2)*$A22 -> 620 | R22: =((R$2/5)+2)*$A22 -> 640 | S22: =((S$2/5)+2)*$A22 -> 660 | T22: =((T$2/5)+2)*$A22 -> 680 | U22: =((U$2/5)+2)*$A22 -> 700 | V22: =((V$2/5)+2)*$A22 -> 720 | W22: =((W$2/5)+2)*$A22 -> 740 | X22: =((X$2/5)+2)*$A22 -> 760 | Y22: =((Y$2/5)+2)*$A22 -> 780 | Z22: =((Z$2/5)+2)*$A22 -> 800 | AA22: =((AA$2/5)+2)*$A22 -> 820 | AB22: =((AB$2/5)+2)*$A22 -> 840
A23: 21 | B23: =((B$2/5)+2)*$A23 -> 336 | C23: =((C$2/5)+2)*$A23 -> 357 | D23: =((D$2/5)+2)*$A23 -> 378 | E23: =((E$2/5)+2)*$A23 -> 399 | F23: =((F$2/5)+2)*$A23 -> 420 | G23: =((G$2/5)+2)*$A23 -> 441 | H23: =((H$2/5)+2)*$A23 -> 462 | I23: =((I$2/5)+2)*$A23 -> 483 | J23: =((J$2/5)+2)*$A23 -> 504 | K23: =((K$2/5)+2)*$A23 -> 525 | L23: =((L$2/5)+2)*$A23 -> 546 | M23: =((M$2/5)+2)*$A23 -> 567 | N23: =((N$2/5)+2)*$A23 -> 588 | O23: =((O$2/5)+2)*$A23 -> 609 | P23: =((P$2/5)+2)*$A23 -> 630 | Q23: =((Q$2/5)+2)*$A23 -> 651 | R23: =((R$2/5)+2)*$A23 -> 672 | S23: =((S$2/5)+2)*$A23 -> 693 | T23: =((T$2/5)+2)*$A23 -> 714 | U23: =((U$2/5)+2)*$A23 -> 735 | V23: =((V$2/5)+2)*$A23 -> 756 | W23: =((W$2/5)+2)*$A23 -> 777 | X23: =((X$2/5)+2)*$A23 -> 798 | Y23: =((Y$2/5)+2)*$A23 -> 819 | Z23: =((Z$2/5)+2)*$A23 -> 840 | AA23: =((AA$2/5)+2)*$A23 -> 861 | AB23: =((AB$2/5)+2)*$A23 -> 882
A24: 22 | B24: =((B$2/5)+2)*$A24 -> 352 | C24: =((C$2/5)+2)*$A24 -> 374 | D24: =((D$2/5)+2)*$A24 -> 396 | E24: =((E$2/5)+2)*$A24 -> 418 | F24: =((F$2/5)+2)*$A24 -> 440 | G24: =((G$2/5)+2)*$A24 -> 462 | H24: =((H$2/5)+2)*$A24 -> 484 | I24: =((I$2/5)+2)*$A24 -> 506 | J24: =((J$2/5)+2)*$A24 -> 528 | K24: =((K$2/5)+2)*$A24 -> 550 | L24: =((L$2/5)+2)*$A24 -> 572 | M24: =((M$2/5)+2)*$A24 -> 594 | N24: =((N$2/5)+2)*$A24 -> 616 | O24: =((O$2/5)+2)*$A24 -> 638 | P24: =((P$2/5)+2)*$A24 -> 660 | Q24: =((Q$2/5)+2)*$A24 -> 682 | R24: =((R$2/5)+2)*$A24 -> 704 | S24: =((S$2/5)+2)*$A24 -> 726 | T24: =((T$2/5)+2)*$A24 -> 748 | U24: =((U$2/5)+2)*$A24 -> 770 | V24: =((V$2/5)+2)*$A24 -> 792 | W24: =((W$2/5)+2)*$A24 -> 814 | X24: =((X$2/5)+2)*$A24 -> 836 | Y24: =((Y$2/5)+2)*$A24 -> 858 | Z24: =((Z$2/5)+2)*$A24 -> 880 | AA24: =((AA$2/5)+2)*$A24 -> 902 | AB24: =((AB$2/5)+2)*$A24 -> 924
A25: 23 | B25: =((B$2/5)+2)*$A25 -> 368 | C25: =((C$2/5)+2)*$A25 -> 391 | D25: =((D$2/5)+2)*$A25 -> 414 | E25: =((E$2/5)+2)*$A25 -> 437 | F25: =((F$2/5)+2)*$A25 -> 460 | G25: =((G$2/5)+2)*$A25 -> 483 | H25: =((H$2/5)+2)*$A25 -> 506 | I25: =((I$2/5)+2)*$A25 -> 529 | J25: =((J$2/5)+2)*$A25 -> 552 | K25: =((K$2/5)+2)*$A25 -> 575 | L25: =((L$2/5)+2)*$A25 -> 598 | M25: =((M$2/5)+2)*$A25 -> 621 | N25: =((N$2/5)+2)*$A25 -> 644 | O25: =((O$2/5)+2)*$A25 -> 667 | P25: =((P$2/5)+2)*$A25 -> 690 | Q25: =((Q$2/5)+2)*$A25 -> 713 | R25: =((R$2/5)+2)*$A25 -> 736 | S25: =((S$2/5)+2)*$A25 -> 759 | T25: =((T$2/5)+2)*$A25 -> 782 | U25: =((U$2/5)+2)*$A25 -> 805 | V25: =((V$2/5)+2)*$A25 -> 828 | W25: =((W$2/5)+2)*$A25 -> 851 | X25: =((X$2/5)+2)*$A25 -> 874 | Y25: =((Y$2/5)+2)*$A25 -> 897 | Z25: =((Z$2/5)+2)*$A25 -> 920 | AA25: =((AA$2/5)+2)*$A25 -> 943 | AB25: =((AB$2/5)+2)*$A25 -> 966
A26: 24 | B26: =((B$2/5)+2)*$A26 -> 384 | C26: =((C$2/5)+2)*$A26 -> 408 | D26: =((D$2/5)+2)*$A26 -> 432 | E26: =((E$2/5)+2)*$A26 -> 456 | F26: =((F$2/5)+2)*$A26 -> 480 | G26: =((G$2/5)+2)*$A26 -> 504 | H26: =((H$2/5)+2)*$A26 -> 528 | I26: =((I$2/5)+2)*$A26 -> 552 | J26: =((J$2/5)+2)*$A26 -> 576 | K26: =((K$2/5)+2)*$A26 -> 600 | L26: =((L$2/5)+2)*$A26 -> 624 | M26: =((M$2/5)+2)*$A26 -> 648 | N26: =((N$2/5)+2)*$A26 -> 672 | O26: =((O$2/5)+2)*$A26 -> 696 | P26: =((P$2/5)+2)*$A26 -> 720 | Q26: =((Q$2/5)+2)*$A26 -> 744 | R26: =((R$2/5)+2)*$A26 -> 768 | S26: =((S$2/5)+2)*$A26 -> 792 | T26: =((T$2/5)+2)*$A26 -> 816 | U26: =((U$2/5)+2)*$A26 -> 840 | V26: =((V$2/5)+2)*$A26 -> 864 | W26: =((W$2/5)+2)*$A26 -> 888 | X26: =((X$2/5)+2)*$A26 -> 912 | Y26: =((Y$2/5)+2)*$A26 -> 936 | Z26: =((Z$2/5)+2)*$A26 -> 960 | AA26: =((AA$2/5)+2)*$A26 -> 984 | AB26: =((AB$2/5)+2)*$A26 -> 1008
A27: 25 | B27: =((B$2/5)+2)*$A27 -> 400 | C27: =((C$2/5)+2)*$A27 -> 425 | D27: =((D$2/5)+2)*$A27 -> 450 | E27: =((E$2/5)+2)*$A27 -> 475 | F27: =((F$2/5)+2)*$A27 -> 500 | G27: =((G$2/5)+2)*$A27 -> 525 | H27: =((H$2/5)+2)*$A27 -> 550 | I27: =((I$2/5)+2)*$A27 -> 575 | J27: =((J$2/5)+2)*$A27 -> 600 | K27: =((K$2/5)+2)*$A27 -> 625 | L27: =((L$2/5)+2)*$A27 -> 650 | M27: =((M$2/5)+2)*$A27 -> 675 | N27: =((N$2/5)+2)*$A27 -> 700 | O27: =((O$2/5)+2)*$A27 -> 725 | P27: =((P$2/5)+2)*$A27 -> 750 | Q27: =((Q$2/5)+2)*$A27 -> 775 | R27: =((R$2/5)+2)*$A27 -> 800 | S27: =((S$2/5)+2)*$A27 -> 825 | T27: =((T$2/5)+2)*$A27 -> 850 | U27: =((U$2/5)+2)*$A27 -> 875 | V27: =((V$2/5)+2)*$A27 -> 900 | W27: =((W$2/5)+2)*$A27 -> 925 | X27: =((X$2/5)+2)*$A27 -> 950 | Y27: =((Y$2/5)+2)*$A27 -> 975 | Z27: =((Z$2/5)+2)*$A27 -> 1000 | AA27: =((AA$2/5)+2)*$A27 -> 1025 | AB27: =((AB$2/5)+2)*$A27 -> 1050
A28: 26 | B28: =((B$2/5)+2)*$A28 -> 416 | C28: =((C$2/5)+2)*$A28 -> 442 | D28: =((D$2/5)+2)*$A28 -> 468 | E28: =((E$2/5)+2)*$A28 -> 494 | F28: =((F$2/5)+2)*$A28 -> 520 | G28: =((G$2/5)+2)*$A28 -> 546 | H28: =((H$2/5)+2)*$A28 -> 572 | I28: =((I$2/5)+2)*$A28 -> 598 | J28: =((J$2/5)+2)*$A28 -> 624 | K28: =((K$2/5)+2)*$A28 -> 650 | L28: =((L$2/5)+2)*$A28 -> 676 | M28: =((M$2/5)+2)*$A28 -> 702 | N28: =((N$2/5)+2)*$A28 -> 728 | O28: =((O$2/5)+2)*$A28 -> 754 | P28: =((P$2/5)+2)*$A28 -> 780 | Q28: =((Q$2/5)+2)*$A28 -> 806 | R28: =((R$2/5)+2)*$A28 -> 832 | S28: =((S$2/5)+2)*$A28 -> 858 | T28: =((T$2/5)+2)*$A28 -> 884 | U28: =((U$2/5)+2)*$A28 -> 910 | V28: =((V$2/5)+2)*$A28 -> 936 | W28: =((W$2/5)+2)*$A28 -> 962 | X28: =((X$2/5)+2)*$A28 -> 988 | Y28: =((Y$2/5)+2)*$A28 -> 1014 | Z28: =((Z$2/5)+2)*$A28 -> 1040 | AA28: =((AA$2/5)+2)*$A28 -> 1066 | AB28: =((AB$2/5)+2)*$A28 -> 1092
A29: 27 | B29: =((B$2/5)+2)*$A29 -> 432 | C29: =((C$2/5)+2)*$A29 -> 459 | D29: =((D$2/5)+2)*$A29 -> 486 | E29: =((E$2/5)+2)*$A29 -> 513 | F29: =((F$2/5)+2)*$A29 -> 540 | G29: =((G$2/5)+2)*$A29 -> 567 | H29: =((H$2/5)+2)*$A29 -> 594 | I29: =((I$2/5)+2)*$A29 -> 621 | J29: =((J$2/5)+2)*$A29 -> 648 | K29: =((K$2/5)+2)*$A29 -> 675 | L29: =((L$2/5)+2)*$A29 -> 702 | M29: =((M$2/5)+2)*$A29 -> 729 | N29: =((N$2/5)+2)*$A29 -> 756 | O29: =((O$2/5)+2)*$A29 -> 783 | P29: =((P$2/5)+2)*$A29 -> 810 | Q29: =((Q$2/5)+2)*$A29 -> 837 | R29: =((R$2/5)+2)*$A29 -> 864 | S29: =((S$2/5)+2)*$A29 -> 891 | T29: =((T$2/5)+2)*$A29 -> 918 | U29: =((U$2/5)+2)*$A29 -> 945 | V29: =((V$2/5)+2)*$A29 -> 972 | W29: =((W$2/5)+2)*$A29 -> 999 | X29: =((X$2/5)+2)*$A29 -> 1026 | Y29: =((Y$2/5)+2)*$A29 -> 1053 | Z29: =((Z$2/5)+2)*$A29 -> 1080 | AA29: =((AA$2/5)+2)*$A29 -> 1107 | AB29: =((AB$2/5)+2)*$A29 -> 1134
A30: 28 | B30: =((B$2/5)+2)*$A30 -> 448 | C30: =((C$2/5)+2)*$A30 -> 476 | D30: =((D$2/5)+2)*$A30 -> 504 | E30: =((E$2/5)+2)*$A30 -> 532 | F30: =((F$2/5)+2)*$A30 -> 560 | G30: =((G$2/5)+2)*$A30 -> 588 | H30: =((H$2/5)+2)*$A30 -> 616 | I30: =((I$2/5)+2)*$A30 -> 644 | J30: =((J$2/5)+2)*$A30 -> 672 | K30: =((K$2/5)+2)*$A30 -> 700 | L30: =((L$2/5)+2)*$A30 -> 728 | M30: =((M$2/5)+2)*$A30 -> 756 | N30: =((N$2/5)+2)*$A30 -> 784 | O30: =((O$2/5)+2)*$A30 -> 812 | P30: =((P$2/5)+2)*$A30 -> 840 | Q30: =((Q$2/5)+2)*$A30 -> 868 | R30: =((R$2/5)+2)*$A30 -> 896 | S30: =((S$2/5)+2)*$A30 -> 924 | T30: =((T$2/5)+2)*$A30 -> 952 | U30: =((U$2/5)+2)*$A30 -> 980 | V30: =((V$2/5)+2)*$A30 -> 1008 | W30: =((W$2/5)+2)*$A30 -> 1036 | X30: =((X$2/5)+2)*$A30 -> 1064 | Y30: =((Y$2/5)+2)*$A30 -> 1092 | Z30: =((Z$2/5)+2)*$A30 -> 1120 | AA30: =((AA$2/5)+2)*$A30 -> 1148 | AB30: =((AB$2/5)+2)*$A30 -> 1176
A31: 29 | B31: =((B$2/5)+2)*$A31 -> 464 | C31: =((C$2/5)+2)*$A31 -> 493 | D31: =((D$2/5)+2)*$A31 -> 522 | E31: =((E$2/5)+2)*$A31 -> 551 | F31: =((F$2/5)+2)*$A31 -> 580 | G31: =((G$2/5)+2)*$A31 -> 609 | H31: =((H$2/5)+2)*$A31 -> 638 | I31: =((I$2/5)+2)*$A31 -> 667 | J31: =((J$2/5)+2)*$A31 -> 696 | K31: =((K$2/5)+2)*$A31 -> 725 | L31: =((L$2/5)+2)*$A31 -> 754 | M31: =((M$2/5)+2)*$A31 -> 783 | N31: =((N$2/5)+2)*$A31 -> 812 | O31: =((O$2/5)+2)*$A31 -> 841 | P31: =((P$2/5)+2)*$A31 -> 870 | Q31: =((Q$2/5)+2)*$A31 -> 899 | R31: =((R$2/5)+2)*$A31 -> 928 | S31: =((S$2/5)+2)*$A31 -> 957 | T31: =((T$2/5)+2)*$A31 -> 986 | U31: =((U$2/5)+2)*$A31 -> 1015 | V31: =((V$2/5)+2)*$A31 -> 1044 | W31: =((W$2/5)+2)*$A31 -> 1073 | X31: =((X$2/5)+2)*$A31 -> 1102 | Y31: =((Y$2/5)+2)*$A31 -> 1131 | Z31: =((Z$2/5)+2)*$A31 -> 1160 | AA31: =((AA$2/5)+2)*$A31 -> 1189 | AB31: =((AB$2/5)+2)*$A31 -> 1218
A32: 30 | B32: =((B$2/5)+2)*$A32 -> 480 | C32: =((C$2/5)+2)*$A32 -> 510 | D32: =((D$2/5)+2)*$A32 -> 540 | E32: =((E$2/5)+2)*$A32 -> 570 | F32: =((F$2/5)+2)*$A32 -> 600 | G32: =((G$2/5)+2)*$A32 -> 630 | H32: =((H$2/5)+2)*$A32 -> 660 | I32: =((I$2/5)+2)*$A32 -> 690 | J32: =((J$2/5)+2)*$A32 -> 720 | K32: =((K$2/5)+2)*$A32 -> 750 | L32: =((L$2/5)+2)*$A32 -> 780 | M32: =((M$2/5)+2)*$A32 -> 810 | N32: =((N$2/5)+2)*$A32 -> 840 | O32: =((O$2/5)+2)*$A32 -> 870 | P32: =((P$2/5)+2)*$A32 -> 900 | Q32: =((Q$2/5)+2)*$A32 -> 930 | R32: =((R$2/5)+2)*$A32 -> 960 | S32: =((S$2/5)+2)*$A32 -> 990 | T32: =((T$2/5)+2)*$A32 -> 1020 | U32: =((U$2/5)+2)*$A32 -> 1050 | V32: =((V$2/5)+2)*$A32 -> 1080 | W32: =((W$2/5)+2)*$A32 -> 1110 | X32: =((X$2/5)+2)*$A32 -> 1140 | Y32: =((Y$2/5)+2)*$A32 -> 1170 | Z32: =((Z$2/5)+2)*$A32 -> 1200 | AA32: =((AA$2/5)+2)*$A32 -> 1230 | AB32: =((AB$2/5)+2)*$A32 -> 1260
A33: 31 | B33: =((B$2/5)+2)*$A33 -> 496 | C33: =((C$2/5)+2)*$A33 -> 527 | D33: =((D$2/5)+2)*$A33 -> 558 | E33: =((E$2/5)+2)*$A33 -> 589 | F33: =((F$2/5)+2)*$A33 -> 620 | G33: =((G$2/5)+2)*$A33 -> 651 | H33: =((H$2/5)+2)*$A33 -> 682 | I33: =((I$2/5)+2)*$A33 -> 713 | J33: =((J$2/5)+2)*$A33 -> 744 | K33: =((K$2/5)+2)*$A33 -> 775 | L33: =((L$2/5)+2)*$A33 -> 806 | M33: =((M$2/5)+2)*$A33 -> 837 | N33: =((N$2/5)+2)*$A33 -> 868 | O33: =((O$2/5)+2)*$A33 -> 899 | P33: =((P$2/5)+2)*$A33 -> 930 | Q33: =((Q$2/5)+2)*$A33 -> 961 | R33: =((R$2/5)+2)*$A33 -> 992 | S33: =((S$2/5)+2)*$A33 -> 1023 | T33: =((T$2/5)+2)*$A33 -> 1054 | U33: =((U$2/5)+2)*$A33 -> 1085 | V33: =((V$2/5)+2)*$A33 -> 1116 | W33: =((W$2/5)+2)*$A33 -> 1147 | X33: =((X$2/5)+2)*$A33 -> 1178 | Y33: =((Y$2/5)+2)*$A33 -> 1209 | Z33: =((Z$2/5)+2)*$A33 -> 1240 | AA33: =((AA$2/5)+2)*$A33 -> 1271 | AB33: =((AB$2/5)+2)*$A33 -> 1302
A34: 32 | B34: =((B$2/5)+2)*$A34 -> 512 | C34: =((C$2/5)+2)*$A34 -> 544 | D34: =((D$2/5)+2)*$A34 -> 576 | E34: =((E$2/5)+2)*$A34 -> 608 | F34: =((F$2/5)+2)*$A34 -> 640 | G34: =((G$2/5)+2)*$A34 -> 672 | H34: =((H$2/5)+2)*$A34 -> 704 | I34: =((I$2/5)+2)*$A34 -> 736 | J34: =((J$2/5)+2)*$A34 -> 768 | K34: =((K$2/5)+2)*$A34 -> 800 | L34: =((L$2/5)+2)*$A34 -> 832 | M34: =((M$2/5)+2)*$A34 -> 864 | N34: =((N$2/5)+2)*$A34 -> 896 | O34: =((O$2/5)+2)*$A34 -> 928 | P34: =((P$2/5)+2)*$A34 -> 960 | Q34: =((Q$2/5)+2)*$A34 -> 992 | R34: =((R$2/5)+2)*$A34 -> 1024 | S34: =((S$2/5)+2)*$A34 -> 1056 | T34: =((T$2/5)+2)*$A34 -> 1088 | U34: =((U$2/5)+2)*$A34 -> 1120 | V34: =((V$2/5)+2)*$A34 -> 1152 | W34: =((W$2/5)+2)*$A34 -> 1184 | X34: =((X$2/5)+2)*$A34 -> 1216 | Y34: =((Y$2/5)+2)*$A34 -> 1248 | Z34: =((Z$2/5)+2)*$A34 -> 1280 | AA34: =((AA$2/5)+2)*$A34 -> 1312 | AB34: =((AB$2/5)+2)*$A34 -> 1344
A35: 33 | B35: =((B$2/5)+2)*$A35 -> 528 | C35: =((C$2/5)+2)*$A35 -> 561 | D35: =((D$2/5)+2)*$A35 -> 594 | E35: =((E$2/5)+2)*$A35 -> 627 | F35: =((F$2/5)+2)*$A35 -> 660 | G35: =((G$2/5)+2)*$A35 -> 693 | H35: =((H$2/5)+2)*$A35 -> 726 | I35: =((I$2/5)+2)*$A35 -> 759 | J35: =((J$2/5)+2)*$A35 -> 792 | K35: =((K$2/5)+2)*$A35 -> 825 | L35: =((L$2/5)+2)*$A35 -> 858 | M35: =((M$2/5)+2)*$A35 -> 891 | N35: =((N$2/5)+2)*$A35 -> 924 | O35: =((O$2/5)+2)*$A35 -> 957 | P35: =((P$2/5)+2)*$A35 -> 990 | Q35: =((Q$2/5)+2)*$A35 -> 1023 | R35: =((R$2/5)+2)*$A35 -> 1056 | S35: =((S$2/5)+2)*$A35 -> 1089 | T35: =((T$2/5)+2)*$A35 -> 1122 | U35: =((U$2/5)+2)*$A35 -> 1155 | V35: =((V$2/5)+2)*$A35 -> 1188 | W35: =((W$2/5)+2)*$A35 -> 1221 | X35: =((X$2/5)+2)*$A35 -> 1254 | Y35: =((Y$2/5)+2)*$A35 -> 1287 | Z35: =((Z$2/5)+2)*$A35 -> 1320 | AA35: =((AA$2/5)+2)*$A35 -> 1353 | AB35: =((AB$2/5)+2)*$A35 -> 1386
A36: 34 | B36: =((B$2/5)+2)*$A36 -> 544 | C36: =((C$2/5)+2)*$A36 -> 578 | D36: =((D$2/5)+2)*$A36 -> 612 | E36: =((E$2/5)+2)*$A36 -> 646 | F36: =((F$2/5)+2)*$A36 -> 680 | G36: =((G$2/5)+2)*$A36 -> 714 | H36: =((H$2/5)+2)*$A36 -> 748 | I36: =((I$2/5)+2)*$A36 -> 782 | J36: =((J$2/5)+2)*$A36 -> 816 | K36: =((K$2/5)+2)*$A36 -> 850 | L36: =((L$2/5)+2)*$A36 -> 884 | M36: =((M$2/5)+2)*$A36 -> 918 | N36: =((N$2/5)+2)*$A36 -> 952 | O36: =((O$2/5)+2)*$A36 -> 986 | P36: =((P$2/5)+2)*$A36 -> 1020 | Q36: =((Q$2/5)+2)*$A36 -> 1054 | R36: =((R$2/5)+2)*$A36 -> 1088 | S36: =((S$2/5)+2)*$A36 -> 1122 | T36: =((T$2/5)+2)*$A36 -> 1156 | U36: =((U$2/5)+2)*$A36 -> 1190 | V36: =((V$2/5)+2)*$A36 -> 1224 | W36: =((W$2/5)+2)*$A36 -> 1258 | X36: =((X$2/5)+2)*$A36 -> 1292 | Y36: =((Y$2/5)+2)*$A36 -> 1326 | Z36: =((Z$2/5)+2)*$A36 -> 1360 | AA36: =((AA$2/5)+2)*$A36 -> 1394 | AB36: =((AB$2/5)+2)*$A36 -> 1428
A37: 35 | B37: =((B$2/5)+2)*$A37 -> 560 | C37: =((C$2/5)+2)*$A37 -> 595 | D37: =((D$2/5)+2)*$A37 -> 630 | E37: =((E$2/5)+2)*$A37 -> 665 | F37: =((F$2/5)+2)*$A37 -> 700 | G37: =((G$2/5)+2)*$A37 -> 735 | H37: =((H$2/5)+2)*$A37 -> 770 | I37: =((I$2/5)+2)*$A37 -> 805 | J37: =((J$2/5)+2)*$A37 -> 840 | K37: =((K$2/5)+2)*$A37 -> 875 | L37: =((L$2/5)+2)*$A37 -> 910 | M37: =((M$2/5)+2)*$A37 -> 945 | N37: =((N$2/5)+2)*$A37 -> 980 | O37: =((O$2/5)+2)*$A37 -> 1015 | P37: =((P$2/5)+2)*$A37 -> 1050 | Q37: =((Q$2/5)+2)*$A37 -> 1085 | R37: =((R$2/5)+2)*$A37 -> 1120 | S37: =((S$2/5)+2)*$A37 -> 1155 | T37: =((T$2/5)+2)*$A37 -> 1190 | U37: =((U$2/5)+2)*$A37 -> 1225 | V37: =((V$2/5)+2)*$A37 -> 1260 | W37: =((W$2/5)+2)*$A37 -> 1295 | X37: =((X$2/5)+2)*$A37 -> 1330 | Y37: =((Y$2/5)+2)*$A37 -> 1365 | Z37: =((Z$2/5)+2)*$A37 -> 1400 | AA37: =((AA$2/5)+2)*$A37 -> 1435 | AB37: =((AB$2/5)+2)*$A37 -> 1470
A38: 36 | B38: =((B$2/5)+2)*$A38 -> 576 | C38: =((C$2/5)+2)*$A38 -> 612 | D38: =((D$2/5)+2)*$A38 -> 648 | E38: =((E$2/5)+2)*$A38 -> 684 | F38: =((F$2/5)+2)*$A38 -> 720 | G38: =((G$2/5)+2)*$A38 -> 756 | H38: =((H$2/5)+2)*$A38 -> 792 | I38: =((I$2/5)+2)*$A38 -> 828 | J38: =((J$2/5)+2)*$A38 -> 864 | K38: =((K$2/5)+2)*$A38 -> 900 | L38: =((L$2/5)+2)*$A38 -> 936 | M38: =((M$2/5)+2)*$A38 -> 972 | N38: =((N$2/5)+2)*$A38 -> 1008 | O38: =((O$2/5)+2)*$A38 -> 1044 | P38: =((P$2/5)+2)*$A38 -> 1080 | Q38: =((Q$2/5)+2)*$A38 -> 1116 | R38: =((R$2/5)+2)*$A38 -> 1152 | S38: =((S$2/5)+2)*$A38 -> 1188 | T38: =((T$2/5)+2)*$A38 -> 1224 | U38: =((U$2/5)+2)*$A38 -> 1260 | V38: =((V$2/5)+2)*$A38 -> 1296 | W38: =((W$2/5)+2)*$A38 -> 1332 | X38: =((X$2/5)+2)*$A38 -> 1368 | Y38: =((Y$2/5)+2)*$A38 -> 1404 | Z38: =((Z$2/5)+2)*$A38 -> 1440 | AA38: =((AA$2/5)+2)*$A38 -> 1476 | AB38: =((AB$2/5)+2)*$A38 -> 1512
A39: 37 | B39: =((B$2/5)+2)*$A39 -> 592 | C39: =((C$2/5)+2)*$A39 -> 629 | D39: =((D$2/5)+2)*$A39 -> 666 | E39: =((E$2/5)+2)*$A39 -> 703 | F39: =((F$2/5)+2)*$A39 -> 740 | G39: =((G$2/5)+2)*$A39 -> 777 | H39: =((H$2/5)+2)*$A39 -> 814 | I39: =((I$2/5)+2)*$A39 -> 851 | J39: =((J$2/5)+2)*$A39 -> 888 | K39: =((K$2/5)+2)*$A39 -> 925 | L39: =((L$2/5)+2)*$A39 -> 962 | M39: =((M$2/5)+2)*$A39 -> 999 | N39: =((N$2/5)+2)*$A39 -> 1036 | O39: =((O$2/5)+2)*$A39 -> 1073 | P39: =((P$2/5)+2)*$A39 -> 1110 | Q39: =((Q$2/5)+2)*$A39 -> 1147 | R39: =((R$2/5)+2)*$A39 -> 1184 | S39: =((S$2/5)+2)*$A39 -> 1221 | T39: =((T$2/5)+2)*$A39 -> 1258 | U39: =((U$2/5)+2)*$A39 -> 1295 | V39: =((V$2/5)+2)*$A39 -> 1332 | W39: =((W$2/5)+2)*$A39 -> 1369 | X39: =((X$2/5)+2)*$A39 -> 1406 | Y39: =((Y$2/5)+2)*$A39 -> 1443 | Z39: =((Z$2/5)+2)*$A39 -> 1480 | AA39: =((AA$2/5)+2)*$A39 -> 1517 | AB39: =((AB$2/5)+2)*$A39 -> 1554
A40: 38 | B40: =((B$2/5)+2)*$A40 -> 608 | C40: =((C$2/5)+2)*$A40 -> 646 | D40: =((D$2/5)+2)*$A40 -> 684 | E40: =((E$2/5)+2)*$A40 -> 722 | F40: =((F$2/5)+2)*$A40 -> 760 | G40: =((G$2/5)+2)*$A40 -> 798 | H40: =((H$2/5)+2)*$A40 -> 836 | I40: =((I$2/5)+2)*$A40 -> 874 | J40: =((J$2/5)+2)*$A40 -> 912 | K40: =((K$2/5)+2)*$A40 -> 950 | L40: =((L$2/5)+2)*$A40 -> 988 | M40: =((M$2/5)+2)*$A40 -> 1026 | N40: =((N$2/5)+2)*$A40 -> 1064 | O40: =((O$2/5)+2)*$A40 -> 1102 | P40: =((P$2/5)+2)*$A40 -> 1140 | Q40: =((Q$2/5)+2)*$A40 -> 1178 | R40: =((R$2/5)+2)*$A40 -> 1216 | S40: =((S$2/5)+2)*$A40 -> 1254 | T40: =((T$2/5)+2)*$A40 -> 1292 | U40: =((U$2/5)+2)*$A40 -> 1330 | V40: =((V$2/5)+2)*$A40 -> 1368 | W40: =((W$2/5)+2)*$A40 -> 1406 | X40: =((X$2/5)+2)*$A40 -> 1444 | Y40: =((Y$2/5)+2)*$A40 -> 1482 | Z40: =((Z$2/5)+2)*$A40 -> 1520 | AA40: =((AA$2/5)+2)*$A40 -> 1558 | AB40: =((AB$2/5)+2)*$A40 -> 1596
A41: 39 | B41: =((B$2/5)+2)*$A41 -> 624 | C41: =((C$2/5)+2)*$A41 -> 663 | D41: =((D$2/5)+2)*$A41 -> 702 | E41: =((E$2/5)+2)*$A41 -> 741 | F41: =((F$2/5)+2)*$A41 -> 780 | G41: =((G$2/5)+2)*$A41 -> 819 | H41: =((H$2/5)+2)*$A41 -> 858 | I41: =((I$2/5)+2)*$A41 -> 897 | J41: =((J$2/5)+2)*$A41 -> 936 | K41: =((K$2/5)+2)*$A41 -> 975 | L41: =((L$2/5)+2)*$A41 -> 1014 | M41: =((M$2/5)+2)*$A41 -> 1053 | N41: =((N$2/5)+2)*$A41 -> 1092 | O41: =((O$2/5)+2)*$A41 -> 1131 | P41: =((P$2/5)+2)*$A41 -> 1170 | Q41: =((Q$2/5)+2)*$A41 -> 1209 | R41: =((R$2/5)+2)*$A41 -> 1248 | S41: =((S$2/5)+2)*$A41 -> 1287 | T41: =((T$2/5)+2)*$A41 -> 1326 | U41: =((U$2/5)+2)*$A41 -> 1365 | V41: =((V$2/5)+2)*$A41 -> 1404 | W41: =((W$2/5)+2)*$A41 -> 1443 | X41: =((X$2/5)+2)*$A41 -> 1482 | Y41: =((Y$2/5)+2)*$A41 -> 1521 | Z41: =((Z$2/5)+2)*$A41 -> 1560 | AA41: =((AA$2/5)+2)*$A41 -> 1599 | AB41: =((AB$2/5)+2)*$A41 -> 1638
A42: 40 | B42: =((B$2/5)+2)*$A42 -> 640 | C42: =((C$2/5)+2)*$A42 -> 680 | D42: =((D$2/5)+2)*$A42 -> 720 | E42: =((E$2/5)+2)*$A42 -> 760 | F42: =((F$2/5)+2)*$A42 -> 800 | G42: =((G$2/5)+2)*$A42 -> 840 | H42: =((H$2/5)+2)*$A42 -> 880 | I42: =((I$2/5)+2)*$A42 -> 920 | J42: =((J$2/5)+2)*$A42 -> 960 | K42: =((K$2/5)+2)*$A42 -> 1000 | L42: =((L$2/5)+2)*$A42 -> 1040 | M42: =((M$2/5)+2)*$A42 -> 1080 | N42: =((N$2/5)+2)*$A42 -> 1120 | O42: =((O$2/5)+2)*$A42 -> 1160 | P42: =((P$2/5)+2)*$A42 -> 1200 | Q42: =((Q$2/5)+2)*$A42 -> 1240 | R42: =((R$2/5)+2)*$A42 -> 1280 | S42: =((S$2/5)+2)*$A42 -> 1320 | T42: =((T$2/5)+2)*$A42 -> 1360 | U42: =((U$2/5)+2)*$A42 -> 1400 | V42: =((V$2/5)+2)*$A42 -> 1440 | W42: =((W$2/5)+2)*$A42 -> 1480 | X42: =((X$2/5)+2)*$A42 -> 1520 | Y42: =((Y$2/5)+2)*$A42 -> 1560 | Z42: =((Z$2/5)+2)*$A42 -> 1600 | AA42: =((AA$2/5)+2)*$A42 -> 1640 | AB42: =((AB$2/5)+2)*$A42 -> 1680
A43: 41 | B43: =((B$2/5)+2)*$A43 -> 656 | C43: =((C$2/5)+2)*$A43 -> 697 | D43: =((D$2/5)+2)*$A43 -> 738 | E43: =((E$2/5)+2)*$A43 -> 779 | F43: =((F$2/5)+2)*$A43 -> 820 | G43: =((G$2/5)+2)*$A43 -> 861 | H43: =((H$2/5)+2)*$A43 -> 902 | I43: =((I$2/5)+2)*$A43 -> 943 | J43: =((J$2/5)+2)*$A43 -> 984 | K43: =((K$2/5)+2)*$A43 -> 1025 | L43: =((L$2/5)+2)*$A43 -> 1066 | M43: =((M$2/5)+2)*$A43 -> 1107 | N43: =((N$2/5)+2)*$A43 -> 1148 | O43: =((O$2/5)+2)*$A43 -> 1189 | P43: =((P$2/5)+2)*$A43 -> 1230 | Q43: =((Q$2/5)+2)*$A43 -> 1271 | R43: =((R$2/5)+2)*$A43 -> 1312 | S43: =((S$2/5)+2)*$A43 -> 1353 | T43: =((T$2/5)+2)*$A43 -> 1394 | U43: =((U$2/5)+2)*$A43 -> 1435 | V43: =((V$2/5)+2)*$A43 -> 1476 | W43: =((W$2/5)+2)*$A43 -> 1517 | X43: =((X$2/5)+2)*$A43 -> 1558 | Y43: =((Y$2/5)+2)*$A43 -> 1599 | Z43: =((Z$2/5)+2)*$A43 -> 1640 | AA43: =((AA$2/5)+2)*$A43 -> 1681 | AB43: =((AB$2/5)+2)*$A43 -> 1722
A44: 42 | B44: =((B$2/5)+2)*$A44 -> 672 | C44: =((C$2/5)+2)*$A44 -> 714 | D44: =((D$2/5)+2)*$A44 -> 756 | E44: =((E$2/5)+2)*$A44 -> 798 | F44: =((F$2/5)+2)*$A44 -> 840 | G44: =((G$2/5)+2)*$A44 -> 882 | H44: =((H$2/5)+2)*$A44 -> 924 | I44: =((I$2/5)+2)*$A44 -> 966 | J44: =((J$2/5)+2)*$A44 -> 1008 | K44: =((K$2/5)+2)*$A44 -> 1050 | L44: =((L$2/5)+2)*$A44 -> 1092 | M44: =((M$2/5)+2)*$A44 -> 1134 | N44: =((N$2/5)+2)*$A44 -> 1176 | O44: =((O$2/5)+2)*$A44 -> 1218 | P44: =((P$2/5)+2)*$A44 -> 1260 | Q44: =((Q$2/5)+2)*$A44 -> 1302 | R44: =((R$2/5)+2)*$A44 -> 1344 | S44: =((S$2/5)+2)*$A44 -> 1386 | T44: =((T$2/5)+2)*$A44 -> 1428 | U44: =((U$2/5)+2)*$A44 -> 1470 | V44: =((V$2/5)+2)*$A44 -> 1512 | W44: =((W$2/5)+2)*$A44 -> 1554 | X44: =((X$2/5)+2)*$A44 -> 1596 | Y44: =((Y$2/5)+2)*$A44 -> 1638 | Z44: =((Z$2/5)+2)*$A44 -> 1680 | AA44: =((AA$2/5)+2)*$A44 -> 1722 | AB44: =((AB$2/5)+2)*$A44 -> 1764
A45: 43 | B45: =((B$2/5)+2)*$A45 -> 688 | C45: =((C$2/5)+2)*$A45 -> 731 | D45: =((D$2/5)+2)*$A45 -> 774 | E45: =((E$2/5)+2)*$A45 -> 817 | F45: =((F$2/5)+2)*$A45 -> 860 | G45: =((G$2/5)+2)*$A45 -> 903 | H45: =((H$2/5)+2)*$A45 -> 946 | I45: =((I$2/5)+2)*$A45 -> 989 | J45: =((J$2/5)+2)*$A45 -> 1032 | K45: =((K$2/5)+2)*$A45 -> 1075 | L45: =((L$2/5)+2)*$A45 -> 1118 | M45: =((M$2/5)+2)*$A45 -> 1161 | N45: =((N$2/5)+2)*$A45 -> 1204 | O45: =((O$2/5)+2)*$A45 -> 1247 | P45: =((P$2/5)+2)*$A45 -> 1290 | Q45: =((Q$2/5)+2)*$A45 -> 1333 | R45: =((R$2/5)+2)*$A45 -> 1376 | S45: =((S$2/5)+2)*$A45 -> 1419 | T45: =((T$2/5)+2)*$A45 -> 1462 | U45: =((U$2/5)+2)*$A45 -> 1505 | V45: =((V$2/5)+2)*$A45 -> 1548 | W45: =((W$2/5)+2)*$A45 -> 1591 | X45: =((X$2/5)+2)*$A45 -> 1634 | Y45: =((Y$2/5)+2)*$A45 -> 1677 | Z45: =((Z$2/5)+2)*$A45 -> 1720 | AA45: =((AA$2/5)+2)*$A45 -> 1763 | AB45: =((AB$2/5)+2)*$A45 -> 1806
A46: 44 | B46: =((B$2/5)+2)*$A46 -> 704 | C46: =((C$2/5)+2)*$A46 -> 748 | D46: =((D$2/5)+2)*$A46 -> 792 | E46: =((E$2/5)+2)*$A46 -> 836 | F46: =((F$2/5)+2)*$A46 -> 880 | G46: =((G$2/5)+2)*$A46 -> 924 | H46: =((H$2/5)+2)*$A46 -> 968 | I46: =((I$2/5)+2)*$A46 -> 1012 | J46: =((J$2/5)+2)*$A46 -> 1056 | K46: =((K$2/5)+2)*$A46 -> 1100 | L46: =((L$2/5)+2)*$A46 -> 1144 | M46: =((M$2/5)+2)*$A46 -> 1188 | N46: =((N$2/5)+2)*$A46 -> 1232 | O46: =((O$2/5)+2)*$A46 -> 1276 | P46: =((P$2/5)+2)*$A46 -> 1320 | Q46: =((Q$2/5)+2)*$A46 -> 1364 | R46: =((R$2/5)+2)*$A46 -> 1408 | S46: =((S$2/5)+2)*$A46 -> 1452 | T46: =((T$2/5)+2)*$A46 -> 1496 | U46: =((U$2/5)+2)*$A46 -> 1540 | V46: =((V$2/5)+2)*$A46 -> 1584 | W46: =((W$2/5)+2)*$A46 -> 1628 | X46: =((X$2/5)+2)*$A46 -> 1672 | Y46: =((Y$2/5)+2)*$A46 -> 1716 | Z46: =((Z$2/5)+2)*$A46 -> 1760 | AA46: =((AA$2/5)+2)*$A46 -> 1804 | AB46: =((AB$2/5)+2)*$A46 -> 1848
A47: 45 | B47: =((B$2/5)+2)*$A47 -> 720 | C47: =((C$2/5)+2)*$A47 -> 765 | D47: =((D$2/5)+2)*$A47 -> 810 | E47: =((E$2/5)+2)*$A47 -> 855 | F47: =((F$2/5)+2)*$A47 -> 900 | G47: =((G$2/5)+2)*$A47 -> 945 | H47: =((H$2/5)+2)*$A47 -> 990 | I47: =((I$2/5)+2)*$A47 -> 1035 | J47: =((J$2/5)+2)*$A47 -> 1080 | K47: =((K$2/5)+2)*$A47 -> 1125 | L47: =((L$2/5)+2)*$A47 -> 1170 | M47: =((M$2/5)+2)*$A47 -> 1215 | N47: =((N$2/5)+2)*$A47 -> 1260 | O47: =((O$2/5)+2)*$A47 -> 1305 | P47: =((P$2/5)+2)*$A47 -> 1350 | Q47: =((Q$2/5)+2)*$A47 -> 1395 | R47: =((R$2/5)+2)*$A47 -> 1440 | S47: =((S$2/5)+2)*$A47 -> 1485 | T47: =((T$2/5)+2)*$A47 -> 1530 | U47: =((U$2/5)+2)*$A47 -> 1575 | V47: =((V$2/5)+2)*$A47 -> 1620 | W47: =((W$2/5)+2)*$A47 -> 1665 | X47: =((X$2/5)+2)*$A47 -> 1710 | Y47: =((Y$2/5)+2)*$A47 -> 1755 | Z47: =((Z$2/5)+2)*$A47 -> 1800 | AA47: =((AA$2/5)+2)*$A47 -> 1845 | AB47: =((AB$2/5)+2)*$A47 -> 1890
A48: 46 | B48: =((B$2/5)+2)*$A48 -> 736 | C48: =((C$2/5)+2)*$A48 -> 782 | D48: =((D$2/5)+2)*$A48 -> 828 | E48: =((E$2/5)+2)*$A48 -> 874 | F48: =((F$2/5)+2)*$A48 -> 920 | G48: =((G$2/5)+2)*$A48 -> 966 | H48: =((H$2/5)+2)*$A48 -> 1012 | I48: =((I$2/5)+2)*$A48 -> 1058 | J48: =((J$2/5)+2)*$A48 -> 1104 | K48: =((K$2/5)+2)*$A48 -> 1150 | L48: =((L$2/5)+2)*$A48 -> 1196 | M48: =((M$2/5)+2)*$A48 -> 1242 | N48: =((N$2/5)+2)*$A48 -> 1288 | O48: =((O$2/5)+2)*$A48 -> 1334 | P48: =((P$2/5)+2)*$A48 -> 1380 | Q48: =((Q$2/5)+2)*$A48 -> 1426 | R48: =((R$2/5)+2)*$A48 -> 1472 | S48: =((S$2/5)+2)*$A48 -> 1518 | T48: =((T$2/5)+2)*$A48 -> 1564 | U48: =((U$2/5)+2)*$A48 -> 1610 | V48: =((V$2/5)+2)*$A48 -> 1656 | W48: =((W$2/5)+2)*$A48 -> 1702 | X48: =((X$2/5)+2)*$A48 -> 1748 | Y48: =((Y$2/5)+2)*$A48 -> 1794 | Z48: =((Z$2/5)+2)*$A48 -> 1840 | AA48: =((AA$2/5)+2)*$A48 -> 1886 | AB48: =((AB$2/5)+2)*$A48 -> 1932
A49: 47 | B49: =((B$2/5)+2)*$A49 -> 752 | C49: =((C$2/5)+2)*$A49 -> 799 | D49: =((D$2/5)+2)*$A49 -> 846 | E49: =((E$2/5)+2)*$A49 -> 893 | F49: =((F$2/5)+2)*$A49 -> 940 | G49: =((G$2/5)+2)*$A49 -> 987 | H49: =((H$2/5)+2)*$A49 -> 1034 | I49: =((I$2/5)+2)*$A49 -> 1081 | J49: =((J$2/5)+2)*$A49 -> 1128 | K49: =((K$2/5)+2)*$A49 -> 1175 | L49: =((L$2/5)+2)*$A49 -> 1222 | M49: =((M$2/5)+2)*$A49 -> 1269 | N49: =((N$2/5)+2)*$A49 -> 1316 | O49: =((O$2/5)+2)*$A49 -> 1363 | P49: =((P$2/5)+2)*$A49 -> 1410 | Q49: =((Q$2/5)+2)*$A49 -> 1457 | R49: =((R$2/5)+2)*$A49 -> 1504 | S49: =((S$2/5)+2)*$A49 -> 1551 | T49: =((T$2/5)+2)*$A49 -> 1598 | U49: =((U$2/5)+2)*$A49 -> 1645 | V49: =((V$2/5)+2)*$A49 -> 1692 | W49: =((W$2/5)+2)*$A49 -> 1739 | X49: =((X$2/5)+2)*$A49 -> 1786 | Y49: =((Y$2/5)+2)*$A49 -> 1833 | Z49: =((Z$2/5)+2)*$A49 -> 1880 | AA49: =((AA$2/5)+2)*$A49 -> 1927 | AB49: =((AB$2/5)+2)*$A49 -> 1974
A50: 48 | B50: =((B$2/5)+2)*$A50 -> 768 | C50: =((C$2/5)+2)*$A50 -> 816 | D50: =((D$2/5)+2)*$A50 -> 864 | E50: =((E$2/5)+2)*$A50 -> 912 | F50: =((F$2/5)+2)*$A50 -> 960 | G50: =((G$2/5)+2)*$A50 -> 1008 | H50: =((H$2/5)+2)*$A50 -> 1056 | I50: =((I$2/5)+2)*$A50 -> 1104 | J50: =((J$2/5)+2)*$A50 -> 1152 | K50: =((K$2/5)+2)*$A50 -> 1200 | L50: =((L$2/5)+2)*$A50 -> 1248 | M50: =((M$2/5)+2)*$A50 -> 1296 | N50: =((N$2/5)+2)*$A50 -> 1344 | O50: =((O$2/5)+2)*$A50 -> 1392 | P50: =((P$2/5)+2)*$A50 -> 1440 | Q50: =((Q$2/5)+2)*$A50 -> 1488 | R50: =((R$2/5)+2)*$A50 -> 1536 | S50: =((S$2/5)+2)*$A50 -> 1584 | T50: =((T$2/5)+2)*$A50 -> 1632 | U50: =((U$2/5)+2)*$A50 -> 1680 | V50: =((V$2/5)+2)*$A50 -> 1728 | W50: =((W$2/5)+2)*$A50 -> 1776 | X50: =((X$2/5)+2)*$A50 -> 1824 | Y50: =((Y$2/5)+2)*$A50 -> 1872 | Z50: =((Z$2/5)+2)*$A50 -> 1920 | AA50: =((AA$2/5)+2)*$A50 -> 1968 | AB50: =((AB$2/5)+2)*$A50 -> 2016
A51: 49 | B51: =((B$2/5)+2)*$A51 -> 784 | C51: =((C$2/5)+2)*$A51 -> 833 | D51: =((D$2/5)+2)*$A51 -> 882 | E51: =((E$2/5)+2)*$A51 -> 931 | F51: =((F$2/5)+2)*$A51 -> 980 | G51: =((G$2/5)+2)*$A51 -> 1029 | H51: =((H$2/5)+2)*$A51 -> 1078 | I51: =((I$2/5)+2)*$A51 -> 1127 | J51: =((J$2/5)+2)*$A51 -> 1176 | K51: =((K$2/5)+2)*$A51 -> 1225 | L51: =((L$2/5)+2)*$A51 -> 1274 | M51: =((M$2/5)+2)*$A51 -> 1323 | N51: =((N$2/5)+2)*$A51 -> 1372 | O51: =((O$2/5)+2)*$A51 -> 1421 | P51: =((P$2/5)+2)*$A51 -> 1470 | Q51: =((Q$2/5)+2)*$A51 -> 1519 | R51: =((R$2/5)+2)*$A51 -> 1568 | S51: =((S$2/5)+2)*$A51 -> 1617 | T51: =((T$2/5)+2)*$A51 -> 1666 | U51: =((U$2/5)+2)*$A51 -> 1715 | V51: =((V$2/5)+2)*$A51 -> 1764 | W51: =((W$2/5)+2)*$A51 -> 1813 | X51: =((X$2/5)+2)*$A51 -> 1862 | Y51: =((Y$2/5)+2)*$A51 -> 1911 | Z51: =((Z$2/5)+2)*$A51 -> 1960 | AA51: =((AA$2/5)+2)*$A51 -> 2009 | AB51: =((AB$2/5)+2)*$A51 -> 2058
A52: 50 | B52: =((B$2/5)+2)*$A52 -> 800 | C52: =((C$2/5)+2)*$A52 -> 850 | D52: =((D$2/5)+2)*$A52 -> 900 | E52: =((E$2/5)+2)*$A52 -> 950 | F52: =((F$2/5)+2)*$A52 -> 1000 | G52: =((G$2/5)+2)*$A52 -> 1050 | H52: =((H$2/5)+2)*$A52 -> 1100 | I52: =((I$2/5)+2)*$A52 -> 1150 | J52: =((J$2/5)+2)*$A52 -> 1200 | K52: =((K$2/5)+2)*$A52 -> 1250 | L52: =((L$2/5)+2)*$A52 -> 1300 | M52: =((M$2/5)+2)*$A52 -> 1350 | N52: =((N$2/5)+2)*$A52 -> 1400 | O52: =((O$2/5)+2)*$A52 -> 1450 | P52: =((P$2/5)+2)*$A52 -> 1500 | Q52: =((Q$2/5)+2)*$A52 -> 1550 | R52: =((R$2/5)+2)*$A52 -> 1600 | S52: =((S$2/5)+2)*$A52 -> 1650 | T52: =((T$2/5)+2)*$A52 -> 1700 | U52: =((U$2/5)+2)*$A52 -> 1750 | V52: =((V$2/5)+2)*$A52 -> 1800 | W52: =((W$2/5)+2)*$A52 -> 1850 | X52: =((X$2/5)+2)*$A52 -> 1900 | Y52: =((Y$2/5)+2)*$A52 -> 1950 | Z52: =((Z$2/5)+2)*$A52 -> 2000 | AA52: =((AA$2/5)+2)*$A52 -> 2050 | AB52: =((AB$2/5)+2)*$A52 -> 2100

A1: EQDruids thanks all of its players and contributors to making this the most complete druid resource on the web! Back to EQ Druids Homepage This page was last modified August 11, 2000 since May 04, 1999 Webmaster :Twilight (c) EQDruids, 1999-2000. EQDruids is a division of Slategroup Everquest is a Trademark of Sony Corporation.

A2: Prev. 5 | B2: JOIN | C2: Next 5
A3: Previous | B3: List | C3: Next