A1: Name | B1: Effect | C1: Ranking | D1: AC | E1: STR | F1: STA | G1: AGI | H1: DEX | I1: WIS | J1: INT | K1: CHA | L1: HP | M1: MANA | N1: PR | O1: MR | P1: DR | Q1: FR | R1: CR | S1: WT | T1: WP | U1: Type
A2: Crown of the Undead Warmaster | C2: =(I2*10)+M2+(D2*4)+G2+(L2/5)+(F2*2)+(E2*2)+(K2*2)+(O2/2)+(Q2/2)+(R2/2)+(N2/4)+(P2/4) -> 485 | D2: 25 | E2: 15 | F2: 15 | G2: 15 | H2: 15 | I2: 15 | J2: 15 | K2: 15 | L2: 100 | M2: 100 | N2: 5 | O2: 5 | P2: 5 | Q2: 5 | R2: 5 | S2: 2.5 | U2: head
A3: Crown of Rile | B3: Extinguish Fatigue | C3: =(I3*10)+M3+(D3*4)+G3+(L3/5)+(F3*2)+(E3*2)+(K3*2)+(O3/2)+(Q3/2)+(R3/2)+(N3/4)+(P3/4)+30 -> 442.75 | D3: 16.0 | E3: 20.0 | I3: 20.0 | J3: 20.0 | L3: 75.0 | M3: 75.0 | N3: 25.0 | O3: 25.0 | S3: 1.1 | T3: =0-QUOTIENT(S3, 5) -> 0 | U3: head
A4: Crown of the Kromzek Kings | B4: Truesight | C4: =(I4*10)+M4+(D4*4)+G4+(L4/5)+(F4*2)+(E4*2)+(K4*2)+(O4/2)+(Q4/2)+(R4/2)+(N4/4)+(P4/4)+30 -> 337.5 | D4: 35.0 | E4: 10.0 | I4: 10.0 | J4: 10.0 | L4: 100.0 | N4: 10.0 | O4: 25.0 | P4: 10.0 | Q4: 10.0 | R4: 10.0 | S4: 1.0 | T4: =0-QUOTIENT(S4, 5) -> 0 | U4: head
A5: Circlet of Summer | C5: =(I5*10)+M5+(D5*4)+G5+(L5/5)+(F5*2)+(E5*2)+(K5*2)+(O5/2)+(Q5/2)+(R5/2)+(N5/4)+(P5/4) -> 296.5 | D5: 25.0 | I5: 10.0 | L5: 70.0 | M5: 70.0 | R5: 25.0 | S5: 2.0 | T5: =0-QUOTIENT(S5, 5) -> 0 | U5: head
A6: White Dragon Helm | B6: Endure Magic | C6: =(I6*10)+M6+(D6*4)+G6+(L6/5)+(F6*2)+(E6*2)+(K6*2)+(O6/2)+(Q6/2)+(R6/2)+(N6/4)+(P6/4)+30 -> 262 | D6: 22.0 | E6: 10.0 | F6: 12.0 | H6: 15.0 | L6: 100.0 | M6: 60.0 | N6: 10.0 | O6: 10.0 | P6: 10.0 | Q6: 10.0 | R6: 10.0 | S6: 1.5 | T6: =0-QUOTIENT(S6, 5) -> 0 | U6: head
A7: Twisted Nature Crown | B7: Ultravision | C7: =(I7*10)+M7+(D7*4)+G7+(L7/5)+(F7*2)+(E7*2)+(K7*2)+(O7/2)+(Q7/2)+(R7/2)+(N7/4)+(P7/4)+30 -> 245 | D7: 15.0 | I7: 10.0 | J7: 5.0 | K7: 10.0 | L7: 25.0 | M7: 25.0 | Q7: 5.0 | R7: 5.0 | S7: 0.5 | T7: =0-QUOTIENT(S7, 5) -> 0 | U7: head
A8: Circlet of Falinkan | C8: =(I8*10)+M8+(D8*4)+G8+(L8/5)+(F8*2)+(E8*2)+(K8*2)+(O8/2)+(Q8/2)+(R8/2)+(N8/4)+(P8/4) -> 204.5 | D8: 12.0 | E8: 7.0 | H8: 5.0 | I8: 5.0 | J8: 5.0 | L8: 50.0 | M8: 75.0 | O8: 5.0 | Q8: 5.0 | R8: 5.0 | S8: 00.1 | T8: =0-QUOTIENT(S8, 5) -> 0 | U8: head
A9: Circlet of Suffering | C9: =(I9*10)+M9+(D9*4)+G9+(L9/5)+(F9*2)+(E9*2)+(K9*2)+(O9/2)+(Q9/2)+(R9/2)+(N9/4)+(P9/4) -> 178 | D9: 20.0 | E9: 7.0 | F9: 7.0 | L9: 100.0 | M9: 50.0 | S9: 0.0 | T9: =0-QUOTIENT(S9, 5) -> 0 | U9: head
A10: Frostreaver's Velium Crown | B10: Truesight | C10: =(I10*10)+M10+(D10*4)+G10+(L10/5)+(F10*2)+(E10*2)+(K10*2)+(O10/2)+(Q10/2)+(R10/2)+(N10/4)+(P10/4)+30 -> 167.5 | D10: 30.0 | N10: 5.0 | O10: 20.0 | P10: 5.0 | Q10: 5.0 | R10: 5.0 | S10: 1.0 | T10: =0-QUOTIENT(S10, 5) -> 0 | U10: head
A11: Nature Walker's Circlet | C11: =(I11*10)+M11+(D11*4)+G11+(L11/5)+(F11*2)+(E11*2)+(K11*2)+(O11/2)+(Q11/2)+(R11/2)+(N11/4)+(P11/4) -> 159 | D11: 11.0 | G11: 2.0 | I11: 9.0 | M11: 20.0 | N11: 1.0 | O11: 3.0 | P11: 1.0 | Q11: 1.0 | R11: 1.0 | S11: 00.6 | T11: =0-QUOTIENT(S11, 5) -> 0 | U11: head
A12: Woven Grass Headband | C12: =(I12*10)+M12+(D12*4)+G12+(L12/5)+(F12*2)+(E12*2)+(K12*2)+(O12/2)+(Q12/2)+(R12/2)+(N12/4)+(P12/4) -> 157.75 | D12: 8.0 | E12: 3.0 | H12: 3.0 | I12: 10.0 | M12: 15.0 | O12: 5.0 | P12: 3.0 | R12: 3.0 | S12: 00.6 | T12: =0-QUOTIENT(S12, 5) -> 0 | U12: head
A13: Crown of Resiliance | C13: =(I13*10)+M13+(D13*4)+G13+(L13/5)+(F13*2)+(E13*2)+(K13*2)+(O13/2)+(Q13/2)+(R13/2)+(N13/4)+(P13/4) -> 150 | D13: 30.0 | N13: 15.0 | O13: 15.0 | P13: 15.0 | Q13: 15.0 | R13: 15.0 | S13: 0.0 | T13: =0-QUOTIENT(S13, 5) -> 0 | U13: head
A14: Shaderock Crown | C14: =(I14*10)+M14+(D14*4)+G14+(L14/5)+(F14*2)+(E14*2)+(K14*2)+(O14/2)+(Q14/2)+(R14/2)+(N14/4)+(P14/4) -> 150 | D14: 20 | J14: 4 | K14: -5 | L14: 50 | M14: 50 | N14: 10 | O14: 10 | P14: 10 | Q14: 10 | R14: 10 | S14: 2 | U14: head
A15: Crown of Hatred | B15: Ultravision | C15: =(I15*10)+M15+(D15*4)+G15+(L15/5)+(F15*2)+(E15*2)+(K15*2)+(O15/2)+(Q15/2)+(R15/2)+(N15/4)+(P15/4)+30 -> 148 | D15: 10.0 | E15: 6.0 | G15: 6.0 | I15: 6.0 | J15: 6.0 | S15: 1.0 | T15: =0-QUOTIENT(S15, 5) -> 0 | U15: head
A16: Elysian Crown | C16: =(I16*10)+M16+(D16*4)+G16+(L16/5)+(F16*2)+(E16*2)+(K16*2)+(O16/2)+(Q16/2)+(R16/2)+(N16/4)+(P16/4) -> 145.5 | D16: 12 | E16: 5 | I16: 8 | Q16: 10 | R16: 5 | S16: 5 | U16: head
A17: Frozen Turban | B17: Resist Cold | C17: =(I17*10)+M17+(D17*4)+G17+(L17/5)+(F17*2)+(E17*2)+(K17*2)+(O17/2)+(Q17/2)+(R17/2)+(N17/4)+(P17/4)+30 -> 145 | D17: 25.0 | G17: 15.0 | S17: 0.0 | T17: =0-QUOTIENT(S17, 5) -> 0 | U17: head
A18: Cowl of Mortality | B18: Haste | C18: =(I18*10)+M18+(D18*4)+G18+(L18/5)+(F18*2)+(E18*2)+(K18*2)+(O18/2)+(Q18/2)+(R18/2)+(N18/4)+(P18/4)+30 -> 137.75 | D18: 16.0 | F18: 9.0 | G18: 12.0 | L18: 50.0 | P18: 15.0 | S18: 00.1 | T18: =0-QUOTIENT(S18, 5) -> 0 | U18: head
A19: Kobold Jester's Crown | C19: =(I19*10)+M19+(D19*4)+G19+(L19/5)+(F19*2)+(E19*2)+(K19*2)+(O19/2)+(Q19/2)+(R19/2)+(N19/4)+(P19/4) -> 125 | D19: 15.0 | G19: 5.0 | H19: -5.0 | J19: -30.0 | K19: 30.0 | S19: 0.0 | T19: =0-QUOTIENT(S19, 5) -> 0 | U19: head
A20: Crown of King Tranix | B20: Serpent Sight | C20: =(I20*10)+M20+(D20*4)+G20+(L20/5)+(F20*2)+(E20*2)+(K20*2)+(O20/2)+(Q20/2)+(R20/2)+(N20/4)+(P20/4)+30 -> 122 | D20: 13.0 | K20: 15.0 | O20: 20.0 | S20: 1.0 | T20: =0-QUOTIENT(S20, 5) -> 0 | U20: head
A21: Rowyl's Circlet of Nature | C21: =(I21*10)+M21+(D21*4)+G21+(L21/5)+(F21*2)+(E21*2)+(K21*2)+(O21/2)+(Q21/2)+(R21/2)+(N21/4)+(P21/4) -> 119 | D21: 8.0 | F21: 2.0 | I21: 8.0 | N21: 2.0 | O21: 3.0 | Q21: 2.0 | S21: 00.6 | T21: =0-QUOTIENT(S21, 5) -> 0 | U21: head
A22: Crown of Harmony | C22: =(I22*10)+M22+(D22*4)+G22+(L22/5)+(F22*2)+(E22*2)+(K22*2)+(O22/2)+(Q22/2)+(R22/2)+(N22/4)+(P22/4) -> 113.5 | D22: 9.0 | F22: 2.0 | I22: 7.0 | O22: 2.0 | Q22: 3.0 | R22: 2.0 | S22: 00.6 | T22: =0-QUOTIENT(S22, 5) -> 0 | U22: head
A23: Square Helm | C23: =(I23*10)+M23+(D23*4)+G23+(L23/5)+(F23*2)+(E23*2)+(K23*2)+(O23/2)+(Q23/2)+(R23/2)+(N23/4)+(P23/4) -> 111 | D23: 12.0 | G23: 3.0 | I23: 6.0 | S23: 2.0 | T23: =0-QUOTIENT(S23, 5) -> 0 | U23: head
A24: Grimling Tribal Headdress | C24: =(I24*10)+M24+(D24*4)+G24+(L24/5)+(F24*2)+(E24*2)+(K24*2)+(O24/2)+(Q24/2)+(R24/2)+(N24/4)+(P24/4) -> 98 | D24: 13 | G24: 3 | I24: 3 | M24: 10 | O24: 3 | R24: 3 | S24: 2 | U24: head
A25: Leatherfoot Raider Skullcap | B25: Ring of Commons | C25: =(I25*10)+M25+(D25*4)+G25+(L25/5)+(F25*2)+(E25*2)+(K25*2)+(O25/2)+(Q25/2)+(R25/2)+(N25/4)+(P25/4)+30 -> 95.5 | D25: 7.0 | E25: 5.0 | G25: 5.0 | K25: 10.0 | O25: 5.0 | S25: 0.5 | T25: =0-QUOTIENT(S25, 5) -> 0 | U25: head
A26: Thought Horror Scalp | C26: =(I26*10)+M26+(D26*4)+G26+(L26/5)+(F26*2)+(E26*2)+(K26*2)+(O26/2)+(Q26/2)+(R26/2)+(N26/4)+(P26/4) -> 88 | D26: 7 | I26: 4 | J26: 4 | M26: 20 | S26: 2 | U26: head
A27: Crystal Chitin Circlet | C27: =(I27*10)+M27+(D27*4)+G27+(L27/5)+(F27*2)+(E27*2)+(K27*2)+(O27/2)+(Q27/2)+(R27/2)+(N27/4)+(P27/4) -> 84 | D27: 12.0 | E27: 3.0 | I27: 3.0 | J27: 3.0 | S27: 0.0 | T27: =0-QUOTIENT(S27, 5) -> 0 | U27: head
A28: Circlet of Tallon | C28: =(I28*10)+M28+(D28*4)+G28+(L28/5)+(F28*2)+(E28*2)+(K28*2)+(O28/2)+(Q28/2)+(R28/2)+(N28/4)+(P28/4) -> 83.25 | D28: 18.0 | N28: 9.0 | O28: 9.0 | R28: 9.0 | S28: 00.6 | T28: =0-QUOTIENT(S28, 5) -> 0 | U28: head
A29: Circlet of Vallon | C29: =(I29*10)+M29+(D29*4)+G29+(L29/5)+(F29*2)+(E29*2)+(K29*2)+(O29/2)+(Q29/2)+(R29/2)+(N29/4)+(P29/4) -> 83.25 | D29: 18.0 | O29: 9.0 | P29: 9.0 | Q29: 9.0 | S29: 00.6 | T29: =0-QUOTIENT(S29, 5) -> 0 | U29: head
A30: Coldstone Wreath | C30: =(I30*10)+M30+(D30*4)+G30+(L30/5)+(F30*2)+(E30*2)+(K30*2)+(O30/2)+(Q30/2)+(R30/2)+(N30/4)+(P30/4) -> 82 | D30: 3.0 | I30: 5.0 | M30: 20.0 | S30: 1.5 | T30: =0-QUOTIENT(S30, 5) -> 0 | U30: head
A31: Nathsar Helm | C31: =(I31*10)+M31+(D31*4)+G31+(L31/5)+(F31*2)+(E31*2)+(K31*2)+(O31/2)+(Q31/2)+(R31/2)+(N31/4)+(P31/4) -> 79 | D31: 9.0 | I31: 4.0 | J31: 4.0 | O31: 6.0 | S31: 0.0 | T31: =0-QUOTIENT(S31, 5) -> 0 | U31: head
A32: Mystical Headshrinker's Skullcap | C32: =(I32*10)+M32+(D32*4)+G32+(L32/5)+(F32*2)+(E32*2)+(K32*2)+(O32/2)+(Q32/2)+(R32/2)+(N32/4)+(P32/4) -> 77.5 | D32: 10 | I32: 3 | J32: 3 | K32: 3 | O32: 3 | S32: 3 | U32: head
A33: Othmir Fur Cap | C33: =(I33*10)+M33+(D33*4)+G33+(L33/5)+(F33*2)+(E33*2)+(K33*2)+(O33/2)+(Q33/2)+(R33/2)+(N33/4)+(P33/4) -> 77.4 | D33: 3.0 | G33: 2.0 | H33: 3.0 | I33: 6.0 | L33: 7.0 | R33: 4.0 | S33: 00.4 | T33: =0-QUOTIENT(S33, 5) -> 0 | U33: head
A34: Circlet of Cerulean Smoke | C34: =(I34*10)+M34+(D34*4)+G34+(L34/5)+(F34*2)+(E34*2)+(K34*2)+(O34/2)+(Q34/2)+(R34/2)+(N34/4)+(P34/4) -> 75.75 | D34: 13.0 | K34: 10.0 | P34: 3.0 | Q34: 3.0 | R34: 3.0 | S34: 00.6 | T34: =0-QUOTIENT(S34, 5) -> 0 | U34: head
A35: Poison Leaf Crown | C35: =(I35*10)+M35+(D35*4)+G35+(L35/5)+(F35*2)+(E35*2)+(K35*2)+(O35/2)+(Q35/2)+(R35/2)+(N35/4)+(P35/4) -> 73.75 | D35: 10 | I35: 3 | J35: 3 | N35: 15 | S35: 00.1 | U35: head
A36: Shissar Scale Headband | C36: =(I36*10)+M36+(D36*4)+G36+(L36/5)+(F36*2)+(E36*2)+(K36*2)+(O36/2)+(Q36/2)+(R36/2)+(N36/4)+(P36/4) -> 71.75 | D36: 12 | G36: 15 | L36: 25 | N36: 15 | S36: 1 | U36: head
A37: Owlbear Feather Circlet | C37: =(I37*10)+M37+(D37*4)+G37+(L37/5)+(F37*2)+(E37*2)+(K37*2)+(O37/2)+(Q37/2)+(R37/2)+(N37/4)+(P37/4) -> 70.5 | D37: 3 | E37: 3 | F37: 3 | I37: 3 | J37: 3 | M37: 15 | N37: 3 | P37: 3 | S37: 2 | U37: head
A38: Blue Flower of Functionality | B38: Aura of Blue Petals | C38: =(I38*10)+M38+(D38*4)+G38+(L38/5)+(F38*2)+(E38*2)+(K38*2)+(O38/2)+(Q38/2)+(R38/2)+(N38/4)+(P38/4)+30 -> 70 | D38: 10.0 | S38: 0.0 | T38: =0-QUOTIENT(S38, 5) -> 0 | U38: head
A39: Elder Spiritist's Helm | B39: Superior Camouflage | C39: =(I39*10)+M39+(D39*4)+G39+(L39/5)+(F39*2)+(E39*2)+(K39*2)+(O39/2)+(Q39/2)+(R39/2)+(N39/4)+(P39/4)+30 -> 70 | D39: 10.0 | S39: 6.0 | T39: =0-QUOTIENT(S39, 5) -> -1 | U39: head
A40: Green Flower of Functionality | B40: Aura of Green Petals | C40: =(I40*10)+M40+(D40*4)+G40+(L40/5)+(F40*2)+(E40*2)+(K40*2)+(O40/2)+(Q40/2)+(R40/2)+(N40/4)+(P40/4)+30 -> 70 | D40: 10.0 | S40: 0.0 | T40: =0-QUOTIENT(S40, 5) -> 0 | U40: head
A41: Withered Leather Skullcap | C41: =(I41*10)+M41+(D41*4)+G41+(L41/5)+(F41*2)+(E41*2)+(K41*2)+(O41/2)+(Q41/2)+(R41/2)+(N41/4)+(P41/4) -> 70 | D41: 6.0 | E41: 3.0 | I41: 2.0 | M41: 20.0 | S41: 00.6 | T41: =0-QUOTIENT(S41, 5) -> 0 | U41: head
A42: Platinum Tiara | C42: =(I42*10)+M42+(D42*4)+G42+(L42/5)+(F42*2)+(E42*2)+(K42*2)+(O42/2)+(Q42/2)+(R42/2)+(N42/4)+(P42/4) -> 69 | D42: 3.0 | L42: 35.0 | M42: 50.0 | S42: 1.2 | T42: =0-QUOTIENT(S42, 5) -> 0 | U42: head
A43: Vermiculated Crown | C43: =(I43*10)+M43+(D43*4)+G43+(L43/5)+(F43*2)+(E43*2)+(K43*2)+(O43/2)+(Q43/2)+(R43/2)+(N43/4)+(P43/4) -> 69 | D43: 7.0 | J43: 9.0 | K43: 13.0 | M43: 15.0 | S43: 6.0 | T43: =0-QUOTIENT(S43, 5) -> -1 | U43: head
A44: Crown of the Froglok Kings | C44: =(I44*10)+M44+(D44*4)+G44+(L44/5)+(F44*2)+(E44*2)+(K44*2)+(O44/2)+(Q44/2)+(R44/2)+(N44/4)+(P44/4) -> 68 | D44: 12.0 | Q44: 20.0 | R44: 20.0 | S44: 0.5 | T44: =0-QUOTIENT(S44, 5) -> 0 | U44: head
A45: Imbued Elven Chainmail Coif | C45: =(I45*10)+M45+(D45*4)+G45+(L45/5)+(F45*2)+(E45*2)+(K45*2)+(O45/2)+(Q45/2)+(R45/2)+(N45/4)+(P45/4) -> 68 | D45: 8.0 | I45: 3.0 | J45: 3.0 | K45: 2.0 | O45: 4.0 | S45: 00.6 | T45: =0-QUOTIENT(S45, 5) -> 0 | U45: head
A46: Golden Efreeti Turban | C46: =(I46*10)+M46+(D46*4)+G46+(L46/5)+(F46*2)+(E46*2)+(K46*2)+(O46/2)+(Q46/2)+(R46/2)+(N46/4)+(P46/4) -> 62 | D46: 10.0 | E46: 5.0 | N46: 6.0 | O46: 6.0 | P46: 6.0 | Q46: 6.0 | R46: 6.0 | S46: 4.5 | T46: =0-QUOTIENT(S46, 5) -> 0 | U46: head
A47: Pegasus Feathered Headdress | C47: =(I47*10)+M47+(D47*4)+G47+(L47/5)+(F47*2)+(E47*2)+(K47*2)+(O47/2)+(Q47/2)+(R47/2)+(N47/4)+(P47/4) -> 61 | D47: 4.0 | I47: 4.0 | M47: 4.0 | P47: 4.0 | S47: 0.0 | T47: =0-QUOTIENT(S47, 5) -> 0 | U47: head
A48: Black Feathered Circlet | B48: Levitate | C48: =(I48*10)+M48+(D48*4)+G48+(L48/5)+(F48*2)+(E48*2)+(K48*2)+(O48/2)+(Q48/2)+(R48/2)+(N48/4)+(P48/4) -> 60 | D48: 5 | I48: 2 | J48: 2 | M48: 20 | S48: 1 | U48: head
A49: Crown of Torment | C49: =(I49*10)+M49+(D49*4)+G49+(L49/5)+(F49*2)+(E49*2)+(K49*2)+(O49/2)+(Q49/2)+(R49/2)+(N49/4)+(P49/4) -> 60 | D49: 12 | E49: 2 | F49: 2 | K49: 2 | S49: 1 | U49: head
A50: Tarmok Tribal Headband | C50: =(I50*10)+M50+(D50*4)+G50+(L50/5)+(F50*2)+(E50*2)+(K50*2)+(O50/2)+(Q50/2)+(R50/2)+(N50/4)+(P50/4) -> 58 | D50: 12 | N50: 20 | P50: 20 | S50: 1 | U50: head
A51: Greater Cap of Health | C51: =(I51*10)+M51+(D51*4)+G51+(L51/5)+(F51*2)+(E51*2)+(K51*2)+(O51/2)+(Q51/2)+(R51/2)+(N51/4)+(P51/4) -> 56 | D51: 10 | F51: 6 | L51: 20 | S51: 1.5 | U51: head
A52: Runed Circlet | C52: =(I52*10)+M52+(D52*4)+G52+(L52/5)+(F52*2)+(E52*2)+(K52*2)+(O52/2)+(Q52/2)+(R52/2)+(N52/4)+(P52/4) -> 56 | D52: 4.0 | I52: 4.0 | J52: 4.0 | S52: 1.0 | T52: =0-QUOTIENT(S52, 5) -> 0 | U52: head
A53: Crown of Leaves | C53: =(I53*10)+M53+(D53*4)+G53+(L53/5)+(F53*2)+(E53*2)+(K53*2)+(O53/2)+(Q53/2)+(R53/2)+(N53/4)+(P53/4) -> 54 | D53: 1.0 | I53: 5.0 | S53: 00.4 | T53: =0-QUOTIENT(S53, 5) -> 0 | U53: head
A54: Enchanted Elven Chain Coif | C54: =(I54*10)+M54+(D54*4)+G54+(L54/5)+(F54*2)+(E54*2)+(K54*2)+(O54/2)+(Q54/2)+(R54/2)+(N54/4)+(P54/4) -> 54 | D54: 8.0 | I54: 2.0 | J54: 2.0 | O54: 4.0 | S54: 00.6 | T54: =0-QUOTIENT(S54, 5) -> 0 | U54: head
A55: Nightshade Wreath | C55: =(I55*10)+M55+(D55*4)+G55+(L55/5)+(F55*2)+(E55*2)+(K55*2)+(O55/2)+(Q55/2)+(R55/2)+(N55/4)+(P55/4) -> 54 | D55: 1.0 | I55: 5.0 | J55: 5.0 | S55: 00.1 | T55: =0-QUOTIENT(S55, 5) -> 0 | U55: head
A56: Velium Etched Circlet | C56: =(I56*10)+M56+(D56*4)+G56+(L56/5)+(F56*2)+(E56*2)+(K56*2)+(O56/2)+(Q56/2)+(R56/2)+(N56/4)+(P56/4) -> 51.5 | D56: 6.0 | E56: 6.0 | F56: 6.0 | O56: 3.0 | Q56: 2.0 | R56: 2.0 | S56: 1.5 | T56: =0-QUOTIENT(S56, 5) -> 0 | U56: head
A57: Siryn Hair Hood | C57: =(I57*10)+M57+(D57*4)+G57+(L57/5)+(F57*2)+(E57*2)+(K57*2)+(O57/2)+(Q57/2)+(R57/2)+(N57/4)+(P57/4) -> 51 | D57: 5.0 | K57: 13.0 | Q57: 10.0 | S57: 00.2 | T57: =0-QUOTIENT(S57, 5) -> 0 | U57: head
A58: Zaharn's Coronet | C58: =(I58*10)+M58+(D58*4)+G58+(L58/5)+(F58*2)+(E58*2)+(K58*2)+(O58/2)+(Q58/2)+(R58/2)+(N58/4)+(P58/4) -> 51 | D58: 5.0 | E58: 3.0 | M58: 25.0 | S58: 5.0 | T58: =0-QUOTIENT(S58, 5) -> -1 | U58: head
A59: Hangman's Noose | B59: Haste | C59: =(I59*10)+M59+(D59*4)+G59+(L59/5)+(F59*2)+(E59*2)+(K59*2)+(O59/2)+(Q59/2)+(R59/2)+(N59/4)+(P59/4)+30 -> 50 | D59: 5.0 | S59: 00.1 | T59: =0-QUOTIENT(S59, 5) -> 0 | U59: head
A60: Idiot Savant's Cap | C60: =(I60*10)+M60+(D60*4)+G60+(L60/5)+(F60*2)+(E60*2)+(K60*2)+(O60/2)+(Q60/2)+(R60/2)+(N60/4)+(P60/4) -> 50 | D60: 21.0 | E60: 8.0 | H60: 8.0 | I60: -5.0 | J60: -5.0 | S60: 0.0 | T60: =0-QUOTIENT(S60, 5) -> 0 | U60: head
A61: Velium Hound Fur Cap | C61: =(I61*10)+M61+(D61*4)+G61+(L61/5)+(F61*2)+(E61*2)+(K61*2)+(O61/2)+(Q61/2)+(R61/2)+(N61/4)+(P61/4) -> 49 | D61: 5.0 | E61: 6.0 | F61: 6.0 | Q61: 10.0 | S61: 0.5 | T61: =0-QUOTIENT(S61, 5) -> 0 | U61: head
A62: Netted Kelp Cap | C62: =(I62*10)+M62+(D62*4)+G62+(L62/5)+(F62*2)+(E62*2)+(K62*2)+(O62/2)+(Q62/2)+(R62/2)+(N62/4)+(P62/4) -> 47.5 | D62: 5.0 | E62: 7.0 | F62: 8.0 | J62: 5.0 | K62: -2.0 | Q62: 3.0 | S62: 00.3 | T62: =0-QUOTIENT(S62, 5) -> 0 | U62: head
A63: Helm of Rile | C63: =(I63*10)+M63+(D63*4)+G63+(L63/5)+(F63*2)+(E63*2)+(K63*2)+(O63/2)+(Q63/2)+(R63/2)+(N63/4)+(P63/4) -> 47 | D63: 6.0 | E63: 9.0 | G63: 5.0 | S63: 4.0 | T63: =0-QUOTIENT(S63, 5) -> 0 | U63: head
A64: Cobalt Drake Cap | C64: =(I64*10)+M64+(D64*4)+G64+(L64/5)+(F64*2)+(E64*2)+(K64*2)+(O64/2)+(Q64/2)+(R64/2)+(N64/4)+(P64/4) -> 46.5 | D64: 9.0 | M64: 8.0 | R64: 5.0 | S64: 00.6 | T64: =0-QUOTIENT(S64, 5) -> 0 | U64: head
A65: Kejekan Tribal Headband | C65: =(I65*10)+M65+(D65*4)+G65+(L65/5)+(F65*2)+(E65*2)+(K65*2)+(O65/2)+(Q65/2)+(R65/2)+(N65/4)+(P65/4) -> 46 | D65: 1.0 | I65: 3.0 | J65: 3.0 | M65: 12.0 | S65: 00.2 | T65: =0-QUOTIENT(S65, 5) -> 0 | U65: head
A66: Lumberjack's Cap | C66: =(I66*10)+M66+(D66*4)+G66+(L66/5)+(F66*2)+(E66*2)+(K66*2)+(O66/2)+(Q66/2)+(R66/2)+(N66/4)+(P66/4) -> 46 | D66: 10.0 | F66: 3.0 | S66: 1.5 | T66: =0-QUOTIENT(S66, 5) -> 0 | U66: head
A67: Fine Silk Turban | C67: =(I67*10)+M67+(D67*4)+G67+(L67/5)+(F67*2)+(E67*2)+(K67*2)+(O67/2)+(Q67/2)+(R67/2)+(N67/4)+(P67/4) -> 45 | D67: 10.0 | Q67: 10.0 | S67: 00.3 | T67: =0-QUOTIENT(S67, 5) -> 0 | U67: head
A68: Purified Spirit Helm | C68: =(I68*10)+M68+(D68*4)+G68+(L68/5)+(F68*2)+(E68*2)+(K68*2)+(O68/2)+(Q68/2)+(R68/2)+(N68/4)+(P68/4) -> 44 | D68: 4.0 | I68: 2.0 | J68: 2.0 | K68: 2.0 | L68: 5.0 | M68: 3.0 | S68: 1.0 | T68: =0-QUOTIENT(S68, 5) -> 0 | U68: head
A69: Sphinx Crown | C69: =(I69*10)+M69+(D69*4)+G69+(L69/5)+(F69*2)+(E69*2)+(K69*2)+(O69/2)+(Q69/2)+(R69/2)+(N69/4)+(P69/4) -> 42.1 | D69: 8.0 | L69: 8.0 | M69: 8.0 | N69: 2.0 | S69: 2.0 | T69: =0-QUOTIENT(S69, 5) -> 0 | U69: head
A70: Burynai Hide Cap | C70: =(I70*10)+M70+(D70*4)+G70+(L70/5)+(F70*2)+(E70*2)+(K70*2)+(O70/2)+(Q70/2)+(R70/2)+(N70/4)+(P70/4) -> 42 | D70: 5.0 | G70: 2.0 | I70: 2.0 | S70: 4.0 | T70: =0-QUOTIENT(S70, 5) -> 0 | U70: head
A71: Platinum Blue Diamond Tiara | C71: =(I71*10)+M71+(D71*4)+G71+(L71/5)+(F71*2)+(E71*2)+(K71*2)+(O71/2)+(Q71/2)+(R71/2)+(N71/4)+(P71/4) -> 41 | D71: 0.0 | M71: 25.0 | N71: 8.0 | O71: 8.0 | P71: 8.0 | Q71: 8.0 | R71: 8.0 | S71: 00.1 | T71: =0-QUOTIENT(S71, 5) -> 0 | U71: head
A72: Giant Warrior Helmet | C72: =(I72*10)+M72+(D72*4)+G72+(L72/5)+(F72*2)+(E72*2)+(K72*2)+(O72/2)+(Q72/2)+(R72/2)+(N72/4)+(P72/4) -> 40 | D72: 10.0 | S72: 6.0 | T72: =0-QUOTIENT(S72, 5) -> -1 | U72: head
A73: Gnomish Pirate Hat | C73: =(I73*10)+M73+(D73*4)+G73+(L73/5)+(F73*2)+(E73*2)+(K73*2)+(O73/2)+(Q73/2)+(R73/2)+(N73/4)+(P73/4) -> 40 | D73: 10.0 | H73: 3.0 | S73: 2.0 | T73: =0-QUOTIENT(S73, 5) -> 0 | U73: head
A74: Batfang Headband | C74: =(I74*10)+M74+(D74*4)+G74+(L74/5)+(F74*2)+(E74*2)+(K74*2)+(O74/2)+(Q74/2)+(R74/2)+(N74/4)+(P74/4) -> 38 | D74: 2.0 | I74: 3.0 | J74: 3.0 | S74: 1.5 | T74: =0-QUOTIENT(S74, 5) -> 0 | U74: head
A75: Imbued Mithril Studded Skullcap | C75: =(I75*10)+M75+(D75*4)+G75+(L75/5)+(F75*2)+(E75*2)+(K75*2)+(O75/2)+(Q75/2)+(R75/2)+(N75/4)+(P75/4) -> 38 | D75: 6.0 | I75: 1.0 | K75: 2.0 | S75: 0.5 | T75: =0-QUOTIENT(S75, 5) -> 0 | U75: head
A76: Imbued Vale Studded Skullcap (K) | C76: =(I76*10)+M76+(D76*4)+G76+(L76/5)+(F76*2)+(E76*2)+(K76*2)+(O76/2)+(Q76/2)+(R76/2)+(N76/4)+(P76/4) -> 38 | D76: 6.0 | F76: 2.0 | I76: 1.0 | S76: 0.5 | T76: =0-QUOTIENT(S76, 5) -> 0 | U76: head
A77: Savants Cap | C77: =(I77*10)+M77+(D77*4)+G77+(L77/5)+(F77*2)+(E77*2)+(K77*2)+(O77/2)+(Q77/2)+(R77/2)+(N77/4)+(P77/4) -> 38 | D77: 2.0 | I77: 3.0 | J77: 3.0 | S77: 00.3 | T77: =0-QUOTIENT(S77, 5) -> 0 | U77: head
A78: Chieftain's Headress | C78: =(I78*10)+M78+(D78*4)+G78+(L78/5)+(F78*2)+(E78*2)+(K78*2)+(O78/2)+(Q78/2)+(R78/2)+(N78/4)+(P78/4) -> 36 | D78: 0.0 | E78: 3.0 | I78: 3.0 | J78: 3.0 | S78: 1.2 | T78: =0-QUOTIENT(S78, 5) -> 0 | U78: head
A79: Mane Attraction | C79: =(I79*10)+M79+(D79*4)+G79+(L79/5)+(F79*2)+(E79*2)+(K79*2)+(O79/2)+(Q79/2)+(R79/2)+(N79/4)+(P79/4) -> 36 | D79: 4.0 | K79: 10.0 | S79: 3.5 | T79: =0-QUOTIENT(S79, 5) -> 0 | U79: head
A80: Silver Threaded Bandana | C80: =(I80*10)+M80+(D80*4)+G80+(L80/5)+(F80*2)+(E80*2)+(K80*2)+(O80/2)+(Q80/2)+(R80/2)+(N80/4)+(P80/4) -> 35 | D80: 2.0 | F80: 1.0 | I80: 2.0 | M80: 5.0 | S80: 0.5 | T80: =0-QUOTIENT(S80, 5) -> 0 | U80: head
A81: Sarnak Dragoon Helm | C81: =(I81*10)+M81+(D81*4)+G81+(L81/5)+(F81*2)+(E81*2)+(K81*2)+(O81/2)+(Q81/2)+(R81/2)+(N81/4)+(P81/4) -> 34.5 | D81: 8.0 | O81: 5.0 | S81: 5.0 | T81: =0-QUOTIENT(S81, 5) -> -1 | U81: head
A82: Kerran Tribal Headband | C82: =(I82*10)+M82+(D82*4)+G82+(L82/5)+(F82*2)+(E82*2)+(K82*2)+(O82/2)+(Q82/2)+(R82/2)+(N82/4)+(P82/4) -> 34 | D82: 1.0 | I82: 2.0 | J82: 2.0 | M82: 10.0 | S82: 00.1 | T82: =0-QUOTIENT(S82, 5) -> 0 | U82: head
A83: Skin of the Garou | C83: =(I83*10)+M83+(D83*4)+G83+(L83/5)+(F83*2)+(E83*2)+(K83*2)+(O83/2)+(Q83/2)+(R83/2)+(N83/4)+(P83/4) -> 32.25 | D83: 4.0 | E83: 5.0 | G83: -5.0 | H83: -5.0 | I83: 2.0 | J83: 2.0 | K83: -5.0 | O83: 5.0 | P83: -5.0 | Q83: -5.0 | R83: 5.0 | S83: 3.0 | T83: =0-QUOTIENT(S83, 5) -> 0 | U83: head
A84: Kerran Headband | C84: =(I84*10)+M84+(D84*4)+G84+(L84/5)+(F84*2)+(E84*2)+(K84*2)+(O84/2)+(Q84/2)+(R84/2)+(N84/4)+(P84/4) -> 32 | D84: 1.0 | E84: 4.0 | I84: 2.0 | S84: 00.1 | T84: =0-QUOTIENT(S84, 5) -> 0 | U84: head
A85: Lesser Cap of Health | C85: =(I85*10)+M85+(D85*4)+G85+(L85/5)+(F85*2)+(E85*2)+(K85*2)+(O85/2)+(Q85/2)+(R85/2)+(N85/4)+(P85/4) -> 32 | D85: 6 | F85: 3 | L85: 10 | S85: 1.5 | U85: head
A86: Ulthork Hide Skullcap | C86: =(I86*10)+M86+(D86*4)+G86+(L86/5)+(F86*2)+(E86*2)+(K86*2)+(O86/2)+(Q86/2)+(R86/2)+(N86/4)+(P86/4) -> 32 | D86: 8.0 | E86: 3.0 | F86: -3.0 | S86: 00.6 | T86: =0-QUOTIENT(S86, 5) -> 0 | U86: head
A87: Fungus Crown | C87: =(I87*10)+M87+(D87*4)+G87+(L87/5)+(F87*2)+(E87*2)+(K87*2)+(O87/2)+(Q87/2)+(R87/2)+(N87/4)+(P87/4) -> 30.5 | D87: 6 | L87: 20 | O87: 5 | S87: 2 | U87: head
A88: Whirling Bloodstone | C88: =(I88*10)+M88+(D88*4)+G88+(L88/5)+(F88*2)+(E88*2)+(K88*2)+(O88/2)+(Q88/2)+(R88/2)+(N88/4)+(P88/4) -> 30 | D88: 0.0 | I88: 3.0 | S88: 00.1 | T88: =0-QUOTIENT(S88, 5) -> 0 | U88: head
A89: Direwolf Fur Hood | C89: =(I89*10)+M89+(D89*4)+G89+(L89/5)+(F89*2)+(E89*2)+(K89*2)+(O89/2)+(Q89/2)+(R89/2)+(N89/4)+(P89/4) -> 28 | D89: 6.0 | H89: 5.0 | L89: 20.0 | S89: 1.0 | T89: =0-QUOTIENT(S89, 5) -> 0 | U89: head
A90: Elven Chainmail Coif | C90: =(I90*10)+M90+(D90*4)+G90+(L90/5)+(F90*2)+(E90*2)+(K90*2)+(O90/2)+(Q90/2)+(R90/2)+(N90/4)+(P90/4) -> 28 | D90: 7.0 | S90: 1.2 | T90: =0-QUOTIENT(S90, 5) -> 0 | U90: head
A91: Vale Reinforced Skullcap | C91: =(I91*10)+M91+(D91*4)+G91+(L91/5)+(F91*2)+(E91*2)+(K91*2)+(O91/2)+(Q91/2)+(R91/2)+(N91/4)+(P91/4) -> 28 | D91: 7.0 | S91: 0.5 | T91: =0-QUOTIENT(S91, 5) -> 0 | U91: head
A92: Crown of Above | C92: =(I92*10)+M92+(D92*4)+G92+(L92/5)+(F92*2)+(E92*2)+(K92*2)+(O92/2)+(Q92/2)+(R92/2)+(N92/4)+(P92/4) -> 27.5 | D92: 5 | O92: 5 | Q92: 5 | R92: 5 | S92: 00.8 | U92: head
A93: Coterie Skullcap | C93: =(I93*10)+M93+(D93*4)+G93+(L93/5)+(F93*2)+(E93*2)+(K93*2)+(O93/2)+(Q93/2)+(R93/2)+(N93/4)+(P93/4) -> 27 | D93: 7 | J93: 2 | Q93: -2 | S93: 00.6 | U93: head
A94: Turtleshell Helm | C94: =(I94*10)+M94+(D94*4)+G94+(L94/5)+(F94*2)+(E94*2)+(K94*2)+(O94/2)+(Q94/2)+(R94/2)+(N94/4)+(P94/4) -> 26 | D94: 5.0 | E94: 3.0 | S94: 6.0 | T94: =0-QUOTIENT(S94, 5) -> -1 | U94: head
A95: Damaged Custodus Centurion Helm | C95: =(I95*10)+M95+(D95*4)+G95+(L95/5)+(F95*2)+(E95*2)+(K95*2)+(O95/2)+(Q95/2)+(R95/2)+(N95/4)+(P95/4) -> 24 | D95: 6 | S95: 6 | U95: head
A96: Damhaged Custodus Legionnaire Helm | C96: =(I96*10)+M96+(D96*4)+G96+(L96/5)+(F96*2)+(E96*2)+(K96*2)+(O96/2)+(Q96/2)+(R96/2)+(N96/4)+(P96/4) -> 24 | D96: 6 | S96: 6 | U96: head
A97: Mithril Studded Skullcap | C97: =(I97*10)+M97+(D97*4)+G97+(L97/5)+(F97*2)+(E97*2)+(K97*2)+(O97/2)+(Q97/2)+(R97/2)+(N97/4)+(P97/4) -> 24 | D97: 6.0 | S97: 0.5 | T97: =0-QUOTIENT(S97, 5) -> 0 | U97: head
A98: Reinforced Skullcap | C98: =(I98*10)+M98+(D98*4)+G98+(L98/5)+(F98*2)+(E98*2)+(K98*2)+(O98/2)+(Q98/2)+(R98/2)+(N98/4)+(P98/4) -> 24 | D98: 6.0 | S98: 00.6 | T98: =0-QUOTIENT(S98, 5) -> 0 | U98: head
A99: Spore Covered Hood | C99: =(I99*10)+M99+(D99*4)+G99+(L99/5)+(F99*2)+(E99*2)+(K99*2)+(O99/2)+(Q99/2)+(R99/2)+(N99/4)+(P99/4) -> 24 | D99: 6 | J99: 1 | S99: 00.4 | U99: head
A100: Stone Circlet | C100: =(I100*10)+M100+(D100*4)+G100+(L100/5)+(F100*2)+(E100*2)+(K100*2)+(O100/2)+(Q100/2)+(R100/2)+(N100/4)+(P100/4) -> 24 | D100: 6.0 | S100: 2.0 | T100: =0-QUOTIENT(S100, 5) -> 0 | U100: head
A101: Vale Studded Skullcap | C101: =(I101*10)+M101+(D101*4)+G101+(L101/5)+(F101*2)+(E101*2)+(K101*2)+(O101/2)+(Q101/2)+(R101/2)+(N101/4)+(P101/4) -> 24 | D101: 6.0 | S101: 0.5 | T101: =0-QUOTIENT(S101, 5) -> 0 | U101: head
A102: Holgresh Fur Cap | C102: =(I102*10)+M102+(D102*4)+G102+(L102/5)+(F102*2)+(E102*2)+(K102*2)+(O102/2)+(Q102/2)+(R102/2)+(N102/4)+(P102/4) -> 23 | D102: 3.0 | G102: 3.0 | H102: 3.0 | J102: 3.0 | M102: 5.0 | O102: 2.0 | Q102: 2.0 | R102: 2.0 | S102: 0.5 | T102: =0-QUOTIENT(S102, 5) -> 0 | U102: head
A103: Gnome Skin Skullcap | C103: =(I103*10)+M103+(D103*4)+G103+(L103/5)+(F103*2)+(E103*2)+(K103*2)+(O103/2)+(Q103/2)+(R103/2)+(N103/4)+(P103/4) -> 21.25 | D103: 5.0 | N103: 5.0 | S103: 1.0 | T103: =0-QUOTIENT(S103, 5) -> 0 | U103: head
A104: Blue Wicker Helm | C104: =(I104*10)+M104+(D104*4)+G104+(L104/5)+(F104*2)+(E104*2)+(K104*2)+(O104/2)+(Q104/2)+(R104/2)+(N104/4)+(P104/4) -> 20 | D104: 5.0 | S104: 00.9 | T104: =0-QUOTIENT(S104, 5) -> 0 | U104: head
A105: Dark Muslin Cap | C105: =(I105*10)+M105+(D105*4)+G105+(L105/5)+(F105*2)+(E105*2)+(K105*2)+(O105/2)+(Q105/2)+(R105/2)+(N105/4)+(P105/4) -> 20 | D105: 5.0 | S105: 00.3 | T105: =0-QUOTIENT(S105, 5) -> 0 | U105: head
A106: Scaled Wolf Hide Cap | C106: =(I106*10)+M106+(D106*4)+G106+(L106/5)+(F106*2)+(E106*2)+(K106*2)+(O106/2)+(Q106/2)+(R106/2)+(N106/4)+(P106/4) -> 19 | D106: 4.0 | J106: 2.0 | Q106: 3.0 | R106: 3.0 | S106: 2.0 | T106: =0-QUOTIENT(S106, 5) -> 0 | U106: head
A107: Cat Skull Cap | C107: =(I107*10)+M107+(D107*4)+G107+(L107/5)+(F107*2)+(E107*2)+(K107*2)+(O107/2)+(Q107/2)+(R107/2)+(N107/4)+(P107/4) -> 17 | D107: 4.0 | O107: 2.0 | S107: 0.5 | T107: =0-QUOTIENT(S107, 5) -> 0 | U107: head
A108: Fungal Field Membrane Helm | C108: =(I108*10)+M108+(D108*4)+G108+(L108/5)+(F108*2)+(E108*2)+(K108*2)+(O108/2)+(Q108/2)+(R108/2)+(N108/4)+(P108/4) -> 16 | D108: 4 | S108: 00.2 | U108: head
A109: Halo of Light | C109: =(I109*10)+M109+(D109*4)+G109+(L109/5)+(F109*2)+(E109*2)+(K109*2)+(O109/2)+(Q109/2)+(R109/2)+(N109/4)+(P109/4) -> 16 | D109: 4.0 | S109: 00.1 | T109: =0-QUOTIENT(S109, 5) -> 0 | U109: head
A110: Leather Skullcap | C110: =(I110*10)+M110+(D110*4)+G110+(L110/5)+(F110*2)+(E110*2)+(K110*2)+(O110/2)+(Q110/2)+(R110/2)+(N110/4)+(P110/4) -> 16 | D110: 4.0 | S110: 00.6 | T110: =0-QUOTIENT(S110, 5) -> 0 | U110: head
A111: Mesh Helm | C111: =(I111*10)+M111+(D111*4)+G111+(L111/5)+(F111*2)+(E111*2)+(K111*2)+(O111/2)+(Q111/2)+(R111/2)+(N111/4)+(P111/4) -> 16 | D111: 4.0 | S111: 00.2 | T111: =0-QUOTIENT(S111, 5) -> 0 | U111: head
A112: Raw-hide Skullcap | C112: =(I112*10)+M112+(D112*4)+G112+(L112/5)+(F112*2)+(E112*2)+(K112*2)+(O112/2)+(Q112/2)+(R112/2)+(N112/4)+(P112/4) -> 16 | D112: 4.0 | S112: 00.9 | T112: =0-QUOTIENT(S112, 5) -> 0 | U112: head
A113: Silk Lined Steel Helm | C113: =(I113*10)+M113+(D113*4)+G113+(L113/5)+(F113*2)+(E113*2)+(K113*2)+(O113/2)+(Q113/2)+(R113/2)+(N113/4)+(P113/4) -> 16 | D113: 4.0 | S113: 00.2 | T113: =0-QUOTIENT(S113, 5) -> 0 | U113: head
A114: Soft Wicker Helm | C114: =(I114*10)+M114+(D114*4)+G114+(L114/5)+(F114*2)+(E114*2)+(K114*2)+(O114/2)+(Q114/2)+(R114/2)+(N114/4)+(P114/4) -> 16 | D114: 4.0 | S114: 00.9 | T114: =0-QUOTIENT(S114, 5) -> 0 | U114: head
A115: Ursa Tresses | C115: =(I115*10)+M115+(D115*4)+G115+(L115/5)+(F115*2)+(E115*2)+(K115*2)+(O115/2)+(Q115/2)+(R115/2)+(N115/4)+(P115/4) -> 16 | D115: 4.0 | S115: 4.0 | T115: =0-QUOTIENT(S115, 5) -> 0 | U115: head
A116: Wild One Wig | C116: =(I116*10)+M116+(D116*4)+G116+(L116/5)+(F116*2)+(E116*2)+(K116*2)+(O116/2)+(Q116/2)+(R116/2)+(N116/4)+(P116/4) -> 16 | D116: 4.0 | S116: 5.0 | T116: =0-QUOTIENT(S116, 5) -> -1 | U116: head
A117: Xakra Kel Cap | C117: =(I117*10)+M117+(D117*4)+G117+(L117/5)+(F117*2)+(E117*2)+(K117*2)+(O117/2)+(Q117/2)+(R117/2)+(N117/4)+(P117/4) -> 16 | D117: 4 | S117: 00.1 | U117: head
A118: Scarab Helm | C118: =(I118*10)+M118+(D118*4)+G118+(L118/5)+(F118*2)+(E118*2)+(K118*2)+(O118/2)+(Q118/2)+(R118/2)+(N118/4)+(P118/4) -> 14 | D118: 4.0 | K118: -1.0 | S118: 1.5 | T118: =0-QUOTIENT(S118, 5) -> 0 | U118: head
A119: Curscale Skullcap | C119: =(I119*10)+M119+(D119*4)+G119+(L119/5)+(F119*2)+(E119*2)+(K119*2)+(O119/2)+(Q119/2)+(R119/2)+(N119/4)+(P119/4) -> 12 | D119: 3.0 | S119: 00.2 | T119: =0-QUOTIENT(S119, 5) -> 0 | U119: head
A120: Dingy Cap | C120: =(I120*10)+M120+(D120*4)+G120+(L120/5)+(F120*2)+(E120*2)+(K120*2)+(O120/2)+(Q120/2)+(R120/2)+(N120/4)+(P120/4) -> 12 | D120: 3 | S120: 00.1 | U120: head
A121: Lupine Locks | C121: =(I121*10)+M121+(D121*4)+G121+(L121/5)+(F121*2)+(E121*2)+(K121*2)+(O121/2)+(Q121/2)+(R121/2)+(N121/4)+(P121/4) -> 12 | D121: 3.0 | S121: 3.5 | T121: =0-QUOTIENT(S121, 5) -> 0 | U121: head
A122: Sensate Reishi Cap | C122: =(I122*10)+M122+(D122*4)+G122+(L122/5)+(F122*2)+(E122*2)+(K122*2)+(O122/2)+(Q122/2)+(R122/2)+(N122/4)+(P122/4) -> 12 | D122: 3 | S122: 00.9 | U122: head
A123: Tattered Skullcap | C123: =(I123*10)+M123+(D123*4)+G123+(L123/5)+(F123*2)+(E123*2)+(K123*2)+(O123/2)+(Q123/2)+(R123/2)+(N123/4)+(P123/4) -> 12 | D123: 3.0 | S123: 00.6 | T123: =0-QUOTIENT(S123, 5) -> 0 | U123: head
A124: Woven Cap | C124: =(I124*10)+M124+(D124*4)+G124+(L124/5)+(F124*2)+(E124*2)+(K124*2)+(O124/2)+(Q124/2)+(R124/2)+(N124/4)+(P124/4) -> 12 | D124: 3.0 | S124: 00.2 | T124: =0-QUOTIENT(S124, 5) -> 0 | U124: head
A125: Damaged Goblin Crown | C125: =(I125*10)+M125+(D125*4)+G125+(L125/5)+(F125*2)+(E125*2)+(K125*2)+(O125/2)+(Q125/2)+(R125/2)+(N125/4)+(P125/4) -> 10 | D125: 2.0 | Q125: 4.0 | S125: 2.0 | T125: =0-QUOTIENT(S125, 5) -> 0 | U125: head
A126: Lord Bergurgle's Crown | C126: =(I126*10)+M126+(D126*4)+G126+(L126/5)+(F126*2)+(E126*2)+(K126*2)+(O126/2)+(Q126/2)+(R126/2)+(N126/4)+(P126/4) -> 10 | D126: 2.0 | Q126: 4.0 | S126: 2.0 | T126: =0-QUOTIENT(S126, 5) -> 0 | U126: head
A127: Azzar's Dreadful Hat | C127: =(I127*10)+M127+(D127*4)+G127+(L127/5)+(F127*2)+(E127*2)+(K127*2)+(O127/2)+(Q127/2)+(R127/2)+(N127/4)+(P127/4) -> 8 | D127: 2.0 | S127: 00.4 | T127: =0-QUOTIENT(S127, 5) -> 0 | U127: head
A128: Blackburrow Braids | C128: =(I128*10)+M128+(D128*4)+G128+(L128/5)+(F128*2)+(E128*2)+(K128*2)+(O128/2)+(Q128/2)+(R128/2)+(N128/4)+(P128/4) -> 8 | D128: 2.0 | S128: 3.5 | T128: =0-QUOTIENT(S128, 5) -> 0 | U128: head
A129: Cloth Cap | C129: =(I129*10)+M129+(D129*4)+G129+(L129/5)+(F129*2)+(E129*2)+(K129*2)+(O129/2)+(Q129/2)+(R129/2)+(N129/4)+(P129/4) -> 8 | D129: 2.0 | S129: 00.2 | T129: =0-QUOTIENT(S129, 5) -> 0 | U129: head
A130: Dusty Burlap Hood | C130: =(I130*10)+M130+(D130*4)+G130+(L130/5)+(F130*2)+(E130*2)+(K130*2)+(O130/2)+(Q130/2)+(R130/2)+(N130/4)+(P130/4) -> 8 | D130: 2.0 | S130: 00.2 | T130: =0-QUOTIENT(S130, 5) -> 0 | U130: head
A131: Netted Cap | C131: =(I131*10)+M131+(D131*4)+G131+(L131/5)+(F131*2)+(E131*2)+(K131*2)+(O131/2)+(Q131/2)+(R131/2)+(N131/4)+(P131/4) -> 8 | D131: 2.0 | S131: 00.2 | T131: =0-QUOTIENT(S131, 5) -> 0 | U131: head
A132: Whirling Jasper | C132: =(I132*10)+M132+(D132*4)+G132+(L132/5)+(F132*2)+(E132*2)+(K132*2)+(O132/2)+(Q132/2)+(R132/2)+(N132/4)+(P132/4) -> 6 | D132: 0.0 | F132: 3.0 | S132: 00.1 | T132: =0-QUOTIENT(S132, 5) -> 0 | U132: head
A133: Whirling Onyx | C133: =(I133*10)+M133+(D133*4)+G133+(L133/5)+(F133*2)+(E133*2)+(K133*2)+(O133/2)+(Q133/2)+(R133/2)+(N133/4)+(P133/4) -> 6 | D133: 0.0 | E133: 3.0 | S133: 00.1 | T133: =0-QUOTIENT(S133, 5) -> 0 | U133: head
A134: Whirling Agate | C134: =(I134*10)+M134+(D134*4)+G134+(L134/5)+(F134*2)+(E134*2)+(K134*2)+(O134/2)+(Q134/2)+(R134/2)+(N134/4)+(P134/4) -> 5 | D134: 0.0 | O134: 10.0 | S134: 0.0 | T134: =0-QUOTIENT(S134, 5) -> 0 | U134: head
A135: Whirling Hematite | C135: =(I135*10)+M135+(D135*4)+G135+(L135/5)+(F135*2)+(E135*2)+(K135*2)+(O135/2)+(Q135/2)+(R135/2)+(N135/4)+(P135/4) -> 5 | D135: 0.0 | Q135: 10.0 | S135: 00.1 | T135: =0-QUOTIENT(S135, 5) -> 0 | U135: head
A136: Catacomb Curls | C136: =(I136*10)+M136+(D136*4)+G136+(L136/5)+(F136*2)+(E136*2)+(K136*2)+(O136/2)+(Q136/2)+(R136/2)+(N136/4)+(P136/4) -> 4 | D136: 1.0 | S136: 1.0 | T136: =0-QUOTIENT(S136, 5) -> 0 | U136: head
A137: Giant Sized Monacle | C137: =(I137*10)+M137+(D137*4)+G137+(L137/5)+(F137*2)+(E137*2)+(K137*2)+(O137/2)+(Q137/2)+(R137/2)+(N137/4)+(P137/4) -> 4 | D137: 1.0 | J137: 1.0 | S137: 00.1 | T137: =0-QUOTIENT(S137, 5) -> 0 | U137: head
A138: Rat Fur Cap | C138: =(I138*10)+M138+(D138*4)+G138+(L138/5)+(F138*2)+(E138*2)+(K138*2)+(O138/2)+(Q138/2)+(R138/2)+(N138/4)+(P138/4) -> 4 | D138: 1.0 | S138: 00.3 | T138: =0-QUOTIENT(S138, 5) -> 0 | U138: head
A139: Shazda Turbin | C139: =(I139*10)+M139+(D139*4)+G139+(L139/5)+(F139*2)+(E139*2)+(K139*2)+(O139/2)+(Q139/2)+(R139/2)+(N139/4)+(P139/4) -> 4 | D139: 0.0 | G139: 4.0 | H139: 4.0 | S139: 00.2 | T139: =0-QUOTIENT(S139, 5) -> 0 | U139: head
A140: Whirling Carnelian | C140: =(I140*10)+M140+(D140*4)+G140+(L140/5)+(F140*2)+(E140*2)+(K140*2)+(O140/2)+(Q140/2)+(R140/2)+(N140/4)+(P140/4) -> 3 | D140: 0.0 | G140: 3.0 | S140: 00.1 | T140: =0-QUOTIENT(S140, 5) -> 0 | U140: head
A141: Whirling Lapis Lazuli | C141: =(I141*10)+M141+(D141*4)+G141+(L141/5)+(F141*2)+(E141*2)+(K141*2)+(O141/2)+(Q141/2)+(R141/2)+(N141/4)+(P141/4) -> 2.5 | D141: 0.0 | P141: 10.0 | S141: 00.1 | T141: =0-QUOTIENT(S141, 5) -> 0 | U141: head
A142: Whirling Malachite | C142: =(I142*10)+M142+(D142*4)+G142+(L142/5)+(F142*2)+(E142*2)+(K142*2)+(O142/2)+(Q142/2)+(R142/2)+(N142/4)+(P142/4) -> 2.5 | D142: 0.0 | N142: 10.0 | S142: 00.1 | T142: =0-QUOTIENT(S142, 5) -> 0 | U142: head
A143: Stoneglint Lime Plume | C143: =(I143*10)+M143+(D143*4)+G143+(L143/5)+(F143*2)+(E143*2)+(K143*2)+(O143/2)+(Q143/2)+(R143/2)+(N143/4)+(P143/4) -> 2 | D143: 0.0 | K143: 1.0 | S143: 00.2 | T143: =0-QUOTIENT(S143, 5) -> 0 | U143: head
A144: Stoneleer Emerald Plume | C144: =(I144*10)+M144+(D144*4)+G144+(L144/5)+(F144*2)+(E144*2)+(K144*2)+(O144/2)+(Q144/2)+(R144/2)+(N144/4)+(P144/4) -> 0 | D144: 0.0 | S144: 00.2 | T144: =0-QUOTIENT(S144, 5) -> 0 | U144: head
A145: Useless Cloth Cap | C145: =(I145*10)+M145+(D145*4)+G145+(L145/5)+(F145*2)+(E145*2)+(K145*2)+(O145/2)+(Q145/2)+(R145/2)+(N145/4)+(P145/4) -> 0 | D145: 0.0 | S145: 00.2 | T145: =0-QUOTIENT(S145, 5) -> 0 | U145: head
A146: Whirling Amber | C146: =(I146*10)+M146+(D146*4)+G146+(L146/5)+(F146*2)+(E146*2)+(K146*2)+(O146/2)+(Q146/2)+(R146/2)+(N146/4)+(P146/4) -> 0 | D146: 0.0 | J146: 3.0 | S146: 0.0 | T146: =0-QUOTIENT(S146, 5) -> 0 | U146: head
A147: Whirling Crystal | C147: =(I147*10)+M147+(D147*4)+G147+(L147/5)+(F147*2)+(E147*2)+(K147*2)+(O147/2)+(Q147/2)+(R147/2)+(N147/4)+(P147/4) -> 0 | D147: 0.0 | H147: 3.0 | S147: 0.0 | T147: =0-QUOTIENT(S147, 5) -> 0 | U147: head
A148: Red Headband | C148: =(I148*10)+M148+(D148*4)+G148+(L148/5)+(F148*2)+(E148*2)+(K148*2)+(O148/2)+(Q148/2)+(R148/2)+(N148/4)+(P148/4) -> -8 | D148: 3.0 | H148: 1.0 | K148: -10.0 | S148: 0.0 | T148: =0-QUOTIENT(S148, 5) -> 0 | U148: head