D1: AC | F1: Str | G1: Sta | H1: Dex | I1: Agi | J1: Int | K1: Wis | L1: Cha | N1: HP | O1: Mana | Q1: Sv Magic | R1: Sv Fire | S1: Sv Cold | T1: Sv Poison | U1: Sv Disease | W1: Effect
A2: Chestplate | B2: Plane of Fear | D2: 26 | F2: 9 | K2: 13 | N2: 50
B3: Kunark | D3: 35 | F3: 10 | H3: 10 | I3: 10 | K3: 10 | W3: Ring of Faydark
B4: Thurgadin | D4: 37 | F4: 6 | G4: 6 | H4: 6 | I4: 6 | K4: 14 | O4: 60 | Q4: 7 | T4: 3 | W4: Call of Earth
B5: Kael | D5: 48 | F5: 14 | G5: 7 | H5: 7 | I5: 7 | K5: 7 | N5: 50 | O5: 50 | Q5: 7 | S5: 5 | W5: Call of Earth
B6: Skyshrine | D6: 43 | F6: 10 | G6: 8 | H6: 8 | I6: 10 | K6: 10 | N6: 70 | O6: 30 | Q6: 10 | R6: 2 | S6: 2 | T6: 1 | U6: 5 | W6: Call of Earth
A8: Legs | B8: Plane of Fear | D8: 14 | I8: 9 | K8: 5 | O8: 15 | U8: 7
B9: Kunark | D9: 24 | F9: 8 | H9: 8 | I9: 8 | K9: 8 | W9: Cancel Magic
B10: Thurgadin | D10: 22 | G10: 10 | H10: 4 | K10: 4 | N10: 60 | Q10: 1 | R10: 1 | S10: 1 | T10: 1 | U10: 1
B11: Kael | D11: 32 | F11: 5 | H11: 4 | K11: 14 | N11: 60 | Q11: 1 | R11: 1 | S11: 1 | T11: 1 | U11: 1
B12: Skyshrine | D12: 26 | F12: 8 | G12: 5 | H12: 10 | N12: 60 | O12: 20 | Q12: 3 | R12: 3 | S12: 3 | T12: 2 | U12: 2
A14: Arms | B14: Plane of Fear | D14: 13 | H14: 9 | J14: 9 | Q14: 7
B15: Kunark | D15: 18 | W15: Stinging Swarm
B16: Thurgadin | D16: 16 | F16: 7 | O16: 30 | Q16: 3 | S16: 3
B17: Kael | D17: 24 | F17: 2 | I17: 2 | K17: 7 | O17: 30 | Q17: 3 | T17: 2
B18: Skyshrine | D18: 16 | G18: 10 | N18: 30 | Q18: 3 | R18: 3
A20: Hands | B20: Plane of Fear | D20: 11 | F20: 9 | H20: 9 | Q20: 7
B21: Kunark | D21: 14 | W21: Snare
B22: Thurgadin | D22: 13 | F22: 2 | G22: 1 | H22: 1 | I22: 1 | K22: 2 | O22: 10 | Q22: 2
B23: Kael | D23: 17 | F23: 2 | G23: 3 | H23: 1 | I23: 1 | K23: 2 | O23: 10 | Q23: 2
B24: Skyshrine | D24: 16 | F24: 3 | G24: 2 | H24: 2 | I24: 2 | K24: 3 | O24: 10 | Q24: 4 | R24: 1 | S24: 1 | T24: 1 | U24: 1
A26: Feet | B26: Plane of Fear | D26: 14 | F26: 5 | G26: 5 | I26: 9 | T26: 7
B27: Kunark | D27: 18 | W27: Invigor
B28: Thurgadin | D28: 18 | F28: 4 | H28: 2
B29: Kael | D29: 24 | F29: 3 | H29: 2 | I29: 2
B30: Skyshrine | D30: 21 | F30: 4 | G30: 4 | H30: 4 | N30: 20
A32: Head | B32: Plane of Fear | D32: 14 | K32: 5 | L32: 9 | O32: 10 | S32: 8
B33: Kunark | D33: 18 | W33: Superior Camoflauge
B34: Thurgadin | D34: 16 | F34: 4 | G34: 3 | H34: 3 | N34: 15 | Q34: 2 | R34: 3
B35: Kael | D35: 19 | G35: 5 | H35: 5 | O35: 30 | Q35: 2 | U35: 3
B36: Skyshrine | D36: 19 | F36: 5 | H36: 5 | K36: 5 | N36: 40 | O36: 20 | Q36: 5 | S36: 4
A38: Wrist | B38: Plane of Fear | D38: 9 | G38: 5 | I38: 5 | K38: 5 | O38: 10
B39: Kunark | D39: 14 | W39: Summon Arrows
B40: Thurgadin | D40: 13 | G40: 2 | K40: 3 | N40: 10 | O40: 10 | S40: 1
B41: Kael | D41: 17 | F41: 3 | H41: 4 | N41: 10 | O41: 10 | R41: 1 | U41: 1
B42: Skyshrine | D42: 16 | F42: 7 | K42: 3 | N42: 10 | O42: 10
A44: Total | B44: Plane of Fear | D44: =D2+D8+D14+D20+D26+D32+2*D38 -> 110 | F44: =F2+F8+F14+F20+F26+F32+2*F38 -> 23 | G44: =G2+G8+G14+G20+G26+G32+2*G38 -> 15 | H44: =H2+H8+H14+H20+H26+H32+2*H38 -> 18 | I44: =I2+I8+I14+I20+I26+I32+2*I38 -> 28 | J44: =J2+J8+J14+J20+J26+J32+2*J38 -> 9 | K44: =K2+K8+K14+K20+K26+K32+2*K38 -> 33 | L44: =L2+L8+L14+L20+L26+L32+2*L38 -> 9 | N44: =N2+N8+N14+N20+N26+N32+2*N38 -> 50 | O44: =O2+O8+O14+O20+O26+O32+2*O38 -> 45 | Q44: =Q2+Q8+Q14+Q20+Q26+Q32+2*Q38 -> 14 | R44: =R2+R8+R14+R20+R26+R32+2*R38 -> 0 | S44: =S2+S8+S14+S20+S26+S32+2*S38 -> 8 | T44: =T2+T8+T14+T20+T26+T32+2*T38 -> 7 | U44: =U2+U8+U14+U20+U26+U32+2*U38 -> 7
B45: Kunark | D45: =D3+D9+D15+D21+D27+D33+2*D39 -> 155 | F45: =F3+F9+F15+F21+F27+F33+2*F39 -> 18 | G45: =G3+G9+G15+G21+G27+G33+2*G39 -> 0 | H45: =H3+H9+H15+H21+H27+H33+2*H39 -> 18 | I45: =I3+I9+I15+I21+I27+I33+2*I39 -> 18 | J45: =J3+J9+J15+J21+J27+J33+2*J39 -> 0 | K45: =K3+K9+K15+K21+K27+K33+2*K39 -> 18 | L45: =L3+L9+L15+L21+L27+L33+2*L39 -> 0 | N45: =N3+N9+N15+N21+N27+N33+2*N39 -> 0 | O45: =O3+O9+O15+O21+O27+O33+2*O39 -> 0 | Q45: =Q3+Q9+Q15+Q21+Q27+Q33+2*Q39 -> 0 | R45: =R3+R9+R15+R21+R27+R33+2*R39 -> 0 | S45: =S3+S9+S15+S21+S27+S33+2*S39 -> 0 | T45: =T3+T9+T15+T21+T27+T33+2*T39 -> 0 | U45: =U3+U9+U15+U21+U27+U33+2*U39 -> 0
B46: Thurgadin | D46: =D4+D10+D16+D22+D28+D34+2*D40 -> 148 | F46: =F4+F10+F16+F22+F28+F34+2*F40 -> 23 | G46: =G4+G10+G16+G22+G28+G34+2*G40 -> 24 | H46: =H4+H10+H16+H22+H28+H34+2*H40 -> 16 | I46: =I4+I10+I16+I22+I28+I34+2*I40 -> 7 | J46: =J4+J10+J16+J22+J28+J34+2*J40 -> 0 | K46: =K4+K10+K16+K22+K28+K34+2*K40 -> 26 | L46: =L4+L10+L16+L22+L28+L34+2*L40 -> 0 | N46: =N4+N10+N16+N22+N28+N34+2*N40 -> 95 | O46: =O4+O10+O16+O22+O28+O34+2*O40 -> 120 | Q46: =Q4+Q10+Q16+Q22+Q28+Q34+2*Q40 -> 15 | R46: =R4+R10+R16+R22+R28+R34+2*R40 -> 4 | S46: =S4+S10+S16+S22+S28+S34+2*S40 -> 6 | T46: =T4+T10+T16+T22+T28+T34+2*T40 -> 4 | U46: =U4+U10+U16+U22+U28+U34+2*U40 -> 1
B47: Kael | D47: =D5+D11+D17+D23+D29+D35+2*D41 -> 198 | F47: =F5+F11+F17+F23+F29+F35+2*F41 -> 32 | G47: =G5+G11+G17+G23+G29+G35+2*G41 -> 15 | H47: =H5+H11+H17+H23+H29+H35+2*H41 -> 27 | I47: =I5+I11+I17+I23+I29+I35+2*I41 -> 12 | J47: =J5+J11+J17+J23+J29+J35+2*J41 -> 0 | K47: =K5+K11+K17+K23+K29+K35+2*K41 -> 30 | L47: =L5+L11+L17+L23+L29+L35+2*L41 -> 0 | N47: =N5+N11+N17+N23+N29+N35+2*N41 -> 130 | O47: =O5+O11+O17+O23+O29+O35+2*O41 -> 140 | Q47: =Q5+Q11+Q17+Q23+Q29+Q35+2*Q41 -> 15 | R47: =R5+R11+R17+R23+R29+R35+2*R41 -> 3 | S47: =S5+S11+S17+S23+S29+S35+2*S41 -> 6 | T47: =T5+T11+T17+T23+T29+T35+2*T41 -> 3 | U47: =U5+U11+U17+U23+U29+U35+2*U41 -> 6
B48: Skyshrine | D48: =D6+D12+D18+D24+D30+D36+2*D42 -> 173 | F48: =F6+F12+F18+F24+F30+F36+2*F42 -> 44 | G48: =G6+G12+G18+G24+G30+G36+2*G42 -> 29 | H48: =H6+H12+H18+H24+H30+H36+2*H42 -> 29 | I48: =I6+I12+I18+I24+I30+I36+2*I42 -> 12 | J48: =J6+J12+J18+J24+J30+J36+2*J42 -> 0 | K48: =K6+K12+K18+K24+K30+K36+2*K42 -> 24 | L48: =L6+L12+L18+L24+L30+L36+2*L42 -> 0 | N48: =N6+N12+N18+N24+N30+N36+2*N42 -> 240 | O48: =O6+O12+O18+O24+O30+O36+2*O42 -> 100 | Q48: =Q6+Q12+Q18+Q24+Q30+Q36+2*Q42 -> 25 | R48: =R6+R12+R18+R24+R30+R36+2*R42 -> 9 | S48: =S6+S12+S18+S24+S30+S36+2*S42 -> 10 | T48: =T6+T12+T18+T24+T30+T36+2*T42 -> 4 | U48: =U6+U12+U18+U24+U30+U36+2*U42 -> 8