A1: Name | B1: Effect | C1: DMG | D1: DLY | E1: Dmg/Dly | F1: STR | G1: STA | H1: AGI | I1: DEX | J1: WIS | K1: INT | L1: CHA | M1: HP | N1: MANA | O1: PR | P1: MR | Q1: DR | R1: FR | S1: CR | T1: WT | U1: WP | V1: Type
A2: A Club Clad Blackjack | C2: 7.0 | D2: 21.0 | E2: =D2/C2 -> 3.0 | T2: 0.0 | U2: =0-QUOTIENT(T2,3) -> 0.0 | V2: 1hb
A3: Arcane Staff of Duir | C3: 13.0 | D3: 29.0 | E3: =D3/C3 -> 2.2307692307692308 | F3: 7.0 | G3: 6.0 | H3: 3.0 | I3: 6.0 | J3: 4.0 | L3: 3.0 | M3: 35.0 | N3: 25.0 | P3: 10.0 | T3: 3.5 | V3: 1hb
A4: Astral Mace | C4: 13.0 | D4: 28.0 | E4: =D4/C4 -> 2.1538461538461537 | F4: 6.0 | G4: 7.0 | H4: 4.0 | I4: 7.0 | J4: 8.0 | L4: 4.0 | M4: 60.0 | N4: 25.0 | S4: 15.0 | T4: 3.5 | V4: 1hb
A5: Bamboo Tanto Bo | C5: 5.0 | D5: 33.0 | E5: =D5/C5 -> 6.6 | T5: 8.5 | U5: =0-QUOTIENT(T5,3) -> -2.0 | V5: 1hb
A6: Bamboo Wakizashi Bo | C6: 6.0 | D6: 38.0 | E6: =D6/C6 -> 6.333333333333333 | T6: 8.5 | U6: =0-QUOTIENT(T6,3) -> -2.0 | V6: 1hb
A7: Battle Scarred Wingblade | C7: 13.0 | D7: 25.0 | E7: =D7/C7 -> 1.9230769230769231 | J7: 4.0 | T7: 5.0 | V7: 1hb
A8: Blackjack | C8: 7.0 | D8: 21.0 | E8: =D8/C8 -> 3.0 | T8: 1.9 | U8: =0-QUOTIENT(T8,3) -> 0.0 | V8: 1hb
A9: Blam Stick | C9: 30.0 | D9: 40.0 | E9: =D9/C9 -> 1.3333333333333333 | T9: 0.0 | U9: =0-QUOTIENT(T9,3) -> 0.0 | V9: 1hb
A10: Blood Crusted Kobold Mace | C10: 7.0 | D10: 38.0 | E10: =D10/C10 -> 5.4285714285714288 | F10: 3.0 | M10: 5.0 | T10: 9.0 | U10: =0-QUOTIENT(T10,3) -> -3.0 | V10: 1hb
A11: Blydreln's Bane | C11: 11.0 | D11: 24.0 | E11: =D11/C11 -> 2.1818181818181817 | F11: 10.0 | H11: 15.0 | M11: 50.0 | S11: 30.0 | T11: 4.5 | U11: =0-QUOTIENT(T11,3) -> -1.0 | V11: 1hb
A12: Bone Handled Scimitar | C12: 6.0 | D12: 30.0 | E12: =D12/C12 -> 5.0 | T12: 7.5 | V12: 1hb
A13: Brell's Keg Popper | B13: Yaulp II | C13: 15.0 | D13: 35.0 | E13: =D13/C13 -> 2.3333333333333335 | T13: 3.2 | U13: =0-QUOTIENT(T13,3) -> -1.0 | V13: 1hb
A14: Bronze Flail | C14: 6.0 | D14: 37.0 | E14: =D14/C14 -> 6.166666666666667 | T14: 10.0 | U14: =0-QUOTIENT(T14,3) -> -3.0 | V14: 1hb
A15: Bronze Mace | C15: 6.0 | D15: 38.0 | E15: =D15/C15 -> 6.333333333333333 | T15: 9.0 | U15: =0-QUOTIENT(T15,3) -> -3.0 | V15: 1hb
A16: Bronze Tonfa | C16: 5.0 | D16: 35.0 | E16: =D16/C16 -> 7.0 | T16: 6.0 | U16: =0-QUOTIENT(T16,3) -> -2.0 | V16: 1hb
A17: Bronze Warclub | C17: 5.0 | D17: 35.0 | E17: =D17/C17 -> 7.0 | T17: 6.0 | U17: =0-QUOTIENT(T17,3) -> -2.0 | V17: 1hb
A18: Cast Iron Stein | C18: 5.0 | D18: 31.0 | E18: =D18/C18 -> 6.2 | G18: 2.0 | J18: 3.0 | T18: 4.3 | U18: =0-QUOTIENT(T18,3) -> -1.0 | V18: 1hb
A19: Cast-Iron Warhammer | C19: 4.0 | D19: 30.0 | E19: =D19/C19 -> 7.5 | T19: 7.5 | U19: =0-QUOTIENT(T19,3) -> -2.0 | V19: 1hb
A20: Centi Warhammer | C20: 15.0 | D20: 32.0 | E20: =D20/C20 -> 2.1333333333333333 | F20: 5.0 | G20: 5.0 | J20: 2.0 | T20: 6.0 | V20: 1hb
A21: Claw Beast Talon Club | C21: 5.0 | D21: 30.0 | E21: =D21/C21 -> 6.0 | F21: 3.0 | G21: 3.0 | T21: 2.0 | V21: 1hb
A22: Club | C22: 4.0 | D22: 27.0 | E22: =D22/C22 -> 6.75 | T22: 5.0 | U22: =0-QUOTIENT(T22,3) -> -1.0 | V22: 1hb
A23: Cold Iron Morning Star | C23: 9.0 | D23: 35.0 | E23: =D23/C23 -> 3.8888888888888888 | T23: 4.5 | U23: =0-QUOTIENT(T23,3) -> -1.0 | V23: 1hb
A24: Combine Morning Star | C24: 8.0 | D24: 38.0 | E24: =D24/C24 -> 4.75 | T24: 10.0 | U24: =0-QUOTIENT(T24,3) -> -3.0 | V24: 1hb
A25: Cracked Dragon Bone | C25: 5.0 | D25: 32.0 | E25: =D25/C25 -> 6.4 | T25: 8.5 | U25: =0-QUOTIENT(T25,3) -> -2.0 | V25: 1hb
A26: Cracked Staff | C26: 5.0 | D26: 32.0 | E26: =D26/C26 -> 6.4 | T26: 8.5 | U26: =0-QUOTIENT(T26,3) -> -2.0 | V26: 1hb
A27: Crude Bone Flail | C27: 5.0 | D27: 37.0 | E27: =D27/C27 -> 7.4 | T27: 9.0 | V27: 1hb
A28: Crude Stone Flail | C28: 6.0 | D28: 44.0 | E28: =D28/C28 -> 7.333333333333333 | T28: 10.0 | V28: 1hb
A29: Crystalized Shadow Hammer | C29: 7.0 | D29: 29.0 | E29: =D29/C29 -> 4.1428571428571432 | F29: 2.0 | G29: 2.0 | L29: 1.0 | M29: 5.0 | T29: 7.3 | U29: =0-QUOTIENT(T29,3) -> -2.0 | V29: 1hb
A30: Crystalized Shadow Star | C30: 9.0 | D30: 37.0 | E30: =D30/C30 -> 4.1111111111111107 | F30: 2.0 | G30: 2.0 | L30: 1.0 | M30: 5.0 | T30: 10.0 | U30: =0-QUOTIENT(T30,3) -> -3.0 | V30: 1hb
A31: Dark Ember | B31: Burn | C31: 13.0 | D31: 32.0 | E31: =D31/C31 -> 2.4615384615384617 | F31: 2.0 | J31: 5.0 | M31: 20.0 | N31: 20.0 | R31: 7.0 | T31: 5.0 | U31: =0-QUOTIENT(T31,3) -> -1.0 | V31: 1hb
A32: Dark Steel Great Staff | C32: 15.0 | D32: 32.0 | E32: =D32/C32 -> 2.1333333333333333 | F32: 5.0 | G32: 5.0 | J32: 2.0 | T32: 6.0 | V32: 1hb
A33: Dark Steel Morning Star | C33: 10.0 | D33: 38.0 | E33: =D33/C33 -> 3.8 | F33: 1.0 | M33: 5.0 | N33: 5.0 | T33: 10.0 | V33: 1hb
A34: Dark Steel Scimitar | C34: 6.0 | D34: 24.0 | E34: =D34/C34 -> 4.0 | T34: 0.0 | V34: 1hb
A35: Dark Steel Warhammer | C35: 8.0 | D35: 30.0 | E35: =D35/C35 -> 3.75 | F35: 1.0 | M35: 5.0 | N35: 5.0 | T35: 7.3 | V35: 1hb
A36: Darkwood Staff | C36: 5.0 | D36: 28.0 | E36: =D36/C36 -> 5.6 | T36: 6.5 | U36: =0-QUOTIENT(T36,3) -> -2.0 | V36: 1hb
A37: Deathmaw Claw Club | C37: 6.0 | D37: 35.0 | E37: =D37/C37 -> 5.833333333333333 | T37: 1.0 | V37: 1hb
A38: Delgin's Sceptre | C38: 8.0 | D38: 24.0 | E38: =D38/C38 -> 3.0 | F38: 5.0 | H38: 2.0 | J38: 3.0 | N38: 10.0 | P38: 3.0 | S38: 4.0 | T38: 1.5 | U38: =0-QUOTIENT(T38,3) -> 0.0 | V38: 1hb
A39: Di`zok Escape Staff | B39: Evacuate Nek | C39: 21.0 | D39: 40.0 | E39: =D39/C39 -> 1.9047619047619047 | T39: 5.0 | U39: =0-QUOTIENT(T39,3) -> -1.0 | V39: 1hb
A40: Di`zok Sceptre of Authority | C40: 10.0 | D40: 20.0 | E40: =D40/C40 -> 2.0 | J40: 5.0 | K40: 5.0 | N40: 25.0 | P40: 5.0 | T40: 3.0 | U40: =0-QUOTIENT(T40,3) -> -1.0 | V40: 1hb
A41: Dwarven Mace | C41: 8.0 | D41: 35.0 | E41: =D41/C41 -> 4.375 | T41: 4.5 | U41: =0-QUOTIENT(T41,3) -> -1.0 | V41: 1hb
A42: Dwarven Warhammer | C42: 7.0 | D42: 33.0 | E42: =D42/C42 -> 4.7142857142857144 | T42: 7.5 | U42: =0-QUOTIENT(T42,3) -> -2.0 | V42: 1hb
A43: Ebonwood Cudgel | C43: 8.0 | D43: 24.0 | E43: =D43/C43 -> 3.0 | F43: 5.0 | I43: 5.0 | T43: 4.5 | U43: =0-QUOTIENT(T43,3) -> -1.0 | V43: 1hb
A44: Efreeti Standard | C44: 3.0 | D44: 10.0 | E44: =D44/C44 -> 3.3333333333333335 | T44: 10.0 | U44: =0-QUOTIENT(T44,3) -> -3.0 | V44: 1hb
A45: Efreeti War Club | C45: 11.0 | D45: 26.0 | E45: =D45/C45 -> 2.3636363636363638 | T45: 1.0 | U45: =0-QUOTIENT(T45,3) -> 0.0 | V45: 1hb
A46: Enamelled Black Mace | C46: 8.0 | D46: 28.0 | E46: =D46/C46 -> 3.5 | T46: 4.5 | U46: =0-QUOTIENT(T46,3) -> -1.0 | V46: 1hb
A47: Enchanted Fine Steel Morning Star | C47: 7.0 | D47: 30.0 | E47: =D47/C47 -> 4.2857142857142856 | F47: 2.0 | J47: 5.0 | T47: 9.0 | U47: =0-QUOTIENT(T47,3) -> -3.0 | V47: 1hb
A48: Etched Steel Baton | C48: 14.0 | D48: 28.0 | E48: =D48/C48 -> 2.0 | O48: 10.0 | S48: 10.0 | T48: 3.0 | U48: =0-QUOTIENT(T48,3) -> -1.0 | V48: 1hb
A49: Etched Velium Battlehammer | C49: 11.0 | D49: 20.0 | E49: =D49/C49 -> 1.8181818181818181 | T49: 3.5 | U49: =0-QUOTIENT(T49,3) -> -1.0 | V49: 1hb
A50: Exquisite Velium Battlehammer | C50: 12.0 | D50: 20.0 | E50: =D50/C50 -> 1.6666666666666667 | T50: 3.5 | U50: =0-QUOTIENT(T50,3) -> -1.0 | V50: 1hb
A51: Fading Shadow Star | C51: 9.0 | D51: 37.0 | E51: =D51/C51 -> 4.1111111111111107 | M51: 2.0 | T51: 10.0 | U51: =0-QUOTIENT(T51,3) -> -3.0 | V51: 1hb
A52: Fatesealer | C52: 9.0 | D52: 18.0 | E52: =D52/C52 -> 2.0 | F52: 4.0 | I52: 4.0 | J52: 8.0 | K52: 8.0 | M52: 75.0 | N52: 75.0 | T52: 3.5 | U52: =0-QUOTIENT(T52,3) -> -1.0 | V52: 1hb
A53: Fine Steel Morning Star | C53: 8.0 | D53: 38.0 | E53: =D53/C53 -> 4.75 | T53: 10.0 | U53: =0-QUOTIENT(T53,3) -> -3.0 | V53: 1hb
A54: Fine Steel Tonfa | C54: 6.0 | D54: 29.0 | E54: =D54/C54 -> 4.833333333333333 | T54: 6.0 | U54: =0-QUOTIENT(T54,3) -> -2.0 | V54: 1hb
A55: Fine Steel Warhammer | C55: 6.0 | D55: 30.0 | E55: =D55/C55 -> 5.0 | T55: 7.4 | U55: =0-QUOTIENT(T55,3) -> -2.0 | V55: 1hb
A56: Flail | C56: 7.0 | D56: 36.0 | E56: =D56/C56 -> 5.1428571428571432 | T56: 9.0 | U56: =0-QUOTIENT(T56,3) -> -3.0 | V56: 1hb
A57: Flint Hammer | C57: 5.0 | D57: 30.0 | E57: =D57/C57 -> 6.0 | J57: 2.0 | N57: 10.0 | T57: 8.0 | V57: 1hb
A58: Focused Ethereal Morning Star | C58: 8.0 | D58: 37.0 | E58: =D58/C58 -> 4.625 | H58: 4.0 | I58: 2.0 | T58: 5.0 | U58: =0-QUOTIENT(T58,3) -> -1.0 | V58: 1hb
A59: Focused Ethereal Warhammer | C59: 6.0 | D59: 29.0 | E59: =D59/C59 -> 4.833333333333333 | H59: 4.0 | I59: 2.0 | T59: 3.7 | U59: =0-QUOTIENT(T59,3) -> -1.0 | V59: 1hb
A60: Fool's Gold Stein | C60: 2.0 | D60: 30.0 | E60: =D60/C60 -> 15.0 | T60: 1.0 | U60: =0-QUOTIENT(T60,3) -> 0.0 | V60: 1hb
A61: Forest Giant Hammer | C61: 10.0 | D61: 35.0 | E61: =D61/C61 -> 3.5 | T61: 8.0 | U61: =0-QUOTIENT(T61,3) -> -2.0 | V61: 1hb
A62: Forged Hammer of Dalnir | C62: 6.0 | D62: 50.0 | E62: =D62/C62 -> 8.3333333333333339 | T62: 15.0 | U62: =0-QUOTIENT(T62,3) -> -5.0 | V62: 1hb
A63: Forged Mace | C63: 7.0 | D63: 36.0 | E63: =D63/C63 -> 5.1428571428571432 | T63: 8.0 | U63: =0-QUOTIENT(T63,3) -> -2.0 | V63: 1hb
A64: Forged Morning Star | C64: 8.0 | D64: 38.0 | E64: =D64/C64 -> 4.75 | T64: 9.0 | U64: =0-QUOTIENT(T64,3) -> -3.0 | V64: 1hb
A65: Forged Velium Battlehammer | C65: 11.0 | D65: 23.0 | E65: =D65/C65 -> 2.0909090909090908 | T65: 3.5 | U65: =0-QUOTIENT(T65,3) -> -1.0 | V65: 1hb
A66: Forged Warhammer | C66: 6.0 | D66: 30.0 | E66: =D66/C66 -> 5.0 | T66: 7.5 | U66: =0-QUOTIENT(T66,3) -> -2.0 | V66: 1hb
A67: Forging Hammer | C67: 4.0 | D67: 38.0 | E67: =D67/C67 -> 9.5 | T67: 6.5 | U67: =0-QUOTIENT(T67,3) -> -2.0 | V67: 1hb
A68: Garou Bone Club | B68: Curse of the Garou | C68: 5.0 | D68: 25.0 | E68: =D68/C68 -> 5.0 | J68: 7.0 | K68: 7.0 | T68: 4.0 | U68: =0-QUOTIENT(T68,3) -> -1.0 | V68: 1hb
A69: Gavel | C69: 4.0 | D69: 38.0 | E69: =D69/C69 -> 9.5 | T69: 6.5 | U69: =0-QUOTIENT(T69,3) -> -2.0 | V69: 1hb
A70: Gem-Encrusted Scepter | C70: 7.0 | D70: 28.0 | E70: =D70/C70 -> 4.0 | J70: 5.0 | T70: 4.5 | U70: =0-QUOTIENT(T70,3) -> -1.0 | V70: 1hb
A71: Goblin Knee Cracker | C71: 5.0 | D71: 29.0 | E71: =D71/C71 -> 5.8 | T71: 3.8 | U71: =0-QUOTIENT(T71,3) -> -1.0 | V71: 1hb
A72: Goblin Shin Splinter | C72: 5.0 | D72: 30.0 | E72: =D72/C72 -> 6.0 | T72: 2.8 | U72: =0-QUOTIENT(T72,3) -> 0.0 | V72: 1hb
A73: Goblin Skull Crusher | B73: Stun | C73: 7.0 | D73: 32.0 | E73: =D73/C73 -> 4.5714285714285712 | S73: 6.0 | T73: 4.3 | U73: =0-QUOTIENT(T73,3) -> -1.0 | V73: 1hb
A74: Goranga Hammer | C74: 10.0 | D74: 24.0 | E74: =D74/C74 -> 2.4 | J74: 6.0 | K74: 6.0 | N74: 50.0 | T74: 5.0 | V74: 1hb
A75: Goranga Tribal Warhammer | C75: 8.0 | D75: 17.0 | E75: =D75/C75 -> 2.125 | T75: 6.5 | V75: 1hb
A76: Goranga Warhammer | C76: 9.0 | D76: 20.0 | E76: =D76/C76 -> 2.2222222222222223 | T76: 5.0 | V76: 1hb
A77: Grikplag's Scheptre | C77: 10.0 | D77: 25.0 | E77: =D77/C77 -> 2.5 | J77: 5.0 | M77: 20.0 | N77: 20.0 | O77: 5.0 | Q77: 5.0 | T77: 5.0 | V77: 1hb
A78: Grikplag's Scheptre | C78: 10.0 | D78: 25.0 | E78: =D78/C78 -> 2.5 | J78: 5.0 | M78: 20.0 | N78: 20.0 | O78: 5.0 | Q78: 5.0 | T78: 5.0 | V78: 1hb
A79: Guard Captain's Mallet | C79: 11.0 | D79: 20.0 | E79: =D79/C79 -> 1.8181818181818181 | H79: 6.0 | I79: 6.0 | M79: 45.0 | T79: 5.0 | U79: =0-QUOTIENT(T79,3) -> -1.0 | V79: 1hb
A80: Hardened Driftwood Great Staff | C80: 9.0 | D80: 23.0 | E80: =D80/C80 -> 2.5555555555555554 | F80: 3.0 | I80: 6.0 | K80: 6.0 | L80: 3.0 | M80: 35.0 | N80: 25.0 | P80: 10.0 | T80: 3.5 | V80: 1hb
A81: Heavy Stone Warhammer | C81: 9.0 | D81: 47.0 | E81: =D81/C81 -> 5.2222222222222223 | T81: 22.0 | V81: 1hb
A82: Hulking Spiked Club | C82: 6.0 | D82: 26.0 | E82: =D82/C82 -> 4.333333333333333 | T82: 4.5 | U82: =0-QUOTIENT(T82,3) -> -1.0 | V82: 1hb
A83: Humerus Handled Mace | C83: 5.0 | D83: 29.0 | E83: =D83/C83 -> 5.8 | S83: 2.0 | T83: 1.5 | U83: =0-QUOTIENT(T83,3) -> 0.0 | V83: 1hb
A84: Iceball | C84: 2.0 | D84: 20.0 | E84: =D84/C84 -> 10.0 | T84: 0.5 | U84: =0-QUOTIENT(T84,3) -> 0.0 | V84: 1hb
A85: Iceshaper's Staff | C85: 7.0 | D85: 24.0 | E85: =D85/C85 -> 3.4285714285714284 | F85: 3.0 | J85: 5.0 | N85: 30.0 | S85: 8.0 | T85: 4.0 | U85: =0-QUOTIENT(T85,3) -> -1.0 | V85: 1hb
A86: Iksar Berserker Club | B86: Fleeting Fury | C86: 7.0 | D86: 18.0 | E86: =D86/C86 -> 2.5714285714285716 | F86: 4.0 | J86: 4.0 | K86: -2.0 | T86: 8.0 | U86: =0-QUOTIENT(T86,3) -> -2.0 | V86: 1hb
A87: Iksar Stave | C87: 5.0 | D87: 23.0 | E87: =D87/C87 -> 4.6 | T87: 3.5 | U87: =0-QUOTIENT(T87,3) -> -1.0 | V87: 1hb
A88: Iron Bound Tome | B88: Cancel Magic | C88: 7.0 | D88: 38.0 | E88: =D88/C88 -> 5.4285714285714288 | N88: 5.0 | P88: 3.0 | R88: 5.0 | T88: 12.0 | U88: =0-QUOTIENT(T88,3) -> -4.0 | V88: 1hb
A89: Ivory Inlaid Staff | C89: 5.0 | D89: 25.0 | E89: =D89/C89 -> 5.0 | T89: 6.5 | U89: =0-QUOTIENT(T89,3) -> -2.0 | V89: 1hb
A90: Ivory Spiked Club | C90: 9.0 | D90: 40.0 | E90: =D90/C90 -> 4.4444444444444446 | T90: 10.0 | U90: =0-QUOTIENT(T90,3) -> -3.0 | V90: 1hb
A91: Jade Mace | C91: 9.0 | D91: 18.0 | E91: =D91/C91 -> 2.0 | T91: 2.1 | U91: =0-QUOTIENT(T91,3) -> 0.0 | V91: 1hb
A92: Jaggedpine Crook Staff | C92: 5.0 | D92: 31.0 | E92: =D92/C92 -> 6.2 | F92: 1.0 | M92: 5.0 | R92: 5.0 | T92: 8.5 | U92: =0-QUOTIENT(T92,3) -> -2.0 | V92: 1hb
A93: Journeyman's Walking Stick | B93: Tashani | C93: 9.0 | D93: 24.0 | E93: =D93/C93 -> 2.6666666666666665 | F93: 4.0 | J93: 4.0 | K93: 4.0 | T93: 1.6 | U93: =0-QUOTIENT(T93,3) -> 0.0 | V93: 1hb
A94: Kejekan Smithy Hammer | C94: 5.0 | D94: 42.0 | E94: =D94/C94 -> 8.4 | T94: 18.0 | U94: =0-QUOTIENT(T94,3) -> -6.0 | V94: 1hb
A95: Kerran Fishingpole | C95: 3.0 | D95: 17.0 | E95: =D95/C95 -> 5.666666666666667 | F95: 2.0 | T95: 4.0 | U95: =0-QUOTIENT(T95,3) -> -1.0 | V95: 1hb
A96: Knobbed Warclub | C96: 8.0 | D96: 24.0 | E96: =D96/C96 -> 3.0 | J96: 3.0 | T96: 2.0 | U96: =0-QUOTIENT(T96,3) -> 0.0 | V96: 1hb
A97: Light Velium Battlehammer | C97: 11.0 | D97: 24.0 | E97: =D97/C97 -> 2.1818181818181817 | T97: 3.5 | U97: =0-QUOTIENT(T97,3) -> -1.0 | V97: 1hb
A98: Lunar Mace | C98: 13.0 | D98: 29.0 | E98: =D98/C98 -> 2.2307692307692308 | F98: 5.0 | G98: 6.0 | H98: 3.0 | I98: 6.0 | J98: 7.0 | L98: 3.0 | M98: 35.0 | N98: 25.0 | S98: 10.0 | T98: 3.5 | V98: 1hb
A99: Lunar Staff | C99: 9.0 | D99: 23.0 | E99: =D99/C99 -> 2.5555555555555554 | F99: 4.0 | G99: 6.0 | I99: 6.0 | K99: 6.0 | L99: 3.0 | M99: 35.0 | N99: 25.0 | S99: 10.0 | T99: 3.5 | V99: 1hb
A100: Mace | C100: 7.0 | D100: 37.0 | E100: =D100/C100 -> 5.2857142857142856 | T100: 8.0 | U100: =0-QUOTIENT(T100,3) -> -2.0 | V100: 1hb
A101: Mace of Prescience | C101: 10.0 | D101: 18.0 | E101: =D101/C101 -> 1.8 | H101: 5.0 | T101: 1.5 | V101: 1hb
A102: Mace of the Blood Skull | C102: 9.0 | D102: 24.0 | E102: =D102/C102 -> 2.6666666666666665 | F102: 5.0 | H102: 5.0 | J102: 5.0 | N102: 30.0 | O102: 5.0 | Q102: 5.0 | R102: -5.0 | T102: 4.5 | V102: 1hb
A103: Massive Velium Battlehammer | C103: 12.0 | D103: 21.0 | E103: =D103/C103 -> 1.75 | T103: 3.5 | U103: =0-QUOTIENT(T103,3) -> -1.0 | V103: 1hb
A104: Mithril Fier'Dal Morning Star (K) | C104: 9.0 | D104: 35.0 | E104: =D104/C104 -> 3.8888888888888888 | H104: 4.0 | I104: 2.0 | J104: 2.0 | T104: 5.0 | U104: =0-QUOTIENT(T104,3) -> -1.0 | V104: 1hb
A105: Mithril Fier'Dal Morning Star (Tu) | C105: 9.0 | D105: 35.0 | E105: =D105/C105 -> 3.8888888888888888 | H105: 4.0 | J105: 2.0 | L105: 2.0 | T105: 5.0 | U105: =0-QUOTIENT(T105,3) -> -1.0 | V105: 1hb
A106: Modulating Rod | B106: Modulation | C106: 8.0 | D106: 26.0 | E106: =D106/C106 -> 3.25 | T106: 1.0 | U106: =0-QUOTIENT(T106,3) -> 0.0 | V106: 1hb
A107: Morning Star | C107: 8.0 | D107: 40.0 | E107: =D107/C107 -> 5.0 | T107: 10.0 | U107: =0-QUOTIENT(T107,3) -> -3.0 | V107: 1hb
A108: Mudman Enforcer | C108: 8.0 | D108: 20.0 | E108: =D108/C108 -> 2.5 | F108: 3.0 | T108: 1.9 | U108: =0-QUOTIENT(T108,3) -> 0.0 | V108: 1hb
A109: Neb's Warbone | C109: 15.0 | D109: 23.0 | E109: =D109/C109 -> 1.5333333333333334 | F109: 10.0 | R109: 15.0 | T109: 5.0 | U109: =0-QUOTIENT(T109,3) -> -1.0 | V109: 1hb
A110: Noble Walking Staff | C110: 8.0 | D110: 19.0 | E110: =D110/C110 -> 2.375 | F110: 2.0 | J110: 2.0 | K110: 2.0 | T110: 4.0 | U110: =0-QUOTIENT(T110,3) -> -1.0 | V110: 1hb
A111: Northman Mace | C111: 9.0 | D111: 36.0 | E111: =D111/C111 -> 4.0 | T111: 8.5 | U111: =0-QUOTIENT(T111,3) -> -2.0 | V111: 1hb
A112: Orcish Mace | C112: 7.0 | D112: 39.0 | E112: =D112/C112 -> 5.5714285714285712 | T112: 9.0 | U112: =0-QUOTIENT(T112,3) -> -3.0 | V112: 1hb
A113: Orcish Morning Star | C113: 8.0 | D113: 43.0 | E113: =D113/C113 -> 5.375 | T113: 11.0 | U113: =0-QUOTIENT(T113,3) -> -3.0 | V113: 1hb
A114: Paebala Fetish | C114: 12.0 | D114: 25.0 | E114: =D114/C114 -> 2.0833333333333335 | F114: 5.0 | J114: 9.0 | N114: 15.0 | O114: 5.0 | P114: 5.0 | Q114: 5.0 | R114: 5.0 | S114: 5.0 | T114: 0.0 | U114: =0-QUOTIENT(T114,3) -> 0.0 | V114: 1hb
A115: Paebala Warbone | B115: Bone Melt | C115: 15.0 | D115: 27.0 | E115: =D115/C115 -> 1.8 | T115: 5.0 | U115: =0-QUOTIENT(T115,3) -> -1.0 | V115: 1hb
A116: Phosphorous Torch | C116: 1.0 | D116: 24.0 | E116: =D116/C116 -> 24.0 | T116: 0.5 | V116: 1hb
A117: Polished Velium Battlehammer | C117: 11.0 | D117: 21.0 | E117: =D117/C117 -> 1.9090909090909092 | T117: 3.5 | U117: =0-QUOTIENT(T117,3) -> -1.0 | V117: 1hb
A118: Priceless Velium Battlehammer | C118: 13.0 | D118: 20.0 | E118: =D118/C118 -> 1.5384615384615385 | F118: 5.0 | G118: 5.0 | H118: 5.0 | I118: 5.0 | J118: 5.0 | K118: 5.0 | L118: 5.0 | M118: 25.0 | N118: 25.0 | O118: 5.0 | P118: 5.0 | Q118: 5.0 | R118: 5.0 | S118: 5.0 | T118: 3.5 | U118: =0-QUOTIENT(T118,3) -> -1.0 | V118: 1hb
A119: Primal Velium Battlehammer | B119: Avatar | C119: 13.0 | D119: 20.0 | E119: =D119/C119 -> 1.5384615384615385 | F119: 5.0 | G119: 5.0 | H119: 5.0 | I119: 5.0 | J119: 5.0 | K119: 5.0 | L119: 5.0 | M119: 50.0 | N119: 50.0 | O119: 5.0 | P119: 5.0 | Q119: 5.0 | R119: 5.0 | S119: 5.0 | T119: 1.5 | U119: =0-QUOTIENT(T119,3) -> 0.0 | V119: 1hb
A120: Purified Crystal Star | C120: 9.0 | D120: 37.0 | E120: =D120/C120 -> 4.1111111111111107 | L120: 4.0 | O120: 5.0 | P120: 5.0 | Q120: 5.0 | R120: 5.0 | S120: 5.0 | T120: 10.0 | U120: =0-QUOTIENT(T120,3) -> -3.0 | V120: 1hb
A121: Purified Star | C121: 9.0 | D121: 37.0 | E121: =D121/C121 -> 4.1111111111111107 | L121: 2.0 | O121: 3.0 | P121: 3.0 | Q121: 3.0 | R121: 3.0 | S121: 3.0 | T121: 10.0 | U121: =0-QUOTIENT(T121,3) -> -3.0 | V121: 1hb
A122: Purified Warhammer | C122: 7.0 | D122: 29.0 | E122: =D122/C122 -> 4.1428571428571432 | L122: 2.0 | O122: 3.0 | P122: 3.0 | Q122: 3.0 | R122: 3.0 | S122: 3.0 | T122: 7.3 | U122: =0-QUOTIENT(T122,3) -> -2.0 | V122: 1hb
A123: Reinforced Bamboo Tanto Bo | C123: 5.0 | D123: 31.0 | E123: =D123/C123 -> 6.2 | T123: 8.5 | U123: =0-QUOTIENT(T123,3) -> -2.0 | V123: 1hb
A124: Reinforced Bamboo Wakizashi Bo | C124: 6.0 | D124: 34.0 | E124: =D124/C124 -> 5.666666666666667 | T124: 9.0 | U124: =0-QUOTIENT(T124,3) -> -3.0 | V124: 1hb
A125: Rightehousness | C125: 20.0 | D125: 22.0 | E125: =D125/C125 -> 1.1 | F125: 10.0 | G125: 5.0 | J125: 10.0 | M125: 25.0 | N125: 25.0 | P125: 10.0 | R125: 10.0 | S125: 10.0 | T125: 1.0 | V125: 1hb
A126: Ringed Mace of the Ykesha | B126: Ykesha | C126: 10.0 | D126: 22.0 | E126: =D126/C126 -> 2.2 | T126: 3.9 | U126: =0-QUOTIENT(T126,3) -> -1.0 | V126: 1hb
A127: Rock Studded Smasher | C127: 11.0 | D127: 22.0 | E127: =D127/C127 -> 2.0 | F127: 5.0 | J127: 8.0 | S127: 10.0 | T127: 5.0 | V127: 1hb
A128: Rod of Drones | B128: Drones of Doom | C128: 6.0 | D128: 30.0 | E128: =D128/C128 -> 5.0 | T128: 1.5 | U128: =0-QUOTIENT(T128,3) -> 0.0 | V128: 1hb
A129: Rod of Oblations | C129: 6.0 | D129: 27.0 | E129: =D129/C129 -> 4.5 | N129: 60.0 | R129: 10.0 | S129: 10.0 | T129: 00.1 | U129: =0-QUOTIENT(T129,3) -> 0.0 | V129: 1hb
A130: Ruined Battleworn Morning Star | C130: 7.0 | D130: 33.0 | E130: =D130/C130 -> 4.7142857142857144 | J130: 6.0 | Q130: -5.0 | T130: 9.0 | U130: =0-QUOTIENT(T130,3) -> -3.0 | V130: 1hb
A131: Rune Smudged Battle Staff | C131: 40.0 | D131: 38.0 | E131: =D131/C131 -> 00.95 | G131: 5.0 | J131: 10.0 | M131: 25.0 | N131: 25.0 | O131: 10.0 | Q131: 10.0 | T131: 1.0 | V131: 1hb
A132: Rune Smudged Great Staff | C132: 13.0 | D132: 28.0 | E132: =D132/C132 -> 2.1538461538461537 | F132: 8.0 | G132: 7.0 | H132: 4.0 | I132: 7.0 | J132: 5.0 | L132: 4.0 | M132: 60.0 | N132: 25.0 | P132: 15.0 | T132: 3.5 | V132: 1hb
A133: Runed Branding Iron | B133: Burst of Flame | C133: 8.0 | D133: 28.0 | E133: =D133/C133 -> 3.5 | T133: 5.5 | U133: =0-QUOTIENT(T133,3) -> -1.0 | V133: 1hb
A134: Runed Morning Star | C134: 12.0 | D134: 26.0 | E134: =D134/C134 -> 2.1666666666666665 | F134: 7.0 | G134: 3.0 | H134: 8.0 | J134: 6.0 | L134: 4.0 | P134: 8.0 | T134: 3.0 | U134: =0-QUOTIENT(T134,3) -> -1.0 | V134: 1hb
A135: Runed Velium Battlehammer | C135: 12.0 | D135: 24.0 | E135: =D135/C135 -> 2.0 | T135: 3.5 | U135: =0-QUOTIENT(T135,3) -> -1.0 | V135: 1hb
A136: Sap Encrusted Branch | B136: Ensnare | C136: 14.0 | D136: 19.0 | E136: =D136/C136 -> 1.3571428571428572 | G136: 16.0 | O136: 12.0 | Q136: 12.0 | R136: 12.0 | T136: 0.5 | U136: =0-QUOTIENT(T136,3) -> 0.0 | V136: 1hb
A137: Sap of Piety | C137: 13.0 | D137: 36.0 | E137: =D137/C137 -> 2.7692307692307692 | T137: 2.5 | U137: =0-QUOTIENT(T137,3) -> 0.0 | V137: 1hb
A138: Sarnak Enforcer | C138: 7.0 | D138: 28.0 | E138: =D138/C138 -> 4.0 | T138: 1.5 | U138: =0-QUOTIENT(T138,3) -> 0.0 | V138: 1hb
A139: Sarnak Lightning Caller | B139: Fury of Air | C139: 15.0 | D139: 28.0 | E139: =D139/C139 -> 1.8666666666666667 | T139: 1.5 | U139: =0-QUOTIENT(T139,3) -> 0.0 | V139: 1hb
A140: Scepter of Flame | C140: 7.0 | D140: 29.0 | E140: =D140/C140 -> 4.1428571428571432 | N140: 15.0 | P140: 5.0 | R140: 5.0 | T140: 4.5 | U140: =0-QUOTIENT(T140,3) -> -1.0 | V140: 1hb
A141: Scepter of Ixiblat Fer | C141: 15.0 | D141: 32.0 | E141: =D141/C141 -> 2.1333333333333333 | R141: 10.0 | T141: 00.1 | U141: =0-QUOTIENT(T141,3) -> 0.0 | V141: 1hb
A142: Scepter of Rahotep | C142: 9.0 | D142: 38.0 | E142: =D142/C142 -> 4.2222222222222223 | T142: 4.5 | U142: =0-QUOTIENT(T142,3) -> -1.0 | V142: 1hb
A143: Sceptre of Destruction | B143: Anarchy | C143: 12.0 | D143: 18.0 | E143: =D143/C143 -> 1.5 | F143: 10.0 | G143: 10.0 | I143: 10.0 | M143: 50.0 | N143: 50.0 | T143: 00.2 | U143: =0-QUOTIENT(T143,3) -> 0.0 | V143: 1hb
A144: Scimitar of Oak | C144: 7.0 | D144: 35.0 | E144: =D144/C144 -> 5.0 | T144: 8.0 | V144: 1hb
A145: Screaming Mace | B145: Yaulp I | C145: 8.0 | D145: 35.0 | E145: =D145/C145 -> 4.375 | T145: 8.0 | U145: =0-QUOTIENT(T145,3) -> -2.0 | V145: 1hb
A146: Shaded staff | C146: 10.0 | D146: 22.0 | E146: =D146/C146 -> 2.2 | O146: 5.0 | P146: 5.0 | Q146: 5.0 | R146: -5.0 | S146: 5.0 | T146: 8.0 | V146: 1hb
A147: Shaded staff | C147: 10.0 | D147: 22.0 | E147: =D147/C147 -> 2.2 | O147: 5.0 | P147: 5.0 | Q147: 5.0 | R147: -5.0 | S147: 5.0 | T147: 8.0 | V147: 1hb
A148: Sharkbone Warhammer | C148: 8.0 | D148: 26.0 | E148: =D148/C148 -> 3.25 | J148: 5.0 | T148: 3.0 | U148: =0-QUOTIENT(T148,3) -> -1.0 | V148: 1hb
A149: Shillelah | C149: 10.0 | D149: 25.0 | E149: =D149/C149 -> 2.5 | H149: 2.0 | J149: 9.0 | L149: 4.0 | N149: 50.0 | R149: 5.0 | T149: 4.0 | U149: =0-QUOTIENT(T149,3) -> -1.0 | V149: 1hb
A150: Shimmering Mace | C150: 6.0 | D150: 24.0 | E150: =D150/C150 -> 4.0 | J150: 6.0 | P150: 5.0 | R150: 5.0 | T150: 4.5 | V150: 1hb
A151: Shining Velium Battlehammer | C151: 12.0 | D151: 22.0 | E151: =D151/C151 -> 1.8333333333333333 | T151: 3.5 | U151: =0-QUOTIENT(T151,3) -> -1.0 | V151: 1hb
A152: Shiny Ore Machete | C152: 8.0 | D152: 26.0 | E152: =D152/C152 -> 3.25 | F152: 2.0 | M152: 10.0 | T152: 5.0 | V152: 1hb
A153: Shiny Stone Hammer | C153: 6.0 | D153: 30.0 | E153: =D153/C153 -> 5.0 | T153: 7.3 | V153: 1hb
A154: Shredder Claw Club | C154: 5.0 | D154: 30.0 | E154: =D154/C154 -> 6.0 | T154: 2.0 | V154: 1hb
A155: Skull Shaped Sacrificial Hammer | C155: 6.0 | D155: 24.0 | E155: =D155/C155 -> 4.0 | F155: 2.0 | L155: -15.0 | T155: 6.0 | V155: 1hb
A156: Smoldering Brand | B156: Burn | C156: 9.0 | D156: 22.0 | E156: =D156/C156 -> 2.4444444444444446 | F156: 3.0 | T156: 5.0 | U156: =0-QUOTIENT(T156,3) -> -1.0 | V156: 1hb
A157: Smoldering Cudgel | B157: Blaze | C157: 18.0 | D157: 34.0 | E157: =D157/C157 -> 1.8888888888888888 | J157: 12.0 | N157: 50.0 | R157: 25.0 | T157: 00.8 | U157: =0-QUOTIENT(T157,3) -> 0.0 | V157: 1hb
A158: Springwood Club | C158: 9.0 | D158: 25.0 | E158: =D158/C158 -> 2.7777777777777777 | F158: 5.0 | J158: 5.0 | K158: 5.0 | T158: 1.2 | U158: =0-QUOTIENT(T158,3) -> 0.0 | V158: 1hb
A159: Sprinkler of the Spirits | C159: 7.0 | D159: 16.0 | E159: =D159/C159 -> 2.2857142857142856 | F159: 10.0 | J159: 15.0 | M159: 75.0 | N159: 75.0 | O159: 20.0 | P159: 20.0 | Q159: 20.0 | R159: 20.0 | S159: 20.0 | T159: 0.0 | U159: =0-QUOTIENT(T159,3) -> 0.0 | V159: 1hb
A160: Staff | C160: 5.0 | D160: 28.0 | E160: =D160/C160 -> 5.6 | T160: 6.5 | U160: =0-QUOTIENT(T160,3) -> -2.0 | V160: 1hb
A161: Staff of Fire | C161: 5.0 | D161: 25.0 | E161: =D161/C161 -> 5.0 | T161: 6.5 | U161: =0-QUOTIENT(T161,3) -> -2.0 | V161: 1hb
A162: Staff of Peace | C162: 0.0 | D162: 999.0 | E162: 999.0 | F162: 5.0 | J162: 10.0 | Q162: 20.0 | T162: 1.0 | U162: =0-QUOTIENT(T162,3) -> 0.0 | V162: 1hb
A163: Staff of the Gathering | C163: 16.0 | D163: 35.0 | E163: =D163/C163 -> 2.1875 | J163: 5.0 | K163: 5.0 | N163: 50.0 | T163: 00.1 | U163: =0-QUOTIENT(T163,3) -> 0.0 | V163: 1hb
A164: Staff of the Scaled | C164: 5.0 | D164: 38.0 | E164: =D164/C164 -> 7.6 | M164: 5.0 | R164: 10.0 | T164: 6.6 | U164: =0-QUOTIENT(T164,3) -> -2.0 | V164: 1hb
A165: Stone Thunder | C165: 10.0 | D165: 34.0 | E165: =D165/C165 -> 3.4 | T165: 6.5 | U165: =0-QUOTIENT(T165,3) -> -2.0 | V165: 1hb
A166: Stronghorn's Horn | B166: Knockback | C166: 18.0 | D166: 30.0 | E166: =D166/C166 -> 1.6666666666666667 | F166: 7.0 | G166: 15.0 | M166: 25.0 | Q166: 15.0 | T166: 7.5 | U166: =0-QUOTIENT(T166,3) -> -2.0 | V166: 1hb
A167: Superior Combine Great Staff | C167: 9.0 | D167: 23.0 | E167: =D167/C167 -> 2.5555555555555554 | F167: 3.0 | G167: 6.0 | I167: 6.0 | K167: 6.0 | L167: 3.0 | M167: 35.0 | N167: 25.0 | R167: 10.0 | T167: 3.5 | V167: 1hb
A168: Superior Combine Morning Star | C168: 9.0 | D168: 37.0 | E168: =D168/C168 -> 4.1111111111111107 | T168: 10.0 | V168: 1hb
A169: Superior Combine Scimitar | C169: 8.0 | D169: 18.0 | E169: =D169/C169 -> 2.25 | T169: 3.0 | V169: 1hb
A170: Superior Combine Warhammer | C170: 7.0 | D170: 29.0 | E170: =D170/C170 -> 4.1428571428571432 | T170: 7.3 | V170: 1hb
A171: Thex Mallet | C171: 5.0 | D171: 33.0 | E171: =D171/C171 -> 6.6 | P171: 5.0 | T171: 8.5 | U171: =0-QUOTIENT(T171,3) -> -2.0 | V171: 1hb
A172: Tier'Dal Morning Star | C172: 8.0 | D172: 38.0 | E172: =D172/C172 -> 4.75 | T172: 9.5 | U172: =0-QUOTIENT(T172,3) -> -3.0 | V172: 1hb
A173: Tier'Dal Warhammer | C173: 6.0 | D173: 30.0 | E173: =D173/C173 -> 5.0 | T173: 6.7 | U173: =0-QUOTIENT(T173,3) -> -2.0 | V173: 1hb
A174: Torklar's Battle Hammer | C174: 6.0 | D174: 28.0 | E174: =D174/C174 -> 4.666666666666667 | T174: 5.0 | U174: =0-QUOTIENT(T174,3) -> -1.0 | V174: 1hb
A175: Tri-Plated Golden Hackle Hammer | B175: Arch Shielding | C175: 14.0 | D175: 24.0 | E175: =D175/C175 -> 1.7142857142857142 | F175: 10.0 | J175: 13.0 | K175: 13.0 | N175: 25.0 | O175: 5.0 | P175: 5.0 | Q175: 5.0 | R175: 5.0 | S175: 5.0 | T175: 2.0 | U175: =0-QUOTIENT(T175,3) -> 0.0 | V175: 1hb
A176: Tuuak's Fishing Pole | C176: 5.0 | D176: 30.0 | E176: =D176/C176 -> 6.0 | T176: 5.0 | U176: =0-QUOTIENT(T176,3) -> -1.0 | V176: 1hb
A177: Velium Etched Stone Mace | C177: 7.0 | D177: 22.0 | E177: =D177/C177 -> 3.1428571428571428 | F177: 3.0 | J177: 3.0 | T177: 6.0 | U177: =0-QUOTIENT(T177,3) -> -2.0 | V177: 1hb
A178: Velium Maul of Superiority | C178: 11.0 | D178: 18.0 | E178: =D178/C178 -> 1.6363636363636365 | F178: 3.0 | G178: 3.0 | H178: 3.0 | I178: 3.0 | J178: 3.0 | K178: 3.0 | L178: 3.0 | M178: 30.0 | N178: 30.0 | O178: 3.0 | P178: 3.0 | Q178: 3.0 | R178: 3.0 | S178: 3.0 | T178: 7.0 | U178: =0-QUOTIENT(T178,3) -> -2.0 | V178: 1hb
A179: Velium Morning Star | B179: Velium Shards | C179: 8.0 | D179: 38.0 | E179: =D179/C179 -> 4.75 | T179: 9.5 | U179: =0-QUOTIENT(T179,3) -> -3.0 | V179: 1hb
A180: Velium War Maul | B180: Velium Shards | C180: 9.0 | D180: 24.0 | E180: =D180/C180 -> 2.6666666666666665 | T180: 0.5 | U180: =0-QUOTIENT(T180,3) -> 0.0 | V180: 1hb
A181: Velium Warhammer | B181: Velium Shards | C181: 6.0 | D181: 30.0 | E181: =D181/C181 -> 5.0 | T181: 6.8 | U181: =0-QUOTIENT(T181,3) -> -2.0 | V181: 1hb
A182: Warclub | C182: 6.0 | D182: 32.0 | E182: =D182/C182 -> 5.333333333333333 | T182: 5.0 | U182: =0-QUOTIENT(T182,3) -> -1.0 | V182: 1hb
A183: Warhammer | C183: 6.0 | D183: 32.0 | E183: =D183/C183 -> 5.333333333333333 | T183: 7.5 | U183: =0-QUOTIENT(T183,3) -> -2.0 | V183: 1hb
A184: Warhammer of Ethereal Energy | C184: 13.0 | D184: 29.0 | E184: =D184/C184 -> 2.2307692307692308 | F184: 3.0 | G184: 6.0 | I184: 6.0 | J184: 8.0 | L184: 3.0 | M184: 35.0 | N184: 25.0 | R184: 10.0 | T184: 3.5 | V184: 1hb
A185: Weighted Velium Battlehammer | C185: 11.0 | D185: 22.0 | E185: =D185/C185 -> 2.0 | T185: 3.5 | U185: =0-QUOTIENT(T185,3) -> -1.0 | V185: 1hb
A186: Windetched Staff | B186: Careless Lightning | C186: 3.0 | D186: 20.0 | E186: =D186/C186 -> 6.666666666666667 | N186: 20.0 | T186: 1.5 | U186: =0-QUOTIENT(T186,3) -> 0.0 | V186: 1hb
A187: Wraith Bone Hammer | C187: 8.0 | D187: 26.0 | E187: =D187/C187 -> 3.25 | F187: 5.0 | J187: 2.0 | K187: 2.0 | T187: 7.3 | U187: =0-QUOTIENT(T187,3) -> -2.0 | V187: 1hb
A188: Ye Auld Ball Peen Hammer | C188: 4.0 | D188: 27.0 | E188: =D188/C188 -> 6.75 | F188: 2.0 | M188: 4.0 | T188: 4.5 | U188: =0-QUOTIENT(T188,3) -> -1.0 | V188: 1hb
A189: Ykeshan War Club | B189: Ykesha | C189: 9.0 | D189: 24.0 | E189: =D189/C189 -> 2.6666666666666665 | T189: 3.0 | U189: =0-QUOTIENT(T189,3) -> -1.0 | V189: 1hb