A1: Active Roster
B2: Levels | C2: Title | D2: Race | E2: Epic | F2: VP Key | G2: ST Key | H2: PoV/PoS | I2: BoT | J2: PoI B | K2: CoD | L2: PoN B | M2: HoH A | N2: Status
A3: Clerics
A4: Bohric | B4: 65 | C4: Baron | D4: Dwarf | E4: NO | F4: 1 | G4: 1 | H4: 1 | N4: Member | O4: 1
A5: =HYPERLINK("http://www.magelo.com/eq_view_profile.html?num=342919","Dinanin") -> Dinanin | B5: 65 | C5: Venerable | D5: Dwarf | E5: YES | F5: 1 | G5: 1 | H5: 1 | I5: 1 | J5: 1 | K5: 1 | L5: 1 | N5: Member | O5: 1
A6: =HYPERLINK("http://www.magelo.com/eq_view_profile.html?num=59684","Dystopya") -> Dystopya | B6: 65 | C6: Venerable | D6: Human | E6: YES | F6: 1 | H6: 1 | I6: 1 | J6: 1 | K6: 1 | L6: 1 | N6: Member | O6: 1
A7: =HYPERLINK("http://www.magelo.com/eq_view_profile.html?num=84050","Gerweena") -> Gerweena | B7: 65 | C7: Venerable | D7: Halfling | E7: YES | G7: 1 | H7: 1 | I7: 1 | N7: Member | O7: 1
A8: =HYPERLINK("http://www.magelo.com/eq_view_profile.html?num=207442","Jerycho") -> Jerycho | B8: 63 | C8: Venerable | D8: Dwarf | E8: YES | F8: 1 | H8: 1 | N8: Member | O8: 1
A9: =HYPERLINK("http://www.magelo.com/eq_view_profile.html?num=151159","Mediloks") -> Mediloks | B9: 63 | D9: High Elf | E9: YES | N9: Member | O9: 1
A10: =HYPERLINK("http://www.magelo.com/eq_view_profile.html?num=71953","Philander") -> Philander | B10: 63 | C10: Venerable | D10: Dwarf | E10: YES | F10: 1 | G10: 1 | N10: Officer | O10: 1
A11: Samine | B11: 65 | C11: Venerable | D11: High Elf | E11: NO | F11: 1 | G11: 1 | H11: 1 | J11: 1 | N11: Member | O11: 1
A12: Sarigus | B12: 60 | C12: Venerable | D12: Halfling | E12: YES | F12: 1 | N12: Member | O12: 1
A13: =HYPERLINK("http://www.magelo.com/eq_view_profile.html?num=62008","Xorolorn") -> Xorolorn | B13: 63 | C13: Baron | D13: High Elf | E13: YES | F13: 1 | G13: 1 | H13: 1 | I13: 1 | J13: 1 | L13: 1 | N13: Member | O13: 1
A14: =HYPERLINK("http://www.magelo.com/eq_view_profile.html?num=141442","Adella (alt)") -> Adella (alt) | B14: 64 | D14: Dwarf | E14: YES | F14: 1 | H14: 1 | I14: 1 | N14: Member
A15: =HYPERLINK("http://www.magelo.com/eq_view_profile.html?num=345649","Andromache (alt)") -> Andromache (alt) | B15: 59 | D15: Dark Elf | E15: YES | N15: Member
A16: Fryar (alt) | B16: 64 | D16: Dwarf | E16: YES | H16: 1 | I16: 1 | N16: Member
A17: Pria (alt) | B17: 62 | C17: Baroness | D17: High Elf | E17: YES | H17: 1 | I17: 1 | L17: 1 | N17: Member
A18: Restora (alt) | B18: 60 | D18: High Elf | E18: YES | N18: Member
A19: =HYPERLINK("http://www.magelo.com/eq_view_profile.html?num=24215","Weckie (alt)") -> Weckie (alt) | B19: 65 | D19: Dark Elf | E19: YES | F19: 1 | H19: 1 | I19: 1 | N19: Member
A20: Mages
A21: =HYPERLINK("http://www.magelo.com/eq_view_profile.html?num=35310","Almorzar") -> Almorzar | B21: 65 | C21: Master | D21: Erudite | E21: NO | F21: 1 | G21: 1 | H21: 1 | I21: 1 | K21: 1 | N21: Member | O21: 1
A22: Canda | B22: 63 | C22: Baron | D22: High Elf | E22: YES | F22: 1 | G22: 1 | H22: 1 | I22: 1 | N22: Member | O22: 1
A23: =HYPERLINK("http://www.magelo.com/eq_view_profile.html?num=345293","Elingia") -> Elingia | B23: 59 | D23: High Elf | E23: NO | N23: Member | O23: 1
A24: Gaidar | B24: 60 | D24: Human | N24: Member | O24: 1
A25: Mandrayke (alt) | B25: 63 | E25: NO | N25: Member
A26: Beastlords
A27: Wizards
A28: =HYPERLINK("http://www.magelo.com/eq_view_profile.html?num=202761","Aylith") -> Aylith | B28: 60 | C28: Baroness | D28: High Elf | E28: YES | F28: 1 | G28: 1 | N28: Member | O28: 1
A29: =HYPERLINK("http://www.magelo.com/eq_view_profile.html?num=193912","Faren") -> Faren | B29: 62 | D29: Human | E29: YES | F29: 1 | N29: Member | O29: 1
A30: Zeanith | B30: 56 | D30: Dark Elf | E30: NO | N30: Member | O30: 1
A31: Kelben (alt) | B31: 60 | C31: Baron | D31: Human | E31: NO | N31: Member
A32: Xiaolasing (alt) | B32: 64 | C32: Sage | D32: Dark Elf | E32: YES | F32: 1 | G32: 1 | N32: Member
A33: Warriors
A34: =HYPERLINK("http://www.magelo.com/eq_view_profile.html?num=141424","Agus") -> Agus | B34: 65 | C34: Veteran | D34: Halfling | E34: YES | F34: 1 | G34: 1 | H34: 1 | I34: 1 | L34: 1 | N34: Officer | O34: 1
A35: =HYPERLINK("http://www.magelo.com/eq_view_profile.html?num=357231","Feersum") -> Feersum | B35: 65 | D35: Barbarian | E35: NO | G35: 1 | N35: Member | O35: 1
A36: =HYPERLINK("http://www.magelo.com/eq_view_profile.html?num=343105","Hearsay") -> Hearsay | B36: 65 | C36: Veteran | D36: Barbarian | E36: YES | F36: 1 | G36: 1 | H36: 1 | I36: 1 | J36: 1 | K36: 1 | L36: 1 | M36: 1 | N36: Member | O36: 1
A37: Ghazhagh | B37: 65 | D37: Dwarf | E37: NO | H37: 1 | N37: Member | O37: 1
A38: =HYPERLINK("http://www.magelo.com/eq_view_profile.html?num=127179","Kteq") -> Kteq | B38: 65 | C38: Veteran | D38: Barbarian | E38: YES | F38: 1 | G38: 1 | H38: 1 | I38: 1 | J38: 1 | N38: Member | O38: 1
A39: =HYPERLINK("http://www.magelo.com/eq_view_profile.html?num=176947","Matsu") -> Matsu | B39: 65 | C39: Veteran | D39: Halfling | E39: NO | F39: 1 | N39: Member | O39: 1
A40: =HYPERLINK("http://www.magelo.com/eq_view_profile.html?num=244458","Mouxxie") -> Mouxxie | B40: 63 | C40: Baroness | D40: Halfling | E40: NO | F40: 1 | H40: 1 | I40: 1 | K40: 1 | N40: Member | O40: 1
A41: =HYPERLINK("http://www.magelo.com/eq_view_profile.html?num=265387","Sarelin") -> Sarelin | B41: 64 | C41: Baron | D41: Barbarian | E41: NO | H41: 1 | I41: 1 | J41: 1 | K41: 1 | N41: Member | O41: 1
A42: =HYPERLINK("http://www.magelo.com/eq_view_profile.html?num=98879","Silph") -> Silph | B42: 65 | C42: Veteran | D42: Human | E42: YES | F42: 1 | G42: 1 | N42: Member | O42: 1
A43: =HYPERLINK("http://www.magelo.com/eq_view_profile.html?num=361707","Veera") -> Veera | B43: 55 | D43: Barbarian | E43: NO | N43: Member | O43: 1
A44: Zeal (alt) | B44: 65 | N44: Member
A45: Shadow Knights
A46: =HYPERLINK("http:www.magelo.com/eq_view_profile.html?num=362550","Asdrubael") -> Asdrubael | B46: 65 | C46: Duke | D46: Dark Elf | E46: YES | F46: 1 | G46: 1 | H46: 1 | N46: Member | O46: 1
A47: Groldar | B47: 62 | D47: Iksar | E47: NO | H47: 1 | I47: 1 | J47: 1 | K47: 1 | L47: 1 | N47: Member | O47: 1
A48: =HYPERLINK("http://www.legendsoftherealm.com/legends/","Lunna") -> Lunna | B48: 58 | D48: Erudite | E48: NO | N48: Member | O48: 1
A49: =HYPERLINK("http://www.magelo.com/eq_view_profile.html?num=70519","Rakum") -> Rakum | B49: 65 | C49: Duke | D49: Troll | E49: NO | G49: 1 | H49: 1 | I49: 1 | K49: 1 | N49: Member | O49: 1
A50: =HYPERLINK("http://www.magelo.com/eq_view_profile.html?num=359742","Tobak") -> Tobak | B50: 62 | D50: Ogre | E50: YES | F50: 1 | G50: 1 | H50: 1 | I50: 1 | K50: 1 | L50: 1 | N50: Member | O50: 1
A51: =HYPERLINK("http://www.magelo.com/eq_view_profile.html?num=346793","Veya") -> Veya | B51: 65 | C51: Sir | D51: Iksar | E51: NO | F51: 1 | G51: 1 | H51: 1 | I51: 1 | J51: 1 | K51: 1 | L51: 1 | N51: Member | O51: 1
A52: =HYPERLINK("http://www.magelo.com/eq_view_profile.html?num=350162","Zolgar") -> Zolgar | B52: 63 | D52: Troll | E52: NO | F52: 1 | N52: Member | O52: 1
A53: Paladins
A54: =HYPERLINK("http://www.magelo.com/eq_view_profile.html?num=98063","Badin") -> Badin | B54: 65 | C54: Sir | D54: Dwarf | E54: YES | F54: 1 | G54: 1 | H54: 1 | I54: 1 | J54: 1 | K54: 1 | N54: Guild Leader | O54: 1
A55: =HYPERLINK("http://www.magelo.com/eq_view_profile.html?num=168250","Brokkson") -> Brokkson | B55: 65 | C55: Duke | D55: Dwarf | E55: NO | F55: 1 | G55: 1 | H55: 1 | I55: 1 | J55: 1 | K55: 1 | L55: 1 | M55: 1 | N55: Member | O55: 1
A56: =HYPERLINK("http://www.magelo.com/eq_view_profile.html?num=350082","Infirit") -> Infirit | B56: 60 | D56: Half Elf | E56: YES | H56: 1 | K56: 1 | N56: Member | O56: 1
A57: Kwaidd | B57: 62 | D57: Dwarf | E57: NO | N57: Member | O57: 1
A58: =HYPERLINK("http://www.magelo.com/eq_view_profile.html?num=301696","Shadrakk") -> Shadrakk | B58: 61 | D58: Human | E58: NO | H58: 1 | N58: Member | O58: 1
A59: Shamans
A60: =HYPERLINK("http://www.magelo.com/eq_view_profile.html?num=557618","Aldarien") -> Aldarien | B60: 65 | C60: Venerable | D60: Barbarian | E60: YES | H60: 1 | I60: 1 | J60: 1 | K60: 1 | L60: 1 | N60: Member | O60: 1
A61: Bamslam | B61: 65 | C61: Venerable | D61: Troll | E61: YES | F61: 1 | G61: 1 | N61: Officer | O61: 1
A62: Blisk | B62: 65 | C62: Baron | D62: Iksar | E62: YES | G62: 1 | H62: 1 | I62: 1 | K62: 1 | L62: 1 | N62: Member | O62: 1
A63: Bulvyne | B63: 65 | D63: Barbarian | N63: Member | O63: 1
A64: Kroze | B64: 60 | D64: Barbarian | E64: YES | N64: Member | O64: 1
A65: =HYPERLINK("http://www.magelo.com/eq_view_profile.html?num=183881","Naghite") -> Naghite | B65: 62 | C65: Venerable | D65: Ogre | E65: YES | F65: 1 | G65: 1 | H65: 1 | I65: 1 | J65: 1 | K65: 1 | M65: 1 | N65: Member | O65: 1
A66: =HYPERLINK("http://www.magelo.com/eq_view_profile.html?num=347641","Ruanu") -> Ruanu | B66: 64 | C66: Venerable | D66: Troll | E66: YES | F66: 1 | N66: Member | O66: 1
A67: Saramina | B67: 60 | C67: Venerable | D67: Barbarian | E67: YES | N67: Member | O67: 1
A68: Sscar | B68: 65 | D68: Barbarian | E68: YES | N68: Member | O68: 1
A69: =HYPERLINK("http://www.magelo.com/eq_view_profile.html?num=194845","Ulskun") -> Ulskun | B69: 65 | D69: Barbarian | E69: YES | N69: Member | O69: 1
A70: =HYPERLINK("http://www.magelo.com/eq_view_profile.html?num=356943","Zurs") -> Zurs | B70: 65 | C70: Venerable | D70: Barbarian | E70: YES | F70: 1 | G70: 1 | N70: Member | O70: 1
A71: =HYPERLINK("http://www.magelo.com/eq_view_profile.html?num=341926","Oenone (alt)") -> Oenone (alt) | B71: 60 | C71: Venerable | D71: Troll | E71: YES | F71: 1 | N71: Member
A72: Rogues
A73: Britan | B73: 65 | C73: Veteran | D73: Gnome | E73: YES | F73: 1 | G73: 1 | H73: 1 | I73: 1 | N73: Member | O73: 1
A74: =HYPERLINK("http://www.magelo.com/eq_view_profile.html?num=524849","Gerhardt") -> Gerhardt | B74: 65 | C74: Marauder | D74: Dwarf | E74: YES | G74: 1 | H74: 1 | I74: 1 | J74: 1 | K74: 1 | L74: 1 | N74: Member | O74: 1
A75: =HYPERLINK("http://www.magelo.com/eq_view_profile.html?num=35808","Honour") -> Honour | B75: 65 | C75: Veteran | D75: Half Elf | E75: YES | F75: 1 | G75: 1 | H75: 1 | I75: 1 | J75: 1 | N75: Member | O75: 1
A76: =HYPERLINK("http://www.magelo.com/eq_view_profile.html?num=319473","Less") -> Less | B76: 65 | C76: Veteran | D76: Barbarian | E76: YES | H76: 1 | I76: 1 | J76: 1 | K76: 1 | N76: Member | O76: 1
A77: =HYPERLINK("http://www.magelo.com/eq_view_profile.html?num=552907","Mindori") -> Mindori | B77: 62 | D77: Dark Elf | E77: NO | H77: 1 | N77: Member | O77: 1
A78: =HYPERLINK("http://www.magelo.com/eq_view_profile.html?num=176420","Morisan") -> Morisan | B78: 65 | C78: Marauder | D78: Dwarf | E78: YES | F78: 1 | G78: 1 | H78: 1 | I78: 1 | J78: 1 | K78: 1 | L78: 1 | N78: Member | O78: 1
A79: Slipn | B79: 62 | N79: Member | O79: 1
A80: =HYPERLINK("http://www.magelo.com/eq_view_profile.html?num=92314","Vestrial") -> Vestrial | B80: 65 | C80: Marauder | D80: Half Elf | E80: YES | F80: 1 | G80: 1 | H80: 1 | I80: 1 | N80: Gimp | O80: 1
A81: Bards
A82: =HYPERLINK("http://www.magelo.com/eq_view_profile.html?num=328474 ","Arsis") -> Arsis | B82: 60 | D82: Wood Elf | E82: YES | H82: 1 | N82: Member | O82: 1
A83: =HYPERLINK("http://www.magelo.com/eq_view_profile.html?num=194601","Cranth") -> Cranth | B83: 65 | C83: Veteran | D83: Wood Elf | E83: YES | F83: 1 | G83: 1 | H83: 1 | I83: 1 | J83: 1 | N83: Cranky | O83: 1
A84: =HYPERLINK("http://www.magelo.com/eq_view_profile.html?num=344746","Rosha") -> Rosha | B84: 65 | D84: Wood Elf | E84: YES | F84: 1 | H84: 1 | N84: Officer | O84: 1
A85: =HYPERLINK("http://www.magelo.com/eq_view_profile.html?num=182277","Yorke") -> Yorke | B85: 62 | C85: Veteran | D85: God | E85: YES | F85: 1 | G85: 1 | H85: 1 | I85: 1 | N85: Officer | O85: 1
A86: Enchanters
A87: =HYPERLINK("http://www.magelo.com/eq_view_profile.html?num=345631","Cwell") -> Cwell | B87: 65 | C87: Master | D87: Erudite | E87: YES | F87: 1 | G87: 1 | H87: 1 | I87: 1 | N87: Member | O87: 1
A88: Jibrit | B88: 63 | D88: Gnome | H88: 1 | N88: Member | O88: 1
A89: =HYPERLINK("http://www.magelo.com/eq_view_profile.html?num=343464","Sethrah") -> Sethrah | B89: 65 | C89: Mistress | D89: Dark Elf | E89: YES | F89: 1 | G89: 1 | H89: 1 | I89: 1 | K89: 1 | N89: Member | O89: 1
A90: =HYPERLINK("http://www.magelo.com/eq_view_profile.html?num=376636","Terir") -> Terir | B90: 61 | D90: High Elf | E90: NO | F90: 1 | H90: 1 | N90: Member | O90: 1
A91: Amantus (alt) | B91: 62 | D91: High Elf | E91: NO | H91: 1
A92: =HYPERLINK("http://www.magelo.com/eq_view_profile.html?num=64112","Roonie (alt)") -> Roonie (alt) | B92: 62 | C92: Mistress | D92: High Elf | E92: NO | F92: 1 | H92: 1 | J92: 1 | L92: 1 | N92: Member
A93: Monks
A94: Chubbies | B94: 65 | C94: Sensei | D94: Iksar | E94: YES | F94: 1 | G94: 1 | H94: 1 | I94: 1 | K94: 1 | N94: Member | O94: 1
A95: Dlainy | B95: 65 | D95: Human | E95: YES | N95: Member | O95: 1
A96: Stormin | B96: 65 | C96: Baron | D96: Human | E96: YES | F96: 1 | G96: 1 | N96: Member | O96: 1
A97: =HYPERLINK("http://www.magelo.com/eq_view_profile.html?num=54695","Talinsyn") -> Talinsyn | B97: 64 | C97: Sensei | D97: Human | E97: YES | F97: 1 | G97: 1 | H97: 1 | I97: 1 | J97: 1 | K97: 1 | N97: Member | O97: 1
A98: =HYPERLINK("http://www.magelo.com/eq_view_profile.html?num=64095","Voir") -> Voir | B98: 62 | C98: Brother | D98: Iksar | E98: YES | F98: 1 | G98: 1 | H98: 1 | J98: 1 | L98: 1 | N98: Member | O98: 1
A99: Druids
A100: =HYPERLINK("http://www.magelo.com/eq_view_profile.html?num=28957","Echineasia") -> Echineasia | B100: 65 | C100: Baroness | D100: Wood Elf | E100: YES | F100: 1 | G100: 1 | H100: 1 | J100: 1 | L100: 1 | N100: Member | O100: 1
A101: =HYPERLINK("http://www.magelo.com/eq_view_profile.html?num=107624","Edylc") -> Edylc | B101: 63 | D101: Halfling | E101: YES | N101: Member | O101: 1
A102: =HYPERLINK("http://www.magelo.com/eq_view_profile.html?num=186512","Gweeto") -> Gweeto | B102: 65 | D102: Halfling | E102: YES | F102: 1 | G102: 1 | H102: 1 | I102: 1 | J102: 1 | K102: 1 | L102: 1 | N102: Member | O102: 1
A103: =HYPERLINK("http://www.magelo.com/eq_view_profile.html?num=12316","Thunderheart") -> Thunderheart | B103: 65 | C103: Venerable | D103: Wood Elf | E103: YES | H103: 1 | I103: 1 | L103: 1 | N103: Member | O103: 1
A104: =HYPERLINK("http://www.magelo.com/eq_view_profile.html?num=11509","Wickie") -> Wickie | B104: 65 | C104: Venerable | D104: Wood Elf | E104: YES | F104: 1 | G104: 1 | H104: 1 | I104: 1 | J104: 1 | L104: 1 | N104: Member | O104: 1
A105: =HYPERLINK("http://www.magelo.com/eq_view_profile.html?num=226868","Padain (alt)") -> Padain (alt) | B105: 60 | D105: Wood Elf | E105: NO | F105: 1 | G105: 1 | H105: 1 | J105: 1 | N105: Member
A106: Rangers
A107: Birdsong | B107: 59 | D107: Wood Elf | E107: NO | N107: Member | O107: 1
A108: Canis | B108: 62 | D108: Wood Elf | E108: YES | F108: 1 | H108: 1 | I108: 1 | J108: 1 | K108: 1 | N108: Member | O108: 1
A109: =HYPERLINK("http://www.magelo.com/eq_view_profile.html?num=350545","Moshady") -> Moshady | B109: 63 | C109: Baron | D109: Wood Elf | E109: YES | G109: 1 | H109: 1 | I109: 1 | J109: 1 | L109: 1 | N109: Member | O109: 1
A110: Molian | B110: 65 | C110: Hunter | D110: Wood Elf | N110: Member | O110: 1
A111: =HYPERLINK("http://www.magelo.com/eq_view_profile.html?num=236757","Paliane") -> Paliane | B111: 56 | D111: Half Elf | E111: NO | N111: Member | O111: 1
A112: Tyndall | B112: 61 | D112: Half Elf | H112: 1 | I112: 1 | J112: 1 | K112: 1 | N112: Member | O112: 1
A113: =HYPERLINK("http://www.magelo.com/eq_view_profile.html?num=205039","Twitami") -> Twitami | B113: 64 | C113: Hunter | D113: Wood Elf | E113: YES | F113: 1 | G113: 1 | H113: 1 | I113: 1 | N113: Member | O113: 1
A114: Necromancers
A115: Evilgrim | B115: 60 | D115: Gnome | N115: Member | O115: 1
A116: =HYPERLINK("http://www.magelo.com/eq_view_profile.html?num=352099","Lokaris") -> Lokaris | B116: 65 | C116: Lich | D116: Dark Elf | E116: YES | F116: 1 | G116: 1 | K116: 1 | N116: Officer | O116: 1
A117: Scraps | B117: 65 | C117: Lich | D117: Gnome | H117: 1 | I117: 1 | J117: 1 | L117: 1 | N117: Member | O117: 1
A118: Num of Act. Memb.= | B118: =SUM(O1:O116) -> 85 | C118: % Of Guild With Access= | F118: =SUM(F4:F117)/B118*1 -> 0.63529411764705879 | G118: =SUM(G4:G117)/B118*1 -> 0.52941176470588236 | H118: =SUM(H4:H117)/B118*1 -> 0.71764705882352942 | I118: =SUM(I4:I117)/B118*1 -> 0.51764705882352946 | J118: =SUM(J4:J117)/B118*1 -> 0.3411764705882353 | K118: =SUM(K4:K117)/B118*1 -> 0.30588235294117649 | L118: =SUM(L4:L117)/B118*1 -> 0.25882352941176473 | M118: =SUM(M4:M117)/B118*1 -> 3.5294117647058823E-2
A119: Average Level= | B119: =AVERAGE(B4:B13,B21:B25,B28:B30,B34:B43,B46:B52,B54:B58,B60:B70,B73:B80,B82:B85,B87:B90,B94:B98,B100:B104,B107:B113,B115:B117) -> 63.218390804597703