A1: Name | B1: Effect | C1: Ranking | D1: AC | E1: STR | F1: STA | G1: AGI | H1: DEX | I1: WIS | J1: INT | K1: CHA | L1: HP | M1: MANA | N1: PR | O1: MR | P1: DR | Q1: FR | R1: CR | S1: WT | T1: WP | U1: Type
A2: Do`Vassir's Gauntlets of Might | C2: =(I2*10)+M2+(D2*4)+G2+(L2/5)+(F2*2)+(E2*2)+(K2*2)+(O2/2)+(Q2/2)+(R2/2)+(N2/4)+(P2/4) -> 565 | D2: 40.0 | E2: 20.0 | F2: 15.0 | G2: 15.0 | H2: 15.0 | I2: 15.0 | J2: 15.0 | K2: 15.0 | L2: 100.0 | M2: 100.0 | N2: 10.0 | O2: 10.0 | P2: 10.0 | Q2: 10.0 | R2: 10.0 | S2: 2.0 | T2: =0-QUOTIENT(S2, 5) -> 0 | U2: hands
A3: Gauntlets of Dragon Slaying | B3: Haste | C3: =(I3*10)+M3+(D3*4)+G3+(L3/5)+(F3*2)+(E3*2)+(K3*2)+(O3/2)+(Q3/2)+(R3/2)+(N3/4)+(P3/4)+30 -> 366 | D3: 30.0 | E3: 9.0 | I3: 9.0 | J3: 9.0 | L3: 75.0 | M3: 75.0 | N3: 9.0 | O3: 9.0 | P3: 9.0 | Q3: 9.0 | R3: 9.0 | S3: 0.0 | T3: =0-QUOTIENT(S3, 5) -> 0 | U3: hands
A4: Slighted Gloves | C4: =(I4*10)+M4+(D4*4)+G4+(L4/5)+(F4*2)+(E4*2)+(K4*2)+(O4/2)+(Q4/2)+(R4/2)+(N4/4)+(P4/4) -> 290 | D4: 15 | E4: 15 | I4: 20 | S4: 1 | U4: hand
A5: Gloves of the Earthcrafter | B5: Shield of Thorns | C5: =(I5*10)+M5+(D5*4)+G5+(L5/5)+(F5*2)+(E5*2)+(K5*2)+(O5/2)+(Q5/2)+(R5/2)+(N5/4)+(P5/4)+30 -> 257.5 | D5: 10.0 | E5: 5.0 | I5: 12.0 | M5: 50.0 | O5: 5.0 | Q5: 5.0 | R5: 5.0 | S5: 2.0 | T5: =0-QUOTIENT(S5, 5) -> 0 | U5: hands
A6: Twisted Nature Gloves | B6: Nullify Magic | C6: =(I6*10)+M6+(D6*4)+G6+(L6/5)+(F6*2)+(E6*2)+(K6*2)+(O6/2)+(Q6/2)+(R6/2)+(N6/4)+(P6/4)+30 -> 245 | D6: 15.0 | H6: 10.0 | I6: 10.0 | L6: 50.0 | M6: 40.0 | Q6: 5.0 | R6: 5.0 | S6: 1.5 | T6: =0-QUOTIENT(S6, 5) -> 0 | U6: hands
A7: Onyx Gauntlets | C7: =(I7*10)+M7+(D7*4)+G7+(L7/5)+(F7*2)+(E7*2)+(K7*2)+(O7/2)+(Q7/2)+(R7/2)+(N7/4)+(P7/4) -> 241 | D7: 35.0 | L7: 100.0 | M7: 75.0 | N7: 3.0 | O7: 3.0 | P7: 3.0 | Q7: 3.0 | R7: 3.0 | S7: 2.0 | T7: =0-QUOTIENT(S7, 5) -> 0 | U7: hands
A8: Gloves of Stability | C8: =(I8*10)+M8+(D8*4)+G8+(L8/5)+(F8*2)+(E8*2)+(K8*2)+(O8/2)+(Q8/2)+(R8/2)+(N8/4)+(P8/4) -> 199 | D8: 35.0 | E8: 7.0 | F8: 7.0 | L8: 75.0 | N8: 8.0 | O8: 8.0 | P8: 8.0 | Q8: 8.0 | R8: 8.0 | S8: 20.0 | T8: =0-QUOTIENT(S8, 5) -> -4 | U8: hands
A9: Twisted Steel Gauntlets | C9: =(I9*10)+M9+(D9*4)+G9+(L9/5)+(F9*2)+(E9*2)+(K9*2)+(O9/2)+(Q9/2)+(R9/2)+(N9/4)+(P9/4) -> 168 | D9: 32.0 | E9: 20.0 | S9: 3.0 | T9: =0-QUOTIENT(S9, 5) -> 0 | U9: hands
A10: Coldain Skin Gloves | C10: =(I10*10)+M10+(D10*4)+G10+(L10/5)+(F10*2)+(E10*2)+(K10*2)+(O10/2)+(Q10/2)+(R10/2)+(N10/4)+(P10/4) -> 150 | D10: 12.0 | F10: 9.0 | I10: 6.0 | J10: 6.0 | L10: 20.0 | M10: 20.0 | S10: 1.5 | T10: =0-QUOTIENT(S10, 5) -> 0 | U10: hands
A11: Geomantic Fingers of Focus | B11: Flowing Thought III | C11: =(I11*10)+M11+(D11*4)+G11+(L11/5)+(F11*2)+(E11*2)+(K11*2)+(O11/2)+(Q11/2)+(R11/2)+(N11/4)+(P11/4) -> 140 | D11: 30 | E11: 5 | N11: 5 | O11: 5 | P11: 5 | Q11: 5 | R11: 5 | S11: 00.1 | U11: hands
A12: Crystal Chitin Gauntlets | C12: =(I12*10)+M12+(D12*4)+G12+(L12/5)+(F12*2)+(E12*2)+(K12*2)+(O12/2)+(Q12/2)+(R12/2)+(N12/4)+(P12/4) -> 135 | D12: 20.0 | E12: 10.0 | M12: 35.0 | S12: 2.0 | T12: =0-QUOTIENT(S12, 5) -> 0 | U12: hands
A13: Faith Healer's Gloves | C13: =(I13*10)+M13+(D13*4)+G13+(L13/5)+(F13*2)+(E13*2)+(K13*2)+(O13/2)+(Q13/2)+(R13/2)+(N13/4)+(P13/4) -> 127 | D13: 8 | I13: 7 | M13: 25 | S13: 2.5 | U13: hand
A14: Slime Blood of Cazic Thule | C14: =(I14*10)+M14+(D14*4)+G14+(L14/5)+(F14*2)+(E14*2)+(K14*2)+(O14/2)+(Q14/2)+(R14/2)+(N14/4)+(P14/4) -> 122 | D14: 16.0 | E14: 2.0 | F14: 2.0 | G14: 2.0 | H14: 2.0 | I14: 2.0 | J14: 2.0 | K14: 2.0 | L14: 20.0 | M14: 20.0 | S14: 15.0 | T14: =0-QUOTIENT(S14, 5) -> -3 | U14: hands
A15: Grey Flesh Gloves | C15: =(I15*10)+M15+(D15*4)+G15+(L15/5)+(F15*2)+(E15*2)+(K15*2)+(O15/2)+(Q15/2)+(R15/2)+(N15/4)+(P15/4) -> 118 | D15: 6 | H15: 10 | I15: 6 | J15: 6 | L15: 20 | M15: 25 | R15: 10 | S15: 1 | U15: hand
A16: Woven Grass Gauntlets | C16: =(I16*10)+M16+(D16*4)+G16+(L16/5)+(F16*2)+(E16*2)+(K16*2)+(O16/2)+(Q16/2)+(R16/2)+(N16/4)+(P16/4) -> 114.75 | D16: 8.0 | F16: 2.0 | H16: 2.0 | I16: 3.0 | M16: 45.0 | O16: 5.0 | P16: 5.0 | S16: 1.5 | T16: =0-QUOTIENT(S16, 5) -> 0 | U16: hands
A17: Elysian Gloves | C17: =(I17*10)+M17+(D17*4)+G17+(L17/5)+(F17*2)+(E17*2)+(K17*2)+(O17/2)+(Q17/2)+(R17/2)+(N17/4)+(P17/4) -> 109.5 | D17: 10 | E17: 6 | H17: 10 | I17: 3 | M17: 25 | O17: 5 | S17: 4 | U17: hand
A18: Golden Efreeti Gauntlets | C18: =(I18*10)+M18+(D18*4)+G18+(L18/5)+(F18*2)+(E18*2)+(K18*2)+(O18/2)+(Q18/2)+(R18/2)+(N18/4)+(P18/4) -> 100.5 | D18: 12.0 | I18: 5.0 | J18: 5.0 | P18: 10.0 | S18: 3.8 | T18: =0-QUOTIENT(S18, 5) -> 0 | U18: hands
A19: Nature Walker's Gauntlets | C19: =(I19*10)+M19+(D19*4)+G19+(L19/5)+(F19*2)+(E19*2)+(K19*2)+(O19/2)+(Q19/2)+(R19/2)+(N19/4)+(P19/4) -> 92.5 | D19: 10.0 | F19: 2.0 | G19: 2.0 | I19: 2.0 | M19: 25.0 | O19: 2.0 | R19: 1.0 | S19: 1.5 | T19: =0-QUOTIENT(S19, 5) -> 0 | U19: hands
A20: Gloves of Harmony | C20: =(I20*10)+M20+(D20*4)+G20+(L20/5)+(F20*2)+(E20*2)+(K20*2)+(O20/2)+(Q20/2)+(R20/2)+(N20/4)+(P20/4) -> 91.25 | D20: 9.0 | F20: 2.0 | I20: 3.0 | M20: 20.0 | N20: 1.0 | Q20: 2.0 | S20: 1.5 | T20: =0-QUOTIENT(S20, 5) -> 0 | U20: hands
A21: Rowyl's Gauntlets of Nature | C21: =(I21*10)+M21+(D21*4)+G21+(L21/5)+(F21*2)+(E21*2)+(K21*2)+(O21/2)+(Q21/2)+(R21/2)+(N21/4)+(P21/4) -> 82.25 | D21: 8.0 | F21: 2.0 | I21: 2.0 | M21: 25.0 | N21: 1.0 | O21: 2.0 | S21: 5.5 | T21: =0-QUOTIENT(S21, 5) -> -1 | U21: hands
A22: Gauntlets of Iron Tactics | C22: =(I22*10)+M22+(D22*4)+G22+(L22/5)+(F22*2)+(E22*2)+(K22*2)+(O22/2)+(Q22/2)+(R22/2)+(N22/4)+(P22/4) -> 82 | D22: 2.0 | E22: 7.0 | H22: 7.0 | I22: 7.0 | K22: -5.0 | S22: 1.0 | T22: =0-QUOTIENT(S22, 5) -> 0 | U22: hands
A23: Primitive Leather Gloves | C23: =(I23*10)+M23+(D23*4)+G23+(L23/5)+(F23*2)+(E23*2)+(K23*2)+(O23/2)+(Q23/2)+(R23/2)+(N23/4)+(P23/4) -> 80 | D23: 12 | E23: 8 | F23: 8 | S23: 2.2 | U23: hand
A24: Nathsar Gauntlets | C24: =(I24*10)+M24+(D24*4)+G24+(L24/5)+(F24*2)+(E24*2)+(K24*2)+(O24/2)+(Q24/2)+(R24/2)+(N24/4)+(P24/4) -> 74 | D24: 8.0 | H24: 4.0 | I24: 4.0 | O24: 2.0 | R24: 2.0 | S24: 0.5 | T24: =0-QUOTIENT(S24, 5) -> 0 | U24: hands
A25: Elder Spiritist's Gauntlets | B25: Snare | C25: =(I25*10)+M25+(D25*4)+G25+(L25/5)+(F25*2)+(E25*2)+(K25*2)+(O25/2)+(Q25/2)+(R25/2)+(N25/4)+(P25/4)+30 -> 66 | D25: 9.0 | S25: 5.0 | T25: =0-QUOTIENT(S25, 5) -> -1 | U25: hands
A26: Imbued Elven Chainmail Gloves | C26: =(I26*10)+M26+(D26*4)+G26+(L26/5)+(F26*2)+(E26*2)+(K26*2)+(O26/2)+(Q26/2)+(R26/2)+(N26/4)+(P26/4) -> 63 | D26: 7.0 | I26: 3.0 | J26: 3.0 | K26: 2.0 | O26: 2.0 | S26: 00.7 | T26: =0-QUOTIENT(S26, 5) -> 0 | U26: hands
A27: Gauntlets of Potence | C27: =(I27*10)+M27+(D27*4)+G27+(L27/5)+(F27*2)+(E27*2)+(K27*2)+(O27/2)+(Q27/2)+(R27/2)+(N27/4)+(P27/4) -> 62 | D27: 8.0 | E27: 15.0 | S27: 3.0 | T27: =0-QUOTIENT(S27, 5) -> 0 | U27: hands
A28: Withered Leather Gloves | C28: =(I28*10)+M28+(D28*4)+G28+(L28/5)+(F28*2)+(E28*2)+(K28*2)+(O28/2)+(Q28/2)+(R28/2)+(N28/4)+(P28/4) -> 60 | D28: 5.0 | M28: 35.0 | R28: 10.0 | S28: 1.5 | T28: =0-QUOTIENT(S28, 5) -> 0 | U28: hands
A29: Flayed Paebala Gloves | C29: =(I29*10)+M29+(D29*4)+G29+(L29/5)+(F29*2)+(E29*2)+(K29*2)+(O29/2)+(Q29/2)+(R29/2)+(N29/4)+(P29/4) -> 58 | D29: 12.0 | H29: 15.0 | N29: 5.0 | O29: 5.0 | P29: 5.0 | Q29: 5.0 | R29: 5.0 | S29: 1.0 | T29: =0-QUOTIENT(S29, 5) -> 0 | U29: hands
A30: Terror Gauntlets | C30: =(I30*10)+M30+(D30*4)+G30+(L30/5)+(F30*2)+(E30*2)+(K30*2)+(O30/2)+(Q30/2)+(R30/2)+(N30/4)+(P30/4) -> 58 | D30: 12 | L30: 20 | N30: 3 | O30: 3 | P30: 3 | Q30: 3 | R30: 3 | S30: 2.5 | U30: hand
A31: Silver Chitin Hand Wraps | B31: Haste | C31: =(I31*10)+M31+(D31*4)+G31+(L31/5)+(F31*2)+(E31*2)+(K31*2)+(O31/2)+(Q31/2)+(R31/2)+(N31/4)+(P31/4)+30 -> 56 | D31: 5.0 | N31: 3.0 | O31: 3.0 | P31: 3.0 | Q31: 3.0 | R31: 3.0 | S31: 1.0 | T31: =0-QUOTIENT(S31, 5) -> 0 | U31: hands
A32: Gloves of Altered Reality | C32: =(I32*10)+M32+(D32*4)+G32+(L32/5)+(F32*2)+(E32*2)+(K32*2)+(O32/2)+(Q32/2)+(R32/2)+(N32/4)+(P32/4) -> 55 | D32: 8 | J32: 5 | M32: 20 | O32: 2 | Q32: 2 | R32: 2 | S32: 3 | U32: hand
A33: Turtle Wrangler's Gloves | C33: =(I33*10)+M33+(D33*4)+G33+(L33/5)+(F33*2)+(E33*2)+(K33*2)+(O33/2)+(Q33/2)+(R33/2)+(N33/4)+(P33/4) -> 55 | D33: 8 | E33: 1 | F33: 1 | G33: 1 | H33: 1 | I33: 1 | J33: 1 | K33: 1 | L33: 5 | M33: 5 | S33: 1.5 | U33: hand
A34: Gauntlets of Mortality | C34: =(I34*10)+M34+(D34*4)+G34+(L34/5)+(F34*2)+(E34*2)+(K34*2)+(O34/2)+(Q34/2)+(R34/2)+(N34/4)+(P34/4) -> 54 | D34: 14.0 | E34: 15.0 | F34: -7.0 | H34: 9.0 | K34: -4.0 | N34: -5.0 | O34: -5.0 | P34: -5.0 | Q34: -5.0 | R34: -5.0 | S34: 00.3 | T34: =0-QUOTIENT(S34, 5) -> 0 | U34: hands
A35: White Satin Gloves | C35: =(I35*10)+M35+(D35*4)+G35+(L35/5)+(F35*2)+(E35*2)+(K35*2)+(O35/2)+(Q35/2)+(R35/2)+(N35/4)+(P35/4) -> 53.5 | D35: 4.0 | L35: 25.0 | M35: 25.0 | N35: -5.0 | O35: -5.0 | P35: -5.0 | Q35: 30.0 | R35: -5.0 | S35: 00.1 | T35: =0-QUOTIENT(S35, 5) -> 0 | U35: hands
A36: Enchanted Elven Chainmail Gloves | C36: =(I36*10)+M36+(D36*4)+G36+(L36/5)+(F36*2)+(E36*2)+(K36*2)+(O36/2)+(Q36/2)+(R36/2)+(N36/4)+(P36/4) -> 49 | D36: 7.0 | I36: 2.0 | J36: 2.0 | O36: 2.0 | S36: 00.7 | T36: =0-QUOTIENT(S36, 5) -> 0 | U36: hands
A37: Laoch Combat Gauntlets | C37: =(I37*10)+M37+(D37*4)+G37+(L37/5)+(F37*2)+(E37*2)+(K37*2)+(O37/2)+(Q37/2)+(R37/2)+(N37/4)+(P37/4) -> 47 | D37: 7.0 | E37: 4.0 | F37: 3.0 | G37: 5.0 | S37: 3.0 | T37: =0-QUOTIENT(S37, 5) -> 0 | U37: hands
A38: Gnome Skin Gloves | C38: =(I38*10)+M38+(D38*4)+G38+(L38/5)+(F38*2)+(E38*2)+(K38*2)+(O38/2)+(Q38/2)+(R38/2)+(N38/4)+(P38/4) -> 45 | D38: 5.0 | G38: 5.0 | H38: 3.0 | I38: 2.0 | S38: 1.0 | T38: =0-QUOTIENT(S38, 5) -> 0 | U38: hands
A39: Pristine Studded Leather Gloves | C39: =(I39*10)+M39+(D39*4)+G39+(L39/5)+(F39*2)+(E39*2)+(K39*2)+(O39/2)+(Q39/2)+(R39/2)+(N39/4)+(P39/4) -> 45 | D39: 5.0 | H39: 2.0 | I39: 2.0 | M39: 5.0 | S39: 00.2 | T39: =0-QUOTIENT(S39, 5) -> 0 | U39: hands
A40: Cobalt Drake Gloves | C40: =(I40*10)+M40+(D40*4)+G40+(L40/5)+(F40*2)+(E40*2)+(K40*2)+(O40/2)+(Q40/2)+(R40/2)+(N40/4)+(P40/4) -> 44.5 | D40: 8.0 | M40: 10.0 | R40: 5.0 | S40: 1.5 | T40: =0-QUOTIENT(S40, 5) -> 0 | U40: hands
A41: Cured Tizmak Gloves | C41: =(I41*10)+M41+(D41*4)+G41+(L41/5)+(F41*2)+(E41*2)+(K41*2)+(O41/2)+(Q41/2)+(R41/2)+(N41/4)+(P41/4) -> 44 | D41: 9.0 | Q41: 8.0 | R41: 8.0 | S41: 2.0 | T41: =0-QUOTIENT(S41, 5) -> 0 | U41: hands
A42: Snakefingers | B42: Poison Bolt | C42: =(I42*10)+M42+(D42*4)+G42+(L42/5)+(F42*2)+(E42*2)+(K42*2)+(O42/2)+(Q42/2)+(R42/2)+(N42/4)+(P42/4) -> 40 | D42: 10 | S42: 1.5 | U42: hands
A43: Gem Inlaid Gauntlets | C43: =(I43*10)+M43+(D43*4)+G43+(L43/5)+(F43*2)+(E43*2)+(K43*2)+(O43/2)+(Q43/2)+(R43/2)+(N43/4)+(P43/4) -> 38 | D43: 8.0 | F43: 3.0 | H43: 3.0 | S43: 1.0 | T43: =0-QUOTIENT(S43, 5) -> 0 | U43: hands
A44: Imbued Mithril Studded Gloves | C44: =(I44*10)+M44+(D44*4)+G44+(L44/5)+(F44*2)+(E44*2)+(K44*2)+(O44/2)+(Q44/2)+(R44/2)+(N44/4)+(P44/4) -> 38 | D44: 6.0 | I44: 1.0 | K44: 2.0 | S44: 1.0 | T44: =0-QUOTIENT(S44, 5) -> 0 | U44: hands
A45: Imbued Vale Studded Gloves (K) | C45: =(I45*10)+M45+(D45*4)+G45+(L45/5)+(F45*2)+(E45*2)+(K45*2)+(O45/2)+(Q45/2)+(R45/2)+(N45/4)+(P45/4) -> 38 | D45: 6.0 | F45: 2.0 | I45: 1.0 | S45: 1.0 | T45: =0-QUOTIENT(S45, 5) -> 0 | U45: hands
A46: Netted Kelp Gloves | C46: =(I46*10)+M46+(D46*4)+G46+(L46/5)+(F46*2)+(E46*2)+(K46*2)+(O46/2)+(Q46/2)+(R46/2)+(N46/4)+(P46/4) -> 37 | D46: 5.0 | E46: 4.0 | F46: 6.0 | J46: 5.0 | K46: -4.0 | Q46: 10.0 | S46: 00.4 | T46: =0-QUOTIENT(S46, 5) -> 0 | U46: hands
A47: Sporali Gloves | B47: Haste | C47: =(I47*10)+M47+(D47*4)+G47+(L47/5)+(F47*2)+(E47*2)+(K47*2)+(O47/2)+(Q47/2)+(R47/2)+(N47/4)+(P47/4)+30 -> 37 | D47: 2.0 | N47: -2.0 | P47: -2.0 | S47: 1.0 | T47: =0-QUOTIENT(S47, 5) -> 0 | U47: hands
A48: Split Paw Hide Gloves | C48: =(I48*10)+M48+(D48*4)+G48+(L48/5)+(F48*2)+(E48*2)+(K48*2)+(O48/2)+(Q48/2)+(R48/2)+(N48/4)+(P48/4) -> 36 | D48: 4.0 | H48: 3.0 | I48: 2.0 | S48: 2.0 | T48: =0-QUOTIENT(S48, 5) -> 0 | U48: hands
A49: Frosted Gloves | C49: =(I49*10)+M49+(D49*4)+G49+(L49/5)+(F49*2)+(E49*2)+(K49*2)+(O49/2)+(Q49/2)+(R49/2)+(N49/4)+(P49/4) -> 33 | D49: 7.0 | J49: 4.0 | R49: 10.0 | S49: 1.0 | T49: =0-QUOTIENT(S49, 5) -> 0 | U49: hands
A50: Coterie Gloves | C50: =(I50*10)+M50+(D50*4)+G50+(L50/5)+(F50*2)+(E50*2)+(K50*2)+(O50/2)+(Q50/2)+(R50/2)+(N50/4)+(P50/4) -> 32.2 | D50: 7 | E50: 2 | L50: 6 | Q50: -2 | S50: 1.5 | U50: hand
A51: Saprophyte Spore Gloves | C51: =(I51*10)+M51+(D51*4)+G51+(L51/5)+(F51*2)+(E51*2)+(K51*2)+(O51/2)+(Q51/2)+(R51/2)+(N51/4)+(P51/4) -> 30.5 | D51: 5 | G51: 3 | O51: 5 | Q51: 5 | R51: 5 | S51: 1.5 | U51: hand
A52: Drakkel Wolfhide Gloves | C52: =(I52*10)+M52+(D52*4)+G52+(L52/5)+(F52*2)+(E52*2)+(K52*2)+(O52/2)+(Q52/2)+(R52/2)+(N52/4)+(P52/4) -> 30 | D52: 7.0 | L52: 10.0 | S52: 00.1 | T52: =0-QUOTIENT(S52, 5) -> 0 | U52: hands
A53: Burynai Hide Gloves | C53: =(I53*10)+M53+(D53*4)+G53+(L53/5)+(F53*2)+(E53*2)+(K53*2)+(O53/2)+(Q53/2)+(R53/2)+(N53/4)+(P53/4) -> 28 | D53: 5.0 | F53: 2.0 | K53: 2.0 | S53: 1.1 | T53: =0-QUOTIENT(S53, 5) -> 0 | U53: hands
A54: Vale Reinforced Gloves | C54: =(I54*10)+M54+(D54*4)+G54+(L54/5)+(F54*2)+(E54*2)+(K54*2)+(O54/2)+(Q54/2)+(R54/2)+(N54/4)+(P54/4) -> 28 | D54: 7.0 | S54: 1.0 | T54: =0-QUOTIENT(S54, 5) -> 0 | U54: hands
A55: Ulthork Hide Gloves | C55: =(I55*10)+M55+(D55*4)+G55+(L55/5)+(F55*2)+(E55*2)+(K55*2)+(O55/2)+(Q55/2)+(R55/2)+(N55/4)+(P55/4) -> 26 | D55: 8.0 | J55: 3.0 | K55: -3.0 | S55: 1.5 | T55: =0-QUOTIENT(S55, 5) -> 0 | U55: hands
A56: Vermiculated Gloves | C56: =(I56*10)+M56+(D56*4)+G56+(L56/5)+(F56*2)+(E56*2)+(K56*2)+(O56/2)+(Q56/2)+(R56/2)+(N56/4)+(P56/4) -> 25.75 | D56: 6.0 | H56: 13.0 | J56: 5.0 | P56: 7.0 | S56: 5.5 | T56: =0-QUOTIENT(S56, 5) -> -1 | U56: hands
A57: Spore Covered Gloves | C57: =(I57*10)+M57+(D57*4)+G57+(L57/5)+(F57*2)+(E57*2)+(K57*2)+(O57/2)+(Q57/2)+(R57/2)+(N57/4)+(P57/4) -> 25 | D57: 6 | Q57: 2 | S57: 00.4 | U57: hand
A58: Dark Muslin Gloves | C58: =(I58*10)+M58+(D58*4)+G58+(L58/5)+(F58*2)+(E58*2)+(K58*2)+(O58/2)+(Q58/2)+(R58/2)+(N58/4)+(P58/4) -> 24 | D58: 6.0 | S58: 00.4 | T58: =0-QUOTIENT(S58, 5) -> 0 | U58: hands
A59: Elven Chainmail Gloves | C59: =(I59*10)+M59+(D59*4)+G59+(L59/5)+(F59*2)+(E59*2)+(K59*2)+(O59/2)+(Q59/2)+(R59/2)+(N59/4)+(P59/4) -> 24 | D59: 6.0 | S59: 1.5 | T59: =0-QUOTIENT(S59, 5) -> 0 | U59: hands
A60: Gloves of the Rock Climber | C60: =(I60*10)+M60+(D60*4)+G60+(L60/5)+(F60*2)+(E60*2)+(K60*2)+(O60/2)+(Q60/2)+(R60/2)+(N60/4)+(P60/4) -> 24 | D60: 3.0 | E60: 4.0 | F60: 2.0 | H60: 5.0 | S60: 4.5 | T60: =0-QUOTIENT(S60, 5) -> 0 | U60: hands
A61: Mithril Studded Gloves | C61: =(I61*10)+M61+(D61*4)+G61+(L61/5)+(F61*2)+(E61*2)+(K61*2)+(O61/2)+(Q61/2)+(R61/2)+(N61/4)+(P61/4) -> 24 | D61: 6.0 | S61: 1.0 | T61: =0-QUOTIENT(S61, 5) -> 0 | U61: hands
A62: Vale Studded Gloves | C62: =(I62*10)+M62+(D62*4)+G62+(L62/5)+(F62*2)+(E62*2)+(K62*2)+(O62/2)+(Q62/2)+(R62/2)+(N62/4)+(P62/4) -> 24 | D62: 6.0 | S62: 1.0 | T62: =0-QUOTIENT(S62, 5) -> 0 | U62: hands
A63: Lionskin Gloves | C63: =(I63*10)+M63+(D63*4)+G63+(L63/5)+(F63*2)+(E63*2)+(K63*2)+(O63/2)+(Q63/2)+(R63/2)+(N63/4)+(P63/4) -> 21 | D63: 5.0 | R63: 2.0 | S63: 1.1 | T63: =0-QUOTIENT(S63, 5) -> 0 | U63: hands
A64: Bearskin Gloves | C64: =(I64*10)+M64+(D64*4)+G64+(L64/5)+(F64*2)+(E64*2)+(K64*2)+(O64/2)+(Q64/2)+(R64/2)+(N64/4)+(P64/4) -> 20 | D64: 5.0 | S64: 2.1 | T64: =0-QUOTIENT(S64, 5) -> 0 | U64: hands
A65: Blue Wicker Gloves | C65: =(I65*10)+M65+(D65*4)+G65+(L65/5)+(F65*2)+(E65*2)+(K65*2)+(O65/2)+(Q65/2)+(R65/2)+(N65/4)+(P65/4) -> 20 | D65: 5.0 | S65: 2.2 | T65: =0-QUOTIENT(S65, 5) -> 0 | U65: hands
A66: Griffin Talon Claw | C66: =(I66*10)+M66+(D66*4)+G66+(L66/5)+(F66*2)+(E66*2)+(K66*2)+(O66/2)+(Q66/2)+(R66/2)+(N66/4)+(P66/4) -> 20 | D66: 4.0 | E66: 2.0 | S66: 0.0 | T66: =0-QUOTIENT(S66, 5) -> 0 | U66: hands
A67: Griffon Talon Gloves | C67: =(I67*10)+M67+(D67*4)+G67+(L67/5)+(F67*2)+(E67*2)+(K67*2)+(O67/2)+(Q67/2)+(R67/2)+(N67/4)+(P67/4) -> 20 | D67: 4.0 | E67: 2.0 | S67: 0.5 | T67: =0-QUOTIENT(S67, 5) -> 0 | U67: hands
A68: Reinforced Gloves | C68: =(I68*10)+M68+(D68*4)+G68+(L68/5)+(F68*2)+(E68*2)+(K68*2)+(O68/2)+(Q68/2)+(R68/2)+(N68/4)+(P68/4) -> 20 | D68: 5.0 | S68: 1.5 | T68: =0-QUOTIENT(S68, 5) -> 0 | U68: hands
A69: Purified Spirit Gloves | C69: =(I69*10)+M69+(D69*4)+G69+(L69/5)+(F69*2)+(E69*2)+(K69*2)+(O69/2)+(Q69/2)+(R69/2)+(N69/4)+(P69/4) -> 19.5 | D69: 2.0 | H69: 3.0 | K69: 2.0 | M69: 5.0 | O69: 5.0 | S69: 0.0 | T69: =0-QUOTIENT(S69, 5) -> 0 | U69: hands
A70: Lupine Claw Gauntlets | C70: =(I70*10)+M70+(D70*4)+G70+(L70/5)+(F70*2)+(E70*2)+(K70*2)+(O70/2)+(Q70/2)+(R70/2)+(N70/4)+(P70/4) -> 19 | D70: 4.0 | G70: 3.0 | H70: 3.0 | S70: 00.2 | T70: =0-QUOTIENT(S70, 5) -> 0 | U70: hands
A71: Grobb Oven Mittens | C71: =(I71*10)+M71+(D71*4)+G71+(L71/5)+(F71*2)+(E71*2)+(K71*2)+(O71/2)+(Q71/2)+(R71/2)+(N71/4)+(P71/4) -> 18.5 | D71: 4.0 | Q71: 5.0 | S71: 3.0 | T71: =0-QUOTIENT(S71, 5) -> 0 | U71: hands
A72: Impskin Gloves | C72: =(I72*10)+M72+(D72*4)+G72+(L72/5)+(F72*2)+(E72*2)+(K72*2)+(O72/2)+(Q72/2)+(R72/2)+(N72/4)+(P72/4) -> 18 | D72: 2.0 | J72: 5.0 | M72: 10.0 | S72: 1.5 | T72: =0-QUOTIENT(S72, 5) -> 0 | U72: hands
A73: Shiny Silk Gloves | C73: =(I73*10)+M73+(D73*4)+G73+(L73/5)+(F73*2)+(E73*2)+(K73*2)+(O73/2)+(Q73/2)+(R73/2)+(N73/4)+(P73/4) -> 17 | D73: 4.0 | L73: 5.0 | S73: 00.4 | T73: =0-QUOTIENT(S73, 5) -> 0 | U73: hands
A74: Ogre Butcher Gloves | C74: =(I74*10)+M74+(D74*4)+G74+(L74/5)+(F74*2)+(E74*2)+(K74*2)+(O74/2)+(Q74/2)+(R74/2)+(N74/4)+(P74/4) -> 16.5 | D74: 1.0 | N74: 25.0 | P74: 25.0 | S74: 1.9 | T74: =0-QUOTIENT(S74, 5) -> 0 | U74: hands
A75: Fungal Field Membrane Gauntlets | C75: =(I75*10)+M75+(D75*4)+G75+(L75/5)+(F75*2)+(E75*2)+(K75*2)+(O75/2)+(Q75/2)+(R75/2)+(N75/4)+(P75/4) -> 16 | D75: 4 | S75: 00.3 | U75: hand
A76: Leather Gloves | C76: =(I76*10)+M76+(D76*4)+G76+(L76/5)+(F76*2)+(E76*2)+(K76*2)+(O76/2)+(Q76/2)+(R76/2)+(N76/4)+(P76/4) -> 16 | D76: 4.0 | S76: 1.5 | T76: =0-QUOTIENT(S76, 5) -> 0 | U76: hands
A77: Mesh Gauntlets | C77: =(I77*10)+M77+(D77*4)+G77+(L77/5)+(F77*2)+(E77*2)+(K77*2)+(O77/2)+(Q77/2)+(R77/2)+(N77/4)+(P77/4) -> 16 | D77: 4.0 | S77: 00.3 | T77: =0-QUOTIENT(S77, 5) -> 0 | U77: hands
A78: Otterhide Gloves | C78: =(I78*10)+M78+(D78*4)+G78+(L78/5)+(F78*2)+(E78*2)+(K78*2)+(O78/2)+(Q78/2)+(R78/2)+(N78/4)+(P78/4) -> 16 | D78: 4.0 | H78: 3.0 | S78: 1.0 | T78: =0-QUOTIENT(S78, 5) -> 0 | U78: hands
A79: Raw-hide Gloves | C79: =(I79*10)+M79+(D79*4)+G79+(L79/5)+(F79*2)+(E79*2)+(K79*2)+(O79/2)+(Q79/2)+(R79/2)+(N79/4)+(P79/4) -> 16 | D79: 4.0 | S79: 2.2 | T79: =0-QUOTIENT(S79, 5) -> 0 | U79: hands
A80: Snakeskin Gloves | C80: =(I80*10)+M80+(D80*4)+G80+(L80/5)+(F80*2)+(E80*2)+(K80*2)+(O80/2)+(Q80/2)+(R80/2)+(N80/4)+(P80/4) -> 16 | D80: 4.0 | H80: 3.0 | S80: 1.5 | T80: =0-QUOTIENT(S80, 5) -> 0 | U80: hands
A81: Soft Wicker Gloves | C81: =(I81*10)+M81+(D81*4)+G81+(L81/5)+(F81*2)+(E81*2)+(K81*2)+(O81/2)+(Q81/2)+(R81/2)+(N81/4)+(P81/4) -> 16 | D81: 4.0 | S81: 2.2 | T81: =0-QUOTIENT(S81, 5) -> 0 | U81: hands
A82: Wolfskin Gloves | C82: =(I82*10)+M82+(D82*4)+G82+(L82/5)+(F82*2)+(E82*2)+(K82*2)+(O82/2)+(Q82/2)+(R82/2)+(N82/4)+(P82/4) -> 16 | D82: 4.0 | S82: 0.0 | T82: =0-QUOTIENT(S82, 5) -> 0 | U82: hands
A83: Scaled Wolf Hide Gloves | C83: =(I83*10)+M83+(D83*4)+G83+(L83/5)+(F83*2)+(E83*2)+(K83*2)+(O83/2)+(Q83/2)+(R83/2)+(N83/4)+(P83/4) -> 14 | D83: 3.0 | L83: 5.0 | N83: 2.0 | P83: 2.0 | S83: 1.0 | T83: =0-QUOTIENT(S83, 5) -> 0 | U83: hands
A84: Crystalline Silk Gloves | C84: =(I84*10)+M84+(D84*4)+G84+(L84/5)+(F84*2)+(E84*2)+(K84*2)+(O84/2)+(Q84/2)+(R84/2)+(N84/4)+(P84/4) -> 13 | D84: 3.0 | O84: 2.0 | S84: 00.1 | T84: =0-QUOTIENT(S84, 5) -> 0 | U84: hands
A85: Curscale Gloves | C85: =(I85*10)+M85+(D85*4)+G85+(L85/5)+(F85*2)+(E85*2)+(K85*2)+(O85/2)+(Q85/2)+(R85/2)+(N85/4)+(P85/4) -> 12.25 | D85: 3.0 | N85: 1.0 | S85: 00.4 | T85: =0-QUOTIENT(S85, 5) -> 0 | U85: hands
A86: Dingy Gloves | C86: =(I86*10)+M86+(D86*4)+G86+(L86/5)+(F86*2)+(E86*2)+(K86*2)+(O86/2)+(Q86/2)+(R86/2)+(N86/4)+(P86/4) -> 12 | D86: 3 | S86: 00.2 | U86: hand
A87: Leech Husk Gloves | C87: =(I87*10)+M87+(D87*4)+G87+(L87/5)+(F87*2)+(E87*2)+(K87*2)+(O87/2)+(Q87/2)+(R87/2)+(N87/4)+(P87/4) -> 12 | D87: 3.0 | S87: 1.5 | T87: =0-QUOTIENT(S87, 5) -> 0 | U87: hands
A88: Tattered Gloves | C88: =(I88*10)+M88+(D88*4)+G88+(L88/5)+(F88*2)+(E88*2)+(K88*2)+(O88/2)+(Q88/2)+(R88/2)+(N88/4)+(P88/4) -> 12 | D88: 3.0 | S88: 1.5 | T88: =0-QUOTIENT(S88, 5) -> 0 | U88: hands
A89: Tiger Hide Gloves | C89: =(I89*10)+M89+(D89*4)+G89+(L89/5)+(F89*2)+(E89*2)+(K89*2)+(O89/2)+(Q89/2)+(R89/2)+(N89/4)+(P89/4) -> 12 | D89: 2.0 | E89: 2.0 | H89: 2.0 | S89: 1.0 | T89: =0-QUOTIENT(S89, 5) -> 0 | U89: hands
A90: Woven Gloves | C90: =(I90*10)+M90+(D90*4)+G90+(L90/5)+(F90*2)+(E90*2)+(K90*2)+(O90/2)+(Q90/2)+(R90/2)+(N90/4)+(P90/4) -> 12 | D90: 3.0 | S90: 00.3 | T90: =0-QUOTIENT(S90, 5) -> 0 | U90: hands
A91: Powered Gloves | C91: =(I91*10)+M91+(D91*4)+G91+(L91/5)+(F91*2)+(E91*2)+(K91*2)+(O91/2)+(Q91/2)+(R91/2)+(N91/4)+(P91/4) -> 10 | D91: 0.0 | E91: 5.0 | S91: 00.1 | T91: =0-QUOTIENT(S91, 5) -> 0 | U91: hands
A92: Cloth Gloves | C92: =(I92*10)+M92+(D92*4)+G92+(L92/5)+(F92*2)+(E92*2)+(K92*2)+(O92/2)+(Q92/2)+(R92/2)+(N92/4)+(P92/4) -> 8 | D92: 2.0 | S92: 00.4 | T92: =0-QUOTIENT(S92, 5) -> 0 | U92: hands
A93: Dusty Burlap Gloves | C93: =(I93*10)+M93+(D93*4)+G93+(L93/5)+(F93*2)+(E93*2)+(K93*2)+(O93/2)+(Q93/2)+(R93/2)+(N93/4)+(P93/4) -> 8 | D93: 2.0 | S93: 00.4 | T93: =0-QUOTIENT(S93, 5) -> 0 | U93: hands
A94: Netted Gloves | C94: =(I94*10)+M94+(D94*4)+G94+(L94/5)+(F94*2)+(E94*2)+(K94*2)+(O94/2)+(Q94/2)+(R94/2)+(N94/4)+(P94/4) -> 8 | D94: 2.0 | S94: 00.3 | T94: =0-QUOTIENT(S94, 5) -> 0 | U94: hands
A95: Ratskin Gloves | C95: =(I95*10)+M95+(D95*4)+G95+(L95/5)+(F95*2)+(E95*2)+(K95*2)+(O95/2)+(Q95/2)+(R95/2)+(N95/4)+(P95/4) -> 2 | D95: 3.0 | K95: -5.0 | S95: 2.0 | T95: =0-QUOTIENT(S95, 5) -> 0 | U95: hands